Job Title,Company Name,Location,Salary Estimate,Rating,Job Description,Founded,Industry,Revenue,Sector,Size,Type,Easy Apply
"Lead Software Engineer, Data Engineering","S&P Global
","Tallahassee, FL",$85K - $170K (Employer est.),4.1,"The Role: Data Engineer
Location: Team is in Boston, but is available for remote or on-site throughout CST and EST Time zones
GL (for internal use only): 11

Panjiva is a data-driven technology company that uses machine learning to provide powerful search, analysis, and visualization of billions of shipping records from nearly every country in the world. More than 3,000 customers in over 100 countries, ranging from Fortune 500 companies and startups to government agencies and hedge funds, rely on our platform for supply chain intelligence. In global trade, better insight means better decision making and stronger connections between companies and governments across the globe.
Recognizing Panjiva’s cutting-edge technology, S&P Global acquired Panjiva in 2018. This acquisition has grown our resources, dramatically expanded our access to data, and accelerated our growth plans. People are Panjiva’s greatest strength – join our engineering team as we map out a key part of the world economy!
Job Description
As a data engineer on our team, you will play a key role in developing our next-generation data science infrastructure and underlying core technologies. You will work with Panjiva’s world-class data scientists, analysts, and engineers to create products that solve important real-world business problems in a collaborative, fast-paced, and fun environment.

You’ll work closely with our data science team to develop new platforms, infrastructure, and tools that will allow for machine learning applications at production scale over ever-growing datasets.
You’ll design and leverage distributed computing technologies, data schemas, and APIs to construct data science pipelines. In addition, you’ll be expected to participate in augmenting our infrastructure to seamlessly integrate new data sets through constant R&D of the technologies and systems we use.
Join us in building the next generation of products as we continue to deliver valuable and actionable insights to decision-makers in the $15 trillion global trade industry.

Responsibilities
Architect and implement distributed systems that perform complex transformations, processing, and analysis over very large scale datasets
Develop processes to monitor and automate detection of quality regressions in raw data or in the output of Panjiva’s machine learning models
Working with our data scientists to turn large-scale messy, diverse, and often unstructured data into a source of meaningful insights for our customers
Optimizing slow-running database queries and data pipelines
Helping enhance our search engine, capable of running sophisticated user queries quickly and efficiently
Building internal tools and backend services to enable our data scientists and product engineers to improve efficiency

Qualifications
B.S., M.S., or Ph.D. in Computer Science (or a related field) or equivalent work experience
7+ years of experience working with data-at-scale in a production environment
Experience designing and implementing large-scale, distributed systems
Experience in multi-threaded software development (or some form of parallelism)
Significant performance engineering experience (e.g., profiling slow code, understanding complicated query plans, etc.)
Solid understanding of core algorithms and data structures, including the ability to select (and apply) the optimal ones to computationally expensive operations over data-at-scale
Strong understanding of relational databases and proficiency with SQL
Deep knowledge of at least one scripting language (e.g., Python, Ruby, JavaScript)
Deep knowledge of at least one compiled language (e.g., Scala, C++, Java, Go)
Experience developing software on Linux-based operating systems
Experience with distributed version control systems
Nice-to-Haves
Familiarity with relational database internals (especially PostgreSQL)
Proficiency with cloud computing platforms, specifically AWS
Working knowledge of probability & statistics
Contributions to open-source software
Experience building customer-centric products

Compensation/Benefits Information (US Applicants Only):
S&P Global states that the anticipated base salary range for this position is $85,300 - $170,000 . Base salary ranges may vary by geographic location.
In addition to base compensation, this role is eligible for an annual incentive bonus plan.

This role is eligible to receive additional S&P Global benefits. For more information on the benefits we provide to our employees, visit https://www.spgbenefitessentials.com/newhires .
About S&P Global
S&P Global delivers essential intelligence that powers decision making. We provide the world’s leading organizations with the right data, connected technologies and expertise they need to move ahead. As part of our team, you’ll help solve complex challenges that equip businesses, governments and individuals with the knowledge to adapt to a changing economic landscape.

S&P Global Market Intelligence partners with customers to broaden their perspective and operate with confidence by bringing them leading data sources and technologies that embed insight in their daily work.
We pride ourselves on our agility and diversity, and we welcome requests to work flexibly. For most roles, flexible hours and/or an element of remote working are usually possible. Please talk to us at interview about the type of arrangement that is best for you. We will always try to be adaptable wherever we can.

-----------------------------------------------------------

Equal Opportunity Employer
S&P Global is an equal opportunity employer and all qualified candidates will receive consideration for employment without regard to race/ethnicity, color, religion, sex, sexual orientation, gender identity, national origin, age, disability, marital status, military veteran status, unemployment status, or any other status protected by law. Only electronic job submissions will be considered for employment.

If you need an accommodation during the application process due to a disability, please send an email to: EEO.Compliance@spglobal.com and your request will be forwarded to the appropriate person.

US Candidates Only: The EEO is the Law Poster http://www.dol.gov/ofccp/regs/compliance/posters/pdf/eeopost.pdf describes discrimination protections under federal law.

----------------------------------------------------------- 20 - Professional (EEO-2 Job Categories-United States of America), IFTECH202.2 - Middle Professional Tier II (EEO Job Group), SWP Priority – Ratings - (Strategic Workforce Planning)

Job ID: 277527
Posted On: 2023-09-21
Location: Cambridge, Massachusetts, United States",1860,Research & Development,$10+ billion (USD),Management & Consulting,10000+ Employees,Company - Public,False
Data Scientist / Engineer (TS/SCI),"Cyberhill Partners LLC
","Tampa, FL",$90K - $128K (Glassdoor est.),1.0,"Data Scientist / Data Engineer
TS/SCI
Tampa, FL
Cyberhill Intel
Cyberhill Intel is a premier software services provider focused on partnering with the world's most high-profile software businesses and organizations. We have built our business around a passion for leveraging leading edge software to solve the world's most difficult national security and intelligence problems. Our goal is to partner with world-class software companies from around the world and leverage our mission expertise to help deliver their software to the U.S. Government and its partners.
The Role
We are seeking Mission Driven Data Scientist to join our team supporting Research and Development efforts of the Department of Defense in the heart of Downtown Tampa, FL! You will be responsible for defining, building, implementing and maintaining predictive data models through their full Lifecyle. You will do this by continuously engaging with, and gaining expertise in, emerging industry technology to support our team and our customers.
As a Cyberhill Data Scientist, you will be expected to leverage everything at your disposal: core industry products, open-source technologies, and anything you and your team can build to drive real impact. In this role, you work with customers around the globe, where you gain rare insight into the world’s most important industries and institutions.
Required or Core Knowledge, Skills, and Experience:
5 Years of experience with owning and delivering data Science products
Demonstrated experience in the manipulation and exploitation of data.
Proficiency with major tools and languages such as Java, Python, Postgresql/SQL
Proficiency with regular expressions.
Familiarity with industry best-practices for software-hardware optimization when processing large datasets:


What We Value
Strong engineering background, preferably in fields such as Computer Science, Mathematics, Software Engineering, Physics.
Familiarity with data structures, storage systems, cloud infrastructure, front-end frameworks, and other technical tools, as well as an understanding of how technical decisions impact the user of what you’re building.
Proficiency with programming languages such as Java, C++, Python, JavaScript, or similar languages.
Ability to work effectively in teams of technical and non-technical individuals.
Skill and comfort working in a rapidly changing environment with dynamic objectives and iteration with users.
Demonstrated ability to continuously learn, work independently, and make decisions with minimal supervision.
(As required by U.S. Government contract) U.S. citizenship.
(As required by U.S. Government contract) Varied clearance level TS/SCI.",-1,-1,Unknown / Non-Applicable,-1,1 to 50 Employees,Company - Private,True
Data Link Test Engineer - Mid-Level - TGBC,"ERC
","Shalimar, FL",-1,3.6,"Overview:

Our data link test team is searching for new test engineer professionals that can help us design and execute test events. If you enjoy working in a fast-paced environment, learning new technology areas, this is the place for you. We provide a number of opportunities to learn ranging from on-the-job training with other team members to formal courses for unique technology areas.

We realize that no one will have all of these qualifications. We are looking for people that have experience with Link 16 and system testing. And have the drive and motivation to learn all other required areas.

This position provides support to the 96 Cyber Test Group, 46 Test Squadron, Data Link Test Flight at Eglin AFB as a member of an platform integration team responsible for planning, designing, and executing test events for tactical communications systems. This is NOT a telework or remote position; however, telework opportunities may be authorized as mission requirements allow.




LOCATION: Eglin AFB, FL

JOB STATUS: Full Time

TRAVEL: 25% CONUS / OCONUS TDYs


REQUIRED QUALIFICATIONS (Education, Certifications, Experience, Skills)

SECURITY CLEARANCE: Secret and be able to obtain and maintain a Top Secret clearance – US citizenship required

EDUCATION: BS Degree in a Computer Science, Computer Engineering, or a related technical field (i.e., CS, AE, ME, etc.)

CERTIFICATIONS: None

EXPERIENCE LEVEL: 3-10 years of applicable experience


OTHER QUALIFICATIONS/SKILLS:

US citizenship required
Active Top Secret clearance
Experience with tactical data link radios and terminals
Experience with computer network design concepts, configuration, and operation
Analytical skills and problem-solving skills
Excellent self-initiative and self-motivation with the ability to work under minimal supervision
Ability to work effectively in small and large team settings to solve complex problems
Capable of traveling to contractors' facilities, test sites, and other locations, both CONUS and OCONUS. Travel is on average is 25% of total time worked
Good organization, decision making, verbal and written communication skills
Proficiency in MS Office products to include Word, Excel and PowerPoint


PREFERRED SKILLS:

Relevant technical experience in the areas of software system and hardware integration testing
An understanding of DOD developmental test and evaluation processes
Knowledge of computer networking principles and configuration
Experience using interpreted languages (Python, Ruby, JavaScript, PHP, etc.)
Security+ certification


RESPONSIBILITIES:

Perform as a member of the Platform Integration Element test team
Interface directly with System Program Offices, users, test support organizations, and product development contractors
Plan, execute, and report on tests for Air Force advanced tactical communications programs to include Link 16, Situation Awareness Data Link (SADL) and emerging next generation tactical data links
Utilize Military Standards to evaluate system compliance
Proficient/familiar with various radios such as: MIDS-JTRS, SADL, PRC-117G, etc
Review customer requirements and participate in test planning meetings
Develop test plans and procedures, schedules, and execute tests within the constraints of customer requirements and produce timely test reports
Capable of performing as a team leader in directing and executing system testing
Author technical documents and briefings and conduct formal presentations
Travel to other locations as required to attend meetings and conduct tests


What we offer:

Competitive salaries
Continuing education assistance
Professional development allotment
Multiple healthcare benefits packages
401K with employer matching
Paid time off (PTO) along with a federally recognized holiday schedule


Who We Are

Oasis Systems is a premier provider of customer-driven, cost-effective, and quality Engineering Services; Enterprise Systems and Applications; Human Factors Engineering; Information Technology and Cyber Security; Professional Services; and Specialized Engineering Solutions to the Department of Defense, Federal Aviation Administration, Nuclear Regulatory Commission, and other Federal Agencies.


We strive to be an exciting and welcoming company that attracts, develops, motivates and retains the most talented, skilled and dedicated people in the industry; where they are encouraged to achieve personal excellence, purpose, and their full potential and career aspirations, while supporting mission-critical national security technologies and programs.


Oasis Systems is an Equal Employment Opportunity/Affirmative Action Employer. We provide equal employment opportunities to all employees and applicants for employment and prohibit discrimination and harassment of any type without regard to race, color, religion, age, sex, national origin, disability status, genetics, protected veteran status, sexual orientation, gender identity or expression, or any other characteristic protected by federal, state, or local laws.


This policy applies to all terms and conditions of employment, including recruiting, hiring, placement, promotion, termination, layoff, recall, transfer, leaves of absence, compensation, and training.
""Oasis Systems Cyber Division""
#CJ",1999,HR Consulting,$25 to $100 million (USD),Human Resources & Staffing,5001 to 10000 Employees,Company - Private,False
Mission Data Engineer - SE-4,"Oasis Systems LLC
","Shalimar, FL",$62K - $95K (Glassdoor est.),4.4,"Overview:
Oasis Systems has an exciting opportunity for SE-4 Mission Data Engineer in support of the 36th Electronic Warfare Squadron (EWS) 350th Spectrum Warfare Wing (SWW), located at Eglin AFB, FL. The 350 SWW is the technical focal point for all electronic warfare (EW) support of warfighter systems for the Combat Air Forces (CAF) fighter, bomber, airborne surveillance, and helicopter platforms.

LOCATION: Eglin AFB
JOB STATUS: Full-time
TRAVEL: 10%

REQUIRED QUALIFICATIONS A Bachelor’s or Master’s degree and 3-10 years of experience or equivalent work experience

SECURITY CLEARANCE: Active Secret Security Clearance Required & Fully Completed Application (US Citizenship Required)

EDUCATION: Master’s Degree in technical/engineering discipline
CERTIFICATIONS: N/A
EXPERIENCE LEVEL: 10+ years of experience or equivalent work experience


OTHER QUALIFICATIONS/SKILLS:

This position requires an active secret government security clearance for consideration
Candidates must have at least a Master’s degree in a technical/engineering discipline with at least 10 years of experience in an engineering capacity (A BS degree and additional years of experience may be substituted for MS degree)
Demonstrated ability to recognize and analyze problems, conduct research, summarize results, and make appropriate recommendations
Must have a working knowledge of computer systems and an understanding of Windows-based personal computers and Microsoft Office software and possess the ability to communicate effectively both orally and written


PREFFERED SKILLS:

Knowledge and skills with Electronic Warfare (EW) and the electromagnetic (EM) spectrum, computer software, threat warning, radio frequency (RF) jammers, electro-optical/infrared (EO/IR) jammers, expendables, threat analysis, foreign/US/radar/weapon systems, airborne EW computer software, avionics, systems integration, electronics engineering concepts, principles and practices applicable to a broad range of engineering assignments. Candidates must be analytical, methodical and detail oriented
Highly desire previous experience in RF integration, EM spectrum management, antenna design, and digital signal processing
Desire knowledge of EW weapons systems development, test and evaluation, and systems engineering


RESPONSIBILITIES:

Assist the 350th Spectrum Warfare Wing (350 SWW) at Eglin AFB, Florida, which is the technical focal point for all Electronic Warfare (EW) support of warfighter systems for the Combat Air Forces (CAF). The mission of the 350 SWW is to develop and test Mission Data (MD) to defeat enemy radar and infrared guided missile systems, thus enhancing aircrew and aircraft survivability in combat. This mission includes operational EW testing, MD development/validation/verification, force development evaluation execution and facilitating foreign materiel exploitation
Conduct appropriate EW research, MD development and MD testing. The successful candidate will support EW system programming/reprogramming, work with EW system engineers to coordinate programming/reprogramming requirements, prepare validation and verification test plans, and organize and participate in MD configuration control boards. The successful candidate will assist with the collection, recording, and post-test analysis of data generated during MD testing. The successful candidate may be required to travel


What we offer:

Competitive salaries
Continuing education assistance
Professional development allotment
Multiple healthcare benefits packages
401K with employer matching
Paid time off (PTO) along with a federally recognized holiday schedule


Who We Are

Oasis Systems is a premier provider of customer-driven, cost-effective, and quality Engineering Services; Enterprise Systems and Applications; Human Factors Engineering; Information Technology and Cyber Security; Professional Services; and Specialized Engineering Solutions to the Department of Defense, Federal Aviation Administration, Nuclear Regulatory Commission, and other Federal Agencies.


We strive to be an exciting and welcoming company that attracts, develops, motivates and retains the most talented, skilled and dedicated people in the industry; where they are encouraged to achieve personal excellence, purpose, and their full potential and career aspirations, while supporting mission-critical national security technologies and programs.


Oasis Systems is an Equal Employment Opportunity/Affirmative Action Employer. We provide equal employment opportunities to all employees and applicants for employment and prohibit discrimination and harassment of any type without regard to race, color, religion, age, sex, national origin, disability status, genetics, protected veteran status, sexual orientation, gender identity or expression, or any other characteristic protected by federal, state, or local laws.




This policy applies to all terms and conditions of employment, including recruiting, hiring, placement, promotion, termination, layoff, recall, transfer, leaves of absence, compensation, and training.


""Oasis Systems Cyber Division""",1997,Aerospace & Defense,$100 to $500 million (USD),Aerospace & Defense,1001 to 5000 Employees,Company - Private,False
Senior Data Engineer,"BambooHR
","Orlando, FL",$101K - $138K (Glassdoor est.),3.8,"About Us

Our mission is simple: we want to set people free to do meaningful work. People love our software—and it turns out that people love working here too. We've been recognized as a ""Best Company to Work For"" and we're proud of our team for creating software that makes an impact in the lives of HR pros and employees all over the world.

What You'll Do

As a Senior Data Engineer on the data platform team, we'll rely on your expertise across multiple disciplines to develop, deploy and support data systems, data pipelines, data lakes, and lakehouses. Your ability to automate, performance tune, and scale the data platform will be key to your success.

Your initial areas of focus will include:

Collaborate with stakeholders to make effective use of core data assets
With Spark and Pyspark libraries, load both streaming and batched data
Engineer lakehouse models to support defined data patterns and use cases
Leverage a combination of tools, engines, libraries, and code to build scalable data pipelines
Work within an IT managed AWS account and VPC to stand up and maintain data platform development, staging, and production environments
Documentation of data pipelines, cloud infrastructure, and standard operating procedures
Express data platform cloud infrastructure, services, and configuration as code
Automate load, scaling, and performance testing of data platform pipelines and infrastructure
Monitor, operate, and optimize data pipelines and distributed applications
Help ensure appropriate data privacy and security
Automate continuous upgrades and testing of data platform infrastructure and services
Build data pipeline unit, integration, quality, and performance tests
Participate in peer code reviews, code approvals, and pull requests
Identify, recommend, and implement opportunities for improvement in efficiency, resilience, scale, security, and performance



What You Need to Get the Job Done (if you don't have all, apply anyway!)

Experience developing, scaling, and tuning data pipelines in Spark with PySpark
Understanding of data lake, lakehouse, and data warehouse systems, and related technologies
Knowledge and understanding of data formats, data patterns, models, and methodologies
Experience storing data objects in hadoop or hadoop like environments such as S3
Demonstrated ability to deploy, configure, secure, performance tune, and scale EMR and Spark
Experience working with streaming technologies such as Kafka and Kinesis
Experience with the administration, configuration, performance tuning, and security of database engines like Snowflake, Databricks, Redshift, Vertica, or Greenplum
Ability to work with cloud infrastructure including resource scaling, S3, RDS, IAM, security groups, AMIs, cloudwatch, cloudtrail, and secrets manager
Understanding of security around cloud infrastructure and data systems
Git-based team coding workflows



Bonus Skills (Not Required, So Apply Anyway!)

Experience deploying and implementing lakehouse technologies such as Hudi, Iceberg, and Delta
Experience with Flink, Presto, Dremio, Databricks, or Kubernetes
Experience with expressing infrastructure as code leveraging tools like Terraform
Experience and understanding of a zero trust security framework
Experience developing CI/CD pipelines for automated testing and code deployment
Experience with QA and test automation
Exposure to visualization tools like Tableau



Beyond the technical skills, we're looking for individuals who are:

Clear communicators with team members and stakeholders
Analytical and perceptive of patterns
Creative in coding
Detail-oriented and persistent
Productive in a dynamic setting

If you love to learn, you'll be in good company. You'll likely have a Bachelor's degree in computer science, information systems, or equivalent working experience.




An Equal Opportunity Employer-M/F/D/V
Because our team members are trusted to handle sensitive information, we require all candidates that receive and accept employment offers to complete a background check before being hired.

For information on our Privacy Policy, click here.",2008,Enterprise Software & Network Solutions,Unknown / Non-Applicable,Information Technology,1001 to 5000 Employees,Company - Private,True
