Job Title,Company Name,Location,Salary Estimate,Rating,Job Description,Founded,Industry,Revenue,Sector,Size,Type,Easy Apply
Data Engineer,"Airlines Reporting Corporation
","Tampa, FL",$76K - $110K (Glassdoor est.),3.7,"About The Role::
It's a great time to join us at Airlines Reporting Corporation (ARC)! ARC accelerates the growth of global air travel by delivering forward-looking travel data, flexible distribution services and other innovative industry solutions. We are a leading travel intelligence company with the world’s largest, most comprehensive global airline ticket dataset, including more than 15 billion passenger flights. By working here, you can contribute to solutions and expertise that strengthen economies and enrich lives. We think big, embrace challenges and explore new ideas to lead the way for the travel industry.

ARC is looking for a Data Engineer to join our team! As a Data Engineer you will provide product teams’ software development and product delivery support for data products. Additionally, you will be responsible for product delivery data pipelines and product lifecycle with direction from the Product Owner, the Solution Owner and technical guidance from Solution Architects.
What You'll Get to Do::
Support data pipeline development by contributing to and or leveraging existing architectural patterns to deliver the optimal product related to data; including but not limited to establishing and communicating design patterns, automation, recovery, and operational run books. Mentor other engineers. Cross functional collaboration and provide overall technical and thought leadership to other teams as needed.
Partner with product owners and business SMEs to analyze the business need and provide a supportable and sustainable engineered solution. Ensure that the overall technical solution is aligned with the business needs and aheres to ARC’s Architectural Guiding Principals.
Help drive the creation and modifications of the product portfolio components, identify and engage all technical resources necessary to contribute to the solution. Ensure the solution is consistent with ARC architecture, design and development standards.
Develop datapipe lines using industry best practices. Make adjustments to adopt new methodologies that provide the business with increased flexibility and agility.
Stay current with latest cloud technologies, patterns, and methodologies; share knowledge by clearly articulating results and ideas to key stakeholders. Maybe required to present ideas to larger audience for review and buy-in.
You'll Bring These Qualifications::
Bachelor’s Degree in Computer Science or related field; or equivalent experience
3+ years of experience with full cycle application development (Full SDLC experience: design, development, delivery, etc.),
3+ years with Agile, Scrum, DevOps, and Continuous Integration and Continuous Delivery
3+ years of experience implementing modern applications using:
Cloud Based Solutions/Technologies (AWS, Google, Azure). AWS tech stack including, but not limited to, Lambda, API Gateway, DynamoDB, S3, Cloudwatch, SNS/SQS, Step Functions, Fargate
Implementation of modern application and infrastructure design patterns, including micro-services and containers, disposable, reactive, stateless and distributed patterns
Open source technologies including, but not limited to, NodeJS, OpenJDK, React, Python and NoSQL, DynamoDB database(s)
Familiarity with DevOps tools including, but not limited to, Terraform/Cloud formation, CI/CD pipe line tool like Jenkins, GIT, Jira, Confluence, Jenkins, Sonar, Nexus, automated test and deployment tools
Data warehouse platforms (such as Snowflake, and Redshift). Expertise with SQL, database design/structures, ETL/ELT design patterns, and datamart structures (star, snowflake schemas, etc.)
Experience w/Data Lake concepts and design patters (AWS S3, parquet, python, lambda, java, NoSQL
BI Technologies (such as Tableau, Jasper, Cognos, Qlik, Looker, and others)
Understanding of Data Management and Data governance best practices
Proven ability to lead a group through an architectural development process and collaborate with stakeholders at all levels
Experience leading small technical teams to mentor and guide multiple-disciplined (full stack) technical teams
Ability to discover and define functional requirements and to transform them into technical requirements and solutions
Ability to influence technology strategy and best practices across peer and leadership groups to support an agile development culture
Outstanding communication skills (verbal and written) and ability to communicate with internal and external customers and all levels of management, including communicating technical information to nontechnical audiences
A strong intellectual curiosity to continually challenge what exists and explore what should be changed to best meet evolving business and market
A strong passion to support peers to help meet timelines on larger projects
What We Can Offer You::
Joining ARC means joining a team that is motivated, diverse, creative, collaborative and solutions-oriented. We think big, embrace challenges, and explore new ideas to lead the way for the travel industry.
Our employees value the hands-on learning and professional development opportunities that allow them to expand their skills and grow their career in new, dynamic ways.
ARC offers WorkFlex. WorkFlex is ARC’s new work model, allowing employees in eligible roles to work virtually without set days in the office. ARC employees can work from the office, at home, or any combination of the two. There will be times when it is important to gather in-person and WorkFlex employees will be expected to come into the office or another location, when needed.
We offer a highly competitive, comprehensive benefits package so you can worry less and focus on what truly matters.
By joining ARC, you will partner with top minds in the industry as we use data and technology to innovate how the world travels.
EOE M/F/D/V Females and Minorities Encouraged to Apply",1984,Financial Transaction Processing,$100 to $500 million (USD),Financial Services,201 to 500 Employees,Company - Private,False
Data Engineer,"LTIMindtree
","Tampa, FL",$45K - $121K (Employer est.),3.5,"LTIMindtree is a global technology consulting and digital solutions company that enables enterprises across industries to reimagine business models, accelerate innovation, and maximize growth by harnessing digital technologies. As a digital transformation partner to more than 750 clients, LTIMindtree brings extensive domain and technology expertise to help drive superior competitive differentiation, customer experiences, and business outcomes in a converging world. Powered by nearly 90,000 talented and entrepreneurial professionals across more than 30 countries, LTIMindtree — a Larsen & Toubro Group company — combines the industry-acclaimed strengths of erstwhile Larsen and Toubro Infotech and Mindtree in solving the most complex business challenges and delivering transformation at scale. For more information, please visit ;/p>

Since we are actively recruiting for multiple Data Engineering roles, would request to please circulate this note to among your groups for better reach and help referring to you colleagues.

Send your Resume to mandhagolla.chakradhar@ltimindtree.com

Position: Data Engineering roles

Position: Data Engineer with 9-10 years of experience

Location: Tampa,FL

Job Description:

We are seeking an experienced Data Engineer to join our team and help us build a secure and reliable data platform. The ideal candidate should have 9-10 years of experience in developing data pipelines, ETL processes, and data structures in Hadoop, Apache Spark, SQL, and Java.

The successful candidate will have a strong understanding of the data engineering pipeline, from ingestion to transformation, and be able to develop efficient and secure software solutions to support data-driven applications. The ideal candidate should have experience with design and implementation of data models, as well as performance tuning of data flows and services.

Responsibilities:

Design and develop data models and ETL processes in Hadoop, Apache Spark, SQL, and Java.
Design and implement data pipelines for data ingestion and transformation.
Develop and maintain data warehouses and data marts.
Develop data-driven applications to support data analysis and reporting.
Monitor and optimize data flows and services for maximum efficiency.
Troubleshoot data-related issues and provide technical support.
Ensure data quality and security standards are met.
Develop and document best practices for data engineering and data governance.
Work collaboratively with data scientists, analysts, and other stakeholders.

Requirements:

Bachelor's Degree in Computer Science, Mathematics, or a related field.
9-10 years of experience in developing data pipelines and ETL processes.
Strong understanding of data engineering pipeline (ingestion to transformation).
Experience with Hadoop, Apache Spark, SQL, and Java.
Experience with data modeling and data warehousing.
Experience with performance tuning of data flows and services.
Familiarity with data security and data governance best practices.
Ability to work independently and collaboratively with a team.
Excellent verbal and written communication skills.

Job Type: Full-time

Salary: $45,099.17 - $120,683.06 per year

Benefits:

Health insurance

Experience level:

8 years

Ability to commute/relocate:

Tampa, FL 33602: Reliably commute or planning to relocate before starting work (Required)

Experience:

Informatica: 1 year (Preferred)
SQL: 1 year (Preferred)
Data warehouse: 1 year (Preferred)

Work Location: In person",1997,Information Technology Support Services,$1 to $5 billion (USD),Information Technology,10000+ Employees,Company - Public,True
"SR Data Engineer (DBT, Data Modeling, ETL)","Rotech Healthcare Inc.
","Orlando, FL",,2.5,"About Rotech

Rotech Healthcare Inc. is a national leader in providing ventilators, oxygen, sleep apnea treatment, wound care solutions, diabetic solutions and home medical equipment. We help patients lead a more comfortable and productive life by keeping them engaged in their care and empowering them to manage their health and treatment at home. Rotech provides high quality medical products, services and outstanding customer care through hundreds of locations across 45 states. For additional information, visit our company homepage Rotech.com

Overview and Responsibilities

Job Summary
We are seeking a dedicated Senior Data Engineer to join our data engineering team to build and maintain scalable and reliable data engineering solutions that support our enterprise data warehouse and business analytics. In this position, you will be responsible for designing, developing and deploying data pipelines, workflows and data models. This position requires an in depth knowledge of dbt, Snowflake, Data Modeling, CI/CD, and DevOps. This position will also collaborate with other data engineers, architects, analysts, and stakeholders to ensure business requirements, data quality, security, and governance.

Essential Job Duties and Responsibilities
(Reasonable accommodations may be made to enable individuals with disabilities to perform these essential functions. Please note this job description is not designed to cover or contain a comprehensive listing of activities, duties or responsibilities that are required of the employee for this job. Duties, responsibilities and activities may change at any time with or without notice.)

Design, develop and deploy data pipelines and workflows using dbt and Snowflake to ingest, transform, and deliver data from various sources to snowflake based enterprise data warehouse. This includes but not limited to writing SQL queries, macros, tests, source to target mappings, and documentation.
Expert level knowledge of optimizing performance of ETL/ELT, building & executing tests, maintaining versions/repository, and documenting the workflows
Apply data ops, CI/CD, DevOps principles and practices to automate and streamline data processes and ensure continuous delivery and integration of data solutions
Cross-collaborate with business stakeholders, reporting team and solution architects to lay out a robust design, data architecture and data models for data warehouse that support business intelligence solutions
Hands on experience delivering cloud data integration projects preferably with AWS
Document and communicate data solutions, standards, best practices, and guidelines to ensure consistency and alignment across the data engineering team and the organization
Deliver and manage projects using Agile/SCRUM/KANBAN methodologies
Mentor and coach junior data engineers and provide technical guidance and feedback
Monitor and troubleshoot data issues and incidents and provide root cause analysis and resolution
Research and evaluate new technologies and trends in the data domain and propose improvements and innovations
Performs other duties as assigned

Qualifications

Employment is contingent on

Background investigation (company-wide)
Drug screen ( when applicable for the position )
Valid driver's license in state of residence with a clean driving record (when applicable for the position)
Required Education and/or Experience

Bachelor's degree in computer science, engineering or related field is preferred
10+ years of experience in data engineering or related roles with experience with at least two data engineering and/or ETL/ELT tools
Proficient in dbt design, development and deployment, including writing SQL queries, macros, tests, sources, etc.
Knowledge of Snowflake cloud data platform, architecture, features and capabilities
Familiarity with modern modeling techniques like lake house, data vault as well as traditional concepts such as star schema, snowflake schema, dimensional modeling, facts and dimensions
Experience working in data engineering team in cloud environment preferable AWS
Skilled in data ops, CI/CD, DevOps tools and methodologies, such as Git, Azure DevOps, Jenkins etc.
Strong understanding of data quality, security, and governance principles and frameworks
Experience delivering and managing projects using Agile/SCRUM/KANBAN methodologies
Skills and Competencies

Effectively communicate in English; both oral and written
Interpret a variety of communications (verbal, non-verbal, written, listening and visual)
Maintain confidentiality, discretion and caution when handling sensitive information
Multi-task along with attention to detail
Self-motivation, organized, time-management and deductive problem solving skills
Work independently and as part of a team
Machines, Equipment and Technical Abilities

Email transmission and communication
Internet navigation and research
Microsoft applications; Outlook, Word and Excel
Office equipment; fax machine, copier, printer, phone and computer and/or tablet
Physical Demands

Lift and carry office equipment at times
Requires sitting, walking, standing, talking and listening
Requires close vision to small print on computer and/or tablet and paperwork

Rotech Information

Benefits

401k
Medical, Dental and Vision
Life Insurance and Disability
Generous Paid Time Off and Paid Holidays
Bonus and Incentive Opportunities
Mileage reimbursement (when applicable for the position)
Telephone reimbursement (when applicable for the position)
Make the Right Move and Submit your Resume Today! The hiring manager reviews resumes and contacts applicants that have related experience to the applied position. To view the status of a position that you submitted your profile to, Sign into your account . We appreciate your interest in Rotech Healthcare Inc.

Equal Opportunity Employer of Minorities, Females, Protected Veterans and Individuals with Disabilities. Rotech Healthcare Inc. recruits, employs, trains, promotes, transfers, separates from employment and compensates employees without regard to membership in, association with, or perception of race, color, age, gender, gender identity, religion, creed, national origin, ancestry, citizenship, marital status, veteran status, sexual orientation, physical or mental disability, pregnancy or any other personal characteristic protected by applicable federal, state and local laws governing nondiscrimination in employment in each locality where Rotech has employees.",2002,Health Care Services & Hospitals,$100 to $500 million (USD),Healthcare,1001 to 5000 Employees,Company - Private,False
Senior Data Engineer,PMSA Group,Florida,$130K - $140K (Employer est.),-1.0,"PMSA Group is currently searching for a qualified Data Programmers / Data Engineers for CONTINGENT POSITIONs in support of the USCENTCOM Director, Resources and Analysis, J8. The CCJ8 requires a Data Engineer to assist in identifiying, developing, and documenting new data requirements and management techniques in support of a newly formed team responsible to integrate data and artificial intelligence capabilities into USCENTCOM functions.

Responsibilities:

Data engineers assist analysts and decision makers in solving complex problems through the preparation of data for analytic applications to include, but not limited to inferential analysis, exploratory analysis, comparative analysis, and research. Design, develop, and manage data intake, storage, and processing through appropriate data pipelines and processes. Support and enable the design, development, and application of a variety of operations research and data science principles and techniques to include data analysis, decision support analytics, probability models, statistical inference, simulations, and optimization and economic models. Facilitate quantitative and qualitative analysis for a broad range of complex military problems. Support the development of information displays, data pipelines, data repositories, decision briefings, analytical papers, and facilitate senior leader discussions.

Major functions:

· Assist the Resources and Analysis Directorate in the development and documentation of detailed data requirements for application systems in a logical data model

· Develop the analysis, creation, acquisition, maintenance, and use characteristics of the data identified

· Ensure compliance with data management policies, guidance, and standards

· Evaluate data reuse, data integration, and data compliance and develop strategies based on stewardship and authorities

· Develop physical schemas that address functional and technical requirements for the database including data sharing as appropriate

· Develop, construct, test, and maintain data architectures

· Develop information displays, decision briefings, analytical papers, and facilitate senior leader discussions

· Some travel may be required

Required Qualifications and Experience

· Must have a DoD Top Secret (TS) clearance and Sensitive Compartmented Information (SCI); also, must have a current DoD approved Single Scope Background Investigation (SSBI/Tier 5) having at least one year of eligibility remaining before required renewal of their background investigation.

· B.S. Data Science, Data Engineering, or Applied Mathematics

· 10 years of experience supporting DoD at CCMD or similar level

· 5 years of experience in application development

· 5 years of experience designing, developing, operationalizing, and maintaining complex data applications at enterprise scale

· 3 years of experience creating software for retrieving, parsing, and processing structured and unstructured data

· 3 years of experience building scalable ETL/ELT workflows for reporting and analytics

· Experience with Python, SQL, Scala, or Java

· Experience creating solutions within a collaborative, cross-functional team environment

· Ability to develop scripts and programs for converting various types of data into usable formats and support project team to scale, monitor and operate data platforms

Additional Desired Qualifications and Experience

· M.A. or M.S. degree in OR, Data Science, Data Engineering, or Applied Mathematics preferred

· Experience with UNIX/Linux, including basic commands and Shell scripting

· Experience with a public cloud, including AWS, Microsoft Azure, or Google Cloud

· Experience with distributed data and computing tools including Spark, Databricks, Hadoop, Hive, AWS EMR, or Kafka

· Experience working on real-time data and streaming applications

· Experience with NoSQL implementation, including MongoDB or Cassandra

· Experience with data warehousing using AWS Redshift, MySQL, or Snowflake

· Experience with Agile engineering practices

· Experience with preparing and presenting senior leadership briefings and papers a plus

· Excellent oral and written communication skills a plus

BuzzDoc LLC dba Performance Management Simulation and Analysis (PMSA) Group Overview:

PMSA Group is a small business focused on providing superior system and data analysis services to government and commercial clients. Join the growing PMSA Group family and let your career growth meet your expectations. We are a team of ORSAs, Data/Database Management, and Software Engineering professionals that reward employees through competitive salary, benefits, and profit sharing. BuzzDoc LLC was founded in 2011 by Bruce C. Shultes, PhD in Danville, CA. For additional information see our website at buzzdocllc.com

Job Type: Full-time

Pay: $130,000.00 - $140,000.00 per year

Benefits:

401(k)
Dental insurance
Flexible schedule
Health insurance
Paid time off
Vision insurance

Compensation package:

Bonus opportunities

Experience level:

9 years

Schedule:

8 hour shift

Experience:

Data Engineering: 5 years (Required)
Data warehouse: 3 years (Preferred)
Application Development: 5 years (Required)

Security clearance:

Top Secret (Required)

Work Location: In person",-1,-1,-1,-1,-1,-1,True
