Job Title,Company Name,Location,Salary Estimate,Rating,Job Description,Founded,Industry,Revenue,Sector,Size,Type,Easy Apply
Data Platform Engineer Lead,"Bremer Bank
","Lake Elmo, MN",$96K - $138K (Glassdoor est.),3.8,"Why Work at Bremer?



Are we a bank? Absolutely. But when it comes to careers, you'll find that there's a lot more to our business than you might expect. We’re passionate about helping customers throughout Minnesota, Wisconsin and North Dakota succeed and grow. Our commitment to authentic and enduring relationships starts by taking time to listen and learn about our customers’ goals, and innovate to solve their challenges, not only through financial resources but also deep knowledge, insights and ideas.

We expect, encourage and reward entrepreneurial thinking from our employees. We have a shared purpose of cultivating thriving communities, inspired by our founder, Otto Bremer, who spent his lifetime supporting the communities that his banks served in new and unexpected ways. That commitment to community and creative problem-solving contributes to Bremer’s culture.

If you want the next chapter in your story to be one where you make a real difference for our customers, communities and economies, we’re the bank to join. We foster diversity, equity and inclusion, building on the legacy of our immigrant founder. If you’re curious, enjoy collaborating, and start each day with the customer in mind, we invite you to join our team!

Job Description



Are you passionate about solving complex data challenges using cutting-edge technologies? Do you love working with technology in a fast-paced, dynamic environment where you contribute to innovative solutions? If so, we want you to join our team as a Data Engineer Lead!


You should have strong leadership and communication skills. You must be able to collaborate with other teams, effectively manage projects, and communicate technical information to non-technical stakeholders.

The Data Engineer Lead will develop and maintain data integration processes to ensure complete, accurate and timely data to the company. This position is part of the Data Services team enabling Data-as-a-Service support based on varying levels of Data Service Level Agreements. The Data engineer Lead will be part of a dynamic team adopting modern data architecture to improve the data management processes and workflows as well as data presentation capabilities. The Data engineer Lead will develop and maintain processes to support data feeds and batch data integrations needs across the company. They provide support to the Analytics, Data Warehouse, Business Intelligence and Cloud Engineering teams as well as several business applications with high priority data needs.




The ideal candidate will have extensive experience building data pipelines, extensive experience data wrangling and is someone who enjoys building and optimizing data systems. They must be self-directed and comfortable leveraging modern data architectures to support the data needs of multiple teams, systems, and products.

The ideal candidate will have a B.S. degree in Computer Science / Engineering with a minimum of 10 years of experience or High school diploma or GED and 13 years of experience with data management platforms, data warehousing technologies, business intelligence technologies, advanced analytics technologies, reporting tools, and experience with one or more ETL tools. They must demonstrate knowledge of data warehouse design, source to target specifications, prototyping data sets, process analysis, and critical thinking skills. Excellent communication skills and the ability to communicate in a clear and concise manner.


The position requires performing in depth ad-hoc data analysis and the ability to organize, integrate, and analyze large amounts of data both for operational support as well as for quality assurance and solution design purposes. This position requires the ability to work in a collaborative environment, follow pre-defined patterns and know when exceptions need to be made, the ability to follow, define, communicate, and improve development patterns. Understanding of “impact analysis” and how to properly identify potential consequences of a change.




Experience:

Strong expertise Microsoft SQL Server and TSQL
Strong expertise Microsoft SQL Server Integration Services
Experience with extract-transform-load (ETL) Tools like Informatica or Wherescape Red
Experience working with and supporting Data Virtualization and Data Visualization tools.
Knowledge of NoSQL technologies such as Elastic Search or Cassandra.
Experience working with large and complex data sets with multi-terabyte scale.
Knowledge of Agile and DataOps



Bremer Values & Benefits



Our Values

Collaboration: We work elbow-to-elbow with our customers, making a difference for them in good times and bad. We share our skills, knowledge and experience to support each other every day.

Commitment: We’re deeply invested in the places we live and work, and we’re always ready to do whatever it takes to help our neighbors and communities thrive and grow.

Creativity: Imagination and innovation are essential to helping our customers and Bremer succeed. If there’s a better way to do something, we’ll find it or create it.


Our Benefits

At Bremer, we are committed to supporting and growing the communities we call home. Our people understand that they represent our name and reputation in every conversation, and that they’re backed by an organization that values finding a better way to get things done. Let’s talk about benefits. Not just the 401(k), pension plan, healthcare, and vacation kind (we’ve got those), but the kind of everyday benefits that get you excited for what each day holds.

Equal Employment Opportunity



Bremer Bank is committed to a diverse and inclusive workforce. We’ve built an organization of experienced, intelligent and collaborative people from a range of all backgrounds, and all of them contribute something essential to helping our customers thrive and grow.

All qualified applicants will receive consideration for employment without regard to sex, gender identity, sexual orientation, race, color, religion, national origin, disability, protected Veteran status, age, or any other characteristic protected by applicable law.

For your reference, here are additional details for your awareness:
Know Your Rights: Workplace Discrimination is Illegal (dol.gov)
Family and Medical Leave Act (dol.gov)
Employee Polygraph Protection Act rights (dol.gov)

Miscellaneous Items to Note

Must be legally authorized to work in the U.S. without Bremer sponsorship for employment visa status (e.g., H1B status, 0-1, TN, EB-2)
Notice to California Applicants - for your awareness, please see Bremer Bank California Notice at Collection and Privacy Policy
Accessibility Commitment - Bremer is committed to accessibility, diversity and inclusion for all our applicants. We believe everyone should be able to have equal and effective access to our websites and our services. We have worked very hard to ensure that our website and digital content meet the needs of our applicants and visitors. Click here for more information on our accessibility and how to get in touch with us.
Notice to Third Party Recruiters - Bremer Bank, National Association, including its affiliates, does not accept unsolicited resumes from recruiters or employment agencies. In the absence of a signed agreement for recruiting or placement services, Bremer will have no obligation and will not agree to pay any referral or recruiting fee. In the event a recruiter or agency submits a candidate for consideration, Bremer explicitly reserves the right to pursue and/or hire any such candidate(s) without any financial or other obligation to the recruiter or agency. Any unsolicited resumes, including those submitted to hiring managers, will be deemed to be the property of Bremer.",1943,Banking & Lending,$10+ billion (USD),Financial Services,1001 to 5000 Employees,Company - Private,False
Data and Development Engineer,"Bold Orange
","Minneapolis, MN",$62K - $93K (Glassdoor est.),4.4,"Role Location: Greater Minneapolis/St. Paul area (partial in-office requirement)
Bold Orange is a customer experience company. We believe authentic human connections are the single most important driver of business and societal progress. We exist to create these connections across the customer lifecycle, from acquisition to engagement to retention. Our culture is one of curiosity, collaboration, proactivity and always bringing the outside perspective to our customers.
Position Summary:
Bold Orange is seeking a Data and Development Engineer with a passion for developing technical solutions related to various aspects of data lineage. This person will design and execute data acquisition, process automation, and support analytics & insights data service capabilities by managing large behavioral datasets.
The ideal candidate will blend software development experience with a data architect’s mindset to enable data analytics, support web development projects and help create technical connections across customer experiences. Ideally, logical, organized, pragmatic, and methodical to their core. To be successful they will collaborate closely with technology services, analytics, our emerging SFMC practice, and other cross-functional partners to accelerate data collection, transformation, and automation of processes that require behavioral marketing and digital analytics data.
Position Duties and Responsibilities:
Design, develop, and execute technical solutions to automate data processes and increase the efficiency of analytic deliverables
Support data acquisition efforts from digital execution platforms both ad-hoc in nature, as well as at a system level where feasible.
Develop data and analytic views to support capabilities around modeling, analysis, testing & optimization, and insight development
Collaborate on data acquisition and data transformation needs for analytics, personalization, and customer data platforms
Understand, monitor, and enhance data flow(s) to enable reporting and insights development, including tracking data quality
Articulate requirements and present solutions to less-technical stakeholders
Maintain knowledge of technical changes impacting data availability, new technologies and tools, privacy practices, and relevant tools
Work with front-end web developers to create and support back-end web solutions
Develop, maintain, and deploy new and existing REST API’s
Continuously inform business partners of work in process and potential roadblocks to timelines
Required Qualifications & Experience:
3+ years of professional experience in data engineering, data management, data development, software development or related field
Bachelor’s degree in computer science, or related discipline
Advanced proficiency with MSSQL, Amazon Redshift, and MongoDB
Demonstrated expertise/applied knowledge of C#, Python, and PowerShell
Experience consuming and developing REST API’s and related software interfaces
Demonstrated experience with back-end web development, data architecture, structured and unstructured data management, and data transformation
Experience with Visual Studio, C#, PHP scripting, general development patterns, and related frameworks
Ability to thrive in a highly collaborative, fast-paced environment where the nature of the work can be variable
Innately curious and happy to dig in whenever called upon
Who We Are:
Our tone is professionally sassy. We embrace meat raffles, hot seats, and the occasional Jell-O shot. We like staff meetings that are informative, educational, and at times, damn funny. We believe in no hierarchy, no bullshit, and no politics. Just honest, hard work, and great fun.

Equal Opportunity Employer:
We are an equal opportunity employer, dedicated to a policy of nondiscrimination in employment on any basis including race, color, creed, gender, sexual orientation, age, disability, religion, national origin, marital status, familial status, ancestry, status as a veteran, status with regard to public assistance and any other characteristic protected by law. Bold Orange does not and will not discriminate against employees, prospective employees, clients, or vendors.",2018,Advertising & Public Relations,Unknown / Non-Applicable,Media & Communication,51 to 200 Employees,Company - Private,False
"AWS Data Engineer ( Hybrid at Eagan, Minnesota)","Cognizant Technology Solutions
","Eagan, MN",$72K - $103K (Glassdoor est.),3.8,"We are Cognizant Artificial Intelligence

Digital technologies, including analytics and AI, give companies a once-in-a-generation opportunity to perform orders of magnitude better than ever before. However, clients need new business models built from analyzing customers and business operations at every angle to really understand them.

With the power to apply artificial intelligence and data science to business decisions via enterprise data management solutions, we help leading companies prototype, refine, validate, and scale the most desirable products and delivery models to enterprise scale within weeks.




*You must be legally authorized to work in United States without the need of employer sponsorship, now or at any time in the future *




AWS Data Engineer (Hybrid at Eagan , Minnesota)




2 to 4 years




Technical Skills

AWS
SQL
ETL



Nice to have skills.




AWS Glue



Job Summary

Strong Healthcare experience with Data Model and ETL experience
Experience with a variety of AWS Cloud platform services that include but not limited to: Lambda NodeJS Dynamo DB SNS SQS RDS S3 CloudWatch and API Gateway
Experience with developing Microservices and building APIs
Strong experience in Java Scala and at least one JavaScript framework like Angular.js or Node.js React.js Vue.js or Ember.js
Responsible for building data solutions on the AWS cloud technology



Roles/Responsibilities:

ETL experience
Cloud native database experience – RDS Redshift DynamoDB
Knowledge of the health care/health insurance industry is a plus
Big Data and NoSQL experience
Automation experience
Experience driving and developing medium complex data integration solutions using two or more of data management software tools.
Experienced knowledge in data analysis using SQL user story development data warehouse design and modeling (3rd normal form or dimensional modeling) data integration design and development and/or performance tuning Teradata SQL.
Knowledgeable in data warehouse market best practices development standards and methodologies.
Demonstrated ability and willingness to play multiple roles for different projects e.g. planning/architecting and overseeing development for some projects being a hands-on technical resource for others.
Not only leading and working on strategic and tactical projects but also understand the importance of details and remaining hands-on to data applications/solution business enablement.
Experienced in work estimation design review and code review.
Strong skills in cross team coordination for project execution and issue resolution as well as working with contracting vendor onsite and offshore.
Demonstrated oral/written communication and presentation skills to effectively communicate medium complexity technical information.
Demonstrated ability to influence motivate and lead teams with diverse cultural and professional background.
Experience in mentoring and coaching junior developers in problem solving and critical thinking efforts.



Primary Location

Eagan, Minnesota, Hybrid 2 days per week.




Salary and Other Compensation:

The annual salary for this position is depending on experience and other qualifications of the successful candidate.

This position is also eligible for Cognizant’s discretionary annual incentive program, based on performance and subject to the terms of Cognizant’s applicable plans.




Benefits: Cognizant offers the following benefits for this position, subject to applicable eligibility requirements:

Medical/Dental/Vision/Life Insurance
Paid holidays plus Paid Time Off
401(k) plan and contributions
Long-term/Short-term Disability
Paid Parental Leave
Employee Stock Purchase Plan



Disclaimer: The salary, other compensation, and benefits information is accurate as of the date of this posting. Cognizant reserves the right to modify this information at any time, subject to applicable law.




LI-MA1 #CB #Ind123

Employee Status : Full Time Employee

Shift : Day Job

Travel : No

Job Posting : Nov 21 2023

About Cognizant
Cognizant (Nasdaq-100: CTSH) is one of the world's leading professional services companies, transforming clients' business, operating and technology models for the digital era. Our unique industry-based, consultative approach helps clients envision, build and run more innovative and efficient businesses. Headquartered in the U.S., Cognizant is ranked 185 on the Fortune 500 and is consistently listed among the most admired companies in the world. Learn how Cognizant helps clients lead with digital at www.cognizant.com or follow us @USJobsCognizant.

Applicants may be required to attend interviews in person or by video conference. In addition, candidates may be required to present their current state or government issued ID during each interview.

Cognizant is an equal opportunity employer. All qualified applicants will receive consideration for employment without regard to sex, gender identity, sexual orientation, race, color, religion, national origin, disability, protected Veteran status, age, or any other characteristic protected by law.

If you have a disability that requires a reasonable accommodation to search for a job opening or submit an application, please email CareersNA2@cognizant.com with your request and contact information.",1994,Information Technology Support Services,$10+ billion (USD),Information Technology,1001 to 5000 Employees,Company - Public,False
Senior Data Engineer,Erstom,"Minneapolis, MN",$109K - $145K (Glassdoor est.),-1.0,"Job Description:

You will be part of a team building the next generation data warehouse platform and will design, develop, and maintain complex extract, transform, and load (ETL) data pipelines using large heterogeneous datasets. You will also build data engineering solutions for complex data models that express business processes. Your expertise with leading technologies and tools such as Oracle, Postgres, Python, etc. will result in a valuable modern data warehouse that supports critical business decisions and data analysis processes. Your collaboration and communication skills will help to establish stakeholder relationships and ensure that your work products are in alignment with project goals. Most importantly, you will be passionate about working with data and will be a significant contributor.

Responsibilities:
Design, develop, and automate scalable data engineering solutions by leveraging cloud infrastructure. Extend or migrate existing data pipelines to new cloud environment.
Lead technical projects involving design and development of data pipelines for complex datasets. Document project plans, outline tasks and milestones, provide estimation of effort.
Work closely with business partners to devise and manage data pipelines, load frequency, data delivery mechanisms, and performance tuning.
Identify and implement best practices for data engineering and software development to ensure quality delivery of enterprise solutions.
Help enable team alignment by participating in code reviews, change management and team meetings.
Develop and maintain detailed technical documentation of data engineering solutions.
Collaborate with key stakeholders, both internal and external, including enterprise data architect, data modelers, and subject matter experts (SMEs).
Qualifications:
Five or more years of professional experience as data engineer. Bachelor’s degree in Computer Science or equivalent experience.
Demonstrated experience in data warehousing and ETL development.
Experience building complex data pipelines using large, disparate data sources.
Demonstrated expert knowledge in SQL.
Demonstrated experience working with relational databases such as Oracle, Postgres and other modern database technologies.
Proficiency in modern programming languages such as Python, R, Java.
Thorough understanding of data movement and transformation tools, such as Informatica, Datastage or equivalent.
Demonstrated experience in selecting tools, methods, techniques, and evaluation criteria for designing optimal data engineering solutions.
Demonstrated experience in leading complex technical projects, including assigning tasks and selecting team members.
Ability to make technical presentations to teams, focus groups, management, and governance committees.
Excellent customer service, communication and collaboration skills.
Preferred Qualifications:
Five years or more experience as data engineer designing and implementing complex data pipelines.
Master’s degree in Computer Science, Information Technology or related field.
Experience with Big Data Technologies (Hadoop, Hive, Hbase, Pig, Spark, etc.).
Experience with AWS technologies.",-1,-1,Unknown / Non-Applicable,-1,1 to 50 Employees,Company - Private,False
