Job Title,Company Name,Location,Salary Estimate,Rating,Job Description,Founded,Industry,Revenue,Sector,Size,Type,Easy Apply
Senior Data Engineer (Snowflake) - Contractor,"EY
",United States,$90.00 - $130.00 Per Hour (Employer est.),3.9,"The primary responsibility for the Sr. Data Engineer / Tech Lead is to ensure data accessibility, quality, and reliability within the client's data platform ecosystem.

RESPONSIBILITIES

Design and develop end-to-end data pipelines and ETL processes using Snowflake, Denodo, DBT Cloud, Fivetran, and AWS Glue, ensuring seamless data integration, transformation, and loading.
Collaborate with cross-functional teams to gather data requirements and implement scalable data models and schemas within Snowflake and Denodo, ensuring optimal performance and data consistency.
Implement and maintain data orchestration workflows using Stonebranch, ensuring efficient and reliable scheduling and automation of data processes.
Work with EnterpriseDataLake for ingestion and storage of data from various sources, ensuring the availability and accessibility of data for analytics and reporting purposes.
Utilize Azure DevOps and Teraform to implement and manage infrastructure as code, ensuring streamlined deployment and scalability of data engineering solutions.
Skills

snowflake

denodo

dbt cloud

fivetran

Qualifications

REQUIREMENTS

Proficiency in Snowflake and Denodo: Strong understanding and hands-on experience in working with Snowflake and Denodo for data integration, transformation, and analysis.
Knowledge of DBT Cloud: Familiarity with DBT Cloud, including experience in building and maintaining efficient data transformation workflows and deploying reliable data pipelines.
Experience with Fivetran: Demonstrated experience in utilizing Fivetran for data ingestion, source connectivity, and ensuring data accuracy and completeness.
Understanding of EnterpriseDataLake: Knowledge of EnterpriseDataLake principles and practices, including data ingestion, storage, and organization for analytics and reporting purposes.
Familiarity with Stonebranch: Proficiency in using Stonebranch for data orchestration and scheduling, ensuring efficient and reliable execution of data pipelines and workflows.
Proficiency in Azure DevOps and Teraform: Experience in leveraging Azure DevOps and Teraform for infrastructure as code, enabling streamlined deployment and scalability of data engineering solutions.

The expected pay rate range for this contract assignment is $90 to $130 per hour. The exact pay rate will vary based on skills, experience, and location. The position is approximately 65-70% remote and 30-35% travel to the client as needed.

#GigNowTechOpportunities

GigNowOpportunities

Equal Employment Opportunity Information
EY provides equal opportunities to applicants, employees, contractors, vendors, and stakeholders without regard to race, color, religion, age, sex, sexual orientation, gender identity/expression, pregnancy, genetic information, national origin, protected veteran status, disability status, or any other legally protected basis, including arrest and conviction records, in accordance with applicable law. If you are an individual with a disability and either need assistance applying online or need to request an accommodation during any part of the application process, please email gignow.recruiting@ey.com.",-1,-1,Unknown / Non-Applicable,-1,Unknown,Unknown,False
Data & Software Engineer,"Ovative Group, LLC
","Minneapolis, MN",$62K - $93K (Employer est.),4.1,"About Ovative Group

Ovative Group is the premier independent media and measurement firm in the United States. We help change-makers, in fast-growing, customer-centric organizations across industries reinvent their marketing and measurement programs. We leverage our media, measurement, and consulting capabilities to help brands like Coach, Kate Spade, Stuart Weitzman, Facebook, The Home Depot, CVS, Disney, and UnitedHealth Group transform their media and marketing programs. Our proprietary approach to measuring and optimizing marketing investment decisions, Enterprise Marketing Return (EMR), is disrupting the industry and setting the gold standard for customer and marketing strategy, activation, and measurement.

Recognized eight consecutive years on Star Tribune’s list of Top 150 Workplaces and five years on Inc. 5000’s list of the fastest-growing private companies in America, we pride ourselves in always overdelivering for our clients, our teams, and our communities.

About the Role

We are seeking a Data & Software Engineer to join our rapidly growing product and engineering development team. Our company specializes in enterprise-level media measurement and optimization across various industries. In this role, you will be an integral part of a cross-functional team responsible for creating, optimizing, and maintaining scalable software and data solutions to enhance performance, stability, and scalability. You will work under the guidance of experienced team members and closely collaborate with stakeholders throughout the entire software development lifecycle, from concept to deployment.

The ideal candidate will have a strong foundation in iterative development practices, familiarity with version control systems like GitHub, and a passion for developing both conceptual and pragmatic problem-solving skills. Your attention to detail and communication skills, both written and oral, will enable you to work directly with a variety of users, understand their objectives, and contribute to translating them into technical requirements and solutions. As a valuable team member, you will be encouraged to learn and grow in a supportive environment, actively participate in team activities, and set the foundation for your professional development.

Responsibilities:

Assist in designing, developing, testing, and deploying software solutions that align with business and technical requirements.
Contribute to the effort of identifying opportunities for automation with a focus on the operational stability of software applications and systems
Collaborate with your team to support translating business goals and user requirements into detailed, actionable technical requirements
Contribute to documentation and technical requirements, including software designs, evaluation plans, test results, technical manuals and formal recommendations and reports
Contribute to the creation and maintenance of robust, performant solutions that provide high customer impact at scale
Provide technical assistance to teammates as needed through collaboration and by sharing your expertise
Follow established software and product engineering best practices, including code quality, documentation, deployment, and testing.
Explore new technologies and tools under guidance to enhance software development.
Troubleshoot tier 1 software issues with support from senior team members as needed.
Participate in technical knowledge sharing with other team members.
Stay current with emerging technology and software engineering innovations and continuously enhance skills.

Requirements:

3+ years of relevant data & software engineering development experience
Proficient working with ETL/ELT tooling for large data sets (e.g., Airbyte)
Proficient utilizing SQL, Python, and command line
Familiarity with cloud-based platforms (i.e. GCP, AWS)

Preferred:

Experience working with APIs for data retrieval
Experience working with data warehouses and big data tools (e.g., BigQuery, Databricks)
Experience creating data/table architecture
Experience implementing QA processes and QA automation
Experience integrating data models within software
Experience working with marketing, analytics and customer data

Pay Transparency

At Ovative, we offer a transparent view into three core components of your total compensation package: Base Salary, Annual Bonus, and Benefits. The salary range for this position below is inclusive of an annual bonus. Actual offers are made with consideration for relevant experience and anticipated impact. Additional benefits information is provided below.

For our Sr. Analyst positions, our compensation ranges from $62,000 to $93,000, which is inclusive of a 15% bonus.

Benefits of Working at Ovative Group

We provide strong, competitive, holistic benefits that understand the importance of your life inside and out of work.

Culture:

Culture matters and we’ve been recognized as a Top Workplace for eight years running because of it. We demand trust and transparency from each other. We believe in doing the hard and complicated work others put off. We’re open in communication and floor plan. We’re flat – our interns sit next to VPs, our analysts work closely with senior leaders, and our CEO interacts with every single person daily. Put together, these elements help foster an environment where smart people can support each other in performing to their highest potential.

Compensation and Insurance:

We strive to hire and retain the best talent. Paying fair, competitive compensation, with a large bonus incentive, and phenomenal health insurance is an important part of this mix.

We’re rewarded fairly and when the company performs well, we all benefit.

Tangible amenities we enjoy:

Access to all office spaces in MSP, NYC, and CHI
Frequent, paid travel to our Minneapolis headquarters for company events, team events, and in-person collaboration with teams.
Flexible paid vacation policy
401k match program
Top-notch health insurance options
Monthly stipend for your mobile phone and data plan
Sabbatical program
Charitable giving via our time and a financial match program
Shenanigan’s Day

Working at Ovative won’t be easy, but if you like getting your hands dirty, driving results, and being surrounded by the best talent, it’ll be the most rewarding job you’ll ever have. If you think you can make us better, we want to hear from you!",2009,Advertising & Public Relations,$25 to $100 million (USD),Media & Communication,501 to 1000 Employees,Company - Private,True
Data Engineer,"Centriam
","Minneapolis, MN",$69K - $105K (Glassdoor est.),5.0,"As a Data Engineer, you will play a key role in designing and building reliable, scalable, and performant data solutions in support of our growing analytics practice. If you are passionate about the data analytics space and are excited by the opportunity to build innovative solutions in a fast-paced environment, this may be the role for you!

Key Responsibilities:
Build high quality data processing solutions using a variety of technologies
Implement complex data projects with a focus on collecting, parsing, managing, and analyzing large sets of data to turn information into insights
Solve problems that span multiple interconnected systems
Automate infrastructure while accounting for a large number of interdependent processes
Translate business requirements into technical requirements, and refine existing technical requirements as needed
Collaborate with cross-functional teams on various initiatives
Mentor, pair, and delegate work to encourage the growth of those around you
Design and implement scalable, low-latency, high-availability, and performant applications
Assist in other analytics and/or development work outside of the traditional data engineering role
Experience & Skills:
Proficient in Python
Strong SQL skills
Experience with cloud engineering on AWS
Expertise with Linux command line tools
Experience with RESTful APIs
Strong commitment to well designed and well maintained unit tests, BDD, TDD
Strong interest in building big data applications and solutions
Strong interest in learning new technologies, languages and skills
Excellent communication skills and technical knowledge-sharing habits
2+ years of relevant experience
Bonus Skills:
Data analysis
Solution architecture
Database performance tuning and optimization
Data visualization and charting frameworks experience
Bonus Technology Skills
Luigi
AWS Redshift, Lambda, API Gateway, ECS, Glue
Docker
Pandas
Document database technology (CouchBase, MongoDB, DynamoDB)
Why Work at Centriam?
Small analytics company focused on delivering excellence and value to our clients by providing high quality analytical and data-driven solutions.
Fun & collaborative culture; you will wear many hats and play an integral part in projects.
Exposure to a wide variety of data analytics, cloud, and open source technologies.
“Take what you need” vacation policy.
401k with generous match, vested immediately.
Free drinks, coffee, beer, and snacks.
Downtown Minneapolis office, connected to skyway.",2012,Advertising & Public Relations,Unknown / Non-Applicable,Media & Communication,1 to 50 Employees,Company - Private,False
Senior Network Engineer - Data Center,"Wells Fargo
","Minneapolis, MN",-1,3.7,"About this role:

Wells Fargo is seeking a Senior Network Engineer to join our Internal Hosting implementation team. This team provides the foundational global network infrastructure (data center routers and switches) which includes building capacity and managing the lifecycle of our internal network modules.

In this role, you will:
Lead or participate in implementing network security policies across routers and firewalls
Manage production networks including Internet Protocol backbone, data centers and edge pops across the globe
Ensure the continuous availability of all data network services
Identify gaps, risks and issues and navigate organizational structure to resolve them
Perform quarterly proactive network testing to ensure proper functioning and reliability of the network
Investigate and remediate network capacity related issues
Apply knowledge of security and regulatory policies to design and implement foolproof secured network solutions
Provide resolution information and work with other teams to complete impact analysis
Deliver comprehensive and maintenance plans for change management review and approval
Mentor and train network operations team in the installation, configuration, and maintenance
Partner cross-functionally with other Product Infrastructure teams in order to continuously improve and apply standards and policies relevant to operational excellence
Required Qualifications:
4+ years of Network Engineering experience, or equivalent demonstrated through one or a combination of the following: work experience, training, military experience, education
4+ years of experience with configuration of routing and switching latest platforms and solutions - Cisco Nexus and/or Arista product line
4+ years of experience designing LAN/WAN/Datacenter solutions for large enterprises
4+ years of experience with IP routing protocols (BGP, OSPF, RIP) in a large enterprise environment
Desired Qualifications:
Excellent documentation and verbal communication skills
Demonstrated skill with creating and/or updating technical design documentation used by engineering teams
Experience with Microsoft Office, Visio Professional
Experience working in an agile environment utilizing Atlassian Jira products
Strong understanding of the following routing protocols: OSPF, BGP, EIGRP
Bachelor's degree in Computers or Electronics with 7-9 Years of Networking Experience
CCNA, CCNP/DP or CCIE Certification preferred - Datacenter
Strong understanding of QoS configurations to support enterprise standards.
Strong experience in configuring Cisco and Arista Routers/Switches
Strong understanding of the following layer 2 switching protocols: Spanning Tree, Trunking, Etherchannel
Strong understanding of the following: HSRP, CBWFQ, DSCP, NAT/SNAT, TCP/IP, Multicast, Ethernet, EVPN, MLAG, CVP
Strong understanding of DNS/domain services
Python/Ansible/GITHUB experience a plus
Experience and familiarity with Change control processes - Service Now
Job Expectations:
Flexibility to frequently be on call beyond normal working hours
Ability to travel up to 10% of the time
Telecommuting is not an option for this position
This position offers a hybrid work schedule
Relocation assistance in not available for this position
This position is not eligible for visa sponsorship
Execute changes into the above environments via the Wells Fargo change control process, assist on mitigating risk for the enterprise by proactively addressing capacity problems or system related issues, participate in enterprise level projects from an engineering perspective and responsible for Design, reviewing, implementing, testing/validating, and researching industry best practices
This team works under a product model with dedicated teams supporting our products
We Value Diversity

At Wells Fargo, we believe in diversity, equity and inclusion in the workplace; accordingly, we welcome applications for employment from all qualified candidates, regardless of race, color, gender, national origin, religion, age, sexual orientation, gender identity, gender expression, genetic information, individuals with disabilities, pregnancy, marital status, status as a protected veteran or any other status protected by applicable law.

Employees support our focus on building strong customer relationships balanced with a strong risk mitigating and compliance-driven culture which firmly establishes those disciplines as critical to the success of our customers and company. They are accountable for execution of all applicable risk programs (Credit, Market, Financial Crimes, Operational, Regulatory Compliance), which includes effectively following and adhering to applicable Wells Fargo policies and procedures, appropriately fulfilling risk and compliance obligations, timely and effective escalation and remediation of issues, and making sound risk decisions. There is emphasis on proactive monitoring, governance, risk identification and escalation, as well as making sound risk decisions commensurate with the business unit's risk appetite and all risk and compliance program requirements.

Candidates applying to job openings posted in US: All qualified applicants will receive consideration for employment without regard to race, color, religion, sex, sexual orientation, gender identity, national origin, disability, status as a protected veteran, or any other legally protected characteristic.

Candidates applying to job openings posted in Canada: Applications for employment are encouraged from all qualified candidates, including women, persons with disabilities, aboriginal peoples and visible minorities. Accommodation for applicants with disabilities is available upon request in connection with the recruitment process.

Drug and Alcohol Policy

Wells Fargo maintains a drug free workplace. Please see our Drug and Alcohol Policy to learn more.",1852,Banking & Lending,$10+ billion (USD),Financial Services,10000+ Employees,Company - Public,False
Data Engineer,"Piper Sandler
","Minneapolis, MN",$96K - $132K (Glassdoor est.),4.1,"At Piper Sandler, we connect capital with opportunity to build a better future.

We believe diverse teams with unique backgrounds, skills and experiences yield more innovative solutions. Our mission is to recruit, develop, retain and engage a diverse, high-performing team. Our business enables bright, committed people working in partnership within an environment that allows each person to achieve at a high level. We commit to encouraging and valuing inclusivity because every partner brings unique perspectives that help us better serve our clients.

We are currently looking for a Data Engineer in our Minneapolis, MN office.

Responsibilities include:

Prepare, cleanse and format datasets for processing and analysis
Build and maintain complex ETL pipelines
Interface with data scientists, software developers, and other analytics operations staff as needed
Contribute to software code reusability and knowledge management
Build complex ETL pipelines which are easy to maintain and enhance
Perform Managed File Transfer automation tasks supporting different protocols like SFTP, FTP, HTTPS etc.
Provide production support during business hours and non-business hours as needed
Liaise with other technology specialists and software engineers/developers to assist with quality assurance, code logic, data processing, system design, and disaster recovery/resiliency
Monitor production jobs, maintain and enhance ETL pipelines
Schedule the jobs using enterprise supported scheduling tool (Autosys)
Extract and ingest data using variety of methods including SOAP and REST APIs
Manage Tasks using Kanban/Azure Boards to collaborate with the team and to track progress

Requirements:

Four-year college diploma or university degree in computer systems or computer science
Certifications in relevant technology(ies) is a plus
5+ years of experience working in Data Engineering
5+ or more years of experience with relational databases like Oracle and MSSQL server
Experience working with managed file transfer products like Cleo Harmony or IBM Streling File Gateway
Proficient in linux/shell scripting
Proficient in Python
Experience in data integration and building complex ETL pipelines using Python
Experience working in ETL Tools like IBM Datastage, Informatica, Talend, SSIS
Experience working in Linux environments
Experience in the financial services industry
Experience working with large data sets
Experience working with different data formats like XML/JSON/CSV/BAI/FIX
Strong follow-through skills, keen attention to deadlines, and the ability to drive tasks to completion
Strong written and oral communication skills as well as strong listening and interpersonal skills
Highly self-motivated and ability to complete tasks with minimal supervision
Ability to multi-task, exercise excellent time management, and meet multiple deadlines
Keen attention to detail and ability to document information accurately
Willingness to learn new technologies
Desirable but not required - Knowledge/experience in cloud technologies like Kafka/Azure Synapse/Snowflake

As a leading investment bank, we enable growth and success for our clients through deep sector expertise, candid advice and a differentiated, highly productive culture.

Our human capital, technology, marketing and other corporate support teams work with our business partners to maximize each employee. We understand the dynamic nature of the industry and work alongside our company strategies. Learn more about our firm here .

Piper Sandler values a strong culture dedicated to the emotional and physical well-being of our employees. Learn more about our commitment to our employee’s health and well-being. Learn more about our benefits program and how we are here for our employees and their families today, tomorrow and beyond.

All qualified applicants will receive consideration for employment without regard to race, color, creed, religion, sex, sexual orientation, gender identity, national origin, disability, age, marital status, status as a protected veteran or status with regard to public assistance.

LI-BSL",1895,Investment & Asset Management,$500 million to $1 billion (USD),Financial Services,1001 to 5000 Employees,Company - Public,False
