Job Title,Company Name,Location,Salary Estimate,Rating,Job Description,Founded,Industry,Revenue,Sector,Size,Type,Easy Apply
Senior Data Engineer (Snowflake) - Contractor,"EY
",United States,$90.00 - $130.00 Per Hour (Employer est.),3.9,"The primary responsibility for the Sr. Data Engineer / Tech Lead is to ensure data accessibility, quality, and reliability within the client's data platform ecosystem.

RESPONSIBILITIES

Design and develop end-to-end data pipelines and ETL processes using Snowflake, Denodo, DBT Cloud, Fivetran, and AWS Glue, ensuring seamless data integration, transformation, and loading.
Collaborate with cross-functional teams to gather data requirements and implement scalable data models and schemas within Snowflake and Denodo, ensuring optimal performance and data consistency.
Implement and maintain data orchestration workflows using Stonebranch, ensuring efficient and reliable scheduling and automation of data processes.
Work with EnterpriseDataLake for ingestion and storage of data from various sources, ensuring the availability and accessibility of data for analytics and reporting purposes.
Utilize Azure DevOps and Teraform to implement and manage infrastructure as code, ensuring streamlined deployment and scalability of data engineering solutions.
Skills

snowflake

denodo

dbt cloud

fivetran

Qualifications

REQUIREMENTS

Proficiency in Snowflake and Denodo: Strong understanding and hands-on experience in working with Snowflake and Denodo for data integration, transformation, and analysis.
Knowledge of DBT Cloud: Familiarity with DBT Cloud, including experience in building and maintaining efficient data transformation workflows and deploying reliable data pipelines.
Experience with Fivetran: Demonstrated experience in utilizing Fivetran for data ingestion, source connectivity, and ensuring data accuracy and completeness.
Understanding of EnterpriseDataLake: Knowledge of EnterpriseDataLake principles and practices, including data ingestion, storage, and organization for analytics and reporting purposes.
Familiarity with Stonebranch: Proficiency in using Stonebranch for data orchestration and scheduling, ensuring efficient and reliable execution of data pipelines and workflows.
Proficiency in Azure DevOps and Teraform: Experience in leveraging Azure DevOps and Teraform for infrastructure as code, enabling streamlined deployment and scalability of data engineering solutions.

The expected pay rate range for this contract assignment is $90 to $130 per hour. The exact pay rate will vary based on skills, experience, and location. The position is approximately 65-70% remote and 30-35% travel to the client as needed.

#GigNowTechOpportunities

GigNowOpportunities

Equal Employment Opportunity Information
EY provides equal opportunities to applicants, employees, contractors, vendors, and stakeholders without regard to race, color, religion, age, sex, sexual orientation, gender identity/expression, pregnancy, genetic information, national origin, protected veteran status, disability status, or any other legally protected basis, including arrest and conviction records, in accordance with applicable law. If you are an individual with a disability and either need assistance applying online or need to request an accommodation during any part of the application process, please email gignow.recruiting@ey.com.",-1,-1,Unknown / Non-Applicable,-1,Unknown,Unknown,False
Lead Electrical Engineer (Mission Critical/Data Center),"WSP
","Milwaukee, WI",$71K - $105K (Glassdoor est.),3.7,"Who We Are

At WSP, we are driven by inspiring future-ready pioneers to innovate. We’re looking to grow our teams with people who are ready to collaborate in building communities and expanding our skylines. To do this, we hire candidates of all experiences, skillsets, backgrounds and walks of life. We actively foster a work environment and culture where inclusion and diversity is part of our fundamental structure. This is delivered behaviorally, through our policies, trainings, local partnerships with professional diverse organizations, internal networks and most importantly with the support and sponsorship of our leaders who help drive our commitment to an inclusive, diverse, welcoming and equitable work environment. Anything is within our reach and yours as a WSP employee. Come join us and help shape the future!

Great people. Great places. Great projects. kW Mission Critical Engineering, a WSP company, is a high-performance, fast-paced consulting engineering firm designing data centers and mission critical environments across the globe. We hire smart, responsive, team players to work in collaborative and mentoring office settings. Our mechanical, electrical, plumbing, fire protection, controls, telecommunications, and security building system designs keep many of the world’s top Fortune 100 financial, technology, enterprise, hyperscale, and colocation companies up and running 24 hours a day, 365 days a year.

We work on innovative, award-winning, large-scale projects. We travel to construction sites to see our designs being built. As part of WSP, we are able to offer our employees increased professional development and career opportunities in addition to kW MCE’s office culture which is consistently recognized as one of the “Best Places to Work.” Join our great people at our great places designing great projects.

This Opportunity

What You’ll Do:

kW Mission Critical Engineering is currently initiating a search for a Lead Electrical Engineer that can be located for our kW Milwaukee office located at: 233 N Water St, Milwaukee, WI 53202. As a Lead Electrical Engineer with us, you will design complex power and other building systems including generator plants, medium voltage distribution, uninterruptible power systems, lighting, fire alarm, and grounding while leading projects and a team of electrical engineers.

Your Impact
Produce high quality technical and professional deliverables for projects and proposals
Apply deep knowledge of engineering techniques across multiple technical functions
Utilize advanced analytical and design techniques to solve technical problems
Exemplify well-developed advanced experience in electrical discipline
Lead the development of initial electrical system concepts
Present complex technical solutions to clients
Manage and coordinate project teams and projects
Develop work plans to address technical issues within project time and budget
Work within multi-discipline project teams to develop drawing and specification documents for issuance to architects, contractors and building owners
Attend and lead client meetings
Manage and mentor junior staff
Collaborate and coordinate with internal project discipline team members, equipment vendors and manufacturers
Perform project management activities including writing proposals, establishing budgets, and managing client interactions
Coordinate activities concerned with technical development, scheduling, and resolving engineering design issues
Coordinate the activities of technical staff from project award through project completion
Design complex and large electrical medium voltage and low voltage distribution systems and electrical building systems (i.e. general power, lighting, grounding, etc.)
Survey and evaluation of existing conditions
Develop project specifications
Perform construction administration
Develop and maintain client relationships
Contribute and interact with team, develop and manage high quality technical and professional deliverables on projects and proposals
Participate in local professional organization (attend meetings/lectures), i.e., poster sessions, participate in conference panel
Exercise responsible and ethical decision-making regarding company funds, resources and conduct and adhere to WSP""s Code of Conduct and related policies and procedures
Proven track record of upholding workplace safety and ability to abide by WSP""s health, safety and drug/alcohol and harassment policies
Who You Are

The ideal candidate has familiarity with Building Information Modeling using Revit, has strong communication skills, and an interest in liaising with internal and external design, client and construction team members. Candidate will have previous experience as a lead project electrical engineer capable of directing the project team.

Required Qualifications

Bachelor’s degree in Electrical Engineering or Architectural Engineering with electrical building systems emphasis
7+ years of experience in designing electrical systems for the high performing, commercial, industrial or mission critical/data center buildings
Registered Professional Engineer (PE)
Experience mentoring and training others in field
Strong verbal and written communication skills
Ability to interact well with others as well as develop and contribute to high quality technical and professional deliverables on projects and proposals
Strong working knowledge of electrical systems and codes
Attention to detail, highly organized, self-starter
Participate in conference programs including panels, lectures, poster sessions, papers and presentations

Preferred Qualifications:

Enhancing credentials (LEED, Uptime ATD, etc.) preferred
Experience with the analysis and modeling of short circuit coordination and arc flash studies
Mission Critical/Data Center experience
Experience with international projects and knowledge of international codes and standards

#LI-TB1

Additional Requirements
To perform this job successfully, an individual must be able to perform each essential job duty satisfactorily. Reasonable accommodations may be made to enable qualified individuals with disabilities to perform essential job functions.
Additional Details
Travel Required: 10%
Job Status: Regular
Employee Type: Full
Primary Location: MILWAUKEE - N WATER ST
All locations: US-WI-Milwaukee

About WSP

WSP USA is the U.S. operating company of WSP, one of the world's leading engineering and professional services firms. Dedicated to serving local communities, we are engineers, planners, technical experts, strategic advisors and construction management professionals. WSP USA designs lasting solutions in the buildings, transportation, energy, water and environment markets. With more than 15,000 employees in over 300 offices across the U.S., we partner with our clients to help communities prosper. www.wsp.com

WSP provides a flexible and agile workplace model while meeting client needs. Employees are also afforded a comprehensive suite of benefits including medical, dental, vision, disability, life, and retirement savings focused on providing health and financial stability throughout the employee’s career.

At WSP, we want to give our employees the challenges they seek to grow their careers and knowledge base. Your daily contributions to your team will be essential in meeting client objectives, goals and challenges. Are you ready to get started?

WSP USA (and all of its U.S. companies) is an Equal Opportunity Employer Race/Age/Color/Religion/Sex/Sexual Orientation/Gender Identity/National Origin/Disability or Protected Veteran Status.

The selected candidate must be authorized to work in the United States.

NOTICE TO THIRD PARTY AGENCIES:

WSP does not accept unsolicited resumes from recruiters, employment agencies, or other staffing services. Unsolicited resumes include any resume or hiring document sent to WSP in the absence of a signed Service Agreement where WSP has expressly requested recruitment/staffing services specific to the position at hand. Any unsolicited resumes, including those submitted to hiring managers or other business leaders, will become the property of WSP and WSP will have the right to hire that candidate without reservation – no fee or other compensation will be owed or paid to the recruiter, employment agency, or other staffing service.",-1,-1,$5 to $25 million (USD),-1,10000+ Employees,Company - Private,False
Cost Engineer – Data Center Construction,"Turner & Townsend
","Mount Pleasant, WI",$60K - $83K (Glassdoor est.),3.8,"Company Description


From the inception of a project through to completion and beyond, Turner & Townsend help to deliver the outcomes that matter through transformational programs covering the full spectrum of consultancy, project delivery and post-project operations.

With offices located globally, you're never far away from our services. Working from 118 offices in 50 countries, we make the difference to projects across the real estate, infrastructure and natural resources sectors worldwide.

Our team is dynamic, innovative and client-focused, supported by an inclusive and fun company culture. Our clients value our proactive approach, depth of expertise, integrity and the quality we deliver. As a result, our people get to enjoy working on some of the most exciting projects in the world.



Job Description


Turner & Townsend are seeking a driven Cost Engineer to join our team and support a global technology client on their large-scale Data Center construction program.

Working as part of an industry leading team, you’ll be eager and excited to learn the role and build upon your cost skillset that will set you up for a successful career in the construction industry.

To be successful you’ll have strong analytical skills, be well organized and able to work effectively under pressure, and have great commercial acumen.

The role will initially entail supporting our estimating and cost review leads with take-offs, benchmarking and managing stakeholders.


Job Objectives:




Tracking cost review and estimate requests as they are submitted by the client.
Preparing documents as required by the team.
Issuing RFIs and chasing responses.
Document control.
Analyzing existing cost data and producing benchmark information.
Weekly reporting to the client.
Meet and negotiate costs with contractors.
Reconciling actual costs with contract pricing.
Develop cost estimates from drawings and specifications.
Provide input into value engineering exercises.


Qualifications


A minimum of 2-3 years post-graduate experience working in a cost role on large Data Center, Commercial, Healthcare, High-tech or related projects.
Passion and enthusiasm for construction and numbers!
Strong analytical skills and advanced proficiency using spreadsheets.
Experience using estimating software, e.g. on screen take off, Revit.
Working knowledge of Microsoft Office and Google Suite: Docs, Sheets, Slides, and Drive.

Additional Information


*On-site presence and requirements may change depending on our client's needs*


Our inspired people share our vision and mission. We provide a great place to work, where each person has the opportunity and voice to affect change.

We want our people to succeed both in work and life. To support this we promote a healthy, productive and flexible working environment that respects work-life balance.

Turner & Townsend is an equal opportunity employer. We celebrate diversity and are committed to creating an inclusive environment for all employees and actively encourage applications from all sectors of the community.

Please find out more about us at www.turnerandtownsend.com/ and https://www.heery.com/

All your information will be kept confidential according to EEO guidelines.

#LI-MB1

Join our social media conversations for more information about Turner & Townsend and our exciting future projects:

Twitter

Instagram

LinkedIn

It is strictly against Turner & Townsend policy for candidates to pay any fee in relation to our recruitment process. No recruitment agency working with Turner & Townsend will ask candidates to pay a fee at any time.

Any unsolicited resumes/CVs submitted through our website or to Turner & Townsend personal e-mail accounts, are considered property of Turner & Townsend and are not subject to payment of agency fees. In order to be an authorised Recruitment Agency/Search Firm for Turner & Townsend, there must be a formal written agreement in place and the agency must be invited, by the Recruitment Team, to submit candidates for review.",1946,Business Consulting,$100 to $500 million (USD),Management & Consulting,5001 to 10000 Employees,Company - Private,False
"Staff Data Solutions Engineer- Madison, WI","Findhelp, A Public Benefit Corporation
","Madison, WI",$89K - $134K (Employer est.),2.6,"We’re changing the way people connect to social care.

At findhelp, we’ve built a comprehensive platform of products and services that make it easy for you to connect people to resources, follow them on their journey, and track your impact in a fast and reliable way. Our industry-leading social care network includes more than half a million local, state, and national programs that serve every ZIP Code in the country, from rural areas to major metropolitan centers.
Findhelp is headquartered in Austin, Texas and has been enabling healthcare, government, education, and other organizations to connect people with the social care resources that serve them, with privacy and security, since 2010.

As a mission driven organization, we are focused on creating a positive impact by connecting people in need to the programs that serve them with dignity and ease. Powered by our proprietary technology that enables people to find the resources available in their area, we have helped millions of Seekers find food, health, housing and employment programs.

Job Overview: We are seeking a highly skilled Staff Data Solution Engineer to join our team. As a Staff Data Solution Engineer, you will coordinate and contribute to the design, development, and implementation of data solutions for our customers and team. You will be responsible for working closely with our product team and customers to understand the data needs of today and tomorrow. This role offers an exciting opportunity to work on diverse projects, solve complex problems, and contribute to the success of our data-driven initiatives.
Responsibilities and Duties:
Client Collaboration: Engage with clients to understand their data requirements and challenges. Serve as a strong technical counterpart and trusted advisor to customer success and government relations teams.
Data Solution Design: Translate business requirements to analytical dashboard designs and operational data delivery solutions that meet the needs of a diverse and growing user audience.
Data Management: Leverage knowledge of relational databases to analyze and optimize schemas, queries, and data movement (ETL).
Problem Solving: Tackle new and complex data-related problems with creativity and a structured approach. Identify opportunities for simplification, process improvement and efficiency gains.
Continuous Learning: Stay up-to-date with industry trends, emerging technologies, and best practices in data engineering, data modeling, and use of AI.
Architecture analysis: Understand data from source to target and inform design, considering optimal methods for data capture, logging, transformation, warehousing, and delivery.
Qualifications:
Bachelor’s degree in Computer Science, Engineering, or related field ( or proven experience (7+ years) in data engineering, dashboard development, or a related role)
Experience with data visualization tools to develop dashboards and reports.
Proficiency in database systems such as MySQL and BigQuery
Strong SQL programming skills with the ability to write complex queries and optimize database performance.
Excellent problem-solving skills and the ability to work on new and challenging data problems.
Exceptional communication and customer-facing skills, with the ability to explain technical concepts to non-technical audiences.
Preferred: Experience with data management, ETL processes, and data movement techniques in Cloud infrastructure.
Preferred: Experience with Python for data manipulation, scripting, or automation.
The compensation for this position will be based on a candidate’s job-related skills, experience, education or training, and location.
This job is based on-site in Austin, TX or Madison, WI with the opportunity to work remotely on Fridays.

Perks at findhelp
401k & stock options
Free food and onsite gym at our Austin HQ
Paid parental leave
Competitive PTO & 10 paid holidays
Health, dental, and vision insurance
Pet-friendly office with attached dog park at our Austin HQ
24/7 access to telemedicine and counseling
Book Purchasing Program

We’re building a diverse, inclusive team

You’re welcome here. We want everyone to be able to easily connect to the help they need, and we want our teams to reflect and represent our communities. It is our policy to recruit, hire, train, and promote individuals, as well as administer any and all Company policies, without regard to age, color, disability, ethnicity, family or marital status, gender identity or expression, language, national origin or ancestry, physical and mental ability, political affiliation, race, religion, creed, sexual orientation, socio-economic status, veteran status, or any other protected class, in accordance with applicable laws. Accommodations are available for applicants with disabilities.

Here are some of the ways we support our staff:
Culture Committee
Leadership Development Training
Paid Volunteering Time",2010,Enterprise Software & Network Solutions,$5 to $25 million (USD),Information Technology,201 to 500 Employees,Company - Private,False
