Job Title,Company Name,Location,Salary Estimate,Rating,Job Description,Founded,Industry,Revenue,Sector,Size,Type,Easy Apply
Data Support Engineer,"NTT DATA
",Oregon,-1,3.4,"Req ID: 261278

NTT DATA Services strives to hire exceptional, innovative and passionate individuals who want to grow with us. If you want to be part of an inclusive, adaptable, and forward-thinking organization, apply now.

We are currently seeking a Data Support Engineer to join our team in Brighton, Massachusetts (US-MA), United States (US).

Work hours between 2 - 11 PM EST. This position can be remote with PST time zone ideal.

Responsibilities:

at staging/QA environments and help deploying them at production.


Work with business, product and technical stakeholders on data or report issues.


Create and manage Incident and Change Requests as needed for data pipelines.


Assist with data architecture, pipeline development, automation and planning


Develop and maintain documentation, departmental technical procedures, and user guides


Maintain best practices to facilitate optimized software development and continuous improvement/continuous delivery (CI/CD)

- Triage problems across the data platform to help address development, test, and production issues.


Testing Data pipelines

Basic Qualifications:


4+ years of software development


Software engineering best practices (system design for scale, modularity, version control, unit testing, documentation etc.) on real-world projects


Code in multiple languages (Python and SQL; R, Java, or others as well)


Foundation/certification in the AWS Cloud Services: S3, Redshift Spectrum, EC2


Gitlab, JIRA and Confluence

Education:


Undergraduate degree in computer science, engineering, or a related discipline preferred.

#INDFSINS

#L1-NAM

About NTT DATA Services

NTT DATA Services is a recognized leader in IT and business services, including cloud, data and applications, headquartered in Texas. As part of NTT DATA, a $30 billion trusted global innovator with a combined global reach of over 80 countries, we help clients transform through business and technology consulting, industry and digital solutions, applications development and management, managed edge-to-cloud infrastructure services, BPO, systems integration and global data centers. We are committed to our clients' long-term success. Visit nttdata.com or LinkedIn to learn more.

NTT DATA Services is an equal opportunity employer and considers all applicants without regarding to race, color, religion, citizenship, national origin, ancestry, age, sex, sexual orientation, gender identity, genetic information, physical or mental disability, veteran or marital status, or any other characteristic protected by law. We are committed to creating a diverse and inclusive environment for all employees. If you need assistance or an accommodation due to a disability, please inform your recruiter so that we may connect you with the appropriate team.",1967,Information Technology Support Services,$10+ billion (USD),Information Technology,10000+ Employees,Company - Public,False
Data Warehouse Engineer,"Clean Water Services
","Hillsboro, OR",$49.90 - $68.61 Per Hour (Employer est.),3.2,"The Position

The Digital Solutions Department is seeking a Data Warehouse Engineer. This position shapes processes, architecture, and organizational data management throughout the data life cycle by integrating core systems into a robust data warehouse system. Ensures cohesive digital infrastructure throughout the District by leveraging Extraction Transform Load (ETL) and ELT processes, cube development, dimensional design, and performance administration. Additionally, the position will oversee regulatory data compliance policies that adhere to Cybersecurity & Infrastructure Security Agency controls, and supports data governance, management, and security.

Essential Functions

(The essential functions listed below are not intended to reflect all duties that may be assigned to this classification. The District may augment duties and/or essential functions at its discretion. Additionally, some incumbents may not perform all Essential Functions.)



Collaborates with analytical and business teams to improve data modeling integration, business intelligence tooling, data accessibility, and broker data-driven decision-making throughout the organization.
Implements scalable solutions that align with our data governance standards and architectural roadmap for data integration, storage, analytics, and reporting.
Develops a standardized data integration and data quality framework. Writes quality control validation unit test for integration and ensures functionality and documentation of work.
Coordinates with business partners for troubleshooting or enhancements that pertain to data-related processes or issues. Assists leadership staff in responding to operational issues in emergencies.
Builds and maintains a central repository of integrated data from one or more disparate sources with modern practices that adhere to industry standards.
Maintains a positive, engaged, equitable, and inclusive workplace culture within the department to improve the work groups’ understanding and recognition of diversity in the workplace and foster multidisciplinary and integrated team approaches.
Drives a District vehicle for work related purposes.



Qualifications

KNOWLEDGE OF:

Principles, practices, and techniques of management of information systems
Information security, system integration, data and analytics, infrastructure application and program design, software systems development, business process design, and application portfolio management
Current technologies of an information technology services division
Principles and practices of strategy formulation, program planning, and project management
Advanced server platforms, virtualization technologies, systems and application software
Principles, practices, and applications of enterprise security practices and technical solutions
Compliance requirements for security and licensing within the services provided by the District departments
Principles and practices for meeting quality standards for customer service
Contracting for information services including contract negotiations and performance monitoring
Database technologies and warehouse schema patterns (i.e. snowflake, star)
Contextual architecture for No-SQL and Relational Database Management Systems

SKILL IN:
Active listening
Using logic and reasoning to identify and evaluate alternative solutions, conclusions, and approaches to problems
Identifying complex problems and reviewing related information to develop and evaluate different approaches and implement solutions
Negotiating and reaching consensus on complex issues
Using professional judgment and decision-making to evaluate costs and benefits to potential solutions and choose the most appropriate option
Adjusting oral and written communication appropriately for the needs of the audience
Microsoft SQL Server, Oracle database, Azure Cosmos, and Power BI. Programming in TSQL and PSQL
Python, C#, and R languages
Data operation methodologies such as Git, PowerShell, Azure Data Factory, Azure Databricks, Azure Synapse Analytics, Azure DevOps, Application Insights

ABILITY TO:
Interpret and apply complex technical manuals, documentation, and procedures
Interpret and explain database policies and procedures
Analyze and evaluate system performance, user needs, and data requirements
Develop and manage projects with established timeframes and budget requirements
Keep current on new methods being developed in the information systems industry
Communicate clearly and concisely, both orally and in writing
Read and understand information and ideas presented orally or in writing
Apply general rules and processes to specific problems
Leverage and apply existing IT solutions to business requirements
Apply knowledge and skills across a broad range of information technology disciplines, including application, data, infrastructure, and security domains
Analyze and summarize complex technical and organizational issues
Create life cycle cost-benefit summaries and risk analysis
Develop or design new solutions, develop long and short-range plans to meet established goals
Accurately analyze situations and adopt an effective course of action
Operate effectively in a team environment
Establish and maintain cooperative working relationships with individuals and groups who come from diverse backgrounds and represent members of the public, coworkers, and/or vendors
Experience and Training Guidelines:

3 years’ experience with a relational database, cloud database, No-SQL database architecture;

3 years’ database management, traditional data pipelines, analytical pipelines, or integration.

College coursework in computer science, programming, database design, and administration, or related field

AZURE data certification preferred.

CERTIFICATION AND LICENSURE REQUIREMENTS:
Upon selection, candidates must possess and maintain a valid State issued driver’s license.



Additional Information

Reasonable Accommodation
Applicants who require reasonable accommodation in order to participate in any phase of the application process should contact Human Resources at 503.681.3600 or TDD 503.681.3601.

Equal Employment Opportunity
Clean Water Services is an Equal Opportunity Employer and does not discriminate on the basis of race, religion, gender, national origin, marital status, age, uniformed service, sexual orientation or disability in the admission or access to the recruitment process or any aspect of employment.




Clean Water Services offers eligible employees the opportunity to choose benefits and plans that meet both individual and family needs. In addition to a competitive salary, Clean Water Services offers employees a comprehensive benefit packet that includes health coverage, health reimbursement account, life and accidental death insurance, flexible spending account, Oregon Public Employees Retirement Plan (PERS/OPSRP), deferred compensation, paid vacation, holidays and sick leave, tuition reimbursement, goal sharing bonus, and more. Further information for full-time regular non-represented employees can be found here (Download PDF reader).

Depending on hours worked and duration of the position, temporary employees may qualify for an offer of medical benefits, deferred compensation, and employee discounts. Temporary employees are eligible for sick leave at the rate of .0334 per hour worked upon beginning employment and may carry over up to 40 hours into the next calendar year.",-1,Energy & Utilities,$100 to $500 million (USD),"Energy, Mining & Utilities",201 to 500 Employees,Government,False
PRINCIPAL DATA ENGINEER,"Nike
","Beaverton, OR",-1,4.2,"Become a Part of the NIKE, Inc. Team

NIKE, Inc. does more than outfit the world's best athletes. It is a place to explore potential, obliterate boundaries and push out the edges of what can be. The company looks for people who can grow, think, dream and create. Its culture thrives by embracing diversity and rewarding imagination. The brand seeks achievers, leaders and visionaries. At NIKE, Inc. it's about each person bringing skills and passion to a challenging and constantly evolving game.

WHO ARE WE LOOKING FOR

We are looking for an experienced Principal Data Engineer to guide and influence multiple engineering teams to deliver scalable data and analytics solutions, implement new technologies, participate in solution design and architecture discussions. The ideal candidate will have outstanding communication skills, shown data design and implementation capabilities, strong eye for business, and a drive to deliver results. The person in this role will be technically proficient and excel at collaborating with engineers, analysts, and business partners. This person will be a self-starter, comfortable with ambiguity, and will enjoy working in a fast-paced dynamic environment.

WHAT WILL YOU WORK ON

In this role, you will build and deliver scalable data and analytics solutions focused on Nike Direct, Supply Chain, and Commercial space. You will design, implement and integrate new technologies and evolve data and analytics products. You will be chipping in to all aspects of data engineering from ingestion, transformation, and consumption in addition to designing and building test-driven development, reusable frameworks, automated workflows, and libraries at scale to support analytics products. You will also participate in architecture and design discussions to process and store high-volume data sets.

WHO WILL YOU WORK WITH

This person will join the North America Data & Analytics Organization and you will work with world-class talent in the field of Data Engineering with a goal of better business insights and driving data-driven decisions across the organization. Youll be working closely with hardworking teams - Internal partners, Product Owners, Engineering Leaders, Data Analysts, Big Data Leads, and Engineers. One of Nikes maxims is ""Win as a Team"" and you will be working in a very collaborative environment and will find success in teamwork, a positive attitude, and hard work.

WHAT YOU BRING


Bachelor/Master degree in Computer Science or related technical subject area or equivalent combination of education and experience


10+ years relevant work experience in the Data Engineering field


5+ years validated experience working with Hadoop and Big Data processing frameworks (Spark, Hive, Nifi, Spark-Streaming, Flink, etc.)


2+ years experience building scalable, real-time and high-performance cloud data lake solutions


Strong experience with relational SQL and programming languages such as Python, Scala, or Java


Experience with source control tools such as GitHub and related CI/CD processes


Experience working with Big Data streaming services such as Kinesis, Kafka, etc.


Experience working with NoSQL data stores such as HBase, DynamoDB, etc.


Experience provisioning RESTful APIs to enable real-time data consumption


Experience working in AWS environment primarily EMR, S3, Kinesis, Redshift, Athena, etc


Experience with data warehouses/RDBMS like Snowflake & Teradata


Experience with workflow scheduling tools like Airflow


Experience providing guidance and mentorship to other engineers


Strong understanding of algorithms, data structures, data architecture, and technical designs.


Proven track record of rapidly learning new technologies and developing and implementing proof of concepts and practical, working code


Proven track record to influence and communicate effectively with team members and business partners


Proven track record to partner with teams in solving complex problems by taking a broad perspective to identify innovative solutions.

NIKE, Inc. is a growth company that looks for team members to grow with it. Nike offers a generous total rewards package, casual work environment, a diverse and inclusive culture, and an electric atmosphere for professional development. No matter the location, or the role, every Nike employee shares one galvanizing mission: To bring inspiration and innovation to every athlete* in the world.

NIKE, Inc. is committed to employing a diverse workforce. Qualified applicants will receive consideration without regard to race, color, religion, sex, national origin, age, sexual orientation, gender identity, gender expression, veteran status, or disability.

How We Hire

At NIKE, Inc. we promise to provide a premium, inclusive, compelling and authentic candidate experience. Delivering on this promise means we allow you to be at your best - and to do that, you need to understand how the hiring process works. Transparency is key.


This overview explains our hiring process for corporate roles. Note there may be different hiring steps involved for non-corporate roles.

Benefits

Whether it's transportation or financial health, we continually invest in our employees to help them achieve greatness - inside and outside of work. All who work here should be able to realize their full potential.",1972,Consumer Product Manufacturing,$10+ billion (USD),Manufacturing,10000+ Employees,Company - Public,False
Data Center Engineer,"NVIDIA
","Hillsboro, OR",$140K - $288K (Employer est.),4.6,"Are you a person who likes to work in a fast-paced organization? For two decades, NVIDIA has pioneered visual computing, the art and science of computer graphics. With our invention of the GPU - the engine of modern visual computing - the field has expanded to encompass personal computer games, movie production, product design, medical diagnosis, and scientific research. Today, visual computing is becoming increasingly central to how people harmonize with technology, and there has never been a more exciting time to join our excellent team. NVIDIA is now passionate about innovation at the intersection of visual processing, high performance computing, and artificial intelligence.
Our data centers, and the thousands of servers installed in them, are the foundation upon which our creative products and services are delivered. Our customer base consists of hundreds of deeply intelligent engineers who continually provide us with complex problems to be solved. We are looking for a highly motivated senior Data Center technician to join our team. Having depth and breadth knowledge of working in data center facilities in a large-scale distributed environment is a strength you'll need. You should have deep knowledge and experience in at least one of the following core areas: Project Management, Hardware Operations, Network Operations or Data Center Operations.
What you'll be doing:
Act as technical liaison for our partner organizations
Lead installation, monitoring, maintenance, support, and optimization of all production server hardware
Contribute to the development of the global DC knowledge base
Build plans to optimize power, cooling, and network resources
Analyzing forecast to efficiently match supply to demand. Predict data center growth and scaling issues before they occur and implement solutions
You will hunt for and resolve issues, analyze data looking for trends and systemic issues. Implement process improvements and develop a cutting-edge operational environment through automation
What we need to see:
You will have 5 years proven ability in large-scale data center hardware deployments and server relocation projects
BS, BA, or BEng degree in a technical field, or equivalent experience
Sophisticated knowledge in diagnosing servers, hardware repair, and component replacement
Experience with Data Center Build or Operations. You will be able to demonstrate a successful track record
Ability to understand internal customer problem and provide technical solution in timely manner
Good interpersonal skills and ability to communicate efficiently with a diverse group of customers and staff
Experience providing client-facing direct customer support and service
Ability to work in a constantly evolving, hands-on, startup environment
Ways to stand out of the crowd:
Deep understanding of data center power and cooling infrastructure, of network and cabling infrastructure
Experience in Inventory Management and Excel tools
You're a self-starter with a demeanor for growth, continuous learning, and constantly looking to improve the team
Attention to detail with superb communication skills and the ability to optimally lead multiple priorities
Constantly look to improve the team and build strong business relationships
NVIDIA is widely considered to be one of the technology world’s most desirable employers. We have some of the most forward-thinking and hardworking people in the world working for us. If you're creative and autonomous, we want to hear from you!
The base salary range is 140,000 USD - 287,500 USD. Your base salary will be determined based on your location, experience, and the pay of employees in similar positions.
You will also be eligible for equity and
benefits
. NVIDIA accepts applications on an ongoing basis.
NVIDIA is committed to fostering a diverse work environment and proud to be an equal opportunity employer. As we highly value diversity in our current and future employees, we do not discriminate (including in our hiring and promotion practices) on the basis of race, religion, color, national origin, gender, gender expression, sexual orientation, age, marital status, veteran status, disability status or any other characteristic protected by law.",1993,Computer Hardware Development,$5 to $10 billion (USD),Information Technology,10000+ Employees,Company - Public,False
Electrical Engineer - Data Center - US REMOTE,"Jacobs
","Portland, OR",$78K - $118K (Glassdoor est.),4.0,"Our People & Places Solutions business – reinforces our drive to improve the lives of people everywhere and epitomizes the ""why"" of what we do – the tremendous positive impact and value our solutions bring to our communities and society as a whole. From facilities delivering life-saving therapies and ensuring clean water to enabling the connection of people through all modes of transportation and providing access to technology – we're integrating a multitude of these solution elements to build the smart environments of tomorrow.

Start your Jacobs career with a company that inspires and empowers you to deliver your best work so you can evolve, grow and succeed – today and into tomorrow.



Your Impact:


We share a common purpose – to make the world more connected and sustainable. And we’re excited about the innovative ways we can change the world. If you are also interested in turning abstract ideas into realities that transform the world for good, then Jacobs is where you belong. Build on your career with a company that inspires and empowers you to deliver your best work so you can evolve, grow and succeed – today and into tomorrow.

We are currently seeking an Electrical Engineering Professional to contribute to our ever-growing Data Center Organization. In this role, you'll focus on low and medium voltage electrical distribution systems primarily mission critical-related facilities which typically include large electrical and mechanical yards and major building MEP systems for data center cloud storage. You'll also provide electrical design services of systems in areas of power distribution, emergency back-up power including generators, lighting, fire alarm, life safety, communication, and security systems.

In collaboration with and under the mentorship of some of the industry's leading professional, you'll perform technical writing, provide design support in producing deliverables, construction drawings, calculations and specification production, shop drawing review, and respond to requests for information during construction.




Jacobs health and welfare benefits are designed to invest in you, and in the things you care about. Your health. Your well-being. Your security. Your future. Eligible employees and their dependents may elect medical, dental, vision, and basic life insurance. Employees are able to enroll in our company’s 401k plan, and if eligible, a deferred compensation plan, and Executive Deferral Plan. We have an unlimited U.S. Personalized Paid Time Off (PPTO) policy for eligible full-time exempt employees, seven paid holidays, one floating holiday, and caregiver leave. Hired applicants will be able to purchase discounted company stock and have the opportunity to receive a performance discretionary bonus. The base salary range for this position is $86,400 to $141;200. This range reflects the minimum and maximum target for new hire salaries for the position across all US locations [add if remote]. Within the range, individual pay is determined by work location and additional factors, including job-related skills, experience, and relevant education or training.

Here’s What You’ll Need:

Bachelor's Degree in Electrical Engineering (BSEE)
EIT Certification, or ability to obtain within a year
Ability to learn, adapt and work as a team
Excellent oral and written communication skills
Advanced Microsoft Office skills
BIM/CAD experience (REVIT)
Experience working for a MEP firm including experience designing medium-voltage distribution systems and emergency generation

Ideally, You'll Also Have:

Working knowledge of broad range of electrical systems is preferred, including power system design, fire alarm design, lighting design, load flow studies, communications design, grounding design and equipment selection
Some experience producing sizing calculations with minimal supervision is preferred
Familiarity with the NEC and NFPA 820





At Jacobs, we’re challenging today to reinvent tomorrow by solving the world’s most critical problems for thriving cities, resilient environments, mission-critical outcomes, operational advancement, scientific discovery and cutting-edge manufacturing, turning abstract ideas into realities that transform the world for good. With $15 billion in revenue and a talent force of more than 60,000, Jacobs provides a full spectrum of professional services including consulting, technical, scientific and project delivery for the government and private sector.",1947,Architectural & Engineering Services,$10+ billion (USD),"Construction, Repair & Maintenance Services",10000+ Employees,Company - Public,False
