Job Title,Company Name,Location,Salary Estimate,Rating,Job Description,Founded,Industry,Revenue,Sector,Size,Type,Easy Apply
DataOS Data Engineer,"HP
","Corvallis, OR",$86K - $124K (Glassdoor est.),4.1,"DataOS Data Engineer collaborating on cutting edge advances in scalable solutions for data ingestion, manipulation and end to end integration of data building blocks to support business driven data products.


Applies developed subject matter knowledge to solve common and complex business issues within established guidelines and recommends appropriate alternatives. Works on problems of diverse complexity and scope. May act as a team or project coach providing direction to team activities and facilitates information validation and team decision making process. Exercises judgment within generally defined policies and practices to identify and select a solution. Ability to handle most unique situations. May seek advice in order to support complex business issues.


Responsibilities

Designs and establishes secure and performant data architectures, enhancements, updates, and programming changes for portions and subsystems of data product pipelines, repositories or models for structured/unstructured data. Focusing on developing sharable libraries that reduce development time and maintenance,
Analyzes design and determines coding, programming, and integration activities required based on general objectives and knowledge of overall architecture of product or solution.
Writes and executes complete testing plans, protocols, and documentation for assigned portion of data system or component; identifies and debugs, and creates solutions for issues with code and integration into data system architecture.
Leads a project team of other data engineers to develop reliable, cost effective and high-quality solutions for assigned data system, model, or component.
Collaborates and communicates with project team regarding project progress and issue resolution. Supports co-development processes and tools to promote common approaches to solve complex problems.
Represents the data engineering team for all phases of larger and more-complex development projects.
Provides guidance and mentoring to less experienced staff members. Strong technical Leadership is required.


Knowledge & Skills

Using data engineering tools, languages (Python is a must. Java Scala is a plus), frameworks to mine, cleanse and explore Large Data Sets.
Fluent in SQL & Cloud based data systems. Relational data modeling.
Fluent in complex, distributed and massively parallel cloud systems (AWS, GCP, AZURE).
Strong analytical and problem-solving skills with ability to represent complex algorithms in software.
Designing data systems/solutions to manage complex data that are highly scalable and performant.
Ability to performance tune Spark code.
Strong understanding of database technologies and management systems.
Strong understanding of cloud-based systems/services. Differentiate benefits for big data Lake House vs. Warehouse.
Experience with workflow orchestration tools (Airflow, Jenkins)
Strong Notebooks environment experience (Jupyter, DataBricks)
Experience collecting requirements from Partners and choosing the right technologies to meet end to end data flow requirements that are required. (Data size, delivery times: hourly, daily monthly or real-time approaches)
Database architecture testing methodology, including execution of test plans, debugging, and testing scripts and tools.
Excellent written and verbal communication skills; mastery in English and local language.
Ability to effectively communicate product architectures, design proposals and negotiate options at management levels.

Scope & Impact

Collaborates with peers, junior engineers, data scientists and project team.
Typically interacts with high-level Individual Contributors, Managers and Program Teams.
Leads a project requiring data engineering solutions development.

Education & Experience

Bachelor's or Master's degree in Computer Science, Data Engineering, Information Systems, Engineering or equivalent.
Typically 4-6 years’ experience.


About HP


You’re out to reimagine and reinvent what’s possible—in your career as well as the world around you.
So are we. We love taking on tough challenges, disrupting the status quo, and creating what’s next. We’re in search of talented people who are inspired by big challenges, driven to learn and grow, and dedicated to making a meaningful difference.


HP is a technology company that operates in more than 170 countries around the world united in creating technology that makes life better for everyone, everywhere.


Our history: HP’s commitment to diversity, equity and inclusion – it's just who we are.
From the boardroom to factory floor, we create a culture where everyone is respected and where people can be themselves, while being a part of something bigger than themselves. We celebrate the notion that you can belong at HP and bring your authentic self to work each and every day. When you do that, you’re more innovative and that helps grow our bottom line. Come to HP and thrive!",1939,Computer Hardware Development,Unknown / Non-Applicable,Information Technology,10000+ Employees,Company - Public,False
Data Center Production Operations Engineer (University Grad),"Meta
","Prineville, OR",$67K - $99K (Employer est.),3.9,"Meta is seeking an entry level engineer to apply their technical skills in a fast-paced and complex environment. Having a working knowledge of server hardware and the desire to participate in projects at a large-scale data center is central to this role. This position will work to resolve and diagnose server issues at scale, escalate issues and work with engineering teams. Additionally, this role will work within the rack lifecycle processes with a focus on helping build out and enable cloud scale compute and storage environments. Solid communication skills are a requirement for this role. This person should enjoy working in a fast-paced environment where adaptability and flexibility will be key to their success. The successful candidate will be able to work independently and also within groups.



Data Center Production Operations Engineer (University Grad) Responsibilities:

Work within Meta's ticketing system in support of the health of Meta's server fleet
First point of contact for break fix technicians
Accountable for assisting with projects (new capacity as well as retrofits) and repairs throughout the data center
Understand and initial analysis to debug hardware, and Linux OS related issues
Demonstrate personal leadership Identifying and helping to create documentation for the global data center knowledge base
Assist with process improvements and best practices in data center operations
Participate in on-call rotation (once a month on call for a week after hours, first point of contact)




Minimum Qualifications:

Currently has, or is in the process of obtaining, an Associate’s, Bachelor's, or Master's degree in technical field, or equivalent experience/certification
Knowledge of Linux and server hardware repairs
Must obtain work authorization in the country of employment at the time of hire and maintain ongoing work authorization during employment
Experience in at least one of the following core areas: Networking, Programming/Scripting, Hardware and OS repair
Working conceptual knowledge of developing in Python, SQL, and/or shell scripting
Working conceptual knowledge of technologies such as HTTP, DNS, RAID, and DHCP






About Meta:

Meta builds technologies that help people connect, find communities, and grow businesses. When Facebook launched in 2004, it changed the way people connect. Apps like Messenger, Instagram and WhatsApp further empowered billions around the world. Now, Meta is moving beyond 2D screens toward immersive experiences like augmented and virtual reality to help build the next evolution in social technology. People who choose to build their careers by building with us at Meta help shape a future that will take us beyond what digital connection makes possible today—beyond the constraints of screens, the limits of distance, and even the rules of physics.



Meta is proud to be an Equal Employment Opportunity and Affirmative Action employer. We do not discriminate based upon race, religion, color, national origin, sex (including pregnancy, childbirth, or related medical conditions), sexual orientation, gender, gender identity, gender expression, transgender status, sexual stereotypes, age, status as a protected veteran, status as an individual with a disability, or other applicable legally protected characteristics. We also consider qualified applicants with criminal histories, consistent with applicable federal, state and local law. Meta participates in the E-Verify program in certain locations, as required by law. Please note that Meta may leverage artificial intelligence and machine learning technologies in connection with applications for employment.

Meta is committed to providing reasonable accommodations for candidates with disabilities in our recruiting process. If you need any assistance or accommodations due to a disability, please let us know at accommodations-ext@fb.com.",2004,Internet & Web Services,$10+ billion (USD),Information Technology,10000+ Employees,Company - Public,False
Data Engineer,"Nike
","Beaverton, OR",$94K - $134K (Glassdoor est.),4.2,"Become a Part of the NIKE, Inc. Team

NIKE, Inc. does more than outfit the world's best athletes. It is a place to explore potential, obliterate boundaries and push out the edges of what can be. The company looks for people who can grow, think, dream and create. Its culture thrives by embracing diversity and rewarding imagination. The brand seeks achievers, leaders and visionaries. At NIKE, Inc. it's about each person bringing skills and passion to a challenging and constantly evolving game.

Data Engineer-NIKE, Inc., Beaverton, OR. Design and implement features in collaboration with product owners, data analysts, and business partners using Agile / Scrum methodology; contribute to overall architecture, frameworks and patterns for processing and storing large data volumes; design and implement distributed data processing pipelines using tools and languages prevalent in the Hadoop or Cloud ecosystems; build utilities, user defined functions, and frameworks to better enable data flow patterns; build and develop job orchestration and scheduling using Airflow; research, evaluate and utilize new technologies/tools/frameworks centered around high-volume data processing; define and apply appropriate data acquisition and consumption strategies for given technical scenarios; build and incorporate automated unit tests and participate in integration testing efforts; work with architecture/engineering leads and other teams to ensure quality solutions are implemented, and engineering best practices are defined and adhered to; and work across teams to resolve operational and performance issues. Telecommuting is available from anywhere in the U.S., except from AK, AL, AR, DE, HI, IA, ID, IN, KS, KY, LA, MT, ND, NE, NH, NM, NV, OH, OK, RI, SD, VT, WV, and WY.

Employer will accept a Master's degree in Computer Science, Computer Information Systems, or Electronics and Communications and 1 year of experience in the job offered or a data engineering related occupation.

Experience must include:

Python and Scala;
Big Data Frameworks such as Hadoop, Hive, Spark, and Databricks;
SQL and PLSQL;
Scripting skills such as Unix;
Databases such as Oracle, SQL Server, Teradata, and Snowflake;
AWS Tools including EMR, S3, and Kinesis;
Analytics Tools such as New Relic, and Tableau;
Streaming Frameworks such as Kafka and Spark Streaming;
Workflow orchestration tools including Airflow, and Autosys;
No SQL Databases such as HBASE, and Cassandra;
Source Control Software such as Github; and
CI/CD tools such as Jenkins.

#LI-DNI

NIKE, Inc. is a growth company that looks for team members to grow with it. Nike offers a generous total rewards package, casual work environment, a diverse and inclusive culture, and an electric atmosphere for professional development. No matter the location, or the role, every Nike employee shares one galvanizing mission: To bring inspiration and innovation to every athlete* in the world.

NIKE, Inc. is committed to employing a diverse workforce. Qualified applicants will receive consideration without regard to race, color, religion, sex, national origin, age, sexual orientation, gender identity, gender expression, veteran status, or disability.

How We Hire

At NIKE, Inc. we promise to provide a premium, inclusive, compelling and authentic candidate experience. Delivering on this promise means we allow you to be at your best - and to do that, you need to understand how the hiring process works. Transparency is key.


This overview explains our hiring process for corporate roles. Note there may be different hiring steps involved for non-corporate roles.

Benefits

Whether it's transportation or financial health, we continually invest in our employees to help them achieve greatness - inside and outside of work. All who work here should be able to realize their full potential.",1972,Consumer Product Manufacturing,$10+ billion (USD),Manufacturing,10000+ Employees,Company - Public,False
"Data Engineer, Data Analytics & Automation - US Remote","Siemens Digital Industries Software
","Wilsonville, OR",$93K - $168K (Employer est.),4.2,"At Siemens Digital Industries Software, we're seeking a skilled Data Engineer to join our dynamic Marketing Data Analytics & Automation team (DAA) to impower data driven insights!

Position Summary:

We are looking for a Data Engineer to join us in our journey to enable impactful data insights and shape the future of data-driven decision-making. Your expertise will be a pivotal asset in our mission.

As a Data Engineer, you'll take on the vital task of architecting, constructing, and nurturing our data infrastructure. Your work will empower seamless data collection, storage, and processing.

You will:

You will be a key contributor to the success of our SaaS (Software As A Service) Transformation across all of Siemens Digital Industries
You will ensure that our data pipelines and systems remain dependable, secure, and available.
You will work collaboratively with cross-functional teams
You will empower our organization to glean significant insights and make well-informed decisions based on data.
You will be crafting, nurturing, and administering ELT and Event Streaming pipelines that efficiently replicate data from both cloud and on-premises sources to our Snowflake analytics database.

You are a good fit for this role if you:

A Bachelor of Science Degree in Computer Science, engineering, or similar disciplines.
5+ years of experience as a Data Engineer, or similar role with focus on providing enterprise level data pipelines from various sources for analyzing
Profound expertise in SQL, enabling you to navigate data with ease.
Proficient in programming languages like Python, Javascript, or their equivalents, used for data processing.
Skilled in loading data into Snowflake utilizing tools like Snowpipe or equivalents.
Adeptness in employing DBT in tandem with Snowflake for seamless data transformation.
Command of scheduling and orchestration tools such as Airflow, streamlining operational efficiency.
Experience in AWS EC2 storage and the development of AWS Lambda functions.
Hands-on familiarity with versioning, continuous integration, and platforms like Github and GitLab.
Exposure to Stream Processing platforms like Apache Kafka, Confluent, or Amazon Kinesis, enhancing your data-handling capabilities.
Experience in SaaS (Software as a Service) environment a plus

The salary range for this position is $93,400 to $168,100 and this role is eligible to earn incentive compensation. The actual compensation offered is based on the successful candidate’s work location as well as additional factors, including job-related skills, experience, and relevant education/training.Siemens offers a variety of health and wellness benefits to employees. Details regarding our benefits can be found here: www.benefitsquickstart.com. In addition, this position is eligible for time off in accordance with Company policies, including paid sick leave, paid parental leave, PTO (for non-exempt employees) or non-accrued flexible vacation (for exempt employees).

\#LI-REMOTE

\#SWSAAS

\#LI-JJ1

Equal Employment Opportunity Statement

Siemens is an Equal Opportunity and Affirmative Action Employer encouraging diversity in the workplace. All qualified applicants will receive consideration for employment without regard to their race, color, creed, religion, national origin, citizenship status, ancestry, sex, age, physical or mental disability unrelated to ability, marital status, family responsibilities, pregnancy, genetic information, sexual orientation, gender expression, gender identity, transgender, sex stereotyping, order of protection status, protected veteran or military status, or an unfavorable discharge from military service, and other categories protected by federal, state or local law.

EEO is the Law

Applicants and employees are protected under Federal law from discrimination. To learn more, Click here.

Pay Transparency Non-Discrimination Provision

Siemens follows Executive Order 11246, including the Pay Transparency Nondiscrimination Provision. To learn more, Click here.

California Privacy Notice

California residents have the right to receive additional notices about their personal information. To learn more, click here.

Job Family: Strategy

Req ID: 384277",2004,Software Development,$10+ billion (USD),Information Technology,5001 to 10000 Employees,Subsidiary or Business Segment,False
Data Engineer/Data Lead and Developer,"NW Natural
","Portland, OR",$83K - $122K (Glassdoor est.),3.8,"Non-Union Position
Portland, Oregon (US-OR)
Regular FT
Posting # 4629

About Us:
At NW Natural, we offer more than rewarding career opportunities and a vibrant, inclusive work culture. We invite you to join us in providing safe and reliable utility services and renewable energy to better the lives of the communities we serve. Our vision is to be the leader in service excellence, innovation and environmental stewardship for our customers, while building on our strengths as a trusted energy provider and environmental leader for our industry.

In addition to environmental stewardship, We’re also deeply committed to Diversity, Equity and Inclusion at NW Natural. Our DEI Council started 21 years ago, and today we continue to foster a culture where all employees can experience a sense of belonging, shared purpose and possibility.
Northwest Natural Gas Company d/b/a NW Natural
Data Engineer/Data Lead and Developer in Portland, Oregon

Job Duties: Responsible for Cloud Data Integrations within Enterprise Data Platform (EDP). Translate complex enterprise logic into metadata and data quality rule sets. Design, develop, and test pipelines between source and target systems. Oversee technical administration of the Data Acquisition and Enterprise Data landscape and data migration into the Data Access layer. Design consistent and effective data models through utilization of appropriate BI tools and application of best practices and standards. Design, develop, and test ETL solutions for initial and CDC based on functional requirements. Create and maintain documentation of processes, pipelines, applications, and procedures as per department policy. Create and deliver training and documentation for solutions. Partner with business users across the company to understand business needs and gather business requirements. Partner with other team members to ensure that data warehouse models support analytic needs and reporting requirements of the business. Provide off hours support for the Enterprise Data Platform. Support Company’s commitment to a culture of safe work practices. Liaise between business users across the company and the IT&S BIDBA team.

Minimum Requirements: Bachelor’s degree in Computer Science, or related field or equivalent in education, training and experience, plus 3 years of experience as a Data Engineer, Delivery Lead, Lead Developer, Programmer/Analyst, or related position, including experience in the following:

3 years of experience working in Informatica Intelligent Cloud Services (IICS) with Informatica connectors for cloud-based and on-premises systems.
3 years of experience performing database modeling.
3 years of experience with data warehouse ETL tools, such as Informatica, Azure Data Factory, SSIS, stored procedures.
3 years of experience analyzing business objectives and requirements.
3 years of experience utilizing python, Azure Data Lake, Azure SQL DB, and JSON files,
2 years of experience with databases, Business Intelligence development and performing data transformations.

Must pass pre-employment drug test and background check.
All education, experience, and training may be gained concurrently. Applicants must be U.S. workers (includes U.S. citizens, permanent residents, foreign nationals granted temporary residence under one of the 1986 legalization programs, refugees, and asylees). To be considered for this position, submit a complete electronic application including cover letter and resume for Job# 4629via our website at . Resumes submitted via email, fax or mail will not be accepted in lieu of an electronic application.

What we offer:
Health & Wellness –
Rich health insurance benefits with competitive employer contribution
Free access to an online wellness resources platform

Work Life Balance -
Up to 23 Vacation Days
80 Hours of Sick Time
10 paid holidays and 3 floating holidays
Flexible work arrangements
3 weeks paid parental leave
Green Team / Diversity, Equity & Inclusion Council / Safety Team / Women’s Network and many other Employee Resource Groups
1500 sq foot exercise facility and secure bike room

Financial -
Meaningful annual incentive bonus opportunity in addition to base salary
Competitive 401K company contribution and match
15% discount on NW Natural stock through Employee Stock Purchase Program
Up to $5250 a year in tuition reimbursement
Wellness incentive program

Discounts -
20% off natural gas service
Up to 30% discount at NW Natural Appliance Center
TriMet Pass for all HQ employees
Generous discounts with Verizon & AT&T Wireless

Disclosure: We are a drug free workplace and we comply with Federal Drug Free Workplace Act and Department of Transportation regulations. Pre-employment drug tests are part of the hiring process and apply to all positions.

NW Natural is proud to be an equal opportunity employer. We welcome and embrace our candidates’ diversity and take affirmative action to employ and advance individuals without discrimination on the basis of race, color, sex, gender identity or expression, sexual orientation, religion, age, physical or mental disability, veteran status, pregnancy (including childbirth or related medical conditions), national origin, marital status, genetic information, and all other legally protected characteristics. We forbid discrimination and harassment in the workplace based on any protected status or characteristic. A criminal history is not an automatic bar to employment with NW Natural. Instead, we make individualized assessments regarding qualifications and backgrounds. NW Natural is also committed to providing reasonable accommodations for individuals with disabilities, individuals with sincerely held religious beliefs, and disabled veterans in our job application procedures. If you need assistance or an accommodation as part of the application process, please contact us at employment@nwnatural.com or (971) 979-6341.

NW Natural does not accept unsolicited submissions or assistance from search firms for posted positions. Resumes submitted by search firms working under a valid and current written contract with NW Natural valid written Statement of Work in place for this position from NW Natural HR/Employment will be deemed the sole property of NW Natural. No fee will be paid in the event the candidate is hired by NW Natural as a result of the referral or through other means.",1859,Energy & Utilities,Unknown / Non-Applicable,"Energy, Mining & Utilities",1001 to 5000 Employees,Company - Public,False
