Job Title,Company Name,Location,Salary Estimate,Rating,Job Description,Founded,Industry,Revenue,Sector,Size,Type,Easy Apply
Operations and Data Analytics Engineer,"ARES Corporation
","Merritt Island, FL",$59K - $80K (Glassdoor est.),3.9,"Kennedy Space Center (KSC) is preparing to launch Artemis to the Moon, and ARES is looking for talented people to help us get there. The rocket boosters will be delivered to KSC this year and Orion will be accepted shortly thereafter as the Artemis vehicle is built and prepared for launch to send astronauts to the moon. A key function in achieving this success is data analytics. ARES data analysts develop models, run simulations, and provide meaningful reporting and visualizations in support of the complex decision making associated with Artemis.

If you are an entry to mid-level career professional with data analysis skills, and 0-9 years of relevant experience, we hope you will consider this unique opportunity to be a part of the Artemis lunar mission.


Expectations

Candidate has experience in data analytics and has the ability to support EGS in providing simulation modeling and analysis, math modeling, data visualization and additional analysis products, as needed, in support of the Artemis Mission.
Candidate can support full time onsite position at KSC. At this time and for the foreseeable future, the onsite requirement is Tuesday through Thursday, with teleworking approved for Monday and Friday.
Candidate has excellent interpersonal skills with the ability to work in a team environment co-located with multiple cross program customers and contractors.
Candidate is flexible to changing work demands, schedule pressure, multi-tasking, operating with minimal direct supervision, and meeting all customer deadlines.
Candidate is a self-starter with outstanding organizational, analytical, and problem-solving skills.
Candidate is an effective and clear communicator with the ability to present technical issues to both technical and non-technical personnel.


Minimum Requirements

Demonstrated experience with developing analytical models and performing simulations to inform critical decisions.
Demonstrated experience with data visualization software (e.g., Tableau, Power BI, or other) to integrate, analyze and report data.
Demonstrated Launch flow processing experience preferred.
Proficiency in Microsoft Office Word, Excel, PowerPoint, Project, and Outlook, as well as commercial data analysis tools.


Education and Relevant Work Experience

Bachelor of Science in Engineering, Operations Research, Mathematics, Statistics, or other physical science.
Demonstrated engineering, mathematical/computational analysis, or Operations Research experience.
Engineer 1: 0 - 4 years of relevant work experience.
Engineer 2: 4 – 9 years of relevant work experience.


ARES offers a competitive compensation and benefit package. Full time employees may participate in:

Medical Insurance
Dental Insurance
Vision Insurance
HSA/FSA Accounts
Life & Disability Insurance
Critical Illness & Accident Insurance
401(k) Plan
Paid Time Off & Holidays

ARES is an EEO/AA/Disability/Vets Employer and complies with E-Verify.

ARES shall abide by the requirements of 41 CFR 60-1.4(a), 60-300.5(a) and 60-741.5(a). These regulations prohibit discrimination against qualified individuals based on their status as protected veterans or individuals with disabilities, and prohibit discrimination against all individuals based on their race, color, religion, sex, sexual orientation, gender identity or national origin. Moreover, these regulations require that covered prime contractors and subcontractors take affirmative action to employ and advance in employment individuals without regard to race, color, religion, sexual orientation, gender identity, national origin, disability or veteran status.",1992,Aerospace & Defense,$100 to $500 million (USD),Aerospace & Defense,501 to 1000 Employees,Company - Private,True
Sr Data Engineer,"Voloridge Investment Management
","Jupiter, FL",$100K - $144K (Glassdoor est.),4.6,"At Voloridge Investment Management our quantitative systems are deeply dependent on vast quantities of data. The Senior Data Engineer must understand the many different and evolving use cases for data at Voloridge and design systems that supply high-performance datasets for advanced analytics. In this role the Sr. Data Engineer / Architect will provide mentorship and impart experience to the data engineering team.

Summary of Job Functions

Collaborate effectively with Stakeholders, Project Managers, Software Engineers, Data Analysts, QA Analysts, DBAs, and Data Engineers
Build and maintain data pipelines based on functional and non-functional requirements
Proactively seek out information and overcome obstacles to deliver projects efficiently
Ensure that data pipelines incorporate best practices related to performance, scaling, extensibility, fault tolerance, instrumentation, and maintainability
Ensure that data pipelines are kept simple and not overly engineered
Produce and maintain design and operational documentation
Analyze complex data problems and engineer elegant solutions
Stay abreast of emerging technologies and make relevant recommendations
Upgrade existing data models and pipelines leveraging newer features and techniques
Work in a Kanban environment
Mentor less experienced data engineers
Participate in engineering standards and best practices evolution
Participate in an on-call rotation
Lead investigations to troubleshoot pipeline issues

Minimum Requirements

10+ years with hands-on data engineering and deep knowledge of data architecture fundamentals including:
Extensive experience building ETL/ELT pipelines from a variety of data sources
Broad experience with SQL Server 2019+, including advanced SQL Server features such as Table Partitioning, Columnstore
Deep knowledge and measurable experience in performance tuning TSQL, execution plan analysis blocking/deadlock analysis and index optimization
Extensive experience using SSMS to create and maintain SQL Server tables, views, functions, stored procedures, and user-defined table types
Comprehensive experience with data modeling indexes, Temporal tables, CLR, and Service Broker
Deep understanding of the development of data pipelines with either SSIS or Python and building data pipelines using multiple external data sources and transport mechanisms
Strong initiative, collaboration, accountability, impartiality, and communication
Strong analytical skills, a real passion for working with data and strong interest in solving data problems
Strong track record for judging core requirements and meeting deadlines
Experience managing master data
Experience writing C#, PowerShell, and Python
Experience with Git source control integration with SSMS
Experience working in a Kanban SDLC and a strong understanding of traditional Kanban SDLC workflows
Experience with deploying changes through segregated Development, QA, UAT and Production SDLC stages
Experience owning mission-critical processes
Bachelor’s degree in Computer Science, Information Systems, or related disciplines
Ability to work onsite in our Jupiter, FL office

Preferred Skills and Previous Experience

Python programming using libraries such as Pandas, Numpy, csv, Traceback, JSON, PyODBC, Math
Experience with source code branching and pull requests / code reviews
Experience with AWS
Experience working with trading / financial / investment / accounting data
Experience with tools such as Red Gate, Grafana, OpsGenie and JAMS
Experience with MPP databases such as Greenplum
MS/PhD in Computer Science, Information Systems, or related disciplines

Compensation and Benefits

Highly competitive base salary
Profit sharing bonus
Health, dental, vision, life, and disability insurance
401K

Additional Information

Voloridge Investment Management is an SEC registered investment advisor. A private investment company founded in 2009, our mission is to deliver superior risk-adjusted returns for qualified investors, using advanced proprietary modeling technology, conservative investment tactics and sophisticated risk management.

Voloridge Investment Management is an Equal Opportunity Employer. All qualified applicants are encouraged to apply and will receive consideration for employment without regard to race, color, religion, sex, sexual orientation, gender identity, national origin, disability, protected veteran status, or any other legally protected characteristic or status.",2009,Investment & Asset Management,Unknown / Non-Applicable,Financial Services,51 to 200 Employees,Company - Private,False
Data Engineer II,"Boar's Head
","Sarasota, FL",$89K - $130K (Glassdoor est.),3.8,"Hiring Company:
Delicatessen Services Co., LLC
Overview:
A Boar’s Head Data Engineer II is a key analytical resource that is part of the Enterprise Applications team and is driven to identify, define, develop, and deliver innovative solutions that are in alignment with the organization's goals. As a Data Engineer II, you will enhance operations for analytics, reporting, applications, and data science by gathering and processing raw data at scale. Your focus will be on maintaining scalable, reliable, consistent, and repeatable systems that efficiently provide data for company-wide analytics and operations. A Data Engineer II must be self-directed and comfortable supporting the data needs of multiple teams, systems, and products.

The primary focus of the Data Engineer II role is centered on the development and support of the Boar’s Head Analytics Data Warehouse and associated technologies. Areas of focus and responsibilities include:

Create and maintain optimal data pipelines using current Boar’s Head streaming technologies (Kafka, Flink and Clickhouse)
Assisting with the designing, building, and maintaining of the infrastructure to support data storage, processing, and retrieval.
Assemble large, complex data sets that meet functional / non-functional business requirements.
Identify, design, and implement internal process improvements: automating manual processes, optimizing data delivery, re-designing infrastructure for greater scalability, etc.
Assist business analytics teams with analytics tools (Tableau) that utilize the data pipeline to provide actionable insights into customer acquisition, operational efficiency, and other key business performance metrics.
Work with stakeholders (Business and IT teams) to assist with data-related technical issues and support the data quality and infrastructure needs of the organization.
Support Business analytics teams by ensuring the availability of data and tools necessary to support organizational data analytics projects.
Work with data and analytics experts to strive for greater functionality in our data systems.
Job Description:
Essential Duties and Responsibilities
General Duties
Understands how to use technology to competitive advantage and to solve business issues – focusing on data streaming and analytics concepts and business-level functionality.
Work with stakeholders including the Executive, Product, Data, and Design teams to assist with data-related technical issues and support their data infrastructure needs.
Develops and maintains a thorough understanding of business operations, identifying opportunities for operational efficiency through automation and effective utilization of reporting & and analytics tools critical for all business areas (e.g., Marketing, Sales, Distribution, Manufacturing, Finance, Human Resources).
Assists in technical delivery management and relationship management in identifying options for potential solutions and assessing them for both technical and business suitability.
Partners with knowledge management leads within Boar’s Head to ensure and maintain consistency on Standard Operating Procedures and formal Work Instructions that outline use of Data Governance and Analytics applications.
Work with data and analytics experts to strive for greater functionality in our data systems.
Supports roll outs of new and expanding applications/processes/projects.
Specific Duties
Create and maintain optimal data pipelines using current Boar’s Head streaming technologies (Kafka, Flink and Clickhouse)
Assemble large, complex data sets that meet functional / non-functional business requirements.
Identify, design, and implement internal process improvements: automating manual processes, optimizing data delivery, re-designing infrastructure for greater scalability, etc.
Build the infrastructure required for optimal extraction, transformation, and loading of data from a wide variety of data sources using SQL and AWS ‘big data’ technologies.
Build analytics tools that utilize the data pipeline to provide actionable insights into customer acquisition, operational efficiency, and other key business performance metrics.
Adept at outlining the current state and designing conceptual/future state visual process level diagramming and documentation (in Visio and other more advanced visual modeling tools) that help articulate options to reduce costs, improve efficiencies, and effectiveness, and streamline execution while keeping quality norms in alignment.
Identifies, documents, and communicates current state of business process, partnering with Technical Delivery Managers, Data Engineers, and Developers to recommend future state options.
Provides process documentation (to include interaction points with other systems and/or applications).
Fosters understanding of software functions and limitations, usage scenarios, outlines error handling (system/human interaction points) and expected /necessary quantitative measures for success (e.g., expected performance targets, specific percentages for quality improvements)
Develops and executes thorough data validation unit and functional test plans to ensure data accuracy and integrity throughout data streams to the data warehouse.
Partners with QA teams in end-to-end systems testing and coordination of user acceptance testing strategy development and validation.
Project Management Support
Assists Technical Delivery Manager(s) in business strategy analysis and enhancement demand management and assists Project Manager (PM) in refining project plans/objectives for items responsible for delivering and executing according to best practice methodologies and IT process standards.
Assesses project requirements and works with PMs, resource managers, and others delegated as PMs to assess level of effort estimates.
Partners with the project manager to define change requests for missed requirements and scope change, helping maintain the right focus on defined project constraints (schedule, resources, and scope/quality).
Experience with Atlassian project management tools (JIRA, Confluence) is a significant plus
Communication
Demonstrates strong oral communication skills, including the ability to effectively interact with business partners and internal team members.
Demonstrates strong written communication skills, including the ability to produce clear and concise technical documentation.
Communicates technical concepts and issues to non-technical people.
Interacts with all levels of the company with patience, courtesy, diplomacy, and professionalism
Education and Experience
A Bachelor's degree in computer science, software engineering, information technology, or a related field.
A minimum of 4 years of experience in a Data Engineer (or equivalent) role to be considered; to include experience with data streaming, data wrangling, data modeling, and/or data analytics.
Technology and Desired Skills –
Experience and/or knowledge of Data Streaming technologies
Apache Kafka (or equivalent)
Apache Flink (or equivalent)
Clickhouse Columnar Databases (plus)
Experience with a variety of coding languages such as SQL, Python and/or R. Java Programming and SQL experience is necessary.
Experience with data integrity and validation techniques
Experience with Oracle EBS is a plus
Knowledge of Tableau (or equivalent) analytics tool is a plus
Ability to articulate business and technology needs/constraints to IT members and end users alike.
Self-starter, motivated, and having a proactive and strategic mindset are a must.
Strong written and verbal communication skills
Strong collaboration and coalition-building skills
Hands-on experience and proficiency with the full Microsoft Office Suite, Microsoft Visio, and SmartDraw is a plus.
Physical Demands & Work Environment
This position requires working in an office environment.
Occasional travel may be required.
This is primarily a first shift position but adjustments to shift start/end times may be required depending on future production support schedules.
Availability for on-call during non-business hours is required.
After-hours and weekend work is intermittently required for system troubleshooting, maintenance, and upgrades.
Location:
Sarasota, FL
Time Type:
Full time
Department:
Management Information Systems",1905,Food & Beverage Manufacturing,$500 million to $1 billion (USD),Manufacturing,1001 to 5000 Employees,Company - Private,False
DATA PLATFORM ENGINEER,"Swisher International
","Miami, FL",-1,3.8,"Swisher is a leading lifestyle brand for adult consumers headquartered in Jacksonville, Florida. Our superior customer relationships, innovative thinking, and action have driven the company to grow and adapt for 160 years. The legendary company we are today is a result of our unrelenting drive to shape the experiences of tomorrow.

As we shape the future, we are looking for people to continue to build on our history of pushing boundaries, shattering expectations, and evolving to solidify connections with adult consumers. In pursuing our mission, we require a passionate team of diverse backgrounds, viewpoints, and ideas. Our strong brand heritage provides our employees with challenging and rewarding careers, along with real growth opportunities.

Position Overview
As the Data Platform Engineer, you will be responsible for designing, building, testing, and maintaining cloud-native data pipelines to support various analytics algorithms. You will optimize systems for data collection, storage, access, and analytics. You will create data pipelines that convert raw data into formats that are available and accessible to stakeholders.

The Role



Develop and maintain databases by acquiring data from primary and secondary sources and build scripts that will make our data evaluation process more flexible or scalable across data sets.
Design, build, and manage data pipelines to support data and analytics needs in the organization.
Implement data warehousing solutions using a range of methodologies including – but not limited to – Inmon, Kimball, and Medallion methodologies.
Utilize Azure Databricks and Azure Synapse to manage and transform data
Utilize SQL databases, understanding the best cases for their use and how to optimize performance.
Facilitate the inclusion of multiple disparate data sources located in the data platform/data warehouse into the overall reporting framework.
Collaborate with Principal Solutions Architects to ensure the data platform design/process is optimally aligned with overall architecture to enhance the ‘end-user experience.’
Collaborate on project teams, systems and data analysis, design, development, integration, and enhancement activities, as well as related maintenance and more complex production support
Assist in the development of project scopes for multiple complex projects in collaboration with the project team and serves as a project point of contact when necessary
Provide architectural ownership, governance control, and solution management across all reporting initiatives.

The Experience Needed



5 Years experience as a Data Engineer or similar role.
Experience designing, building, and maintaining efficient, reusable, and reliable data marts using Microsoft SQL Server and Azure.
Experience with data and analytics experts to strive for greater functionality in our data systems.
Experience developing and implementing data standards, protocols, and procedures for effective data management and quality.
Experience monitoring data performance and modifying infrastructure requirements
Experience with data pipeline and workflow management tools
Ability to build effective partnerships with coworkers and coordinate overall efforts to contribute to the team, department, and organizational objectives
Knowledge of understanding and implementing security and data privacy settings and standards
Ability to optimize data delivery and re-design infrastructure for greater scalability
Ability to with data scientists and architects on multiple, concurrent projects
Strong analytical skills and problem-solving aptitude
High School diploma or equivalent
Must be located in the US and able to travel to corporate office quarterly

The Preferred Experience

Bachelor's Degree required in Computer Science, Information Systems, or related field
Working industry experience with Big Data systems and projects
Experience in building large-scale distributed systems in a product environment
Experience in writing, analyzing, and debugging SQL queries
Experience in data privacy and security-related projects
Certification in one or more of the following:
Generative AI,
Project Leadership &
IT Strategy
Data Engineering Foundations
Statistics Foundations

What we offer

Great benefits package, including a full suite of health benefits, a generous 401(k) Plan, paid parental leave, a strong rewards and recognition program, and a focus on mental health and well-being.
An inclusive environment with Employee Resource Groups to join and volunteer opportunities.
A Hybrid work schedule.
Professional growth and development programs to help advance your career.
Challenging environment with big goals and the opportunity to make a significant impact.



#MON",1861,Consumer Product Manufacturing,$1 to $5 billion (USD),Manufacturing,501 to 1000 Employees,Company - Private,False
Data Management Engineer/SAS Developer,"FCCI Insurance
","Sarasota, FL",$73K - $101K (Glassdoor est.),3.9,"As an FCCI Systems Developer/Data Engineer, you will have the opportunity to work with a great team providing data security, retention and governance across our IT platform. Produce secured, documented, high quality applications software in support of FCCI’s various business needs. Support the Data Warehouse ETL, BI reporting, data analytics and financial applications utilizing available & emerging technologies, (such as our current SAS & Cognos applications). This role will configure applications to meet NAIC model security regulations for data retention and anonymization, as well as supporting our migration to data lakes/lakehouse. Working in an Agile development environment, you will enjoy collaborating with our business & technical leaders using your leadership, business intelligence, data warehouse and system development skills.

A commitment to collaborative problem solving, sophisticated design, and delivering a quality product is essential. As part of our collaborative culture, the selected individual will provide on call support on a rotational basis to applications as necessary. This position will be located in one of the following: Sarasota, FL corporate office campus, Lake Mary, FL, Lawrenceville, GA, or our Richardson, TX office. FCCI provides the opportunity to work a hybrid work schedule of 3 days in the office and 2 days remote.

In exchange for your talents, FCCI offers competitive salaries and an excellent benefits package.

FCCI values the contributions of a diverse workforce.

We're committed to being fair and equitable to all employees and applicants for employment. FCCI prohibits discrimination on the basis of race, color, sex, age, marital status, religion, national origin, sexual orientation, handicap, disability and other legally protected classifications.

Please apply via our website at www.fcci-group.com.




Qualifications

Experience

Required

* Bachelors or better in Computer Science or related field.
* Two or more years of experience enhancing and supporting the Data Warehouse batch processing using SAS (as well as SAS EG, SAS Macros and SQL programming language.
* Two or more years working on ETL & BI reporting
* Advanced understanding of Data Warehousing concepts & governance, how data processes through systems from internal and external sources.
* Experience working within an Agile methodologies environment

Preferred

* Cognos experience and Solix Data Management is a plus",1959,Insurance Carriers,$500 million to $1 billion (USD),Insurance,501 to 1000 Employees,Company - Private,False
