Job Title,Company Name,Location,Salary Estimate,Rating,Job Description,Founded,Industry,Revenue,Sector,Size,Type,Easy Apply
Sr Streaming Data Engineer,"Discount Tire
","Scottsdale, AZ",$87K - $117K (Glassdoor est.),3.9,"Overview:
Here at Discount Tire, we celebrate the spirit of our people with extraordinary pride and enthusiasm. Our business has been growing for more than 60 years and now is the best time in our history to join us. We recognize that to remain the industry leader we must continue to grow and evolve our business in a rapidly changing industry. We are achieving this, not only by opening new stores, but by transforming our technological landscape and making data a central component of our strategy. The Business Analytics team, one of the fastest growing teams in the company, is leading this change. We are responsible for driving the insights, recommendations, and developing the decision support tools that influence the strategic direction of the company.


Under minimal supervision, the Analytics Senior Streaming Data Engineer provides hands-on technical expertise in designing, building, and implementing analytics solutions that support scalable data solutions in a real-time environment. This role is essential to drive the company's data initiatives, ensuring the successful design and execution of high-performing and robust streaming data systems.

Essential Duties and Responsibilities:
Drives Discount Tire’s real time analytics to support operational insights and decision-making leveraging established engineering disciplines.
Collaborate with source data owners, data engineers, data scientists, and other stakeholders to implement high-velocity data pipelines.
Work with other product team(s) to define data dictionary, data lineage and relationship metrics.
Contributes to the strategic direction and decision making related to Data Warehousing, Big Data and Data analytics in close collaboration with Technical Leadership.
Designs and develops high performance distributed data warehouse, distributed analytic systems and cloud architecture.
Develops, launches and maintains efficient and fault tolerant, batch and streaming, data pipelines (ETL/ELT) to populate databases and object stores from multiple disparate data sources.
Develops complex data calculations through data integration tools and scripting languages.
Designs and implements data quality metrics, standards, guidelines; automates data quality checks / routines as part of data processing frameworks; validates flow of information.
Determines Data Warehousing and Big Data infrastructure needs, including but not limited to, automation of system builds, security requirements, performance requirements and logging/monitoring in collaboration with DevOps engineers.
Troubleshoots complex data and performance related issues; implements adjustments, documents root cause and corrective measure; transfers knowledge to operations support team.
Documents standards, best practices and technical specifications. Facilitates in design and code review sessions and provides feedback and mentorship to peers.
Provides technical assistance to junior data engineers.
Collaborates with broader analytics team and internal IT partners.
Assists employees, vendors or other customers by answering questions related to Data Warehousing and Big Data processes, procedures and services.
Participates in the development of complex cross application architectures in collaboration with cross functional teams.
Implement advanced analytics and data science models and automates complex analysis at scale.
Stays current on the latest industry technologies, trends and strategies.
Completes work in a timely and accurate manner while providing exceptional customer service.
Provides Tier 3 support and create run books to mentor Tier 1 and Tier 2 support staff.
Other duties as assigned.

Qualifications:
This position requires a minimum of five years of progressive streaming data development and integration experience.
Proven understanding of logical and physical data modeling is imperative.
Ability to translate a logical data model into a relational or non-relational solution is necessary.
Understanding of multiple relational (RDMS) and non-relational (NoSQL) data platforms is needed.
Expert level SQL experience is required. Advanced scripting knowledge with SQL, Python, Java or R is necessary.
Advanced experience in SQL tuning, indexing, distribution, partitioning, data access patterns and scaling strategies is needed.
Hands-on / in-depth experience in the following tools, technologies & Concepts such as: SQL (advanced level), Apache Kafka, Apache Flink, Kinesis Data Analytics or related streaming technologies.
Expert experience with data integrations and data processing for business intelligence and analytics workloads is required.
Advanced experience with AWS S3 or other distributed object stores, MPP Data Warehousing, (e.g. AWS Redshift), Elastic MapReduce a plus.
Hands-on experience in database development using views, SQL scripts and transformations is needed.
Proficient with Microsoft office, including skills with Word and Excel, is necessary.
Experience working with large complex data sets.
Understanding of Software Development Life Cycle (SDLC) methodologies such as Agile and Waterfall is needed.
Proven analytical problem solving and decision making skills is critical.
Proven ability to communicate across all levels of the organization is necessary; must be able to clearly articulate technical ideas to a non-technical audience both verbally and in writing.
Ability to work independently and in a team is vital.
Customer service skills including the ability to manage and respond to different customer situations while maintaining a positive and friendly attitude is essential.
The ability to multi-task, and manage multiple projects to meet various deadlines simultaneously is required.
The ability to work efficiently and accurately under pressure, meet deadlines and present a professional demeanor is essential.
In addition troubleshooting and organizational skills with a can-do attitude and the ability to adjust to changing requirements are essential.
Educational Requirements:
This position requires a Bachelors Degree in Computer Science, Computer Information Systems or related or equivalent experience.
Data or cloud related certifications are a plus.

Discount Tire provides equal employment opportunities to all employees and applicants for employment and prohibits discrimination and harassment of any type without regard to race, color, religion, age, sex, national origin, disability status, genetics, protected veteran status, sexual orientation, gender identity or expression, or any other characteristic protected by federal, state, or local law.

#LI-GW1
#LI-Hybrid",1960,Automotive Parts & Accessories Stores,$1 to $5 billion (USD),Retail & Wholesale,10000+ Employees,Company - Private,False
Data Integration and Process Automation Engineer-(non-remote role),"Donor Network of Arizona (DNA)
","Tempe, AZ",$108K - $122K (Employer est.),4.4,"About Us:
Donor Network of Arizona’s mission is to make the most of life through the gift of organ and tissue donation. We challenge ourselves and others every day to realize Arizona's potential to save and improve lives. Every employee at Donor Network of Arizona is responsible for embracing the organizational culture by upholding the Donor Network of Arizona’s core values of Positive Energy, Passion and Eagerness.
About the Role:
The primary responsibilities of the Data Integration and Process Automation Engineer position are to manage all operational aspects of the organization’s databases (MS-SQL), systems integration and process automation initiatives, both operational and strategic. We are seeking to hire a technically skilled resource that can proactively manage a wide range of data and system engineering disciplines. To ensure success in this role you will need to be an excellent problem-solver and communicator that is fluent in data management and manipulation. Ultimately, the resource chosen for this role must have extensive knowledge of databases, their creation, administration and optimization while also possessing deep knowledge of system integration and process automation techniques and technologies. The scope and priorities of data integration this position will be responsible for will be determined by organizational priorities and aligned to data strategies governed by Business Intelligence leadership.
This position’s expected level of interaction with all DNA departments will be governed through the creation of IT Service Requests by both IT and non-IT resources, in support of departmental and project objectives. As an active IT Team member, this position’s duties include mandatory participation in proactive management of IT Service Requests on a rotating on-call schedule, during off-hour time periods.
We Offer:
Competitive Salary- from $107,500-$121,800 annually
Organizational Incentive Program Annually, up to 10% (7% at target)
Very Generous Medical, Dental & Vision Insurance
Paid Life Insurance and LTD Insurance
Voluntary Life Insurance options
403b employer match and profit sharing
Generous Tuition Assistance Program
Employee Assistance Program
Employee Wellness Program
Tobacco Free Workplace

Responsibilities:
Provides for the operational integrity of the organizations MS-SQL database servers including installation, performing upgrades, developing processes for optimizing database performance and security, setting and maintain database standards, managing database access, executing performance tuning, creating automation for repeating database tasks, diagnosing and troubleshoot database errors, recommending and implementing emerging database technologies, creating and managing database usage and performance reports.
Maintains primary ownership and responsibility for engineering job/process lifecycle disciplines related to supporting a rich system integration and process automation environment including (but not limited to) functional and process design creation, configuration, stabilization, performance tuning, build verification, quality control, change control, testing and documentation.
Closely supports the Business Intelligence (BI) and Finance teams with their advanced data integration and process automation initiatives by collaborating with their departmental resources to understand user and system requirements, workflows, use cases and specifications in creating integration and automation solution across the enterprise.
Extracts and/or loads data to support Finance, BI and other departmental operational workflows.
Develops PowerShell scripts / scripting jobs that adhere to standard software development methodologies (documentation, code reviews, unit testing.) to validate the solution.
Works with other IT staff and external vendors to define and configure cybersecurity measures to help mitigate risk for the DNA system environment.
Works with other IT staff and external vendors to define and configure server and software patching / updates to help mitigate risk for the DNA security profile.
Analyzes project requirements and functional specifications in support of DNA departmental data, integration, and automation goals.
Helps to lead the organization’s advancement of data integration and process automation projects throughout the business by being a subject matter expert, influencing and incorporating design for integration and automation standards.
Writes clear, concise, well-coordinated technical documentation to maintain standards and procedures.
Creates training materials and provides training on integration/automation process technologies.
As an IT Team member, takes a proactive approach in the assessment and management of IT Service Requests for both Level 1 (initial triage) and Level 2 (ticket escalation) instances.
Participates in 24 x 7 x 365 On-Call IT resource rotation schedule to field IT Service Requests from users related to workflow stoppage of production systems while maintaining alignment with well-defined executive management service objectives.
Follows established change control processes to implement planned changes to production and non-production systems.
Ethically handles and adheres to regulatory compliance of private data, including financial and/or healthcare data.
Qualifications:
Minimum Education
Bachelor's degree in Information Technology, Computer Science, Information Systems, or a related field, or equivalent detailed Information Technology experience in progressively complex systems integration and process automation environments.
Certification as a MCDBA, MCADS, MCADE or MCASA is advantageous.

Minimum Experience:
6+ years of relevant work experience as an Integration Architect
8+ years experience in delivering complex systems integrations and intelligent automations required.
8+ years of experience with Microsoft Windows Server OS and its components
5+ years’ experience as a database administrator and 3 years as a database engineer.
3+ years’ experience with Microsoft Azure SQL platform in a Windows environment
Knowledge of enterprise architecture, systems architecture, integration architecture and data architecture standards, frameworks, and practices
Strong working experience with SQL/PLSQL and relational databases such as Oracle, MS SQL Server, and NoSQL databases required.
Advanced knowledge of SQL and SQL server tools (SSAS, SSIS, SSRS) with a strong command of database security, backup and recovery, and performance monitoring standards
3+ years (Intermediate level) skills in major programming languages (C++/Objective C/C#/Java/Python, etc.) and desire to learn others.
Strong operational understanding of VMWare and VSphere server virtualization tools (ESXi Hypervisor, vCenter Server, etc.)
Understanding of relational and dimensional data modeling techniques
Familiarity with business integration / automation ESB platforms (Talend, Workato, MuleSoft, Boomi, Informatica, IntApp, SmartConnect, etc.) designed to automate and orchestrate the integration of IT/business processes and workflows; Proficiency, knowledge, and experience with eOne SmartConnect is a plus.
Experience integrating with Cloud/SaaS applications, APIs, SDK of packaged and legacy applications.
Skills Required:
Analytical mindset and good problem-solving skills with an attention to detail.
Excellent verbal and written communication skills.
Excellent project management skills and strong ability to prioritize.",1993,Health Care Services & Hospitals,$25 to $100 million (USD),Healthcare,201 to 500 Employees,Nonprofit Organization,False
Data Engineer,"Contact Government Services, LLC
","Phoenix, AZ",$84K - $119K (Glassdoor est.),4.7,"Data Engineer
Employment Type: Full-Time, Mid-level
Department: Business Intelligence
CGS is seeking a passionate and driven Data Engineer to support a rapidly growing Data Analytics and Business Intelligence platform focused on providing solutions that empower our federal customers with the tools and capabilities needed to turn data into actionable insights. The ideal candidate is a critical thinker and perpetual learner; excited to gain exposure and build skillsets across a range of technologies while solving some of our clients’ toughest challenges.

CGS brings motivated, highly skilled, and creative people together to solve the government’s most dynamic problems with cutting-edge technology. To carry out our mission, we are seeking candidates who are excited to contribute to government innovation, appreciate collaboration, and can anticipate the needs of others. Here at CGS, we offer an environment in which our employees feel supported, and we encourage professional growth through various learning opportunities.
Skills and attributes for success:
Complete development efforts across data pipeline to store, manage, store, and provision to data consumers.
Being an active and collaborating member of an Agile/Scrum team and following all Agile/Scrum best practices.
Write code to ensure the performance and reliability of data extraction and processing.
Support continuous process automation for data ingest.
Achieve technical excellence by advocating for and adhering to lean-agile engineering principles and practices such as API-first design, simple design, continuous integration, version control, and automated testing.
Work with program management and engineers to implement and document complex and evolving requirements.
Help cultivate an environment that promotes customer service excellence, innovation, collaboration, and teamwork.
Collaborate with others as part of a cross-functional team that includes user experience researchers and designers, product managers, engineers, and other functional specialists.

Qualifications:
Must be a US Citizen.
Must be able to obtain a Public Trust Clearance.
7+ years of IT experience including experience in design, management, and solutioning of large, complex data sets and models.
Experience with developing data pipelines from many sources from structured and unstructured data sets in a variety of formats.
Proficiency in developing ETL processes, and performing test and validation steps.
Proficiency to manipulate data (Python, R, SQL, SAS).
Strong knowledge of big data analysis and storage tools and technologies.
Strong understanding of the agile principles and ability to apply them.
Strong understanding of the CI/CD pipelines and ability to apply them.
Experience with relational database, such as, PostgreSQL.
Work comfortably in version control systems, such as, Git Repositories.

Ideally, you will also have:
Experience creating and consuming APIs.
Experience with DHS and knowledge of DHS standards a plus.
Candidates will be given special consideration for extensive experience with Python.
Ability to develop visualizations utilizing Tableau or PowerBI.
Experience in developing Shell scripts on Linux.
Demonstrated experience translating business and technical requirements into comprehensive data strategies and analytic solutions.
Demonstrated ability to communicate across all levels of the organization and communicate technical terms to non-technical audiences.
Our Commitment:
Contact Government Services (CGS) strives to simplify and enhance government bureaucracy through the optimization of human, technical, and financial resources. We combine cutting-edge technology with world-class personnel to deliver customized solutions that fit our client’s specific needs. We are committed to solving the most challenging and dynamic problems.

For the past seven years, we’ve been growing our government-contracting portfolio, and along the way, we’ve created valuable partnerships by demonstrating a commitment to honesty, professionalism, and quality work.

Here at CGS we value honesty through hard work and self-awareness, professionalism in all we do, and to deliver the best quality to our consumers mending those relations for years to come.

We care about our employees. Therefore, we offer a comprehensive benefits package:
Health, Dental, and Vision
Life Insurance
401k
Flexible Spending Account (Health, Dependent Care, and Commuter)
Paid Time Off and Observance of State/Federal Holidays

Contact Government Services, LLC is an Equal Opportunity Employer. Applicants will be considered without regard to their race, color, religion, sex, sexual orientation, gender identity, national origin, disability, or status as a protected veteran.

Join our team and become part of government innovation!

Explore additional job opportunities with CGS on our Job Board:
https://cgsfederal.com/join-our-team/

For more information about CGS please visit: https://www.cgsfederal.com or contact:
Email: info@cgsfederal.com",-1,-1,Unknown / Non-Applicable,-1,1 to 50 Employees,Company - Public,True
