Job Title,Company Name,Location,Salary Estimate,Rating,Job Description,Founded,Industry,Revenue,Sector,Size,Type,Easy Apply
Lead Software Engineer - Test Data & Environments,"Northwestern Mutual
","Milwaukee, WI",$119K (Employer est.),3.9,"At Northwestern Mutual, we are strong, innovative and growing. We invest in our people. We care and make a positive difference.

About the role:

Enable software engineers to deliver value faster and create a world class engineering organization by taking a modern approach to our test environments and test data solutions, enabled with a focus on software engineering, The solutions offered by this area have a high impact across the internal NM Engineering Solutions Delivery (ESD) and enterprise teams, streamlining delivery for engineers across the organization.

As part of the Enterprise Shared Services (ESS) organization within ESD, this role will provide design and execution leadership to deliver modern test data solutions and environments using ephemeral data solutions, data and service virtualization, AI, and synthetic data. The role will partner closely with our software, infrastructure, and data engineers throughout the company to deliver shared capabilities that align with NM’s Software Development Life Cycle (SDLC).

Organization Summary

The Engineering Shared Services (ESS) vision as an integral part of NM’s software delivery ecosystem though standardization, simplification and automation. We help teams accelerate delivery by solving problems that matter through innovative shared technology solutions and keeping NM’s delivery running smoothly and ensure our teams are best positioned to do their jobs.

Primary Duties & Responsibilities

Apply industry leading and ground-breaking practices to design and develop shared capabilities in alignment with NM standards.
Provide technical guidance to engineers to complete solution delivery.
Mentor, guide and coach engineers within space for technical and leadership growth.
Partner with engineers across the organization to understand needs and difficulties to inform capability offerings and to understand broader technology directions for the organization.
Influence technical, business and product leadership to overcome cultural, product or technical challenges.
Represent Northwestern Mutual's technology organization in community and technology events.
Act as a practitioner, mentor, advisor, or influencer based on the need and the situation.
Cultivate network and talent pipeline by attending and presenting at meetups, conferences, and tech events.

Qualifications

Bachelor's Degree or equivalent experience
6-8 years of professional experience required.
5-8+ years of experience designing and delivering solutions using modern engineering tools, languages, and practices.
Ability to build and maintain strong relationships with multiple business and technology partners.
Very strong understanding of DevOps with a proven track record of Continuous Delivery and supporting culture.
Data Engineering understanding – how data flows through systems.
Growing engineering abilities in others.
Proven track record of building platforms and tools that enable developer productivity and happiness.
Deep technical knowledge and broad understanding of the business.
Ability to successfully communicate to both technical and non-technical audiences in varying forms and all levels of detail.
Solid understanding of design patterns and architecture.
Ability to influence teams, technology or business leaders on impactful issues and decisions.

Benefits:

Tuition reimbursement, commuter plans, and paid time off
Highly competitive compensation that include base salary plus bonus
Medical/Dental/Vision plans, 401(k), pension program

Compensation Range:

Pay Range - Start:

$118,510.00

Pay Range - End:

$220,090.00

Northwestern Mutual pays on a geographic-specific salary structure and placement in the salary range for this position will be determined by a number of factors including the skills, education, training, credentials and experience of the candidate; the scope, complexity as well as the cost of labor in the market; and other conditions of employment. At Northwestern Mutual, it is not typical for an individual to be hired at or near the top of the range for their role and compensation decisions are dependent on the facts and circumstances of each case. Please note that the salary range listed in the posting is the standard pay structure. Positions in certain locations (such as California) may provide an increase on the standard pay structure based on the location. Please click here for additional information relating to location-based pay structures.

Grow your career with a best-in-class company that puts our client’s interests at the center of all we do. Get started now!

We are an equal opportunity/affirmative action employer and all qualified applicants will receive consideration for employment without regard to race, color, religion, gender identity or expression, sexual orientation, national origin, disability, age or status as a protected veteran, or any other characteristic protected by law.

If you work or would be working in California, Colorado, New York City, Washington or outside of a Corporate location, please click here for information pertaining to compensation and benefits.




FIND YOUR FUTURE

We’re excited about the potential people bring to Northwestern Mutual. You can grow your career here while enjoying first-class perks, benefits, and commitment to diversity and inclusion.

Flexible work schedules
Concierge service
Comprehensive benefits
Employee resource groups",1857,Investment & Asset Management,$10+ billion (USD),Financial Services,5001 to 10000 Employees,Company - Private,False
Data Operations Engineer,"WebMD
","Madison, WI",$69K - $104K (Glassdoor est.),3.4,"Mercury Healthcare, a WebMD Provider Services company, is a technology and data analytics company that empowers healthcare organizations to engage consumers and optimize provider networks to accelerate growth. Our customers benefit from more than 30 years' experience driving intelligent engagement, aligning physicians, and enabling personalized healthcare journeys. WebMD is an Equal Opportunity/Affirmative Action employer and does not discriminate on the basis of race, ancestry, color, religion, sex, gender, age, marital status, sexual orientation, gender identity, national origin, medical condition, disability, veterans status, or any other basis protected by law.

Position Overview:

As a Data Operations Engineer, you will develop and maintain database functionality to support corporate products and services. Primarily, your focus will be on mastering healthcare data for our Ignite Growth Platform. You will collaborate with cross-functional database and product development teams using Agile / Scrum and open source technologies.

What you will do:

Oversee data transformation, normalization, cleansing, aggregation, workflow management and business rule application
Load, process and manage incoming data feeds
Use SQL to analyze healthcare and marketing data sets
Respond to ad-hoc questions and assist our technical support team as necessary
Be the subject matter expert for consumption layer data, providing guidance to support teams on best practices, capabilities and limitations of the data
Continuous improvement of our automated and manual data processes, improving our efficiency and quality

What you will bring:

SQL Programming / ETL and data management experience
Strong familiarity of Relational Database Management Systems
Fluency in several programming languages such as Python or Java
Experience working with AWS, Jenkins, Docker, and git
Define and manage critical data using Master Data Management solutions
Ability to perform Unit Tests and internal QA checks
Good collaboration and idea sharing in a team environment
A Bachelor’s Degree in Computer Science, completion of a recognized programming bootcamp, or equivalent work experience
Previous experience with healthcare data is a plus",2005,Internet & Web Services,$500 million to $1 billion (USD),Information Technology,1001 to 5000 Employees,Company - Public,False
Data Engineer,"MSI Data
","Milwaukee, WI",$88K - $122K (Glassdoor est.),3.4,"Description:

ASSOCIATE DATA ENGINEER

About Us

MSI develops and sells software for equipment-centric service management.

We live by our Culture Codes

INNOVATION | INTEGRITY |QUALITY | PASSION | COMMUNITY

If you have the ambition to contribute to one of Milwaukee’s fastest growing enterprise software companies, we want to hear from you!

About This Opportunity

The Associate Data Engineer role, a/an exempt/non-exempt position, at MSI Data is the ideal opportunity for an experienced, talented and ambitious software industry professional looking to grow their career in a rapidly growing and dynamic market – service management software. As the Associate Data Engineer for our flagship, cloud-based Service Pro® enterprise, scheduling and mobile field service software application, you will help shape how data analytics can deliver value to our customers and MSI Data.

Team Dynamic

This role reports directly to the Manager, Software Development. The right fit will work alongside software development and customer delivery team members.

We’re looking for someone who:

Self-driven and diligent with time management skills.
Is passionate about learning new skills and is ready to demonstrate them.
Thrives on teamwork as a way to improve everyone around you.
Is looking to build expertise around the value of data.

Physical, Mental and Availability Demands

This is a largely sedentary role, so you must be able to remain in a stationary position during most working hours. In this role, you will need to be able to make effective use of a computer. Although infrequent, there may be expectations of availability on evenings and weekends.

Why should I consider working for MSI Data?

Service Pro®, named an industry leader three consecutive times by G2 Crowd, is one of the most exciting up-and-coming brands in the field service software marketplace. Our customers are the experts that keep mission-critical equipment in commercial, industrial and medical facility settings up and running. Service Pro is trusted by service businesses spanning over a dozen industries, and our development team is rapidly adding new capabilities to the product.

Perks:

Competitive compensation, an excellent benefit program including medical, dental, vision, and insurance coverage, life insurance, 401(k) plan and a great working environment.

MSI Data is an equal opportunity employer and believes in equal opportunity for all employees and applicants. Accordingly, all employment decisions are based on the principles of equal opportunity. These decisions include recruitment, selection, promotion, transfer, discipline, compensation, benefits, training, and other personnel actions involving persons in all job titles and shall occur without regard to race, color, religion, sex, age, national origin, disability, genetic information, and/or military status.

Requirements:

Position Responsibilities:




Proficient in data reporting technologies such as SSRS, Power BI, and Crystal Reports
Work with customer delivery team members to define data reporting requirements and
implementing reports
Explore operational reporting solutions and data presentation methodologies

Position Qualifications:

BS or similar certification in Computer Science, Data Science, or related discipline
Demonstrated expertise and skills in data reporting and analytics modeling
Familiarity with agile software development practices
Strong communication skills and ability to work in teams
Demonstrated passion for learning and delivering results
Familiarity in web-based applications",2010,Enterprise Software & Network Solutions,$5 to $25 million (USD),Information Technology,51 to 200 Employees,Company - Private,True
Data Engineer,"AccuLynx
","Beloit, WI",$73K - $103K (Glassdoor est.),3.8,"We are seeking a highly skilled and motivated Data Engineer with expertise in creating and managing data lakes and data warehouses. In this role, you will be responsible for designing and implementing efficient data storage and processing solutions using Microsoft SQL Server, Azure Data Factory, and Azure Synapse Analytics. You will collaborate closely with financial planning analysts and other stakeholders to understand their data requirements and build scalable solutions to support their analytical needs.




Responsibilities:

Develop and optimize SQL queries to extract insights from large datasets, leveraging the capabilities of SQL Server.
Design and develop data lakes and data warehouses using industry best practices, ensuring high performance, scalability, and data quality.
Collaborate with FP&A Analysts to understand their data requirements and translate them into technical specifications for data models and schemas.
Extract, transform, and load (ETL) data from various sources into the data lake and data warehouse, ensuring data integrity and consistency.
Monitor and maintain the performance and health of the data lake and data warehouse, implementing necessary optimizations and troubleshooting any issues that arise.
Implement data governance and security measures to ensure compliance with regulatory requirements and protect sensitive information.
Collaborate with cross-functional teams to integrate data from different systems and sources, ensuring data consistency and accuracy across the organization.
Stay up-to-date with emerging technologies, tools, and trends in data engineering and analytics, and evaluate their potential application to improve existing systems and processes.



Requirements:

Bachelor's degree in Computer Science, Engineering, or a related field.
Proven experience designing and implementing data lakes and data warehouses, preferably using Microsoft SQL Server and Azure Synapse.
Strong proficiency in SQL and database management systems.
Experience with data integration, ETL processes, and data modeling concepts.
Familiarity with cloud platforms (e.g., Microsoft Azure, AWS, Google Cloud) and their data-related services.
Knowledge of data governance, data security, and regulatory compliance practices.
Strong analytical and problem-solving skills, with the ability to analyze complex datasets and derive meaningful insights.
Excellent communication and collaboration skills to work effectively with FP&A Analysts and cross-functional teams.
Self-motivated and able to work independently as well as in a team environment.



Join our dynamic team and contribute to the development of a robust data infrastructure that empowers our FP&A Analysts to derive valuable insights and drive informed decision-making.",2008,Software Development,Unknown / Non-Applicable,Information Technology,1 to 50 Employees,Company - Private,True
Data Engineer,"Miller
","Appleton, WI",$78K - $106K (Glassdoor est.),4.3,"Company Description


Miller® is about building things that matter. We lead the welding industry in building advanced, solution-focused products and meeting crucial needs for welding safety and health.

We’re about the partnership and the work. Our products are designed with our users for manufacturing, fabrication, construction, aviation, motorsports, education, agriculture and marine applications.

Miller Electric Mfg. LLC, is headquartered in Appleton, Wisconsin, and wholly owned by Illinois Tool Works (NYSE: ITW). The company maintains its industry leadership by setting the standard for reliability, quality and responsiveness. Our tagline, “The Power of Blue®,” is inspired by the blue color of Miller equipment.

The company began with an innovation that responded to customer needs, growing from a one-man operation in 1929, to the world’s largest manufacturer of arc welding products. Miller keeps the tradition alive by focusing on its top priority: people.



Job Description


BASIC DESCRIPTION:

Are you a talented and experienced Azure Data Engineer looking for an exciting opportunity to work on cutting-edge data projects? We are seeking a highly skilled professional with a minimum of 3-5 years of hands-on experience in Azure Data Engineering, including Azure Data Factory, Azure Synapse, Azure Storage Account, SQL, and Python. As an Azure Data Engineer, you will play a crucial role in designing, implementing, and maintaining data solutions on the Azure platform.

ESSENTIAL FUNCTIONS:

Design, develop, and maintain data pipelines using Azure Data Factory to efficiently extract, transform, and load (ETL) data from various sources.
Utilize Azure Synapse to create and manage data warehousing solutions, optimizing query performance and ensuring data accuracy and consistency.
Manage Azure Storage Accounts for data storage and retrieval, implementing data security measures and efficient data access patterns.
Develop and optimize SQL queries for data retrieval and manipulation, ensuring data quality and performance.
Utilize Python for scripting and automation tasks related to data processing and integration.
Collaborate with cross-functional teams to gather data requirements, define data architecture, and provide data engineering expertise.
Ensure data solutions follow industry best practices and security standards.
Communicate effectively with stakeholders, providing updates on project progress and data-related issues.


Qualifications


MINIMUM QUALIFICATIONS:

Bachelor’s degree in information systems, Computer Science or related field.
3-5 years of Data Engineering, Data Analyst or ETL.
They must possess strong communication skills and be a logical thinker.
Ability to work cooperatively with others on a team.

Ideal Qualifications:

Exposure to Scrum Agile methodology
Familiarity with Dynamics 365 (D365)
Experience with relational databases
Proficiency in Power BI for data visualization and reporting
Expertise in database migration, specifically migrating from on-premises to the cloud using Azure Managed Instance

Additional Information


All your information will be kept confidential according to EEO guidelines.

ITW is an equal opportunity employer. We value our colleagues’ unique perspectives, experiences and ideas and create workplaces where everyone can develop their careers and perform to their full potential.

As an equal employment opportunity employer, ITW is committed to equal employment opportunity and fair treatment for employees, beginning with the hiring process and continuing through all aspects of the employment relationship.

All qualified applicants will receive consideration for employment without regard to race, color, sex, gender identity, sexual orientation, religion, national origin, age, disability, protected Veteran status or any other characteristic protected by applicable federal, state, or local laws.

ITW is an equal opportunity employer. We value our colleagues’ unique perspectives, experiences and ideas and create workplaces where everyone can develop their careers and perform to their full potential.

As an equal employment opportunity employer, ITW is committed to equal employment opportunity and fair treatment for employees, beginning with the hiring process and continuing through all aspects of the employment relationship.

All qualified applicants will receive consideration for employment without regard to race, color, sex, gender identity, sexual orientation, religion, national origin, age, disability, protected Veteran status or any other characteristic protected by applicable federal, state, or local laws.",1995,Machinery Manufacturing,$500 million to $1 billion (USD),Manufacturing,1001 to 5000 Employees,Company - Private,True
"Customer Engineer Data Analytics, Google Cloud","Google
",Wisconsin,-1,4.4,"Note: Google’s hybrid workplace includes remote roles.

Remote location: Wisconsin, USA.
Minimum qualifications:
Bachelor's degree in Computer Science or equivalent practical experience.

6 years of experience in virtualization or cloud native architectures in a customer-facing or support role.

Experience with Big Data technologies, Analytic Warehousing technologies, data processing technologies, performance and scalability optimizations.

Experience delivering technical presentations and live demonstrations in an enterprise business environment.


Preferred qualifications:
Experience with technical sales or professional consulting in the fields of cloud computing, data, information lifecycle management, and Big Data.

Experience with architecture design, implementing, tuning, schema design, and query optimization of scalable and distributed systems.

Experience with developing data warehousing, data lakes, batch/real-time event processing, streaming, data processing (e.g., Extract, transform, load/Extract, Load, and Transform), data migrations, data visualization tools, and data governance on cloud native architectures.

Knowledge of cloud computing (e.g., infrastructure, storage, platforms, and data), cloud market, engaged dynamics, and customer buying behavior.

About the job

When leading companies choose Google Cloud it's a huge win for spreading the power of cloud computing globally. Once educational institutions, government agencies, and other businesses sign on to use Google Cloud products, you come in to facilitate making their work more productive, mobile, and collaborative. You listen and deliver what is most helpful for the customer. You'll assist fellow sales Googlers by problem-solving key technical issues for our customers, and liaise with the product marketing management and engineering teams to stay on top of industry trends and devise enhancements to Google Cloud products.

In this role, you will work with Sales teams as an enterprise data analytics subject matter expert. You will help prospective customers and partners understand Google Cloud, explaining technical features, helping customers design architectures, engage in proof-of-concepts, and provide technical closure for roadblocks related to our analytics and business intelligence portfolio.

Google Cloud accelerates organizations’ ability to digitally transform their business with the best infrastructure, platform, industry solutions and expertise. We deliver enterprise-grade solutions that leverage Google’s cutting-edge technology – all on the cleanest cloud in the industry. Customers in more than 200 countries and territories turn to Google Cloud as their trusted partner to enable growth and solve their most critical business problems.

The US base salary range for this full-time position is $118,000-$177,000 + bonus + equity + benefits. Our salary ranges are determined by role, level, and location. The range displayed on each job posting reflects the minimum and maximum target for new hire salaries for the position across all US locations. Within the range, individual pay is determined by work location and additional factors, including job-related skills, experience, and relevant education or training. Your recruiter can share more about the specific salary range for your preferred location during the hiring process.

Please note that the compensation details listed in US role postings reflect the base salary only, and do not include bonus, equity, or benefits. Learn more about benefits at Google.


Responsibilities
Support local Sales teams in pursuit of key business opportunities, engaging customers to address aspects of the data lifecycle.

Identify business and technical requirements, conduct full technical discovery, and design client solutions to meet gathered requirements.

Lead technical projects, including activities such as technology advocacy, supporting bid responses, product and solution briefings, proof-of-concept work, and the coordination of supporting technical resources.

Prepare and deliver product messaging to highlight the Google Cloud Platform value proposition, using techniques that include whiteboard and slide presentations, product demonstrations, white papers, and Request for Information (RFI) response documents.

Work with Google Cloud Platform products to demonstrate and prototype integrations in customer/partner environments. Travel for meetings, technical reviews, and onsite delivery activities as needed.

Google is proud to be an equal opportunity workplace and is an affirmative action employer. We are committed to equal employment opportunity regardless of race, color, ancestry, religion, sex, national origin, sexual orientation, age, citizenship, marital status, disability, gender identity or Veteran status. We also consider qualified applicants regardless of criminal histories, consistent with legal requirements. See also Google's EEO Policy and EEO is the Law. If you have a disability or special need that requires accommodation, please let us know by completing our Accommodations for Applicants form.",1998,Internet & Web Services,$10+ billion (USD),Information Technology,10000+ Employees,Company - Public,False
