Job Title,Company Name,Location,Salary Estimate,Rating,Job Description,Founded,Industry,Revenue,Sector,Size,Type,Easy Apply
"Data Engineer, Finance Data Engineering","Dropbox
",Arizona,-1,4.5,"Company Description

Dropbox is a special place where we are all seeking to fulfill our mission to design a more enlightened way of working. We’re looking for innovative talent to join us on our journey. The words shared by our founders at the start of Dropbox still ring true today.

Wouldn’t it be great if our working environment—and the tools we use—were designed with people’s actual needs in mind? Imagine if every minute at work were well spent—if we could focus and spend our time on the things that matter. This is possible, and Dropbox is connecting the dots.

The nearly 3,000 Dropboxers around the world have helped make Dropbox a living workspace - the place where people come together and their ideas come to life. Our 700+ million global users have been some of our best salespeople, and they have helped us acquire customers with incredible efficiency. As a result, we reached a billion dollar revenue run rate faster than any software-as-a-service company in history.

Dropbox is making the dream of a fulfilling and seamless work life a reality. We hope you’ll join us on the journey.

Team Description

Our Engineering team is working to simplify the way people work together. They’re building a family of products that handle over a billion files a day for people around the world. With our broad mission and massive scale, there are countless opportunities to make an impact.

Role Description
Dropbox is looking for a Data Engineer to join our Finance Data Engineering (FDE) team to build out next generation Financial data pipelines that power crucial business decisions throughout the organization including metrics (ARR, Churn) that are reported externally to Wall St. The team is responsible for curating Gold Datasets (user, team, product etc) that are the source of truth for analytics and operations at Dropbox

Do you dream about Data and talk to your friends in SQL?
Do you want to inspire and be inspired by working with the best and brightest?
You’re friendly, positive, professional, and fun to work with!
You’re a creative thinker with excellent problem­ solving and decision ­making ability.
You’re proactive, self­ starting, organized, and willing to take on difficult problems.
You have excellent communication skills, both written and verbal.
You’re self­ motivated, energetic, and passionate.
You’ll be the genius who understands data at Dropbox, knows where to find it and manages the process to make that data useful for Growth and Monetization at Dropbox. You love thinking about the ways the business can consume this data and then figuring out how to build it. On a typical day you may be consulted on the information architecture of our subscriptions / invoicing systems and help design the event collection infrastructure. You will also be responsible for understanding and curating Gold datasets associated to all Dropbox customers that will be used for marketing, segmentation and several other analytics and operational use cases. You’ll build the data models and ETL processes to provide this data for business use. You've got some practical experience working with large datasets. You are interested in reporting platforms and data visualization.

You may be interested in machine learning or statistics or one of several similar fields. But the most important factor is you have a strong foundation in test driven development and building scalable data pipelines. As part of the Dropbox’s FDE team, you'll own a problem end-to-end, so those skills will come in handy not just to collect, extract and clean the data, but also to understand the systems that generated it, and automate your processes to produce reliable and trustworthy data. On an on-going basis, you'll be responsible for improving the data by adding new sources, coding business rules and producing new metrics that support the business.

As a data engineer, you have experience spanning traditional DW and ETL architectures and big data ecosystems like Databricks / Snowflake / EMR / Airflow. You’ve probably been in the industry an engineer and have developed a passion for the data that drives businesses. You'll need to be technical at heart, comfortable with the idea of extending systems by writing code, rather than just relying on in-built functionality.
Responsibilities

Build and manage data pipeline generating P0 (most critical) metrics for Dropbox
Pay meticulous attention to end-to-end data quality, validation, and consistency
Solve our most challenging data integration problems, utilizing optimal ETL patterns, frameworks, query techniques, sourcing from structured and unstructured data sources
Challenge status quo and adopt industry best practices
Work closely with Dropbox business and engineering teams and anticipate how they'd like to use the curated data sets
Excellent communication skills and comfortable with Agile software development methodologies
Collaborate with cross functional teams, product managers, and data scientists to understand data needs, representing key data insights in a meaningful way
Define and manage SLA for all data sets in allocated areas of ownership
Build cost optimized and efficient data pipelines that are easy to govern and manage
Strong ownership to solve 0-1 problems with minimal guidance and being comfortable with ambiguities
Requirements

Proficient in spark, sparkSQL and hiveSQL
Experience working with Snowflake / Databricks or similar distributed compute systems
Excellent understanding of scheduling and workflow frameworks. Prefer prior experience with Airflow
You've used version control systems like Git and have experience with test automation and CICD
2+ years of Python or Java, Scala development experience
2+ years of SQL experience
2+ years of experience with schema design and dimensional data modeling
Experience designing, building and maintaining data processing systems
BS degree in Computer Science or related technical field involving coding (e.g., physics or mathematics), or equivalent technical experience

Many teams at Dropbox run Services with on-call rotations, which entails being available for calls during both core and non-core business hours. If a team has an on-call rotation, all engineers on the team are expected to participate in the rotation as part of their employment. Applicants are encouraged to ask for more details of the rotations to which the applicant is applying.

Total Rewards

Dropbox takes a number of factors into account when determining individual starting pay, including job and level they are hired into, location/metropolitan area, skillset, and peer compensation. We target most new hire offers between the minimum up to the middle of the range.

Salary/OTE is just one component of Dropbox’s total rewards package. All regular employees are also eligible for the corporate bonus program or a sales incentive (target included in OTE) as well as stock in the form of Restricted Stock Units (RSUs).

Current Salary/OTE Ranges (Subject to change):

US Zone 1: $131,800 - $155,000 - $178,300.
US Zone 2: $118,600 - $139,500 - $160,400.
US Zone 3: $105,400 - $124,000 - $142,600.
Dropbox uses the zip code of an employee’s remote work location to determine which metropolitan pay range we use. Current US Zone locations are as follows:

US Zone 1: San Francisco metro, New York City metro, or Seattle metro
US Zone 2: Austin (TX) metro, Chicago metro, California (outside SF metro), Colorado, Connecticut (outside NYC metro), Delaware, Massachusetts, New Hampshire, New York (outside NYC metro), Oregon, Pennsylvania (outside NYC or DC metro), Washington (outside Seattle metro) and Washington DC metro
US Zone 3: All other US locations
Dropbox is committed to investing in the holistic health and wellbeing of all Dropboxers and their families. Our benefits and perks programs include, but are not limited to:

Competitive medical, dental and vision coverage

(US Only) Competitive 401(k) Plan with a generous company match and immediate vesting

Flexible Time Off/Paid Time Off, paid holidays, Volunteer time off and more

Protection Plans including; Life Insurance, Disability Insurance and Travel benefit plans

Perks Allowance to be used on what matters most to you, whether that’s wellness, learning and development, food & groceries, and much more

Parental benefits including; Parental Leave, Child and Adult Care, Day Care FSA (US Only), Fertility Benefits (US Only), Adoption and Surrogacy support and Lactation Support

Mental Health and Wellness benefits Free Dropbox space for your friends and family

Additional benefits details are available upon request.

Dropbox is an equal opportunity employer. We are a welcoming place for everyone, and we do our best to make sure all people feel supported and connected at work. A big part of that effort is our support for members and allies of internal groups like Asians at Dropbox, BlackDropboxers, Latinx, Pridebox (LGBTQ), Vets at Dropbox, Women at Dropbox, ATX Diversity (based in Austin, Texas) and the Dropbox Empowerment Network (based in Dublin, Ireland).",2007,Computer Hardware Development,Unknown / Non-Applicable,Information Technology,1001 to 5000 Employees,Company - Public,False
Senior Data Engineer (Snowflake) - Contractor,"EY
",United States,$90.00 - $130.00 Per Hour (Employer est.),3.9,"The primary responsibility for the Sr. Data Engineer / Tech Lead is to ensure data accessibility, quality, and reliability within the client's data platform ecosystem.

RESPONSIBILITIES

Design and develop end-to-end data pipelines and ETL processes using Snowflake, Denodo, DBT Cloud, Fivetran, and AWS Glue, ensuring seamless data integration, transformation, and loading.
Collaborate with cross-functional teams to gather data requirements and implement scalable data models and schemas within Snowflake and Denodo, ensuring optimal performance and data consistency.
Implement and maintain data orchestration workflows using Stonebranch, ensuring efficient and reliable scheduling and automation of data processes.
Work with EnterpriseDataLake for ingestion and storage of data from various sources, ensuring the availability and accessibility of data for analytics and reporting purposes.
Utilize Azure DevOps and Teraform to implement and manage infrastructure as code, ensuring streamlined deployment and scalability of data engineering solutions.
Skills

snowflake

denodo

dbt cloud

fivetran

Qualifications

REQUIREMENTS

Proficiency in Snowflake and Denodo: Strong understanding and hands-on experience in working with Snowflake and Denodo for data integration, transformation, and analysis.
Knowledge of DBT Cloud: Familiarity with DBT Cloud, including experience in building and maintaining efficient data transformation workflows and deploying reliable data pipelines.
Experience with Fivetran: Demonstrated experience in utilizing Fivetran for data ingestion, source connectivity, and ensuring data accuracy and completeness.
Understanding of EnterpriseDataLake: Knowledge of EnterpriseDataLake principles and practices, including data ingestion, storage, and organization for analytics and reporting purposes.
Familiarity with Stonebranch: Proficiency in using Stonebranch for data orchestration and scheduling, ensuring efficient and reliable execution of data pipelines and workflows.
Proficiency in Azure DevOps and Teraform: Experience in leveraging Azure DevOps and Teraform for infrastructure as code, enabling streamlined deployment and scalability of data engineering solutions.

The expected pay rate range for this contract assignment is $90 to $130 per hour. The exact pay rate will vary based on skills, experience, and location. The position is approximately 65-70% remote and 30-35% travel to the client as needed.

#GigNowTechOpportunities

GigNowOpportunities

Equal Employment Opportunity Information
EY provides equal opportunities to applicants, employees, contractors, vendors, and stakeholders without regard to race, color, religion, age, sex, sexual orientation, gender identity/expression, pregnancy, genetic information, national origin, protected veteran status, disability status, or any other legally protected basis, including arrest and conviction records, in accordance with applicable law. If you are an individual with a disability and either need assistance applying online or need to request an accommodation during any part of the application process, please email gignow.recruiting@ey.com.",-1,-1,Unknown / Non-Applicable,-1,Unknown,Unknown,False
Data Engineer,Mind Mint,"Scottsdale, AZ",$100K - $120K (Employer est.),-1.0,"JOIN AN AMAZING COMPANY AND GLOBALLY RECOGNIZED BRAND

DIVE INTO INTRIGUING PROJECTS AND LEVEL UP YOUR SKILLS

WORK WITH A FUN TEAM ONSITE IN SCOTTSDALE ARIZONA


Are you ready to embark on an exciting challenge in the field of data engineering?


Do you possess a genuine passion for unraveling patterns and crafting insightful solutions through data engineering?


Can you envision yourself delivering impactful outcomes that align with our company's objectives through data-driven solutions?


If so, we have an opportunity that will ignite your enthusiasm for data engineering and propel your career to new heights.


Mastermind.com, created in partnership by Dean Graziosi and Tony Robbins, is the #1 online platform for people who are looking to market and monetize their knowledge base. Mastermind has a worldwide following and touches lives all over the world.


We are seeking a world-class Data Engineer to join our IT team. Here is your chance to help take our company to new heights.


THE ROLE


️ Build tools and solutions that automate complex workflows


️ Create data pipelines and maintain the infrastructure and architecture for data generation, storage, and processing


Build systems that collect, manage, and convert raw data into usable information


This is a role that involves solving complex technical issues and working collaboratively with our team. You will report directly to the Chief Technology Officer.


Our interview process will include a technical assessment and peer code review to assess your technical proficiency.


This Data Engineer position is based in Phoenix, Arizona, and will require you to work from the Mastermind headquarters in Scottsdale, AZ.


We provide an excellent compensation model based on experience ranging from $100k-120k.


This opportunity is only available for USA residents with valid work authorization. We DO NOT offer sponsorship or relocation.


REQUIREMENTS

You must have 5 years experience in designing and maintaining MySQL
You must have experience with cloud data warehouses (preferably BigQuery), dbt, or Python experience
You must have SQL development experience
You must have experience with spreadsheet manipulation in SQL
You must be able to write custom queries to answer any question about the data without leaving a SQL environment.
You must have experience querying and manipulating large datasets
Bachelor’s degree in a technical field or equivalent related work experience
Ability to utilize Fivetran and Stitch for extracting and loading data into BigQuery
Strong understanding of database design
Experience with Web APIs and pulling data from them, preferably in Python, is a plus
Excellent problem-solving and communication skills
Experience querying and manipulating large datasets
Experience with data parsing, scripting, and automation


RESPONSIBILITIES




Design and create database objects, such as tables, stored procedures, and views.
Conduct technical research and data profiling on various data sources, utilizing technologies like Python, APIs, and SQL.
Innovatively propose technical data solutions to address business challenges.
Perform dimensional data modeling and optimize database objects for accessibility, performance, and consistency.
Collaborate with business stakeholders to gather and understand data requirements.
Communicate data concepts, reports, KPIs, and other technical subjects in a business-friendly language.
Develop ETL applications using SQL, Python, etc., for data extraction, transformation, and loading.
Document development standards, KPI calculations, business terms, table diagrams, and other relevant information related to data and reports.
Keep up-to-date with emerging technologies and trends in data engineering
Perform other duties as assigned.


PERKS & BENEFITS


Competitive salary and compensation

Excellent Medical benefits

EOY Profit Sharing

401(k) administration and matching program

Incredible opportunities for growth and development

Amazing in-office culture

Become part of a mission-team making a difference!


HOW TO APPLY


Ready to dive into the fascinating realm of data engineering and take your skills to new heights as a Data Engineer?


If so, we invite you to join our exceptional team, where you'll have the opportunity to unleash the power of data, shape the future of data-driven decision-making, and embark on a fulfilling career journey.


Click the ""Apply Now"" button below to take the first step toward an exciting future.

We can't wait to review your application and explore the endless possibilities of working together.


About Mastermind.com

Mastermind.com, created in partnership by Dean Graziosi and Tony Robbins, is the #1 online platform for people who are looking to market and monetize their knowledge base. We are redefining what ""Self-Education"" means to the world.


Mastermind is not just ""another software"" but an all-in-one platform for Education, Entertainment, Implementation & Community. Mastermind serves people worldwide who seek transformation, fulfillment, and success outside the traditional education path.


The Mastermind software empowers and enables you to implement what you learn & actually get paid, in addition providing a community where you are surrounded by like-minded individuals cheering you on to YOUR NEXT LEVEL.",-1,-1,Unknown / Non-Applicable,-1,Unknown,Company - Public,True
Data Center Infrastructure Engineer,"Bank of America
","Phoenix, AZ",$72K - $100K (Glassdoor est.),4.0,"Job Description:

About Us

At Bank of America, we are guided by a common purpose to help make financial lives better through the power of every connection. Responsible Growth is how we run our company and how we deliver for our clients, teammates, communities, and shareholders every day.

One of the keys to driving Responsible Growth is being a great place to work for our teammates around the world. We’re devoted to being a diverse and inclusive workplace for everyone. We hire individuals with a broad range of backgrounds and experiences and invest heavily in our teammates and their families by offering competitive benefits to support their physical, emotional, and financial well-being.

Bank of America believes both in the importance of working together and offering flexibility to our employees. We use a multi-faceted approach for flexibility, depending on the various roles in our organization.

Working at Bank of America will give you a great career with opportunities to learn, grow and make an impact, along with the power to make a difference. Join us!

Responsibilities

Participates in planning of white space allocation to include power and cooling needs.
Document all power and space schematics and ensure accuracy in same.
Create/update/maintain rack elevation within a Data Center Infrastructure Management (DCIM) application (Nlyte).
Coordinate with vendors and internal project teams to ensure effective completion of all hardware installation.
Monitor all issues and escalate issues to appropriate department to ensure effective resolution.
Serves as a fully seasoned/proficient technical resource; provides tech knowledge and capabilities as team member and individual contributor.
Accepts delivery of Equipment from staging.
Perform quarterly quality assurance checks of tracked IT hardware
Keep data center organized and clean and always maintain a professional appearance.
Actively promote and comply with Data Center Operations work rules standards. Ensuring that procedures are followed.
May be required to work some weekends and participate in a rotational on call schedule.
This will be a second shift position working from 3:00pm-11:00pm Monday through Friday with the potential to work on weekends.
This is position does require being onsite and does not have a working from home option due to the nature of the work.

Required Skills:

Knowledge and understanding of data center facility operations and IT environments.
Familiar with NEMA and IEC power connectors.
Ability to work independently and as part of a team.
Ability to work under pressure (urgent problems, deadlines, changing priorities).
Detail oriented and organized.
Familiar with server and network hardware.
Basic understanding of server operations and requirements.
Basic understanding of IT equipment electrical requirements.
Microsoft Office suite. Outlook, Excel, PowerPoint, Word.

Physical Requirements:

Ability to climb ladders and work aloft.
Ability to work in cold and hot temperature environments.
Ability to maneuver pallet jacks and lift heavy objects.
Provide data center escort to IT vendors without badges.

Desired Skills:

5 years' experience in a data center environment.
Understanding of Data Center Design and Operations.
Proven communications skills

Shift:

2nd shift (United States of America)

Hours Per Week:

40",1904,Banking & Lending,$10+ billion (USD),Financial Services,10000+ Employees,Company - Public,False
