Job Title,Company Name,Location,Salary Estimate,Rating,Job Description,Founded,Industry,Revenue,Sector,Size,Type,Easy Apply
Lead Software Engineer - Test Data & Environments,"Northwestern Mutual
","Milwaukee, WI",$119K (Employer est.),3.9,"At Northwestern Mutual, we are strong, innovative and growing. We invest in our people. We care and make a positive difference.

About the role:

Enable software engineers to deliver value faster and create a world class engineering organization by taking a modern approach to our test environments and test data solutions, enabled with a focus on software engineering, The solutions offered by this area have a high impact across the internal NM Engineering Solutions Delivery (ESD) and enterprise teams, streamlining delivery for engineers across the organization.

As part of the Enterprise Shared Services (ESS) organization within ESD, this role will provide design and execution leadership to deliver modern test data solutions and environments using ephemeral data solutions, data and service virtualization, AI, and synthetic data. The role will partner closely with our software, infrastructure, and data engineers throughout the company to deliver shared capabilities that align with NM’s Software Development Life Cycle (SDLC).

Organization Summary

The Engineering Shared Services (ESS) vision as an integral part of NM’s software delivery ecosystem though standardization, simplification and automation. We help teams accelerate delivery by solving problems that matter through innovative shared technology solutions and keeping NM’s delivery running smoothly and ensure our teams are best positioned to do their jobs.

Primary Duties & Responsibilities

Apply industry leading and ground-breaking practices to design and develop shared capabilities in alignment with NM standards.
Provide technical guidance to engineers to complete solution delivery.
Mentor, guide and coach engineers within space for technical and leadership growth.
Partner with engineers across the organization to understand needs and difficulties to inform capability offerings and to understand broader technology directions for the organization.
Influence technical, business and product leadership to overcome cultural, product or technical challenges.
Represent Northwestern Mutual's technology organization in community and technology events.
Act as a practitioner, mentor, advisor, or influencer based on the need and the situation.
Cultivate network and talent pipeline by attending and presenting at meetups, conferences, and tech events.

Qualifications

Bachelor's Degree or equivalent experience
6-8 years of professional experience required.
5-8+ years of experience designing and delivering solutions using modern engineering tools, languages, and practices.
Ability to build and maintain strong relationships with multiple business and technology partners.
Very strong understanding of DevOps with a proven track record of Continuous Delivery and supporting culture.
Data Engineering understanding – how data flows through systems.
Growing engineering abilities in others.
Proven track record of building platforms and tools that enable developer productivity and happiness.
Deep technical knowledge and broad understanding of the business.
Ability to successfully communicate to both technical and non-technical audiences in varying forms and all levels of detail.
Solid understanding of design patterns and architecture.
Ability to influence teams, technology or business leaders on impactful issues and decisions.

Benefits:

Tuition reimbursement, commuter plans, and paid time off
Highly competitive compensation that include base salary plus bonus
Medical/Dental/Vision plans, 401(k), pension program

Compensation Range:

Pay Range - Start:

$118,510.00

Pay Range - End:

$220,090.00

Northwestern Mutual pays on a geographic-specific salary structure and placement in the salary range for this position will be determined by a number of factors including the skills, education, training, credentials and experience of the candidate; the scope, complexity as well as the cost of labor in the market; and other conditions of employment. At Northwestern Mutual, it is not typical for an individual to be hired at or near the top of the range for their role and compensation decisions are dependent on the facts and circumstances of each case. Please note that the salary range listed in the posting is the standard pay structure. Positions in certain locations (such as California) may provide an increase on the standard pay structure based on the location. Please click here for additional information relating to location-based pay structures.

Grow your career with a best-in-class company that puts our client’s interests at the center of all we do. Get started now!

We are an equal opportunity/affirmative action employer and all qualified applicants will receive consideration for employment without regard to race, color, religion, gender identity or expression, sexual orientation, national origin, disability, age or status as a protected veteran, or any other characteristic protected by law.

If you work or would be working in California, Colorado, New York City, Washington or outside of a Corporate location, please click here for information pertaining to compensation and benefits.




FIND YOUR FUTURE

We’re excited about the potential people bring to Northwestern Mutual. You can grow your career here while enjoying first-class perks, benefits, and commitment to diversity and inclusion.

Flexible work schedules
Concierge service
Comprehensive benefits
Employee resource groups",1857,Investment & Asset Management,$10+ billion (USD),Financial Services,5001 to 10000 Employees,Company - Private,False
Building Automation and Controls Engineer (Mission Critical/Data Center),"WSP
","Milwaukee, WI",$63K - $87K (Glassdoor est.),3.7,"Building Automation and Controls Engineer (Mission Critical/Data Center)



Who We Are

At WSP, we are driven by inspiring future-ready pioneers to innovate. We’re looking to grow our teams with people who are ready to collaborate in building communities and expanding our skylines. To do this, we hire candidates of all experiences, skillsets, backgrounds and walks of life. We actively foster a work environment and culture where inclusion and diversity is part of our fundamental structure. This is delivered behaviorally, through our policies, trainings, local partnerships with professional diverse organizations, internal networks and most importantly with the support and sponsorship of our leaders who help drive our commitment to an inclusive, diverse, welcoming and equitable work environment. Anything is within our reach and yours as a WSP employee. Come join us and help shape the future!

Great people. Great places. Great projects. kW Mission Critical Engineering, a WSP company, is a high-performance, fast-paced consulting engineering firm designing data centers and mission critical environments across the globe. We hire smart, responsive, team players to work in collaborative and mentoring office settings. Our mechanical, electrical, plumbing, fire protection, controls, telecommunications, and security building system designs keep many of the world’s top Fortune 100 financial, technology, enterprise, hyperscale, and colocation companies up and running 24 hours a day, 365 days a year.

We work on innovative, award-winning, large-scale projects. We travel to construction sites to see our designs being built. As part of WSP, we are able to offer our employees increased professional development and career opportunities in addition to kW MCE’s office culture which is consistently recognized as one of the “Best Places to Work.” Join our great people at our great places designing great projects.

This Opportunity

kW Mission Critical Engineering, a WSP USA company, is currently initiating a search for a Building Automation and Controls Engineer for our kW Milwaukee office located at: 233 N Water St, Milwaukee, WI 53202

As a Building Automation Controls Engineer with us, you will work with senior engineers to design automation control and monitoring systems serving data centers. Applications include heat rejection systems such as industrial air handling units and chilled water plants as well as integration to intelligent HVAC and electrical power monitoring systems (EPMS). Design activities include drawing and specification development for control products, points lists and Sequence of Operations.

Your Impact
Work in a team or independently, planning and executing engineering tasks within projects
Demonstrate significant understanding of the range of services provided by the kW MCE engineering teams & related practices
Independently, under general supervision, support the team during proposal design, and construction stages of projects
Execute controls design of complex projects
Work within multi-discipline project teams to develop drawing and specification documents for issuance to architects, contractors and building owners.
Attend client meetings and contribute to discussions
Collaborate and coordinate with internal project discipline team members and external equipment vendors and manufacturers
Communicate complex control and monitoring concepts and decisions to clients and stakeholders
Integrate complex mechanical & electrical engineering requirements into larger facility controls and monitoring designs
Interact regularly with clients, which includes maintaining current relationships and developing new relationships
Perform all aspects of controls designs, review systems, and drawings prior to issuance
Survey and evaluate existing conditions
Perform construction administration tasks
Who You Are

The ideal candidate will possess experience with HVAC or process control applications from a controls systems vendor, commissioning agent, or design consultant. Candidates should have strong communication skills, and an interest in liaising with internal and external design, client and construction team members.

Required Qualifications

Bachelor’s degree in Engineering
3+ years of experience in designing control systems for the high performing, commercial, industrial or mission critical/data center buildings
Excellent verbal and written communication skills
Experience with applicable software packages including AutoCAD, Revit
Knowledge of building, mechanical, electrical and energy codes
Ability to organize and present design information to project staff
Attention to detail, highly organized, self-starter
Ability to travel to project sites

Preferred Qualifications:

Bachelor’s degree in Mechanical, Electrical, Chemical or Computer Engineering
EIT or Registered Professional Engineer (PE), if applicable
Mission Critical/Data Center experience highly preferred
Experience with international projects

# LI-JB3

Additional Requirements
To perform this job successfully, an individual must be able to perform each essential job duty satisfactorily. Reasonable accommodations may be made to enable qualified individuals with disabilities to perform essential job functions.
Additional Details
Travel Required: 20%
Job Status: Regular
Employee Type: Full
Primary Location: MILWAUKEE - N WATER ST
All locations: US-WI-Milwaukee

About WSP

WSP USA is the U.S. operating company of WSP, one of the world's leading engineering and professional services firms. Dedicated to serving local communities, we are engineers, planners, technical experts, strategic advisors and construction management professionals. WSP USA designs lasting solutions in the buildings, transportation, energy, water and environment markets. With more than 15,000 employees in over 300 offices across the U.S., we partner with our clients to help communities prosper. www.wsp.com

WSP provides a flexible and agile workplace model while meeting client needs. Employees are also afforded a comprehensive suite of benefits including medical, dental, vision, disability, life, and retirement savings focused on providing health and financial stability throughout the employee’s career.

At WSP, we want to give our employees the challenges they seek to grow their careers and knowledge base. Your daily contributions to your team will be essential in meeting client objectives, goals and challenges. Are you ready to get started?

WSP USA (and all of its U.S. companies) is an Equal Opportunity Employer Race/Age/Color/Religion/Sex/Sexual Orientation/Gender Identity/National Origin/Disability or Protected Veteran Status.

The selected candidate must be authorized to work in the United States.

NOTICE TO THIRD PARTY AGENCIES:

WSP does not accept unsolicited resumes from recruiters, employment agencies, or other staffing services. Unsolicited resumes include any resume or hiring document sent to WSP in the absence of a signed Service Agreement where WSP has expressly requested recruitment/staffing services specific to the position at hand. Any unsolicited resumes, including those submitted to hiring managers or other business leaders, will become the property of WSP and WSP will have the right to hire that candidate without reservation – no fee or other compensation will be owed or paid to the recruiter, employment agency, or other staffing service.",-1,-1,$5 to $25 million (USD),-1,10000+ Employees,Company - Private,False
Electrical Engineer (Mission Critical/Data Center),"WSP
","Milwaukee, WI",$62K - $88K (Glassdoor est.),3.7,"Electrical Engineer (Mission Critical/Data Center)



Who We Are

At WSP, we are driven by inspiring future-ready pioneers to innovate. We’re looking to grow our teams with people who are ready to collaborate in building communities and expanding our skylines. To do this, we hire candidates of all experiences, skillsets, backgrounds and walks of life. We actively foster a work environment and culture where inclusion and diversity is part of our fundamental structure. This is delivered behaviorally, through our policies, trainings, local partnerships with professional diverse organizations, internal networks and most importantly with the support and sponsorship of our leaders who help drive our commitment to an inclusive, diverse, welcoming and equitable work environment. Anything is within our reach and yours as a WSP employee. Come join us and help shape the future!

Great people. Great places. Great projects. kW Mission Critical Engineering, a WSP company, is a high-performance, fast-paced consulting engineering firm designing data centers and mission critical environments across the globe. We hire smart, responsive, team players to work in collaborative and mentoring office settings. Our mechanical, electrical, plumbing, fire protection, controls, telecommunications, and security building system designs keep many of the world’s top Fortune 100 financial, technology, enterprise, hyperscale, and colocation companies up and running 24 hours a day, 365 days a year.

We work on innovative, award-winning, large-scale projects. We travel to construction sites to see our designs being built. As part of WSP, we are able to offer our employees increased professional development and career opportunities in addition to kW MCE’s office culture which is consistently recognized as one of the “Best Places to Work.” Join our great people at our great places designing great projects.

This Opportunity

kW Mission Critical Engineering, a WSP company, is currently initiating a search for a Mid-Level Electrical Engineer for our kW Milwaukee office located at: 233 N Water St, Milwaukee, WI 53202.

As an Electrical Engineer with us, you will design complex power and other building systems including generator plants, medium voltage distribution, uninterruptible power systems, lighting, fire alarm, and grounding.

Your Impact
Design electrical systems for buildings including lighting, receptable, general, essential, and critical electrical infrastructure
Work in a team or independently, planning and executing engineering tasks within projects
Demonstrate significant understanding of the range of services provided by the kW MCE engineering teams & related practices
Independently, support the team during design and construction stages of projects
Lead the electrical design of complex projects
Work within multi-discipline project teams to develop drawing and specification documents for issuance to architects, contractors and building owners
Attend client meetings and contribute to discussions
Lead and mentor entry-level and junior engineers
Collaborate and coordinate with internal project discipline team members, equipment vendors, and manufacturers
Communicate complex electrical engineering concepts and decisions to clients and stakeholders
Integrate complex electrical engineering requirements into facility designs
Interact regularly with clients to maintain current relationships and develop new relationships
Lead meetings with internal and external stakeholders
Research & recommend fundamental components identified in electrical designs
Develop equipment rooms layouts, floor plan, and one-line diagrams
Schedule equipment
Prepare short circuit, coordination and arc flash calculations
Perform construction administration tasks
Survey and evaluate existing conditions
Who You Are

The ideal candidate has familiarity with Building Information Modeling using Revit, has strong communication skills, and an interest in liaising with internal and external design, client and construction team members.

Required Qualifications:

Bachelor’s degree in Electrical Engineering or Architectural Engineering with electrical building systems emphasis
3+ years of experience in designing electrical systems for the high performing, commercial, industrial or mission critical/data center buildings
Excellent interpersonal skills, teamwork, and communication skills, both written and verbal
Proficiency with applicable software packages including AutoCAD, Revit, SKM, eTap or Cyme
Knowledge of building, electrical and energy codes
Ability to organize and present design information to project staff
Attention to detail, highly organized, self-starter
Ability to travel to project sites

Preferred Qualifications:

EIT or Registered Professional Engineer (PE), if applicable
Experience with the analysis and modeling of short circuit, coordination, and arc flash analysis
Experience with the design of highly reliable, robust and concurrently maintainable Medium and Low Voltage infrastructure
Mission Critical/Data Center experience
Experience with international projects

#LI-TB1

Additional Requirements
To perform this job successfully, an individual must be able to perform each essential job duty satisfactorily. Reasonable accommodations may be made to enable qualified individuals with disabilities to perform essential job functions.
Additional Details
Travel Required: 10%
Job Status: Regular
Employee Type: Full
Primary Location: MILWAUKEE - N WATER ST
All locations: US-WI-Milwaukee

About WSP

WSP USA is the U.S. operating company of WSP, one of the world's leading engineering and professional services firms. Dedicated to serving local communities, we are engineers, planners, technical experts, strategic advisors and construction management professionals. WSP USA designs lasting solutions in the buildings, transportation, energy, water and environment markets. With more than 15,000 employees in over 300 offices across the U.S., we partner with our clients to help communities prosper. www.wsp.com

WSP provides a flexible and agile workplace model while meeting client needs. Employees are also afforded a comprehensive suite of benefits including medical, dental, vision, disability, life, and retirement savings focused on providing health and financial stability throughout the employee’s career.

At WSP, we want to give our employees the challenges they seek to grow their careers and knowledge base. Your daily contributions to your team will be essential in meeting client objectives, goals and challenges. Are you ready to get started?

WSP USA (and all of its U.S. companies) is an Equal Opportunity Employer Race/Age/Color/Religion/Sex/Sexual Orientation/Gender Identity/National Origin/Disability or Protected Veteran Status.

The selected candidate must be authorized to work in the United States.

NOTICE TO THIRD PARTY AGENCIES:

WSP does not accept unsolicited resumes from recruiters, employment agencies, or other staffing services. Unsolicited resumes include any resume or hiring document sent to WSP in the absence of a signed Service Agreement where WSP has expressly requested recruitment/staffing services specific to the position at hand. Any unsolicited resumes, including those submitted to hiring managers or other business leaders, will become the property of WSP and WSP will have the right to hire that candidate without reservation – no fee or other compensation will be owed or paid to the recruiter, employment agency, or other staffing service.",-1,-1,$5 to $25 million (USD),-1,10000+ Employees,Company - Private,False
