Job Title,Company Name,Location,Salary Estimate,Rating,Job Description,Founded,Industry,Revenue,Sector,Size,Type,Easy Apply
Data Center ACI-Arista Fabric Network Engineer IV,"Retail Business Services
","Scarborough, ME",$53K - $87K (Glassdoor est.),3.8,"Address: USA-ME-Scarborough-145 Pleasant Hill Rd
Store Code: Infrastructure-Network (5118718)




Retail Business Services, ranked No. 25 on Fast Company’s 2022 100 Best Workplaces for Innovators, is the services company of leading grocery retail group Ahold Delhaize USA, which includes Food Lion, Giant Food, The GIANT Company, Hannaford and Stop & Shop.


Primary Purpose:

A Sr Data Center ACI-Arista Fabric Network Engineer will provide expertise and leadership in the design, configuration, and management of all corporate, distribution center and retail digital media devices and associated supporting services. They are expected to work in a fast-paced and challenging environment leveraging forward-thinking technical engineering expertise in the media device and services area of the enterprise.

Duties and Responsibilities:

Lead the overall design and implementation of the technology stack within the RBS Data Centers.

Develop process, procedures, and maintain documentation for RBS managed data centers.

Document network infrastructure and environment design and keep updated with changes to the environment.

Report on the health of the RBS data centers by performing capacity planning and proactively provide recommendations for future growth.

Manage day to day activities and provide guidance of Managed Service Provider engineers.

Provide escalated technical support for Managed Service Providers.

Manage vendor relationship.

Provide subject matter expertise in the analysis, design and preparation of technology solutions to meet business needs

Recommends components for solutions that will work well together across business domains, partner with domain architect or act as the domain architect to ensure adherence to the architectural roadmap

Accountable for projects/applications/infrastructure meeting business needs are delivered in a timely, cost-effective manner considering all budget aspects including total cost of ownership.

Ensures project artifacts are developed as required, this includes working with support organizations and suppliers to ensure proper documentation is created and stored in the procedure’s manual or document repository.

Facilitates/completes the creation of communication plans, ensuring that appropriate information is exchanged among key stakeholders.

Develops complete and robust test plans, cases, and scripts, ensures defects are properly resolved and user acceptance is obtained. Ensures the test scripts and defects are entered and tracked in our department tools.

Acts as communication point keeping the supplier and business partners informed of infrastructure changes, application changes, data changes or upcoming implementations and ensures business specific impacts are addressed.

Ensures integration and consideration of assigned business areas against critical business processing, freeze periods, schedule changes, weather events and significant refresh activities.

Review’s business processes to understand capability gaps and opportunities

Recommends Innovations and business processes /systems simplifications

Builds close relationships with the function heads and their teams. Advise these teams on how technology can be used to match or outpace competitor performance.

Works as 3rd level support to help resolve issues within area of responsibility

Maintains a high level of individual contribution, professional growth, and ability to function effectively and independently, challenges others to do the same

Qualifications:

Bachelor's Degree in Computer Science or Technical field and master's degree in Technology and/or Business-related field equivalent trainings/certifications/experience equivalency will be considered

5 or more years of equivalent experience in relevant job or field of technology.

2 or more years of equivalent experience in an advanced role or technical capacity, leading teams directly or indirectly.

2 or more years' experience directly responsible for guiding, training or onboarding team members in relevant technologies, capabilities or skills

Preferred Qualifications:

Post graduate degree advanced training and or certifications in relevant field/s of study preferred.

3 or more years experience in Agile teams and Product/Platform based operating model.

3 or more years of experience in leading teams or advancing technical capability in teams.

Experience in retail or grocery preferred.

#LI-RV1 #DiceJobs #LI-Hybrid


Retail Business Services currently provides services to five omnichannel grocery brands, including Food Lion, Giant Food, The GIANT Company, Hannaford and Stop & Shop. Retail Business Services leverages the scale of the local brands to drive synergies and provide industry-leading expertise, insights and analytics to local brands to support their strategies. We are committed to diversity, equity and inclusion and we foster a community of belonging where everyone is valued.

Retail Business Services is an equal opportunity employer. We comply with all applicable federal, state and local laws. Qualified applicants are considered without regard to sex, race, color, ancestry, national origin, citizenship status, religion, age, marital status (including civil unions), military service, veteran status, pregnancy (including childbirth and related medical conditions), genetic information, sexual orientation, gender identity, legally recognized disability, domestic violence victim status or any other characteristic protected by law. We provide reasonable accommodations to applicants and employees with disabilities. As important as what we do is how we do it. Our team embodies our values of Courage, Care, Teamwork, Integrity and Humor in everything that they do. We have a culture of care that values and celebrates the qualities and perspectives that make us all unique.

If you have a disability and require assistance in the application process, please contact our Talent Acquisition Department at tad@retailbusinessservices.com.

For more information, visit https://www.retailbusinessservices.com.


Job Requisition: 313850_external_USA-ME-Scarborough_9172023",-1,Food & Beverage Stores,$25 to $100 million (USD),Retail & Wholesale,1001 to 5000 Employees,Company - Public,False
