Job Title,Company Name,Location,Salary Estimate,Rating,Job Description,Founded,Industry,Revenue,Sector,Size,Type,Easy Apply
Data Science Engineer,"Harmann Studios
","De Pere, WI",$26.00 Per Hour (Employer est.),2.6,"Harmann Studios is the longest continuous running photography studio in Northeastern Wisconsin. Being a trusted brand, we have experienced growth with our 25 full-time team members and thousands of clients. Utilizing our four core values and our vision of providing the best internal and external experience for our team and our clients, our company’s culture is second to none. We can only sum it up in one word, family.


Our technology has grown with us but we see that we need a talented person to join our team that is eager to utilize and integrate our databases with a touch of AI to assist us staying ahead of our competitors and provide a unique experience to our clients. If you enjoy being around family, think outside the box, and enjoy helping others, you would be a great fit into our culture at Harmann Studios .




Job Overview:

Harmann Studio has a newly created opportunity for a Data Science Engineer to join our team. In this role, you will be responsible for design, development, and support of data pipelines from multiple applications and sources to facilitate data analytics needs. This position plays a critical role in the growth and transformation of the business. The self-motivated candidate will demonstrate ability to perform an appropriate level of strategic thinking by viewing initiatives both within the immediate project context as well as the overall architectural vision. Success will come from being able to prioritize, deliver value incrementally, problem solve, and manage changing priorities.


Responsibilities:

Develop SQL code or data flow to integrate and transform data from multiple sources into useful, consistent, and easily consumable data elements
Participate in discussions on design options and approaches, propose solutions and develop the new capabilities
Work on troubleshooting, identifying issues and performance bottlenecks, problem solving and impact analysis
Analyze process optimization opportunities and provide data-driven recommendations
Architect, implement, and verify end-to-end data solutions
Stay current with industry trends and emerging technologies to drive innovation



Skills & Qualifications:

2023 & 2024 Graduates earning a bachelor’s degree in data science, computer science, information systems, software engineering, or related field
Experience with SQL, Azure, Python, PowerBI, and the ability to create and link API’s
Experience with AI technologies a plus
Proficient in data management, data mapping, and data profiling
Knowledge of analytics software technologies and strategies, technical design and architectural standards, programming, monitoring, basic engineering modeling and troubleshooting that enables software-related technologies
Ability to create and build positive and productive relationships internally with employees and leadership
Excellent written, oral communication, project management, and presentation skills; ability to present complex data and statistics in a simple and clear way



As part of the Harmann team, you will have the benefit of:

Comprehensive benefit package including Health, Dental, Vision, Life, Paid Vacation, & Retirement Plan
Tuition reimbursement options
Referral Program
On-site fitness center & basketball court
Access to the latest network and print technology



Our Question to you?

Would you like to become part of a very proud, caring organization that offers fun and flexibility while creating lifelong memories? If so, we want you on our Team!


See what we're all about at www.harmann.com.",1960,Photography,$1 to $5 million (USD),Media & Communication,1 to 50 Employees,Company - Private,True
Data Engineer (HYBRID TELEWORK),"Lockheed Martin
","Milwaukee, WI",-1,4.1,"Job ID: 654022BR
Date posted: Oct. 06, 2023
Program: Derco-Wide

Description:We are committed to work life balance by promoting this HYBRID TELEWORK opportunity. These job requirements allow the employee to work at a Lockheed Martin-designated office or job site for part of their schedule and has a predefined regular, recurring telework schedule for the remaining part of their work schedule.

At Lockheed Martin, we are passionate about innovation and integrity. We believe that by applying the highest standards of business ethics and forward-thinking, everything is within our capacity - and yours as a Lockheed Martin employee. Lockheed Martin values your skills, training, education and background.
We are committed to work life balance by promoting this remote telework option. These job requirements allow the employee to work their entire schedule somewhere other than a Lockheed Martin designated office or job site.
Do you want to be part of an environment that encourages and supports employees to think big, perform with quality and build incredible products? We provide the resources, encouragement, and focus - if you have the resourcefulness and courage to work hard, then we want to build a better tomorrow with you. Come and experience your future!

Lockheed Martin RMS and Derco, a Lockheed Martin Company, are seeking a Data Engineer to support the growth of our business analytics. This individual will be responsible for developing and maintaining our data warehouse, as well as performing data cleansing and data governance functions.
This individual will be a valued member of out Business Analytics team and will be tasked with providing an accurate and reliable data stream for use in various analyses and reports. The will be charged with managing a number of data sources and performing ETL tasks to prepare and deliver data to our analysts and users.
Basic Qualifications:

Bachelor's degree from an accredited college in Engineering, Computer Science or related discipline.
Experience with databases select, join, union, from, where, create, update, delete operations (SQL)
Experience with structured and unstructured data in relational databases, including data warehouse hosted in the cloud (SAP HANA)
Experience creating and maintaining data architecture or data modeling
Desired Skills:

Experience in SAP HANA WebIDE development, including calculation view modeling, function creation, and SQL scripting
Experience with ETL tools such as Alteryx
Experience with DevOps tools: Docker, Git [GitLab, GitHub]
Experience with IFS ERP system
Experience with Python or other general programing languages
Clearance Level: None
Other Important Information You Should Know
Expression of Interest: By applying to this job, you are expressing interest in this position and could be considered for other career opportunities where similar skills and requirements have been identified as a match. Should this match be identified you may be contacted for this and future openings.
Ability to Work Remotely: Part-time Remote Telework: The employee selected for this position will work part of their work schedule remotely and part of their work schedule at a designated Lockheed Martin facility. The specific weekly schedule will be discussed during the hiring process.
Work Schedules: Lockheed Martin supports a variety of alternate work schedules that provide additional flexibility to our employees. Schedules range from standard 40 hours over a five day work week while others may be condensed. These condensed schedules provide employees with additional time away from the office and are in addition to our Paid Time off benefits.
Schedule for this Position: 4x10 hour day, 3 days off per week
Lockheed Martin is an Equal Opportunity/Affirmative Action Employer. All qualified applicants will receive consideration for employment without regard to race, color, religion, sex, pregnancy, sexual orientation, gender identity, national origin, age, protected veteran status, or disability status.
At Lockheed Martin, we use our passion for purposeful innovation to help keep people safe and solve the world's most complex challenges. Our people are some of the greatest minds in the industry and truly make Lockheed Martin a great place to work.

With our employees as our priority, we provide diverse career opportunities designed to propel, develop, and boost agility. Our flexible schedules, competitive pay, and comprehensive benefits enable our employees to live a healthy, fulfilling life at and outside of work. We place an emphasis on empowering our employees by fostering an inclusive environment built upon integrity and corporate responsibility.

If this sounds like a culture you connect with, you're invited to apply for this role. Or, if you are unsure whether your experience aligns with the requirements of this position, we encourage you to search on Lockheed Martin Jobs, and apply for roles that align with your qualifications.
Experience Level: Experienced Professional
Business Unit: RMS
Relocation Available: Possible
Career Area: Data Science
Type: Full-Time
Shift: First",1995,Aerospace & Defense,$10+ billion (USD),Aerospace & Defense,10000+ Employees,Company - Public,False
Senior Software Engineer (Big Data),"KOHLS
","Menomonee Falls, WI",$126K - $159K (Glassdoor est.),3.4,"Who are we? At Kohl's, we are revolutionizing the retail industry by leveraging the power of technology to create exceptional customer experiences. We are seeking passionate and innovative Big Data Software Engineers to join our product-centric environment that will unleash your full potential. As a Senior Big Data Software Engineer at Kohl's, you will play a crucial role in developing and maintaining our data infrastructure and analytics solutions. You will be responsible for designing, building, and optimizing scalable big data pipelines and applications, leveraging technologies such as Python, Spark, SQL, Airflow, and Google Cloud Platform (GCP). You will work closely with cross-functional teams to understand data requirements, identify opportunities for data-driven insights, and develop solutions to address complex business problems. So, if you're ready to join a team that values your expertise, encourages your creativity, and provides you with the tools to thrive, then look no further. Apply now and be part of our exciting journey to redefine the future of retail!

Big Data Software Engineer

What You’ll be Doing:

Drive development, testing, deployments, and iterative improvement of product capabilities and features in collaboration with designers, product managers, and other engineers on the product team
Develop and maintain scalable data processing systems using Python, Spark, SQL, Airflow, and GCP (Google Cloud Platform).
Design, implement, and optimize data pipelines, ETL processes, and data workflows to support analytics and reporting requirements.
Collaborate with the DevOps team to ensure the deployment, scalability, and security of big data infrastructure and applications.
Contribute to code reviews, documentation, and best practices to foster a collaborative and high-quality engineering culture. Pairs with and mentors engineers while evangelizing best practices.

Qualifications:

Bachelor's degree or equivalent experience in Computer Science, Engineering, or a related field.
Strong proficiency in Python, Spark, SQL, and Airflow for developing data processing solutions.
Experience with big data technologies and frameworks such as Hadoop, Hive, or BigQuery.
Hands-on experience with cloud platforms, preferably GCP, for building and deploying scalable data solutions.
Experience with version control systems, code management, and CI/CD pipelines.
In-depth knowledge of application design patterns, event-driven architecture, database, schemas, and testing strategies
Experience with large scale application troubleshooting and performance tuning
Database Design experience including either SQL, PL/SQL
Experience with or interest in working in a Pair Programming, TDD environment",1962,"Department, Clothing & Shoe Stores",$10+ billion (USD),Retail & Wholesale,10000+ Employees,Company - Public,False
Azure Data Engineer,"Intone Networks
","Milwaukee, WI",$87K - $123K (Glassdoor est.),4.3,"Must Haves: 5-8 years of experience specifically with Azure (not interested in AWS or Google technologies unless 5-7 specifically in AWS) Experience working with offshore support and architecture teams 5+ years working with data modeling (specifically Azure Analysis and/or Synapse) 3 days a week hybrid model onsite in Milwaukee (Wed/Thurs/Fri) 3-5 years of experience working on platform project-based work Experience working with Databricks (for code) and DataFactory( for pipelines) both within Azure **Can be H1B, GC, or USC but cannot support OPT!** Plusses: Experience with IoT (Information of Things) Previous work with SAP Manufacturing Industry background (low priority) Day to Day: This resource will be working on two different project initiatives and business as usual functions of the data analytics team. They will bring data from source to target and will work to bring data into Azure Analytics and make it available for various internal teams. They will modify data and create pipelines (specifically with DataFactory), as well as metrics. They will need to work within the code (Databricks and Python background) written to build logics. Data will be pulled from various sources such as Salesforce, SQL, SAP, APIs and third parties, etc. Reporting will be handled by a separate team, but if needs arise to jump into reports they need to have familiarity with Power BI. Projects surround sunsetting several databases and moving to modern architecture, as well as creating new programs surrounding Data Liability and Data Availability companywide.",-1,Information Technology Support Services,$5 to $25 million (USD),Information Technology,201 to 500 Employees,Company - Private,False
Lead Cloud Data Engineer,"Intone Networks
","Madison, WI",$93K - $124K (Glassdoor est.),4.3,"Lead Cloud Data Engineer Must have at least 5-7 years: • Azure Cloud • Apache Spark • Cloud Computing • CI/CD • Databricks • Datalakes • Python or Scala (python preferred) • SQL • Must have mentored others or in a lead role Nice to have: • Azure Government Cloud • Data Modeling • Medallion Architecture • ADP Clearance Job Description - • Can define, develop, and implement data pipelines from internal and external data sources using Continuous Integration / Continuous Development (CI/CD) best practices. • Have previously deployed production quality pipelines to the cloud in a cost-effective, reliable, performant, and efficient manner. • Can engineer solutions using SQL and Python (or Scala) for data processing (in this role Python preferred). • Design data platform solutions for a greenfield, company-wide initiative in the Azure Cloud - Azure GCC High. • self-starter who can work in ambiguous situations, rapidly learn, and adapt. • Possess excellent skillsets in general data engineering and management, client interaction, and design usability. • Have experience in Agile project methodologies. • Approach challenges head on with creativity, determination, and passion that ignites other to do so as well. • Can partner with other organizational entities, (e.g., Finance, Actuarial, Enterprise Architecture, Data Warehouse) to determine most effective data models for analytical reports. • Have experience using the Medallion Architecture to model, organize, and aggregate data in Databricks",-1,Information Technology Support Services,$5 to $25 million (USD),Information Technology,201 to 500 Employees,Company - Private,False
Data & Analytics Engineer,"Robert W. Baird
","Madison, WI",$83K - $112K (Glassdoor est.),4.3,"As we continue to grow and add top talent to the Baird family of technical associates, we are looking for a Data & Analytics Engineer for our growing data team. This is a key role on our IT Data Team requiring a broad range of skills and the ability to step into different roles depending on the size and scope of the business need. The self-motivated candidate will have proven experience architecting successful data solutions on key projects in a collaborative environment. Success will come from being able to prioritize, deliver value incrementally, problem solve, and manage changing priorities. You will work closely with our business partners and interface with both technical and non-technical colleagues.

This position is hybrid, working a combination of remote and in-office in our new collaborative work space. We offer a collaborative culture with a continuous learning, agile/lean environment and adding value to the Baird business. Learn more about Baird IT here.


As a Data & Analytics Engineer, you will:

Data Architecture

Specialize in data modeling, both 3NF and dimensional, with experience in conceptual, logical, physical, and industry data modeling. Strong knowledge and experience with data architecture methodologies.
Apply the appropriate level of modeling theory, pattern recognition, and abstractions to architect and design a pragmatic solution that functionally meets the business and technical requirements.
Partner with internal business units to define information requirements and translate them into appropriate data solutions.
Collaborate with IT and business partners to lead data discovery, profiling, analysis, and quality assessments in order to obtain clear information requirements.
Develop and validate source to target mappings and transformation logic required to support business needs. Understand the importance of capturing data lineage.
Architect, implement and verify end-to-end data solutions.
Develop test plans needed to ensure a quality deliverable. Participate in validation testing, coordinate user acceptance testing and training to ensure the final implementation enables the user to solve their business problem.

General Data Management

Play a critical role in architecting our data and analytics solution landscape
Demonstrate competence, experience, knowledge, understanding, and advocacy of data management concepts, data warehousing, BI, and analytics.
Demonstrate ability to perform appropriate level of strategic thinking by viewing initiatives both within the immediate project context as well as the overall architectural vision.
Participate and/or Lead in data architectural design and strategy discussions.

Data Delivery

Work with the business users to conduct data discovery engagements and can quickly identify, and prototype, a solution that brings together multiple data sources into one coherent concept and understanding. (data blending)
Leverage existing tools to create data visualizations and mentors the business to be self-sufficient.

Collaborate – build relationships!

Identify and communicate project risks and impediments and proactively work with other members of the Analytics team to complete high-value deliverables as identified by business partners and team leadership.
Partner with Analytics team members to translate business and functional requirements into technical designs
Strive to understand the data consumption needs of the business community, as well as the problems faced by business users involving the access and use of data
Help Analytics teams develop solutions that enable businesses to capitalize on business insights and drive toward gaining a competitive advantage

What makes this opportunity great:
Information technology is a core part of Baird’s business strategy and plays a critical role in the growth and transformation of the firm.
On Computerworld’s ‘Best Company to Work For’ list for five consecutive years with a collaborative culture that values diverse backgrounds and perspectives while emphasizing teamwork and a strong sense of partnership.
Support and flexibility to grow and be your best at work, at home, and in the community.
What we look for:
Minimum of 3-5 years of experience in Data Solution delivery in a complex environment working collaboratively in a team setting
Proficient in Data Solution tools and concepts such as:
Business Intelligence tools: Microsoft tools (SQL Server Management Studio, SSRS, SSAS, Power Pivot, Power Query, PowerBI), Alteryx
Database: SQL Server
Data Query tools: SQL, T-SQL
Data Management and Quality: data mapping, data profiling, metadata repository, relational data modeling, master data management
Data Modeling: ER/Studio Data Architect, 3NF and dimensional modeling
Data Warehousing concepts: Inmon, Kimball, Data Lake
Data Integration concepts and strategies: EII, ETL, EL-T and EAI

#LI-SB1

Commitment to Inclusion & Diversity

Baird is committed to inclusion & diversity for our clients, our associates and the communities where we live and work. This commitment stems from our culture of integrity, genuine concern for others and respect for the individual. We view inclusion & diversity as an ongoing journey – one of shared responsibility, continuous improvement and a focus on progress. We invite you to join us as we work together to foster an environment where diversity unites rather than divides us.",1919,Investment & Asset Management,$1 to $5 billion (USD),Financial Services,1001 to 5000 Employees,Company - Private,False
Systems Engineer- Data,"ACUITY, A Mutual Insurance Company
","Sheboygan, WI",$66K - $92K (Glassdoor est.),4.7,"Acuity is seeking a Systems Engineer on our Enterprise Data team. The Enterprise Data team is responsible for maintaining the servers and applications related to the storage, processing, and reporting of data collected by Acuity. This teams supports the installations of Db2, Microsoft SQL, and PostgreSQL databases, along with Hadoop and its related services. This team works in conjunction with the DBA's to configure and maintain the databases that run on those platforms. This team also supports the applications that perform the ETL of our data as well as traditional and containerized reporting applications used throughout Acuity. Hybrid work flexibility; a combination of Sheboygan headquarter and remote work.

ESSENTIAL FUNCTIONS:

Provide support and maintenance for distributed or open systems servers.
Provide support and maintenance for all virtualization of servers.
Provide support and maintenance for Linux and Microsoft Windows operating systems.
Provide support and maintenance for data replication systems.
Provide support and maintenance for 3rd party applications as necessary.
Knowledge of progressive security as it pertains to the networking, operating systems, software, and hardware of assigned servers.
Experience with tapeless backup / recovery systems and documenting these processes.
Detailed understanding and experience with network protocols.
Experience with Disaster Recovery planning and testing.
Train local and remote users on operating system software packages and hardware operation.
Test new software products and releases as well as hardware devices.
Assist in establishing standards and trouble reporting procedures.
Assist in system performance monitoring, reporting and tuning.
Assist in the integration of multiple hardware platforms.
Participate in the Disaster Recovery plan and rehearsals.
Design new or revised architectures to include the software, hardware, and communications to support the total requirements and provide for present and future cross-functional requirements and interfaces.
Remain abreast of company and industry directions.
Regular and predictable attendance.
Perform other duties as assigned.



EDUCATION:

Bachelor’s or Associate Degree in Computer Science, MIS or equivalent and continued field specific education.

EXPERIENCE:

3-5 years practical experience in computer operations, applications and/or technical support or information security.

OTHER:

A keen interest and aptitude for problem identification and resolution.

Full understanding of operating system hardware, software, network components, security, and/or database management system.

Ability to provide exact audit trials and recovery points during project life cycles to ensure maximum system stability.

Ability to work cooperatively with technical and non-technical system users and industry vendors.
Good listening ability as well as the ability to competently train others.
Willingness to respond to problems with little notice as well as to adjusting off hours scheduling to meet company project installation dates.
Depending on job responsibilities, may be required to reside within a 2-hour radius of the Acuity corporate headquarters.
Be accountable and respond when reached out to for assistance during and outside of typical work hours, this may include participating in an off-hour call list.



This job is classified as exempt.

We are an Equal Employment Opportunity employer. Applicants and employees are considered for positions and are evaluated without regard to mental or physical disability, race, color, religion, gender, national origin, age, genetic information, military or veteran status, sexual orientation, marital status or any other protected Federal, State/Province or Local status unrelated to the performance of the work involved.",1925,Insurance Carriers,$1 to $5 billion (USD),Insurance,1001 to 5000 Employees,Company - Private,False
