Job Title,Company Name,Location,Salary Estimate,Rating,Job Description,Founded,Industry,Revenue,Sector,Size,Type,Easy Apply
Data Engineer - 5050304,"Accenture
","Miami, FL",-1,3.9,"Accenture Flex offers you the flexibility of local fixed-duration project-based work powered by Accenture, a leading global professional services company. Accenture is consistently recognized on FORTUNE's 100 Best Companies to Work For and Diversity Inc's Top 50 Companies For Diversity lists.

As an Accenture Flex employee, you will apply your skills and experience to help drive business transformation for leading organizations and communities. In addition to delivering innovative solutions for Accenture's clients, you will work with a highly skilled, diverse network of people across Accenture businesses who are using the latest emerging technologies to address today's biggest business challenges.

You will receive competitive rewards and access to benefits programs and world-class learning resources. Accenture Flex employees work in their local metro area onsite at the project, significantly reducing and/or eliminating the demands to travel.

Utilize strong SQL Python skills to engineer sound data pipelines and conduct routine and ad hoc analysis to assess the performance of legacy products and the saliency of new features.

Build reporting dashboards and visualizations to design, create and track campaign program KPIs.

Perform analyses on large data sets to understand drivers of operational efficiency.

Manage end to end process of analytic tooling feature development, including request intake, requirements evaluation, cross functional team alignment, feature execution, QA testing, and stakeholder communication.

Consult with business analysts, technical data SMEs, and cross functional partners to understand their reporting and data needs, serving as the point of contact for requests, inquiries, and actions.

Interface with other data engineering, product, and data science teams to implement client needs and initiatives.




Basic Qualifications:

Minimum 2 years experience with Python.

Minimum 3 years experience SQL.

Minimum 3 years experience Big Data Analytics.

High School Diploma or GED.

Preferred Qualifications:

Experience with large enterprise data sets.

Bachelors Degree

Compensation at Accenture varies depending on a wide array of factors, which may include but are not limited to the specific office location, role, skill set and level of experience. As required by local law, Accenture provides a reasonable range of compensation for roles that may be hired in California, Colorado, New York, or Washington as set forth below.

Information on benefits is here.

Role Location

California: $61.53 to $71.53/hour

Colorado: $61.53 to $71.53/hour

New York: $61.53 to $71.53/hour

Washington: $61.53 to $71.53/hour


What We Believe


We have an unwavering commitment to diversity with the aim that every one of our people has a full sense of belonging within our organization. As a business imperative, every person at Accenture has the responsibility to create and sustain an inclusive environment.


Inclusion and diversity are fundamental to our culture and core values. Our rich diversity makes us more innovative and more creative, which helps us better serve our clients and our communities. Read more here


Equal Employment Opportunity Statement


Accenture is an Equal Opportunity Employer. We believe that no one should be discriminated against because of their differences, such as age, disability, ethnicity, gender, gender identity and expression, religion or sexual orientation.


All employment decisions shall be made without regard to age, race, creed, color, religion, sex, national origin, ancestry, disability status, veteran status, sexual orientation, gender identity or expression, genetic information, marital status, citizenship status or any other basis as protected by federal, state, or local law.


Accenture is committed to providing veteran employment opportunities to our service men and women.


For details, view a copy of the Accenture Equal Employment Opportunity and Affirmative Action Policy Statement.


Requesting An Accommodation


Accenture is committed to providing equal employment opportunities for persons with disabilities or religious observances, including reasonable accommodation when needed. If you are hired by Accenture and require accommodation to perform the essential functions of your role, you will be asked to participate in our reasonable accommodation process. Accommodations made to facilitate the recruiting process are not a guarantee of future or continued accommodations once hired.


If you would like to be considered for employment opportunities with Accenture and have accommodation needs for a disability or religious observance, please call us toll free at 1 (877) 889-9009, send us an email or speak with your recruiter.


Other Employment Statements


Applicants for employment in the US must have work authorization that does not now or in the future require sponsorship of a visa for employment authorization in the United States.


Candidates who are currently employed by a client of Accenture or an affiliated Accenture business may not be eligible for consideration.


Job candidates will not be obligated to disclose sealed or expunged records of conviction or arrest as part of the hiring process.


The Company will not discharge or in any other manner discriminate against employees or applicants because they have inquired about, discussed, or disclosed their own pay or the pay of another employee or applicant. Additionally, employees who have access to the compensation information of other employees or applicants as a part of their essential job functions cannot disclose the pay of other employees or applicants to individuals who do not otherwise have access to compensation information, unless the disclosure is (a) in response to a formal complaint or charge, (b) in furtherance of an investigation, proceeding, hearing, or action, including an investigation conducted by the employer, or (c) consistent with the Company's legal duty to furnish information.",1989,Business Consulting,$10+ billion (USD),Management & Consulting,10000+ Employees,Company - Public,False
"Sr. Cloud Data Engineer, Data Operations","CardWorks
","Orlando, FL",$76K - $123K (Glassdoor est.),3.1,"CardWorks Servicing (""CWS"") is one of the largest privately-held provider of outsourcing services for bankcard-related products to banks and non-bank lenders in North America. CWS offers management expertise across the credit spectrum and supports both MasterCard and Visa accounts as well as a variety of private label debit, credit, stored value, and customer bankcards.

Position Summary:
As a Senior Cloud Data Engineer, you will support data engineering related initiatives within Data Operations department with a focus on building data & analytics platform and data stores for consumption by data operations, reporting, business intelligence and analytics user community. This role is responsible for developing data ingestion patterns, data pipelines, data extraction, load, and transformation (ETL) programs, ETL test plans, and automating the ETL process through scheduling and exception-handling routines.

Essential Functions:

Works with business teams to understand business use cases, requirements and translate business requirements into data requirements.
Works with applications specialists (SMEs) to understand data sources and perform data discovery and document the learnings
Creates ETL system design specifications and data flow diagrams etc.
Prepares technical and system specifications documents including Source to Target Mapping covering data sources integration patterns, controls, data transformation and load rules.
Design, develop, test, and deploy ELT programs to extract, stage, cleanse, transform and load the data needed.
Troubleshoots, maintains, and supports the warehouse and the downstream data feeds sent to consuming applications.
Supports system, integration and UAT testing.
Assists with performing source data quality assessments
Performs root cause analysis, resolves production issues and supports production teams.
Performs other job duties as assigned and fulfill report and data extraction requests as needed
Adherence to legal and company standards
Education and Experience:

Bachelor’s degree in software engineering/computer science/information technology or related field is required.
Five (5) years’ experience in ETL/ELT development including building data ingestion & integration pipelines.
Minimum three (3) years’ experience in AWS Cloud technologies and data integration tools such as Amazon S3, Amazon Athena, AWS Glue, AWS Glue Catalog, AWS Lake Formation etc.
Experience in scripting languages: Python, SQL
Experience working with Analytics Databases like Snowflake, Redshift
Experience in Big Data technologies like Data Lakes, Delta Lake, Data Factory, relational data stores in AWS Cloud Platform
Working knowledge of message queuing, stream processing, and highly scalable ‘big data’ stores
Experience building and implementing data ingest and egress patterns and pipelines.
Ability to troubleshoot and solve complex technical problems.
Strong project management skills
Clear communication skills
Consumer Financial Services background, preferably credit card business knowledge
Summary of Qualifications:

Ability to gather requirements, apply strong analysis and design skills to build ELT and system specifications
Proficient in designing and developing SQL Queries & ETL Programs using cloud technologies and tools.
Strong project management & analytical skills
Ability to work with data warehouse users, IT Business Analysts
Strong problem solving, written and verbal communication skills
Hands on experience with SQL-Based databases (e.g., Snowflake)
Proficiency in Python
Experience in Informatica ETL Tools will be an added advantage
We are an equal opportunity employer, and we evaluate qualified applicants without regard to race, color, religion, sex, national origin, disability, veteran status or any other legally protected characteristic. We will conduct a thorough background check for all hires in compliance with applicable law which includes (but may not be limited to) a review of factors including the applicant’s personal credit history, drug testing, and employment/personal references.",1987,Banking & Lending,$25 to $100 million (USD),Financial Services,501 to 1000 Employees,Company - Private,True
Azure Data Engineer,"Wipro Limited
","Orlando, FL",$85K - $114K (Glassdoor est.),3.1,"Overview:
About Wipro:
Wipro Limited (NYSE: WIT, BSE: 507685, NSE: WIPRO) is a leading technology services and consulting company focused on building innovative solutions that address clients’ most complex digital transformation needs. We leverage our holistic portfolio of capabilities in consulting, design, engineering, operations, and emerging technologies to help clients realize their boldest ambitions and build future-ready, sustainable businesses. A company recognized globally for its comprehensive portfolio of services, strong commitment to sustainability and good corporate citizenship, we have over 250,000 dedicated employees serving clients across 66 countries. We deliver on the promise of helping our customers, colleagues, and communities thrive in an ever-changing world.
A PROUD HISTORY OF OVER 75 YEARS
FY22 REVENUE 10.4 BN USD
WE’RE PRESENT IN 66 COUNTRIES
OVER 1,400 ACTIVE GLOBAL CLIENTS

Role - Azure Data Engineer

Location - Remote (Anywhere in USA)

JD for this requirement
Strong proficiency in designing and implementing data integration solutions using Azure Data Factory
Good experience in data load from different data sources like DBs, APIs, Flat files and cloud based data sources like ADLS, Amazon S3
Design, develop, and deploy data integration and transformation solutions using Azure Data Factory
Develop and maintain data pipelines to extract, transform, and load (ETL) data from various sources into target data repositories
Solid understanding of data modeling, data warehousing concepts, and ETL principles.
Familiarity with Azure services and tools, including Azure Blob Storage, Azure SQL Database, Azure Data Lake
Strong knowledge in SQL language
Implement data validation and quality to ensure accuracy and consistency of data
Optimize data pipelines for performance and scalability
Have worked with high data volume and continuous data flow
Very good communication and presentation skill

Wipro is an Equal Employment Opportunity employer and makes all employment and employment-related decisions without regard to a person's race, sex, national origin, ancestry, disability, sexual orientation, or any other status protected by applicable law.",1945,Information Technology Support Services,$5 to $10 billion (USD),Information Technology,10000+ Employees,Company - Public,False
Data Engineer,"Elder Research Inc
","Tampa, FL",$87K - $124K (Glassdoor est.),4.4,"DATA ENGINEER

Work Locations: Tampa, Florida

Clearance: Top Secret with SCI Eligibility

Elder Research Inc. is a recognized leader in predictive analytics and machine learning. We pride ourselves in our ability to find creative, cutting edge solutions to real-world problems. We are looking for innovative and inquisitive self-starters who enjoy translating complex models into actionable solutions that deliver real value for our clients.

As a member of the Elder Research team, you will join a functional team of accomplished Data Scientists and Software Engineers that deliver custom analytic solutions. Some of your responsibilities will include: wrangling and fusing large and disparate data sets, assisting in the deployment of models and algorithms, automating the entire data pipeline, and communicating model results through user-focused data visualizations.

We are looking for an experienced Data Engineer to join our team! In this role, you will support robust and repeatable data manipulation, large scale infrastructure for data ingestion, and stunning data visualization for custom client applications.

Required Qualifications:

5+ years of Data Engineering or Data Management experience.
Strong SQL skills, and ability to identify issues with data.
Understanding of database and database design
Demonstrated experience with cleaning, processing, managing, and optimizing performance of large volumes of data.
Demonstrated experience within an AWS environment (AWS certifications preferred)
Familiarity with industry best-practices for software-hardware optimization when processing large sets of data.
Experience with machine learning, with statistical modeling, time-series forecasting and/or geospatial analytics is preferred.
Experience with Hadoop, Spark or other parallel storage/computing processes is a plus.
Ability to travel to and work on site at clients as needed.
Excellent communication skills both verbal and written
Hands on experience with cloud native data warehousing and data lake solutions with Azure ADF, Redshift, Snowflake, etc
Engineering experience and seasoned coder in one or more relevant language: Python, Java, Scala, SQL, etc


About Elder Research, Inc.

Elder Research is a fast growing consulting firm specializing in predictive analytics and machine learning. Elder Research has been in the data science business for over 20 years providing analytic solutions to hundreds of companies and organizations across numerous industries. At Elder Research, you’ll be part of a fun, friendly community. In keeping with our entrepreneurial spirit, we want candidates that are self-motivated with an innate curiosity and strong team work ethic. We work hard to provide the best value to our clients and allow each person to contribute their ideas and put their skills to use immediately.

Achieving success on defense, intelligence and security projects requires a data science team with broad experience, critical thinking, a proven ability to solve complex problems, and the ability to effectively communicate results. Our scientists conduct analysis in a collaborative environment that frequently brings together the expertise of decision-makers, analysts, agents, investigators, and even behavioral scientists. Our team relies on well-trained technical personnel who have experience with tools, algorithms, best practices, and custom software development to navigate the frontier of unsolved problems we typically encounter. Our team enjoys great variety in the type of work they do and exposure to a wide range of analytic techniques and tools.

Elder Research, Inc. is an Equal Opportunity Employer. All qualified applicants will receive consideration for employment without regard to race, color, religion, sex, sexual orientation, gender identity, national origin, or protected veteran status and will not be discriminated against on the basis of disability.",1995,Business Consulting,$5 to $25 million (USD),Management & Consulting,51 to 200 Employees,Company - Private,True
Data Engineer,Sparibis,"Orlando, FL",$67K - $117K (Glassdoor est.),-1.0,"Location: 100% Remote

Years' Experience: 5+ years

Education: bachelor's degree in computer science, Engineering, Mathematics, Statistics, Business, or similar field

Work Authorization: Must show that applicant is legally permitted to work in the United States.

Clearance: Applicants must be able to meet the requirements to obtain a Secret security clearance. NOTE: United States Citizenship is required

Key Skills:

Experience in Databricks is required.
Experience with data engineering, mapping, and modeling tools
Current certifications in Network+, Security+, or higher
Responsibilities


Implement and validate predictive and prescriptive models, create, and maintain statistical models with a focus on big data.
Oversee Databricks clusters and document parameters.
Support development of data sets, data processes and data acquisition to support the data hub activities.
Incorporate a variety of statistical and machine learning techniques in your projects.
Write programs to cleanse and integrate data in an efficient and reusable manner.
Participate end to end in the product life cycle: requirements gathering, solution design, development, testing, and implementation.
Work in an Agile, collaborative environment to bring analytical rigor and statistical methods.
Communicate with internal and external clients to understand and define business needs and appropriate modelling techniques to provide analytical solutions.
Evaluate modelling results and communicate the results to technical and non-technical audiences.
Build reusable code and libraries for future use.
Create work estimates and meet project deadlines.
Translate application storyboards, requirements docs and use cases into functional applications.
Work both independently and collaboratively with business and development teams to create great user experiences for our customers.
Troubleshoot and resolve any bugs assigned.
Qualifications


3+ years of experience in data using architecture, data engineering, data hub / data warehouse development and design.
Bachelor's degree
Must be able to obtain a Secret Security Clearance. United States Citizenship is required to be able to obtain a Secret clearance.
Must have experience with data architecture concepts and tools such as data warehouse and physical, enterprise, and cloud services
Experience in utilizing data management, enterprise repository, data modeling, data quality and data mapping tools.
Current Network+, Security+, or higher as defined by DoD CIO Information Assurance (IA) certification requirements.
Experience with Databricks is required.
About Sparibis

Sparibis LLC is a professional solution firm that Clients rely on to access the best talent to drive their business success.

Sparibis is an equal opportunity employer that values diversity at all levels. All individuals, regardless of personal characteristics, are encouraged to apply.",-1,-1,Unknown / Non-Applicable,-1,1 to 50 Employees,Company - Private,True
Data Platform Engineer (Data Stewardship),"Clarity Innovations, LLC
","Tampa, FL",$83K - $118K (Glassdoor est.),4.8,"Description

Clarity Innovations connects human creativity with emerging technology to design, develop, and deploy software that enhances mission success. Our focus is redefining the Department of Defense's relationship with technology by encouraging the use of DevSecOps and Agile methodologies, small-teams constructs, modern tech stacks, and automation. Our software improves the lives and work of our end users and enhances innovation. We fulfill our responsibility to our country by delivering mission-changing results that help shape a better and safer world.

Job Description:


A platform engineer (production) is responsible for developing and maintaining the production environment (k8s, Openshift, VMWare PKS Essentials, etc.) They ensure a modern and secure foundation upon which all product teams can deploy containerized applications.

Minimum of 1-year experience is required
Experienced in providing DevSecOps implementation using Jenkins, Gitlab, or similar tools.
Experienced in developing, testing, and maintaining containerized applications utilizing docker, K8s, Openshift, etc.
Working knowledge of Source Version Control and Build/Release tools and methodologies
Strong understanding of Software Build process and how it connects to CI/CD
Must be able to do some coding
Must be 8570 Compliant
Must have some exposure to Data Science
CLEARANCE:

At least “Interim Secret” w/in 30 days of hire is required, while Top Secret clearance eligible for SCI is preferred

Clarity Innovations provides equal employment opportunities (EEO) to all employees and applicants for employment without regard to race, color, religion, sex, sexual orientation, gender identity, national origin, disability or veteran status, or any other protected class.",2013,Research & Development,Unknown / Non-Applicable,Management & Consulting,1 to 50 Employees,Company - Private,False
