Job Title,Company Name,Location,Salary Estimate,Rating,Job Description,Founded,Industry,Revenue,Sector,Size,Type,Easy Apply
Senior Data Engineer,"Lithia Home Office
","Medford, OR",$89K - $128K (Glassdoor est.),3.2,"Dealership:
L0105 Lithia Home Office

Senior Data Engineer

The Senior Data Engineer is responsible for developing and supporting the cutting-edge data solutions by using the Azure stake (Data Lake, Data Warehouse, Data Factory, Functions) SQL script design/dev, and stored procedures.

Responsibilities

Design and implement data load processes from disparate data sources into Azure Data Lake and subsequent Azure SQL & SQL Data Warehouse
Migrate existing processes and data from our On Premises SQL Server and other environments to Azure Data Lake
Explore and learn the latest Azure technologies to provide new capabilities and increase efficiency
Ensure all existing data is created in the right way, and that new data is created according to appropriate standards and with proper documentation
Read, write, and configure code for end-to-end service telemetry, alerting and self-healing capabilities
Strive for continuous improvement of code quality and development practices
Work closely with the Lead Data Engineer and other Data Engineers to develop and document solutions for providing data to the enterprise
Mentor and teach more junior developers

Skills and Qualifications

3+ years of experience in working as an analytics or data engineering member working with cross functional teams
3+ years of SQL Server development or equivalent
Azure SQL DB, SQL Data Warehouse, Azure Data Factory a plus
Version control using Git or TFS
Bachelor’s Degree in computer sciences, Analytics, Systems Eng., Statistics or related field
Strong attention to detail and sense of urgency

Competencies

Does the right thing, takes action and adapts to change
Self-motivates, believes in accountability, focuses on results, makes plans and follows through
Believes in humility, shares best practices, desires to keep learning, measures performance and adapts to improve results
Thrives on a team, stays positive, lives our values

Physical Demands

The physical demands described here are representative of those that must be met by an employee to successfully perform the essential functions of the job.*

Up to 1/3 of time: standing, walking, lifting up to 25 pounds
Up to 2/3 of time: sitting, kneeling, reaching, talking, hearing

Reasonable accommodations may be made to enable individuals to perform the essential functions.

NOTE: This is not necessarily an exhaustive list of responsibilities, skills, or working conditions associated with the job. While this list is intended to be an accurate reflection of the current job, the company reserves the right to revise the functions and duties of the job or to require that additional or different tasks be performed.

We offer best in class industry benefits:
Competitive pay
Medical, Dental and Vision Plans
Paid Holidays & PTO
Short and Long-Term Disability
Paid Life Insurance
401(k) Retirement Plan
Employee Stock Purchase Plan
Lithia Learning Center
Vehicle Purchase Discounts
Wellness Programs

High School graduate or equivalent, 18 years or older required. Acceptable driving record and a valid driver's license in your state of residence necessary for select roles. We are a drug free workplace. We are committed to equal employment opportunity (regardless of race, color, ancestry, religion, sex, national origin, sexual orientation, age, citizenship, marital status, disability, gender identity or Veteran status). We also consider qualified applicants regardless of criminal histories, consistent with legal requirements.",1946,Vehicle Dealers,$10+ billion (USD),Retail & Wholesale,10000+ Employees,Company - Public,True
"Senior Data Engineer, Public Company","Recruiting From Scratch
",United States,$100K - $200K (Employer est.),4.0,"This is for a client of Recruiting from Scratch.
Who is Recruiting from Scratch:
Recruiting from Scratch is a premier talent firm that focuses on placing the best product managers, software, and hardware talent at innovative companies. Our team is 100% remote and we work with teams across the United States to help them hire. We work with companies funded by the best investors including Sequoia Capital, Lightspeed Ventures, Tiger Global Management, A16Z, Accel, DFJ, and more.
Our Client:

Our next evolution is underway as a newly public company looking to expand and continue to build meaningful experiences for our users. From social issues to original content, we’re blazing innovative paths with impact for our community, all while leveraging the latest tech stacks and striving for engineering excellence. At the heart of our work in this new chapter is a shared set of core values: openness and exploration, a bias for action, and strong support of the LGBTQ community.

With a track record of strong financial performance and plans for continued headcount growth, we’re looking to build a team of talented, passionate, and open-minded people who believe in our mission, align with our values, and are excited to work at the intersection of innovative technology and social impact. Come be a part of this exciting journey with us.

What’s so interesting about this role?

Our client is looking to bring on a Senior Data Engineer with chops in cutting edge real-time streaming technologies and ambitions to achieve high quality and reliability with TDD, automation, and continuous delivery. .

In this role, you will have the opportunity to work with our product teams, building models and APIs to drive new features, delivers analysis to further improve engagement in existing features, and empowers our business with real-time insights to drive growth in market share, engagement, and revenue. We see 1 trillion events per year and process 10TB of data daily.

What’s the job?

Design, develop and deliver data products to production, complying with internal data governance, security and scalability of our system.
Moving implementation to ownership of real-time and batch processing and data governance and policies.
Maintain and enforce the business contracts on how data should be represented and stored.
Stay on top of new technologies through R&D and prototyping to continuously improve our big data architectures and systems to streamline how we deliver value with high quality to our end users
Implementing ETL processes, moving data between systems including S3, Snowflake, Kafka, and Spark.
Work closely with our Data Scientists, SREs, and Product Managers to ensure software is high quality and meets user requirements.

What we’ll love about you

5+ years of experience working with data at scale, including data engineering, business intelligence, data science, or related field.
7+ years experience using Python,
Experience using big data technologies (Snowflake, Airflow, Kubernetes, Docker, Helm, Spark, pySpark, )
Significant experience with relational databases and query authoring (SQL) in Snowflake or other distributed Databases.
Experience with agile engineering practices such as TDD, Pair Programming, Continuous Integration, automated testing, and deployment.
Experience with building stream-processing systems, using solutions such as Kafka, Storm or Spark-Streaming
Experience with dimensional data modeling and schema design in Data Warehouses
Familiar with ETL (managing high-quality reliable ETL pipelines)
Be familiar with legal compliance (with data management tools) data classification, and retention.

Salary Range: $165,000-$210,000 USD base. Equity. Medical, Dental, Vision.
https://www.recruitingfromscratch.com/",2019,Staffing & Subcontracting,$1 to $5 million (USD),Human Resources & Staffing,1 to 50 Employees,Company - Private,True
DevOps Data Center Engineer,"INTEL
","Hillsboro, OR",$77K - $112K (Glassdoor est.),4.1,"Job Description


We are looking for experienced DevOps and SRE automation engineers to support our Data Center automation development! In this role, you will develop and employ continuous integration and deployment in support of our evolving CI/CD process. You will engage with the SW Development Engineers to build and maintain a seamless development flow and tackle large scale optimization challenges.




The ideal candidate will be self-motivated, have excellent communication skills, creativity and a willingness to continuous learning.




The candidate should exhibit the following behavioral traits:

Excellent communication skills, both written and verbally

Self-motivated, fast learner


Qualifications


You must possess the below minimum qualifications to be initially considered for this position. Preferred qualifications are in addition to the minimum requirements and are considered a plus factor in identifying top candidates.

Minimum Qualifications

The candidate must have a Bachelor's Degree in Electrical/Computer Engineering or Computer Science and 3+ years of experience -OR- a Master's Degree in Electrical/Computer Engineering or Computer Science and 2+ years of experience -OR- a PhD in Electrical/Computer Engineering or Computer Science and experience in:

Implementing DevOps processes, practices, and a willingness to build and maintain the necessary infrastructure

Developing and writing CI/CD pipelines (Jenkins, Github, Artifactory)

Development and deployment on Linux

Windows and Powershell

Containerization (Docker, Kubernetes)

Infrastructure automation frameworks (Github, Ansible, Salt, Artifactory)

Infrastructure monitoring solutions (Prometheus, Grafana)

Storage systems such as Weka.io, Netapp, Lustre, etc.

Scripting (Bash, Python)

Networking and DNS

Azure

This position is not eligible for Intel Immigration sponsorship.

Preferred Qualifications

Windows server administration

Datacenter

Network automation

Experience in the use of configuration management automation tools such as Puppet, Chef, Saltstack in creating continuous delivery systems

Experience with ELK or other monitoring, dashboarding and alerting tools


Inside this Business Group

Enable amazing computing experiences with Intel Software continues to shape the way people think about computing – across CPU, GPU, and FPGA architectures. Get your hands on new technology and collaborate with some of the smartest people in the business. Our developers and software engineers work in all software layers, across multiple operating systems and platforms to enable cutting-edge solutions. Ready to solve some of the most complex software challenges? Explore an impactful and innovative career in Software.

Other Locations

US, Austin

Posting Statement

All qualified applicants will receive consideration for employment without regard to race, color, religion, religious creed, sex, national origin, ancestry, age, physical or mental disability, medical condition, genetic information, military and veteran status, marital status, pregnancy, gender, gender expression, gender identity, sexual orientation, or any other characteristic protected by local law, regulation, or ordinance.

Benefits

We offer a total compensation package that ranks among the best in the industry. It consists of competitive pay, stock, bonuses, as well as, benefit programs which include health, retirement, and vacation. Find more information about all of our Amazing Benefits here.

Working Model

This role will be eligible for our hybrid work model which allows employees to split their time between working on-site at their assigned Intel site and off-site. In certain circumstances the work model may change to accommodate business needs.


JobType

Hybrid",1968,Computer Hardware Development,$10+ billion (USD),Information Technology,10000+ Employees,Company - Public,False
Senior Enterprise Data Warehouse Engineer,"First Technology Federal Credit Union
","Hillsboro, OR",$125K - $135K (Employer est.),3.8,"Description

The Senior EDW Data Engineer builds and maintains a data pipeline infrastructure for optimal extraction, transformation, and loading of data from a wide variety of data sources using SQL , cloud based relational or non-relational databases and employing Talend and/or scripting languages like Perl/Python.

Here's what you can expect from the job and what you need to be successful:

Job Duties

Lead analysis, design, development, and deployment of complex data platforms and pipelines across functional teams involving multiple integration and other technologies to meet committed deliverables
Partner and collaborate with business and IT stakeholders to deliver solutions to meet the business needs with quality and within the defined timeline
With minimal supervision, build and maintain complex data platforms and large scale CI/CD data pipelines utilizing a variety of technologies (REST APIs, TeamCity, Jenkins) and cloud databases (Snowflake)
Identify, design, and implement internal process improvements: automating manual processes, optimizing data delivery, re-designing infrastructure for greater scalability, etc.
Partner with data and analytics experts to strive for optimal functionality in our data integration platform
Collaborate on a day to day basis with business partners, architects and technical teams to identify, troubleshoot and resolve enterprise data warehouse issues
Resolve data issues by identifying multiple potential solutions and assessing them for both technical and business suitability, and work closely with all stakeholders (including technical peers and end users) to ensure technical compatibility and user satisfaction
Follow established best practices guidelines related to enterprise data warehouse configuration and change control processes
As a subject matter expert, mentor less experienced Data Engineers on a day to day basis
Conduct performance testing, tune and optimize data pipelines to meet the SLAs

Essential Skills

Minimum 6 years of developing data pipelines using Talend\Informatica and Python including the processing of NoSQL and JSON, XML formats, preferably in the financial services industry using Agile development process
Advanced working experience in SQL/PL-SQL, Snowflake, API
Excellent skills in scripting languages, including Python, Perl and Shell
Excellent skills with Ant, Maven, GIT, Jenkins, TeamCity
Excellent skills in source code repository tools such as Clear Case, SVN, CVS, and Gi.
Deep understanding of ETL, ELT, Talend, Informatica, Hadoop, data warehousing schema and Cloud platforms
Ability to work autonomously to manage time effectively and prioritize work appropriately to meet deadlines
Excellent problem solving and critical thinking skills
Strong business communication skills; able to write/speak clearly and professionally for a variety of audiences
Demonstrate independence, creativity, and initiative
Working knowledge of Microsoft Office Suite
Minimum Education: Bachelor’s degree in Information Technology, Computer Science or other related fields of study, or equivalent work experience
Certification/License: Talend Certification is preferred

Location: Hillsboro, OR 97124 | San Jose, CA 95134 | Rocklin, CA 95765 (HYBRID)

Target Compensation in Hillsboro, OR: $125k - $135k annually + annual bonus

Target Compensation in Rocklin, CA 95765: $137k - $148k annually + annual bonus

Target Compensation in San Jose, CA 95134: $156k - $169k annually + annual bonus

Benefits options include:

Traditional medical, dental, and vision coverage
401K matching up to 5% per pay period
Accrue up to 17 days of Paid Time Off your first year of employment
11 paid federal holidays
Special employee pricing on lending products such as mortgage, auto, and personal loans (eligibility for special employee pricing is subject to standard account requirements and underwriting criteria)

What makes First Tech different? Click here to learn more!

First Tech is not currently offering Visa transfer/ sponsorship for this position

#LI-KW1",1952,Banking & Lending,$100 to $500 million (USD),Financial Services,1001 to 5000 Employees,Company - Private,False
Data Engineer/Sr. Data Engineer (Remote) - EVOLVE Intelligence,"DNV
","Corvallis, OR",$105K - $150K (Employer est.),4.0,"Local Unit & Position Description

EVOLVE Intelligence accelerates the transition towards a carbon-free future through software and analytics.We are looking for a Data Engineer/Sr. Data Engineer to help us accomplish this mission.The Analytics & Data Science team in DNV Energy Management s Technology group is a remote-first team. We offer more than just a job; we provide a community where you can learn, grow, and thrive your way. Join a dynamic and diverse technology team that values relationships and the environment as much as results. Help us create software that empowers utility clean energy customers to combat climate change!

This is a remote position open to any location in the continental United States.

What You ll DoAs a Data Engineer/Sr. Data Engineer, you will design, develop, and maintain data architecture, pipelines, and systems that play a vital role in how our utility partners steward clean energy programs. Your impact will be immediate and will directly enable pathways to decarbonization through energy efficiency, demand response, storage, electric vehicles, and renewable energy technologies. You will solve a variety of problems that leverage your deep understanding of data engineering principles.How You ll Succeed

Collaborate with cross-functional teams, including machine learning engineers, software developers, analytics engineers, and product managers to translate business requirements into highly available data solutions
Leverage your creative problem-solving skills to architect, develop, and maintain scalable and efficient data processing pipelines using PySpark and other distributed computing technologies
Create and optimize data models that support reporting, analytics, artificial intelligence, and software
Optimize data storage and retrieval by designing and implementing efficient storage systems that use technologies such as Timescale and Apache Spark
Apply data validation, data profiling, and data cleansing to ensure data quality and integrity
Write clean, efficient, maintainable code, and actively engage with team members in code reviews
Create and maintain technical documentation covering data models, flows, views, dictionaries, and mapping schemes
Serve as a mentor and resource to other members of the team
Position Qualifications

What is Required

An undergraduate or advanced degree in a quantitative field
Proven professional experience as a Data Engineer
Strong proficiency in SQL, Python, and Spark/PySpark
Hands on experience with distributed computing frameworks such as Apache Spark
Familiarity with working in Azure experience with Data Factory is strongly desired
Experience with version control systems (e.g., Git) and familiarity with agile development practices
Excellent communication and teamwork skills, with the ability to effectively collaborate with cross-functional teams
Experience working on an agile product team is a bonus
Someone who is eager to learn new things and is coachable
Most importantly, this team member should display a positive, team-oriented attitude to match our friendly and enthusiastic work environment
Willingness and the ability to undergo a background investigation and drug screening
Excellent written and verbal English communication skills
We conduct pre-employment drug and background screening

*Immigration-related employment benefits, for example visa sponsorship, are not available for this position*

What We Offer

Generous paid time off (vacation, sick days, company holidays, personal days)
Multiple Medical and Dental benefit plans to choose from, Vision benefits
Spending accounts FSA, Dependent Care, Commuter Benefits, company-seeded HSA
Special programs Employee Assistance Program, ID theft protection, and accident and critical illness options for you and your family
Employer-paid, therapist-led, virtual care services through Talkspace
Company provided life insurance, short-term, and long-term disability benefits
Tuition assistance
Flexible work schedule with hybrid/remote opportunities
Advancement opportunities

**Benefits may vary based on position, tenure, location, and employee election

How We Do ItWe Care, We Dare, We ShareDNV is a proud equal opportunity employer committed to building an inclusive and diverse workforce. All employment is decided on the basis of qualifications, merit or business need, without regard to race, color, religion, age, sex, sexual orientation, gender identity, national origin, disability or protected veteran status.DNV is committed to ensuring equal employment opportunity, including providing reasonable accommodations to individuals with a disability. US applicants with a physical or mental disability who require a reasonable accommodation for any part of the application or hiring process may contact the North America Recruitment department (hrrecruitment.northamerica@dnv.com). Information received relating to accommodations will be addressed confidentially.DNV is proud to announce being named one of Houston s best places to work in the 2022 Houston Business Journal Best Places to Work competition.For more informationhttps://www.eeoc.gov/know-your-rights-workplace-discrimination-illegal-posterRead more here

Diversity at DNV

Meet our Employees

About DNV

Careers in DNV

As required by the Colorado Equal Pay Transparency Act and New York City Salary Transparency Law, DNV provides a reasonable range of compensation for roles that may be hired in Colorado or New York City. Actual compensation is influenced by a wide array of factors including but not limited to skill set, level of experience, and specific office location. For the state of Colorado and New York City, NY only, the range of starting yearly salary for this role is $105,000.00- $150,000.00.

Please visit our website at www.dnv.com

Company & Business Area Description

DNV is the independent expert in assurance and risk management, operating in more than 100 countries. Through our broad experience and deep expertise, we advance safety and sustainable performance, set industry benchmarks, and inspire and invent solutions. We provide assurance to the entire energy value chain through our advisory, monitoring, verification, and certification services. As the world's leading resource of independent energy experts and technical advisors, we help industries and governments to navigate the many complexes, interrelated transitions taking place globally and regionally, in the energy industry. We are committed to realizing the goals of the Paris Agreement and support all stakeholders to transition faster to a deeply decarbonized energy system.


Requisition #cln28d7yt000908mk8ioh3rb7",1864,Energy & Utilities,$1 to $5 billion (USD),"Energy, Mining & Utilities",10000+ Employees,Company - Private,False
