Job Title,Company Name,Location,Salary Estimate,Rating,Job Description,Founded,Industry,Revenue,Sector,Size,Type,Easy Apply
Senior Lead Mechanical Engineer (Mission Critical/Data Center),"WSP
","Tempe, AZ",$77K - $113K (Glassdoor est.),3.7,"Who We Are

At WSP, we are driven by inspiring future-ready pioneers to innovate. We’re looking to grow our teams with people who are ready to collaborate in building communities and expanding our skylines. To do this, we hire candidates of all experiences, skillsets, backgrounds and walks of life. We actively foster a work environment and culture where inclusion and diversity is part of our fundamental structure. This is delivered behaviorally, through our policies, trainings, local partnerships with professional diverse organizations, internal networks and most importantly with the support and sponsorship of our leaders who help drive our commitment to an inclusive, diverse, welcoming and equitable work environment. Anything is within our reach and yours as a WSP employee. Come join us and help shape the future!

Great people. Great places. Great projects. kW Mission Critical Engineering, a WSP company, is a high-performance, fast-paced consulting engineering firm designing data centers and mission critical environments across the globe. We hire smart, responsive, team players to work in collaborative and mentoring office settings. Our mechanical, electrical, plumbing, fire protection, controls, telecommunications, and security building system designs keep many of the world’s top Fortune 100 financial, technology, enterprise, hyperscale, and colocation companies up and running 24 hours a day, 365 days a year.

We work on innovative, award-winning, large-scale projects. We travel to construction sites to see our designs being built. As part of WSP, we are able to offer our employees increased professional development and career opportunities in addition to kW MCE’s office culture which is consistently recognized as one of the “Best Places to Work.” Join our great people at our great places designing great projects.

This Opportunity

kW Mission Critical Engineering, a member of WSP USA, is currently initiating a search for a Senior Lead Mechanical Engineer for our kW Tempe, Arizona office: 40 E. Rio Salado Parkway, Suite 445 Tempe AZ 85281. As a Senior Lead Mechanical Engineer with us, you will design complex cooling and HVAC systems including air distribution systems, chiller plants, and alternative energy solutions while leading projects and a team of mechanical engineers.

Your Impact
Produce high quality technical and professional deliverables for projects and proposals
Design complex and large air distribution (supply, return, exhaust) and hydronic systems (chilled water, heating water, etc.)
Design Automatic building automation controls systems and specification for large air distribution and heat rejection systems
Work within multi-discipline project teams to develop drawing and specification documents for issuance to architects, contractors and building owners
Attend client meetings and lead discussions
Communicate complex mechanical engineering concepts and decisions to clients and stakeholders
Directing complex mechanical engineering requirements and integrate into facility designs
Collaborate and coordinate with internal project discipline team members and external equipment vendors and manufacturers
Act as the lead mechanical engineer on projects and direct the project team
Lead and mentor a team of engineers
Perform project management activities including writing proposals, establishing budgets, and managing client interactions
Coordinate activities concerned with technical development, scheduling, and resolving engineering design issues
Survey and evaluate existing conditions
Perform construction administration
Who You Are

The ideal candidate is a technically sound mechanical engineer with the ability to lead and develop complex projects and foster the growth of junior engineers. Candidate has strong communication skills, and an interest in developing and maintaining relationships with internal and external design, client, and construction team members. Candidate is willing to travel to client sites.

Required Qualifications:

Proven history of Mechanical or Architectural Engineering with mechanical building systems emphasis
10+ years of experience in designing mechanical systems for the high performing, commercial, industrial or mission critical/data center buildings
Registered Professional Engineer (PE)
Experience mentoring and training others in field
Strong verbal and written communication skills
Ability to interact well with others as well as develop and contribute to high quality technical and professional deliverables on projects and proposals
Strong working knowledge of mechanical systems and codes
Proven track record of upholding workplace safety and ability to abide by WSP’s health, safety and drug/alcohol and harassment policies
Must be flexible to a variety of schedules to meet business needs and able to prioritize responsibilities and quickly adapt to change in a pressure work environment
Occasional travel may be required depending on project-specific requirements

Preferred Qualifications

Experience with the analysis of interior and exterior Computational Fluid Dynamics of airflow
Mission Critical/Data Center experience
Experience with international projects and knowledge of international codes and standards

#LI-JB3

Additional Requirements
To perform this job successfully, an individual must be able to perform each essential job duty satisfactorily. Reasonable accommodations may be made to enable qualified individuals with disabilities to perform essential job functions.
Additional Details
Travel Required: 20%
Job Status: Regular
Employee Type: Full
Primary Location: TEMPE - E RIO SALADO PKWY
All locations: US-AZ-Phoenix, US-AZ-Tempe, US-AZ-Tucson

About WSP

WSP USA is the U.S. operating company of WSP, one of the world's leading engineering and professional services firms. Dedicated to serving local communities, we are engineers, planners, technical experts, strategic advisors and construction management professionals. WSP USA designs lasting solutions in the buildings, transportation, energy, water and environment markets. With more than 15,000 employees in over 300 offices across the U.S., we partner with our clients to help communities prosper. www.wsp.com

WSP provides a flexible and agile workplace model while meeting client needs. Employees are also afforded a comprehensive suite of benefits including medical, dental, vision, disability, life, and retirement savings focused on providing health and financial stability throughout the employee’s career.

At WSP, we want to give our employees the challenges they seek to grow their careers and knowledge base. Your daily contributions to your team will be essential in meeting client objectives, goals and challenges. Are you ready to get started?

WSP USA (and all of its U.S. companies) is an Equal Opportunity Employer Race/Age/Color/Religion/Sex/Sexual Orientation/Gender Identity/National Origin/Disability or Protected Veteran Status.

The selected candidate must be authorized to work in the United States.

NOTICE TO THIRD PARTY AGENCIES:

WSP does not accept unsolicited resumes from recruiters, employment agencies, or other staffing services. Unsolicited resumes include any resume or hiring document sent to WSP in the absence of a signed Service Agreement where WSP has expressly requested recruitment/staffing services specific to the position at hand. Any unsolicited resumes, including those submitted to hiring managers or other business leaders, will become the property of WSP and WSP will have the right to hire that candidate without reservation – no fee or other compensation will be owed or paid to the recruiter, employment agency, or other staffing service.",-1,-1,$5 to $25 million (USD),-1,10000+ Employees,Company - Private,False
Data Engineer III (IT Application Engineer),"Pima County
","Tucson, AZ",$81K - $113K (Employer est.),3.2,"Position Description

OPEN UNTIL FILLED

Salary Grade: 17

Pay Range
Hiring Range: $80,508 - $96,610 Annually
Full Range: $80,508 - $112,711 Annually

Salary offers are based on the candidate's equivalent experience and internal equity with other employees within the same job classification.

Provides independent technical and analytical support on specific application system activities involving the design, development, construction, and ongoing support of systems, processes, or methods. Services complex customer segment application systems and databases of either the Pima County Information Technology (IT) Department, central Finance & Risk Management Department, within an Elected Official's IT team, or other department/work unit approved by the County Administrator. This classification is distinguished from the IT - Applications Developer-Senior classification by its focus on technical systems/database design and database management.

Duties/Responsibilities

(Work assignments may vary depending on the department's needs and will be communicated to the applicant or incumbent by the supervisor.)

Customer Segment Design, Maintenance and Support

Assists with the development of project scopes, pilot system efforts, definitions of associated costs, and evaluation of alternative delivery mechanisms to satisfy customer requests;

Refines conceptual requirements into detailed technical designs;

Designs and develops software in support of new application development/deployment;

Programs/configures enhancements to existing automation solutions;

Provides guidance and support on processes and procedures based on the systems development life cycle;

Assists in the setup and maintenance of various environments required for testing, development, conversion, and training, and establishes procedures for program migration, database changes, and menu changes;

Performs unit testing and participates and assists in system testing and associated functional validations of business applications;

Develops documentation for programs, test plans, validation protocols and other supporting system documentation;

Serves as a project leader for teams performing technology-related analysis, research, implementation, testing, and maintenance;

Database Design, Maintenance and Support

Plans, develops, and maintains relational databases over a variety of database platforms;

Participates in the development of database requirements and design specifications;

Models database systems, transforms database models and entities into database objects, implements database changes based on application development or enhancements;

Installs database management systems (DBMS) software, application software, and other software related to DBMS administration;

Monitors and administers DBMS security using appropriate protocols;

Conducts system administration of database servers to function optimally with the DBMS;

Writes and maintains database documentation appropriate to area of assignment;

Monitors storage, archiving, backup, and recovery procedures to ensure functionality and operability, as well as conducting capacity planning;

Develops custom or ad hoc reports using industry-standard tools.

KNOWLEDGE & SKILLS:

Knowledge of:

programming languages and associated web application development tools applicable to the area of assignment;
end user office, email, and programming tools;
principles and techniques of systems analysis and design;
office tools and associated procedures and their application in the use of application systems processing;
data warehouses and business intelligence environments;
development and maintenance of data communications, security, and privacy measures;
database design, normalization and management, and systems analysis;
modeling database systems and capacity planning;
effective database supervision and monitoring techniques;
protocols and methods for monitoring the security of DBMS;
techniques of data storage, archiving, backup, and recovery;
procedures and definitions for the data dictionary;
operating principles, capabilities, and limitations of hardware, software, and database systems;
industry security standards and procedures and IT best practices for application development;
IT Infrastructure Library for the Incident and Problem Management environment;
effective teamwork behaviors;
project management methodologies and technologies.
Skill in:
creating moderately complex documents, forms, reports, and spreadsheets containing tables and graphs;
mail merging documents and applying page setup functions (margins, page numbers, footers, headers);
creating an index and/or table of contents, using search & replace, printing labels and envelopes;
sorting, finding, and filtering messages, setting rules, sharing contact information and creating custom forms and working with permissions and journals;
refining conceptual requirements into technical designs;
transforming database models and entities into database objects;
installing software and configuring hardware and software for optimal performance;
organizing workload, being proactive, and managing a wide variety of customer requests simultaneously;
written, verbal communications in both technical and non-technical terms;
operating as a member of a team;
employing quality skill sets and diagnostic tools;
understanding client applications, business requirements, and concepts;
communicating with internal and external customers/vendors;
employing diagnostic, analytical, and conceptual skills with detailed orientation;
employing full systems life cycle development;
gathering requirements, analyzing business problems, automating business processes, and implementing application solutions.

Minimum Qualifications

(1) A Bachelor's degree from an accredited college, university, or technical trade school with a major in computer science, computer engineering, management information systems (MIS), or a closely related field as determined by the appointing authority at the time of recruitment, and four years of work experience in software development and maintenance, and two years of work experience in the development and maintenance of database systems.

(Experience requirements may be achieved concurrently.)

OR:

(2) An Associate's degree from an accredited college, university, or technical trade school and six years of work experience in information technology software development and maintenance and two years of work experience in the development and maintenance of database systems.

(Experience requirements may be achieved concurrently.)

(Additional relevant work experience and/or education from an accredited college, university, or technical trade school may be substituted.)


Qualifying education and experience must be clearly documented in the ""Education"" and ""Work Experience"" sections of the application. Do not substitute a resume for your application or write ""see resume"" on your application.

Preferred Qualifications: (Be specific in describing your experience in your application. Ensure the descriptions provided illustrate your competencies, specifically addressing the required and preferred qualifications.):

Experience coding in C#, Java, and Python.
Experience planning and creating new applications to completion and working on data layer/business logic/UI.
Experience with using Git for version control and Jira for issue tracking and project management.
Experience with/knowledge of PowerShell or Bash scripting languages.
Experience in creating and managing automated deployment pipelines, streamlining the deployment process.
Experience with database platforms such as Microsoft SQL Server, MySQL, or Snowflake.
Experience with Reporting and Analytics tools such as Power BI, Qlik Sense, or Business Objects.
Selection Procedure:
Pima County Human Resources Department reserves the right to admit to the selection process only those candidates that meet the minimum/desired qualifications. All applications will be assessed based on an evaluation of the listed education and experience. Candidates meeting the minimum/desired qualifications may be further evaluated/scored against any advertised Preferred Qualifications. The hiring authority will interview and select the successful candidate from a referral list provided by Human Resources. Additional assessments/testing may be required as part of the selection process.

Supplemental Information

Licenses and Certificates: Some positions may require appropriate licenses or certifications at the time of appointment or within a specified timeframe, e.g., Microsoft Certified Technology Specialist (MCTS). Some positions require a valid Arizona Class D driver's license at the time of application or prior to completion of initial/promotional probation. Failure to obtain/maintain the required licensure/certifications shall be grounds for termination.

Special Notice Items: Some positions may require satisfactory completion of a personal background investigation, polygraph examination, and/or pre-/post-appointment drug testing by law enforcement agencies due to the need for access to law enforcement, corrections or court facilities, property, and associated confidential and sensitive information, documents, communications and database systems. The County requires pre-employment background checks. Successful candidates will receive a post-offer, pre-employment background screening to include verification of work history, education, and criminal conviction history. A prior criminal conviction will not automatically disqualify a candidate from employment with the County.

Physical/Sensory Requirements: Some positions require lifting equipment, climbing, and working on towers, and elevated or below-grade platforms. All positions require the ability to identify industry-standard color-coding of electrical wiring and components. Other physical and sensory abilities will be determined by position.

EEO Information: Pima County Government is an Equal Employment Opportunity employer. We are committed to an inclusive and diverse workforce and will not discriminate in employment opportunities or practices on the basis of race, color, religion, national origin, age, disability, gender, sexual orientation, kinship, political interest, or any other characteristic protected by law.",1864,Municipal Agencies,$500 million to $1 billion (USD),Government & Public Administration,5001 to 10000 Employees,Government,False
