Job Title,Company Name,Location,Salary Estimate,Rating,Job Description,Founded,Industry,Revenue,Sector,Size,Type,Easy Apply
Data Center Engineer - Phoenix - On-site,RM Staffing B.V.,"Phoenix, AZ",$52K - $75K (Glassdoor est.),-1.0,"Do you want to go back to the source of your profession? Feel ‘IT’ again and move away from the view of your desktop monitor wall. Do you miss the feeling of good old-fashioned hardware engineering and want to go back to basics? Do you have an affinity with- or are you working in the IT Infrastructural industry? To go back to the roots of IT? Then this is your calling!

We are seeking a highly motivated Freelance IT/Datacenter Engineer to work with us on a project basis. The successful candidate will have extensive knowledge of data center operations, including managing and troubleshooting server hardware, network infrastructure, and storage systems. The ideal candidate will be a self-starter, have excellent problem-solving skills, and be comfortable working independently.

Responsibilities:

Manage and troubleshoot server hardware, network infrastructure, and storage systems in a large-scale data center environment.
Perform regular system maintenance and upgrades to ensure optimal performance and availability.
Collaborate with cross-functional teams to resolve technical issues and ensure efficient operation of the data center.
Identify and implement process improvements to optimize the data center infrastructure.
Manage data center assets, including inventory and procurement of equipment.
Monitor and respond to data center alarms and alerts.
Maintain a high level of security and compliance with relevant regulations and standards

If you meet the qualifications and are interested in this exciting freelance opportunity, please submit your resume and cover letter to us. We look forward to hearing from you!


Who are we?

Reboot Monkey is the one-stop shop for all infrastructural hardware and services. Starting in 2022 and with clients in 5 countries, we are moving quickly. We are proud to see our small team going above and beyond to deliver on our promise to make the infra world faster, easier, and better for everybody, including you!

What does working for Reboot Monkey look like?

Your work for Reboot Monkey will mostly go along with your existing freelance or permanent job. Whenever and as often as you want, you can choose to pick one or more tickets as long as you are within a 1-hour range of the client’s data center. Your work for us is a freelance assignment and invoiced from your privately owned company or via a payroll construction. The main philosophy is that you don’t have to commit to a minimum number of (set) hours and can be as flexible with your time as you, please. We offer a competitive reward, a professional work environment, and the possibility to finally get back to your profession's roots.

Are you the person that wants to reconnect with the practical side of our industry? Who wants to grow whenever possible and can be sure of compelling clients? Then, sign up and join Reboot Monkey!



Strong passion for IT Hardware
Minimum of 3 years of experience in data center operations.
Strong knowledge of server hardware, network infrastructure, and storage systems.
Excellent problem-solving skills and ability to work independently.
Ability to manage multiple projects simultaneously and work in a fast-paced environment.
Strong communication skills and ability to effectively convey technical information to non-technical stakeholders.
Ability to be physically available in the data center location as this is NOT a remote/online role.",-1,-1,Unknown / Non-Applicable,-1,1 to 50 Employees,Private Practice / Firm,True
Staff Data Engineer,"Recruiting From Scratch
","Mesa, AZ",$190K - $250K (Employer est.),4.0,"This is for a client of Recruiting from Scratch.
Who is Recruiting from Scratch:
Recruiting from Scratch is a premier talent firm that focuses on placing the best product managers, software, and hardware talent at innovative companies. Our team is 100% remote and we work with teams across the United States to help them hire. We work with companies funded by the best investors including Sequoia Capital, Lightspeed Ventures, Tiger Global Management, A16Z, Accel, DFJ, and more.
Our Client:

Our client is a dating app.

In this role, you will have the opportunity to work with our product teams, building models and APIs to drive new features, deliver analysis to further improve engagement in existing features, and empower our business with real-time insights to drive growth in market share, engagement, and revenue. We see 1 trillion events per year and process 10TB of data daily.

What’s the job?

Design, develop and deliver data products to production, complying with internal data governance, security and scalability of our system.
Solve technical problems of the highest scope and complexity
Exert significant influence on the company’s analytical long-range goals and data architecture
Define and extend our internal standards for style, maintenance, and best practices for a high-scale data platform
Provide mentorship for all on your team to help them grow in their technical responsibilities
Propose ideas to improve the scale, performance, and capabilities of the Data Platform
Moving implementation to ownership of real-time and batch processing and data governance and policies.
Maintain and enforce the business contracts on how data should be represented and stored.
Stay on top of new technologies through R&D and prototyping to continuously improve our big data architectures and systems to streamline how we deliver value with high quality to our end users
Implementing ETL processes, moving data between systems including S3, Snowflake, Kafka, and Spark.
Work closely with our Data Scientists, SREs, and Product Managers to ensure software is high quality and meets user requirements.

What we'll love about you

7+ years of experience working with data at scale, including data engineering, business intelligence, data science, or related field
7+ years experience using Python
Experience using big data technologies (Snowflake, Airflow, Kubernetes, Docker, Helm, Spark, pySpark)
Significant experience with relational databases and query authoring (SQL) in Snowflake or other distributed Databases
Experience with agile engineering practices such as TDD, Pair Programming, Continuous Integration, automated testing, and deployment
Experience with building stream-processing systems, using solutions such as Kafka, Storm or Spark-Streaming
Experience with dimensional data modeling and schema design in Data Warehouses
Familiar with ETL (managing high-quality reliable ETL pipelines)
Be familiar with legal compliance (with data management tools) data classification, and retention

Location : This role will be located in office twice a week minimum.

Salary Range: $180,000 - 250,000 USD base. Equity. Medical, Dental, Vision.
https://www.recruitingfromscratch.com/",2019,Staffing & Subcontracting,$1 to $5 million (USD),Human Resources & Staffing,1 to 50 Employees,Company - Private,True
Data Engineer,"Vertex Education
","Chandler, AZ",$76K - $108K (Glassdoor est.),3.7,"Be the one who makes a difference!
At Vertex Education we are a team of high achievers, courageous leaders, and passionate believers in changing lives through education. As a purpose-led education services provider, our mission is destined to benefit many and yet it starts with just one person inspired to work together with us to make a memorable and meaningful difference for our clients, schools, students, and communities. Be the one who makes a difference&mdash;with us.

Data Engineer
At Vertex Education, we understand the critical role that data plays in unlocking
insights, driving innovation, and making informed business decisions. As we expand
and refine our Business Intelligence capabilities, we're on the lookout for a Data
Engineer who can elevate our data infrastructure to the next level. This position is
more than just managing databases&mdash;it's about creating an environment where data
is easily accessible, flawlessly accurate, and primed for analysis. As a pivotal
member of our BI team, the Data Engineer will collaborate closely with BI analysts
and the BI manager, owning the entire lifecycle of our data processes. From
designing new pipelines to ensuring the integrity of our data, this role is essential to
ensuring our analysts have the tools they need to deliver rapid insights.
Design & Implementation of Data Pipelines

Design & Architecture: Design the data flow and architecture for new

pipelines, ensuring scalability and compatibility with the existing
infrastructure.

Integration with Sources: Establish connections to various structured data

sources, utilizing tools like Fivetran for seamless integration or write custom
Python as necessary.

Data Transformation & Modeling: Implement and refine data

transformation processes in Snowflake to convert structured data into
optimized models suitable for analysis using DBT. Ensure efficient data
retrieval and alignment with analytical needs.

Tool Evaluation & Integration: Explore and integrate new tools or

technologies that can enhance the overall efficiency and capability of the
data engineering ecosystem.
Quality Assurance & Data Integrity

Quality Assurance: Implement initial data quality checks to ensure

accuracy and integrity of data ingested from new sources.

Audit & Evaluation: Periodically review existing pipelines to identify

performance bottlenecks, data quality issues, or outdated practices.

Monitoring & Alerting: Implement robust, automated monitoring solutions

for the entire data engineering environment, ensuring timely alerts and
prompt resolution of any data quality issues.

Data Quality Enhancement: Introduce or refine data validation, cleansing,

and deduplication processes to elevate data accuracy and reliability.
Infrastructure & Environment Management

Infrastructure Optimization: Regularly evaluate and optimize the Azure,

Fivetran, and Snowflake environments for performance, cost-efficiency, and
scalability.

Data Security & Compliance: Prioritize and enforce robust data security

measures, ensuring data privacy regulations are adhered to and the
infrastructure remains compliant with industry standards.

Best Practices & Training: Stay updated with industry best practices and

ensure that the BI team is trained and aligned with the latest data
engineering standards.

Documentation & Continuous Improvement

Comprehensive Documentation: Produce and update documentation for

both new and existing pipelines, capturing source details, transformation
logic, and any known limitations, ensuring it remains current and accurate.

Stakeholder Engagement: Foster close collaboration with the BI analysts,

understanding their evolving data needs and adapting pipelines accordingly.

Feedback Mechanism: Establish and sustain a robust feedback loop with

the BI team and potential future data scientists, ensuring rapid identification
and rectification of performance bottlenecks.

Innovation & Best Practices: Stay abreast of industry trends, proactively

introducing innovative techniques, tools, or methodologies that can enhance
the efficiency and effectiveness of the data engineering ecosystem.
Education and Experience
Education:

Bachelor’s degree in Computer Science, Information Systems, Engineering, or

a related field.

Master’s degree in a related field is a plus.

Experience:

Minimum of 3-5 years of experience in data engineering or a related role.
Proven expertise in working with cloud platforms, preferably Azure.
Hands-on experience with data pipeline tools such as Fivetran, DBT, and

Snowflake.

Expertise in Python and basic software engineering best practices
Familiarity with BI tools, with Tableau experience being a distinct advantage.
Demonstrated ability to design, build, and maintain scalable and robust data

pipelines.

Prior experience working in close collaboration with BI analysts or data

scientists is a plus.
Certifications (optional but advantageous):

Azure Data Engineer Associate certification or other relevant cloud

certifications.

Certifications related to specific data engineering tools or platforms, such as

Snowflake SnowPro Core Certification, SnorPro Advanced Data Engineer Cert,
or other comparable.

Be excited to be a part of our team and grow your career with us!
Be the one who enables us to positively impact over 25,000 students across multiple states while driving our growth forward so we can enrich even more lives. Be the one who helps us achieve excellence for the 26 schools we support with academics, finance, technology, human resources, communications, marketing, facilities, construction, and food services. Be the one who is a diverse thinker, a team player, a smart risk taker, an innovator, and a difference maker by encouraging others to climb higher and reach farther to further education.

Be yourself surrounded by wonderful people who care about you, value your unique skills, and lift you up.
Be supported in your work by caring leaders and team members who want you to succeed.
Be empowered to make a difference and climb higher and reach farther to change lives through education.
Be well in all aspects of your life from your physical, mental, and emotional wellbeing to your finances.
Enjoy industry-leading pay, rewards, referral bonuses, with unlimited flexible paid time-off for performance.
Be able to care for your health and your family with comprehensive medical, dental and vision benefits and invest in your future with 401(k) plans with a 6% employer match on your contributions.
Enhance your growth and development with mentoring and money to take training classes.
Thrive in a welcoming, supportive, and inclusive environment where we treat others with fairness and respect, celebrate diversity, and elevate equality and inclusion as an equal opportunity employer.

Be the one who makes a difference!
With an innovative mind, a hungry heart, and engaging spirit you can change lives through education. Be a part of Vertex Education and let’s make a difference together. Apply Today!

Job Type: Full-time",2007,Primary & Secondary Schools,Unknown / Non-Applicable,Education,51 to 200 Employees,Company - Private,True
Big Data Engineer,"Chabez Tech
","Phoenix, AZ",$60.00 Per Hour (Employer est.),5.0,"Company Description

Chabez Tech is a fast growing IT services and software development firm providing services across several domains. Chabez Tech is headquartered in Pennsylvania with a client base all around the world. Chabez Tech provides a wide variety of IT services, Application development and IT solutions. We have an offshore hub for back end operations and support for clients all over the world.

Job Description

Position: Big Data Engineer
Location: #Phoenix, #AZ (Locals are preferred)
Visa: Any
Duration: Long Term Contract
Client: AMEX
Our Rate : $60/hr on C2C all inclusive Max

# Familiar with Agile or other rapid application development methods Experience with design and coding across one or more platforms and languages as appropriate
# Hands-on expertise with application design, software development and automated testing
# Experience with distributed (multi-tiered) systems, algorithms, and relational databases
# Bachelor Degree in computer science, computer science engineering, or related experience required; advanced degree preferred
# Hands-on expertise with application design and software development in Big Data across one or more platforms, languages, and tools.(Hadoop/ Spark/ HIVE/ NoSQL & SQL Databases).
# Have had prior experience of architecting data abstraction layers using some NoSQL/in-memory database
# Data modeling and data architecture experience will be an advantage
# Expert on Dimensional modelling concepts.
# Strong knowledge on Oracle SQL, ETL performance tuning and unix scripting.

Additional Information

All your information will be kept confidential according to EEO guidelines.",2017,-1,Less than $1 million (USD),-1,1 to 50 Employees,Company - Public,True
Senior Data Engineer,"BambooHR
","Phoenix, AZ",$108K - $141K (Glassdoor est.),3.8,"About Us

Our mission is simple: we want to set people free to do meaningful work. People love our software—and it turns out that people love working here too. We've been recognized as a ""Best Company to Work For"" and we're proud of our team for creating software that makes an impact in the lives of HR pros and employees all over the world.

What You'll Do

As a Senior Data Engineer on the data platform team, we'll rely on your expertise across multiple disciplines to develop, deploy and support data systems, data pipelines, data lakes, and lakehouses. Your ability to automate, performance tune, and scale the data platform will be key to your success.

Your initial areas of focus will include:

Collaborate with stakeholders to make effective use of core data assets
With Spark and Pyspark libraries, load both streaming and batched data
Engineer lakehouse models to support defined data patterns and use cases
Leverage a combination of tools, engines, libraries, and code to build scalable data pipelines
Work within an IT managed AWS account and VPC to stand up and maintain data platform development, staging, and production environments
Documentation of data pipelines, cloud infrastructure, and standard operating procedures
Express data platform cloud infrastructure, services, and configuration as code
Automate load, scaling, and performance testing of data platform pipelines and infrastructure
Monitor, operate, and optimize data pipelines and distributed applications
Help ensure appropriate data privacy and security
Automate continuous upgrades and testing of data platform infrastructure and services
Build data pipeline unit, integration, quality, and performance tests
Participate in peer code reviews, code approvals, and pull requests
Identify, recommend, and implement opportunities for improvement in efficiency, resilience, scale, security, and performance



What You Need to Get the Job Done (if you don't have all, apply anyway!)

Experience developing, scaling, and tuning data pipelines in Spark with PySpark
Understanding of data lake, lakehouse, and data warehouse systems, and related technologies
Knowledge and understanding of data formats, data patterns, models, and methodologies
Experience storing data objects in hadoop or hadoop like environments such as S3
Demonstrated ability to deploy, configure, secure, performance tune, and scale EMR and Spark
Experience working with streaming technologies such as Kafka and Kinesis
Experience with the administration, configuration, performance tuning, and security of database engines like Snowflake, Databricks, Redshift, Vertica, or Greenplum
Ability to work with cloud infrastructure including resource scaling, S3, RDS, IAM, security groups, AMIs, cloudwatch, cloudtrail, and secrets manager
Understanding of security around cloud infrastructure and data systems
Git-based team coding workflows



Bonus Skills (Not Required, So Apply Anyway!)

Experience deploying and implementing lakehouse technologies such as Hudi, Iceberg, and Delta
Experience with Flink, Presto, Dremio, Databricks, or Kubernetes
Experience with expressing infrastructure as code leveraging tools like Terraform
Experience and understanding of a zero trust security framework
Experience developing CI/CD pipelines for automated testing and code deployment
Experience with QA and test automation
Exposure to visualization tools like Tableau



Beyond the technical skills, we're looking for individuals who are:

Clear communicators with team members and stakeholders
Analytical and perceptive of patterns
Creative in coding
Detail-oriented and persistent
Productive in a dynamic setting

If you love to learn, you'll be in good company. You'll likely have a Bachelor's degree in computer science, information systems, or equivalent working experience.




An Equal Opportunity Employer-M/F/D/V
Because our team members are trusted to handle sensitive information, we require all candidates that receive and accept employment offers to complete a background check before being hired.

For information on our Privacy Policy, click here.",2008,Enterprise Software & Network Solutions,Unknown / Non-Applicable,Information Technology,1001 to 5000 Employees,Company - Private,True
