Job Title,Company Name,Location,Salary Estimate,Rating,Job Description,Founded,Industry,Revenue,Sector,Size,Type,Easy Apply
"Senior Data Engineer, Talent Analytics","RVO Health
","Minneapolis, MN",$100K - $170K (Employer est.),3.5,"AT A GLANCE

RVO Health is looking to grow our Talent Analytics team by adding a Senior Data Engineer. In this role, you'll be challenged to help shape our Talent Analytics strategy while working on high-priority data efforts – all in line with our broader mission of attracting diverse talent and giving them an experience that will bring out their very best. You will be responsible for scoping, executing, and delivering technical projects to stakeholders across the Human Capital organization, and producing data engineering & analytical solutions that connect them to the data they need.

Where You'll Be

To prioritize togetherness, culture, and accountability, RVO Health operates on a hybrid in-office work schedule. We expect employees to work from our Minneapolis office Tuesday, Wednesday and Thursday each week. You are welcome to work remotely Mondays and Fridays if you wish.

11000 Optum Cir Eden Prairie, MN 55344

What You'll Do
Develop/maintain data pipelines from various data sources (ADP WFN, Greenhouse Recruiting/Onboarding, CultureAmp, Docebo, etc) to a target data warehouse using batch data load strategies utilizing cutting edge cloud technologies.
Conduct hands-on, advanced data engineering & analytics using multiple data sources originating from different applications and systems.
Collaborate with the data science team to identify new opportunities for deep analytics within the Human Capital organization.
Provide input into strategies as they drive the team forward with delivery of business value and technical acumen.
Execute on proof of concepts, where appropriate, to help improve our technical processes.
Documenting database designs that include data models, metadata, ETL specifications and process flows for business data project integrations.
What We're Looking For
5+ years of Data Engineering experience
3+ years of writing SQL experience against complex databases for data extraction using AWS Athena (Presto), Databricks Delta Lake along with Data Modeling & Data warehousing experience.
3+ years of experience working on Spark (RDDs / Data Frames / Dataset API) using Scala/Python to build and maintain complex ETL pipelines and experience data processing using Parquet and Avro
3+ years of Python coding experience, familiar with utilizing packages such as pandas, boto3, requests, json, csv, os
3+ years of experience working on AWS services including Glue, Athena, Lambda, S3, SNS, SQS, Cloud formation, Step Functions, Serverless architecture.
Experience with GitHub, Code check-in, versioning, Git commands
Introduce and drive adoption of CI/CD framework within the team and build/deploy CI/CD Pipelines using Terraform or AWS Cloud Formation
Experience with visualization tools such as Tableau, Looker or PowerBI to build dynamic/scalable dashboards and reports.
Strong analytical and interpersonal skills
Knowledge or experience within Talent/People analytics is a plus
Enthusiastic, highly motivated and ability to learn quickly.
Able to work through ambiguity in a fast-paced, dynamically changing business environment.
Ability to manage multiple tasks at the same time with minimal supervision.

Pursuant to various state Fair Pay Acts, below is a summary of compensation elements for this role at the company. The following benefits are provided by RVO Health, subject to eligibility requirements.

Starting Salary: $100,000 - $170,000

Note actual salary is based on geographic location, qualifications and experience
Access to a Free Udemy for Business subscription—thousands of hours of learning content on hundreds of different subjects at your fingertips
Health Insurance Coverage (medical, dental, and vision)
Life Insurance
Short and Long-Term Disability Insurance
Flexible Spending Accounts
Paid Time Off
Holiday Pay
401(k) with match
Employee Assistance Program
Paid Parental Bonding Benefit Program

This position may occasionally require travel for training and other work-related duties.

Who We Are:

Founded in 2022, RVO Health is a new healthcare platform of digital media brands, services and technologies focused on building relationships with people throughout their health & wellness journey. We meet people where they are in their personal health journeys and connect them with both the information and the care they need. RVO Health was created by joining teams from both Red Ventures and UnitedHealth Group's Optum Health. Together we're focused on delivering on our vision of a stronger and healthier world.

RVO Health is comprised of Healthline Media (Healthline, Medical News Today, Psych Central, Greatist and Bezzy), Healthgrades, FindCare and PlateJoy; Optum Perks, Optum Store and the virtual coaching platforms Real Appeal, Wellness Coaching, and QuitForLife.

We offer competitive salaries and a comprehensive benefits program for full-time employees, including medical, dental and vision coverage, paid time off, life insurance, disability coverage, employee assistance program, 401(k) plan and a paid parental leave program.

RVO Health is an equal opportunity employer that does not discriminate against any employee or applicant because of race, creed, color, religion, gender, sexual orientation, gender identity/expression, national origin, disability, age, genetic information, veteran status, marital status, pregnancy or any other basis protected by law. Employment at RVO Health is based solely on a person's merit and qualifications.

We are committed to providing equal employment opportunities to qualified individuals with disabilities. This includes providing reasonable accommodation where appropriate. Should you require a reasonable accommodation to apply or participate in the job application or interview process, please contact accommodations@rvohealth.com.

#LI-Hybrid

RVO Health Privacy Policy: https://rvohealth.com/legal/privacy",2022,Hospitals & Health Clinics,Unknown / Non-Applicable,Healthcare,1001 to 5000 Employees,Company - Private,False
Software Engineer II - Data Science,"Infinite Campus
",United States,-1,3.1,"Job Description

The Software Engineer II is responsible for design, development, and testing of select product area(s) of Infinite Campus software systems. Engineering leadership skills to mentor and coach engineers on technical implementation. Able to produce long term sustainable solutions. Must be legally authorized to work within country of employment without sponsorship for employment visa status (e.g., H1B) now or in the future. Must be legally authorized to work within country of employment without sponsorship for employment visa status (e.g., H1B) now and/or in the future.


Job Responsibilities
· Demonstrate mastery of standard concepts, practices, and procedures in technologies used at Infinite Campus (e.g., Java, Groovy, SQL, Spock, Grails, JavaScript).
· DevOps knowledge/skills such as build and deploy processes, Devops tools such as Jenkins, docker, tomcat, Kubernetes.
· Research, investigate, and fix a wide range of technical issues.
· Assume overall responsibility for design, development, and quality of a project or product area
· Mentor other software engineers
· Provide technical leadership through coding knowledge, technical guidance on solution design and implementation, engaging in pair programming sessions and providing oversight between engineering team to ensure dependencies are managed
· Improve code based upon technical experience and product knowledge. Stay abreast of latest technology
· Develop software to fulfill complex business requirements
· Facilitate planning, estimation, and communication
· Demonstrate ability to meet aggressive timelines
· Evaluate the quality of requirements, designs, and tests
· Multi-task among different development activities
· Improve code based upon technical experience and product knowledge
· Debug and test code
· Create unit and other automated code validation tests
· Research, investigate, and fix a wide range of technical issues
· Use agile planning, estimation, communication, and release processes
· Write system documentation in support of the code being developed
· Access Infinite Campus production customer data and production data in public test adhering to the practices and procedures outlined in the master security guidelines
· Fulfill other related duties as assigned


Desired Background
· BA/BS in Computer Science or related field and three years software development experience; OR five years software development experience
· Strong communication and presentation skills
· Experience with technologies such as Java, Groovy, SQL, XSLT, Spock, Grails, JavaScript, or Angular
· DevOps knowledge/skills such as build and deploy processes, Devops tools such as Jenkins, docker, tomcat, Kubernetes.


Performance Expectations
· Perform job responsibilities as directed achieving desired results within expected time frames and with a high degree of quality and professionalism
· Establish and maintain positive and productive work relationships with all staff, customers and business partners
· Protect confidentiality of student and district data
· Must be a self-starter
· High attention to detail
· Must have good analytical and organizational skills
· Possess a positive attitude in stressful situations
· Ability to work in a fast-paced, agile environment with frequent software releases
· Ability to adapt to and work with numerous functional organizations
· Demonstrate commitment to quality
· Communicate well and proactively with internal stakeholders



Position must adhere to the practices and procedures outlined in the master security guidelines.

*This position may perform job responsibilities directly for a customer contract, which may be subject to a more thorough criminal background check to include, but not limited to, fingerprints, outside the standard screening. If the position performs job responsibilities directly for said customer(s), employee is required to pass the specified criminal background check; meeting the requirements of the customer contract.

Infinite Campus, Inc. provides equal employment opportunities (EEO) to all employees and applicants for employment without regard to race, color, religion, sex, national origin, age, disability or genetics. In addition to federal law requirements, Infinite Campus complies with applicable state and local laws governing nondiscrimination in employment in every location in which the company has facilities. This policy applies to all terms and conditions of employment, including recruiting, hiring, placement, promotion, termination, layoff, recall, transfer, leaves of absence, compensation and training.

Infinite Campus, Inc. expressly prohibits any form of workplace harassment based on race, color, religion, gender, sexual orientation, gender identity or expression, national origin, age, genetic information, disability, or veteran status. Improper interference with the ability of Infinite Campus’ employees to perform their job duties may result in discipline up to and including discharge.",1997,Computer Hardware Development,$100 to $500 million (USD),Information Technology,201 to 500 Employees,Company - Private,False
AI Engineer/Data Scientist,TMPI,"Minneapolis, MN",$130K - $160K (Employer est.),-1.0,"Benefits/Perks

Competitive Compensation
Flexible Scheduling
Career Growth Opportunities
Job Summary
We are seeking a detail-oriented Data Scientist to join our team. As a Data Scientist, you will analyze large amounts of raw data to discover patterns and insights that will help to improve our company. We will rely on you to collect and analyze data, build models, and present your findings in an easy-to-understand manner. The ideal candidate has an analytical mind and a passion for data.

Responsibilities

Analyze large amounts of raw data to discover trends and patterns
Discover valuable business insights and propose new approaches to challenges
Automate the data collection process
Identify valuable data sources
Build machine learning algorithms and predictive models
Present information in an easily digestible format
Collaborate with other teams within the organization
Work between multiple projects and flexibility to shift between projects
Code development and integration
integrate with database and knowledge on SQL
Code versioning and maintaining
Qualifications

A bachelor’s degree in Computer Science or a related field is preferred
Strong understanding of data collection and analysis
Strong troubleshooting and analytical skills
Ability to work well as part of a team
Strong written and verbal communication skills
Experience with data visualization tools such as Tableau and PowerBI
Minimum of 3 years working experience in AI field
Minimum of 3 years experience in programming languages
Understand Agile Scrum and Waterfall project management methodologies
Knowledge of R, SQL, Python, Java, Unix and Linux, C++",-1,General Repair & Maintenance,Unknown / Non-Applicable,"Construction, Repair & Maintenance Services",Unknown,Company - Private,True
Data Engineer,"ABOUT HEALTHCARE INC
","Saint Paul, MN",$87K - $121K (Glassdoor est.),3.2,"ABOUT offers a flexible, purpose-built solution that empowers hospitals and health systems to operate as one connected network of care. We enable easy access for clinicians to move patients into and out of the acute care setting - getting them to the next, best care setting faster and easier. Complemented by our clinical experts and best practices, we provide health systems the necessary controls and insights to grow with resilience, drive clinician effectiveness, and improve patient outcomes.

SUMMARY

THIS POSITION IS ON-SITE 2-3 DAYS/WEEK in OUR DOWNTOWN ST PAUL OFFICE. PLEASE DO NOT APPLY IF YOU ARE NOT LOCAL TO MN

Services as a technical expert on our data layer. Discusses customer needs, maintains and updates databases, warehouse or marts. Tunes and ensures optimal database and server performance. Assists with reporting and analytics to meet business intelligence requirements and ensures overall integrity, quality and related system maintenance.

ESSENTIAL FUNCTIONS:
Discusses needs, operations and data requirements with staff or customers and outlines system capabilities and approaches to pull, maintain and analyze system data.
Work with other data engineers to design and maintain scalable data models and ETL pipelines
Help design, build, and improve the infrastructure for ingesting, storing, securing and transforming data at a scale
Help design and build systems to monitor and analyze data
Provide technology ownership for data solutions for projects that the team has been tasked with.
Work with a cross functional team of business analysts, architects, engineers, data analysts to formulate technical requirements.
Design and build data pipelines from various data sources to a target data warehouse using batch data load strategies utilizing cloud technologies.
Conceptualizing and generating infrastructure that allows data to be accessed and analyzed effectively.
Documenting database designs that include data models, metadata, ETL specifications and process flows for business data project integrations.
Perform periodic code reviews and test plans to ensure data quality and integrity.
Provide input into strategies that drive the team forward with delivery of business value and technical acumen.
Execute proof of concepts, where appropriate, to help improve our technical processes.
Provides analysis, interpretation and counsel regarding the application and usage of systems, business intelligence and reporting to improve policies, programs, and practices.
Provides research and feedback to resolve management and customer questions and requirements; assists with receiving customer feedback and coordinating resources and responses as required.
Analyzes and reviews operations, results, feedback, and related information on an ongoing to as needed basis to determine trends, draw conclusions, interpret findings, and presents results, proposals, and recommendations to management.
Ensures the accuracy of operational databases, reports, and related details through audits, queries, and operational reviews; works with teams to resolve discrepancies.
Interprets and applies department policies and procedures and assists with applicable laws, rules, and regulations; receives guidance within these areas as needed.
Contributes to the efficiency and effectiveness of the department's service to its customers by offering suggestions and directing or participating as an active member of a work team.
Performs other duties as assigned.

QUALIFICATIONS:
Need to Have:
Due to the need for this role to be credentialed with the VA, we can only consider US citizens for this role.
CURRENTLY local to Minneapolis / St Paul area and able to work on site 2-3 days/week
Bachelor’s Degree in Information Technology or related field and 5 years of related experience; or equivalent education and experience.
Ability to work on site in our St Paul office 2-3 business days/week; parking reimbursement provided
4+ years of experience in managing data/databases (Proficient in SQL)
4+ years of experience in translating business requirements into technical data solutions on a large scale.
Nice to Have:
Prior experience working in a private equity-funded organization.
Healthcare technology experience.
Experience with Mirth or a similar integration or ETL tools

Required Knowledge and Skills
Required Knowledge:
Research and troubleshoot potential issues presented by stakeholders within the data ecosystem.
Experience with Data Modeling, Data warehousing
Strong analytical and interpersonal skills.
Enthusiastic, highly motivated and ability to learn quickly.
Able to work through ambiguity in a fast-paced, dynamically changing business environment.
Ability to manage multiple tasks at the same time with minimal supervision.
Advanced principles, practices and techniques of managing data , databases and system analytics.
Specialized understanding of data engineering, reporting and management.
Understanding of the administration and oversight of data, system and business intelligence programs, policies, and procedures.
Various methods to identify and resolve analytical problems, questions, and concerns.
Basic methods and approaches to analyze and improve business operations.
Understanding of applicable laws, codes, and regulations.
Computer applications and systems related to the work.
Principles and practices to serving as an effective project team member.
Methods to communicate with staff, coworkers, and customers to ensure safe, effective, and appropriate operations.
Correct business English, including spelling, grammar, and punctuation.
Required Skills:
Performing advanced data engineering duties in a variety of assigned areas.
Overseeing and administering business intelligence and data analytical systems.
Using standard, customized, and complex data analytics tools.
Training others in policies and procedures related to the work.
Identifying, documenting, and reporting on system and data administration.
Serving as a team member and the development and management of projects.
Operating in both a team and individual contributor environment.
Using initiative and independent judgment within established department guidelines.
Contributing effectively to the accomplishment of team or work unit goals, objectives, and activities.
Establishing and maintaining effective working relationships with a variety of individuals.
We also value the employee experience, so we offer a full benefits package, including medical, dental, vision, supplemental insurances, parking reimbursement, and a flexible time off policy.

PHYSICAL/MENTAL REQUIREMENTS:
Mobility to work in an office setting, use standard office equipment and stamina to sit for extended periods of time; strength to lift and carry up to 10 pounds; vision to read printed materials and computer screens; and hearing and speech to communicate in person or over the telephone.

Travel as needed to support company and customer initiatives. Work on Site at our St Paul office is required and ABOUT reserves the right to change the location of the role at any time.
This role may involve work on federal government contracts that require additional federal background investigations, training, and federal badging. As such, you will required to submit personal information to the government and be fingerprinted and photographed at your local Department of Veteran Affairs Medical Center.

ABOUT is also an Equal Employment Opportunity employer and all qualified applicants will receive consideration for employment without regard to race, color, religion, sex, age, national origin, protected veteran status, disability status, sexual orientation, gender identity or expression, marital status, genetic information, or any other characteristic protected by law.",-1,Enterprise Software & Network Solutions,Unknown / Non-Applicable,Information Technology,51 to 200 Employees,Company - Private,True
Senior Data Engineer,"General Mills
","Minneapolis, MN",$133K - $175K (Employer est.),4.1,"Job Description:
Employer: General Mills, Inc.

Job Title: Senior Data Engineer (multiple positions)
Job Requisition: #25002 | 20330.305.6
Job Location: 1 General Mills Blvd. Minneapolis, MN 55426 | Telecommuting 100% of time is permitted.
Job Type: Full Time
Rate of Pay: $133,385 - $174,600 per year

Duties: Work closely with a multidisciplinary agile team to build high quality data pipelines driving analytic solutions that will generate insights from our connected data, enabling General Mills to advance the data-driven decision-making capabilities of our enterprise. Design, develop, optimize, and maintain data architecture and pipelines that adhere to ETL principles and business goals. Solve complex data problems to deliver insights that helps our business to achieve their goals. Create data products for analytics and data scientist team members to improve their productivity. Advise, consult, mentor and coach other data and analytic professionals on data standards and practices. Foster a culture of sharing, re-use, design for scale stability, and operational efficiency of data and analytical solutions. Lead evaluation, implementation and deployment of emerging tools and process for analytic data engineering to improve our productivity as a team. Develop and deliver communication and education plans on analytic data engineering capabilities, standards, and processes. Partner with business analysts and solutions architects to develop technical architectures for strategic enterprise projects and initiatives.

Telecommuting 100% of time is permitted.

Requirements: Employer will accept a Bachelor's degree in Computer Science, Management Information Systems, Engineering, or related field and 5 years of post-baccalaureate, progressively responsible experience in job offered or 5 years of post-baccalaureate, progressively responsible experience in data engineering or architecture.

Must have experience in each of the following:
1. 4 years of experience working with data analysis
2. 4 years of experience with SQL or Hive QL
3. 4 years of experience developing and maintaining data warehouses in big data solutions
4. 4 years of experience with Big Data development using Hadoop
5. 4 years of experience with Hive, BigQuery , Impala OR Spark
6. 4 years of experience automating the data pipelines/processes
7. 4 years of experience with Hadoop ecosystems (HDFS, YARN, Hive, HBase, Sqoop, Spark, and or Hue, )
8. 3 years of experience utilizing Agile Development Methodology
9. 3 years of experience with Git Repositories

Telecommuting 100% of time is permitted. Background check and drug testing required.
Contact: Apply online at https://careers.generalmills.com/careers/ Please refer to job requisition number- #25002

The salary range for this position $133,385-$174,600 per year. At General Mills we strive for each employee’s pay at any point in their career to reflect their experiences, performance and skills for their current role. The salary range for this role represents the numerous factors considered in the hiring decision including, but not limited to, education, skills, work experience, certifications, etc. As such, pay for the successful candidate(s) could fall anywhere within the stated range. Beyond base salary, General Mills offers a competitive Total Rewards package focusing on your overall well-being. We are proud to offer a foundation of health benefits, retirement and financial wellbeing, time off programs, wellbeing support and perks. Benefits may vary by role, country, region, union status, and other employment status factors. You may also be eligible to participate in an annual incentive program. An incentive award, if any, depends on various factors, including, individual and organizational performance.
.

Company Overview:
We exist to make food the world loves. But we do more than that. Our company is a place that prioritizes being a force for good, a place to expand learning, explore new perspectives and reimagine new possibilities, every day. We look for people who want to bring their best — bold thinkers with big hearts who challenge one other and grow together. Because becoming the undisputed leader in food means surrounding ourselves with people who are hungry for what’s next.",1866,Food & Beverage Manufacturing,$10+ billion (USD),Manufacturing,10000+ Employees,Company - Public,False
