Job Title,Company Name,Location,Salary Estimate,Rating,Job Description,Founded,Industry,Revenue,Sector,Size,Type,Easy Apply
Data Center Facilities Engineer,"Talent Group
","Eugene, OR",$28.00 Per Hour (Employer est.),2.3,"Job Description:

Respond to and resolve reported computer software, hardware, operating system & telephony issues.
Fulfill service requests.
Perform installations, upgrades, releases & deployments.
Monitor data center systems & jobs
Proactively monitor end-user platform performance
Construct data center facilities
Monitor & protect data center facilities.

Job Type: Contract

Salary: Up to $28.00 per hour

Schedule:

8 hour shift

Ability to commute/relocate:

Eugene, OR 97401: Reliably commute or planning to relocate before starting work (Required)

Experience:

Data center: 5 years (Required)

Work Location: In person",-1,Broadcast Media,Less than $1 million (USD),Media & Communication,1 to 50 Employees,Company - Public,True
Data Center Operating Engineer,"Cushman & Wakefield
","Hillsboro, OR",$73K - $110K (Glassdoor est.),3.7,"Job Title

Data Center Operating Engineer

Job Description Summary

Responsible to ensure the efficient operation and maintenance of mechanical, electrical and plumbing equipment and systems for the assigned property(s). Responsibilities include (but are not limited to) maintaining a clean and safe working environment, performing rounds, conducting routine assessments, performance of day-to-day preventive and corrective maintenance, painting, and housekeeping for assigned properties

Job Description

Night Shift 8:00 pm - 6:00 am



ESSENTIAL FUNCTIONS AND RESPONSIBILITIES

Perform all plumbing, electrical, or HVAC requirements of the building(s)
Maintain heating equipment, chillers (air and/ or water cooled), DX units, pumps, cooling towers, fan coil units, VAV, and air distribution systems, etc.
Monitor and adjust all mechanical/pneumatic equipment, steam stations, control gauges, distributor panels, valves, thermostats, diffusers, and other equipment necessary to provide a comfortable environment for the buildings
Verify field conditions and perform any necessary repairs or adjustments
Monitor Energy Management
Repair doors, ceilings, hand railings, and floors and other general repairs, adjustments and installations about the property
Perform repairs to plumbing fixtures (water closets, urinals, flush valve assemblies, lavatories, etc.)
Perform preventive maintenance duties in accordance with C&W standards, building protocol, manufacturer recommendations and industry best practices. including changing filters, cleaning coils, flushing condensers, punching tubes, greasing fan, pump and motor bearings as required, inspecting and adjusting belts, replacing motor bearings, aligning pulleys and shafts, monitor condenser, chilled, heating and secondary water chemical treatment and its associated feed equipment, clean and maintain cooling towers, and perform annual inspections and other scheduled routines as directed.
Inspect engine room equipment, fan room equipment, cooling tower, all motors, house pumps, electric rooms, back-up generator, fire pump(s), sump pump(s), and ejector pumps. Replace lamps, light fixtures, reinstall or replace signage, verify rooms are clean and clear of obstructions and debris
Check for properly operating emergency exit signs and lights and ensure free and clear access to emergency stairs and exits. Perform additional fire and life safety inspections as per NFPA and local jurisdiction, C&W standards, building protocol and as directed by superiors and property management
Document and report activities to supervisor
Respond immediately to emergency situations (fire, evacuation, equipment failure, etc.) and customer concerns
Comply with all applicable codes, regulations, governmental agency, and company directives as relates to building operations and practice safe work habits
Complete all required C&W Safety Training as scheduled annually
Comply with C&W Uniform Dress Code while working and maintain a neat and clean appearance while on the property at times other than working hours

KEY COMPETENCIES

Technical Proficiency
Initiative
Flexibility
Multi-Tasking
Sense of Urgency

IMPORTANT EDUCATION

High School Diploma of GED Equivalent
Graduate of apprentice program or trade school preferred

IMPORTANT EXPERIENCE

5+ years of related work experience in operating mechanical, electrical, and plumbing systems in a commercial property setting

ADDITIONAL ELIGIBILITY QUALIFICATIONS

Appropriate license/permit for trade as may be required, i.e. Journeyman or Master Electrician License or City Licenses, such as Refrigeration Certificate of Fitness, High Pressure Boiler License, High Pressure Steam Operator, etc.)
May be required to have certification as a Universal Technician for CFC’s depending on market licensure requirements
Possess and maintain a valid driver’s license and good driving record with periodic checks (where applicable)
Basic Computing Skills in Outlook, Excel & Word
Experience in operation, maintenance and basic repair of HVAC, boilers, heaters, pumps, refrigerant systems, compressors, water systems, etc.
Knowledgeable in energy management systems, techniques and operations.
Thorough knowledge in all building systems operations, maintenance and repair.

May be only maintenance staff member on duty during certain shifts; may be required to work extended periods of time without relief when responding to priority/emergency situations (including overtime type assignments); may require shift work and/or on call duties

WORK ENVIRONMENT

This job operates in a professional office environment. This role routinely uses standard office equipment such as computers, phones, photocopiers, filing cabinets and fax machines. Regularly required to travel outside between properties in varying weather conditions.

PHYSICAL DEMANDS

The physical demands described here are representative of those that must be met by an employee to successfully perform the essential functions of this job.

Must have ability to stoop, stand, climb, frequently lift a minimum of 50 lbs. of equipment (pumps, tools, ladders) and safely install rigging/lifting devices
Regularly required to crouch and reach to install/move equipment by bending forward at the waist or by bending legs and spine
Involves movement between departments, floors, and properties to facilitate work
Ability to speak clearly so others can understand you
Ability to read and understand information presented orally and in writing
Regularly required to utilize vision abilities, allowing reading of printed material, drawings, and schematics

AAP/EEO STATEMENT

C&W provides equal employment opportunity to all individuals regardless of their race, color, creed, religion, gender, age, sexual orientation, national origin, disability, veteran status, or any other characteristic protected by state, federal, or local law. Further, the company takes affirmative action to ensure that applicants are employed and employees during employment are treated without regard to any of these characteristics. Discrimination of any type will not be tolerated.

OTHER DUTIES

This job description is not designed to cover or contain a comprehensive list of activities, duties or responsibilities that are required of the employee. Other duties, responsibilities and activities may change or be assigned at any time with or without notice.


#INDSkilledtrades




Cushman & Wakefield provides equal employment opportunity. Discrimination of any type will not be tolerated. Cushman & Wakefield is an Equal Opportunity / Affirmative Action employer. All qualified applicants will receive consideration for employment without regard to race, color, religion, sex, national origin, sexual orientation, gender identity, disability, protected veteran status or any other characteristic protected by state, federal, or local law.

In compliance with the Americans with Disabilities Act Amendments Act (ADAAA), if you have a disability and would like to request an accommodation in order to apply for a position at Cushman & Wakefield, please call the ADA line at 1-888-365-5406 or email HRServices@cushwake.com. Please refer to the job title and job location when you contact us.",1917,Real Estate,$5 to $10 billion (USD),Real Estate,10000+ Employees,Company - Public,True
Sr. Data Warehouse Engineer and Architect,"Ayahealthcare
",Oregon,$150K - $200K (Employer est.),4.3,"Join Aya Healthcare, winner of multiple Top Workplace awards!

A Sr Data Warehouse Engineer/Architect at Aya Healthcare is an experienced Cloud Data Warehouse Engineer/Architect with a robust background in big data, data lakes, ETL, digital transformation, machine learning/AI, and digital workflow optimization. This role requires substantial experience with Azure IaaS/PaaS data solutions and technologies, Microsoft SQL, Power BI, and Azure DevOps. The successful candidate will provide technical leadership in designing, implementing, and managing complex data architectures across the enterprise, spearheading digital data transformation initiatives, and fostering a culture of continuous learning and knowledge sharing. You will work independently in a highly collaborative remote-work environment with daily meetings to communicate progress and challenges on projects. You should be efficient and comfortable being a leading a team and have ability to multi-task, while maintaining structure and organization. The ideal candidate for this job is highly resourceful, excels at problem solving, and is a superb communicator.

Who We Are:

We’re a $10+ billion, rapidly growing workforce solutions provider in the healthcare industry. We deliver tech-enabled services that help healthcare organizations meet and manage their contingent labor needs. We build and manage tech-enabled marketplaces for national and local healthcare talent and deliver contingent labor management solutions through our proprietary software platform.

At Aya, we’re obsessed with creating exceptional experiences for our clients, clinicians and employees. In fact, we put employee satisfaction above all else. Our team members are responsible for incomparable customer experience and we know that happy employees are critical to maintaining happy clients. We foster an entrepreneurial, high-energy, low-bureaucracy culture and value innovative thinking and creative problem solving. We embrace diversity in thought and backgrounds unified by a commitment to high achievement. When you join Aya, you’ll be surrounded by teammates who care about you as an individual and leaders who will help you grow both personally and professionally.

Responsibilities:

Lead the design, build, and continuous optimization of data architecture leveraging Azure data solutions (Data Lake, Azure SQL, Azure Synapse Analytics, Azure Data Factory, Databricks) in a big data environment.
Champion digital transformation and workflow optimization initiatives, identifying data acquisition opportunities and strategically directing data and business intelligence tools.
Drive technical discussions that foster reconciling differing opinions and drives decision making process.
Own the strategy around the data warehouse in terms of system monitoring, capacity planning, disaster recovery, and architecture.
Develop, test, and deploy ETL processes, reports, and queries in support of business analytics using tools like Azure DevOps and Redgate Flyway.
Establish and manage data hygiene practices and perform data mining tasks to enhance data quality and usability.
Implement Machine Learning/AI models to drive business decisions and provide insightful analytics.
Ensure all data architectures comply with regulatory and privacy standards.
Create and enforce data governance best practices and standards, training teams as necessary.
Expertise designing and implementing security and access controls to include masking and encryptions, object tagging, role-based access with row and column level security.
Share knowledge and mentor teams in best practices and emerging trends in big data, AI/ML, ETL processes, and Azure DevOps.
Collaborate with cross-functional teams to integrate systems and data effectively and efficiently.
Work closely with stakeholders to address data-related technical issues and support their data infrastructure needs.
Work with data engineers and data owners to understand the data schema, data flow, and develop data dictionaries.
Develop a deep understanding of ingested data from a business perspective.
Continuously assess the existing system for improvements and enhancements.

Required Qualifications

Bachelor's or Master's degree in Computer Science, Engineering, or related field, or equivalent work experience.
Minimum 10 years of experience in data warehousing, big data, cloud technologies, and machine learning/AI.
Extensive experience with Azure IaaS and PaaS solutions and services, particularly in data management and analytics.
Proficiency in ETL processes, data lakes, data modeling, digital transformation, Microsoft SQL Server, and Power BI.
Hands-on experience with Azure DevOps, Terraform, Redgate Flyway, and Redgate Clone.
Deep understanding of distributed computing principles and PaaS services for data analytics like Databricks, Azure Stream Analytics.
Proficient in C#, Microsoft PowerShell, SQL, Python, Spark, or other data processing languages.
Demonstrable experience with ML/AI algorithms and model development.
Strong understanding of network configuration, devices, protocols, and security.
Strong organizational and leadership skills with ability to listen to multiple points of view and synthesize against goals for recommendations.
Exceptional analytical and problem-solving abilities.
Excellent communication and interpersonal skills.
Ability to foster and maintain good working relationships with key business process owners and stakeholders.
Proven ability to mentor and lead teams.

Preferred Qualifications:

Azure Data Engineer Associate or Azure Solutions Architect Expert certification.
Knowledge of data mining and hygiene best practices.
Familiarity with DevOps practices and Agile methodologies.
Strong experience with a broad range of open-source data, data warehouse, data lake, ETL, and workflow technologies.
Experience in a leadership role in technology.

What We Offer:

Free premium medical, dental, life and vision insurance
Generous 401(k) match
Aya also offers other benefits to those that are eligible and where required by applicable law, including reimbursements and discretionary bonuses
Aya provides paid sick leave in accordance with all applicable state, federal, and local laws. Aya’s general sick leave policy is that employees accrue one hour of paid sick leave for every 30 hours worked. However, to the extent any provisions of the statement above conflict with any applicable paid sick leave laws, the applicable paid sick leave laws are controlling
Celebrations! We hit our goals and reward ourselves.
Company-sponsored virtual events, happy hours and team-building activities are always on the horizon — plus, you get a special treat on your birthday!
Unlimited DTO — we believe in time off!
Virtual yoga, meditation or boot camp classes offered daily

Compensation: Aya reasonably anticipates the pay scale for this position to an annual salary of $150,000 to $200,000.

The pay scale for this position may vary if applicant possesses experience outside of what Aya reasonably anticipates for this position. Bonuses are subject to the role and your manager’s discretion.

Aya is an Equal Opportunity Employer (EEO), including Disability / Vets, and welcomes all to apply. Please click here for our EEO policy.",2001,HR Consulting,Unknown / Non-Applicable,Human Resources & Staffing,5001 to 10000 Employees,Company - Private,False
Data Engineer- 5050306,"Accenture
","Beaverton, OR",-1,3.9,"Accenture Flex offers you the flexibility of local fixed-duration project-based work powered by Accenture, a leading global professional services company. Accenture is consistently recognized on FORTUNE's 100 Best Companies to Work For and Diversity Inc's Top 50 Companies For Diversity lists.

As an Accenture Flex employee, you will apply your skills and experience to help drive business transformation for leading organizations and communities. In addition to delivering innovative solutions for Accenture's clients, you will work with a highly skilled, diverse network of people across Accenture businesses who are using the latest emerging technologies to address today's biggest business challenges.

You will receive competitive rewards and access to benefits programs and world-class learning resources. Accenture Flex employees work in their local metro area onsite at the project, significantly reducing and/or eliminating the demands to travel.

Utilize strong SQL Python skills to engineer sound data pipelines and conduct routine and ad hoc analysis to assess the performance of legacy products and the saliency of new features.

Build reporting dashboards and visualizations to design, create and track campaign program KPIs.

Perform analyses on large data sets to understand drivers of operational efficiency.

Manage end to end process of analytic tooling feature development, including request intake, requirements evaluation, cross functional team alignment, feature execution, QA testing, and stakeholder communication.

Consult with business analysts, technical data SMEs, and cross functional partners to understand their reporting and data needs, serving as the point of contact for requests, inquiries, and actions.

Interface with other data engineering, product, and data science teams to implement client needs and initiatives.




Basic Qualifications:

Minimum 2 years experience with Python.

Minimum 3 years experience SQL.

Minimum 3 years experience Big Data Analytics.

High School Diploma or GED.

Preferred Qualifications:

Experience with large enterprise data sets.

Bachelors Degree

Compensation at Accenture varies depending on a wide array of factors, which may include but are not limited to the specific office location, role, skill set and level of experience. As required by local law, Accenture provides a reasonable range of compensation for roles that may be hired in California, Colorado, New York, or Washington as set forth below.

Information on benefits is here.

Role Location

California: $61.53 to $71.53/hour

Colorado: $61.53 to $71.53/hour

New York: $61.53 to $71.53/hour

Washington: $61.53 to $71.53/hour


What We Believe


We have an unwavering commitment to diversity with the aim that every one of our people has a full sense of belonging within our organization. As a business imperative, every person at Accenture has the responsibility to create and sustain an inclusive environment.


Inclusion and diversity are fundamental to our culture and core values. Our rich diversity makes us more innovative and more creative, which helps us better serve our clients and our communities. Read more here


Equal Employment Opportunity Statement


Accenture is an Equal Opportunity Employer. We believe that no one should be discriminated against because of their differences, such as age, disability, ethnicity, gender, gender identity and expression, religion or sexual orientation.


All employment decisions shall be made without regard to age, race, creed, color, religion, sex, national origin, ancestry, disability status, veteran status, sexual orientation, gender identity or expression, genetic information, marital status, citizenship status or any other basis as protected by federal, state, or local law.


Accenture is committed to providing veteran employment opportunities to our service men and women.


For details, view a copy of the Accenture Equal Employment Opportunity and Affirmative Action Policy Statement.


Requesting An Accommodation


Accenture is committed to providing equal employment opportunities for persons with disabilities or religious observances, including reasonable accommodation when needed. If you are hired by Accenture and require accommodation to perform the essential functions of your role, you will be asked to participate in our reasonable accommodation process. Accommodations made to facilitate the recruiting process are not a guarantee of future or continued accommodations once hired.


If you would like to be considered for employment opportunities with Accenture and have accommodation needs for a disability or religious observance, please call us toll free at 1 (877) 889-9009, send us an email or speak with your recruiter.


Other Employment Statements


Applicants for employment in the US must have work authorization that does not now or in the future require sponsorship of a visa for employment authorization in the United States.


Candidates who are currently employed by a client of Accenture or an affiliated Accenture business may not be eligible for consideration.


Job candidates will not be obligated to disclose sealed or expunged records of conviction or arrest as part of the hiring process.


The Company will not discharge or in any other manner discriminate against employees or applicants because they have inquired about, discussed, or disclosed their own pay or the pay of another employee or applicant. Additionally, employees who have access to the compensation information of other employees or applicants as a part of their essential job functions cannot disclose the pay of other employees or applicants to individuals who do not otherwise have access to compensation information, unless the disclosure is (a) in response to a formal complaint or charge, (b) in furtherance of an investigation, proceeding, hearing, or action, including an investigation conducted by the employer, or (c) consistent with the Company's legal duty to furnish information.",1989,Business Consulting,$10+ billion (USD),Management & Consulting,10000+ Employees,Company - Public,False
