Job Title,Company Name,Location,Salary Estimate,Rating,Job Description,Founded,Industry,Revenue,Sector,Size,Type,Easy Apply
"Sr Network Data Center Engineer (Saint Paul, MN)","Patterson
","Saint Paul, MN",$69K - $97K (Glassdoor est.),3.8,"Patterson isn't just a place to work, it's a partner that cares about your success.

One of the distinguishing marks of our company is the talented people who embrace the people-first, always advancing, and results-driven culture. Professional growth abounds in this motivating environment. We value the diverse talents and experiences our employees bring to Patterson and believe that they build a stronger and successful organization.

Job Description:

The Sr Network Engineer is responsible for driving architectural decisions and detailed design activities for Patterson’s network infrastructure. The Sr Network Engineer collaborates with other engineering team members, technology architects, operations staff, developers, and business leads to develop and deliver strategic solutions for the Patterson enterprise. The areas of focus for this role include all aspects of network infrastructure architecture, implementation, process development, and technology integration. This role collaborates on the creation and maintenance of policies and assists with the development of standards, guidelines, and procedures that are consistent with company goals, industry best practices, and regulatory requirements.


Essential Functions

Responsible for design, implementation, and integration of data center, cloud, and end-user network architectures. Works with leadership, architects, and infrastructure teams to analyze and improve current data center networks, WAN solutions, LAN solutions, and cloud environments.

Drives the development of standards, guidelines, and processes for networks, considering redundant systems, policies, capacity planning and high availability

Works with Project Management, architecture, business, technical, and security teams to achieve project delivery. Collaborates with cross-functional teams to ensure alignment and resolve concerns.

Provides escalation support for data center, cloud and core routing platforms.

Provides processes and guidance for tier 1 and 2 staff. Completes root cause analysis of problems and provides potential solutions in area of expertise.

Acts as a leader and advocate of technology stewardship and management, including mentoring, coaching, and training.

Required Qualifications

Bachelor’s degree in related field or equivalent combination of experience and education

At least 5 years’ experience in a Network Engineer role, working with multiple data center environments, network analysis, packet capture and monitoring tools (Wireshark, Observer, SolarWinds, Gigamon, LiveAction and Cisco Modeling Labs).

At least 3 years’ experience with designing/supporting cloud security solutions (AWS, Azure, GCP).

Experience with Express Route a plus.

Routing Protocol knowledge (BGP, OSPF, EIGRP) and experience with QOS.

Expert understanding of architecture design techniques, theories, principles, and practices.

Performance analysis, tuning and optimization on various hardware platforms in a large enterprise environment. Viavi Gigastor and Gigamon experience a plus. Experience as an escalation engineer with a high level of comfort when debugging complex issues.

Proven analytical and problem-solving abilities.

Excellent written and verbal communication skills.

Ability to present ideas in business-friendly and user-friendly language to all levels of management and staff. Ability work on-call and alternative hour schedules when required.

PCI Audit Knowledge.

Highly self-motivated and directed, with keen attention to detail.

Able to effectively prioritize tasks in a high-pressure environment.

Strong customer service orientation.

Experience working in a team-oriented, collaborative environment.

Preferred Qualifications

Prior experience with common network scripting programming languages.

Prior experience with common automation tools such as Ansible, Puppet, Chef.

Prior experience with API integrations.

Prior experience engineering networks with more than 2000 devices.

Prior experience with Cisco technologies/solutions including Nexus 7000/6000/5000/2000, LAN controllers, fixed-configuration switches, and Cisco ISR and ASR series routers.

Experience with Cisco ACI and SD-WAN/SDN.

Prior experience with the DNS/DHCP.

Experience managing partner and vendor relationships to achieve business outcomes.

Prior experience in a global enterprise.

This role is open to primarily remote work with the ability to travel to data centers or our corporate office in Minnesota when needed.

What's In It For You:

We provide competitive benefits, unique incentive programs and rewards for our eligible employees:

Full Medical, Dental, and Vision benefits and an integrated Wellness Program.

401(k) Match Retirement Savings Plan.

Employee Stock Purchase Plan (ESPP).

Paid Time Off (PTO).

Holiday Pay & Floating Holidays.

Volunteer Time Off (VTO).

Educational Assistance Program (Tuition Reimbursement).

Full Paid Parental and Adoption Leave.

LifeWorks (Employee Assistance Program).

Patterson Perks Program.


The potential compensation range for this role is below. The final offer amount could exceed this range, based on various factors such as candidate location (geographical labor market), experience, and skills.

$93,100.00 - $117,400.00

EEO Statement


As a people-first company, Patterson promotes a culture that embodies and celebrates diversity and inclusivity. We believe our employees’ unique experiences and differences is what strengthens us and drives our success. We consider all qualified applicants without regard to race, religion, color, sex, national origin, age, sexual orientation, gender identity, disability or veteran status.


We are Patterson. We welcome you.",1877,Wholesale,$5 to $10 billion (USD),Retail & Wholesale,5001 to 10000 Employees,Company - Public,False
"Lead Engineer - Big Data Platform/Infra (Hadoop, Spark Streaming, Druid)","Target
","Brooklyn Park, MN",$109K - $196K (Employer est.),3.5,"Location: 7000 Target Pkwy N, Brooklyn Park, Minnesota, United States, 55445

The pay range is $109,000.00 - $196,200.00

Pay is based on several factors which vary based on position. These include labor markets and in some instances may include education, work experience and certifications. In addition to your pay, Target cares about and invests in you as a team member, so that you can take care of yourself and your family. Target offers eligible team members and their dependents comprehensive health benefits and programs, which may include medical, vision, dental, life insurance and more, to help you and your family take care of your whole selves. Other benefits for eligible team members include 401(k), employee discount, short term disability, long term disability, paid sick leave, paid national holidays, and paid vacation. Find competitive benefits from financial and education to well-being and beyond at https://corporate.target.com/careers/benefits.

JOIN US AS A LEAD ENGINEER – BIG DATA PLATFORM

About us:

As a Fortune 50 company with more than 350,000 team members worldwide, Target is an iconic brand and one of America's leading retailers. Working at Target means the opportunity to help all families discover the joy of everyday life. Caring for our communities is woven into who we are, and we invest in the places we collectively live, work and play. We prioritize relationships, fuel and develop talent by creating growth opportunities, and succeed as one Target team. At our core, our purpose is ingrained in who we are, what we value, and how we work. It’s how we care, grow, and win together.

The Target High Performance Distributed Computing team creates the platforms and tools to enable our business partners to make data-based decisions at Target. This team helps to manage hardware and software for large scale distributed computing, frequently angling towards data analytics and Artificial Intelligence/Machine Learning type applications. We help develop the technology that personalizes the guest experience, from product recommendations to relevant ad content. We’re also the source of the data and analytics behind Target's Supply Chain optimization, fraud detection, demand forecasting (DFE) and metrics to support our stores. We play a key role in identifying the test-and-measure or A/B test opportunities that continuously help Target improve the guest experience, whether they love to shop in stores or Target.com.

As a Lead Engineer, you serve as the technical anchor for the engineering team that supports a product. You create, own and are responsible for the application and platform architecture that best serves the product in its functional and non-functional needs. You'll bring innovative ideas and help set the strategy for the future of our platform. You love keeping abreast of the latest industry trends and use them to help you innovate. You have leadership qualities, good judgment, and clear communication skills. If you’re excited to work on a fast-moving, tightly knit team and build solutions to unsolved problems, we want to meet you.

As a Lead Engineer, you’ll take the lead as you…

Understand Target's business and technical environments and assist teams in resolving complex business challenges via current technical solutions by assessing viability/applicability/cost implication through POCs and prototypes.
Collaborate with technical staff and Enterprise Architecture teams in setting technical direction across platform and drive technology lifecycle management and communication of standards/decisions to the engineering team.
Participate in procurement specifications, installation, and maintenance of Target systems.
Lead designing and building the Target platform API with deep focus on non-functional requirements including scalability, availability, performance, etc. while being a strong advocate of extreme agile and DevOps practices across engineers.

About You:

BS/MA degree in Computer Science or relevant experience
5+ years of experience in developing software applications
Detailed knowledge of GNU/Linux OS experience w/ administration of production grade services running on Linux servers
Proven track record in writing code that is correct, maintainable, testable, expressive, easy to change, efficient and fault-tolerant
Demonstrated proficiency in Java
Demonstrated knowledge of some of the following concepts:
Operating system architecture, memory management, process scheduling, I/O scheduling
Networking, technologies, latency, bandwidth
Benchmarking, performance debugging, performance monitoring
Limiting-resource identification
Have familiarity and experience with some of the following:
Hadoop (multi-node fully distributed Hadoop clusters)
Spark
HDFS
Hive
ZooKeeper
Ozone
Trino/PrestoSQL
Possess a strong understanding of high-performance, large-scale system architecture design and implementation
Experience with distributed and parallel processing, computer architecture, operating systems, synchronization, communication
Experience with modern CI/CD technologies such as Git, Drone, Docker, Artifactory
Understand business fundamentals and how technologies can support business goals along with how to translate business vision into a technical strategy and financial implications
Strong team player who understands concepts of teamwork and team effectiveness.
Have excellent verbal, written, and presentation communication skills to convey complex technical solutions clearly to an organization
Have excellent planning and organizational skills

This position will operate as a Hybrid/Flex for Your Day work arrangement based on Target’s needs. A Hybrid/Flex for Your Day work arrangement means the team member’s core role will need to be performed both onsite at the Target HQ MN location the role is assigned to and virtually, depending upon what your role, team and tasks require for that day. Work duties cannot be performed outside of the country of the primary work location, unless otherwise prescribed by Target. Click here if you are curious to learn more about Minnesota.

Americans with Disabilities Act (ADA)

Target will provide reasonable accommodations with the application process upon your request as required to comply with applicable laws. If you have a disability and require assistance in this application process, please visit your nearest Target store or Supply Chain Facility or reach out to Guest Services at 1-800-440-0680 for additional information.",1962,General Merchandise & Superstores,$10+ billion (USD),Retail & Wholesale,10000+ Employees,Company - Public,False
Data Engineer - 5050304,"Accenture
","Minneapolis, MN",-1,3.9,"Accenture Flex offers you the flexibility of local fixed-duration project-based work powered by Accenture, a leading global professional services company. Accenture is consistently recognized on FORTUNE's 100 Best Companies to Work For and Diversity Inc's Top 50 Companies For Diversity lists.

As an Accenture Flex employee, you will apply your skills and experience to help drive business transformation for leading organizations and communities. In addition to delivering innovative solutions for Accenture's clients, you will work with a highly skilled, diverse network of people across Accenture businesses who are using the latest emerging technologies to address today's biggest business challenges.

You will receive competitive rewards and access to benefits programs and world-class learning resources. Accenture Flex employees work in their local metro area onsite at the project, significantly reducing and/or eliminating the demands to travel.

Utilize strong SQL Python skills to engineer sound data pipelines and conduct routine and ad hoc analysis to assess the performance of legacy products and the saliency of new features.

Build reporting dashboards and visualizations to design, create and track campaign program KPIs.

Perform analyses on large data sets to understand drivers of operational efficiency.

Manage end to end process of analytic tooling feature development, including request intake, requirements evaluation, cross functional team alignment, feature execution, QA testing, and stakeholder communication.

Consult with business analysts, technical data SMEs, and cross functional partners to understand their reporting and data needs, serving as the point of contact for requests, inquiries, and actions.

Interface with other data engineering, product, and data science teams to implement client needs and initiatives.




Basic Qualifications:

Minimum 2 years experience with Python.

Minimum 3 years experience SQL.

Minimum 3 years experience Big Data Analytics.

High School Diploma or GED.

Preferred Qualifications:

Experience with large enterprise data sets.

Bachelors Degree

Compensation at Accenture varies depending on a wide array of factors, which may include but are not limited to the specific office location, role, skill set and level of experience. As required by local law, Accenture provides a reasonable range of compensation for roles that may be hired in California, Colorado, New York, or Washington as set forth below.

Information on benefits is here.

Role Location

California: $61.53 to $71.53/hour

Colorado: $61.53 to $71.53/hour

New York: $61.53 to $71.53/hour

Washington: $61.53 to $71.53/hour


What We Believe


We have an unwavering commitment to diversity with the aim that every one of our people has a full sense of belonging within our organization. As a business imperative, every person at Accenture has the responsibility to create and sustain an inclusive environment.


Inclusion and diversity are fundamental to our culture and core values. Our rich diversity makes us more innovative and more creative, which helps us better serve our clients and our communities. Read more here


Equal Employment Opportunity Statement


Accenture is an Equal Opportunity Employer. We believe that no one should be discriminated against because of their differences, such as age, disability, ethnicity, gender, gender identity and expression, religion or sexual orientation.


All employment decisions shall be made without regard to age, race, creed, color, religion, sex, national origin, ancestry, disability status, veteran status, sexual orientation, gender identity or expression, genetic information, marital status, citizenship status or any other basis as protected by federal, state, or local law.


Accenture is committed to providing veteran employment opportunities to our service men and women.


For details, view a copy of the Accenture Equal Employment Opportunity and Affirmative Action Policy Statement.


Requesting An Accommodation


Accenture is committed to providing equal employment opportunities for persons with disabilities or religious observances, including reasonable accommodation when needed. If you are hired by Accenture and require accommodation to perform the essential functions of your role, you will be asked to participate in our reasonable accommodation process. Accommodations made to facilitate the recruiting process are not a guarantee of future or continued accommodations once hired.


If you would like to be considered for employment opportunities with Accenture and have accommodation needs for a disability or religious observance, please call us toll free at 1 (877) 889-9009, send us an email or speak with your recruiter.


Other Employment Statements


Applicants for employment in the US must have work authorization that does not now or in the future require sponsorship of a visa for employment authorization in the United States.


Candidates who are currently employed by a client of Accenture or an affiliated Accenture business may not be eligible for consideration.


Job candidates will not be obligated to disclose sealed or expunged records of conviction or arrest as part of the hiring process.


The Company will not discharge or in any other manner discriminate against employees or applicants because they have inquired about, discussed, or disclosed their own pay or the pay of another employee or applicant. Additionally, employees who have access to the compensation information of other employees or applicants as a part of their essential job functions cannot disclose the pay of other employees or applicants to individuals who do not otherwise have access to compensation information, unless the disclosure is (a) in response to a formal complaint or charge, (b) in furtherance of an investigation, proceeding, hearing, or action, including an investigation conducted by the employer, or (c) consistent with the Company's legal duty to furnish information.",1989,Business Consulting,$10+ billion (USD),Management & Consulting,10000+ Employees,Company - Public,False
Data Quality Assurance Engineer (Hybrid),"Farm Credit Network
","Lakeville, MN",$59K - $81K (Glassdoor est.),4.7,"Compeer Financial is seeking collaborative, innovative and dynamic professionals to be a part of our Top Workplace culture!

Tell me more about this opportunity.

Position Overview:
This position evaluates and performs functional, integration and regression testing for various data-related engagements. Supports Business Data Analysts, ETL Developers and other stakeholders in analysis of business needs, process improvements and new technologies. Develops procedures to efficiently create and execute test plans, track defects and resolve identified issues. Develops automated test scripts and maintains an automation framework using QA software tools and processes. Provides subject matter expertise and mentorship across the organization. Proactively identify problems with acceptance criteria (lack of clarity, inconsistencies, technical limitations) and communicates these issues early.

Essential Functions:

Collaborates with Business Systems Analysts, ETL Developers, and other stakeholders to review project requests, participate in design sessions and determine testing goals.
Estimates, prioritizes, plans and coordinates testing activities.
Utilizes various testing methods to ensure quality, including black box, white box, regression, and automated testing.
Writes, executes and maintains both manual and automated test cases for functional, integration and regression testing which includes translating both simple and complex business rules to SQL queries and executing those queries to validate data quality and accuracy and ensure that it meets agreed-upon requirements and applicable QA standards.
Provides testing status updates to the project team.
Manages and reports test results which will require clear and concise documentation and an ability to conduct root cause analysis and communicate complex information to both technical and non-technical personnel.
Tracks data issu es and works with team leads from discovery to resolution.
Collaborates with reporting and analytics teams to conduct data quality investigations.
Maintains test environments to include managing test data, configuring systems for specific test needs, ensuring compliance with standards.
Leads efforts to develop, implement and review quality processes and methodologies.
Participates with cross-functional Data and Business Technology teams to formulate best practices.
Researches new testing tools, technologies and strategies.
Facilitates meetings with Data, Project Delivery and/or business unit team members.

Minimum Qualifications & Required Knowledge, Skills and Abilities:

Bachelor’s degree in math, computer science, management information systems, or related field or an equivalent combination of education and experience sufficient to perform the essential functions of the job.
Minimum of 3 years of experience in a software or data development environment as an application/ETL tester, business analyst, technical writer or developer.
Knowledge of software testing methodologies, tools and best practices.
Knowledge of business applications, process improvement, project management systems, and agile methodology.
Solid knowledge and experience in writing clear, concise and comprehensive test plans and test cases.
Solid knowledge in writing complex SQL queries on large tables (millions of records) and ensure data integrity is maintained throughout the ETL lifecycle.
Specialized experience with data warehouses, APIs, ETL testing and SQL scripting.
Knowledge of queries, scripting and coding frequently used in QA Automation tools.
Experience creating automated test scripts using QA software tools and processes.
Knowledge of effective automation test design and development methods.
Effective communication skills t o clearly and concisely convey technical issues to customers and to share ideas, solutions and feedback with team.
Effective interpersonal, analytical, organizational and planning skills.
Ability to apply a methodical and logical approach to problem solving.
Critical thinking skills with attention to detail and accuracy.
Quick learner who thrives in a collaborative team environment.
Ability to coordinate tasks to meet established deadlines.
Ability to foster collaborative working relationships across the organization.
Ability to train and mentor others.
Demonstrates initiative to remain technically competent by keeping abreast of industry best practices.
Ability to work independently and collaboratively with other teams to achieve goals and represent the business.

Who is Compeer Financial?
Compeer Financial exists to champion the hopes and dreams of rural America. By joining our team, you will help empower those in agriculture and rural communities to achieve their goals and expand their possibilities. We embrace business agility and innovative approaches to serving our clients and communities.

Why join our team?

Amazing team members who are passionate about serving agriculture and rural America.
Investment in our team members’ education, growth and development.
Engagement in our communities through giving back and volunteerism.
Flexible, collaborative and dynamic work environment.
Great benefits:

Medical, Dental, Vision insurance
401K (3% Compeer contribution & up to an additional 6% match)
Paid time off (vacation, sick leave, holidays, volunteer time)

Find out why our team members choose Compeer Financial by watching this video.

How do I apply?
Qualified candidates, please apply online at www.compeer.com/careers.

Compeer Financial is an equal opportunity employer and all qualified applicants will receive consideration for employment without regard to race, color, religion, sex, national origin, disability status, protected veteran status, or any other characteristic protected by law.",-1,Banking & Lending,$25 to $100 million (USD),Financial Services,51 to 200 Employees,Company - Public,False
