Job Title,Company Name,Location,Salary Estimate,Rating,Job Description,Founded,Industry,Revenue,Sector,Size,Type,Easy Apply
Executive Analyst (FT),"Buffalo Run Casino & Resort
","Miami, OK",$54K - $86K (Glassdoor est.),2.8,"To be fully considered for this position, you must apply directly on Buffalo Run's career website via the link:
https://recruiting.paylocity.com/recruiting/jobs/All/7344bc26-8785-453b-be2e-271f795e14d9/Buffalo-Run-Casino-Resort

Position Description:
The Executive Analyst will provide insights and report on findings via data visualizations and stories derived from various sources related to all casino and marketing activities for Buffalo Run Casino & Resort. By exploring market trends, competitors, potential and existing guests, the Executive Analyst will help to foster a data driven environment through the creation of models and analysis that drive revenue, profit, and engagement. This individual will coordinate with teams throughout the organization and external agencies to collect and retrieve data required for research projects.

Knowledge, Skills, and Abilities:
Build business intelligence, reports and dashboards using software like Microsoft Excel/VBA, Tableau, or SAS Visual Analytics that include segment/campaign profitability and customer behavior or trends.
Create training material to raise the competency of analytics across Buffalo Run Casino & Resort Investigate and conduct deep dives into data across marketing channels (email, web, social, digital advertising, events, etc.) to understand customer engagements and analyze user behaviors throughout the customer journey.
Collect customer demographic information (e.g., gender, income, age) and market data (e.g., competition prices, industry, media) through primary research methods and sources (such as surveys, media ratings tools, internal databases and focus groups) and secondary research (information from industry associations, statisticians, and marketing experts).
Conduct market research for determining brand perceptions, understanding guest needs, evaluating market penetration and analyzing competitors.
Generate reports that analyze customers, competition, the industry, and marketing activities using charts, graphs, explanatory text and previously developed ROI formats.
Perform special studies as assigned, including preparation of written and/or verbal reports. Oversee all department presentation materials, including but not limited to, final reports, PowerPoint presentations, and all electronic presentation deliverables.
Perform other duties as assigned to support the efficient operation of the department.
Collaborate across multiple teams to research, analyze, and configure complex data sources according to business needs.
Manage projects to scope requirements for data matrix to be used for analysis and coordinate input and approvals from multiple stakeholders.
Build reports and dashboards that enable managers, operators, and team members to better understand our business and facilitate key decisions. Identify gaps in reporting and business intelligence capabilities needed by divisions/departments and work on long-term solutions to meet these needs.
Create reports and analyze data for departments that do not have analytics support. Participate in the identification, definition, and testing of company-wide metrics.
Run cross-departmental projects with multiple contributors.
Work independently with leaders across the company to identify opportunities for new data analysis and development of new self-service tools to improve productivity and outcomes.
Collaborate closely with other teams to implement new functions and data across the broader scope of the company. Mentor and help others grow their skills drive growth.
A thorough leader who influences and collaborates across the enterprise.
Highly self-motivated and directed with a strong sense of curiosity.
Faces organizational challenges with energy and resiliency.

Education/Qualifications:
Bachelor’s degree or equivalent from an accredited college or university in Information Management, Computer Science, Computer Systems Engineering, Business Administration, Mathematics, or a related field 4+ years of experience working in quantitative/data analyst roles with hospitality, food and beverage, and retail experience preferred.
Ability to train and administer the tool sets (data visualization and analytics tool sets – Tableau, PowerBI, and SQL) Strong analytical skills with the ability to collect, organize, analyze, and disseminate significant amounts of information with attention to detail and accuracy.
Understanding of standard data models/schemas·
In-depth knowledge of best practices in database management.
Advanced analytical, leadership, and problem-solving skills.
Must be able to work in fast paced, high-performance environment with tight deadlines.
Requires ability to think critically and independently, while at the same time the ability to know when to ask for help; requires excellent common sense.
Ability to self-manage project based upon defined timelines and variable outcomes required.
Ability to complete projects that require long hours prepping presentation materials from not just content, but even “making them dynamic” perspective.

Licensing & Work Requirements:
Shift hours: M-F (days)
Must be able to obtain and maintain the required Gaming License",2004,Hotels & Resorts,$5 to $25 million (USD),Hotels & Travel Accommodation,201 to 500 Employees,Company - Private,True
Financial Analyst,"MidFirst Bank
","Oklahoma City, OK",$50K - $69K (Glassdoor est.),3.6,"The analyst will be responsible for data analytics, performance reporting and business intelligence solutions in support of the Bank’s mortgage asset strategies. This challenging position offers a great career path for inquisitive, hard-working individuals who are passionate about working with data and transforming it into useful business insights.

Responsibilities:

Gathers and analyzes data related to mortgage assets for the purpose of asset acquisition and performance modeling.
Maintains datasets and business intelligence solutions.
Creates reports and visualizations in support of investment decisions and business initiatives.
Provides support for the Bank’s mortgage asset acquisition activities.
Develop subject area expertise in certain aspects of mortgage asset performance.



Qualifications:

The ideal candidate is a research-minded professional with excellent problem-solving and data analysis skills.
The candidate is familiar with gathering, organizing, analyzing, and presenting large and complex datasets.
The candidate must be a self-starter who can also work well with others.
The candidate must have effective verbal and written communication skills.
A bachelor’s degree in Accounting, Economics, Finance, Statistics or Mathematics is required with a minimum cumulative GPA of 3.50 or above.
Previous work experience in finance, accounting or related field is preferred but not required.
Business-intelligence experience, working knowledge of statistics and proficiency with Microsoft Excel and Access are also preferred but not required.



This position is onsite in the Oklahoma City office and does not offer hybrid/remote work.

Equal Opportunity Employer/Protected Veterans/Individuals with Disabilities

The contractor will not discharge or in any other manner discriminate against employees or applicants because they have inquired about, discussed, or disclosed their own pay or the pay of another employee or applicant. However, employees who have access to the compensation information of other employees or applicants as a part of their essential job functions cannot disclose the pay of other employees or applicants to individuals who do not otherwise have access to compensation information, unless the disclosure is (a) in response to a formal complaint or charge, (b) in furtherance of an investigation, proceeding, hearing, or action, including an investigation conducted by the employer, or (c) consistent with the contractor’s legal duty to furnish information. 41 CFR 60-1.35(c)",1982,Banking & Lending,Unknown / Non-Applicable,Financial Services,1001 to 5000 Employees,Company - Private,False
Business Intelligence Specialist - City,"The City of Oklahoma City
","Oklahoma City, OK",$37.76 - $57.70 Per Hour (Employer est.),3.6,"$37.76 - $57.70 Hourly

Note : The normal starting pay for this position is the minimum of the pay range listed above. A higher rate of pay may be considered, dependent on the qualifications and experience of the selected applicant and/or the City’s step placement policy.

JOB SUMMARY

This position is located in the Development Center Division of the Development Services Department with the City of Oklahoma City and is responsible for gathering complex business data, using statistical methods to analyze data, identifying trends and patterns in datasets and making recommendations, and creating models and presentations of findings. Work is performed on an independent basis, requiring a previous knowledge of development and/or support for commercial and custom applications serving a broad range of business needs. Essential job functions include : Leadership and oversight of various programs dealing with the management and analysis of data; identifying and developing new ways to introduce data into the current system, as well as develop and maintain new systems for monitoring efficiency of work and evaluations. Specific tasks include but are not limited to pulling existing data from multiple databases, analyzing data, and creating annual reports and projected outcomes; Assembling gathered data to present to executive staff for annual reports and evaluations; Working closely with Information Technology to communicate design, alignment, and implementation of technical standards to address appropriate business solutions.

VETERANS PREFERENCE

Honorably discharged veterans of the United States Active Duty Armed Forces, National Guard, and Reserve Forces who are not currently employed full-time by the City of Oklahoma City and who meet the qualifications for the position shall be given preference. To receive preference, veterans must submit verification of honorable discharge from the United States military service (Department of Defense Form DD214 or NGB Form 22) prior to the closing date of the vacancy announcement.

JOB REQUIREMENTS

Knowledge and skill in analysis and data management understanding how data relates and is relevant to current business functions and future interfaces.
Knowledge and skill with software related to programming and data gathering, mining, analysis and presentation using charts, graphs, or tables.
Skill in accurately performing mathematical computations.
Skill in data governance ensuring data quality exists throughout the entirety of the data life cycle, monitoring the availability, usability, and consistency of data integrity.
Skill in research coordination planning activities, such as, identifying problem areas, proposing alternative solutions to those problem areas, developing plan implementation and statistical analysis, and accurate research findings.
Skill in research analysis inquiring, examining, and revising current facts, to prepare reports.
Skill in organizing, recording, and working accurately with large quantities of information and data.
Skill in technical thinking and writing.
Strong oral and written communication skills.
Ability to recall and retain information.
Ability to work with minimum supervision.
Ability to travel.

COMPETENCIES

Execution and Results: (1) Sets well-defined and realistic goals and high standards of performance for self or self and others; (2) displays a high level of initiative, effort, and commitment toward performing work; (3) completes assignments in a thorough, accurate, and timely manner, and delivers results; (4) works with minimal supervision, is motivated to achieve, and demonstrates responsible behavior; (5) demonstrates understanding of all aspects of the job and application of accrued knowledge in carrying out duties and responsibilities; technical knowledge; skill in the techniques, equipment, procedures, and work required; (6) recognizes opportunities and takes action for improvement to programs, policies, procedures, practices, and processes; (7) understands and is able to apply the principles, methods, and tools of quality improvement; (8) collects, examines, analyzes, and interprets data from a variety of sources; (9) makes data-driven recommendations/decisions and achieves results; (10) effectively achieves results through others to achieve the Department or City's mission.
Judgment: (1) Plans, coordinates, and executes business functions efficiently, effectively, and in a fiscally responsible manner; (2) identifies risks and develops and implements measures to avoid, mitigate, or minimize those risks; (3) makes effective, timely, well-informed, objective, and transparent work-related decisions; (4) exhibits emotional maturity and stability, effectively manages conflict, and remains optimistic and calm during stressful situations; (5) uses resources effectively to achieve results aligned with organizational priorities; (6) applies understanding of financial management/budgeting principles to ensure decisions are fiscally sound and responsible and in accordance with policies, procedures, processes, rules, regulations, and laws; (7) makes business decisions that drive positive, fiscally responsible performance; (8) manages ambiguity, business insight, financial acumen, makes decisions using data and insight that achieves the best outcome for the department and City.
Teamwork/Team Oriented: (1) Recognizes, values, and leverages the ideas, opinions, and perspectives of others; (2) participates willingly and effectively as a team lead or team member; (3) builds consensus; fosters team commitment, spirit, pride, and trust; (4) collaborates with others to accomplish goals and objectives and achieve results; (5) expresses facts, ideas, messages, and information (technical and non-technical) to individuals or groups clearly, concisely, accurately, understandably, with honesty, tact, and diplomacy and in a manner that is appropriate for the intended audience; (6) actively listens, clarifies information as needed.
Customer Centric: (1) Demonstrates commitment to public service; (2) serves and satisfies internal and external customers in a timely and effective manner; (3) establishes, commits to, and maintains high standards for producing quality work products and being responsive to customers; (4) supports the Department/City's mission; develops and executes strategies with the customer in mind.
Strategic Thinking: (1) Thinks conceptually, imaginatively, and systematically; (2) envisions the future; (3) defines the vision, direction, and goals; (4) develops a road map for achievement; (5) anticipates change and plans for it; (6) considers long-term value and consequences; (7) influences others to achieve results; (8) understands where the organization is headed; knows the organization's mission and functions, and how its social, political, and technological systems work; (9) aligns business strategies to long-term success of the City; (10) sets the vision, direction and compelling course of action; (11) operates effectively within the systems, programs, policies, procedures, codes, ordinances, rules, and regulations of the organization; (12) knows industry and stays ahead of best practices; (13) understands the political environment, management priorities, staff roles and responsibilities, and grasps external factors impacting the organization; (14) identifies when issues need to be escalated to higher authorities and effectively alerts appropriate officials.
Leads Through Influence: (1) Persuades others; builds consensus through give and take; (2) gains cooperation from others to obtain information and accomplish goals; (3) works with others towards achieving agreements that may involve exchanging resources or resolving differences; (4) understands the concepts, practices, and techniques used to identify, engage, influence, and monitor relationships with individuals and groups connected to a work effort including those actively involved; (5) leads through influence over the process and its results, and those who have a vested interest in the outcome (positive or negative).
Commitment to Continuous Improvement : (1) Recognizes opportunities for improvement with regard to programs, policies, procedures, practices, and processes; (2) understands and is able to apply the principles, methods, and tools of quality improvement; (3) collects, examines, analyzes, and interprets data from a variety of sources; (4) makes data-driven recommendations/decisions and achieves results.
Agility : (1) Values collaboration, communication, and feedback and is flexible and open to new ideas; (2) learns rapidly and transforms learning into action; (3) examines processes and practices to perform work most effectively; (4) demonstrates courage and willingness to take calculated risks; (5) assesses readiness; proposes new approaches, methods, and technologies plans, implements, and evaluates change in a transparent, positive, and thoughtful manner; (6) exhibits emotional maturity and stability, effectively manages conflict, and remains optimistic and calm during stressful situations; (7) rapidly adapts to change and leads others through change, while producing tangible results and identifying new opportunities.
Talent Development: (1) Provides tools, materials, equipment, and resources; (2) provides performance feedback, coaching, mentoring, encouragement, and support; (3) discusses personal and professional goals; (4) provides formal and informal learning and development opportunities that support achievement of personal and professional goals; (5) attracts and develops talent; (6) manages performance throughout the department or City; (7) sets the leadership tone for area of responsibility. Note: This competency is not applicable for employees who are not supervisors.
Inclusive Leadership: (1) Fosters a diverse, equitable and inclusive workplace where individual differences are valued, and employees feel a sense of belonging; (2) seeks to know and learn about others; welcomes diversity in ideas, perspectives, and thoughts; understands and respects values, attitudes, and beliefs of others; (3) seeks to build diverse teams through inclusive hiring practices (ensures opportunity for individuals of all backgrounds and demonstrates a commitment to hiring the most qualified candidates); (4) cultivates engagement, team building, collaboration; (5) instills trust; (6) recognizes contributions and celebrates accomplishments; (7) promotes the advancement of all employees including those of marginalized identities (e.g., coaching, mentoring, providing personal and professional development opportunities); (8) actively participates in and encourages others to participate in diversity and inclusion programming and/or training; (9) strategically integrates inclusion into business practices and decisions; (10) demonstrates respect, inclusiveness, understanding, tact, diplomacy, and professionalism in developing and maintaining effective working relationships with others; (11) effectively manages one's own feelings and emotions; (12) builds diverse teams, promotes advancement of marginalized employees, participates and encourages participation of I&D initiatives. Note: This competency is not applicable for employees who are not supervisors.

WORKING CONDITIONS

Primarily indoors, subject to sitting, standing, walking, using a telephone, keyboard, visual display terminal, etc., for extended periods of time.
Primarily inside in a climate-controlled environment.
Subject to frequent low-level noise from data processing equipment.
Occasionally required to work beyond normal working hours or to change working hours when conducting training or systems analysis.
Occasional local and out-of-town travel.

Note : Typical City employee working hours are 8:00 a.m. to 5:00 p.m., Monday through Friday. However, working hours vary (may require work to begin before 8:00 a.m. and/or end beyond 5:00 p.m., and/or may require work on weekends and holidays), and are subject to change, based on the duties and location of the position and the business needs of the assigned work unit/department.

PHYSICAL REQUIREMENTS

Arm/hand steadiness enough to demonstrate and operate computing equipment such as calculators, keyboards, and other computer operating devices.
Manual and finger dexterity enough to operate equipment such as personal computers, audio visual, and other training aids.
Near vision enough to read, write, develop training materials, and systems documentation, etc.
Speech and hearing enough to communicate clearly and distinctly by telephone and in person.

OTHER DETAILS

Pay Method: City employees are required to receive pay electronically, either via direct deposit or pay card.

Former Employees: If this position is open to external applicants and you are a former employee, you must be eligible for rehire to participate in any selection process. If you are unsure of your rehire status, please contact the Human Resources Department at (405) 297-2530. If your rehire status has been coded “Not Eligible,” “Eligible 3,” or “Conditional,” you will need to request a review of your rehire status through the Human Resources Department’s Employee and Labor Relations Division.

Background Investigation, Drug Testing, Physical Examination: Upon a conditional offer of employment/acceptance of position, the City of Oklahoma City will conduct a criminal history background check for external applicants. Applicants will be provided contact information for any third-party reporting agencies used to collect background information in connection with conditional offers of employment.

If the position accepted includes a driver license (commercial or non-commercial) Job Requirement, the City of Oklahoma City will obtain a Motor Vehicle Report for internal and external applicants.

If the position accepted is safety sensitive and/or a driving position, internal and external applicants will be provided a copy of the City of Oklahoma City's Drug and Alcohol Testing Policy prior to being directed for a drug test.

If the position accepted is cyber security sensitive, internal and external applicants will be subject to a Criminal Justice Information Services (CJIS) Interstate Identification Index (III) Fingerprint Background check. Additionally, employees in this job classification must complete Level 4 Security Awareness Training and pass an online certification test.

If the position accepted includes a lift/push/pull/carry Physical Requirement of 25 pounds and greater, internal and external applicants will be directed for a physical examination.

Note: Completion of the supplemental questions is required. Applicant responses to supplemental questions must specifically answer the questions asked. Responses to supplemental questions must be supported by work history/information listed on the application/resume. Applications may not be reviewed if specific responses to supplemental questions have not been provided.

AN EQUAL OPPORTUNITY EMPLOYER

If you require reasonable accommodation at any time during the hiring process, please notify one of the Human Resources Department Representatives by calling 405-297-2530. The City of Oklahoma City is an equal opportunity employer and values diversity and inclusion. The City of Oklahoma City will not discriminate against any applicant or employee because of race, color, creed, national origin, ethnicity, religion, sex (to include sexual orientation and gender identity and/or expression), age, genetic information, disability or political affiliation.",1889,Municipal Agencies,Unknown / Non-Applicable,Government & Public Administration,1001 to 5000 Employees,Government,False
