Job Title,Company Name,Location,Salary Estimate,Rating,Job Description,Founded,Industry,Revenue,Sector,Size,Type,Easy Apply
Senior Business Intelligence Analyst (IT),"MTF Biologics
",United States,-1,3.7,"Overview/Risks:
Serve as technical team leader and work closely with business and technical partners across the enterprise to enable the implementation of end-to-end Business Intelligence solutions. Possess exceptional data transformation, warehousing and automation skills, as well as interpersonal skills to work cross-functionally and drive better data access and holistic analytics. Play a key role in the architecture, delivery and governance of reporting and data delivery
Responsibilities:
Manage reporting environments including data warehouse, data sources, security, licensing, and metadata.
Ensure evolving data warehouse is in lockstep with evolving analytics and reporting use cases, and partner with the infrastructure team to ensure the data warehouse scales with growth.
Responsible for planning, designing, configuring, developing, testing, deploying and supporting ETL/BI solutions. Develops and uses ETL applications to perform data analysis, create technical designs and provide applications support.
Partner cross-functionally with our infrastructure, engineering, and analytics teams to define and drive optimized data access and data-informed decision-making across the organization.
Write complex SQL scripts to extract data from variousdatabases and systems to make data available for enterprise reporting.
Responsible for establishing and maintaining data normalization and data integrity.
Facilitate automation of analytical and operational tasks and processes.
Create ope rational metrics and KPIs to improve data quality and operational efficiency.
Establish data management best practices to ensure completeness, cleanliness, and consistency across the entire data lifecycle.
Identify and revise enterprise reporting requirements.
Responsible for evaluation, installation, testing, implementation, maintenance and troubleshooting of new or upgraded BI Applications.
Troubleshoot reported problems pertaining to BI tools and database environments, working closely with other IT members, especially DBAs, Systems Analysts, BI Analysts and Systems Engineers, identifying the cause and designing / developing an approach for resolution.
Assess impact of changes and updates to source production systems, planning and implementing resulting changes to reports and dashboards.
Governance / Best Practices – adhere and contribute to enterprise data governance standards. Also educates andsupports colleagues in best practices to ensure that data is used appropriately.
Conduct end user training on BI systems.
Perform system administrator functions within software, including maintaining configuration of software, account management, maintaining system security.


Qualifications:
MINIMUM QUALIFICATIONS
Education: Bachelor's Degree, Masters Degree (Combination of Education and/or Equivalent Work
Experience)
Other MSCE a plus
Other CBIP a plus

Years of Experience:
Minimum Years of Experience
Area of experience
7 Years Experience with business intelligence platforms
5 Years Strong working knowledge of data-warehousing, ETL, automation and reporting
5 Years Exceptional data retrieval and handling skills using SQL (or other scripting languages) Data modeling and data analysis skills with a strong customer focus.
5 Years System administration and security
3-5 years of Experience with Power BI.

Specialized Knowledge, Technical Skills, and Abilities

Ability to interface with various levels of the business and across various functional groups.
Strong technical documentation skills.
Excellent communication skills (written and verbal) and organizational skills.
Ability to work with minimal supervision.
Ability to think creatively and critically.
Ability to thrive in a fast paced, dynamic, & often ambiguous work environment.

#INDMTF",1987,Health Care Services & Hospitals,$100 to $500 million (USD),Healthcare,1001 to 5000 Employees,Nonprofit Organization,False
Data & Systems Analyst,"The Goal Family of Companies
","Sioux Falls, SD",$80K - $120K (Glassdoor est.),4.2,"Position: Data and Systems Analyst
Location: Sioux Falls


Goal Solutions, LLC (“Goal” or the “Company”) is an innovative consumer loan servicing and asset management company providing comprehensive and customizable solutions driven by technology, analytics, and industry expertise. Goal is recognized by industry leaders and is a finalist for 2022’s Lendit FinTech award.

Directly or through its subsidiaries, GSS Data Services, Launch Servicing (“Launch”) and Turnstile Capital Management (“TCM”), Goal provides primary servicing, asset management, collections management, direct collections, administration, and treasury services. Key markets we serve include residential solar, home improvement, student finance, and a growing number of personal loan providers. Currently Goal serves a variety of clients including hedge funds, traditional banks, ABS structures, insurance companies, investment banks, and colleges and universities with over $30B in assets under management.

Goal will continue to grow the business both organically and through acquisitions. Senior Goal leadership has been working together for almost fifteen years and we pride ourselves and our work on our mission, values, culture, and service to our community. Our company is headquartered in San Diego, CA and has been named “Best Places to Work” by the San Diego Business Journal since 2015.

Job Description:

The Data and Systems Analyst will be responsible for assisting Operation in the administration of the Latitude system and well as providing KPI date to management showing performance and identifying areas of opportunity. They will oversee the various workflows and daily processes within Latitude and ensure all deliverables are completed in a timely manner. They will also assist in onboarding new clients and maintaining existing relationships while working directly with them and working closely with the IT and BI departments.

Responsibilities:

Assist Recovery Operations in executing batch processes and workflows including placements, letter and digital communication campaigns, and account scrub processes

Assist in developing and executing Latitude test plans for programming and development of the Latitude platform

Be the system administrator for the Latitude system and run processes through various Latitude modules to ensure continuity of business processes

Perform modifications and adjustments to workflows for multiple lines of business.

Assist in creating reporting and deliverables for internal and external use.

Provide analysis and statistics of key KPI data to Operations to assist in decision making and strategy for the department

Assist in providing our clients their required reporting and requests including but not limited to, call logs, remittances, reconciliation files, account status logs, and other ad hoc requests.

Be a liaison between our clients and the I.T. department to facilitate and oversee projects and deliverables that are required ensuring accuracy.

Assist in onboarding of new clients and developing reporting utilizing SQL and Latitude Reports

Education & Other Minimum Requirements

A Bachelor’s degree in Information Technology, Computer Science or a related field preferred

Proficient it utilizing SQL

Working knowledge of the capabilities and strategies of quality assurance

Experience in Latitude products preferred

Experience in working in Collections or Third Party Collections preferred.

Good problem-solving skills

Keen attention to detail.

Outstanding written and oral communication abilities

Excellent interpersonal skills

Ability to excel in a fast-paced, ever-changing team environment

Proficient with MS Office applications and experience with testing multiple versions of Web browsers

Experience in financial services and/or student educational lending preferred

Bonus points if you have:

Master’s degree in finance, economics, or business administration

Demonstrated experience providing leadership in a multi-business line organization

Leadership working in the consumer finance industry or banking operations organizations


Competitive pay with bonus, and a comprehensive benefits package that includes, but not limited to:

401(k) + company match up to 4%

Medical, dental, and vision coverage

Annual HSA contribution of $1,500

Life insurance, disability, and critical illness

Birthday holiday

2 floating Community Days

Free snacks and drinks in the office

Tuition reimbursement program

Generous PTO, including Paid Parental Leave

$2,000 Vacation Incentive Plan after 3 years + $1,000 Sabbatical Day

Community funds, wellness funds, and more

Learn more about our benefits by viewing our 2023 Employee Benefits Brochure.


The Job Description is intended to be a general representation of the responsibilities and requirements of the job. However, the description may not be all-inclusive, and responsibilities and requirements are subject to change.


Equal Employment Opportunity

It is the policy of the Company to provide equal employment opportunities to all employees and employment applicants without regard to unlawful considerations of race, religion, color, national origin, sex, sexual orientation, gender identity or expression, age, sensory, physical, or mental disability, marital status, veteran or military status, genetic information, or any other classification protected by applicable local, state, or federal laws. This policy applies to all aspects of employment, including, but not limited to, hiring, job assignment, compensation, promotion, benefits, training, discipline, and termination. Reasonable accommodation is available for qualified individuals with disabilities, upon request.

rZHXqbo3MA",2008,Investment & Asset Management,$5 to $25 million (USD),Financial Services,201 to 500 Employees,Company - Private,True
Data Analyst III,"First Bank and Trust
","Sioux Falls, SD",$58K - $81K (Glassdoor est.),4.3,"Overall Functions
This person will design and develop advanced enterprise-scale data analytics solutions to identify patterns and trends, analyze root cause, and improve overall data quality, consistency, and accessibility. They will build solutions using current and emerging techniques to deliver client insights and perspectives to business lines enabling data-informed decisions as well as increase efficiencies and innovation. This individual will consult directly with business lines to learn business objectives, understand key results, and derive requirements needed to develop solutions that will deliver positive business outcomes.


Qualifications
This person should have a bachelor’s, plus six years of previous related work experience or the equivalent. Experience building solutions using advanced analytics and working with financial data is required. This candidate must be research oriented, possess strong analytical and problem-solving skills, be able to effectively communicate the value of company data to leaders at all levels, and have experience leading the development of solutions while working with multiple contributors. This person must have extensive experience working with tabular data models, using Microsoft SQL Server, writing T-SQL queries and DAX, performing data visualizations with Microsoft’s BI stack, and understanding relational and non-relational databases. Microsoft Power BI Data Analyst Associate (PL-300) certification is required and must be obtained within six months of hiring. Knowledge of R or Python is preferred.


Responsibilities
Design and develop optimized enterprise data analytics solutions for client, market, product, and operational functions that deliver insights to generate data-informed decisions and actions. Develop and use tabular models and continually improve analytics solutions, models, and strategies to provide outcome-based solutions, root cause analysis, and data analytics reporting and visualizations.



Lead Data Engagement initiatives to make information accessible through dynamic reports and dashboards driven by universal tabular models. Design and develop tabular models through collaboration with technology team members. Ensure relevant data and analytics are available to meet initiatives by helping design and implement the storage and access of data.



Build and manage relationships with business line managers to understand business objectives. Partner with stakeholders to derive requirements, scope data engagement solutions, and help drive data-informed decisions and results. Advise on data best practices, improve automation of insights, actions, decisions, and increase efficiencies and competencies with FBT technical capabilities.



Provide technical leadership to technology team members working on data analytics projects and deliverables. Be knowledgeable of Database, Data Engineering, DevOps, and API concepts. Work closely with Technology teams to align projects and support the strategic direction of the organization.



Support data governance, data literacy, and data stewardship initiatives established by the Data Governance Committee to improve data integrity, usability, and access across the organization. Lead data governance initiatives and key results on behalf of Data Engagement Team as assigned.



Build statistical and quantitative analysis to identify trends, patterns, and correlations that can be used to promote better business decisions.



Maintain knowledge of innovative tools and resources to improve data strategy and governance. Remain on top of industry best practice and know what system and business process data comes from and remain current on changes within the data platform, data models, and systems used across the bank.



Act in accordance with FBT policies and procedures as set forth in the employee handbook.



Adhere to compliance procedures and attend required compliance training.",1968,Banking & Lending,$25 to $100 million (USD),Financial Services,201 to 500 Employees,Company - Private,False
Data Specialist,"Contact Government Services, LLC
","Pierre, SD",$43K - $67K (Glassdoor est.),4.7,"Data Specialist
Employment Type: Full-Time, Mid-Level
Department: Data Science

As a Data Specialist for CGS you will help our government client in processing data using LAW. The ideal candidate will regularly load large volumes of production data; running exports from the database for creating discovery party productions. Downloading files from our file sharing tool, JEFS, and performing quality control on load and export files to ensure accuracy is vital to this job position.

CGS brings motivated, highly skilled, and creative people together to solve the government’s most dynamic problems with cutting-edge technology. To carry out our mission, we are seeking candidates who are excited to contribute to government innovation, appreciate collaboration, and can anticipate the needs of others. Here at CGS, we offer an environment in which our employees feel supported, and we encourage professional growth through various learning opportunities.
Skills and attributes for success:
Modify load files and perform quality control on loaded data quickly and accurately
Assist with creating and updating document processing procedures as needed
Run multiple load streams simultaneously
Perform native file processing in LAW
Export data from Relativity to create load files for other various platforms as requested by Case Manager
Performs data conversion processing, including conversions of various document types
Perform special format data conversions and file manipulation requests
Handle quality control on load files and Relativity data loads and exports
Perform advanced requests, such as creating data exports for productions and performing quality control on files, and complicated overlays or appends, privilege clawbacks, and sequestration of documents
Perform quality control to confirm accuracy on loads completed by new Data Specialists
Provide hands-on training to other Data Specialist as needed
Perform basic Relativity searching and global updates to mark and/or tag records as requested; to include confirming record counts in Save Searches and Image redactions prior to creating exports for production
Clearly and accurately discusses data inconsistencies found with Project Manager
- Assists on calls relating to data load file formats or media encryption software with Case - Manager and other IT individuals as requested

Qualifications:
Modify load files and perform quality control on loaded data quickly and accurately
Assist with creating and updating document processing procedures as needed
Run multiple load streams simultaneously
Perform native file processing in LAW
Export data from Relativity to create load files for other various platforms as requested by Case Manager
Performs data conversion processing, including conversions of various document types
Perform special format data conversions and file manipulation requests
Handle quality control on load files and Relativity data loads and exports
Perform advanced requests, such as creating data exports for productions and performing quality control on files, and complicated overlays or appends, privilege clawbacks, and sequestration of documents
Perform quality control to confirm accuracy on loads completed by new Data Specialists
Provide hands-on training to other Data Specialist as needed
Perform basic Relativity searching and global updates to mark and/or tag records as requested; to include confirming record counts in Save Searches and Image redactions prior to creating exports for production
Clearly and accurately discusses data inconsistencies found with Project Manager
Assists on calls relating to data load file formats or media encryption software with Case Manager and other IT individuals as requested

Our Commitment:
Contact Government Services (CGS) strives to simplify and enhance government bureaucracy through the optimization of human, technical, and financial resources. We combine cutting-edge technology with world-class personnel to deliver customized solutions that fit our client’s specific needs. We are committed to solving the most challenging and dynamic problems.

For the past seven years, we’ve been growing our government-contracting portfolio, and along the way, we’ve created valuable partnerships by demonstrating a commitment to honesty, professionalism, and quality work.

Here at CGS we value honesty through hard work and self-awareness, professionalism in all we do, and to deliver the best quality to our consumers mending those relations for years to come.

We care about our employees. Therefore, we offer a comprehensive benefits package.
Health, Dental, and Vision
Life Insurance
401k
Flexible Spending Account (Health, Dependent Care, and Commuter)
Paid Time Off and Observance of State/Federal Holidays

Contact Government Services, LLC is an Equal Opportunity Employer. Applicants will be considered without regard to their race, color, religion, sex, sexual orientation, gender identity, national origin, disability, or status as a protected veteran.

Join our team and become part of government innovation!

Explore additional job opportunities with CGS on our Job Board:
https://cgsfederal.com/join-our-team/

For more information about CGS please visit: https://www.cgsfederal.com or contact:
Email: info@cgsfederal.com",-1,-1,Unknown / Non-Applicable,-1,1 to 50 Employees,Company - Public,True
Senior Business Intelligence Analyst,"Pearson
","Pierre, SD",$76K - $104K (Glassdoor est.),3.7,"Senior Business Intelligence Analyst

Context

The shift within Higher Education more from one-time purchases of print textbooks to recurring subscriptions of digital products has generated a wealth of data about our products, customers, opportunities, and sales.

We’re looking for a leader who can take this information and leverage the latest data analytics tools, especially Tableau, to provide insight into the performance of business.

Reporting to the Director of Business Intelligence and sitting within the Strategic Sales Operations wing of US Higher Ed Sales Operations, the Sr Business Intelligence Analyst leads the analyses of the sales pipeline, net sales, subscriptions, and market data across multiple formats, models, and channels.

Responsibilities

Forecasting Mastery: Take the helm in owning all aspects of forecasting seasonal revenue, turning data into a strategic asset for our team.
Collaborative Insight: Work closely with cross-functional teams, including sales, marketing, finance, and product, to deliver accessible and consumable insights into the success of our higher education products.
Dashboard Stewardship: Support the lifecycle of our Tableau dashboards, ensuring they remain up to date with the latest features and capabilities while streamlining and retiring those that are no longer necessary.
Analytical Evolution : Drive the evolution of our analytics capabilities from self-service to predictive and early alert insights into product, sales, and market trends.
Data Integrity Guardian : Manage functional areas of data management, forecasting, contacts, leads, opportunities, dashboards, and reports, ensuring data integrity across our systems.
Strategic Partner: Assist in turning sales data into actionable insights that inform our go=to-market strategy, emphasizing focus areas, maximizing revenue, and preventing revenue leakage.

Essential Skills:

Holistic Business Understanding: Detailed comprehension of the sales business process and the ability to translate business needs into technical specifications.
Communication Prowess: Excellent interpersonal and communication skills, with the ability to articulate complex topics and present them thoughtfully to senior leaders.
Tech Savvy: Comfort with navigating the complexity of data across legacy and third-party platforms, ensuring forward momentum while simplifying and standardizing.
Organizational Agility : Strong time-management and organizational skills to balance multiple competing priorities.
Data Expertise: Background with ETL logic, data modeling concepts, and 5+ years of experience in a technical data role.

Requirements

Bachelor’s degree in business, finance, or computer-related program
5+ years of experience in a technical data role, such as analyst, engineer, architect, or scientist 5
5+ years of experience with multiple versions of SQL
5+ years of experience building and maintaining Tableau dashboards

Preferred Skills

Proficiency with Salesforce Sales Cloud (Marketing & Services Clouds a plus)
Proficiency with cloud databases such as Google BigQuery or Snowflake
Experience with machine learning concepts such as predictive modeling, categorization, and clustering
Background with programming in a language such as R or Python
Experience working in or supporting Sales or Revenue Operations a plus

\#LI-RS1

What to expect from Pearson

Did you know Pearson is one of the 10 most innovative education companies of 2022?

At Pearson, we add life to a lifetime of learning so everyone can realize the life they imagine. We do this by creating vibrant and enriching learning experiences designed for real-life impact. We are on a journey to be 100 percent digital to meet the changing needs of the global population by developing a new strategy with ambitious targets. To deliver on our strategic vision, we have five business divisions that are the foundation for the long-term growth of the company: Assessment & Qualifications, Virtual Learning, English Language Learning, Workforce Skills and Higher Education. Alongside these, we have our corporate divisions: Digital & Technology, Finance, Global Corporate Marketing & Communications, Human Resources, Legal, Strategy and Direct to Consumer. Learn more at We are Pearson.

We value the power of an inclusive culture and also a strong sense of belonging. We promote a culture where differences are embraced, opportunities are accessible, consideration and respect are the norm and all individuals are supported in reaching their full potential. Through our talent, we believe that diversity, equity and inclusion make us a more innovative and vibrant place to work. People are at the center, and we are committed to building a workplace where talent can learn, grow and thrive.

Pearson is an Affirmative Action and Equal Opportunity Employer and a member of E-Verify. We want a team that represents a variety of backgrounds, perspectives and skills. The more inclusive we are, the better our work will be. All employment decisions are based on qualifications, merit and business need. All qualified applicants will receive consideration for employment without regard to race, ethnicity, color, religion, sex, sexual orientation, gender identity, gender expression, age, national origin, protected veteran status, disability status or any other group protected by law. We strive for a workforce that reflects the diversity of our communities.

To learn more about Pearson’s commitment to a diverse and inclusive workforce, navigate to: Diversity, Equity & Inclusion at Pearson.

If you are an individual with a disability and are unable or limited in your ability to use or access our career site as a result of your disability, you may request reasonable accommodations by emailing ppsmhr@pearson.com.

Note that the information you provide will stay confidential and will be stored securely. It will not be seen by those involved in making decisions as part of the recruitment process.

Job: GENERAL BUSINESS OPERATIONS

Organization: Higher Education

Schedule: FULL\_TIME

Req ID: 13765

\#location",1844,Publishing,$5 to $10 billion (USD),Media & Communication,10000+ Employees,Company - Public,False
