Job Title,Company Name,Location,Salary Estimate,Rating,Job Description,Founded,Industry,Revenue,Sector,Size,Type,Easy Apply
"Lead Specialist, Business Analysis","Transamerica
","Cedar Rapids, IA",$112K - $148K (Employer est.),3.2,"Job Family
Financial Accounting & Reporting
About Us

At Transamerica, hard work, innovative thinking, and personal accountability are qualities we honor and reward. We understand the potential unleashed by leveraging the talents of a diverse workforce. We embrace an environment where employees enjoy a balance between their careers, families, communities, and personal interests.

Ultimately, we appreciate the uniqueness of a company where talented professionals work collaboratively in a positive environment — one focused on helping people look forward and plan for the best life possible while providing tools and solutions that make it easier to get there.

Transamerica is a part of Aegon, an integrated, diversified, international financial services group. The Aegon companies employ over 21,500 people and have approximately 31.7 million customers.* For more information, visit
www.transamerica.com
.

Who We Are

Transamerica has been making financial services available to the many, not just the few, for more than 100 years. We’re a leading provider of life insurance, retirement, and investment solutions, serving millions of customers throughout the United States. Transamerica’s dedicated professionals focus on helping people live their best lives through saving, investing, and protecting their loved ones. Transamerica is dedicated to building America’s leading middle market life insurance and retirement company, providing a broad range of quality individual life insurance policies, workplace supplemental insurance benefits, workplace retirement plans, individual retirement accounts, and investment products, including mutual funds, annuities, stable value solutions, as well as investment management services.

What We Do

Transamerica is organized by lines of business (Life Insurance, Annuities, Mutual Funds, Retirement Plans, and Employee Benefits), which are supported by Transamerica Corporate (Corporate Development; Finance; Internal Audit; Legislative, Regulatory & Policy; Office of the CEO; People and Places; Brand; Corporate Affairs; Risk; and Technology).
Job Description Summary
Responsible for partnering with leaders in bringing clarity through reporting progress in achievement of strategic objectives primarily through the development and routine monitoring of key performance indicators. This role will be part of the Finance Transformation organization and involves enabling Oracle Cloud Financials solutions to support business objectives. This role requires both financial process expertise as well as Oracle ERP technology experience.
Job Description
Responsibilities:
Enabling finance solutions within Oracle Cloud Financials ERP platform (ERP, EPM and FAH)
Lead process redesign efforts and demonstrate how Oracle ERP can help the business solve problems and meet their key business objectives.
Mentor and guide other junior team members in use of Oracle Financials ERP, best practices, configuration, etc.
Partnering with leaders on the design and implementation of key performance indicators to appropriately measure progress of execution of strategic objectives and to support management decision making
Collaborating with leaders and management reporting team to develop effective and accurate routine reporting of key performance indicators, including setting clear definitions to ensure clarity of results
Drive and deliver upon continuous improvement of quarterly and annual reporting
Analyze actual results of key performance indicators relative to expected trends and gain understanding of drivers of change; influencing management actions based on completed analysis
Develop effective communication of progress of key performance indicators for Americas Executive Committee, including overview of macro environment, regulatory and competitive updates, and business developments
Provide insight and effective communication of Americas progress on key performance indicators for use with the Management Board and Supervisory Board
Partners with management on development of external communication and presentation of Americas’ execution of strategy and financial results
Acts as the key business control point of contact with Group Business Control team members
Partners with senior management to meet business goals.
Develops strong business relationships with all levels of management
Creates effective communication of complex messages to a variety of audiences - ability to operate at strategic and operational levels
Qualifications:
Bachelor’s degree in Accounting or other Finance field.
Generally at least 12 years previous experience, with degree, primarily in the insurance, financial services or investment management industry.
Demonstrated management/leadership experience.
Experienced strategic thinker able to communicate on business/market and legislative issues at a macro level
Preferred Qualifications:
It is highly desirable to have experience deploying finance solutions within Oracle Cloud Financials.
CPA/advanced degree preferred.
Finance technology experience or training.
Effectively communicate orally and in writing to all audiences; ability to effectively partner with numerous employees a varying levels within the organization to ensure business goals are met.
Anticipates future needs/challenges (visionary).
Organizational and prioritization skills, effective judgment; makes timely decisions with appropriate information.
Working Conditions:
Commuting Remote employees will need to report to a Company office location at times, but will perform their work primarily remotely.
**Please note that the compensation information that follows is a good faith estimate for this position only and is provided pursuant to applicable pay transparency and compensation posting laws. It is estimated based on what a successful candidate might be paid in certain Company locations.**
The Salary for this position generally ranges between $112,000 - $148,000 annually. This range is an estimate, based on potential qualifications and operational needs. Salary may vary above and below the stated amounts, as permitted by applicable law.

Additionally, this position is typically eligible for an Annual Bonus based on the Company Bonus Plan/Individual Performance and is at Company discretion.
What We Offer

For eligible employees, we offer a comprehensive benefits package designed to support both the personal and financial well-being of our employees.

Compensation Benefits
Competitive Pay
Bonus for Eligible Employees

Benefits Package
Pension Plan
401k Match
Employee Stock Purchase Plan
Tuition Reimbursement
Disability Insurance
Medical Insurance
Dental Insurance
Vision Insurance
Employee Discounts
Career Training & Development Opportunities

Health and Work/Life Balance Benefits
Paid Time Off starting at 160 hours annually for employees in their first year of service.
Ten (10) paid holidays per year (typically mirroring the New York Stock Exchange (NYSE) holidays).
Be Well Company holistic wellness program, which includes Wellness Coaching and Reward Dollars
Parental Leave – fifteen (15) days of paid parental leave per calendar year to eligible employees with at least one year of service at the time of birth, placement of an adopted child, or placement of a foster care child.
Adoption Assistance
Employee Assistance Program
College Coach Program
Back-Up Care Program
PTO for Volunteer Hours
Employee Matching Gifts Program
Employee Resource Groups
Inclusion and Diversity Programs
Employee Recognition Program
Referral Bonus Programs
Peer Recognition Program (BRAVO)

As of December 31, 2022

Inclusion & Diversity

We believe our commitment to diversity and inclusion creates a work environment filled with exceptional individuals. We’re thrilled to have been recognized for our efforts through the Human Rights Campaign Corporate Equality Index, Dave Thomas Adoption Friendly Advocate, and several Seramount lists, including the Inclusion Index, 100 Best Companies for Working Parents, Best Companies for Dads, and Top 75 Companies for Executive Women.

To foster a culture of inclusivity throughout our workforce, workplace, and marketplace, Transamerica offers a wide range of diversity and inclusion programs. This includes our company-sponsored, employee-driven Employee Resource Groups (ERGs), which are formed around a shared interest or a common characteristic of diversity. ERGs are open to all employees. They provide a supportive environment to help us better appreciate our similarities and differences and understand how they benefit us all.

Giving Back

We believe our responsibilities extend beyond our corporate walls. That's why we created the Aegon Transamerica Foundation in 1994. Through a mix of financial grants and the volunteer efforts of our employees, the foundation supports nonprofit organizations focused on the things that matter most to our people in the communities where we live and work.

https://www.transamerica.com/why-transamerica/aegon-transamerica-foundation

Transamerica’s Parent Company

Aegon
acquired the Transamerica business in 1999. Since its start in 1844, Aegon has grown into an international company serving more than 29.5 million people across the globe. It offers investment, protection, and retirement solutions, always with a clear purpose: Helping people live their best lives. As a leading global investor and employer, the company seeks to have a positive impact by addressing critical environmental and societal issues, with a focus on climate change and inclusion and diversity.",1904,Insurance Carriers,$10+ billion (USD),Insurance,5001 to 10000 Employees,Subsidiary or Business Segment,False
Sales Business Analyst,"VT Industries
","Holstein, IA",$56K - $82K (Glassdoor est.),3.6,"Company Overview

VT Industries, Inc., is North America’s leading manufacturer of architectural wood doors for commercial and residential applications, the largest post-form laminate countertop manufacturer in the United States, as well as a leading source for butcher block countertops and other architectural wood products. VT is a family-owned company that offers a dynamic work environment and continues to invest in state-of-the-art manufacturing equipment and processes, as well as growth and development opportunities for its team members. The company’s three divisions serve customers from fifteen manufacturing facilities strategically located throughout the U.S. and Canada.

Position Description

Overall Responsibilities:

This position will interpret sales, cost, and other data with analytical takeaways and recommendations in an integral role within our Countertop Division teams. The Sales Business Analyst is a highly visible position, working closely with top leaders of the organization and various cross-functional work groups. This is a highly specialized role with a plethora of challenges and opportunities to improve data visibility and decision making with the Countertop Division. This person will monitor projects from initiation through delivery to key internal and external sales customers.

Essential Job Functions:

Perform advanced and complex analytics based upon business needs by extracting relevant data from both internal and external sources
Drive clear communication with sales leadership and stakeholders on projects and portfolio
Provide input to systems that track cost and progress
Develop business recommendations to sales leadership based on data that will provide insight to strategies to maximize revenue and profit at specific customers
Support sales presentations development to national home centers, fabricators, commercial, and national accounts, including trade show coordination. Send leads from trade show to sales team.
Assist with SKU and UPC creation for home centers, price lists, quarterly budget reports, weekly and monthly sales reports, and other miscellaneous reports
Work cross functionally with internal partners such as customer service, purchasing, and field sales
Work with operations leadership to identify proper timelines/deadlines for production requirements of key components for project completion
Provide sales forecast to the purchasing department in collaboration with sales and according to ongoing projects
Follow up on vendor quotes, support sales projects, manage supplier compliance, and deliver customer communication as needed; assist with customer site visits including plant tour coordination
Support internal CRM system users and internal dashboards
Previous PowerBI and IFS CRM system experience is highly desirable
Update and maintain various databases and documentation
Serve as primary contact for customers’ systems to develop customer projects
Previous B2B sales experience is preferred
Other duties as assigned

Position Requirements

Professional Characteristics:

Accepts responsibility, holds himself/herself accountable for performance
Self-starter, who takes the initiative and possesses a strong work ethic
Creative problem solver, visionary, detail-oriented, solutions-focused
High aptitude in learning new technology, systems, processes
Strong written and oral communication skills
Team player throughout the organization
High level of integrity, sincerity, and honesty
Business-oriented, client-service mindset



Qualifications:

Bachelor’s Degree in Business, Finance, Marketing, Analytics, or equivalent experience required
3-5 years of experience working as an Analyst supporting a sales division is preferred
Industry or retail knowledge preferred
Bilingual in English and French (verbal and written) an asset
Team oriented, accountable to peer team and managed team, willingness to seek improvements with team
Excellent communication, presentation, teamwork, and analytical skills.
Experience with Drafting and MS software - Word, Advanced Excel, Power Point and Access
Excellent business writing skills and comfortable in front of groups for presentations
Problem solving know how and willingness to mentor others in solving problems
Willing to travel approximately 25% of the time; international travel required, primarily between United States and Canada
All team members are expected to follow the Code of Conduct to the highest standards as well as to adhere to the Attendance Policy of VT Industries

Physical Requirements

Tolerance for sitting long periods of time. Possess finger dexterity to write, type, and use a calculator. Maintain adequate vision to view small print and computer terminal. Ability to speak and hear, walk throughout facilities with occasional light lifting (25 pounds), stooping, kneeling, crouching, and reaching with hands and arms required. Ability to travel between multiple facilities as required to perform core job duties.

The physical demands described here are representative of those an employee encounters while performing the essential functions of this job. Reasonable accommodations may be made to enable individuals with disabilities to perform the essential functions.",1956,Machinery Manufacturing,$100 to $500 million (USD),Manufacturing,501 to 1000 Employees,Company - Private,False
HIPAA Privacy and Compliance Analyst,"Telligen
","West Des Moines, IA",$47K - $68K (Glassdoor est.),4.3,"Privacy and Compliance Analyst
As a Privacy and Compliance Analyst, you will support Telligen's commitment to compliance, privacy and security, through the monitoring and implementation of the programs and policies supporting these critical elements of our business.
This role will work in the West Des Moines office 3 or more days a week.
In this role, you will:
Serve as a subject matter expert on HIPAA. Maintain current knowledge of HIPAA laws and regulations, as well as other applicable federal and state privacy regulations, industry compliance and privacy policies.
Develop a cross-departmental privacy program. Implement privacy-related procedures and training as required.
Conduct risk assessments, internal audits and recommend risk reduction strategies.
Support Telligen's response to all privacy incidents and breaches.
Monitor existing processes for privacy controls, including record retention.
Incorporate privacy design into business practices and recommend enhancements to IT systems as needed.
Review and evaluate the life cycle of confidential and sensitive data, including the collection, storage, use, transfer, retention and destruction.
Oversee all data use agreements.
Research and respond to privacy and compliance related inquiries from internal and external stakeholders.
Train and educate staff and vendors on privacy and compliance policies and procedures.
Compile and analyze data to create and deliver reports for internal stakeholders.
Monitor and analyze privacy and compliance related legislation and amendments to regulations.

What You'll Need:
Bachelor's degree in business, finance, IT or related field
Minimum 3-5 years' experience in industry.
Must have HIPAA compliance experience.
Understanding of privacy practices, regulations, and laws and how they relate to healthcare data practices.
COMMITMENT TO SAFETY
As part of our commitment to health and safety, some roles may require additional health protocols (i.e. personal protective equipment or vaccination)
Who We Are:
Telligen is one of the most respected population health management organizations in the country. We work with state and federal government programs, as well as employers and health plans offering clinical, analytical, and technical expertise.
Health has changed a lot through our 50-year history, but what has remained constant is that we care deeply about who we serve and what we do. Our success is built on our ability to adapt, respond to client needs, and offer innovative solutions at every turn.
Our business is our people and we’re looking for talented individuals who not only believe in our mission but who are ready to take ownership and make a difference in the lives of people, in the world of health. Learn more about who we are and what we do at www.telligen.com/about-us


Are you Ready?
We’re on a mission to transform lives and economies by improving health and getting there means following through on our values of Ownership, Community, Ingenuity & Integrity.
Ownership: As a 100% employee-owned company, our employee-owners drive our business, our solutions, and share in our success. When employee-owners grow and thrive, we all win.
Community: Putting others first and being a good corporate partner wherever we work, and play makes us who we are. We Show Up. For our clients, for our communities, and for each other.
Ingenuity: We’re a team of passionate professionals driven by hard work and big ideas. We understand that high-value breakthroughs come from taking calculated risks. If it will benefit our clients and advance our mission, we’re all ears. We celebrate free-thinking and challenge the status quo, so brainstorm away!
Integrity: Smiling faces (virtual or in-person) are the norm around here. We enjoy a friendly work environment where everyone is dedicated to mutual trust, respect, and excellence.
Thank you for your interest in Telligen!
Follow us on Twitter, Facebook, and LinkedIn to learn more about our mission-driven culture and stay up to speed.
Telligen and our affiliates are Affirmative Action, Equal Opportunity Employers (EOE/M/F/Vet/Disability), and E-Verify Participants.
Telligen will not provide sponsorship for this position. If you will require sponsorship for work authorization now or in the future, we cannot consider your application at this time.
Telligen does not accept 3rd party solicitations from outside staffing firms.",1972,Health Care Services & Hospitals,$25 to $100 million (USD),Healthcare,501 to 1000 Employees,Company - Private,True
"Program Analyst - Des Moines, IA","Jamison Professional Services Inc
","Des Moines, IA",$66K - $98K (Glassdoor est.),3.1,"Jamison Professional Services, Inc. (“JPS”) is currently seeking a qualified and motivated candidate for the position of Program Analyst.

Labor Category: Program Analyst - Des Moines, IA

Successful performance of a Program Analyst under this requirement requires a wide variety of associated duties including research, analysis, systems thinking, data entry, writing, document preparation, editing, scanning, document management, copying, phone calls, faxing, filing, and other activities as necessary to complete the tasks assigned. Contractor Personnel are required to provide data input/extraction and ongoing support of the data systems for VHA Procurement Regional Procurement Offices (RPOs) and Network/Program Contracting Activity. Program Analysts may also be expected to analyze a wide variety of data from conceptualization through presentation of the data to the RPO Program Analyst team.

Responsibilities:

Assists in designing, coordinating, developing, and documenting proposed organization designs, and/or changes in business/programmatic processes, procedures, and/or products.
Performs initial reviews of existing processes, procedures, and/or products.
Gathers and compiles data for reports to develop comprehensive studies for decision-making purposes and ensures information is provided within necessary time frames.
Organizes and analyzes data from all applicable sources, using statistical methods to ensure the validity of results.
Assists in the development of recommendations for changes to improve systems, applications, processes, or products.
Provides data and trend analysis during exploratory and informative stages.
Briefs RPO Program Analysts on problem areas, corrective action to be taken, and the monitoring of those actions once implemented.
Responds to all customer inquiries and concerns and recommends alternate approaches when customers' request cannot be met.
Qualifications:
Work Experience: A minimum of four (4) recent years of relevant experience in conducting comprehensive program analyst services.

Education: Program Analysts shall have, at a minimum, a relevant bachelor's degree from an accredited college or university.

Additional Knowledge and Skills: In addition to the experience and educational requirements described above, Program Analysts shall clearly possess the following knowledge and skills:


Working knowledge of PC software packages, such as Microsoft Power BI, Power Automate, Excel, Access, SharePoint, various Microsoft programs, and other Business Intelligence software.
Experience with established program analysis principles, theories, and practices, including knowledge of various analytical techniques (audits, databases, spreadsheet/graphics analysis)
Working knowledge of qualitative and/or quantitative data analytic methods for the assessment and suggested improvements of program effectiveness.
Place of Performance:
This requirement requires contractor personnel to work off-site (remote). Travel to the nearest VA Medical Center is required for on-boarding (fingerprinting, PIV picture, PIV card and GFE). Contractor personnel are usually required to physically access the nearest VA facility when receiving GFE.

Electronic Media:
All contractor employees shall be knowledgeable and proficient in the use of Microsoft Office basic tools and software: Word, Excel, Outlook, Share Points. It is mandatory that all contract employees be proficient with modern computing equipment.

English Language Requirement:
The Contractor shall ensure all personnel are able to read, write, and speak English well enough to effectively communicate.

U.S. Citizenship:
All contractor personnel performing under this contract shall be U.S. citizens.

Jamison Corporate Overview:
Jamison Professional Services, Inc. (Jamison) is a Service-Disabled, Veteran-Owned Small Business (SDVOSB), certified Minority Business Enterprise (MBE) headquartered in metropolitan Atlanta, Georgia. We specialize in providing professional management, administrative, healthcare, court reporters and transcriptionist experts, and document/ record and telehealth operational support solutions to U.S. Government, State and commercial clients. Jamison is a nationwide professional staff augmentation company, that helps commercial clients and government agencies expand their talent acquisition reach by sourcing, assessing, developing, and managing the talent that enables them to be successful.

Jamison offers a wide range of employment opportunities in the commercial and government sectors. We seek employees who share our values of service excellence, integrity, and professionalism.

Jamison affords equal employment opportunity to all individuals, regardless of race, creed, color, religion, gender, national origin, ancestry, age, marital status, veteran status, disability, medical condition, gender identity, or sexual orientation. Our employees, as well as applicants and others with whom we do business, will not be subjected to sexual, racial, religious, ethnic, or any other form of unlawful harassment and/or discrimination. In addition, JPS adheres to the equal employment opportunity requirements of all states and localities in which it does business.

Jamison's commitment to equal opportunity is applied through every aspect of the employment relationship, including, but not limited to, recruitment, selection, placement, training, compensation, promotion, transfer, termination, and all other matters of employment.

Applicants may be required to successfully complete an online assessment to determine qualifications for positions requiring specific skills.

All applications must be submitted through our application system at: https://www.jps-online.com/apply-now/",-1,Business Consulting,$1 to $5 million (USD),Management & Consulting,1 to 50 Employees,Contract,True
