Job Title,Company Name,Location,Salary Estimate,Rating,Job Description,Founded,Industry,Revenue,Sector,Size,Type,Easy Apply
Data Senior Analyst,"Cox Communications
","Tulsa, OK",$77K - $116K (Employer est.),4.0,"A data senior analyst is responsible for providing data driven insights and analytical support for key projects, programs and initiatives within Customer Experience Operations. Applies critical thinking, problem solving, data visualization techniques, and analytical acumen to develop and deliver reporting, analysis and recommendations that support decision making and deliver business insights.

PRIMARY RESPONSIBILITIES AND ESSENTIAL FUNCTIONS :

Works with business partners and stakeholders across multiple products, business or organizational areas to understand primary strategy, objectives and priorities; helps connect these goals with underlying data and delivers insight driven analysis.
Effectively translates complex data driven analysis into clear, meaningful and actionable findings; provides relevant solutions and recommendations.
Participates in collaborative, cross functional initiatives and projects; provides thought leadership on data requirements and scope of analysis necessary to support decision-making and deliver business insights.
Effectively utilizes tools, techniques and processes to gather, report and analyze data, including SQL, Python, Power BI, Tableau and other data mining, preparation and visualization tools.
Designs, develops implements and maintains various dashboards and reports, supporting multiple client groups.
Identifies, researches, and resolves discrepancies in analytical processes or cross-functional methods.
Analyzes current and historical performance, performs variance analyses of key metrics and identifies trends.
Creates scenario models to assist the business in complex decision making and forecasting outcomes.
Solicits feedback and continuous learning opportunities to expand knowledge and capabilities related tools, techniques, relevant data analytics principles and methods required to perform operational analysis.
Meet established timelines and committed tasks during each sprint cycle and proactively communicates any risks, issues or challenges in meeting deliverables.



QUALIFICATIONS AND EXPERIENCE:

Minimum



BA/BS degree in a related discipline (i.e. Business Intelligence & Analytics, Information Science, Data Science, Statistics, Mathematics, etc.) with 4 years of experience required in related field (e.g. reporting, statistics, data modeling, data analytics, data visualization, data interpretation); or 8 years of equivalent experience in lieu of a degree.
Skilled to advanced knowledge building highly visual interactive dashboards. (Tableau or Power BI preferred)
Successful candidates must know how to intuitively assimilate, manipulate, and visualize large quantities of data in a visually appealing and easily consumable manner.
Demonstrated experience working directly with leadership and supporting multiple stakeholders.
Skilled analytic and diagnostic skills utilizing a data-driven and metrics-driven approach.
Excellent communication (written and verbal) and presentation skills with a proven history of influencing outcomes and gaining alignment.
Proven ability to work efficiently, effectively, and proactively in a fast-paced, deadline-oriented, dynamic and virtual environment.
Proven ability to work in a cross-organizational team environment collaborating with the business leads on key analytical deliverables.



Preferred



Master's degree with 2 years of experience in a related discipline.
8 years successful experience developing advanced analytics solutions (e.g. predictive models, anomaly detection models, correlation models, etc.
Prior experience with data analytics in a contact center environment, specifically working with voice, chat, & digital data.
Prior operations and analytics experience with Cox Communications



USD 77,000.00 - 115,600.00 per year

About Cox Communications

Cox Communications is the largest private telecom company in America, serving six million homes and businesses. That's a lot, but we also proudly serve our employees. Our benefits and our award-winning culture are just two of the things that make Cox a coveted place to work. If you're interested in bringing people closer through broadband, smart home tech and more, join Cox Communications today!

About Cox

Cox empowers employees to build a better future and has been doing so for over 120 years. With exciting investments and innovations across transportation, communications, cleantech and healthcare, our family of businesses - which includes Cox Automotive and Cox Communications - is forging a better future for us all. Ready to make your mark? Join us today!

Benefits of working at Cox may include health care insurance (medical, dental, vision), retirement planning (401(k)), and paid days off (sick leave, parental leave, flexible vacation/wellness days, and/or PTO). For more details on what benefits you may be offered, visit our benefits page .

Cox is an Equal Employment Opportunity employer - All qualified applicants/employees will receive consideration for employment without regard to that individual's age, race, color, religion or creed, national origin or ancestry, sex (including pregnancy), sexual orientation, gender, gender identity, physical or mental disability, veteran status, genetic information, ethnicity, citizenship, or any other characteristic protected by law.

Statement to ALL Third-Party Agencies and Similar Organizations: Cox accepts resumes only from agencies with which we formally engage their services. Please do not forward resumes to our applicant tracking system, Cox employees, Cox hiring manager, or send to any Cox facility. Cox is not responsible for any fees or charges associated with unsolicited resumes.",1962,"Cable, Internet & Telephone Providers",$10+ billion (USD),Telecommunications,10000+ Employees,Company - Private,False
IT Business Analyst - Billing & Taxation,"HILTI
","Tulsa, OK",$65K - $88K (Glassdoor est.),4.1,"What's the role?

In Hilti the billing related topics are under the responsibility of Finance & Controlling due to which we are looking for an experienced IT Business Analyst having SAP SD or SAP FICO consultant background who will be working in the topics related to Billing & Taxation in the Finance area. In your role as IT Business Analyst, you will provide professional advice, do hands-on customizations and responsible for transferring business requirements into implementations. You will contribute to build end to end digital solutions in our application landscape with a backend based on SAP S/4HANA. You will be working on global projects, daily support (requests / incident), initiatives with focus on compliance and regulatory requirements for the Hilti subsidiaries worldwide. Your innovative mindset will help to enable business excellence and customer satisfaction through value-adding global IT solutions.

Who is Hilti?

We provide leading-edge tools, technologies, software and services for the global construction sector. Hilti is a multicultural workplace with 127 different nationalities in 60 countries committed to global teamwork.



Global IT within Hilti is a truly global team with main hubs in Buchs (Switzerland), Kuala Lumpur (Malaysia) and Plano/Tulsa (USA). All locations have highly competent teams who work very closely together. Hilti`s Global IT team is known for their focus on sustainable value creation by translating latest IT innovations into value creating solutions & services.

What does the role involve?

As an IT Business Analyst (Finance and Controlling IT) in Billing & Taxation, you identify and analyze business requirements for creative and innovative IT solutions based on business needs and strategic requirements. You are responsible for working on our SAP system landscape towards S/4HANA for Finance & Controlling processes. Designing global solution concepts, System/Solution architecture and validate technical and business process feasibility. Implementing and supporting Global IT solutions innovating Finance & Controlling journeys by using emerging techniques/technologies. Collaborating and cooperating with different project stakeholders including business, IT and external partners. Additionally, you will be expected to recommend business process improvements, solving business problems, creating innovative solutions, and thus enabling business excellence. Lastly you will definitely profit from your functional & technical expertise in SAP SD (e.g. billing), FICO (accounting, accounts receivables etc.), SD-FI integration, on interfaces with external systems (e.g. EDI, Business to Government (e.g. SAP eDocument Compliance / SAP Document and Reporting Compliance), tax reporting, tax calculation engine for USA/CA, Output Management System etc.), understanding of integrations with FICO modules and debagging skills in ABAP is an advantage.

Youwill be part of a global and diverse team located in Tulsa (Oklahoma), USA. Youwill be actively working with IT colleagues in other two strategic IT locations(Buchs (St. Gallen) - Switzerland and Kuala Lumpur - Malaysia) and with ourbusiness stakeholders around the world. We live diversity and inclusion. Wedevelop and manage our team members based on trust and empowerment. Our valuesare integrity, courage, teamwork and commitment

What do we offer?

Show us what you’re capable of and we’ll offer you opportunities to move around the business – to work abroad, experience different job functions and tackle different markets. It’s a great way to find the right match for your ambitions and achieve the exciting career you’re after.

We have a very thorough people review process; unlike any we know of in any other business. We can pair talent with opportunities - developing our people in their current roles or challenging them to work in new ways or in new places. It’s how we find the right fit, further our teams personally and professionally, get the best value for each employee and increase the job satisfaction. Additionally, we offer you a wide range of benefits.

What you need is:

Bachelor’s degree and/or Master’s degree and/or PhD in Information Technology, Computer Science or other relevant education
At least 2 years of experience in SAP Sales and Distribution (SD) or SAP FICO in SAP ERP 6.0 environment / S/4HANA in the following areas: billing, accounting, accounts receivables, SD-FI integration, on interfaces with external systems (e.g. EDI, Business to Government (e.g. SAP eDocument Compliance / SAP Document and Reporting Compliance), tax reporting, tax calculation engine for USA/CA, Output Management System etc.), understanding of integrations with FICO modules and debagging skills in ABAP is an advantage.
Understanding of business processes in SD / FICO, especially integration with FICO, in the context of a globally operating enterprise
Strong drive for success and high level of commitment
A team player with the willingness to learn and develop yourself and your colleagues
Excellent communication skills, high commitment, self-responsibility and customer orientation
Experience in working in an international/virtual/geographically dispersed team

Why should you apply?

We have an excellent mix of people, challenging, and developing you every single day! Success at Hilti is down to teamwork and ability, no matter what your background is.
The ideal candidate has a strong ability to acquire and apply new technical expertise quickly on assigned responsibilities. You should be using advanced tools and methods for gathering of facts including analytical methods to develop solutions scenarios. In addition, you can prepare decisions and actions based on deep understanding of our Hilti Business Model, specific product area and corresponding IT strategy & guidelines. We have a clearly defined career development track for every individual employee and an excellent team whom are duly rewarded by performance. Last not least you enjoy working side by side with partners, colleagues, and teams on tough problems.

Hilti, Inc is committed to employing a diverse workforce. Qualified applicants will receive consideration without regard to race, color, religion, sex, national origin, age, sexual orientation, gender identity, gender expression, veteran status, or disability.",1955,Construction,$1 to $5 billion (USD),"Construction, Repair & Maintenance Services",1001 to 5000 Employees,Subsidiary or Business Segment,False
Technical Analyst III - Enterprise Data Solutions,"BOK Financial
","Tulsa, OK",$88K - $130K (Glassdoor est.),3.9,"Req ID: 74361
Location: Tulsa -TUL
Areas of Interest: Information Technology
Pay Transparency Salary Range: Not Available
BOK Financial, Headquartered in Tulsa, Oklahoma, BOK Financial Corporation (NASDAQ: BOKF) is a top U.S.-based financial services holding company with operations in Oklahoma, Texas, Arizona, Arkansas, Colorado, Kansas, Missouri, Tennessee and New Mexico. The company began more than 100 years ago in Tulsa and has successfully diversified into a variety of industries, businesses and geographies. .
Bonus Type
Discretionary
Summary
Are you an experienced Technical Data Analyst who enjoys problem solving and learning? Are you passionate about data and believe it fuels an organization? We have an exciting opportunity awaiting someone like you!
Job Description
The Technical Analyst III job family is responsible for delivering superior services acting as a liaison between the line of business and IT with a focus on end user experience such as user interfacing, user flow, data flow, and/or other UI/UX strategies. Using comprehensive expertise, defining and performing analysis, design, programming, planning, implementation, and supporting of some of the most critical systems software and procedures with a focus on our long term technology road map which require technical and systems knowledge. The Technical Analyst manages plans, organizes, and controls projects which have an organizational impact as well as provides day-to-day support for complex applications systems.
Team Culture
Our team is committed to delivering the best IT solutions for our lines of business. We collaborate with other IT members, as well as our business partners. It is a fast-paced, ever-changing yet fun environment with a number of new exciting initiatives. The mission of IT is to Enable Business Success and Create Raving fans. We do this through our shared quest to continuously improve, while simultaneously looking at ways to optimize our applications and processes. We are a determined, smart, and collaborative group that is eager to welcome you to the team.
How You'll Spend Your Time
In this role, you will work closely with the business to understanding their goals.
You will collaborate with technology partners to architect, design, and build data and analytics solutions that empower business success.
Your deliverables could be data flows, architecture diagrams, data model, data integration, data controls, transformations, and more!
The Enterprise Data Solutions team is cross-functional, so building and growing expertise is a continuous ""responsibility"" for this position.
You will use your expertise in data integration techniques to fulfill integration requirements, to make solutions understandable and supportable.
You will work directly with all team members to facilitate conversations, confirm understanding, test code, and provide fast feedback.
You will be responsible for creating and maintaining detailed reports using Jira's reporting capabilities. This includes gathering requirements, designing, and developing custom reports, and analyzing data to provide valuable insights to stakeholders.
You will be responsible for overseeing and coordinating project plans within Jira. You will work closely with project managers, team leads, and stakeholders to create and maintain project timelines, track progress, and ensure that tasks are completed on time. Your role will involve setting up and managing Jira boards, assigning tasks to team members, and monitoring the overall project status.
You will manage the data security model, this includes reporting on current access, define and request new access roles.
You will work directly with all team members to ensure stories written and completed with the highest quality.
You will work with core system subject matter experts to deeply understand data models and define transformation logic.
You will use ad-hoc SQL querying and other prototyping methods to confirm data assumptions and business rules are correct.
You will use your analytical, deductive reasoning skills, and experience to determine root cause of defects in ETL code and develop solutions.
You will have advanced technical understanding of single application data flows across multiple applications, software and system integrations, RDBMS principles, and tiered environments
You will develop, design, and support processes that maintain and mitigate risk-related activity across the organization.
You will build processes that master data from many sources across the organization for risk-related platforms and reporting.
Education & Experience Requirements
Bachelor’s Degree in a data-centric field (Computer Science, Economics, Information Systems, Data Analytics, etc.) and minimum 5-7 Years’ experience with demonstrated track record of successful technical leadership in the execution of large-scale data projects

Understanding of object-oriented programming languages and frameworks e.g., Microsoft .NET, ASP .NET, C#, Java, Python, and others
TSQL programming and strong understanding of RDBMS principles
Strong understanding of ETL methodologies and data integration design patterns (API, streaming, enterprise job schedulers, batch)
Strong understanding of BOKF business information systems and strong Enterprise Data Warehouse concepts
Strong hands-on experience designing, developing and testing business intelligence & analytics solutions using proven or emerging technologies in a variety of technologies and environments
Well-developed oral and written communication skills to effectively represent self and BOKF, as well as ability to present complex information and issues in a clear and concise manner
Well-developed conceptual thinking and analytical skills with the ability to analyze complex problems that include interrelationships and dependencies in order to identify common themes and solutions
Strong sense of accountability, taking ownership over projects and responsibilities, and resolving issues proactively
Experience with projects managed in both agile and waterfall strategies
Experience working, developing, and deploying in tiered environments (e.g. development, testing, UAT, production, DR)
Experience supporting, maintaining, and developing data pipelines for risk (suspicious activity, money laundering, and BSA reporting) applications


Working Conditions & Physical Requirements
Office
BOK Financial Corporation Group is a stable and financially strong organization that provides excellent training and development to support building the long term careers of employees. With passion, skill and partnership you can make an impact on the success of the bank, customers and your own career!

Apply today and take the first step towards your next career opportunity!

The companies in BOK Financial Corporation Group are equal opportunity employers. We are committed to providing equal employment opportunities for training, compensation, transfer, promotion and other aspects of employment for all qualified applicants and employees without regard to sex, race, color, religion, national origin, age, disability, pregnancy status, sexual orientation, genetic information or veteran status.
Please contact recruiting_coordinators@bokf.com with any questions.",1910,Banking & Lending,$100 to $500 million (USD),Financial Services,1001 to 5000 Employees,Company - Public,False
"RECRUITMENT STRATEGIC ANALYST (OKLAHOMA CITY, OK)","Oklahoma Blood Institute
","Oklahoma City, OK",$62K - $104K (Glassdoor est.),3.0,"ADVANCE YOUR CAREER WHILE SAVING LIVES


Location: Oklahoma City, OK

Salary: Competitive salary based on education and/or experience and $500 bonus after 6 months and $1,000 bonus after 1 year!

Benefits: Health, dental, vision, life insurance, long term disability, 401(k), paid-time off, $5,000 annual tuition reimbursement, holiday pay, etc.


Days: Monday through Friday

Hours: 8:00 a.m. to 5:00 p.m.

Qualifications:

Associate's Degree (Bachelor's preferred) from an accredited college or university plus minimum of three years' sales administration or customer service experience.
Good knowledge of Microsoft Office products including, at a minimum, Word, Excel & Outlook
Demonstrate critical thinking skills in dealing with donors, and others who communicate with the department
Ability to pull reports, analyze data, and interpret it to make suggestions

Primary Responsibilities:

Data Management & Planning

Responsible for aggressive research and creating a tactical plan for increased collections.
Accountable for driving growth to increase collections, at or above goals and historical collections.
Review donor group history and data to work with Account Consultant on strategic growth strategy for both individual donor groups and territories.
Success Measure: Present growth strategy to Executive Director quarterly

New Donor Group Acquisition

Working with Executive Management to identify prospecting plan; Accountable for target goal to drive new account achievement within Recruitment Department with Exec Director.
Success Measure: Number of new accounts and reactivated accounts tracked, measured against goal each month.

Strategic Insight

Identifies strategic opportunities to increase blood drive sizes by implementing OBI recruitment programs (such as Donable and Hospital Recuitment)
Creates new and innovative approaches for developing successful recruitment strategies at blood drives.
Work with Account Consultant to identify eligible donor groups to map into existing drives.
Success Measure: Measure blood drive size by programs implemented; track and measure ""feeder groups"" being included in existing drives, and measuring the drive success

Identifying High-Level Opportunities

Identify opportunities an audiences, helping coordinate and prepare for high-level meetings.
Examples: HOSA, STEM Teacher Conferences to present Vein-to-Vein, YMCA with Kids Care
Success Measure: Track number of prospects and executed opportunities

Internal Communication Management for Opportunity Leverage

Create an internal administrative communication channel to support Executive Director. This would include but is not limited to Medical, Client Relations, vendors, Volunteer Services, etc.
Example: Working with Client Relations on a list of vendors, identifying if we have mobile opportunities with them; Providing a list of prospects to internal partners to identify potential relationships that can be leveraged for mobile opportunities.

Calendar management

Identify booking opportunities and maximize calendar resources in consultation with Calendar Management Department
Reviewing the mobile operation calendar to identify strategic opportunities in which we can maximize collections during high-need times.
Success Measure: Territories on the appropriate timeline; strong bookings around high-need times.


Click the link below to learn fun facts about working for Our Blood Institute!

https://play.tic-tac-trivia.com/quiz/uPSABhC7P3HTAh5J4Rk6",1976,Civic & Social Services,$25 to $100 million (USD),Nonprofit & NGO,501 to 1000 Employees,Nonprofit Organization,True
