Job Title,Company Name,Location,Salary Estimate,Rating,Job Description,Founded,Industry,Revenue,Sector,Size,Type,Easy Apply
Completions/Production Data Analyst (Anadarko Basin),"Continental Resources, Inc.
","Oklahoma City, OK",$52K - $78K (Glassdoor est.),3.7,"Job Summary
The Data Analyst is primarily responsible for working on projects to automate manual processes and produce data driven insights for the team and other stakeholders across the organization. A successful candidate will also actively seek out and generate new and innovative ways to retrieve, visualize and analyze data across a variety of operational, geological and financial data sources.
Performs a wide variety of tasks; contributes to process improvements. Leads the work of small project teams; may formally train less experienced team members. Comprehensive knowledge of fundamental theories, principles and practices in the area of specialization. Identifies possible solutions for problems/issues of diverse scope using existing solutions. Works under general supervision
Duties and Responsibilities
Discovers and troubleshoots data issues across sources and drives issues to resolution.
Create complex datasets, visualizations and tools.
Collaborate with varying levels of engineers, geologists and management to effectively gather data/reporting requirements and build analytical datasets, visualizations and tools.
Own, maintain and enhance critical Spotfire Tools
Implement automated solutions to streamline manual team processes.
Perform data capture processes as necessary to support analytics efforts.
Personal commitment to inclusion and diversity
Other duties as assigned.
Skills and Competencies
Understands E&P operations, primarily focusing on completions and production data.
Use SQL to retrieve data from systems, create integrated datasets using CTEs and/or subqueries, update data within systems and create data tables and views within CLR’s data warehouse.
Use Spotfire to enhance existing projects and create new projects from scratch using data from a variety of sources across the enterprise.
Understands or is able to learn the data models of Continental’s primary data sources including Aries, WellView, ProCount, SAP, eGIS, IHS and Enverus.
Use UiPath, FME or Alteryx to implement automated solutions for manual workflows.
Understands basic data modeling and data integration principles and techniques.
Detail oriented with ability to organize and synthesize large amounts of data to generate high-quality, executive-level quality presentations in an efficient manner.
Self-starter, with ability to work as part of a team or individually.
Advanced written and verbal communication skills
Ability to quickly adapt and exemplify flexibility around process changes and shifting priorities.
Required Qualifications
High School Diploma or general education degree (GED)
Minimum of five (5) years’ experience within the Oil and Gas industry working as a Data Analyst, Engineering Tech, Engineering Specialist, Business Analyst, Systems Analyst, IT Analyst or related role
Intermediate to advanced skills within Spotfire with the ability to use existing projects, inherit and enhance existing projects and create new projects from scratch leveraging multiple data sources.
Intermediate to advanced skills within SQL with the ability to retrieve data from systems, create integrated datasets using CTEs and/or subqueries, update data within systems and create data tables and views within CLR’s data warehouse.
Ability to pass a pre-employment background and drug test
Preferred Qualifications
Bachelor’s Degree from an accredited college or university in Management Information Systems, Data Analytics, Information Science/Management, Economics, Mathematics, Science or related degree.
Basic to intermediate skills developing automated workflows using UiPath, FME or Alteryx
Basic coding skills in R or Python
Physical Requirements and Working Conditions
Requires prolonged sitting, some bending and stooping.
Occasional lifting up to 25 pounds.
Manual dexterity sufficient to operate a computer keyboard and calculator.
Continental Resources, Inc. provides equal employment and affirmative action opportunities to applicants and employees without regard to race, color, religion, sex, age, sexual orientation, gender identity, national origin, protected veteran status, or disability.",1967,Energy & Utilities,Unknown / Non-Applicable,"Energy, Mining & Utilities",1001 to 5000 Employees,Company - Private,False
Business Analyst I - Customer Service,"One Gas
","Tulsa, OK",-1,4.2,"Position Description:

Job Posting End Date: This job posting will be removed on November 27, 2023.

As a Business Analyst I, you will perform analysis on activities related to billing and payments for Kansas, Oklahoma, and Texas. Must be able to work collaboratively with other team members and stakeholders in addition to providing vendor management support. You must have initiative and adapt to a variety of responsibilities. Collaboration and good interpersonal / communication skills are key to success in this role.

What You Will Do

Perform entry-level analysis on activities related to the contact centers or business office groups within the Customer Service Department.

Help prepare and maintain financial spreadsheets (can perform complex functions) and reports such as:

Budget planning, projections, and forecasting

Variance analysis

Third-party contractor financial reports

Operating and maintenance expenses

Attrition and headcount trending

Support business analysis to aid management in decisions and to guide improved performance using performance scorecards, agent statistics, measurements, customer accounts.

Participate in business or vendor process implementation, problem resolution, testing, and training support.

Participate in compliance monitoring by reviewing information and conducting internal compliance audits.

Compile data and assist with data mining related to performance statistics, forecasting, budget planning, or other information related to processes or projects using systems such as Banner, CRM Dynamics, Power BI, DebtNext, LexisNexis, Accurint, Community, or PACER.

Help with data reporting using BI databases.

Perform responsibilities to assist the vendor as a backup for senior business analysts.

Provide reports on the number of survey complaints contacted by Contact Center Supervisors to ensure customer complaints are addressed.

Help with customer feedback survey reviews to identify customer pain points, successes, and trends related to escalated complaints and web cases.

Regular and reliable attendance is required in the performance of the job.

Employee may perform additional responsibilities.

What You Will Need

Preferred bachelor’s degree business administration, math, statistics, related field, or an equivalent combination of formal education and the following job-related experience:

Complete projects accurately and on time.

Demonstrated ability to organize and prioritize tasks.

Working knowledge of data compilation and extraction tools.

Working knowledge of math and algebraic applications to use data for meaningful analysis.

Demonstrated ability to research and validate data to prepare reports, presentations, or other documentation.

Knowledge of customer service responsibilities and procedures.

Demonstrated ability to use Excel at an intermediate level.

Demonstrated ability to work together as a team or individually on guided projects.

Demonstrated ability to read and write fluently in English.

Diversity at ONE Gas

Inclusion & Diversity is so important to us that we made it one of our core values, values that guide and direct our actions as we go about our daily business. We know that every employee makes a difference and contributes to our success through their unique talents and abilities. We also acknowledge that we can accomplish great things by listening and learning from each other.

ONE Gas has great benefits! Here are just a few:

Medical/Dental/Vision packages that fit your family's needs.

Paid Time Off

401K that is 100% matched up to 6%.

Profit Sharing Plan

Paid Parental Leave

Basic and Optional Employee Term Life Insurance

Education Assistance and Tuition Reimbursement

Position Requirements:

#OfficeOperations

The job description is not intended to be a complete list of all responsibilities, duties, or skills required for the job and is subject to review and change at any time, with or without notice, in accordance with the needs of ONE Gas. Where positions are covered by a collective bargaining unit agreement, the terms and conditions of the agreement will apply.

ONE Gas, Inc., and its divisions will provide equal employment opportunity for qualified persons without regard to sex, race, religion, color, national origin, ethnicity, age, sexual orientation, gender identity or expression, disability, military status or genetic information.

Job ID: 5169

Functional Area: Customer Service

Position Type: Full-Time Regular

Relocation Provided: No

Location: Tulsa, OK

Department: CUSTOMER SVC

Internal / External: Internal and External

Experience Required: Not Indicated",2014,Energy & Utilities,$1 to $5 billion (USD),"Energy, Mining & Utilities",1001 to 5000 Employees,Company - Public,False
Business Analyst,"Emergency Medical Services Authority
","Oklahoma City, OK",$59K - $83K (Glassdoor est.),3.3,"Essential Functions of the Position

Drive awareness of requirements across business units and identify substandard systems processes through evaluation of real-time data.
Determine and develop user requirements for systems in production, ensuring maximum usability.
Partner with stakeholders across business units (ex: operations, finance, clinical, support, billing, etc) to develop analyses and documentation in a collaborative way, communicating effectively and efficiently with production, managerial, and executive teams.
Partner with stakeholders across business units (ex: sales, finance, security, compliance) to develop analyses and documentation in a collaborative way, communicating effectively and efficiently with production, managerial, and executive teams.
Analyze data from multiple systems (Computer Aided Dispatch, Electronic Health Records, Billing, Logistics, etc) identifying trends and correlations that can be used to increase organizational efficiency.
Work with relational and non-relational data sources (SQL, Snowflake, SharePoint, etc).
Visualize data utilizing available platforms (Crystal Reports, Tableau, Power Bi).
Present data and work with shareholders to test process changes and drive performance in their areas of responsibility.
Perform other duties as assigned.

Job Knowledge, Skills, and Abilities

Proficient in Microsoft Office Suite.
Proficient in Tableau, Power Bi, Crystal Reports.
Proficient in the utilization of relational and nonrelational data sources.
Knowledge of Extract, transform, and load (ETL).
Experience obtaining data from disparate and cloud-based systems using application programming interfaces.
Thorough understanding of technical and professional skills management.
Excellent interpersonal and communication skills to establish and maintain effective working relationships and ability to interact with employees at all levels, both in person and through phone, e-mail, and written correspondence.
Work independently and as part of a team to ensure proper work practices.
Must always maintain a high level of confidentiality.
Excellent ability to conceptualize long-term business goals and develop orderly processes to accomplish those goals.
Ability to develop and maintain effective partnerships across disparate groups to organize and facilitate decisions and ensure implementation.

Physical Demands

Required to walk, sit, stand, and move about the property for periods of time.
Prolonged periods sitting at a desk and working on a computer.
Must be able to lift, carry, push, or pull up to 50 lbs.

Work Environment

Work performed in an office setting and off-site.
Noise level can range from minimal to intense.

Minimum Qualifications

Bachelor’s degree (or equivalent) in information technology or computer science preferred.
Minimum of 2 years experience performing analytics and process management functions.
Strong understanding of EMS and/or healthcare industry, including operational, financial, and clinical functions preferred.
Must be 21 years of age or older.
Must be able to pass a background check and drug screen.",-1,Taxi & Car Services,$25 to $100 million (USD),Transportation & Logistics,1 to 50 Employees,Government,True
Fire Prevention Officer - Community Risk Reduction Data Analyst,"City of Midwest City
","Midwest City, OK",$94K (Employer est.),4.3,"Applications for this position CAN be submitted online. You MUST submit a completed City of Midwest City employment application to be considered. Individual resumes without a completed City employment application WILL NOT be accepted.

The City of Midwest City is currently accepting applications for Fire Prevention Officer (Community Risk Reduction Data Analyst) in the Fire Department. Under the general direction of the Fire Marshal, the Community Risk Reduction Data Analyst will assist in the vision and development of a Community Risk Analysis (CRA) and Community Risk Reduction Plan by analyzing existing internal and external departmental data. This individual will assist with all duties assigned to a Fire Protection Officer while analyzing existing programs and determining future programs that are needed for our community. This position will work with the Fire Chief, Fire Marshal, and Shift Commanders to analyze the differing response districts in order to support the mission and vision of the Midwest City Fire Department in our Community Risk Reduction efforts. Must possess a high school diploma or equivalent, valid Oklahoma drivers license and be insurable. Any applicant attaining the position of Fire Prevention Officer must be certified as an IFSAC or Pro Board Inspector I and successfully complete a fire investigation training within one (1) year of attaining this position as approved by the Fire Chief. Must possess a Inspection and Arson Investigation Certificate. Must take a basic PIO course. Must meet the Oklahoma Firefighters Pension and Retirement entrance requirements. All Applicants must successfully complete a National Testing Network written and CPAT exam prior to 01/01/2024 to be considered. This position is designated safety/security sensitive and is subject to pre-employment, reasonable suspicion and random drug and alcohol screening. Starting salary: $93,512.85/yr. w/benefits. Click ""Apply now"" to apply online or via kiosk in person at the City of Midwest City, HR Dept., 100 N. Midwest Blvd, Midwest City, OK. Apps accepted until 5:30PM Monday, January 1, 2024.EOE.",-1,Municipal Agencies,Unknown / Non-Applicable,Government & Public Administration,Unknown,Government,False
IT Business Analyst ERP,"Choctaw Global
","Durant, OK",$60K - $92K (Glassdoor est.),3.6,"IT Business Analyst, ERP
Provide support for mission critical ERP and related applications for IT. Troubleshoot, analyze, integrate, and administer database related applications and systems. This position reports to the Director of Information Technology.
General Duties and Responsibilities
Provide functional support of Deltek Costpoint GCCM
Manage user setup, security, and other configuration for Deltek systems.
Support to Costpoint improvement initiatives includes working with the business to identify improvement areas, acquisition migrations, Costpoint System update testing, month-end/quarter-end closing support, Batch process verification, and Audit support.
Ensure compliance with company’s security policies and procedures.
Prepare and maintain documentation, including requirements, policies & procedures relating to Costpoint.
Work to evaluate, escalate and resolve defects within Costpoint.
Create ad hoc reports.
Maintain excellent communication with the Director of Information Technologies on all projects.
Communicate with customers, peers, team, and managers regarding incident and change management.
Monitor ticket queue and support Deltek product related issues, requests, and changes.
Position Qualifications: Knowledge, Skills, and Abilities
Experienced with all CostPoint Domains.
Analyze, identify, and write detailed description of user requirements, program functions, and steps required to develop or modify applications or components.
Make recommendations for business process improvements with an understanding of technical problems and solutions as they relate to the technology needs.
Project management skills are an asset.
Knowledge of Business Intelligence solutions: Power BI, Cognos, etc.
Ability to conduct research into ERP issues and products as required.
Ability to present ideas in business-friendly and user-friendly language.
Highly self-motivated and directed, with keen attention to detail.
Proven analytical and problem-solving abilities.
Ability to effectively prioritize tasks.
Strong customer service orientation.
Ability to work a flexible schedule, including evenings, weekends and/or holidays as required.
Ability to travel in support of remote sites, less than 10%
Ability to be a positive representative of the Company both internally and externally.
Experience/Education:
University degree in the field of computer science or management information systems or a related discipline
Strong general knowledge of Enterprise Resource Planning products.
Minimum of 5 years of experience maintaining, utilizing, and Deltek CostPoint.
Experience with Deltek TIP QA Modules
Hands-on experience with Deltek Integration.
Exposure to Lean Six Sigma methodologies
Experience working in a team-oriented, collaborative environment.


The above-noted job description is not intended to describe, in detail, the multitude of tasks that may be assigned but rather to give the applicant a general sense of the responsibilities and expectations of this position. As the nature of business demands change so, too, may the essential functions of the position.

EEO/AAP Statement
We acknowledge and honor the fundamental value and dignity of all individuals. We pledge ourselves to craft and maintain an environment that respects diverse traditions, heritages, and experiences. Choctaw is an Equal Employment Opportunity and Affirmative Action employer. We do not discriminate based upon race, religion, color, national origin, gender (including pregnancy, childbirth, or related medical conditions), sexual orientation, gender identity, gender expression, age, status as a protected veteran, status as an individual with a disability, or other applicable legally protected characteristics.",-1,Advertising & Public Relations,Unknown / Non-Applicable,Media & Communication,501 to 1000 Employees,Company - Public,False
