Job Title,Company Name,Location,Salary Estimate,Rating,Job Description,Founded,Industry,Revenue,Sector,Size,Type,Easy Apply
Business Analyst - Midwest,"HHS Technology Group
","Des Moines, IA",$69K - $95K (Glassdoor est.),4.2,"Business Analyst

WHO WE ARE:

At HHS Tech Group (HTG), our work matters, and each of us makes a difference in the lives of people every day.

HTG is a leader in the development and delivery of innovative, purpose-built modular software and technology solutions to clients in the commercial and government sectors.

WHAT WE DO:

HHS Tech Group creates innovative, purpose-built technology products and solutions, resulting in value and positive, quantifiable impact for our clients and the people they serve.

Our people bring our software to life through collaborative relationships with our clients, working as a team, helping to solve complex problems that create positive personal and community impact for the people our clients serve.

Each day, our software products and our people are making a difference.

OUR PEOPLE MATTER MOST:

Improving the lives of others and making an impact daily is no simple task. We are dedicated to our team’s professional and personal growth and well-being. Some key rewards and benefits include:

Generously sponsored Medical Insurance
Fully paid premiums on dental, vision, life and disability insurance.
Generous 401k matching program (100% match up to 6%)
Tuition and Certification reimbursement
Open PTO policy

Join us!


WHO WE ARE HIRING: Business Analyst - Midwest

WHAT YOU WILL DO:

The Business Analyst is a Business/Data Informatics subject matter expert (SME) with technical/functional Medicaid Data Analytics experience. You will be responsible for partnering with our teams and clients to understand project goals, make a plan to achieve those goals, manage changes, and promote the alignment of established goals with business decisions throughout the life of a project. This is a remote role based in the Midwest, US.


Responsibilities:

Critically evaluate information gathered from multiple sources, reconcile conflicts, decompose high-level information into details, abstract up from low-level information to a general understanding, and distinguish user requests from the underlying true needs
Proactively communicate and collaborate with external and internal customers to analyze information needs and functional requirements and deliver the following artifacts as needed: (functional requirements, business requirements, use cases, Graphical User Interface (GUI) screens and interface designs)
Elicit requirements using interviews, document analysis, requirements workshops, surveys, site visits, business process descriptions, use cases, scenarios, business analysis, task and workflow analysis.
Work independently with users to define concepts with guidance from project managers
Drive and challenge business units on their assumptions of how they will successfully execute their plans
Serve as the conduit between the customer community (internal and external) and the software development team through which requirements flow
Develop requirements specifications according to standard templates, using natural language
Collaborate with developers and subject matter experts to establish the technical vision and analyze tradeoffs between usability and performance needs
Liaise between the business units, technology teams and support teams
Maintain industry/technical knowledge base and facilitate/maintain industry relationships
Maintain understanding of the business mission and technology environment
Demonstrate commitment to providing customer-focused quality service
Perform other duties as deemed relevant based upon experience to fulfill customer needs


Required Experience

Five (5) or more years of demonstrated Business Analyst experience.
3+ years of State Government experience with Health and Human Services and have a strong level of domain expertise in Medicaid and MMIS (Medicaid Management Information System) initiatives, specifically Provider Enrollment.
Two (2) or more years of hands-on Systems/Software Development Life Cycle (SDLC) experience
5+ years of experience capturing, documenting, and refining requirements in Agile, and Hybrid Agile environment (blended Waterfall/Agile approach).
Experience in using enterprise-wide requirements definition and management systems and methodologies.
Demonstrated successful engagement in multiple simultaneous initiatives/projects.
Strong analytical and product management skills required, including a thorough understanding of how to interpret customer business needs and translate them into application and operational requirements
Excellent verbal and written communication skills and the ability to interact professionally with a diverse group, executives, managers, and subject matter experts.
Experience in producing deliverable quality documents.
Experience with supporting system testing and user acceptance testing
Experience training end users and providing business user support
Experience with Microsoft Word, Excel, SQL, Visio, Lucid Charts, Jira, Confluence


Preferred Experience

Experience working in an SOA framework
Moderate to high level expertise with T-SQL DB, DS software such as R or Python, and MS Office (Excel, Word, PPT)
Health Care knowledge around Health care Billing and coding (CPT/HCPCS, ICD, NDC) is a plus.


Critical Skills

Detail oriented, analytical, and inquisitive
Ability to work independently and with others.
Extremely organized with strong time-management skills
Requirements Elicitation and Analysis
Negotiation
Ability to build rapport with internal and external stakeholders quickly
Able to produce requirements traceability matrix and work with technical staff to understand requirements
Excellent communication and organizational skills


Education and Certification

BS/BA or equivalent in Computer Science, Information Systems, Engineering, Business, Mathematics, or other related scientific or technical discipline with five (5) or more years of experience related to this position
Industry-recognized Business Analyst Certification preferred




Applicants for employment in the US must have work authorization that does not, now or in the future, require sponsorship of a visa for employment authorization in the United States.

EEO Statement

HHS Technology Group is an equal opportunity employer. All aspects of employment including the decision to hire, promote, discipline, or discharge, will be based on merit, competence, performance, and business needs. We do not discriminate on the basis of race, color, religion, marital status, age, national origin, ancestry, physical or mental disability, medical condition, pregnancy, genetic information, gender, sexual orientation, gender identity or expression, veteran status, or any other status protected under federal, state, or local law.

D276iCV3tf",-1,Information Technology Support Services,Unknown / Non-Applicable,Information Technology,Unknown,Company - Private,False
Business Analyst (Remote Work Flexibility),"Shazam.net
","Des Moines, IA",$55K - $84K (Employer est.),3.0,"SHAZAM is looking for a business analyst to contribute banking expertise to core banking platform software projects. In this role, you will work with Product Managers, Compliance Analysts, and client-facing operations teams to define the behavior of new products and products enhancements. You will research stakeholder needs and industry regulations, identify impacts to our systems, and collaborate with technology teams. After you apply business analysis techniques to fully define needs, you will create clear, testable written requirements and procedures that will solve problems and address new opportunities for our financial institutions.



What you’ll do:

Elicit and analyze information from a variety of sources to fully understand problems and opportunities (and be able to clearly explain them to others).
Facilitate collaborative meetings with product managers, business units, and technical teams to build mutual understanding about client needs and potential solutions.
Identify gaps in systems and processes and guide cross-department teams and leaders to decide how to best resolve them.
Create written requirements, acceptance criteria, and user stories to document changes needed to Core banking software, systems, and business processes.
Create process flows, context diagrams, wireframes, and other visual models in order to clearly communicate a set of functional requirements.
Demonstrate solid understanding of software development lifecycle, including Agile and waterfall methodologies.
Apply attention to detail, including the ability to follow written and verbal directions and produce clear, complete, and correct written communication.
Manage multiple projects and priorities, tasks and coordinate various channels of communication at the same time.



What we’re looking for:

Minimum of five years banking experience. Some experience with internal/back-office operations (DDA, GL, loans, teller) a plus.
Core banking platform experience.
Experience contributing to cross-department technology projects in the banking space preferred.
Excellent communication skills, both verbal and written.
Demonstrated interpersonal, leadership, and team-building skills that drive cross-department teams to make decisions
Ability to write unambiguous, verified requirements to a testable level (functional and non-functional requirements)
Facilitation and organizational skills
Ability to problem solve and apply analytical thinking
Strong attention to detail and a commitment to a high level of accuracy

Starting annual salary from $55,100 to $83,700*

Actual compensation will be based upon factors such as geographic location, experience, education, and/or skill level and will be finalized at the time of offer.

The Strength of SHAZAM

SHAZAM’s an independent company in the thriving financial services industry. We offer a dynamic, fast-paced work environment where you'll be challenged and rewarded for your achievements. Our employees’ professional growth and development is top priority, and you’ll be surrounded by talented individuals and postured to make a real difference in the company. As a team member at SHAZAM, you’ll be an essential part of our mission as we work together strengthening community financial institutions. We’re a trusted partner to our valued customers providing answers, choice and innovation with an impeccable level of customer service — a level unmatched in the industry. And here’s the best part. We’re a national company that offers a small-company feel, a cultural balance that’s hard to come by but very real at SHAZAM. As an employee here, you’ll get to know everyone from the front line to the CEO, and be a part of a highly collaborative work environment.

Benefits

Join SHAZAM and be a part of a motivated and vibrant group of people. We offer highly competitive salary packages and attractive benefits:

Comprehensive benefits package including medical, dental, and vision, plus flexible spending accounts

Retirement plan, plus financial planning assistance

Paid time off, paid parental leave, volunteer time off, and paid corporate holidays

Educational assistance

Casual dress

Wellness programs, on-site fitness center and fitness reimbursement

Life insurance and disability plans

Employee rewards, recognition programs and employee referral program

Flexible hours

Two Des Moines area facilities with secure building access and free on-site parking. (Johnston office is located in a greenbelt area).

AFFIRMATIVE ACTION/EQUAL OPPORTUNITY EMPLOYER

PROTECTED VETERANS AND INDIVIDUAL WITH DISABILITY

Visa Sponsorship: This position is not eligible for sponsorship for work authorization by ITS, Inc. Therefore, if you will require sponsorship for work authorization now or in the future, we cannot consider your application at this time.

If you believe you are receiving communications related to this position from someone other than SHAZAM, please email HumanResourcesGroup@SHAZAM.net. SHAZAM will not ask you to share financial information as part of the application process.",1976,Financial Transaction Processing,$25 to $100 million (USD),Financial Services,501 to 1000 Employees,Nonprofit Organization,False
Technical Business Analyst,"Cygnus Professionals
","Des Moines, IA",$72K - $102K (Glassdoor est.),4.2,"Job Description

Job Title : Technical Business Analyst

Location: 1305 E. Walnut Des Moines IA – Hybrid

Will be onsite for the first 30 days before being allowed to work fully remote.

Duration: 6 Months

Job Description:

Due to the growing demand for IT systems and solutions, the Iowa Department of Health and Human Services is seeking an experienced IT Business Analyst to join our team in supporting the implementation and management of various software development projects. The successful candidate will have a strong background in Software Development Life Cycle (SDLC) methodologies and Agile frameworks such as Scrum and Kanban. Experience with project management tools like Azure DevOps or JIRA is highly desirable. As a Business Analyst, you will work closely with cross-functional teams to ensure successful project delivery and alignment with the organization’s strategic objectives.

Responsibilities:

Collaborate with stakeholders to gather, analyze, and document business requirements for new software initiatives or enhancements to existing applications.
Act as a liaison between business units, development teams, and management, to ensure seamless communication and project execution.
Develop a deep understanding of HHS business processes, applications, and systems to facilitate the implementation of effective solutions.
Create and maintain project artifacts such as business requirement documents, user stories, use cases, workflow diagrams, and test plans.
Participate in Agile ceremonies, including sprint planning, daily stand-ups, sprint reviews, and retrospectives, to ensure continuous improvement in project delivery.
Utilize project management tools such as Azure DevOps, Microsoft Project, and Power BI to create user stories, track and monitor project progress, manage tasks, and report on project status to stakeholders.
Assist in the development and implementation of user acceptance testing (UAT) strategies, ensuring that solutions meet business requirements and expectations.
Support change management efforts by facilitating user demos/training, documenting processes, and providing guidance on the adoption of new processes, systems, and features.
Continuously identify opportunities for process improvements and provide recommendations for enhancing efficiency and effectiveness.

Qualifications:

Bachelor’s degree in business administration, Information Technology, Computer Science, or a related field, and/or a combination of education/certification and work experience.
A minimum 6 years of experience as a Business Analyst and/or Project Manager, with a preferred focus on SDLC and Agile methodologies.
Ability to analyze business strategies and user needs, document specifications, and translate business objectives into proper system requirements and specifications.
Working knowledge of Agile frameworks such as Scrum and Kanban, and familiarity with Agile project management tools like Azure DevOps or JIRA.
Proficient in Microsoft Office Suite including Excel, Word, PowerPoint, Project, and Visio.
Excellent communication and interpersonal skills, with the ability to work effectively with diverse teams and stakeholders at various levels of the organization.
Guide stakeholders through business case development for new applications/functionality, including cost benefit analysis, risks and issues, and impact analysis.
Strong analytical and problem-solving skills, with a keen attention to detail.
Demonstrated ability to balance multiple priorities and manage time effectively in a fast-paced environment.
Familiarity with state government operations and processes is a large plus.",-1,Accounting & Tax,Unknown / Non-Applicable,Financial Services,201 to 500 Employees,Company - Private,False
Technical Business Analyst 1/2/3- Hybrid,"American Enterprise
","Des Moines, IA",$74K - $110K (Glassdoor est.),4.7,"Job Details

Description

JOB SUMMARY

Wellabe is looking for a Technical Business Analyst to join our team. Responsibilities include working as a liaison with business units to optimize costs and improve routine business process, products, services, and software by strategically using data analysis to elicit, analyze, and validate requirements for change.

Position level will be determined based on skills, knowledge, and experience.

ESSENTIAL FUNCTIONS
Reasonable accommodations may be made to enable individuals with disabilities to perform these essential functions.

Level 1

Assist in research, identify, analyze, and model routine business processes and problems of minimal difficulty to ensure a thorough understanding of current and proposed procedures and systems to identify opportunities to improve departmental and corporate operations.

Assist in collaborating with project stakeholders to build the business case and prepare detailed business requirement documents with information such as project scope, cost/benefit analysis, and efficiency and feasibility of the identified project or business opportunity.
May participate in application systems analysis projects; including analyzing system requirements, drafting scope documents and provide technical solutions.
Works to analyze and present documented requirements on small projects, to the business, technical, and software quality assurance teams to report progress and strategies and to create solutions by explaining the cost/benefit of presented solutions, facilitating discussion around selecting the best solutions, and re-evaluating the agreed upon solution to ensure feasibility of implementation and that it meets stakeholder objectives.
Utilizes questioning, identify, define, document, and perform necessary verification and validation to ensure accuracy of requirements related to the business process or opportunity.
With coaching direction plan, manage, prioritize, schedule, and monitor all requirement activities of the project such as elicitation, validation, change and scope control, and determination of approach, risks, solutions, and priorities to ensure completion while providing guidance and communication of status to leaders.

Level 2

Research, identify, analyze, and model business processes and problems of moderate difficulty to ensure a thorough understanding of current and proposed procedures and systems to identify opportunities to improve departmental and corporate operations.
Assist and may lead in collaborating with project stakeholders to build the business case and prepare detailed business requirement documents with information such as project scope, cost/benefit analysis, and efficiency and feasibility of the identified project or business opportunity.
Participates in moderately complex application systems analysis projects; including analyzing system requirements, drafting scope documents and provide technical solutions.
Analyzes and presents documented requirements on varying sized projects, to the business, technical, software quality assurance teams to report progress and strategies and to create solutions by explaining the cost/benefit of presented solutions, facilitating discussion around selecting the best solutions, and re-evaluating the agreed upon solution to ensure feasibility of implementation and that it meets stakeholder objectives.
Proficient in questioning, identify, define, document, and perform necessary verification and validation to ensure accuracy of requirements related to the business process or opportunity.
Collaborates with BA lead on how and where the business will progress by continuously looking for improvements, evaluating effectiveness, and ensuring others follow the outlined approach.
With minor direction plan, manage, prioritize, schedule, and monitor all requirement activities of the project such as elicitation, validation, change and scope control, and determination of approach, risks, solutions, and priorities to ensure completion while providing guidance and communication of status to leaders.
Assists in designing strategies and selection of the best tools for business analysis practice such as field mappings, linking to DevOps for historical artifacts, etc.
Train, mentor, support, and develop less experienced business analysts by providing advice, coaching, and educational opportunities.

Level 3

Functions of a level 2 with addition of the following:




Leads collaborations with project stakeholders to build the business case and prepare detailed business requirement documents with information such as project scope, cost/benefit analysis, and efficiency and feasibility of the identified project or business opportunity.


Leads and directs complex application systems analysis projects; including analyzing system requirements, drafting scope documents and provide technical solutions.


Advanced experience in questioning, identify, define, document, and perform necessary verification and validation to ensure accuracy of requirements related to the business process or opportunity.


Designs how and where the business will progress by continuously looking for improvements, evaluating effectiveness, and ensuring others follow the outlined approach.


Plan, manage, prioritize, schedule, and monitor all requirement activities of the project such as elicitation, validation, change and scope control, and determination of approach, risks, solutions, and priorities to ensure completion while providing guidance and communication of status to leaders.


Designs strategies and select the best tools for business analysis practice such as field mappings, linking to DevOps for historical artifacts, etc.



SUCCESS PROFILE
Knowledge, Skills, and Abilities

General (Level 1), Working (Level 2), Advanced (Level 3) knowledge of the principles, processes, and practices related to technical business analysis and IT standards and procedures such as Teams, Product Plan, SharePoint, systems development life cycle and other related items.
Ability to understand, utilize, and communicate technical solutions.


Basic critical thinking, analysis, problem-solving, and interpersonal skills with the ability to communicate technical and complex topics.


Demonstrate the Wellabe core competencies of change, communication, customer focus, financial acumen, innovation, teamwork, critical thinking, and decision making. For a full description of each competency, please visit wellabe.com/core-competencies.
Embrace and foster a diverse and inclusive culture that aligns with our commitment to THRIVE together. Toolkit: We are building resources for employee reference, including a diversity driven book club, leadership training, and a culture of betterment philosophy. Hear: Every employee has a voice. We listen with attention to gain knowledge and to understand. Respect: We empower people by respecting and appreciating their differences. Inclusion: We support a collaborative workforce that promotes belonging and respect that increases participation and contribution from all employees. Value: All employees are appreciated for their uniqueness. Equity: For all.
Demonstrate an Agile mindset* of trust, teamwork, and transparency and capability to implement agile tools into daily work, allowing for quick adaption to change. (*An agile mindset is the set of attitudes supporting an agile working environment including trust, teamwork, transparency, respect, improvement, ongoing learning, pride in ownership, focus on delivering value, and the ability to adapt to change.)
Embrace our culture of betterment, which surrounds the question: Does this decision fit with our mission and core values while enhancing the outcome for our customers, our business, and our associates?

EDUCATION AND EXPERIENCE

Education

Bachelor’s degree in business, insurance, computer science, or related. Combination of education and/or relevant work experience may be accepted in lieu of degree.





Experience

Level 1: Entry level, Internship or experience, a plus
Level 2: 2+ years related experience, project management experience a plus.
Level 3: 5+ years related experience, project management experience a plus.

TRAVEL REQUIREMENTS

Trainings/Seminars/Conferences
Minimal

PHYSICAL REQUIREMENTS

Primarily works in an office environment (or in-home office) performing work that is sedentary which involves remaining stationary and working on a computer for long periods of time
Must be able to review, assess, and/or analyze data and figures by viewing a computer screen, including extensive reading.
Regularly communicates with others in-person, via video conferencing, electronically (including email), or by phone to exchange accurate information.

This job description does not list all activities, duties, or responsibilities that may be required. The employee in this position may be assigned other duties at any time with or without notice.

This job description does not constitute a contract of employment and the company may exercise its employment-at-will rights at any time.",-1,Insurance Carriers,Unknown / Non-Applicable,Insurance,Unknown,Unknown,False
