Job Title,Company Name,Location,Salary Estimate,Rating,Job Description,Founded,Industry,Revenue,Sector,Size,Type,Easy Apply
CPQ Systems Analyst,Empire Building Materials Inc,"Bozeman, MT",$73K - $88K (Employer est.),-1.0,"CPQ Systems Analyst

Empire Building Materials is seeking a CPQ Systems Analyst for our door manufacturing facility. This position will play a key role in assisting with a CPQ (configure, price, quote) software implementation and subsequent CPQ system maintenance.

Established in 1954, Empire Building Materials is a wholesale distributor of building products that sells to retail lumber yards and home centers throughout Montana, Wyoming, Idaho, North Dakota, South Dakota, and Washington. Empire Building Materials maintains its corporate headquarters in Bozeman Montana, and has distribution facilities in both Bozeman and Missoula Montana. In addition to our wholesale distribution, we operate two door shop facilities with locations in Bozeman and Missoula Montana.

As the CPQ Systems Analyst, you will be responsible for assisting with the catalog build, system implementation, and product maintenance. This role will be a key player in the digital transformation of our business.

Catalog Build: Work with a team of employees to build an extensive catalog of our door products, including various configurations, specifications, and pricing options.

Product Implementation: Collaborate with the CPQ project team to ensure the successful implementation of the CPQ system. Serve as a product knowledge expert for our internal staff and our external customers.

Product Maintenance: Responsible for routine catalog build and releases throughout the year, including all applicable testing prior to releases. Manage and schedule version updates. Identify and implement changes to the CPQ to improve user experience, streamline processes, and ensure data accuracy. Maintain the integrity of product data, ensuring consistency and accuracy in the system. Responsible for image maintenance and updates.

Training and Support: Provide training and support to internal staff and external customers to ensure they can effectively utilize the CPQ system. Act as a first point of contact for our IT Services provider.

Additional Duties: This position has the potential to support our door manufacturing facilities in a number of other ways including programming and updating the Kval door library, utilizing Bistrack for scheduling and dispatch, and maintaining products on our website.

Competency:

Thorough understanding of information technology procedures and practices.
Flexible to changing needs.
Organized with attention to detail.
Works well with a team
Excellent verbal and written communication skills
Excellent analytical, logical thinking, and problem-solving skills.
Proficient with, or able to quickly become proficient with Bistrack, Paradigm Omni, and Kval software.
Proficient with Microsoft Office 365.
Experience with building and maintaining a manufacturing CPQ.
SQL and/or C++ programming language experience.

Education and Experience:

· A Bachelor’s degree in Computer Science or Computer Programming, or equivalent experience and training.

· 2 years’ experience as a systems/data analyst OR

· 2 year’s experience in door manufacturing or sales (preferred)

· Alternate combinations of education and experience will be considered on a case-by-case basis

Job Type: Full-time

Pay: $72,751.45 - $87,614.64 per year

Benefits:

401(k)
401(k) matching
Dental insurance
Employee discount
Health insurance
Health savings account
Paid time off
Professional development assistance
Retirement plan
Vision insurance

Compensation package:

Bonus opportunities

Experience level:

2 years

Schedule:

8 hour shift

Work Location: In person",-1,-1,-1,-1,-1,-1,True
GIS & Natural Resource Data Analyst,"State of Montana
","Helena, MT",$31.53 Per Hour (Employer est.),2.8,"GIS & Natural Resource Data Analyst - (23143489)




THE OUTSIDE IS IN US ALL.

Please remember to attach the required documents listed in this announcement:

Cover Letter
Resume

Applications missing the requested documents will be considered incomplete and may not progress further in the process. Documents not requested will not be considered in the recruitment process. The State Application is not a substitute for a Resume. This position closes at 11:59 PM Mountain Time on December 17, 2023. You must apply through the State of Montana Career site.



Identity of applicants who become finalists may be released to the public if the Department deems it necessary. Employees who exceed 1,040 hours in a calendar year are also provided health, dental and life insurance. Other benefits include retirement, paid vacation, sick and holidays. This position may be covered by a VEBA (Voluntary Employee Beneficiary Association).

A successful applicant will be subject to a background investigation.


Women and minorities are under-represented in this job category and are encouraged to apply.




Special Information:

Do you have experience managing natural resources spatial data and creating compelling GIS products? Are you interested in fisheries, wildlife, and natural resources information? Would you enjoy working with professionals dedicated to the stewardship of natural resources in Montana? If so, the Geographic Data Services Bureau at Montana Fish, Wildlife & Parks is recruiting for a GIS and Natural Resources Analyst. This position is a unique opportunity for a GIS professional interested in using their skills in a fish and wildlife agency.




The successful applicant will have experience with, and be interested in fish, wildlife and recreational resources in Montana and share a commitment to FWP's Vision and Mission. The ideal candidate will be analytical, detail oriented, creative, possess a strong work ethic, have a positive attitude and excellent people skills. This position requires excellent time management skills, collaborating successfully in a team environment, working independently on multiple priorities, and interacting with diverse groups of people. You must be an effective, knowledgeable, and engaging communicator. To be successful, you must clearly communicate concepts related to fisheries and wildlife science as well as GIS, data, and database concepts to individuals with both technical and non-technical backgrounds. You must have a minimum of three (3) years of relevant prior work experience managing natural resources or fish and wildlife spatial data; creating digital and hard copy map products; technical expertise in obtaining, working with, and organizing spatial data and defining, planning, and implementing spatial analysis and GIS workflows. Work experience with geodatabases, geospatial data services, relational databases, data query syntax such as SQL and familiarity with the Python language are required. Prior experience with ArcGIS Online including Dashboards and Experience Builder is required.




If this sounds like you, we encourage you to apply. This position requires some travel and occasional irregular hours to meet project deadlines. Long hours of computer use at a desk are required. On occasion, there may be opportunity to participate in field work requiring physical exertion and possibly under adverse weather conditions. Required application materials are a detailed resume and cover letter. Please review the previous list of requirements when you apply and ensure you submit all three required documents as incomplete applications will be rejected. Candidates progressing to an interview will be required to present a recent GIS project as part of the interview process.




Job Duties:

This position is responsible for planning and managing statewide GIS data and services, developing official map publications, spatial data management, data analysis, map production, technical support/outreach, mapping application development assistance, and cross-division and cross-agency collaboration and support.


Minimum Qualifications:

The knowledge, skills, and abilities of this position are normally attained through combination of education and experience equivalent to a Bachelor's Degree in geographic information systems, information management, wildlife or fisheries biology and/or management, natural resources, geography, computer science or a related field and 3-4 years of job related work experience.




Other combinations of education and experience will be considered on a case-by-case basis.



Applicant Pool Statement: If another department vacancy occurs in this job title within six months, the same applicant pool may be used for the selection.
Training Assignment: This agency may use a training assignment. Employees in training assignments may be paid below the base pay established by the agency pay rules. Conditions of the training assignment will be stated in writing at the time of hire.


Salary: $ 31.53 - 31.53 Hourly
Telework Eligibility: Telework Eligible (Full-time telework is not available. Telework schedule must be supervisor approved.)
Benefits Package Eligibility: Health Insurance, Paid Leave & Holidays, Retirement Plan


Number of Openings: 1
Employee Status: Regular
Schedule: Full-Time
Shift: Day Job
Travel: Yes, 10 % of the Time


Primary Location: Helena


Agency: Department of Fish, Wildlife & Parks
Union: 000 - None


Posting Date: Nov 21, 2023, 4:50:42 PM
Closing Date (based on your computer's timezone): Dec 18, 2023, 12:59:00 AM
Required Application Materials: Cover Letter, Resume


Contact Name: Brianna Johnson | Contact Email: fwpemp@mt.gov | Contact Phone: 406-444-4657",-1,Health Care Services & Hospitals,Unknown / Non-Applicable,Healthcare,51 to 200 Employees,Hospital,False
Management Consultant (IT Business Analyst) - US,"Public Knowledge, LLC
",Montana,-1,4.3,"Applicant must be willing to travel as needed

Company Summary
Public Knowledge® is a national management consulting firm that helps government agencies solve tough problems and thrive in complex environments. We do this by providing planning, procurement, and implementation services. Most of our work is in Health and Human Services. You can learn more about us at www.pubknow.com. The GLI® Group has acquired Public Knowledge®, which provides Public Knowledge® with the financial backing and infrastructure of a larger company.

Inclusion is a core value of Public Knowledge®. We value and seek to create a more diverse workforce. We encourage women, minorities, veterans, people with disabilities, people with different sexual orientations, people with lived expertise, and other diverse people to apply. We believe every member on our team enriches our diversity by exposing us to a broad range of ways to understand and engage with the world, identify challenges, and to discover, design, and deliver solutions. We are committed to creating a safe and inclusive workplace that highlights the diversity in all of us and our experiences.

Position Summary
This management consultant would spearhead research efforts to gather information for large projects and programs and propose creative solutions. This person would collaborate with project managers and team members to support project administration, time management, and budgeting.

Duties & Responsibilities include, but not limited to:
Research

Gather information for a project by conducting interviews, surveys, facilitating groups, analyzing client documentation, conducting research of best practice and academic literature, and the application of other information gathering tools.
Project Support

Learn and apply the tools and techniques we have for projects.
Work with project managers to support the administration of projects (ensure staff adhere to standards, organizing the time of other team members, supporting project meetings, and assisting with project financial management).
Help your team meet project objectives, timelines, and deliverables within budget.
Analysis, Communication, and Consultation

Using your experience and research results, analyze and organize information identifying root causes of issues, opportunities for improvement, and generate ideas to improve the client situation.
Based on your analysis, research, and experience participate with your team in the development of recommendations for actions that will improve the client situation.
Communicate the results of our work (information, analysis, and recommendations) through the participation in the development and delivery of written reports, formal presentations, and oral discussions with your team, and as requested clients and stakeholders.
Firm Knowledge Sharing and Growth

Freely share your knowledge, skills, and abilities with your peers in the firm.
Perform firm administrative activities (maintain your resume, record your time accurately).
Grow your skills and experience by participating in projects and actively pursuing continuing professional education.
Develop an effective working relationship with clients and colleagues.
Required Education and Other Credentials:

Bachelor’s Degree required
Valid Driver’s License
Required Experience and Skills:

Must have ability to lead the application of analytic techniques and assist in defining the project objectives, methodologies, and principles.
Must have experience performing a wide variety of analytical tasks with the continuous improvement of processes, personnel, organization, system, or training.
Must have strong interpersonal skills and extremely resourceful
Experience with JIRA, Rational, Kanban, preferred
Must have experience in bringing focus and organization to ambiguous situations
Must demonstrate creative and strong analytical and problem-solving skills
Demonstrates excellent interpersonal skills Must have flexibility and ability to adapt quickly to new situations
Must have ability to establish and cultivate strong work relationships
Must have clear, concise written and verbal communication
Must have demonstrated life-long learning skills
Desire to work in a collaborative, fast-paced, entrepreneurial environment
Ability and willingness to travel (reasonable travel will be required)
Proficient knowledge of Microsoft Word, Excel, and Outlook
Must have excellent oral and written communication skills, including the ability to communicate with officials at all levels in government and industry
Must have the ability to handle and organize multiple projects and deadlines
Must demonstrate a high degree of attention to quality, details, and correctness
Ability to work with colleagues in a virtual environment (via conference calls, web meetings, and using digital collaboration tools such as Zoom and cloud document repository)
Physical Requirements and Working Conditions:

Must have the ability to travel to client sites
Ability to work from a home-based office
Must have the ability to work at a computer for extensive periods of time
Must have the ability to speak on the telephone for extended periods of time
Must have the ability to read (paper or computer screen) for extended periods of time
Must have sufficient hand, arm, and finger dexterity to operate a computer keyboard and other Company equipment
Must have the ability to be self-driven, work independently and as part of a team
We offer excellent paid benefits that include:

Comprehensive Health & Dental Insurance
100% Paid Life Insurance
20 Days Paid Time Off (Per Year)
Paid Holidays
401K Savings Plan with 100% match up to 3% of your salary
Anniversary Reward Bonus
If you are a Colorado resident, you may be eligible to receive additional information about the compensation and benefits for this role, which we will provide upon request. You may contact 732-942-3999 ext. 1436 for assistance
In accordance with PK's duty to provide and maintain a safe workplace during the pandemic, we require all new employees to be fully vaccinated with a Coronavirus vaccine. You will be asked to show proof of vaccination prior to your start date.

Applying
Think you've got what it takes? Apply online on our website and include an introduction to yourself and your qualifications.

This job post should not be interpreted as all-inclusive; it is intended to identify major responsibilities and requirements of the job. The incumbent may be requested to perform other job-related task and responsibilities than those stated above.

Public Knowledge is an Equal Opportunity Employer",1988,Business Consulting,$5 to $25 million (USD),Management & Consulting,51 to 200 Employees,Company - Private,True
