Job Title,Company Name,Location,Salary Estimate,Rating,Job Description,Founded,Industry,Revenue,Sector,Size,Type,Easy Apply
Data and Communications Analyst (Program Analyst),"Tygart Technology, Inc
","Clarksburg, WV",$55K - $85K (Glassdoor est.),4.7,"Tygart is currently seeking a Data and Communication Analyst (Program Analyst) to support a Department of Justice (DOJ) Program Office. This is an onsite position in Clarksburg, WV and requires that the candidate have a current Top Secret security clearance.

Responsibilities Include:

Support the program with various research and analytical projects, white paper development, presentations, and other project-oriented tasks.
Ability to develop a communications strategy and produce creative, effective, and engaging communications content.
Manage, track, prioritize, and schedule multiple projects simultaneously, while meeting all deadlines.
Provide necessary professional skills, including planning, selecting, collecting, analyzing, interpreting, and communicating for all phases of data processing; system and software development lifecycle phases; and data analysis.
Collaborate with other CJIS units on projects, initiatives, and events.
Recognize patterns of customer needs, problems, and potential systemic solutions.
Work with all levels of the organization. Interactions may include presentations, workshop facilitation, and outreach.
Proficiency in preparing and/or reviewing technical and programmatic documentation to ensure consistency with outreach documentation and ensuring impacts are identified, understood, and communicated is required.
Shall work with all levels of the organization. Interactions may include the delivery of presentations, workshop facilitation, and other forms of outreach.
Recommend innovative avenues of communication for external and internal audiences.
Assist with system messaging as needed; this includes system maintenance, outages, and notifications Shall manage and perform print production updates, while maintaining master production schedule.
Provide functional expertise in the following aspects of creative content production: creative content strategy development; content development; and content delivery.
Shall perform extensive analysis and research to create case analysis studies and reports some of which will involve use of MS PowerBI.

Qualifications:

A minimum of 5 years of experience in the development and management of user manuals, standard operating procedures, outreach materials, bulletins, presentations, reports, and instructional materials
Expertise in creative writing and marketing materials, including, but not limited to creating informative emails, articles, success stories, brochures, flyers, newsletters, presentations, etc. is required.
Excellent analytical, critical thinking, judgement, and organizational skills are required.
Must have excellent verbal, written, and interpersonal communication skills.
Must have experience working with MS Tools, specifically PowerPoint, Excel, and Visio software.
Ability to develop a communications strategy and produce creative, effective, and engaging communications content.
Desired: Proficiency with the application of copyright procedures and laws, and Section 508 of the Rehabilitation Act of 1973 requirements and standards.

Job Type: Full-time

Benefits:

Dental insurance
Health insurance
Paid time off

Security clearance:

Top Secret (Required)

Work Location: In person",-1,-1,$1 to $5 million (USD),-1,1 to 50 Employees,Company - Private,True
IT D365 Business Analyst,"Morgan Advanced Materials
",United States,-1,3.2,"Overview:

Morgan Advanced Materials is a business rich in history and innovation. Founded in the UK in 1856, we have grown into a global organisation with 70 sites in 18 countries. Our model to serve our customers where they need us has led to a diversified product range using our unparalleled expertise in ceramic and carbon materials, which we exploit to solve difficult problems for our customers across a diverse range of markets.


We are a purpose driven organisation. Our purpose is to use advanced materials to make the world more sustainable and to improve the quality of life. We deliver on that purpose through the products that we make, and the way that we make them.


We help our customers push the limits of their processes and products to meet the demanding requirements they face, from higher process temperatures to higher product performance to increasing miniaturisation.

Key Figures: Revenue £1,112m (2022), ~8,500 employees, manufacturing in 30+ countries, and a global customer portfolio. A UK PLC with head office located in Windsor, Berkshire UK. Listed on London Stock Exchange; Member of the FTSE 250 Index.


Responsibilities:

OVERVIEW & SCOPE OF ROLE:

Morgan IT is on a mission to enable and drive the Morgan goals by being a valuable business partner to all Global Business Units and Functions by:

Running Effective and Efficient IT
Delivering Solid Business Foundations
Extracting Maximum Business Value from IT
Driving disruptive innovation

To do so, the OneIT team is currently executing on a strategic roadmap to make significant step changes in IT performance and business value from IT.


ESSENTIAL DUTIES & REPONSIBILITIES:
The D365 IT Business Analyst will ensure the line of business applications, primarily Dynamics 365 (D365), can sustain current and future business needs for our businesses. This role is responsible for providing D365 technical and functional expertise, ensuring business requirements are gathered and subsequent technical/functional resolutions are implemented appropriately. In addition, the role will ensure efficient and effective business as usual operation of D365, including remediation of issues.

The D365 IT Business Analyst understands both technology as well as business and is responsible to capture all business requirements in order to ensure proper IT solutions are delivered. The key focus is mapping functional requirements of the Finance & Supply Chain modules in D365, data and processes.
Key Accountabilities
Serves as liaison to business and IT teams to understand business requirements and create and implement solutions as well as understanding root causes of current issues.
Assembling business requirements with requisite analysis and translation into D365 solutions; along with alternative options and recommendations.
Supports designing business solutions that ensure alignment with the architecture principles and standards.
Documents and provides training for newly implemented systems and/or processes using Click Learn
Resolving incidents/issues, with root cause analysis and fix where appropriate, for D365 applications.
Applying functional and technical understanding of D365 to develop new functionality and integrations/interfaces with other systems as required, to support business growth.
Ensuring all aspects of the D365 development lifecycle are completed successfully, incorporating ISV solutions.
Assuring quality of releases (fixes/upgrades/enhancements etc) into production, through thorough testing and first-class environment management.
Ensuring vendor relationships remain transparent and with clearly understood outcomes
Supports Business Information Managers, Project Managers and Solution Architects in writing program / project proposals
Work with business end users to ensure the project meets business needs
Assumes ownership of the process, system, and expands skill base.
Interacts frequently with business process owners.
Conduct unit testing for project deliverables and facilitate user acceptance testing
Engage in efforts to establish scope and business case for new programs and initiatives.
Collaborate with team members to collect and analyse data
Qualifications:

OVERVIEW & SCOPE OF ROLE:

Morgan IT is on a mission to enable and drive the Morgan goals by being a valuable business partner to all Global Business Units and Functions by:

Running Effective and Efficient IT
Delivering Solid Business Foundations
Extracting Maximum Business Value from IT
Driving disruptive innovation

To do so, the OneIT team is currently executing on a strategic roadmap to make significant step changes in IT performance and business value from IT.


ESSENTIAL DUTIES & REPONSIBILITIES:
The D365 IT Business Analyst will ensure the line of business applications, primarily Dynamics 365 (D365), can sustain current and future business needs for our businesses. This role is responsible for providing D365 technical and functional expertise, ensuring business requirements are gathered and subsequent technical/functional resolutions are implemented appropriately. In addition, the role will ensure efficient and effective business as usual operation of D365, including remediation of issues.

The D365 IT Business Analyst understands both technology as well as business and is responsible to capture all business requirements in order to ensure proper IT solutions are delivered. The key focus is mapping functional requirements of the Finance & Supply Chain modules in D365, data and processes.
Key Accountabilities
Serves as liaison to business and IT teams to understand business requirements and create and implement solutions as well as understanding root causes of current issues.
Assembling business requirements with requisite analysis and translation into D365 solutions; along with alternative options and recommendations.
Supports designing business solutions that ensure alignment with the architecture principles and standards.
Documents and provides training for newly implemented systems and/or processes using Click Learn
Resolving incidents/issues, with root cause analysis and fix where appropriate, for D365 applications.
Applying functional and technical understanding of D365 to develop new functionality and integrations/interfaces with other systems as required, to support business growth.
Ensuring all aspects of the D365 development lifecycle are completed successfully, incorporating ISV solutions.
Assuring quality of releases (fixes/upgrades/enhancements etc) into production, through thorough testing and first-class environment management.
Ensuring vendor relationships remain transparent and with clearly understood outcomes
Supports Business Information Managers, Project Managers and Solution Architects in writing program / project proposals
Work with business end users to ensure the project meets business needs
Assumes ownership of the process, system, and expands skill base.
Interacts frequently with business process owners.
Conduct unit testing for project deliverables and facilitate user acceptance testing
Engage in efforts to establish scope and business case for new programs and initiatives.
Collaborate with team members to collect and analyse data


Morgan Advanced Materials is an EEO/AA/M/W/D/V Employer Ind-1",1856,Metal & Mineral Manufacturing,$1 to $5 billion (USD),Manufacturing,5001 to 10000 Employees,Company - Public,False
Business Analyst - Remote,"Highlight Technologies
",United States,-1,4.5,"Overview:
We are looking for a Business Analyst to provide cross team support for five of eight teams on the USCIS SPEED contract.
Responsibilities:
Participate and provide admin support for daily, weekly, monthly agile ceremonies including standups, retrospectives, demos, etc.
Develop documentation, requirements/user stories, process diagrams and test cases.
Write reqirements for the developers and then support the team's dedicated testers to ensure that what is produced matches those specifications.
Provide production support as needed.
Provide administrative support for deployments.
Qualifications:
US Citizenship required.
Ability to receive DHS EOD Required.
Must possess strong verbal and written communication experience.
Ability to work in a high-speed delivery focused environment.
Ability to work in a fully remote environment and maintain delivery tempo.
Must possess an in-depth knowledge of agile implementation and test driven development.
Understanding of DevSecOps tools, principles and execution.
Experience with Agile tools like GitHub, Confluence, Jira, etc.
SAFe Agile or other Agile Certification are a plus.
About Highlight:
For over ten years, Highlight has provided Development and Modernization, Secure IT, and Mission Solution services to our federal government customers. Our team knows the technology; we understand how our customers and their stakeholders work; and we know how to implement industry best practices to deliver high-quality, end-to-end solutions that minimize risk and maximize results.

Since our inception, Highlight has had an employee-first mindset. Our mission is to provide employees with rewarding and impactful career opportunities. In 2021, Highlight’s founder and CEO, Rebecca Andino, implemented an Employee Stock Ownership Plan to embody and expand our culture of transparency, teamwork and rewarding the work of our employees. By becoming an ESOP, our employee-owners share in the success of the company through their ownership stake. To learn more about ESOPS, check out: www.esopinfo.org.

We’re an Equal Opportunity Employer (EOE) that empowers our people to fearlessly drive change - regardless of their race, color, religion, sex, gender identity, sexual orientation, national origin, disability, veteran status, or other characteristics. Our team is dedicated to foster diversity within our teams to promote creativity, innovation, and teamwork to deliver the best solutions for our customers.
-:
#nwhp",2008,Information Technology Support Services,$5 to $25 million (USD),Information Technology,201 to 500 Employees,Company - Private,False
Pharmacy Data Analyst,"The Health Plan of West Virginia Inc
","Wheeling, WV",$48K - $70K (Glassdoor est.),3.5,"This position is possible remote. Candidates will be considered based on their qualifications and the candidate’s ability to work from an approved work location. Although the location is flexible, THP does not have a presence in all states and localities. The following locations are currently approved for this position: AL, FL, NC, OH, PA, TN, TX, WV. THP will consider qualified candidates who are willing to relocate to an approved work location, at the candidate’s expense, provided the relocation can be completed within a timeframe that meets THP’s staffing needs.


The Pharmacy Data Analyst will help the operation of Pharmacy Services run more effectively and efficiently through analyzing data from multiple sources (e.g., Express Scripts, Databytes, Ipro) as well as extract trends and business insights to improve health and financial outcomes of The Health Plan's population. The Pharmacy Data Analyst will also assist the unit with the plan benefit management and coding of multiple lines of business (Commercial, Exchange, Medicaid, and Medicare) within the pharmacy benefit adjudication platform.

Required:

Must possess a bachelor’s or master’s degree related to data analytics or at least one year experience in pharmacy and medical claim data reporting.
Proficient Microsoft Excel skills, including pivot tables, graphing, and complex formulas.
Experience in data collection, analysis, and visualization methods.
Must possess a working knowledge of quality improvement principles, theory, study design and statistical modeling.
Flexible and able to multi-task, work in a fast-paced environment and adapt to changing processes.
Self-motivated and goal oriented.
Ability to work effectively as part of a team and independently.
Proficient keyboarding skills and computer literacy with the ability to navigate through multiple systems.
Ability to exercise independent and sound judgment in decision making, utilizing all relevant information and data.

Desired:

Excellent oral, written, telephonic and interpersonal skills, balancing an independent and team working environment.
Working knowledge of the PBM industry and pharmacy benefit claims.
Certified Pharmacy Technician (CPhT)
Experience creating automated reports, self-service tools and integrating multiple data inputs into a single dashboard (PowerBI).
Skilled with mathematic problem solving and graphing.
Intermediate to proficient skills working with SQL to extract data.
Previous experience working in PBM environment, health plan, or managed care service organization.

Responsibilities:

Integrate data from multiple sources to produce requested or required data elements which support continuous quality improvement leading to actionable information.
Assist pharmacy team members with complex, detailed data needed projects.
Interpret, analyze, and provide recommendations regarding data accuracy and data collection needs and processes.
Research and identify data quality issues and work with internal and external partners to create a resolution.
Work with business unit(s) to identify opportunities to enhance existing processes and to develop new data information processes and tools. Continuously assess and improve data collection and reporting processes.
Interfacing with, gathering information from, and preparing data for presentations to various levels of management, committees, internal and external.
Work with designated department to assess, define, and develop report deliverables to meet internal and customer requirements.
Reconcile daily eligibility file report with PBM and ensure that the eligibility reporting procedure aligns with HEDIS measures.
Understand and calculate client drug price guarantees, admin fees, rebates and other terms related to pharmacy client and vendor contracts.
Review files received for PBM compliance with data needs, assist with the development of reports, testing files and configuring data in mapping tool.
Create and maintain the pharmacy executive management funds dashboard (drug spends, rebates, savings, PMF, etc.)
Assist with auditing the PBM plan benefit coding and plan materials to ensure pharmacy benefits reflect the intent and/or client expectations.
Assist in submitting and updating benefit material for internal and external teams, such as customer service applications.
Assist with creating and recording impact reports from internal audit findings and work with PBM for solutions via corrective action plan.",1979,Insurance Carriers,$100 to $500 million (USD),Insurance,501 to 1000 Employees,Nonprofit Organization,True
Information Data Analyst/ Data Visualization Engineer,"Gazelle Global Consulting
","Dan, WV",$72K (Employer est.),3.8,"IT
CR/072440
Contract

My client is looking for Information Data Analyst/ Data Visualization Engineer and I wanted to know whether this would be of interest to you or not?

Job Title: Information Data Analyst/ Data Visualization Engineer

Job Location : Dan Hag/ Netherlands(And other cities in Netherlands. Associate should be flexible to travel 2-3 days to customer Hague/Rijswijk/Amsterdam office)

Job : Contract (6-12 months)

Hybrid

What’s the role?
As a Senior Data Visualization Engineer on the RAVE team, you are responsible to engage with IT stakeholders and ServiceNow DevOps Reporting Analysts, working in a tight-knit virtual team across the globe and sometimes presenting to various levels in the organization.

You’ll be energized by researching and keeping up with 2 ServiceNow upgrades each year that bring in new technological improvements for you explore & investigate how we can best make use of these in our data visualizations and analytics area. In addition, your role will include:

Manage ad-hoc requests while still delivering on commitments
Support IT on ServiceNow reports and dashboards: train, problem-solve and prepare or build
Ensure ServiceNow report/ dashboard design is visually attractive, easy to use/ navigate & tells a story

What we need from you?
To be able to collaborate and support IT stakeholders across multiple time zones & in all business areas,

Additionally, you will have:

Strong skills and experience in ServiceNow reporting and dashboard creation using industry standard visualizations
Certification in ServiceNow area (preferred: Performance Analytics or System Administrator)
Substantial IT experience and knowledge in one or more process areas: ITSM, ITBM, SecOps, GRC/ IRM, ITOM or Legal
Organized, self-motivated, results-oriented with excellent attention to detail, as accuracy and completeness of a report / dashboard is of key importance
Excellent oral and written presentation and communication skills
Bachelor’s or Master’s degree in IT and/or Management Skills: ServiceNow Performance Analytics and Data Analyst

Must have : ServiceNow Performance Analytics

Job Reference: CR/072440

Salary:

Salary per: Annum

Job Duration: 12months

Job Start Date: ASAP

Job Type: Contract

Job Industry: IT




Contact Name: Sarfaraz Alam
Contact Email: adresponses@gazellegc.com
Contact Tel: +44(0)2035887706",-1,Staffing & Subcontracting,Unknown / Non-Applicable,Human Resources & Staffing,1 to 50 Employees,Company - Private,False
