Job Title,Company Name,Location,Salary Estimate,Rating,Job Description,Founded,Industry,Revenue,Sector,Size,Type,Easy Apply
Data Analyst,"RFA Engineering
","Urbandale, IA",$55K - $75K (Employer est.),3.9,"RFA Engineering (www.rfamec.com) is an engineering service provider dedicated to delivering our clients with timely engineering support and expertise. We are seeking an entry-level to experienced candidate to become an integral part of our engineering team. The selected candidate will work with an experienced engineering staff using state-of-the-art engineering tools & processes. This position will operate onsite at our customer's world-class engineering facility.

This is a full-time position with a full benefit package listed below that includes opportunities for professional growth, direct hire by our customers, and additional opportunities within our own organization.

Data Analyst

Responsibilities:

Work with product teams to understand additional data requirements, and/or augment existing data fields.
Use data mapping tools to migrate project information and workflow planning data from Rally to Azure Dev Ops.
Verify mapping in a sandbox environment.
Execute migration projects for multiple product teams.

Requirements:

General Knowledge of Data Analytics, including data types.
Strong verbal and written communication skills
Willingness to adapt to a wide variety of technologies and architectures
Self-motivated, quick learner, with an any-problem-can-be-solved attitude
Associates degree or higher in Management Information Systems, Information Technology, Computer Science, Software, Computer Engineering, or related field.

Desired Experience:

Knowledge or experience working with databases and/or bridging tools such as Tasktop, ConnectALL or Ops Hub.
Experience work with large data sets, or migrating data between systems.
Previous experience working with Azure cloud tools.

Visa Sponsorship is NOT available for this position.

Pay Range: $55,000 - $75,000 - Commensurate with experience.

About RFA Engineering

RFA Engineering has provided product development and engineering service to industry leading customers since 1943. Our primary focus is the development of off highway equipment including agricultural, construction, mining, recreational, industrial, and special machines. Our work includes concept development, product design, documentation, problem solving, simulation, optimization, and testing of components, systems and complete machines. Our engineering staff is located at our Engineering Center in Minneapolis, branch office in Dubuque, IA, and at Numerous customer sites throughout the U.S.

Competitive Benefits

Health and Dental Insurance
TelaDoc Healthiest You
Supplemental vision Insurance
Company Paid Life Insurance
Company Paid Long-Term Disability
Sort-term Disability
Retirement Savings Account (Traditional 401k & Roth 401k)
Flexible Spending Plan Dependent Care
HSA for Medical Expenses
Bonus Plan (Exempt Employees Only)
Paid Holidays
Bereavement leave
Employee Assistance programs (EAP)
Education Assistance

Equal Opportunity and Veteran Friendly

Education
Required
Bachelors of Science or better in Engineering
Skills
Required
Soft Skills Communication
Data Analytics
Behaviors
Preferred
Innovative: Consistently introduces new ideas and demonstrates original thinking
Detail Oriented: Capable of carrying out a given task with all details necessary to get the task done well
Team Player: Works well as a member of a group",1967,Architectural & Engineering Services,$5 to $25 million (USD),"Construction, Repair & Maintenance Services",201 to 500 Employees,Company - Private,True
Sr. SAS Data Analyst,"Pioneer Consulting Services
","West Des Moines, IA",$76K - $105K (Glassdoor est.),4.6,"Write code using SAS Macros and other SAS procedures for programming analysis; Perform data analysis, statistical analysis using SAS tools such as SAS Graphs, SAS Reporting/ODS; Generate tables and listing for Ad-hoc requests and output files in PDF, RTF and HTML format using SAS/ODS; Write specifications for both SDTM and ADAM using CDISC standards; Involve in data merging, data validation, data manipulation, data processing and cleaning; Create sort merge and concatenate datasets using SAS and SQL. Skills: SAS Base, SAS Macros, SAS/Access, SAS/Stat, SAS/Graph, SAS/ODS, SAS/SQL, SAS/Report procedures, Double programming and QC check.

Master’s deg + 1 Yr. Exp. M-F, 9:am to 5pm

Send Resume: Pioneer Consulting Services, LLC., 1200 Valley West Drive, Suite 701, West Des Moines, IA 50266.",-1,Information Technology Support Services,$1 to $5 million (USD),Information Technology,1 to 50 Employees,Company - Private,False
Data Analyst/Business Analyst,acs-team,"Des Moines, IA",$50.00 - $70.00 Per Hour (Employer est.),-1.0,"American Computer Services, Inc. is seeking a Technical Data Analyst / Business Analyst with a minimum of 8 years’ experience. This role is within a data management team so focus will be heavy on data and working within a large, complex data warehouse environment. The successful candidate will have a strong background in Software Development Life Cycle (SDLC) methodologies and Agile frameworks such as Scrum and Kanban. Experience with project management tools like Azure DevOps or JIRA is highly desirable. You will work closely with cross-functional teams to ensure successful project delivery and alignment with the organization's strategic objectives.

The position is HYBRID.

Candidate must be local to Des Moines, IA OR residing within 4 hours of Des Moines and willing to relocate.

To Be Successful:

Consult with business and development staff to define business and data requirements, coordinate testing and validate data from legacy system and/or target solution.
Conduct interviews and group requirement sessions to define requirements, identify gaps and analyze process needs.
Participate in gap analysis sessions, articulating and/or documenting business needs clearly and accurately to vendor teams.
Coordinate test efforts with UI SMEs, prepare test cases as necessary, document test results and articulate to vendor teams.
Lead requirement and testing sessions, ensuring business needs are captured and system features comply with technical specifications.
Proficient at communicating complex concepts to technical and non-technical staff at all levels of responsibility.

Data Analyst Skills:

Familiarity with advanced information management practices, data modeling standards, and/or architecture design and analysis.
Working experience with Microsoft SQL Server Management Studio or other relational database software.
Analyze/define data mapping requirements from one or more data sources to target.
During data migration, facilitate, analyze and document data validation.
Experience using SQL to extract data and analyze for problem resolution or testing purposes.
Familiarity with data warehousing concepts, data marts, data dictionaries, metadata.

Day to Day Responsibilities:

Collaborate with stakeholders to gather, analyze, and document business requirements for new software initiatives or enhancements to existing applications.
Act as a liaison between business units, development teams, and management, to ensure seamless communication and project execution.
Develop a deep understanding of Client business processes, applications, and systems to facilitate the implementation of effective solutions.
Create and maintain project artifacts such as business requirement documents, user stories, use cases, workflow diagrams, and test plans.
Participate in Agile ceremonies, including sprint planning, daily stand-ups, sprint reviews, and retrospectives, to ensure continuous improvement in project delivery.
Utilize project management tools such as Azure DevOps, Microsoft Project, and Power BI to create user stories, track and monitor project progress, manage tasks, and report on project status to stakeholders.
Assist in the development and implementation of user acceptance testing (UAT) strategies, ensuring that solutions meet business requirements and expectations.
Support change management efforts by facilitating user demos/training, documenting processes, and providing guidance on the adoption of new processes, systems, and features.
Continuously identify opportunities for process improvements and provide recommendations for enhancing efficiency and effectiveness.

Qualifications:

Familiarity with state government operations and processes is a large plus.
Business Analyst (CBAP) certification a plus.
Minimum 8 years’ experience in Data Analyst or Business Analyst role.
Proficient in Jira and other collaboration tools.
Bachelor's degree in Business Administration, Information Technology, Computer Science, or a related field, and/or a combination of education/certification and work experience.
Experience participating in data migration, system modernization, or vendor-managed solution development projects.
Ability to analyze business strategies and user needs, document specifications, and translate business objectives into proper system requirements and specifications.
Working knowledge of Agile frameworks such as Scrum and Kanban, and familiarity with Agile project management tools like Azure DevOps or JIRA.
Proficient in Microsoft Office Suite including Excel, Word, PowerPoint, Project, and Visio.
Excellent communication and interpersonal skills, with the ability to work effectively with diverse teams and stakeholders at various levels of the organization.
Guide stakeholders through business case development for new applications/functionality, including cost benefit analysis, risks and issues, and impact analysis.
Strong analytical and problem-solving skills, with a keen attention to detail.
Demonstrated ability to balance multiple priorities and manage time effectively in a fast-paced environment.

Job Types: Contract, Full-time

Pay: $50.00 - $70.00 per hour

Benefits:

401(k)
Dental insurance
Health insurance
Health savings account
Life insurance

Experience level:

8 years

Schedule:

Monday to Friday

Application Question(s):

What is your current location?

Experience:

Agile: 5 years (Preferred)
Jira: 3 years (Preferred)
Data warehouse: 3 years (Preferred)
Data Mapping: 1 year (Preferred)
Data modeling: 1 year (Preferred)
SQL: 1 year (Preferred)
Business Analyst: 4 years (Required)
Data Analysis: 4 years (Required)

Work Location: In person",-1,-1,Unknown / Non-Applicable,-1,1 to 50 Employees,Company - Public,True
Worldwide M3 ERP Business Analyst,"Kemin
","Des Moines, IA",$74K - $108K (Glassdoor est.),3.9,"Overview:
As a member of the M3 Business Process Team, the Global ERP Business Analyst-COM, F&S is the owner of the ERP system for the Customer Order Management, Fulfillment and Sales domain. Working closely with Business Process Managers to understand business needs and translate into functional specifications that result in optimal solutions. You act as a domain solution architect and are both an M3 subject matter expert and a business oriented client advocate. You are a servant leader, who can lead without authority and negotiate effectively to arrive at the optimum solution.

This is a remote role, 100% work from home.

We Are Kemin

We are visionaries who see things differently and are inspired by the world around us.

We have been dedicated to using applied science to improve the quality of life for over half a century.

We are a global ingredient manufacturer that strives to sustainably transform the quality of life every day for 80 percent of the world with its products and services.

For over half a century, Kemin has been dedicated to using applied science to address industry challenges and offer product solutions to customers in more than 120 countries. Kemin provides ingredients to feed a growing population with its commitment to the quality, safety and efficacy of food, feed and health-related products to customers in more than 120 countries.

Established in 1961, Kemin is a privately held, family-owned-and-operated company with more than 2,800 global employees and operations in 90 countries, including manufacturing facilities in Belgium, Brazil, China, India, Italy, Russia, San Marino, Singapore, South Africa and the United States.

As a Kemin team member, you’ll receive…

A competitive financial package- in addition to your salary, we offer an uncapped bonus opportunity, 401k match program, and paid vacation and holidays.
Robust health and wellness support- we are proud to offer a fitness reimbursement (for your whole family!), an on-site fitness center, restaurant with seasonal fresh food options (and the ability to order food to bring home), and free fresh fruit in break areas- to name a few.
Continued learning opportunities- Kemin offers tuition reimbursement and recently launched a new corporate university with online and in-person training opportunities for growth and development throughout your entire career.
The chance to give back to our world- Through our foundation of servant leadership, we are proud to offer ample service opportunities, including paid time off to do so. Kemin has a valued corporate partnership with both The World Food Program and Habitat for Humanity, in addition to many local initiatives.
Opportunities to support our valued educators- Kemin is a proud sponsor of the Iowa Governor's Stem Advisory Council where we fund annual teacher's awards. In addition, we have a robust internship and externship program, and frequently host student tours.


Responsibilities:
Subject matter expert and system owner for (Customer order Management, Fulfillment and Sales (COM, F&S)
Maintain system configuration documentation for COM, F&S domain
Lead the business to optimum solutions by understanding business needs, translating to requirements, documenting use cases, identifying solution, creating functional specifications, consulting with technical architects, creating test cases and plans, executing unit testing, ensuring solution meets or exceeds business need, delivering solution with documentation and training, overseeing UAT and issue resolution, communicating with stakeholders
May work with Kemin DevOps team on collaborative solutions in an Agile methodology
Documenting and Auditing M3 Standard Usage
Consult with support colleagues with a sense of urgency that matches to incident priority resulting in timely, effective incident resolution
Consult with other IT colleagues on projects, requests, incidents where domain knowledge is needed.
Consult with M3 Business Process Team Manager on strategic direction for COM, F&S domain
Adhere to all security, change control and data governance policies, procedures and processes with a sense of priority
Qualifications:
Bachelor’s Degree with 5+ years of experience as a Infor-M3 ERP Business Analyst with at least one year of experience in M3 cloud
Must be a life long learner, who is excited to expand their M3 knowledge into other functional domains
Excellent documentation and communication skills (written and verbal)
Excellent problem-solving skills
Understanding of the complexity of a global multi-site company is a plus
Ability to learn and adopt quickly
Timely response to requests and communications
Excellent customer service, interpersonal, and phone skills.

Kemin is an equal opportunity employer, and all reasonable accommodation will be considered.

A post-offer background check and drug screen is required. Additional pre-employment requirements may be necessary based on position.

#LI-SJ1",1961,Biotech & Pharmaceuticals,$500 million to $1 billion (USD),Pharmaceutical & Biotechnology,1001 to 5000 Employees,Company - Private,False
Data Analyst - Procurement Services,"Wellmark, Inc.
","Des Moines, IA",$57K - $78K (Glassdoor est.),3.8,"Company Description


Why Wellmark: We are a mutual insurance company owned by our policy holders across Iowa and South Dakota, and we’ve built our reputation on over 80 years’ worth of trust. We are not motivated by profits. We are motivated by the well-being of our friends, family, and neighbors–our members. If you’re passionate about joining an organization working hard to put its members first, to provide best-in-class service, and one that is committed to sustainability and innovation, consider applying today!

Learn more about our unique benefit offerings here.

Want to know more? You can learn about life at Wellmark here.



Job Description


Use your strengths as a Procurement Services Data Analyst at Wellmark!

About the Role: Reporting to the Director of Strategic Sourcing, you will serve as the systems and vendor liaison between the Procurement Services team and other business functions across Wellmark. Using PowerBI, you will be responsible for pulling and analyzing data from dashboards, presenting findings to internal stakeholders through data visualization, as well as negotiating low dollar value purchases and assisting in purchase order processing in Workday Financials. You will be responsible for system administration and identifying efficiencies and automations to assist with process improvements. In addition, you will take point on researching industry benchmarks to support Procurement Services innovations.

About You: You are a technically strong, self-starter who is intrinsically motivated to ‘dig deep’ to find creative ways to solve problems. You enjoy working autonomously, while also regularly collaborating with your team and other departments to meet business goals. For you, the status quo is something to be challenged in order to find improved, innovative ways of working. You enjoy continuous learning and being the “go-to” for others within the organization. You thrive on building and maintaining relationships, and partnering with your team and others to improve outcomes. You like making an impact and influencing change. You are skilled in data analytics and visualization to drive recommendations and generate new ideas.

Top candidates will have PowerBI experience.



Qualifications


Required:

Associate's degree in related field or direct and applicable work experience.
Minimum 1 year business analysis or related experience, including analyzing and interpreting data and providing accurate reports.
Demonstrated experience using Microsoft Office Suite, specifically Excel, including the use of spreadsheets, presentation, and word processing software.
Strong technical skills with the ability to learn new systems quickly.
Strong organizational skills, with the ability to manage the details of many projects simultaneously.
Strong analytical skills, with demonstrated ability to analyze processes, workflows, and dashboards.
Ability to problem solve and recommend improvements.
Ability to read and understand data models and give input to data modeling based on data analysis results.
Experience working with and ability to actively protect confidential information and data.
Ability to work with and coordinate with vendors which may include conference call meetings, discussions, and presentations
Strong interpersonal skills with a collaborative approach and with the ability to partner with different business and technical areas of the company.
Demonstrated ability to work under pressure and meet timelines and accuracy guidelines. Flexible and adaptable to change
Demonstrated ability to communicate effectively, verbally, and in writing, expressing complex concepts clearly and concisely. Problem solving/troubleshooting and continuous process improvement skills.
Ability to train others on process steps, tool ability, etc. (i.e., train the team on any new processes created, new releases, training vendors, etc.)

Preferred:

Knowledge of how to effectively utilize PowerBI.

Additional Information


a. Provide coordination and support for the procurement services team including maintaining accuracy of reports, data, testing, event/questionnaire building and the administration for all procurement services tools.

b. Serve as the procurement services Workday Strategic Sourcing (WSS) and Financials solution administrator including the assignment of system access, role access and provides customer service for both internal and external stakeholders. Serve as the liaison for vendors regarding any procurement tool questions, access issues, etc. Responsibility to train internal and external stakeholders for the WSS including the development of materials, communication plan, and executing training.

c. Build, maintain and compile dashboard data, including customer service surveys and executive reports. Provide summation of detailed performance data, savings information, and any additional key reporting elements in an executive summary. Develop simple, dependable automated reports and dashboards to surface key metrics that deliver information that is digestible and visually appealing. Support ad-hoc reporting needs to internal stakeholders. Determine data retention policies, data collection methodologies, and data modeling techniques for Procurement data. This includes designing data manipulation to achieve desirable results.

d. Apply business data subject matter expertise to data decisions that are made during the development of projects, business process, systems, and data integrity with dashboards.

e. Collate data analysis in a meaningful way and present findings to peers, project core team, and stakeholders.

f. Collaborate with external third-party vendors on the definition, design, and implementation of data extracts to meet business needs, provide data expertise (customer service) and maintenance of ongoing extracts, including changes and testing based on third party vendor’s needs.

g. Assist with coordination and work assignments to procurement services team members based on skill set or divisional alignment, and resource capacity for requests. Provide stakeholders with timely and accurate updates related to inquiries received by phone, e-mail, or direct interaction; may require research to resolve the inquiry. Take initiative to review, analyze, and act on Procurement Services Requests that qualify for purchase via the requestor.

h. Serve as administrator for Workday Financials including Vendor supplier portal, setting up users, modifying the business process and assisting with new releases by understanding impacts to current processes.

i. Provide research for new vendors, categories, spend information, industry best practices and other items needed for strategic sourcing events.

j. Create, update, and maintain documentation and procedures for sourcing, analyzing, and preparing internal reporting and presentations. Ensure the highest quality and integrity of data sources.

k. Responsible for collecting and analyzing procurement data for business insights and effective decision-making across all teams in procurement. Will utilize data to assist in the SLM (sourcing lifecycle management) program, provide analytics to senior leaders, analyze benchmarks in the industry and other areas to improve Wellmark’s overall team.

l. Provide support to the sourcing team with the end-to end RFP process, including setting up templates, provisioning language in the tool, providing training, and supporting vendors with questions.

m. Provide procurement innovation through automating all processes, making improvements, and helping the team become more agile.

n. Serve as a back-up for the creation of purchase orders including getting competitive quotes from vendors and will negotiate contract terms to meet contract requirements, if necessary. May review and analyze pricing information to ensure accuracy. May process requests for any change orders and activities on purchase orders.

o. Design and maintain department tools and the procurement services intranet page. Provide administrative support to resolve and monitor any production issues. Serve as the primary resource for stakeholders and team members regarding system utilization and processes. Responsible for troubleshooting Procurement tools/software and taking corrective action.

p. Continuously review and scrutinize processes within procurement services and look for ways to better serve the business and reduce cycle times. Partner with leadership and business stakeholders to share ideas to implement changes. Assist in the creation and maintenance of department project plans and processes.

q. Serves as the relationship manager between Workday and Wellmark for all procurement tools and will escalate issues to leadership when appropriate.

r. Provide support and input on the department business continuity/disaster recovery plan procedures. Update all department procedures in the Wellmark BC/DR system on a timely basis.

s. Other duties as assigned.

An Equal Opportunity Employer

The policy of Wellmark Blue Cross Blue Shield is to recruit, hire, train and promote individuals in all job classifications without regard to race, color, religion, sex, national origin, age, veteran status, disability, sexual orientation, gender identity or any other characteristic protected by law.

Applicants requiring a reasonable accommodation due to a disability at any stage of the employment application process should contact us at careers@wellmark.com",1939,Insurance Carriers,$1 to $5 billion (USD),Insurance,1001 to 5000 Employees,Nonprofit Organization,True
