Job Title,Company Name,Location,Salary Estimate,Rating,Job Description,Founded,Industry,Revenue,Sector,Size,Type,Easy Apply
"IT Sr Technical Specialist, Analytics Analyst","Labcorp
","Tulsa, OK",$61K - $91K (Glassdoor est.),3.6,"Labcorp is a leading global life sciences company that provides comprehensive diagnostic and drug development services to patients, physicians, and healthcare organizations. Our mission is to improve health and improve lives by delivering world-class diagnostic solutions, drug development services, and technologies to advance medicine and improve patient care.
IT Sr Technical Specialist, Analytics Analyst

Labcorp IT seeks an experienced IT professional for the role of IT Sr Technical Specialist, Analytics Analyst. will be part of a newly formed division supporting laboratory partnerships and acquisitions and will collaborate with IT, vendor, business, laboratory operations, and partnership stakeholders to ensure successful LIS implementations. The IT Sr Technical Specialist will demonstrate a working knowledge of the Cerner Millennium Analytics and Lights On Modules, Laboratory operations and the ability to learn complex processes and technology quickly.

Responsibilities:

Serves as a member of the broader LIS implementation team and collaborates in accomplishing defined strategic LIS initiatives for the Health System Operating Division.
Contributes to the development of the overall IT strategy for LIS implementation; develops repeatable implementation processes for assigned laboratory initiatives.
Prepares and leads meetings at an appropriate cadence; uses excellent verbal and written communication.
Partners with operations leaders to identify site-specific requirements that impact the deployment strategy.
Leads current state review and assesses current processes and workflows within the labs for any scope gaps or potential risks or issues.
Leads future state review to demo all workflows.
Assists with decision making and completes the Data Collection Workbooks to capture data for LIS configuration.
Plans and manages the configuration of the solution into the system.
Raises integration points with workstreams where there is crossover with other workstreams.
Applies technical expertise to build design, configuration, and execution.
Documents lessons learned to ensure ongoing success with future initiatives.
Fosters a collaborative environment by establishing a team atmosphere of candor, trust, and mutual respect.
Supports the laboratories through cutover and transition to support.

Education and Qualifications:

A BA (Bachelor of Arts) or BS (Bachelor of Science) degree is required.
5+ years of IT experience including extensive Cerner Millennium Analytics build experience including Data Analytics 2, CCL and Lights On. Implementation experience for multi facility projects is strongly recommended.
Laboratory clinical experience is recommended.
A solid understanding of the Laboratory industry and Laboratory workflows and how the LIS impacts and is impacted by surround technologies to include Revenue Cycle, Electronic Health Records, etc.
Critical thinking skills and the ability to translate abstract information into a consumable format.

Labcorp is proud to be an Equal Opportunity Employer:

As an EOE/AA employer, Labcorp strives for diversity and inclusion in the workforce and does not tolerate harassment or discrimination of any kind. We make employment decisions based on the needs of our business and the qualifications of the individual and do not discriminate based upon race, religion, color, national origin, gender (including pregnancy or other medical conditions/needs), family or parental status, marital, civil union or domestic partnership status, sexual orientation, gender identity, gender expression, personal appearance, age, veteran status, disability, genetic information, or any other legally protected characteristic. We encourage all to apply.

For more information about how we collect and store your personal data, please see our Privacy Statement.",1978,Health Care Services & Hospitals,$10+ billion (USD),Healthcare,10000+ Employees,Company - Public,False
Senior Data Analyst,"Global Payments (Beamery)
","Oklahoma City, OK",$74K - $105K (Glassdoor est.),3.5,"Description

The Senior Data Analyst will be primarily responsible for supporting the leaders of Heartland’s Operations teams with business process improvement, data analysis, and developing business intelligence (BI) tools. The Senior Data Analyst will work to gather, analyze, and translate data that has been collected regarding Heartland’s initiatives and production into a format to enable better business decisions.

Primary Responsibilities/Objectives:

Coordinate with leadership team to identify critical data to capture and report on

Consolidate and summarize data for business decision making and continuous improvements

Create graphical representations of data/analysis for easy consumption

Perform statistical analysis (correlation, regression, or time series analysis)

Inspect and cleanse data for accuracy and quality

Some data ETL/ELT responsibilities as needed

Other responsibilities as assigned

Core Competencies:

Strong understanding of reporting requirements and structural hierarchies for reporting in a collaborative environment. Query, analyze and transform complex data sets to optimize dashboard flexibility and performance.

Rationalize and identify use cases for developing data visualization, including identifying different personas for each use case.

The Senior Data Analyst will work with large amounts of data: facts, figures, and number crunching. The candidate will need to see through the data and analyze it to find conclusions. One needs to be strong in logic and mathematics.

Communication Skills: Senior Data Analyst will be expected to present their findings or translate the data into an understandable document. This candidate will need to write and speak clearly, easily communicating complex ideas. Needs to possess the ability to work in a team environment as well as individually.

Critical Thinking: Senior Data Analyst must look at the numbers, trends, and data and come to conclusions based on the findings.

Presentation Skills: Ability to organize data and supporting information into visual representations that allow consumers to easily dissect and make decisions based on data provided.

Attention to Detail: Data is precise. Data analysts have to make sure they are vigilant in their analysis to come to correct conclusions. Must make every effort not to only meet but also preempt customer needs.

Strong experience with hands-on building and deploying Tableau, Qlik, PowerBI or Spotfire data visualizations and dashboards

Strong understanding of data visualization concepts. Thoughtfully connects these concept business metrics and KPIs to achieve business goals.

Experience in relational database concepts with a solid knowledge of SQL Server

Google Suite Products: Advanced level with Google Sheets, Google Slides, and Google Docs

Education/Experience:

Position requires knowledge typically associated with a Bachelor’s Degree in Computer Science, MIS, Economics, Business, Mathematics, Statistics, related technical field, or equivalent work experience.

6+ years of applicable experience as a Data Analyst or similar role

Advanced Tableau experience building robust dashboards

Understanding of the Bankcard Industry or Commission Based Sales is a plus.



Preferred Qualities:

Motivated self-starter

Detail oriented

Cautious

Consistent

Tenacious

Ability to manage a project



Heartland Qualities:

Uncompromising honesty

Approachable and willing to offer helpful solutions

Ability to search relentlessly for better solutions

Must handle constructive feedback well",1967,Financial Transaction Processing,$5 to $10 billion (USD),Financial Services,10000+ Employees,Company - Public,False
Geospatial Health Data Analyst,"The State of Oklahoma
",United States,$84K (Employer est.),3.6,"Job Posting Title
Geospatial Health Data Analyst
Agency
340 OKLAHOMA STATE DEPARTMENT OF HEALTH
Supervisory Organization
340 Center for Health Statistics
Job Posting End Date (Continuous if Blank)
Note: Applications will be accepted until 11:59 PM on the day prior to the posting end date above.
Estimated Appointment End Date (Continuous if Blank)
Full/Part-Time
Full time
Job Type
Regular
Compensation
The annual salary is up to $83,600.00 based on education and experience.
Job Description
Location: 123 Robert S Kerr OKC, OK 73012
Salary: $83,600
Full Time /Part Time: Full Time
Work Schedule: Monday-Friday
Primary Hours: 8:00 am – 5:00 pm
Why you’ll love it here!
RESPECT. COLLABORATION. SERVICE. The Oklahoma State Department of Health (OSDH) is committed to leading Oklahoma to prosperity through health. Our mission is to protect and promote health, prevent disease and injury, and cultivate conditions by which Oklahomans can thrive. Check out why were are passionate about public health and believe it is the career for you!!!
What is Public Health?
Oh yeah, did we mention perks? We know that benefits matter and that is why we offer a competitive
benefits package
for all eligible employees.
Generous state paid benefit allowance to help cover insurance premiums.
A wide choice of
insurance plans
with no pre-existing condition exclusions or limitations.
Flexible spending accounts for health care expenses and/or dependent care.
Retirement Savings Plan
with a generous match.
15 days of vacation and 15 days of sick leave the first year for full time employees.
11 paid holidays a year.
Student Loan repayment options & tuition reimbursement.
Employee discounts with a variety of companies and venders.
Longevity Bonus for years of service
Position Description:
The Geospatial Health Data Analyst will primarily be responsible for conducting spatial analyses such as: disease mapping, geographic correlation studies and disease clustering/surveillance. This position would interpret, evaluate and design public health spatial research projects in collaboration with internal and external partners meeting geospatial data needs. The Geospatial Data Analyst will also conduct small-area studies using data sources (BRFSS, Cancer Registry, Vital Statistics, and Hospital Discharge) within Center for Health Statistics, providing stakeholders data visualization on Oklahoma high-need areas. He/she will demonstrate a high proficiency with ArcGIS suite acting as Oklahoma State Department of Health (OSDH) subject matter expert. The position will also be responsible for the development and maintenance of the OSDH geodatabases
Duties:
Duties include, but are not limited to:
Analyze public health and geographical data to aid understanding of complex relationships between environment and health.
Conduct spatial analyses with quality data using ArcGIS software, display data using maps, reports, charts and tables.
Produce data visualizations of spatiotemporal and health services data.
Investigate the environmental, social, and behavioral factors underlying geographic variations in disease rates.
Complete individual GIS mapping projects as required and provide technical support for GIS projects created by end-users at OSDH
Assess, coordinate, and determine GIS needs throughout the agency.
Conduct trainings and resources on GIS to build epidemiologic capacity in mapping and spatial analyses.
Provide technical advice and expertise for the OSDH geospatial database environment including the development and organization of databases, and assessment and implementation of related new technologies.
Develop standards, policies and procedures for ArcGIS use.
Represent OSDH on external committees, work groups, and contribute spatial epidemiologic data to statewide clearinghouse.
Other Duties
Demonstrates knowledge of and supports mission, vision, value statements, standards, policies and procedures, operating instructions, confidentiality standards, and the code of ethical behavior.
Works effectively in team environment, participating and assisting their peers.
Minimum Qualifications: (MUST upload transcripts with application)
Requirements consist of a Master’s degree in Public health (Biostatistics/Epidemiology) or related Master’s level degree and three years of experience in a field involving the use of epidemiological techniques and analysis; or a doctorate in epidemiology and one year of qualifying experience; or 10 years of directly applicable experience. Proficient in ArcGIS software.
Valued Knowledge, skills and abilities
Knowledge of epidemiology methods, environmental analyses interpretation; of statistical analysis, and demography; of epidemiological or statistical software; of social and economic conditions; of current epidemiological developments and techniques; of grant writing. Ability to establish and maintain effective working relationships with others; to meet with the public and conduct public information programs; to write technical and non-technical information material; to use a personal computer and applicable software; to manipulate large databases; and to develop and implement intervention and prevention strategies as identified through data analysis.
Physical Demands and Work Environment:
This position is set in an office environment and computer based. While performing the duties of the job, employees are frequently required to stand, walk, lift, and reach. Applicants must be willing to perform all job-related travel associated with this position.
Telework: This position is Hybrid and is subject to OSDH policy and supervisor’s discretion.
Application Requirements:
If education, certification or licensure is required to meet qualifications, applicants must provide documentation at the time of application.
All applicants are subject to a background check and must be legally authorized to work in the United States without visa sponsorship.
Equal Opportunity Employment
The State of Oklahoma is an equal opportunity employer and does not discriminate on the basis of genetic information, race, religion, color, sex, age, national origin, or disability.
Current State of Oklahoma employees must apply for open positions through their Workday account. Go to Careers app on WD home screen>Click on 'Find Jobs-Internal State of Oklahoma'.",1990,State & Regional Agencies,$10+ billion (USD),Government & Public Administration,10000+ Employees,Government,False
Data/Business Analyst I or II - PRN,"NORTHEASTERN HEALTH SYSTEM
","Tahlequah, OK",$60K - $87K (Glassdoor est.),3.3,"Position Summary

The Decision Support Analyst works with stakeholders throughout the organization to support data and analytics for both clinical and financial departments. The position is responsible for project management, developing and maintaining reports, performing data analysis, providing education and updates to stakeholders, and creating tools to further these activities. The successful candidate will have self-motivation, attention to detail, and a desire to problem-solve and create solutions.

Position Accountabilities

Maintains departmental policies, procedures, objectives, performance improvement programs, safety, and environmental and infection control standards.

Manages and communicates project requirements and functional specifications through collaboration with stakeholders, vendors, and team members.

Designs, develops and maintains reports using various methods and technologies, in solo and team environments.

Validates data for accuracy and relevance.

Provides report training to stakeholders in both classroom and one-on-one environments.

Manages and maintains the servers and systems that are used by Decision Support projects.

Maintains a supportive and productive relationship with the Decision Support staff.

Identifies new analysis opportunities that could contribute to NHS’s mission.

Maintains professional growth and development through activities such as training, workshops, and professional affiliations, to stay up-to-date with best practices and trends in the field of Decision Support and data analytics.

Tracks and documents work using the department’s issue tracking system.

Performs other related duties as assigned or requested.

Level I Requirements

Minimum Education - High school diploma or equivalent

Minimum Experience - One year working with data and reports

Preferred Education - Bachelor’s Degree in Business, Management, Finance, Health Information, Data Science or related area

Preferred Experience - Three years of progressive data analysis and report development; project management; SQL; medical terminology; healthcare experience; understanding of medical billing

Level II Requirements

Minimum Education - Bachelor’s Degree in Business, Management, Finance, Health Information, Data Science or related area or equivalent

work experience

Minimum Experience - Three years of data collection and analysis using Excel, SQL or other ad hoc tools. Sufficient knowledge of data

architecture and management principles. Experience managing projects.

Preferred Education - Bachelor’s or Master’s Degree in Business, Management, Finance, Health Information, Data Science or related area;

certification in data analysis

Preferred Experience - Five years of progressive data analysis and report development; project management; SQL; medical terminology; healthcare experience; understanding of medical billing and revenue cycle

Do you have questions about starting your career with Northeastern Health System? Our healthcare recruiter is available to answer all of your questions related to any position.

Sharee Maggard

918-207-2699 Call or Text

recruiter@nhs-ok.org",-1,Health Care Services & Hospitals,Unknown / Non-Applicable,Healthcare,Unknown,Company - Public,False
Data & Analytics Specialist,"Vesta Realty, LLC
","Tulsa, OK",$62K - $90K (Glassdoor est.),3.4,"Vesta Realty is looking for talented individuals with the drive to succeed and grow with our company. Voted a “Great Place to Work” in 2022, Vesta Realty strives to provide the career growth and professional development opportunities that are vital to the success of our workforce. Since being established in 2017, Vesta has been recognized as one of the Top 50 Multifamily Property Management Firms in the United States. We know that this wouldn’t be possible without the efforts of our diverse team and dynamic leadership. As one of the fastest-growing companies in the multifamily industry, we are excited about the opportunities that await you with the Vesta family.

This is not a remote position. This is an onsite position.",2017,Real Estate,Unknown / Non-Applicable,Real Estate,201 to 500 Employees,Company - Private,False
Data Analyst/Business Intelligence Specialist,Aberdeen Dynamics LLC,"Tulsa, OK",$67K - $95K (Glassdoor est.),-1.0,"Description:

This is not a remote position. The successful candidate for the position of Data Analyst/Business Intelligence Specialist is a professional with technical and analytical skills to evaluate data, collate findings relevant to the business, and share them in a manner that can bring about an effective change in a business. A data analyst/business intelligence specialist suggests measures for corporate development and progress by evaluating complicated datasets of a company. This profession combines a love for statistics and the potential to effectively assist an organization in achieving its business goals.

Requirements:

Safety

Work Environment

The employee will work in an office environment with a business casual dress code.
Personal Protective Equipment (PPE)
Eye protection when in manufacturing areas - Company supplied.
Ability to wear a mask.
Optional - Ear protection when in manufacturing areas – Company supplied.

Physical Demands

The employee will occasionally stoop, kneel, crouch; the employee will regularly stand; walk; use hands, fingers to handle or feel; reach with hands and arms; talk and hear. Must possess good physical dexterity and have the ability to perform manual tasks and body movement.
Specific vision abilities required by this job include close vision; distance vision; peripheral vision; depth perception; ability to adjust visual focus.
This job requires an extensive amount of typing and use of hands.

Tasks

Extract data from ERP and other sources to produce Business Intelligence Reports, Department KPIs and other data related tasks.
Writing SQL queries and views.
Understand VBA or equivalent language.
ERP database maintenance by doing file loads.
Help maintain data security.
Analyze Data for correctness and making those corrections.
Work with users to solve IT related issues such as printer and other minor hardware issues. Resetting of passwords and general problem solving.
Light IT Work - help with printers, installations. Get involved with larger projects when needed. Not afraid to crawl under a desk.
Occasional travel may be required.

Skills and Competencies

Heavy Excel skills – Connect to external tables, Create Pivot tables, Advanced query writing, Formatting, Graphs.
PowerBI, PowerBI Dax, PowerBI Query M
Power Automate
Microsoft Forms
Microsoft Access
Understanding of database structures.
SQL Queries/Statements
Understanding of coding languages.
Excellent communication skills.
A working knowledge of finance.

Knowledge and Education

Require a bachelor’s degree in finance, math, or data science.
English Language",-1,Consumer Product Manufacturing,$25 to $100 million (USD),Manufacturing,51 to 200 Employees,Company - Private,True
