Job Title,Company Name,Location,Salary Estimate,Rating,Job Description,Founded,Industry,Revenue,Sector,Size,Type,Easy Apply
Data Specialist,"Great Plains Tribal Leaders Health Board Inc
","Rapid City, SD",$42K - $60K (Glassdoor est.),3.2,"Job Summary:

The Data Specialist will provide support to the GPTEC Applied Science and Informatics department. The Data Specialist is responsible for the organization and processing of raw data files, contributing to statistical analysis, data mapping and summarizing and preparing reports.

Essential Functions:

Essential duties include but are not limited to:

Completes basic organization and processing of raw data files.
Contributes to basic descriptive statistical analysis of public health data.
Supports the summarizing/preparation of data for reporting.
Contributes to initial data validation, cleaning, and quality review/assurance.
Contributes to the development/adaptation of codebooks, guides, and other documentation to support engagement with and use of data.
Apply a basic knowledge of database infrastructure to contribute to the management of GPTEC/GPTCHB data assets.
Contributes to data mapping and linkage projects/operations.
Inputs data into computer database systems; retrieves, verifies, and corrects information from the computer system.
Gathers or searches for information from various documents; records information; makes adjustments or corrections; compares or verifies information; compiles data from source documents; computes numerical data.
Establishes and maintains files, records, and other information sources related to work; keeps suspense file on recurring and other scheduled requirements for replies and reports.
Inputs data into computer database systems; retrieves, verifies, and corrects information from the computer system.
Provide administrative assistance with participant and training logistics; prepare training agenda and materials.
Perform related duties as assigned.

Professional Behavior

Effectively plan, organize workload and schedule time to meet the demands of the position.
Work in a cooperative and professional manner with OHC and GPTCHB staff.
Treat Great Plains tribes and collaborators with dignity and respect.
Utilize effective verbal and written communication skills.
Advance personal educational development by attending training sessions and seminars as appropriate.
Exemplify excellent customer service with tribal stakeholders, health board colleagues, program partners, service recipients, visitors and guests.
Foster a work environment of wellness, courtesy, friendliness, helpfulness and respect.
Relate well and work collaboratively with coworkers and all levels of staff in a professional manner.
Consistently demonstrate respect for and acceptance of differing capabilities, cultures, gender, age, sexual orientation and/or personalities.
Maintain and ensure organizational privacy and confidentiality.
Handle crisis and tolerate stress professionally.
Be self-directed and take proactive initiative to assist others.
Resolve issues with other departments and coworkers without direct supervision if needed.
Exercise flexibility to alter plans/routines when situations require and continue to perform without projecting stress/frustration that would adversely affect the work environment.
Promote an alcohol, tobacco and drug-free lifestyle.
Embrace modes of appearance and attire that reflect a professional presence.
Adhere to GPTCHB policies and procedures.

Requirements

Knowledge of public health surveillance and epidemiology methods and practices.
Knowledge of data management key concepts and methods.
Knowledge of modern office practices and procedures.
Knowledge of assigned department’s policies and procedures.
Knowledge of HIPAA and other applicable privacy regulations.
Knowledge of computers and job-related software programs.
Ability to work with personal computer and utilize a variety of software applications
Ability and willingness to learn new software programs and researching functional requirements, Microsoft Office, ArcGIS, statistical software e.g. SPSS, SAS.
Ability to communicate clearly and effectively, both orally and in writing, using tact and sensitivity.
Ability to manage multiple demands of the job.
Ability to set and adhere to established deadlines.
Skill in oral and written communication, including public speaking.
Skill in public health research in a clinical, social services or community context.
Skill in interpersonal relations.
Skill in the provision of customer service.
Skill in use of personal computer and a variety of job-related software applications.
Skill in prioritizing and organizing work, and maintenance of files and records.
Skill in the use of such office equipment as a computer, scanner, fax machine, and copier.

Supervisory Controls

The supervisor provides continuing or individual assignments by indicating generally what is to be done, limitations, quality and quantity expected, deadlines, and priority of assignments. When there are new, difficult, or unusual assignments, the supervisor provides additional, specific instructions for including suggested work methods or advice on source material available.

The supervisor reviews finished work to assure methods used are technically accurate and in compliance with instructions or established procedures. Review of the work increases with more difficult assignments if the employee has not previously performed similar assignments.

Guidelines

There are established procedures for doing the work and a number of specific guidelines are available as a resource. Guidelines include GPTCHB and department policies and procedures, HIPPA, individual state Department of Health confidentiality requirements.

The employee must use judgment in interpreting and adapting guidelines, such as agency policies, regulations, precedents, accreditation requirements, advanced clinical protocols, and work directions for application to specific cases or problems. The employee analyzes results and recommends changes.

Complexity/Scope of Work

The work consists of related steps, processes, or methods. Varying data parameters, constantly changing indicators, and changing public health priorities add to the complexity of the position.

The decision regarding what needs to be done involves various choices that require the employee to recognize the existence of and differences among a few easily recognizable situations. Actions to be taken or responses to be made differ in such things as the source of information, the kind of transactions or entries, or other differences of a factual nature.

The work involves the execution of specific rules, regulations, or procedures and typically comprises a complete segment of an assignment or project of broader scope. The work product or service affects the accuracy, reliability, or acceptability of further processes, services, and/or patient care.

Contacts

The personal contacts are with employees throughout the organization and are generally engaged in different functions and kinds of work, and may be representatives from various levels. Other personal contacts at this level include contact with partner organizations, Tribal affiliate organizations, and members of the general public.

The purpose is to obtain, clarify, or give facts or information regardless of the nature of those facts and to provide technical assistance and/or information.

Work Environment/Physical Demands

The work is sedentary. Typically, the employee sits comfortably to do the work. However, there may be some walking; standing; bending; carrying of light items, such as papers, books, or small parts; or driving an automobile. No special physical demands are required to perform the work. The environment involves everyday risks or discomforts that require normal safety precautions typical of such places as offices, meeting and training rooms, libraries, residences, or commercial vehicles, e.g., use of safe work practices with office equipment, avoidance of trips and falls, observance of fire regulations and traffic signals. The work area is adequately lighted, heated, and ventilated.

Reasonable accommodations may be made to enable individuals with disabilities to perform the essential functions.

Supervisory and Management Responsibility

None.

Minimum Qualifications

An associate’s degree and one (1) year of relevant experience in public health or data collection; or, a high school diploma or GED and three (3) years of relevant experience in public health or date collection.
Experience working in public health research in a clinical, social services or community context preferred.
Experience that indicates the ability to interact effectively with leaders among Indian communities, government agencies, scientific and academic communities, medical and health-related organizations, non-governmental groups and the public at large is required.
Possession of or ability to readily obtain a valid driver’s license issued by the State of South Dakota with a clean driving record.
Must successfully pass a criminal and background check and a pre-employment drug screen.


The GPTCHB is a tribal organization which follows tribal preference laws. It is our policy to give preference to qualified Indian/Tribal candidates over qualified non-native candidates in hiring decisions, if all other qualifications are equal.

Employment is contingent upon the outcome of all required criminal background checks.",1986,Municipal Agencies,Unknown / Non-Applicable,Government & Public Administration,201 to 500 Employees,Nonprofit Organization,True
Systems Analyst (Data Analytics),"Contact Government Services, LLC
","Pierre, SD",$67K - $98K (Glassdoor est.),4.7,"Systems Analyst (Data Analytics)
Employment Type: Full-Time, Mid-Level
Department: Information Technology

As a CGS Systems Analyst, you will be doing the work of setting up Oracle databases in a UNIX environment, including designing, implementing, troubleshooting, populating, maintaining, documenting, and training users on such systems. Other systems environments and specific project requirements will call for other specific sets of technical skills.

CGS brings motivated, highly skilled, and creative people together to solve the government’s most dynamic problems with cutting-edge technology. To carry out our mission, we are seeking candidates who are excited to contribute to government innovation, appreciate collaboration, and can anticipate the needs of others. Here at CGS, we offer an environment in which our employees feel supported, and we encourage professional growth through various learning opportunities.
Skills and attributes for success:
Requires broad knowledge of the Government's IT environments.
Office automation networks.
PC and server-based databases and applications.

Qualifications:
This is a senior-level technical position, often the most senior-level technical position for all work for a particular DOJ component.
Must demonstrate substantial, hands-on, successful experience in doing the work on the systems being used, usually at least five years of such experience.
Other systems environments will require other specific sets of skills.
Requires broad knowledge of the Government's IT environments, including office automation networks, and PC and server-based databases and applications.
Experience in a litigation support environment is extremely helpful.
Excellent oral and written communication skills are required.
The ability to lead a technical team, and to give it direction, will be essential, as will the demonstrated ability to analyze the attorneys' needs and to design and implement a whole system solution responsive to those needs.

Ideally, you will also have:
Undergraduate degree in the computer science or information management/technology disciplines.
Supervisory experience.
Our Commitment:
Contact Government Services (CGS) strives to simplify and enhance government bureaucracy through the optimization of human, technical, and financial resources. We combine cutting-edge technology with world-class personnel to deliver customized solutions that fit our client’s specific needs. We are committed to solving the most challenging and dynamic problems.

For the past seven years, we’ve been growing our government contracting portfolio, and along the way, we’ve created valuable partnerships by demonstrating a commitment to honesty, professionalism, and quality work.

Here at CGS we value honesty through hard work and self-awareness, professionalism in all we do, and to deliver the best quality to our consumers mending those relations for years to come.

We care about our employees. Therefore, we offer a comprehensive benefits package.
Health, Dental, and Vision
Life Insurance
401k
Flexible Spending Account (Health, Dependent Care, and Commuter)
Paid Time Off and Observance of State/Federal Holidays

Contact Government Services, LLC is an Equal Opportunity Employer. Applicants will be considered without regard to their race, color, religion, sex, sexual orientation, gender identity, national origin, disability, or status as a protected veteran.

Join our team and become part of government innovation!

Explore additional job opportunities with CGS on our Job Board:
https://cgsfederal.com/join-our-team/

For more information about CGS please visit: https://www.cgsfederal.com or contact:
Email: info@cgsfederal.com",-1,-1,Unknown / Non-Applicable,-1,1 to 50 Employees,Company - Public,True
Senior Marketing Data Analyst,"First International Bank & Trust
","Sioux Falls, SD",$62K - $92K (Glassdoor est.),3.7,"We are seeking a highly analytical and detail-oriented Senior Marketing Data Analyst to join our marketing team. In this role, you will champion Salesforce Marketing Cloud, serve as a SME (Subject Matter Expert) on our customer databases, lead generation strategies, measure ROI on campaigns, research, and supervise our current Marketing Data Analyst. The ideal candidate will have a strong background in data analysis and marketing analytics with an emphasis on Salesforce Marketing Cloud and Google Analytics.

This position is In-Person and will have the employee primarily located in one of our Branches.

Key Responsibilities:

Champion Salesforce Marketing Cloud including but not limited to:
Recommend and implement marketing automation to streamline/align sales efforts and increase effectiveness.
Collaborate with SMEs to architect prospect engagement activities.
Share outcomes of efforts through reporting and suggest enhancements for better results.
Serve as SME of FIBT’s customer database and share insights with business line leaders and operations teams to help identify opportunities and drive effective strategies for engagement and growth.
Lead effective strategies for customer engagement and cross-selling; includes targeted digital marketing campaigns and SEO/SEM practices; includes collaboration with third parties.
Measure ROI of online and offline advertising campaigns including, but not limited to, reporting of KPIs such as leads, conversion rates, website traffic and social media engagement.
Conduct competitive research and analyze benchmarking data, including consumer behavioral insights.
Supervise marketing data team member(s)

Qualifications:

Bachelor degree in Marketing or Business Administration; a minimum of 7 years of marketing analyst experience, or equivalent combination of education and experience is required.
Salesforce Marketing Cloud experience highly preferred.
Google Analytics experience is highly preferred.
In-depth understanding of SEM campaign strategies and SEO practices and experience with PPC campaigns.

First International Bank and Trust is a family-owned full-service Community Bank with locations in ND, MN, SD, and AZ. We show our employees we care by providing competitive benefits and training and growth opportunities. Here are the things we offer within our full-time benefits package:

Health, Dental & Vision
401K Retirement Plan with Employer Match
Paid Parental Leave
Life and Disability Insurance
Generous PTO and Holiday pay

If you are interested in learning more, you can apply or if you have questions before applying you can reach out directly at TalentAcquisition@FIBT.com.

Equal Opportunity Employer",1910,Banking & Lending,$25 to $100 million (USD),Financial Services,501 to 1000 Employees,Company - Private,False
Technology Business Management Analyst,"Sanford Health
","Sioux Falls, SD",$43.00 - $71.00 Per Hour (Employer est.),3.4,"Create Your Career With Us!

Sanford Health is one of the largest and fastest-growing not-for-profit health systems in the United States. We're proud to offer many development and advancement opportunities to our nearly 50,000 members of the Sanford Family who are dedicated to the work of health and healing across our broad footprint.

Facility: Stevens Center Building

Location: Sioux Falls, SD

Address: 900 East 54th St N, Sioux Falls, SD 57104, USA

Shift: Day

Job Schedule: Full time

Weekly Hours: 40. 00

Salary Range: $43.00 - $71.00

Pay Info: Pay starts at $43 and increases according to years of applicable experience.

Job Summary

Technology Business Management is a newly established program within Sanford Health s Technology area that will manage and communicate the cost of Information Technology, known within the industry as Technology Business Management (TBM).

This principal position will be responsible for the analysis of IT finance, cost, and other related IT management information to include the IT service catalog, IT contracts, project management office, and architecture. Responsible for evaluating and supporting IT management systems and tools; capturing, generating, synthesizing, and reporting IT investment life cycle management data; and improving IT financial planning, budgeting, and transactions and reporting workflows and processes.

In addition, this position will support the IT Financial Management (ITFM)/Technology Business Management (TBM) program initiative for Chief Information Officer, System Executive Director, and Technology Leadership. The ITFM/TBM initiative's overall objective is to develop IT financial, management, and cost data associated with IT investments beyond the finance view to include IT service views and business views. The goal is to support executive decision-making, thereby leading to improved IT cost transparency, IT investment accountability, and IT value delivery to Sanford s business and mission components. Develops, implements, and administers IT Financial Management (ITFM)/Technology Business Management (TBM) processes, data, systems, and tools used for planning and life cycle management for IT budgets, assets, and capital resources. Follows well established and understood financial management best practices within a standardized ITFM/TBM taxonomy and framework. Provides expert advice related to ITFM/TBM processes, systems, tools, and data to CIO IT portfolio and sub-portfolio owners, applications portfolio, and enterprise architecture components. Identifies, collects, and analyzes ITFM/TBM related cost, financial, and other related management data. This includes IT financial, cost, and enterprise architecture data related to business capabilities, services portfolio, functional towers, projects, and enterprise architecture components.

Provides expert guidance in resolving complex problems and/or issues affecting IT financial, cost, and data collection, extraction, and reporting of IT spending and management data. Collects analytical management data essential to the investment planning, contracts, and project management of CIO portfolios. Advises and assists Finance with the conceptualization, design, and development of costing methodologies, cost allocation, and variance analysis. Support the monthly budget and forecast process in managing consumption, chargeback, show back, and savings in collaboration with Finance, Technology, and Business Lines/Operations. Provides advice and guidance to resolve, implement, or manage ITFM/TBM program, process, data, and technology issues that may arise.

Researches, analyzes, and provides expert technical advice on findings associated with cost optimization opportunities. Recommendations may relate to complex conclusions drawn from data generated from ITFM/TBM or financial and other management systems and tools to include reports, metrics, dashboards, and related analysis. Provides substantive supporting data to aid in operational and executive management decision making by working committees and executive management to include CIO, the Operational Leadership Committee, and the Priority Executive Committee. Capable of motivating and managing organizations as part of cross functional teams to deliver desired results. This role involves close collaboration with technology, operations, and finance professionals at all levels within the organization.

Determines and documents data mapping rules for movement data between applications. Adheres to and promotes the use of data administration standards. Extracts and analyzes data from specific applications, systems, and/or databases to create reports and provide recommendations based on the analysis of the data. Investigates and resolves data issues across platforms and applications, including discrepancies of definition, format, and function. May create data models, including robust data definitions, which may be entity-relationship-attribute models, star, or dimensional models. May be responsible for employing data mining techniques to achieve data synchronization, redundancy elimination, source identification, data reconciliation, and problem root cause analysis.

Qualifications

Bachelor's degree in accounting, finance, healthcare administration, or related field required.

Minimum of seven years experience in Technology required.

Understanding of technology infrastructure domains including data centers, network/communications, server utilization, virtual environment, storage, and application development.

Knowledge of financial management processes and best practices such as cost allocations, capital & operating expense management, program portfolio management, and application/infrastructure support.

Knowledge of large corporate technology operations. Ability to learn emerging technology trends to develop cost, quality/performance, and value of that technology.

Strong Excel software skills, especially VLOOKUP, IF statements, pivot tables, and macros. Proficiency in Microsoft Power BI software, SQL database development, and Microsoft Access databases.

Experience with C-Suite communication, presenting, and Technology Business Management tools.

Demonstrated leadership and organizational skills.

Certified Public Accountant (CPA), Certified Management Accountant (CMA) or other professional certification is preferred, but not required. TBM Certification preferred.

Benefits

Sanford Health offers an attractive benefits package for qualifying full-time and part-time employees. Depending on eligibility, a variety of benefits include health insurance, dental insurance, vision insurance, life insurance, a 401(k) retirement plan, work/life balance benefits, and a generous time off package to maintain a healthy home-work balance. For more information about Total Rewards, visit https://sanfordcareers.com/benefits .

Sanford is an EEO/AA Employer M/F/Disability/Vet. If you are an individual with a disability and would like to request an accommodation for help with your online application, please call 1-877-673-0854 or send an email to talent@sanfordhealth.org .

Sanford Health has a Drug Free Workplace Policy. An accepted offer will require a drug screen and pre-employment background screening as a condition of employment.

Req Number: R-0168574

Job Function: Information Technology

Featured: No",1928,Health Care Services & Hospitals,$5 to $10 billion (USD),Healthcare,10000+ Employees,Nonprofit Organization,True
