Job Title,Company Name,Location,Salary Estimate,Rating,Job Description,Founded,Industry,Revenue,Sector,Size,Type,Easy Apply
Project Controls Analyst,"TC Energy
","Charleston, WV",$68K - $92K (Glassdoor est.),3.6,"Determined. Imaginative. Curious. If these are some of the ways you describe yourself — we want to learn more about you! At TC Energy, we are Energy Problem Solvers — passionate about transitioning North America to cleaner energy while meeting the energy demands of today and tomorrow. If that sounds like a challenge you want to help tackle, we want you to join our team!
Posting Close Date: December 6, 2023
The Opportunity
TC Energy’s Storage Technical Services department is seeking a Project Controls Analyst to join our team. Reporting to the Manager, Well Engineering & Technology, the Project Controls Analyst is responsible for managing procurement of materials and services for the departments’ capital and operational projects and providing detailed project cost support to ensure monitoring and controlling of projects’ budgets.
In this role you will work with both third-party contractors and internal clients to support project cost control and forecasting activities for projects. To be successful you will need to demonstrate drive and commitment to achieving business results and leverage your strong customer service skills to align with the needs of the project leadership and the client.
The successful candidate will provide support for the execution of Storage Technical Services' portfolio of capital and operating projects.
What you’ll do
Collect job plan and resource information from project managers and engineers to prepare purchase requisitions for required materials and services.
Collaborate with Supply Chain in the timely issuance of purchase orders and qualification/onboarding of new vendors.
Maintain an accurate master list of purchase orders for project stakeholders to utilize during execution of the work.
Ensure purchase orders are sufficiently funded for anticipated work during execution.
Prepare various cost reports.
Create SAP master data load sheets.
Prepare and distribute notice of well status change reports.
Compile and analyze cost-related data obtained from a variety of sources and recommend solutions to routine problems.
Track and record costs through work orders and invoices.
Compile and distribute well in-service reports.
Provide support for facility as-built processes.
Minimum Qualifications
Post-Secondary Technical Diploma or University Degree in a related field
6 or more years of related experience
Solid working knowledge of project control functions and processes, including cost control, change management, financial, and project accounting processes and systems
Results oriented with sound problem-solving skills and an aptitude for attention to detail and accuracy
Excellent analytical skills; must have ability to gather and analyze data to make informed and sound decisions and recommendations as appropriate
About our business
TC Energy is a leading energy infrastructure company in North America. We have three complementary businesses of natural gas pipelines, liquids (oil) pipelines, and power generation. Our operations span three countries, seven Canadian provinces, and 34 U.S. states.

TC Energy is an equal opportunity employer.
Learn more
Visit us at TCEnergy.com and connect with us on our social media channels for our latest news, employee stories, community activities, and other updates.
Thank you for choosing TC Energy in your career search.
Depending on qualifications, the successful candidate may be offered a position at a more appropriate level and/or ladder.
Applicants must have legal authorization to work in the country in which the position is based with no restrictions.
All positions require background screening. Some require criminal and/or credit checks to comply with regulations.
TC Energy is committed to provide employment opportunities to all qualified individuals, without regard to race, religion, age, sex, color, national origin, sexual orientation, gender identity, veteran status, or disability. Accommodation for applicants with disabilities is available on request during the recruitment process. Applicants with disabilities can request accessible formats or communication supports by contacting careers@tcenergy.com.",1951,Energy & Utilities,$10+ billion (USD),"Energy, Mining & Utilities",5001 to 10000 Employees,Company - Public,False
Logistics Analyst (Deployment Engineer),"Logistics Management Institute
","Summit Point, WV",$64K - $91K (Glassdoor est.),4.2,"Overview:
LMI seeks a Mid-Level Logistics Analyst to support a federal program management office in the National Capital Region. Join our team of collaborative self-starters focused on delivering practical and efficient solutions to help our client keep U.S. borders safe and facilitate trade and travel. As part of our high-performing team, you will augment our vital work to provide “eyes and ears” technology to protect our nation. This position requires the ability to pass a government background investigation, including financial, criminal, residential, educational, foreign affiliation, prohibited substance use, and employment verifications; active U.S. Customs and Border Protection background investigation preferred. Please note that only U.S. citizens are eligible for a suitability determination.


LMI is a consultancy dedicated to improving the business of government, drawing from deep expertise in advanced analytics, digital services, logistics, and management advisory services. Established in 1961, LMI is a trusted third party to federal civilian, national security, and defense agencies, operating free of commercial and political bias. For nearly 60 years, LMI has worked with 40 government agencies. From the departments of Defense to Health and Human Services, LMI is honored to support the government's mission and people around the globe. We believe government can make a difference, and we seek talented, hardworking, mission-driven people who share that conviction.

We offer a generous compensation package with excellent benefits that start the first day of employment. Flexible work schedules, telework opportunities, and tuition reimbursement are a few of our many work-life benefits available to our employees. Come join the organization consistently ranked as a top workplace!

This position is located on-site in Summit Point, WV.



Some travel in support of client activities required.

Responsibilities:
You will support life cycle management and sustainment for our client’s portfolio of programs, projects, demonstrations, and other efforts. In addition, you will apply your skills in integrated logistics support (ILS) principles in support of planning, acquiring, and managing the operation of technology and capabilities to keep our borders safe and facilitate travel and trade. Working on site in Summit Point, WV, representative responsibilities are:
Collect, monitor, and track deployed system performance.
Develop plans and metrics for maintenance and repair requirements, including physical inspection and physical checkout.
Identify and help to resolve operating and support deficiencies.
Assess operational and sustainment footprints.
Develop strategies to optimize system performance.
Assist with acquisition and implementation of operator and maintenance training program.
Participate in system configuration control boards (CCBs) and support planning and implementation of system engineering changes.
Participate in technical interchange meetings by developing briefing materials, meeting agendas, and minutes and tracking action items to resolution
Work with designated the Contracting Officer Representative (COR) to stay abreast of contract changes, issues, and challenges.
Prepare documents in support of COR to facilitate government acceptance of equipment, repairs, services, and other contract deliverables.
Input, query, and analyze data from numerous CBP database sources, and prepare reports as requested.
Perform Physical Inspection and Functional Check Out (PIFCO) for new and rework systems prior to deployment.
Perform pre- and post- mission system inspection and testing.
Coordinate with stakeholders to support technology demonstration events.
Provide special events’ shipping, set up, and post-event services.
Qualifications:
MINIMUM QUALIFICATIONS
4+ years of logistics experience and a bachelor’s degree in logistics management, business, or a related discipline; or 7+ years of logistics experience.
Ability to pass a government background investigation, including financial, criminal, residential, educational, foreign affiliation, prohibited substance abuse, and employment verifications. Please note that only U.S. citizens are eligible for a suitability determination.
Ability to communicate clearly with a variety of stakeholders.
Ability to effectively solve problems.
Ability to effectively gather and validate requirements.
Ability to effectively monitor contract technical performance.
Strong communication skills, both oral and written.
A true team player who maintains a positive attitude in a dynamic environment.
Possess technical and business writing skills.
Possess strong organizational skills.
Detail oriented with strong time management and presentation skills.

DESIRED SKILLS

Active U.S. Customs and Border Protection Public Trust Clearance preferred.
DHS or DAWIA logistics certification desired.
Preferred skill in in Microsoft Word, Excel, Outlook, PowerPoint, PowerBI, and SharePoint, with emphasis on analytical and presentation functions of each application.
EEO Statement:

LMI is an Equal Opportunity Employer, where all qualified applicants will receive consideration for employment without regard to race, color, religion, sex, sexual orientation, gender identity, or national origin.",1961,Business Consulting,$100 to $500 million (USD),Management & Consulting,1001 to 5000 Employees,Company - Private,False
Senior Business Intelligence Analyst,"Pearson
","Charleston, WV",$77K - $108K (Glassdoor est.),3.7,"Senior Business Intelligence Analyst

Context

The shift within Higher Education more from one-time purchases of print textbooks to recurring subscriptions of digital products has generated a wealth of data about our products, customers, opportunities, and sales.

We’re looking for a leader who can take this information and leverage the latest data analytics tools, especially Tableau, to provide insight into the performance of business.

Reporting to the Director of Business Intelligence and sitting within the Strategic Sales Operations wing of US Higher Ed Sales Operations, the Sr Business Intelligence Analyst leads the analyses of the sales pipeline, net sales, subscriptions, and market data across multiple formats, models, and channels.

Responsibilities

Forecasting Mastery: Take the helm in owning all aspects of forecasting seasonal revenue, turning data into a strategic asset for our team.
Collaborative Insight: Work closely with cross-functional teams, including sales, marketing, finance, and product, to deliver accessible and consumable insights into the success of our higher education products.
Dashboard Stewardship: Support the lifecycle of our Tableau dashboards, ensuring they remain up to date with the latest features and capabilities while streamlining and retiring those that are no longer necessary.
Analytical Evolution : Drive the evolution of our analytics capabilities from self-service to predictive and early alert insights into product, sales, and market trends.
Data Integrity Guardian : Manage functional areas of data management, forecasting, contacts, leads, opportunities, dashboards, and reports, ensuring data integrity across our systems.
Strategic Partner: Assist in turning sales data into actionable insights that inform our go=to-market strategy, emphasizing focus areas, maximizing revenue, and preventing revenue leakage.

Essential Skills:

Holistic Business Understanding: Detailed comprehension of the sales business process and the ability to translate business needs into technical specifications.
Communication Prowess: Excellent interpersonal and communication skills, with the ability to articulate complex topics and present them thoughtfully to senior leaders.
Tech Savvy: Comfort with navigating the complexity of data across legacy and third-party platforms, ensuring forward momentum while simplifying and standardizing.
Organizational Agility : Strong time-management and organizational skills to balance multiple competing priorities.
Data Expertise: Background with ETL logic, data modeling concepts, and 5+ years of experience in a technical data role.

Requirements

Bachelor’s degree in business, finance, or computer-related program
5+ years of experience in a technical data role, such as analyst, engineer, architect, or scientist 5
5+ years of experience with multiple versions of SQL
5+ years of experience building and maintaining Tableau dashboards

Preferred Skills

Proficiency with Salesforce Sales Cloud (Marketing & Services Clouds a plus)
Proficiency with cloud databases such as Google BigQuery or Snowflake
Experience with machine learning concepts such as predictive modeling, categorization, and clustering
Background with programming in a language such as R or Python
Experience working in or supporting Sales or Revenue Operations a plus

\#LI-RS1

What to expect from Pearson

Did you know Pearson is one of the 10 most innovative education companies of 2022?

At Pearson, we add life to a lifetime of learning so everyone can realize the life they imagine. We do this by creating vibrant and enriching learning experiences designed for real-life impact. We are on a journey to be 100 percent digital to meet the changing needs of the global population by developing a new strategy with ambitious targets. To deliver on our strategic vision, we have five business divisions that are the foundation for the long-term growth of the company: Assessment & Qualifications, Virtual Learning, English Language Learning, Workforce Skills and Higher Education. Alongside these, we have our corporate divisions: Digital & Technology, Finance, Global Corporate Marketing & Communications, Human Resources, Legal, Strategy and Direct to Consumer. Learn more at We are Pearson.

We value the power of an inclusive culture and also a strong sense of belonging. We promote a culture where differences are embraced, opportunities are accessible, consideration and respect are the norm and all individuals are supported in reaching their full potential. Through our talent, we believe that diversity, equity and inclusion make us a more innovative and vibrant place to work. People are at the center, and we are committed to building a workplace where talent can learn, grow and thrive.

Pearson is an Affirmative Action and Equal Opportunity Employer and a member of E-Verify. We want a team that represents a variety of backgrounds, perspectives and skills. The more inclusive we are, the better our work will be. All employment decisions are based on qualifications, merit and business need. All qualified applicants will receive consideration for employment without regard to race, ethnicity, color, religion, sex, sexual orientation, gender identity, gender expression, age, national origin, protected veteran status, disability status or any other group protected by law. We strive for a workforce that reflects the diversity of our communities.

To learn more about Pearson’s commitment to a diverse and inclusive workforce, navigate to: Diversity, Equity & Inclusion at Pearson.

If you are an individual with a disability and are unable or limited in your ability to use or access our career site as a result of your disability, you may request reasonable accommodations by emailing ppsmhr@pearson.com.

Note that the information you provide will stay confidential and will be stored securely. It will not be seen by those involved in making decisions as part of the recruitment process.

Job: GENERAL BUSINESS OPERATIONS

Organization: Higher Education

Schedule: FULL\_TIME

Req ID: 13765

\#location",1844,Publishing,$5 to $10 billion (USD),Media & Communication,10000+ Employees,Company - Public,False
Nurse Analyst,"The Health Plan of West Virginia Inc
","Wheeling, WV",$65K - $93K (Glassdoor est.),3.5,"Under the direction of the Supervisor of Nurse Analysts, will develop, organize, prioritize and execute assigned Population Health projects with specific tasks, timelines, and processes required to accomplish project goals. Responsible for identifying and quantifying data related to HEDIS, NCQA, CMS and BMS improvement measures, overall utilization of services, investigating areas of opportunity for improvement both internally and externally.

Required:

Registered Nurse or Licensed Practical Nurse with at least seven (7) years’ experience.
Must have an active RN or LPN license in either Ohio or West Virginia prior to beginning employment. All staff are required to hold licenses in both Ohio and West Virginia by the end of the 90 day probationary period. Additional licenses may be needed per line of business.
Active Ohio and WV licensure which must be maintained throughout employment, including compliance with State Boards of Nursing continuing education policy. Other licensure as company expansion warrants.
Must have experience in Excel, Microsoft Word, and electronic medical records.
Strong critical thinking, analytical skills, and the ability to work in a fast paced environment.
Strong written and verbal communication skills.
Creative, resourceful, flexible and an independent worker.

Desired:

Medical coding and claims experience and understanding.
Strong presentation skills.
Statistical knowledge preferred.
HEDIS, Stars and NCQA experience or understanding.
Experience in managed care, quality improvement or healthcare related organization.

Responsibilities:

Monitor and analyze data and key metrics to drive actionable outcomes.
Provide development, oversight, and ongoing collaboration with interdepartmental efforts for improved adherence to evidence-based practice.
Provide ongoing data collection, medical records abstraction, oversight, and review for needed reporting related to HEDIS, Stars, and as needed to support corporate compliance.
Support the development & implementation of network initiatives, including alternative payment methods, to identify trends and improve outcomes.
Participate in analysis of trending data, assessment of benchmarks with recommendations to improve outcomes of population health initiatives.
Collaborate with clinical staff, quality staff, and analysts in other departments to develop data driven initiatives.
Facilitate development of resources for educating best practices for provider and member engagement.
Produce ongoing meaningful analysis on data from all sources, including analytical software, quality measures, health risk surveys, databytes, and social determinants of health to identify and improve outcomes of at risk populations.
Participate in corporate committees to support overall goals and objectives related to population health improvement.",1979,Insurance Carriers,$100 to $500 million (USD),Insurance,501 to 1000 Employees,Nonprofit Organization,True
