Job Title,Company Name,Location,Salary Estimate,Rating,Job Description,Founded,Industry,Revenue,Sector,Size,Type,Easy Apply
Data and Communication Analyst,"Xcelerate Solutions
","Clarksburg, WV",$46K - $70K (Glassdoor est.),4.4,"Data & Communication Analyst - TS

Location:
Remote/Washington DC

Clearance:
Active Top Secret

Xcelerate Solutions is seeking a Data & Communication Analyst supporting the FBI. Come join our award-winning organization and work with the most talented and brightest minds in the GovCon industry.

Requirements

Shall support the program with various research and analytical projects, white paper development, presentations, and other project-oriented tasks.
Excellent analytical, critical thinking, judgement, and organizational skills are required. Shall perform extensive analysis and research to create case analysis studies and reports some of which will involve use of MS PowerBI.
Shall have excellent verbal, written, and interpersonal communication skills.
Shall manage, track, prioritize, and schedule multiple projects simultaneously, while meeting all deadlines.
Proficiency with the application of copyright procedures and laws, and Section 508 of the Rehabilitation Act of 1973 requirements and standards is desired.
Shall provide necessary professional skills, including planning, selecting, collecting, analyzing, interpreting, and communicating for all phases of data processing; system and software development lifecycle phases; and data analysis.
Ability to develop a communications strategy and produce creative, effective, and engaging communications content.
Shall advise on best practices and guidelines for visual communications, including preparing and formatting documents for use in websites, and oversee logo and brand guidelines.
Shall design and produce the unit’s key newsletters and contribute to the unit’s websites and other publications.
Shall collaborate with other CJIS units on projects, initiatives, and events.
Shall recommend innovative avenues of communication for external and internal audiences.
Shall assist with system messaging as needed; this includes system maintenance, outages, and notifications.
Shall recognize when and where problems and opportunities exist and evaluate strengths and weaknesses of potential solutions to problems.
Shall recognize patterns of customer needs, problems, and potential systemic solutions.
Shall work with all levels of the organization. Interactions may include presentations, workshop facilitation, and outreach.
Proficiency in preparing and/or reviewing technical and programmatic documentation to ensure consistency with outreach documentation and ensuring impacts are identified, understood, and communicated is required.
Shall manage and perform print production updates, while maintaining master production schedule.
Shall have demonstrated creative writing and editing skills, knowledge of the Gregg Reference Manual, and ability to conform to CJIS writing requirements.
Shall provide functional expertise in the following aspects of creative content production: creative content strategy development; content development; and content delivery.
Shall have experience working with MS Tools, specifically PowerPoint, Excel, and Visio software.
Experience in the development and management of user manuals, standard operating procedures, outreach materials, bulletins, presentations, reports, and instructional materials is required.
Expertise in creative writing and marketing materials, including, but not limited to creating informative emails, articles, success stories, brochures, flyers, newsletters, presentations, etc. is required.
Shall work with all levels of the organization. Interactions may include the delivery of presentations, workshop facilitation, and other forms of outreach.
May perform other additional duties or tasks as designated by the supervisor.
It is the intent of the Government for this position to be on-site at the CJIS Division.

About Xcelerate Solutions:
Founded in 2009 and headquartered in McLean, VA, Xcelerate Solutions (www.xceleratesolutions.com) is one of America's fastest-growing companies. Xcelerate’s culture is defined by our diversified workforce of dynamic and versatile professionals, supported with growth and development opportunities that contribute to individual and company growth. This strong commitment to our employees has been recognized by our inclusion on the Washington Business Journal’s “50 Best Places to Work” list as well as being a “Great Place to Work” certified company with a 4.6 star, and a 99% CEO approval Glassdoor rating. Come find out why Xcelerate Solutions is one of the DC Metro top employers!

Xcelerate Solutions is an Equal Employment Opportunity/Affirmative Action Employer. We evaluate qualified applicants without regard to race, color, national origin, religion, age, equal pay, disability, veteran status, sex, sexual orientation, gender identity, genetic information, or expression of another protected characteristic. As part of this commitment to the full inclusion of all qualified individuals, Xcelerate provides reasonable accommodations if needed because of an applicant's or an employee's disability.

Pay Transparency Notice: Xcelerate Solutions will not discharge or in any other manner discriminate against employees or applicants because they have inquired about, discussed, or disclosed their own pay or the pay of another employee or applicant.",2009,Business Consulting,$25 to $100 million (USD),Management & Consulting,201 to 500 Employees,Company - Private,False
Business Analyst,"Bravo Consulting Group
","Morgantown, WV",$75K - $110K (Glassdoor est.),4.3,"Job Description

The Business Analyst will support our government client, Financial Analysts, Administrators, and Project Managers. The position requires an ability to take initiative and a willingness to work in a flexible, fast-paced environment directly with the client and with other members of our team. The Analyst will support the process for executing Funding Opportunity Announcement (FOA), selection efforts, and award processes. The Business Analyst will provide cost tracking, project-document tracking and review, data input and analysis, and report preparation for business processes and various stages of program and project life cycles. The position will assist with program and project oversight and management administrative support.

Required Skills
Track and analyze financial data within the customer databases
Interface with customers, engineers and project managers
Manage and track cost schedules, milestones, and project deliverables
Develop regular and ad hoc reports and presentations
Maintain, amend and update files and records
Support client Funding Opportunity Announcements, selection and processes
Must be able to obtain US security clearance
Desired Skills
Bachelor's Degree
Strong experience with Microsoft Word, Excel, PowerPoint Experience with database and web design
Experience with document editing and technical writing
Ability to work closely with the customer to develop briefings and reports
Ability to provide high-level data analysis is a plus
Proven customer service experience
Excellent communication skills
About Bravo Consulting Group

Bravo Consulting Groupis a people first company!",2007,Information Technology Support Services,Unknown / Non-Applicable,Information Technology,51 to 200 Employees,Company - Private,False
Business Applications Specialist -- Business Intelligence & Data Analytics -- Northgate-400 Associat,"CAMC Health System
","Charleston, WV",$77K - $111K (Glassdoor est.),3.5,"The Business Applications Specialist is responsible for combining business knowledge, clinical workflow, and data analysis within a continuous financial and process improvement framework. The Business Applications Specialist performs a variety of simple and complex activities to provide CAMC business entities with insights to maintain, improve or transform the business and technology framework. Responsible for application support and implementation within the Information Services Department. Demonstrates elevated computer operational skills. Should be able to perform difficult application diagnostics and troubleshooting. Must be able to mentor more junior level staff on departmental procedure and application support and/or implementation procedures. Understand and promote all IT services available to the organization. Demonstrates and the ability to follow I/S Departmental and CAMC Organizational governance commitments including (but not limited to) ticket management, training, testing, implementing, and validating service requests and/or requested modifications through the departments change control process. Promote the departments’ services within the organization as well as develop Informatics practices to ensure departmental quality and process measurements are included. Demonstrates a basic understanding and adheres to departmental processes for change control. Maintains a level of cybersecurity knowledge sufficient to securely accomplish their job duties.


Responsibilities

1. Coordinates and Assists users and IT personnel with training and development of user documentation. 2. Develops system design, including functional specifications, and implements strategies based upon the analysis of specific operational needs. 3. Evaluates, designs, builds, tests, and implements custom or vendor supplied software and develops system-wide reports to support information management needs. 4. Maintains production systems to ensure reliable performance. 5. Prepares complete unit, system, and integrated test plans and test methodologies. 6. Provides day-to-day operations support to customers as required. 7. Coordinates efforts between stakeholders from multiple areas in order to gather requirements, develop technical specifications, and test enhancements and other changes to these systems. 8. Identifies data integrity issues and analyzes data and process flows for process improvement opportunities. 9. Develops & Performs data analysis in order to extract requirements, identify data inaccuracies, and ensure accurate processing and reporting. 10. Identifies policies and requirements that drive a specific solution. 11. Works effectively on project teams and meets deadlines in accordance to project manager's expectations. 12. Works with stakeholders to build, test and maintain integration points with multiple vendor solutions 13. Utilizes detailed instructions to perform routine support and implementation work. 14. Utilizes appropriate and timely communication skills within assigned team. 15. Must have appropriate and timely communications skills to communicate with senior level management. 16. Completed certification/accreditation for specific vendor and/or governing body related to specific applications/tools for which responsibility is held for support. 17. Participates in contract review process, which will include initial vendor contact and contract review prior to delivering to management for further review, negotiation, and execution. 18. On call as required. 19. Flexible hours when needed. 20. All other duties as assigned.


Knowledge, Skills & Abilities

Patient Group Knowledge (Only applies to positions with direct patient contact) The employee must possess/obtain (by the end of the orientation period) and demonstrate the knowledge and skills necessary to provide developmentally appropriate assessment, treatment or care as defined by the department’s identified patient ages. Specifically the employee must be able to demonstrate competency in: 1) ability to obtain and interpret information in terms of patient needs; 2) knowledge of growth and development; and 3) understanding of the range of treatment needed by the patients. Competency Statement Must demonstrate competency through an initial orientation and ongoing competency validation to independently perform tasks and additional duties as specified in the job description and the unit/department specific competency checklist. Common Duties and Responsibilities (Essential duties common to all positions) 1. Maintain and document all applicable required education. 2. Demonstrate positive customer service and co-worker relations. 3. Comply with the company's attendance policy. 4. Participate in the continuous, quality improvement activities of the department and institution. 5. Perform work in a cost effective manner. 6. Perform work in accordance with all departmental pay practices and scheduling policies, including but not limited to, overtime, various shift work, and on-call situations. 7. Perform work in alignment with the overall mission and strategic plan of the organization. 8. Follow organizational and departmental policies and procedures, as applicable. 9. Perform related duties as assigned.


Education

• Bachelor's Degree (Required) Education: Bachelor’s Degree and Advanced Certifications or equivalent experience in Business Administration, Health Administration, Information Systems, Information Technology or related field Master’s Degree and Advanced Certifications preferred Experience: 10 years of related information technology, financial systems support, and/or related business/healthcare experience


Credentials

• No Certification, Competency or License Required


Work Schedule: Days

Status: Full Time Regular

Location: Northgate-400 Association Dr.

Location of Job: US:WV:Charleston

Talent Acquisition Specialist: Lisa J. Craft lisa.craft@vandaliahealth.org",1984,Health Care Services & Hospitals,Less than $1 million (USD),Healthcare,5001 to 10000 Employees,Nonprofit Organization,False
Program Cost Schedule Control Analyst (Level 2/3),"Northrop Grumman
",Virginia,$61K - $91K (Employer est.),4.0,"Requisition ID: R10138877
Category: Business Management
Location: Rocket Center, West Virginia, United States of America
Citizenship required: United States Citizenship
Clearance Type: None
Telecommute: Yes-May consider hybrid teleworking for this position
Shift: 1st Shift (United States of America)
Travel Required: No
Positions Available: 1
At Northrop Grumman, our employees have incredible opportunities to work on revolutionary systems that impact people's lives around the world today, and for generations to come. Our pioneering and inventive spirit has enabled us to be at the forefront of many technological advancements in our nation's history - from the first flight across the Atlantic Ocean, to stealth bombers, to landing on the moon. We look for people who have bold new ideas, courage and a pioneering spirit to join forces to invent the future, and have fun along the way. Our culture thrives on intellectual curiosity, cognitive diversity and bringing your whole self to work — and we have an insatiable drive to do what others think is impossible. Our employees are not only part of history, they're making history.
Northrop Grumman Defense Systems is currently seeking a Financial Analyst 2/3 (Program Cost Control Analyst) to join our team in Rocket Center, WV just outside of Cumberland, MD. The Allegany Ballistics Laboratory (ABL) site in Rocket Center designs, develops and manufactures tactical rocket motors, medium caliber ammunition, composite components and end items, and fuze and electronics equipment. For decades, the dedicated and highly skilled team at ABL have supported national security efforts by developing and building defense systems for DoD customers and U.S. allies.

What to Expect:
If you are a dynamic and motivated professional, Northrop Grumman is the company that will help further your experience and career growth. We offer highly competitive salaries, an array of benefits to give you the support you need, and the opportunity to connect with coworkers in an environment that is professional, creative and ﬂexible. Join our team and Work On What Matters.

Location:
Rocket Center, WV is located along the North Branch Potomac River in Mineral County, West Virginia and is home to the Allegany Ballistics Laboratory (ABL), a government installation operated by Northrop Grumman. Known for its scenic mountain landscapes, rolling hills and state parks, the region offers a multitude of outdoor recreational opportunities to include hiking, mountain biking, skiing, fishing, hunting and whitewater rafting. Where can you get to from Rocket Center? We are just a few hours from Washington, D.C., Baltimore, Pittsburgh and Cleveland and not far from Philadelphia, Virginia and New York. If you enjoy a beautiful all-weather climate, low cost of living, zero gridlock traffic, outdoor activities and easy access to major cities along the east coast - this area has a lot to offer!


Position Summary:
Prepare Estimate at Completion in support of Corporate requirements
Prepare monthly forecasts for revenue and cash
Manage the day to day financial requirements for multiple projects
Work with program team and support required program meetings
Assist Financial Shared Services (FSS) with invoicing
Maintain project detail with Deltek/Costpoint
Support Customer required reporting requirements

Put your skills to the test by pushing the boundaries of what’s possible. From global defense to sustainment and modernization to deterring and defeating any adversary, your experience and ability will make it a reality. Our programs are built on equal parts of curiosity and collaboration. Our combined effort means our customers can connect and defend millions of people around the world. With Northrop Grumman, you’ll have the opportunity to be an essential part of projects that will define your career, now and in the future. #NGSkills

The level hired to is based on qualifications listed below.

Basic Qualifications:

(Level 2)

This position emphasized skills and experience. Must have 7 or more years of finance experience. Will also consider a bachelor’s degree from an accredited four-year college or university (will be verified) and 3 years of experience or a master’s degree with 1 year of experience
Knowledge of applications in a computerized environment, including spreadsheet applications and data bases (e.g. MS Excel, MS Access, MS Power Point)
Ability to extract, compile, document and analyze data
Possess excellent analytical, problem solving and reporting skills
Ability to prioritize multiple assignments in order to meet deadlines
Able to obtain and maintain a U.S. Government security clearance (U.S. citizenship is a pre-requisite)

(Level 3)

This position emphasized skills and experience. Must have 10 or more years of finance experience. Will also consider a bachelor’s degree from an accredited four-year college or university (will be verified) and 6 years of experience or a master’s degree with 4 year of experience
Knowledge of applications in a computerized environment, including spreadsheet applications and data bases (e.g. MS Excel, MS Access, MS Power Point)
Ability to extract, compile, document and analyze data
Possess excellent analytical, problem solving and reporting skills
Ability to prioritize multiple assignments in order to meet deadlines
Able to obtain and maintain a U.S. Government security clearance (U.S. citizenship is a pre-requisite)

Preferred Qualifications:

Bachelors degree preferred with degree in Business Administration or Accounting highly preferred
Analytical Skills
Presentation skills
Organizational/Time Management skills and ability to multi task
Self-motivated and works well in team environment
Experience with EVMS
Salary Range: $60,600 - $90,800
Salary Range 2: $74,600 - $111,800
Employees may be eligible for a discretionary bonus in addition to base pay. Annual bonuses are designed to reward individual contributions as well as allow employees to share in company results. Employees in Vice President or Director positions may be eligible for Long Term Incentives. In addition, Northrop Grumman provides a variety of benefits including health insurance coverage, life and disability insurance, savings plan, Company paid holidays and paid time off (PTO) for vacation and/or personal business.

Northrop Grumman is committed to hiring and retaining a diverse workforce. We are proud to be an Equal Opportunity/Affirmative Action Employer, making decisions without regard to race, color, religion, creed, sex, sexual orientation, gender identity, marital status, national origin, age, veteran status, disability, or any other protected class. For our complete EEO/AA and Pay Transparency statement, please visit http://www.northropgrumman.com/EEO. U.S. Citizenship is required for most positions.",1939,Aerospace & Defense,$10+ billion (USD),Aerospace & Defense,10000+ Employees,Company - Public,False
Clinical Research Data Analyst,"Marshall University
","Huntington, WV",$45K - $74K (Glassdoor est.),3.8,"The research Data Analyst at the Joan C. Edwards School of Medicine is responsible for ingressing,
analyzing, and transforming clinical data from internal and external sources. The position will interact and
work with healthcare systems such as Cerner and HealtheIntent. With support from the professional team, the Research Data Analyst will analyze clinical data sets in multiple formats and
transform/manipulate this data to provide insightful analysis or provide this data to others. The position will work across many different data formats, including Excel, CSV, and MS SQL, and experience in these
formats and capabilities like SSAS and SSIS will be valuable. The analyst will use Microsoft SQL and
medical knowledge to work on clinical research projects for the Department of Clinical and Translational Sciences, Division of Clinical Informatics, consistent with its grant funding from NIH, CTSA, COBRE, etc.
We are looking for a passionate data professional who is self-directed, enjoys being busy with challenging
work, and has a positive attitude toward their work, colleagues, and the medical school.
Essential Job Functions
1. Experience managing clinical research projects using MS SQL,
2. Strong ability to interpret laboratory findings, physical signs/symptoms, and other information on medical charts
3. Understanding of Relational Databases and Data Warehouses
4. Knowledge of medical coding (CPT9/10, ICD)
5. Experience using SSAS, SSIS, REDCap, Tableau, or other visualization tools
6. Ability to analyze user requirements requested by medical researchers.
7. Knowledge of principles of clinical data collection and reporting; demonstrated ability to use systems and tools (e.g., Word, Excel, PowerPoint, etc.) for data collection, analysis, and reporting.
Location MUSOM - Marshall University School of Medicine Salary Range Commensurate with qualifications and experience.
Required Qualifications

Education
BS in Nursing, Computer Science, Public Health, Informatics, or equivalent
degree.


Experience
Ability to work effectively under high pressure while maintaining high-quality standards.
Ability to effectively prioritize tasks and implement them accordingly.
High proficiency in English (written and spoken).


Preferred Qualifications

Education


Experience


Posting Detail Information

Posting Number MR0605 Open Date 05/08/2023 Close Date Open Until Filled Yes Special Instructions Summary",1837,Colleges & Universities,$100 to $500 million (USD),Education,1001 to 5000 Employees,College / University,False
