Job Title,Company Name,Location,Salary Estimate,Rating,Job Description,Founded,Industry,Revenue,Sector,Size,Type,Easy Apply
Enrollment Data Analyst,"Xavier University of Louisiana
","New Orleans, LA",$38K - $57K (Glassdoor est.),3.6,"Posting Details
Posting Summary

Position Title
Enrollment Data Analyst


FLSA
Exempt


Department
Office of Enrollment Management


Job Summary
Reporting to the Vice President for Enrollment Management, the Enrollment Data Analyst will have a dual focus on reporting and maintenance of administrative systems. The ideal candidate will have demonstrated aptitude for analytical work, be able to present data and findings to a variety of audiences, and have the technical skills necessary to successfully liaise with the information technology office on various projects. EOE/AA

Essential Duties and Responsibilities:
Become knowledgeable in all aspects of the Ellucian Banner Recruitment & Admissions Student and Financial Aid modules and related 3rd party systems
Provide system support with the implementation, maintenance and/or upgrade of various computer software systems
Investigate and resolve data quality issues and escalate situations according to department processes.
Develop a data collection, analysis and reporting plan to cover recruitment and admissions activities, enrollment forecasts, enrollment analysis, and effectiveness of various marketing efforts.
Create and generate ongoing recruitment application, and enrollment reports to support admission activities, decision making and enrollment strategies.
Participate in cross-functional projects that support Enrollment Management as needed.
Produce or support the production of standard, custom, and dashboard reports utilizing data warehouse and transactional systems.
Perform business requirements gathering and analysis, and clearly communicate findings and process improvement recs to various stakeholders
Along with other technical leads within the division, fulfill data requests for mailing lists, donor rolls, demographic and giving analyses, and other requests
Participate in thorough testing and validation efforts ensuring timely and accurate results in a team environment
Using advanced analytical skills, provide comprehensive assessments to management that interpret patterns and trends, and determine overall data quality.


Minimum Qualifications
Bachelor’s degree is required with three (3) or more years of experience working with relational databases and demonstrated aptitude for data analysis or data management.
Experience with report writing tools.
Strong aptitude for diagnosing end user problems, identifying and implementing solutions.
Working knowledge of relational and dimensional database architectures.


Preferred Qualifications
Experience working in higher education environment preferred.
Excellent written and oral communication skills.
Proficiency with the Microsoft Office product suite, including Excel and Access.
Ability to prioritize and handle multiple deadlines and projects.
Organized and able to follow through on projects with minimal supervision.
Service orientation, commitment to excellence and professional growth.
Flexible and team-oriented.


Special Requirements Summary
Experience using student information systems; knowledge of Ellucian Banner SIS, specifically the student and finance modules strongly preferred.
Experience with using a CRM (preferably Technolutions/Slate), ERP and/or CMS.
Experience and/or understanding of simple programming (SQL, Visual Basic, Java) required.


Work Hours
Weekdays from 8am – 5pm. Some evenings and weekends as needed.


KSA's

Knowledge, Education, Experience, and Proficiencies
Knowledge of Ellucian Banner SIS, specifically the student and finance modules
Experience with using a CRM (preferably Technolutions/Slate), ERP and/or CMS.
Experience and/or understanding of simple programming (SQL, Visual Basic, Java)
Bachelor’s degree and at least 3 years experience working with relational databases and demonstrated aptitude for data analysis or data management.


Essential Duties and Responsibilities

Essential Duties and Responsibilities Description
Become knowledgeable in all aspects of the Ellucian Banner Recruitment & Admissions Student and Financial Aid modules and related 3rd party systems
Provide system support with the implementation, maintenance and/or upgrade of various computer software systems
Investigate and resolve data quality issues and escalate situations according to department processes.
Develop a data collection, analysis and reporting plan to cover recruitment and admissions activities, enrollment forecasts, enrollment analysis, and effectiveness of various marketing efforts.
Create and generate ongoing recruitment application, and enrollment reports to support admission activities, decision making and enrollment strategies.
Participate in cross-functional projects that support Enrollment Management as needed.
Produce or support the production of standard, custom, and dashboard reports utilizing data warehouse and transactional systems.
Perform business requirements gathering and analysis, and clearly communicate findings and process improvement recs to various stakeholders
Along with other technical leads within the division, fulfill data requests for mailing lists, donor rolls, demographic and giving analyses, and other requests
Participate in thorough testing and validation efforts ensuring timely and accurate results in a team environment
Using advanced analytical skills, provide comprehensive assessments to management that interpret patterns and trends, and determine overall data quality.


Posting Detail Information

Posting Number
S102P


Number of Vacancies
1


Desired Start Date


Position End Date (if temporary)


Posting Date
08/04/2021


Application Review Date
08/31/2021


Closing Date


Open Until Filled
Yes


Special Instructions to Applicants
Attach online only at https://jobs.xula.edu your resume, cover letter and contact information for three references.


Quicklink for Posting
https://jobs.xula.edu/postings/1101


About Xavier

About Xavier
Founded in 1925 by Saint Katharine Drexel and the Sisters of the Blessed Sacrament, XULA is Catholic and historically Black. Located in New Orleans, the ultimate purpose of the University is to contribute to the promotion of a more just and humane society by preparing its students to assume roles of leadership and service in a global society. This preparation takes place in a diverse learning and teaching environment that incorporates all relevant educational means, including research and community service.",1966,Colleges & Universities,$100 to $500 million (USD),Education,501 to 1000 Employees,College / University,False
ERP Business Analyst,"AFCO Industries, Inc.
","Alexandria, LA",$40K - $75K (Employer est.),2.3,"Want to work for the largest vertically integrated manufacturer of aluminum products? AFCO Industries, Inc., a 100% Employee Owned company, has been making quality products since 1946. We are currently seeking an ERP Business Analyst for our Alexandria, LA Plant. The main qualifications are your willingness to be a team player, learn and grow within our organization, and have a great attitude! We offer competitive pay, excellent benefits and quarterly bonuses.

General Statement of Duties: Solves operational and/or data problems related to ERP. Obtains and analyses data for use by Executives, Managers or other AFCO team members. Works with IT department leadership to develop software tools to supplement the ERP environment and/or assigns tasks to outside contractors as needed.

Responsibilities:

Work with data to improve processes and procedures and provide reports.
Help Desk support for the above sub processes.
Assist with security approval and review.
Evaluate, recommend workflow or procedural solutions.
Test new functionalities or tools.
Lead and participate in projects across the enterprise.
Understand the business process organization, issue escalation process, systems project management process, and educate users where applicable.
Reports problems or accidents to management immediately.
Performs related work as required.

Requirements:

Knowledge, Skills, & Abilities:

Must have excellent oral and written communication skills.
The position requires workflow & process knowledge with the ability to understand information technology concepts.
Must have an aptitude for learning new processes & technologies quickly, and for maintaining that knowledge in a fast-paced environment.
Must be able to work on multiple tasks and projects simultaneously.

Education: Prefer Bachelor’s degree or higher in Business, Information Systems or Engineering or equivalent industry experience.

Job Types: Full-time, Permanent

Pay: $40,000.00 - $75,000.00 per year

Benefits:

Dental insurance
Health insurance
Life insurance
Paid time off
Professional development assistance
Retirement plan
Vision insurance

Compensation package:

Bonus opportunities

Schedule:

8 hour shift
Day shift
Monday to Friday

Education:

Bachelor's (Preferred)

Experience:

Data & Technical Business Analysts: 2 years (Preferred)

Work Location: In person",1988,Machinery Manufacturing,$25 to $100 million (USD),Manufacturing,201 to 500 Employees,Self-employed,True
Systems Analyst (Data Analytics),"Contact Government Services, LLC
","New Orleans, LA",$71K - $104K (Glassdoor est.),4.7,"Systems Analyst (Data Analytics)
Employment Type: Full-Time, Mid-Level
Department: Information Technology

As a CGS Systems Analyst, you will be doing the work of setting up Oracle databases in a UNIX environment, including designing, implementing, troubleshooting, populating, maintaining, documenting, and training users on such systems. Other systems environments and specific project requirements will call for other specific sets of technical skills.

CGS brings motivated, highly skilled, and creative people together to solve the government’s most dynamic problems with cutting-edge technology. To carry out our mission, we are seeking candidates who are excited to contribute to government innovation, appreciate collaboration, and can anticipate the needs of others. Here at CGS, we offer an environment in which our employees feel supported, and we encourage professional growth through various learning opportunities.
Skills and attributes for success:
Requires broad knowledge of the Government's IT environments.
Office automation networks.
PC and server-based databases and applications.

Qualifications:
This is a senior-level technical position, often the most senior-level technical position for all work for a particular DOJ component.
Must demonstrate substantial, hands-on, successful experience in doing the work on the systems being used, usually at least five years of such experience.
Other systems environments will require other specific sets of skills.
Requires broad knowledge of the Government's IT environments, including office automation networks, and PC and server-based databases and applications.
Experience in a litigation support environment is extremely helpful.
Excellent oral and written communication skills are required.
The ability to lead a technical team, and to give it direction, will be essential, as will the demonstrated ability to analyze the attorneys' needs and to design and implement a whole system solution responsive to those needs.

Ideally, you will also have:
Undergraduate degree in the computer science or information management/technology disciplines.
Supervisory experience.
Our Commitment:
Contact Government Services (CGS) strives to simplify and enhance government bureaucracy through the optimization of human, technical, and financial resources. We combine cutting-edge technology with world-class personnel to deliver customized solutions that fit our client’s specific needs. We are committed to solving the most challenging and dynamic problems.

For the past seven years, we’ve been growing our government contracting portfolio, and along the way, we’ve created valuable partnerships by demonstrating a commitment to honesty, professionalism, and quality work.

Here at CGS we value honesty through hard work and self-awareness, professionalism in all we do, and to deliver the best quality to our consumers mending those relations for years to come.

We care about our employees. Therefore, we offer a comprehensive benefits package.
Health, Dental, and Vision
Life Insurance
401k
Flexible Spending Account (Health, Dependent Care, and Commuter)
Paid Time Off and Observance of State/Federal Holidays

Contact Government Services, LLC is an Equal Opportunity Employer. Applicants will be considered without regard to their race, color, religion, sex, sexual orientation, gender identity, national origin, disability, or status as a protected veteran.

Join our team and become part of government innovation!

Explore additional job opportunities with CGS on our Job Board:
https://cgsfederal.com/join-our-team/

For more information about CGS please visit: https://www.cgsfederal.com or contact:
Email: info@cgsfederal.com",-1,-1,Unknown / Non-Applicable,-1,1 to 50 Employees,Company - Public,True
Staff - IT Business Analyst,"EisnerAmper Gulf Coast
","Metairie, LA",$73K - $103K (Glassdoor est.),3.8,"EisnerAmper is one of the largest accounting, tax, and business advisory firms, with nearly 4,000 employees and more than 350 partners across the world. We combine responsiveness with a long-range perspective; to help clients meet the pressing issues they face today, and position them for success tomorrow.

Our clients are enterprises as diverse as sophisticated financial institutions and start-ups, global public firms and middle-market companies, as well as high net worth individuals, family offices, not-for-profit organizations, and entrepreneurial ventures across a variety of industries. We are also engaged by the attorneys, financial professionals, bankers and investors who serve these clients.

Our reach extends globally, with offices in the United Kingdom, Israel, India, the Cayman Islands, Singapore, and Ireland.

The Staff Consultant – IT Business Analyst is responsible for supporting Agile projects by assisting with the development, execution, and tracking of agile project plans. This position provides Business Analysis, requirements definition, and software testing support to the user base.

QUALIFICATIONS:

Bachelor’s degree in Business, Computer Science, Information Systems and Decision Sciences, or a related field is required.
Four+ years of relevant experience may substitute education requirement.
None required.
Preferred experience in Agile project management or consulting.
Experience with agile application delivery processes, system development life cycle, business assessments, and programs such as JIRA, Confluence, Asana, Zephyr, TestRail, Trello, Basecamp, TFS is preferred.
Working knowledge of Scrum or other agile methodologies.
Must have an in-depth understanding of Agile, its values and principles, including backlog grooming, release and sprint planning, burn-up/down charts, and more.
Must be knowledgeable of Qualify Assurance and Quality Control processes.
Must be able to effectively manage multiple projects, meet deadlines, and adjust priorities appropriately in an evolving work environment with shifting time frames.
Ability to work in both Agile and Waterfall methodologies.
Must be able to lead, build, and manage effective teams for small, medium, and large scale projects.
Must be able to work in a dynamic, fast-paced, innovative, and continuously changing environment.
Must have excellent communication skills in business and technical environments.
RESPONSIBILITIES:

Assists in executing project management tasks to support Agile teams.
Aids in performing assessments of business needs and assists developers to translate these needs into project requirements
Prepares work papers reflecting results of business system development and implementation efforts.
Creates and distributes regular reports on project progress, blockers, milestones, and resource needs.
Helps identify and clear roadblocks for Agile teams.
Communicates effectively and consistently with all project stakeholders.
Serves as a liaison between technical and non-technical departments.
Assists project leaders and teams in identifying resources needed and completing individual responsibilities within a project.
Attends process improvement meetings to identify people, process and technology improvements to be made improve team and project performance.
Builds and maintains trusted relationships with diverse group of clients, co-workers, managers, and subject matter experts.
Participates in the development and implementation of structured testing concepts, methodologies, and manual testing support tools.
Assists in performing functionality testing of new applications and existing software enhancements to ensure they meet business requirements through performing end to end business scenario tests.
Aids in performing regression testing of new applications and existing software enhancements to identify any possible impacts caused by changes.
Records and discusses test results with key individuals involved and recommends necessary next steps to ensure desired results.
Tracks quality assurance metrics such as defect impact and open defect counts.
Assists in maintaining and managing the manual scripts and test results.
Verifies and traces evidence of reproduction of any reported faults in existing software.
Aids in re-testing all fixes required for reported faults, including tests for possible impacts from changes.
Ensures project documents are complete, current, and stored appropriately.
Ensures all work meets the customer requirements, guidelines, and standards defined for the team and the company before being released for internal approval.
Ensures all internal customers are kept informed of development issues while promoting transparency at all times regarding project status, issues, and risks to stakeholder.
Other Duties:

Provides courteous and prompt service to all internal and external parties. Prioritizes and addresses requests and assignments in a professional and cooperative manner.
Identifies opportunities and recommends methods to improve service, and work processes. Assists in the implementation of quality improvement initiatives.
May assist co-workers in the completion of tasks and assignments to ensure continuity of service and demonstrating team work skills. Actively supports teamwork throughout the organization.
Perform other services as assigned.
Other Considerations:

May periodically travel and work from different company locations.
May be required to work overtime, and/or on weekends as needed.
Must arrive at EisnerAmper offices or client locations in a timely manner and be ready to perform job responsibilities.
Work Environment: Work environment characteristics described here are representative of those that must be met by an employee to perform the essential functions of this job successfully with or without reasonable accommodations. The work environment is considered to be that of a typical business/office operation. The noise level in the work environment is usually moderate.

BENEFITS:

Medical, dental, vision, life, and disability insurance
401(k) Retirement Plan
Flexible Spending & Health Savings Account
Paid holidays, vacation, and sick time
Employee assistance program and other firm benefits.
Join our team of professionals and take a firm step forward in your career. With an established mentor program and defined career paths for a range of specialties and skill sets, EisnerAmper is a place where professionals of all experience levels thrive. Our Lifelong Learning program, combined with technical training opportunities for staff, ensure that this is a place where our employees can grow — and with a rich office culture and a strong commitment to work/life balance, EisnerAmper is a place where you'll be happy to do so. To be considered for employment, visit www.careers.eisneramper.com, complete an employment application and Explore Your Next Opportunity with EisnerAmper.

EisnerAmper is an equal opportunity employer. Qualified applicants will receive consideration for employment without regard to race, color, religion, sex, sexual orientation, gender identity, national origin, disability or protected veteran status.",1963,Accounting & Tax,$100 to $500 million (USD),Financial Services,1001 to 5000 Employees,Company - Private,False
