Job Title,Company Name,Location,Salary Estimate,Rating,Job Description,Founded,Industry,Revenue,Sector,Size,Type,Easy Apply
Board Certified Assistant Behavior Analyst (BCaBA),Key Pieces Therapy,"Bossier City, LA",$50K - $60K (Employer est.),-1.0,"Board-Certified Assistant Behavior Analyst Job Description

Summary of Duties

The Assistant Behavior Analyst is primarily responsible for conducting functional behavior assessments and developing behavior plans based on these assessments, under the supervision of a certified BCBA. The BCaBA is to ensure the effective implementation of all treatment plans and programming for their clients on their caseload as described by the fundamental responsibilities listed below.

Fundamental Responsibilities

Adheres to professional and legal requirements, the principles of behavior analysis and demonstrates sound professional judgment at all times.
Collaborates with families, caregivers and all service providers as necessary to ensure continuity of care.
Performs direct and indirect assessments to identify the function of client’s behaviors.
Assists the BCBA in developing a treatment plan (including behavior support plan) based on the functions of the behavior and treatment methodologies that are evidence-based.
Attends all relevant meetings for clients, including treatment team meetings, IEP/ISP (as allowed/needed) and staffing. Adequately demonstrates their abilities to work effectively as a part of a clinical team.
Assists in collecting data before and during the implementation of the plan so that the plan’s efficacy can be assessed and data-based decisions can be made.
Provides direct instruction/ongoing supervision, training and support to clients, staff members and family members during regularly scheduled visits. This includes visiting each client twice a month in all relevant environments.
Evaluates the effectiveness of the implemented treatment plan and modifies the plan as necessary.
Manages caseload and prepares and submits all required documentation on time. This includes, but is not limited to: assessments, treatment plans/BSPs, insurance updates as required, session notes after every session, at least monthly analysis of the data, updating the treatment plans as needed.
Maintains scheduled meetings with the BCBA to maintain supervision standards and exceptional service delivery.
Performs other duties as requested/assigned.

Qualifications

Must have a bachelor’s degree and BCaBA certification.
Must be able to identify and resolve obstacles in a timely manner; gather and analyze data; develop alternative solutions and must work well in a group problem solving situations.
Must maintain confidentiality at all times.

Job Type: Full-time

Pay: $50,000.00 - $60,000.00 per year

Benefits:

401(k)
401(k) matching
Dental insurance
Health insurance
Life insurance
Referral program
Vision insurance

Medical specialties:

Pediatrics

Schedule:

8 hour shift
Monday to Friday

Work Location: In person",-1,-1,-1,-1,-1,-1,True
Inventory Analyst,"PosiGen
","New Orleans, LA",$60K - $70K (Employer est.),3.2,"Join the Solar For All Revolution!

At PosiGen, we are passionate about providing money saving solar and energy efficiency solutions for people of all income levels. We are seeking an equally passionate Inventory Analyst to that helps manage analytics for inventory items and monitors the day-to-day inventory operations while implementing an agreed-upon controls and protocol. The Inventory analyst will maintain and improves inventory by analyzing statistics on purchasing, shipping, billing, cycle counts, and overall daily movements.

This position is Remote/Hybrid out of Houston, TX and New Orleans, LA location

Essential Job Functions

Work with management and procurement to develop the proper inventory BI model and analytics, for managing daily equipment movements, purchase order receipts, sales order shipments, cycle counts, and adjustments.
Monitor ERP and inventory system daily for system mapping errors, transaction error capture and resolution.
Collaborate with other business units on inventory processes and inventory tracking
Monitor complete and accurate documentation of inventory records.
Analyze inventories to determine how to increase inventory turns, reduce waste, and optimize SKU utilization.
Develop strong partnerships between data engineering, finance and other business functions
Prepare weekly, monthly, quarterly, and annual summaries related to procurement and inventory accuracy.
Compile, analyze, and evaluate data regarding spend vs budget analysis for different item categories (indirect and direct procurement).

Competencies

Capable of demonstrating sound judgment and independent decision-making
Maintain metrics and analyze data to assess performance and suggest improvements.
Possess strong analytical, problem-solving, and organizational skills, related to people and inventory
Ability to work with upper management.
Strong written, verbal, and communication skills

Education/Experience

Bachelor’s or Graduate Degree in business, business administration, computer science or
information technology, or equivalent experience.
2-4 years inventory analytics.
Fluent in Inventory planning systems, ERP, root cause analysis, Microsoft Excel, and BI Solutions experience.

About PosiGen

PosiGen is a people-centric, rapidly growing residential solar company committed to making Solar For ALL a reality. We aim to simplify solar, improve home efficiency, and generate opportunities for the underserved through our first of its kind, no credit check, guaranteed savings solar leasing program.

As employees at PosiGen, we are passionate about furthering our mission of Solar For ALL. At PosiGen, we celebrate the individual and foster an environment where employees can be their true self. We strive to live every day by our values:

Act with Integrity
Be Humble, Be Kind
Collaborate and Seek to Understand
Deliver on our Promises
Engage Passionately

EEO Statement

PosiGen is an Equal Opportunity / Affirmative Action employer committed to diversity in the workplace. All qualified applicants will receive consideration for employment without regard to race, color, religion, sex, sexual orientation, gender identity, national origin, disability, protected veteran status, or any other factor protected by applicable federal, state, or local laws. Individuals who require reasonable accommodations under the Americans with Disabilities Act in order to participate in the search process should notify the Office of Human Resources.

Base Salary
$60,000—$70,000 USD",2011,Energy & Utilities,$100 to $500 million (USD),"Energy, Mining & Utilities",501 to 1000 Employees,Company - Private,True
Data Analyst,"General Dynamics Information Technology
","Bossier City, LA",-1,4.0,"GDIT is seeking a Data Analyst to support its Technology Shared Services (TSS) Data and Analytics organization. As a Data Analyst, you will support GDIT's customers with data-informed solutions tailored to their unique needs.

You will find yourself at the heart of GDIT's customer-centric approach, playing a pivotal role in ensuring our customers successfully meet their strategic goals. You will use your project management and data skills to promote organizational goals to completion. If you enjoy collaborating with others in a fast-paced environment, you will find this role to be both rewarding and challenging.

GDIT is your place. You make it your own. Bring your creativity to help us find simple solutions to complex problems. By owning your opportunity at GDIT, you'll play an essential part in preparing our nation for the future. At GDIT, our employees are driven, resourceful, and unwavering.

GDIT is committed to fostering economic growth and prosperity in Louisiana, with established operations in multiple locations throughout the state, including facilities in New Orleans, Natchitoches, and our Integrated Technology Center in Bossier City, LA. This position offers the flexibility to work 100% remotely from anywhere within the state of Louisiana.

HOW A DATA ANALYST WILL MAKE AN IMPACT

Leads data insights projects and team members in delivery to schedule and scope objectives.
Collects and analyzes large data sets to identify trends, patterns, and insights.
Designs and builds dashboards and reports for all levels of the organization, including executives and staff.
Presents insights to both technical and non-technical team members and stakeholders, assisting in making informed, data-driven decisions.
Contributes to a variety of complex data-related projects, including machine learning, predictive modeling, and analytics.
Mentors and guides junior data analysts and engineers.
Leverages large sets of structured and unstructured data to develop tools and techniques for robust data analysis.
Collaborates with different teams to understand their data needs and create solutions that solve problems and streamline workflows.
Continually evaluate emerging technologies and stay updated on modern data architecture and analyses trends to implement in future projects.

WHAT YOU'LL NEED TO SUCCEED
Education:

BA/BS (or equivalent years of experience)

Required Experience:

2+ years of relevant experience

Required Skills and Abilities:

Experienced in consulting and supporting executives and senior leadership.
Expert-level experience in dashboard design, data visualization, and with Tableau and Power BI.
Experienced with Structured Query Language (SQL).
Strong Excel background; familiarity with other Microsoft tools (Outlook, Word, Excel, PowerPoint)
Ability to effectively manage multiple competing priorities at any given time.
Good team player, able to manage multiple assignments, and adapt to changing client needs.
Outstanding communication skills with the ability to present to business leaders.
Ability to work independently and as a team lead.
Excellent communication and presentation skills with the ability to present complex data insights to both technical and non-technical audiences.
Strong analytical skills with the ability to collect, organize, analyze, and disseminate insights with attention to detail and accuracy.
Good team player, able to manage multiple assignments, and adapt to changing client needs.
Skilled in implementing advanced statistical techniques and concepts (regression, properties of distributions, statistical tests, and proper usage, etc.)
Experienced in implementing some machine learning techniques (may include supervised and unsupervised learning, deep learning, natural language processing, ensemble methods, dimensionality reduction)
Familiarity with machine learning frameworks (like Keras or PyTorch), libraries (like scikit-learn), and computing platforms (like Jupyter).

Preferred Skills and Abilities:

Certifications in Tableau and/or Power BI
Certifications in AWS and Azure
Secret clearance or ability to obtain
Knowledge of ITIL framework
Knowledge of Agile methodology
Familiarity with Azure DevOps or similar tool(s)
Experience with Python and R
Link to sample Tableau, Power BI, and data visualization work/portfolio is preferred.
Demonstrated experience consulting with internal and external customers to understand business needs and make recommendations.
Previous experience in the defense or government sector
Familiarity with cloud services: AWS, Google Cloud, Microsoft Azure, etc.) and big data tools is plus.

GDIT IS YOUR PLACE:

Full-flex work week to own your priorities at work and at home
401K with company match
Comprehensive health and wellness packages
Internal mobility team dedicated to helping you own your career
Professional growth opportunities including paid education and certifications
Cutting-edge technology you can learn from
Rest and recharge with paid vacation and holidays

Work Requirements

.cls-1{fill:none;stroke:#5b6670;stroke-miterlimit:10;stroke-width:2px;}
Years of Experience
2 + years of related experience


may vary based on technical training, certification(s), or degree

.cls-1,.cls-2{fill:none;stroke:#5b6670;stroke-miterlimit:10;}.cls-1{stroke-width:1.77px;}.cls-2{stroke-width:2px;}
Certification

.cls-1{fill:none;stroke:#5b6670;stroke-miterlimit:10;stroke-width:2px;}
Travel Required
None

About Our Work

We are GDIT. A global technology and professional services company that delivers consulting, technology and mission services to every major agency across the U.S. government, defense and intelligence community. Our 30,000 experts extract the power of technology to create immediate value and deliver solutions at the edge of innovation. We operate across 30 countries worldwide, offering leading capabilities in digital modernization, AI/ML, Cloud, Cyber and application development. Together with our clients, we strive to create a safer, smarter world by harnessing the power of deep expertise and advanced technology.

GDIT is an Equal Opportunity/Affirmative Action employer. All qualified applicants will receive consideration for employment without regard to race, color, religion, sex, sexual orientation, gender identity, national origin, disability, or veteran status, or any other protected class.",1996,Information Technology Support Services,$10+ billion (USD),Information Technology,10000+ Employees,Subsidiary or Business Segment,False
Business Analyst (Local Candidates Only),"GOLFBALLS.COM
","Lafayette, LA",$43K - $68K (Glassdoor est.),4.1,"About Us:

Golfballs.com is the World Leader in Golf Customization; and offers a complete selection of balls, clubs, shoes, apparel, and more from golf ball top brands. Golfballs.com sells and prints over 300,000 customized golf balls each week, utilizing our proprietary visualization and fulfillment platforms.

Job Summary:
We are seeking a highly motivated and detail-oriented Business Analyst to join our team. The ideal candidate will play a crucial role in gathering and analyzing business data, identifying trends and insights, and translating them into actionable recommendations. If you have a passion for problem-solving, a strong analytical mindset, and the ability to work collaboratively with cross-functional teams, we encourage you to apply.

Key Responsibilities:



Data Gathering and Analysis: Collect, organize, and analyze business data, including financial reports, customer data, and market research, to identify trends, patterns, and opportunities.
Requirements Elicitation: Collaborate with stakeholders to understand business needs, define project requirements, and document them effectively.
Process Improvement: Identify and evaluate business processes for efficiency and effectiveness, recommending improvements and optimizations.
Data Modeling and Visualization: Create data models and visual representations (e.g., flowcharts, diagrams, dashboards) to communicate findings and insights effectively.
Reporting and Documentation: Develop clear and concise reports, documentation, and presentations to convey analysis results and recommendations to various stakeholders.
Budget Planning and Management: Collaborate with financial teams to develop and maintain budgets, forecast financial performance, and track expenditures, ensuring alignment with organizational goals.
Risk Assessment: Assess potential risks and challenges associated with proposed business solutions and provide risk mitigation strategies.
Quality Assurance: Collaborate with the quality assurance team to ensure that project outcomes meet defined business requirements and quality standards.
Project Management: Assist in project planning, scheduling, and monitoring to ensure timely and successful project completion.
Change Management: Support change initiatives by facilitating communication and training, as well as assessing the impact of changes on the organization.
Continuous Learning: Stay updated on industry trends, emerging technologies, and best practices in business analysis to contribute to ongoing process improvement.

Qualifications:

Bachelor’s degree in business, Economics, Finance, or a related field. MBA or similar advanced degree is a plus.
Proven experience as a Business Analyst or in a similar analytical role, with a track record of solving complex business problems.
Strong analytical and problem-solving skills, with proficiency in data analysis tools and techniques.
Excellent communication skills, including the ability to present findings and recommendations to both technical and non-technical audiences.
Knowledge of project management methodologies and tools.
Proficiency in data modeling and visualization tools, such as Microsoft Excel, Tableau, Power BI, or similar platforms.
Detail-oriented and able to work effectively both independently and as part of a team.
Strong interpersonal skills and the ability to collaborate with stakeholders at all levels of the organization.
A proactive and adaptable approach to handling changing priorities and business needs.

Benefits:

Health and dental insurance.
Retirement plan options.
Paid time off and flexible work arrangements.
Opportunities for professional development and training.

Join our team as a Business Analyst and contribute to the success and growth of our organization through data-driven insights and effective business solutions. If you have the skills and passion for analysis and problem-solving, we want to hear from you. Apply today!",1995,Sporting Goods Stores,$25 to $100 million (USD),Retail & Wholesale,51 to 200 Employees,Company - Private,True
IT D365 Business Analyst,"Morgan Advanced Materials
",United States,-1,3.2,"Overview:

Morgan Advanced Materials is a business rich in history and innovation. Founded in the UK in 1856, we have grown into a global organisation with 70 sites in 18 countries. Our model to serve our customers where they need us has led to a diversified product range using our unparalleled expertise in ceramic and carbon materials, which we exploit to solve difficult problems for our customers across a diverse range of markets.


We are a purpose driven organisation. Our purpose is to use advanced materials to make the world more sustainable and to improve the quality of life. We deliver on that purpose through the products that we make, and the way that we make them.


We help our customers push the limits of their processes and products to meet the demanding requirements they face, from higher process temperatures to higher product performance to increasing miniaturisation.

Key Figures: Revenue £1,112m (2022), ~8,500 employees, manufacturing in 30+ countries, and a global customer portfolio. A UK PLC with head office located in Windsor, Berkshire UK. Listed on London Stock Exchange; Member of the FTSE 250 Index.


Responsibilities:

OVERVIEW & SCOPE OF ROLE:

Morgan IT is on a mission to enable and drive the Morgan goals by being a valuable business partner to all Global Business Units and Functions by:

Running Effective and Efficient IT
Delivering Solid Business Foundations
Extracting Maximum Business Value from IT
Driving disruptive innovation

To do so, the OneIT team is currently executing on a strategic roadmap to make significant step changes in IT performance and business value from IT.


ESSENTIAL DUTIES & REPONSIBILITIES:
The D365 IT Business Analyst will ensure the line of business applications, primarily Dynamics 365 (D365), can sustain current and future business needs for our businesses. This role is responsible for providing D365 technical and functional expertise, ensuring business requirements are gathered and subsequent technical/functional resolutions are implemented appropriately. In addition, the role will ensure efficient and effective business as usual operation of D365, including remediation of issues.

The D365 IT Business Analyst understands both technology as well as business and is responsible to capture all business requirements in order to ensure proper IT solutions are delivered. The key focus is mapping functional requirements of the Finance & Supply Chain modules in D365, data and processes.
Key Accountabilities
Serves as liaison to business and IT teams to understand business requirements and create and implement solutions as well as understanding root causes of current issues.
Assembling business requirements with requisite analysis and translation into D365 solutions; along with alternative options and recommendations.
Supports designing business solutions that ensure alignment with the architecture principles and standards.
Documents and provides training for newly implemented systems and/or processes using Click Learn
Resolving incidents/issues, with root cause analysis and fix where appropriate, for D365 applications.
Applying functional and technical understanding of D365 to develop new functionality and integrations/interfaces with other systems as required, to support business growth.
Ensuring all aspects of the D365 development lifecycle are completed successfully, incorporating ISV solutions.
Assuring quality of releases (fixes/upgrades/enhancements etc) into production, through thorough testing and first-class environment management.
Ensuring vendor relationships remain transparent and with clearly understood outcomes
Supports Business Information Managers, Project Managers and Solution Architects in writing program / project proposals
Work with business end users to ensure the project meets business needs
Assumes ownership of the process, system, and expands skill base.
Interacts frequently with business process owners.
Conduct unit testing for project deliverables and facilitate user acceptance testing
Engage in efforts to establish scope and business case for new programs and initiatives.
Collaborate with team members to collect and analyse data
Qualifications:

OVERVIEW & SCOPE OF ROLE:

Morgan IT is on a mission to enable and drive the Morgan goals by being a valuable business partner to all Global Business Units and Functions by:

Running Effective and Efficient IT
Delivering Solid Business Foundations
Extracting Maximum Business Value from IT
Driving disruptive innovation

To do so, the OneIT team is currently executing on a strategic roadmap to make significant step changes in IT performance and business value from IT.


ESSENTIAL DUTIES & REPONSIBILITIES:
The D365 IT Business Analyst will ensure the line of business applications, primarily Dynamics 365 (D365), can sustain current and future business needs for our businesses. This role is responsible for providing D365 technical and functional expertise, ensuring business requirements are gathered and subsequent technical/functional resolutions are implemented appropriately. In addition, the role will ensure efficient and effective business as usual operation of D365, including remediation of issues.

The D365 IT Business Analyst understands both technology as well as business and is responsible to capture all business requirements in order to ensure proper IT solutions are delivered. The key focus is mapping functional requirements of the Finance & Supply Chain modules in D365, data and processes.
Key Accountabilities
Serves as liaison to business and IT teams to understand business requirements and create and implement solutions as well as understanding root causes of current issues.
Assembling business requirements with requisite analysis and translation into D365 solutions; along with alternative options and recommendations.
Supports designing business solutions that ensure alignment with the architecture principles and standards.
Documents and provides training for newly implemented systems and/or processes using Click Learn
Resolving incidents/issues, with root cause analysis and fix where appropriate, for D365 applications.
Applying functional and technical understanding of D365 to develop new functionality and integrations/interfaces with other systems as required, to support business growth.
Ensuring all aspects of the D365 development lifecycle are completed successfully, incorporating ISV solutions.
Assuring quality of releases (fixes/upgrades/enhancements etc) into production, through thorough testing and first-class environment management.
Ensuring vendor relationships remain transparent and with clearly understood outcomes
Supports Business Information Managers, Project Managers and Solution Architects in writing program / project proposals
Work with business end users to ensure the project meets business needs
Assumes ownership of the process, system, and expands skill base.
Interacts frequently with business process owners.
Conduct unit testing for project deliverables and facilitate user acceptance testing
Engage in efforts to establish scope and business case for new programs and initiatives.
Collaborate with team members to collect and analyse data


Morgan Advanced Materials is an EEO/AA/M/W/D/V Employer Ind-1",1856,Metal & Mineral Manufacturing,$1 to $5 billion (USD),Manufacturing,5001 to 10000 Employees,Company - Public,False
