Job Title,Company Name,Location,Salary Estimate,Rating,Job Description,Founded,Industry,Revenue,Sector,Size,Type,Easy Apply
Technical Analyst (Data Analytics),"Contact Government Services, LLC
","New Orleans, LA",$67K - $99K (Glassdoor est.),4.7,"Technical Analyst (Data Analytics)
Employment Type: Full-Time, Experienced
Department: Legal/ Information Technology

CGS is seeking a Technical Analyst to join our team supporting a wide-ranging technical support initiative for a large Federal agency.

CGS brings motivated, highly skilled, and creative people together to solve the government’s most dynamic problems with cutting-edge technology. To carry out our mission, we are seeking candidates who are excited to contribute to government innovation, appreciate collaboration, and can anticipate the needs of others. Here at CGS, we offer an environment in which our employees feel supported, and we encourage professional growth through various learning opportunities.

Skills and attributes for success:
Ability to consult with contractors and government management to solve complex litigation support requirements.
Ability to make recommendations for technical solutions including application development, applications. management, documentation, quality assurance, and user support.
Ability to provide technical advice, supervision, and guidance to the contractor support team.
Ability to evaluate programs in terms of efficiency, effectiveness, quality, and interoperability with client systems.
- Ability to evaluate software and hardware requirements along with short- and long-range planning, including systems integration solutions and telecommunications requirements.
Ability to translate advanced concepts into practical and effective solutions using structured techniques to define requirements.
Ability to develop feasible alternatives and estimate costs of implementation.
Ability to make presentations of findings, recommendations, and specifications in formal reports and oral presentations to a variety of audiences, including non-technical personnel.
Ability to perform supervisory or managerial duties.

Qualifications:
Bachelor of Science.
Data Analytics experience.
Relativity experience.
Nuix experience.
Litigation support experience.
Client relationship and management experience.

Ideally, you will also have:
At least five years of specific, hands-on experience.
strong background in data analytics.
Ability to demonstrate a successful history of difficult and complex problem-solving for the appropriate systems.
Excellent oral and written communication skills.
Graduate degree in computer science or information management/ technology.
Some supervisory or managerial experience.
Our Commitment:
Contact Government Services (CGS) strives to simplify and enhance government bureaucracy through the optimization of human, technical, and financial resources. We combine cutting-edge technology with world-class personnel to deliver customized solutions that fit our client’s specific needs. We are committed to solving the most challenging and dynamic problems.

For the past seven years, we’ve been growing our government contracting portfolio, and along the way, we’ve created valuable partnerships by demonstrating a commitment to honesty, professionalism, and quality work.

Here at CGS we value honesty through hard work and self-awareness, professionalism in all we do, and to deliver the best quality to our consumers mending those relations for years to come.

We care about our employees. Therefore, we offer a comprehensive benefits package.
Health, Dental, and Vision
Life Insurance
401k
Flexible Spending Account (Health, Dependent Care, and Commuter)
Paid Time Off and Observance of State/Federal Holidays

Contact Government Services, LLC is an Equal Opportunity Employer. Applicants will be considered without regard to their race, color, religion, sex, sexual orientation, gender identity, national origin, disability, or status as a protected veteran.

Join our team and become part of government innovation!
Explore additional job opportunities with CGS on our Job Board:
https://cgsfederal.com/join-our-team/
For more information about CGS please visit: https://www.cgsfederal.com or contact:
Email: info@cgsfederal.com",-1,-1,Unknown / Non-Applicable,-1,1 to 50 Employees,Company - Public,True
Senior Data Analyst Marketing and Sales,"Cox Communications
","New Orleans, LA",$77K - $116K (Employer est.),4.0,"The Senior Data Analyst will be responsible for CCI's efforts to develop and expand an analytically driven business performance evaluation framework. You will support the testing, analysis, and reporting function in projects across multiple functional areas of the business, including Marketing, Pricing, Sales, Operations and others. This role requires a creative individual who possesses skills in data handling, model development, analytics, and storytelling. Innovation is encouraged and a desire to collaborate well with our team, boundary partners, and leaders across the organization is a must.

Cox Communications is seeking a Senior Data Analyst who is experienced in:

Data mining, modeling, analysis, and visualization.
Analytical capabilities building and continuous improvement.
Using data analysis to assess the performance and identify insights of strategies and tests.




In this role you are part of a team responsible for CCI's efforts to develop and expand an analytically driven business performance evaluation framework. You will support the testing, analysis, and reporting function in projects across multiple functional areas of the business, including Marketing, Pricing, Sales, Operations and others. This role is a unique opportunity to help deliver on the vision to grow analytical capabilities, as well as support the development of key strategies critical to the business.

What You'll Do:


Serve as a subject matter expert supporting effectiveness analysis, including:

A/B testing and multivariate experiments.
Sales, Marketing, Pricing performance, including evaluation of strategy objectives.
Performance of offers, customer migration, churn, etc.
Designs and develops big data-based models and reporting tools using tools like SQL and Python in the Snowflake environment.
Identifies and mine new data resources to enable reporting and advanced analytics.
Translates data and trends into actionable insights via regular and ad-hoc reports that tell our competitive story.
Understands organizational objectives and helps improve reporting, analytics, and development projects to meet these goals.
Provides support to ad-hoc requests from senior leaders and boundary partners.
Ensure data accuracy, integrity, and consistency by implementing data validation and quality assurance procedures .
Provides Data Analysis services across multiple products, business or organizational areas.
Interacts with business leaders to understand key objectives and concerns.
Develops database logic to extract required information for reporting.
Supports efforts to distill massive amounts of complicated data into meaningful and actionable insights.
Designs, develops and implements dashboards and reports to facilitate data review and analysis.
Manage and prioritize multiple projects, ensuring that they are delivered on time and within budget.
Drives successful projects by providing action-oriented analyses, optimization and a data-driven approach.




What's In It For You:

At Cox, we reward your hard work with meaningful benefits.

First, we offer a highly competitive compensation package, 401(k) with a generous company match, comprehensive healthcare, life, and disability benefits, plus numerous other benefits, including adoption assistance, pet insurance, and discounts on travel and cars!

We value people more than technology. That means you'll work within a culture and with a team that values your leadership, your experience, your contributions, and you - yes, you - as a person. We believe recognition is important, and Cox strives to celebrate those who help make us successful every day. We also encourage diversity and support inclusion; we want you to do you and feel comfortable doing so.

We also offer boundless opportunities for growth; you can sharpen your skills, learn a new talent, join a mentoring program, even earn an advanced degree. You'll find the potential for lateral or upward career growth within the Cox family businesses, including the innovative startups in transportation mobility, clean tech and more.

Who You Are:

Minimum



Bachelor's degree in a related discipline and 4 years of experience in a related field (Marketing, Data Analytics or related field). The right candidate could also have a different combination, such as a master's degree and 2 years of experience, a Ph.D. and 1 year of experience or 8 years of experience in a related field with no degree.
Analytical/financial analysis background.
Strong multitasking, analytical and creative skills.
Self-starter with strong organizational, detail and follow-up skills.
Excellent interpersonal, leadership, presentation, and collaborative skills to work effectively with teams throughout the organization.
Demonstrated business acumen, problem solving and critical thinking skills.
Develop framework to analyze effectiveness of offer recommendations, strategy rules and processes; provide insights to strategy teams for improvements.
Ability to translate and communicate complex analyses clearly and concisely.
Conducts business/strategy impact analyses, validations, and measurement through all stages from concept formulation, definition of metrics, determination of appropriate statistical methodology, research evaluation, and final presentation
Ability to work independently with minimal supervision.
Deadline driven, ability to work with a sense of urgency.
Proficiency with quantitative tools including Excel and presentation tools such as PowerPoint and willingness to learn new tools that may be valuable to the team.
Continuous learner mindset.
Comfort setting direction and drawing insight from multiple (and often unclear) data sources.
Hands on experience with SQL.
Hands on experience with BI and dashboarding tools (MicroStrategy, Tableau, Power BI, or similar reporting tools.)




Preferred



Bachelor's degree in marketing, data analytics, engineering, computer science, economics, finance or similar analytical or technical field.
Telecommunications, cable industry, high tech, or consulting experience.
Familiarity with financial and data modeling techniques.
Interest in learning (or prior experience with) statistical analysis methods.
Strong knowledge of programming languages SQL, Python, R.
Experience working with Snowflake, AWS (Amazon Web Services) and/or ThoughtSpot.
Process management tools such as Airtable.




Join the Cox family of businesses and make your mark today!

USD 77,000.00 - 115,600.00 per year

About Cox Communications

Cox Communications is the largest private telecom company in America, serving six million homes and businesses. That's a lot, but we also proudly serve our employees. Our benefits and our award-winning culture are just two of the things that make Cox a coveted place to work. If you're interested in bringing people closer through broadband, smart home tech and more, join Cox Communications today!

About Cox

Cox empowers employees to build a better future and has been doing so for over 120 years. With exciting investments and innovations across transportation, communications, cleantech and healthcare, our family of businesses - which includes Cox Automotive and Cox Communications - is forging a better future for us all. Ready to make your mark? Join us today!

Benefits of working at Cox may include health care insurance (medical, dental, vision), retirement planning (401(k)), and paid days off (sick leave, parental leave, flexible vacation/wellness days, and/or PTO). For more details on what benefits you may be offered, visit our benefits page .

Cox is an Equal Employment Opportunity employer - All qualified applicants/employees will receive consideration for employment without regard to that individual's age, race, color, religion or creed, national origin or ancestry, sex (including pregnancy), sexual orientation, gender, gender identity, physical or mental disability, veteran status, genetic information, ethnicity, citizenship, or any other characteristic protected by law.

Statement to ALL Third-Party Agencies and Similar Organizations: Cox accepts resumes only from agencies with which we formally engage their services. Please do not forward resumes to our applicant tracking system, Cox employees, Cox hiring manager, or send to any Cox facility. Cox is not responsible for any fees or charges associated with unsolicited resumes.",1962,"Cable, Internet & Telephone Providers",$10+ billion (USD),Telecommunications,10000+ Employees,Company - Private,False
Data Senior Analyst,"Cox Communications
","New Orleans, LA",$77K - $116K (Employer est.),4.0,"A data senior analyst is responsible for providing data driven insights and analytical support for key projects, programs and initiatives within Customer Experience Operations. Applies critical thinking, problem solving, data visualization techniques, and analytical acumen to develop and deliver reporting, analysis and recommendations that support decision making and deliver business insights.

PRIMARY RESPONSIBILITIES AND ESSENTIAL FUNCTIONS :

Works with business partners and stakeholders across multiple products, business or organizational areas to understand primary strategy, objectives and priorities; helps connect these goals with underlying data and delivers insight driven analysis.
Effectively translates complex data driven analysis into clear, meaningful and actionable findings; provides relevant solutions and recommendations.
Participates in collaborative, cross functional initiatives and projects; provides thought leadership on data requirements and scope of analysis necessary to support decision-making and deliver business insights.
Effectively utilizes tools, techniques and processes to gather, report and analyze data, including SQL, Python, Power BI, Tableau and other data mining, preparation and visualization tools.
Designs, develops implements and maintains various dashboards and reports, supporting multiple client groups.
Identifies, researches, and resolves discrepancies in analytical processes or cross-functional methods.
Analyzes current and historical performance, performs variance analyses of key metrics and identifies trends.
Creates scenario models to assist the business in complex decision making and forecasting outcomes.
Solicits feedback and continuous learning opportunities to expand knowledge and capabilities related tools, techniques, relevant data analytics principles and methods required to perform operational analysis.
Meet established timelines and committed tasks during each sprint cycle and proactively communicates any risks, issues or challenges in meeting deliverables.



QUALIFICATIONS AND EXPERIENCE:

Minimum



BA/BS degree in a related discipline (i.e. Business Intelligence & Analytics, Information Science, Data Science, Statistics, Mathematics, etc.) with 4 years of experience required in related field (e.g. reporting, statistics, data modeling, data analytics, data visualization, data interpretation); or 8 years of equivalent experience in lieu of a degree.
Skilled to advanced knowledge building highly visual interactive dashboards. (Tableau or Power BI preferred)
Successful candidates must know how to intuitively assimilate, manipulate, and visualize large quantities of data in a visually appealing and easily consumable manner.
Demonstrated experience working directly with leadership and supporting multiple stakeholders.
Skilled analytic and diagnostic skills utilizing a data-driven and metrics-driven approach.
Excellent communication (written and verbal) and presentation skills with a proven history of influencing outcomes and gaining alignment.
Proven ability to work efficiently, effectively, and proactively in a fast-paced, deadline-oriented, dynamic and virtual environment.
Proven ability to work in a cross-organizational team environment collaborating with the business leads on key analytical deliverables.



Preferred



Master's degree with 2 years of experience in a related discipline.
8 years successful experience developing advanced analytics solutions (e.g. predictive models, anomaly detection models, correlation models, etc.
Prior experience with data analytics in a contact center environment, specifically working with voice, chat, & digital data.
Prior operations and analytics experience with Cox Communications



USD 77,000.00 - 115,600.00 per year

About Cox Communications

Cox Communications is the largest private telecom company in America, serving six million homes and businesses. That's a lot, but we also proudly serve our employees. Our benefits and our award-winning culture are just two of the things that make Cox a coveted place to work. If you're interested in bringing people closer through broadband, smart home tech and more, join Cox Communications today!

About Cox

Cox empowers employees to build a better future and has been doing so for over 120 years. With exciting investments and innovations across transportation, communications, cleantech and healthcare, our family of businesses - which includes Cox Automotive and Cox Communications - is forging a better future for us all. Ready to make your mark? Join us today!

Benefits of working at Cox may include health care insurance (medical, dental, vision), retirement planning (401(k)), and paid days off (sick leave, parental leave, flexible vacation/wellness days, and/or PTO). For more details on what benefits you may be offered, visit our benefits page .

Cox is an Equal Employment Opportunity employer - All qualified applicants/employees will receive consideration for employment without regard to that individual's age, race, color, religion or creed, national origin or ancestry, sex (including pregnancy), sexual orientation, gender, gender identity, physical or mental disability, veteran status, genetic information, ethnicity, citizenship, or any other characteristic protected by law.

Statement to ALL Third-Party Agencies and Similar Organizations: Cox accepts resumes only from agencies with which we formally engage their services. Please do not forward resumes to our applicant tracking system, Cox employees, Cox hiring manager, or send to any Cox facility. Cox is not responsible for any fees or charges associated with unsolicited resumes.",1962,"Cable, Internet & Telephone Providers",$10+ billion (USD),Telecommunications,10000+ Employees,Company - Private,False
Data Specialist,"Contact Government Services, LLC
","New Orleans, LA",$45K - $76K (Glassdoor est.),4.7,"Data Specialist
Employment Type: Full-Time, Mid-Level
Department: Data Science

As a Data Specialist for CGS you will help our government client in processing data using LAW. The ideal candidate will regularly load large volumes of production data; running exports from the database for creating discovery party productions. Downloading files from our file sharing tool, JEFS, and performing quality control on load and export files to ensure accuracy is vital to this job position.

CGS brings motivated, highly skilled, and creative people together to solve the government’s most dynamic problems with cutting-edge technology. To carry out our mission, we are seeking candidates who are excited to contribute to government innovation, appreciate collaboration, and can anticipate the needs of others. Here at CGS, we offer an environment in which our employees feel supported, and we encourage professional growth through various learning opportunities.
Skills and attributes for success:
Modify load files and perform quality control on loaded data quickly and accurately
Assist with creating and updating document processing procedures as needed
Run multiple load streams simultaneously
Perform native file processing in LAW
Export data from Relativity to create load files for other various platforms as requested by Case Manager
Performs data conversion processing, including conversions of various document types
Perform special format data conversions and file manipulation requests
Handle quality control on load files and Relativity data loads and exports
Perform advanced requests, such as creating data exports for productions and performing quality control on files, and complicated overlays or appends, privilege clawbacks, and sequestration of documents
Perform quality control to confirm accuracy on loads completed by new Data Specialists
Provide hands-on training to other Data Specialist as needed
Perform basic Relativity searching and global updates to mark and/or tag records as requested; to include confirming record counts in Save Searches and Image redactions prior to creating exports for production
Clearly and accurately discusses data inconsistencies found with Project Manager
- Assists on calls relating to data load file formats or media encryption software with Case - Manager and other IT individuals as requested

Qualifications:
Modify load files and perform quality control on loaded data quickly and accurately
Assist with creating and updating document processing procedures as needed
Run multiple load streams simultaneously
Perform native file processing in LAW
Export data from Relativity to create load files for other various platforms as requested by Case Manager
Performs data conversion processing, including conversions of various document types
Perform special format data conversions and file manipulation requests
Handle quality control on load files and Relativity data loads and exports
Perform advanced requests, such as creating data exports for productions and performing quality control on files, and complicated overlays or appends, privilege clawbacks, and sequestration of documents
Perform quality control to confirm accuracy on loads completed by new Data Specialists
Provide hands-on training to other Data Specialist as needed
Perform basic Relativity searching and global updates to mark and/or tag records as requested; to include confirming record counts in Save Searches and Image redactions prior to creating exports for production
Clearly and accurately discusses data inconsistencies found with Project Manager
Assists on calls relating to data load file formats or media encryption software with Case Manager and other IT individuals as requested

Our Commitment:
Contact Government Services (CGS) strives to simplify and enhance government bureaucracy through the optimization of human, technical, and financial resources. We combine cutting-edge technology with world-class personnel to deliver customized solutions that fit our client’s specific needs. We are committed to solving the most challenging and dynamic problems.

For the past seven years, we’ve been growing our government-contracting portfolio, and along the way, we’ve created valuable partnerships by demonstrating a commitment to honesty, professionalism, and quality work.

Here at CGS we value honesty through hard work and self-awareness, professionalism in all we do, and to deliver the best quality to our consumers mending those relations for years to come.

We care about our employees. Therefore, we offer a comprehensive benefits package.
Health, Dental, and Vision
Life Insurance
401k
Flexible Spending Account (Health, Dependent Care, and Commuter)
Paid Time Off and Observance of State/Federal Holidays

Contact Government Services, LLC is an Equal Opportunity Employer. Applicants will be considered without regard to their race, color, religion, sex, sexual orientation, gender identity, national origin, disability, or status as a protected veteran.

Join our team and become part of government innovation!

Explore additional job opportunities with CGS on our Job Board:
https://cgsfederal.com/join-our-team/

For more information about CGS please visit: https://www.cgsfederal.com or contact:
Email: info@cgsfederal.com",-1,-1,Unknown / Non-Applicable,-1,1 to 50 Employees,Company - Public,True
