Job Title,Company Name,Location,Salary Estimate,Rating,Job Description,Founded,Industry,Revenue,Sector,Size,Type,Easy Apply
Contract Machine Learning Engineer,"Nomo International Inc.
","Edina, MN",$94K - $144K (Glassdoor est.),4.1,"Description:

As life changes, people want to maintain their independence, individuality, and freedom to keep living life confidently and on their terms. Caregivers want confidence that their loved one will be safe, and confidence that those receiving care will have help when they need it.

Nomo Smart Care offers caregivers a way to know how their loved one is doing and if they need help even when they can’t be there, all while allowing the loved one to keep their independence. We do this with a focus on customizable privacy options. We’re not a huge tech company here for data. We’re not looking to sell complicated features.

At Nomo, we are caregivers too. As a family-owned organization made up of a diverse mix of employees and partners, we offer simple, intelligent, and connected tools to help caregivers support their loved ones’ independence while answering the question, “How’s Mom?”.

Nomo Smart Care™ - Know More, Worry Less. ™

The primary function of the Machine Learning Engineer is to define processes, establish infrastructure, and contribute to enhancing the Machine Learning capabilities of the organization from the ground up. This includes creating, improving, and deploying ML models in an embedded environment, particularly focusing on applications like vision and audio classification. The Machine Learning Engineer will be responsible for software development, optimizing hardware and infrastructure, designing data pipelines, and implementing robust AI solutions for real-world use cases. The role also involves a strong emphasis on driving projects from inception to production and delivering impactful solutions that contribute to customer success.


What You'll Do

As a Machine Learning Engineer, you will be a driving force in shaping our ML infrastructure and capabilities. Your responsibilities will encompass:

Defining processes and best practices to establish the Machine Learning infrastructure at Nomo, contributing to the evolution and enhancement of our ML capabilities.
Creating, enhancing, and deploying ML models within an embedded environment.
Developing and deploying ML solutions on embedded devices, spanning diverse application areas such as vision and audio.
Engaging in software development, optimizing infrastructure and hardware, designing data pipelines, and innovating to implement robust AI solutions for real-world use cases.
Requirements:
Strong software development skills, with proficiency in relevant programming languages and AI/ML frameworks (e.g., Python, TensorFlow Lite).
Hands-on experience in successfully shipping machine learning-based projects into production and delivering tangible impact to customers.
Solid domain knowledge in vision and audio classification, showcasing your expertise in these specific areas.
A high level of motivation, coupled with strong communication skills. You should be driven to lead projects from concept to production.
Excellent verbal and written communication skills in English.

Extra Credit

While not mandatory, possessing the following qualification will be a significant advantage:

Experience in creating and deploying TFLite models on ESP32 devices, demonstrating your ability to work with specific embedded hardware.

If you're excited about shaping the future of Machine Learning, driving innovation, and delivering impactful solutions, we encourage you to apply and be part of a team committed to pushing the boundaries of technology.

What we offer:

A fun and supportive team culture
Opportunities for professional growth and development
Access to the latest tools and technologies

If this sounds like you, then don't miss this opportunity to join our amazing team! Apply now by sending us your resume, and a cover letter explaining why you are the perfect fit for this role. We can't wait to hear from you! As life changes, people want to maintain their independence, individuality, and freedom to keep living life confidently and on their terms. Caregivers want confidence that their loved one will be safe, and confidence that those receiving care will have help when they need it.",2021,Investment & Asset Management,Unknown / Non-Applicable,Financial Services,51 to 200 Employees,Company - Private,False
Sr Digital Data Analyst,"Ameriprise Financial
","Minneapolis, MN",-1,3.8,"Support modeling, data analysis, campaign execution, and database needs for assigned line of business. Manage large data sets, providing information-based decision logic and predictive modeling solutions, and translates modeling/analytic output into understandable/actionable business knowledge, insight and applications. Demonstrate strong technical/problem solving skills. Support multiple projects collaboratively.

Key Responsibilities

Assist in the development and implementation of complex analytical solutions leveraging tools such as predictive modeling, advanced machine learning techniques, simulation, optimization solutions, etc., with respect to credit card, lending and cash products for marketing and risk management purposes. May lead efforts on small-medium sized projects.

Assist in dataset creation including data extraction, derived and dependent variable creation, and data quality control processes for analytics, model development, and validation. May monitor execution of analytical solutions, including criteria specification, data sourcing, segmentation, analytics, selection, delivery, and back-end data capture results. Partner closely with leader and others to ensure proper delivery.

Consult and coordinate campaign execution for direct to client campaigns. Assist in identifying and executing targeting and optimization opportunities.

Under direction of the Sr. Leader, collaborate with business leaders and/or analysts to provide analytical thought leadership and support for business problems. Help identify and interpret business needs, define high-level business requirements, strategy, technical risks, and scope. Develop, document, and communicate business-driven analytic solutions and capabilities, translating modeling and analytic output into understandable and actionable business knowledge.

Embed analytic programs and tools. Ensure continued accuracy, relevancy, and effectiveness and track process improvements once deployed.

Ensure adherence to data and model governance standards that are set and enforced by industry standards and/or enterprise and business unit data governance polices and leaders.

Contribute to ongoing expansion of data science expertise and credentials by keeping up with industry best practices, developing new skills, and knowledge sharing. Work cross functionally to develop standardized/automated solutions and adopt best practices.


Required Qualifications

Master's degree

1 to 3 years of relevant experience required.

Knowledge of advanced statistical concepts and techniques; skilled in linear algebra.

Competence using advanced statistical methods such as generalized regression models, Bayesian methods, random forest, gradient boosting, neural networks, machine learning, clustering, or similar methodologies.

Experience with statistical programming (SAS, R, Python, SQL etc.) & data visualization software in a data-rich environment.

Ability to present/communicate complex, technical materials in a way that facilitates decision making and drives outcomes; ability to communicate to less technical partners.

Proven ability to apply both strategic and analytic techniques to provide business solutions and recommendations.

Ability to work effectively in a collaborative team environment.


Preferred Qualifications

Ph.D

Degree in Quantitative Discipline (i.e. Finance, Statistics, Computer Science, Actuarial Science, Economics, Engineering, etc.)

Experience conducting analyses of digital data using modern analytics tools and skills.

Some technical understanding of analytics tagging and implementation. (DTM, Launch, Tealium, Segment, GTM, Adobe Analytics)

Experience synthesizing results and analysis using visualizations and presentations for senior management audience.

Proficiency using multivariate testing tools such as Target or Optimizely (or similar tool).

Experience with big data technologies which may include Hadoop, Cloud Computing Environments (including container creation, management & deployment), Spark, etc..

About Our Company
We’re a diversified financial services leader with more than $1 trillion in assets under management and administration. Our team of 20,000 people in more than 20 countries advise, manage and protect the assets and income of more than 2 million individual, small business and institutional clients. We are a long-standing leader in financial planning and advice, a global asset manager and an insurer. Our unwavering focus on our clients and strong financial foundation connects each of our unique businesses - Ameriprise Financial Services, Columbia Threadneedle Investments and RiverSource Insurance and Annuities. Here, we foster meaningful careers, invest in the future, and make a difference for clients, institutions and communities around the world.

Ameriprise Financial is an equal opportunity employer. We consider all qualified applicants without regard to race, color, religion, sex, national origin, genetic information, age, sexual orientation, citizenship, gender identity, disability, veteran status, marital status, family status or any other basis prohibited by law.

Full-Time/Part-Time

Full time

Exempt/Non-Exempt

Exempt

Job Family Group

Data

Line of Business

MARKT Marketing",1894,Investment & Asset Management,$10+ billion (USD),Financial Services,10000+ Employees,Company - Public,False
"Senior Director, Data Science","RVO Health
","Minneapolis, MN",$188K - $240K (Employer est.),3.5,"AT A GLANCE

The RVO thesis is that integrating the consumer health journey and helping consumers access the right information, care, products, and services at the right time will add unique value to the lives of millions of people. We are a new joint venture formed through a partnership between Red Ventures, one of the world's premier digital and consumer analytics companies, and UnitedHealth Group, one of the largest healthcare providers in the world.

Data is a key component of executing on this thesis. We are bringing massive scale (100s of millions of consumers interact with our brands every month) at the top and bottom of the funnel together, and a key tenet of our strategy is leveraging our unique datasets to positively impact consumer health outcomes with our platform. Our opportunity as the data team is to surface the right tool, experience, or product at the right time to each consumer who comes to us looking for help navigating their health journey.

As the Sr. Director of Data Science and Analytics, you will fundamentally be responsible for leveling up how our business uses data to build products, optimizes the consumer experience, and grows our engaged member base. We are looking for someone who has the business acumen and strategic thinking of an MBA combined with the analytical skillset of someone who has spent years writing SQL and using statistical programming to drive business decisions and roadmaps.

Where You'll Be

To prioritize togetherness, culture, and accountability, RVO Health operates on a hybrid in-office work schedule. We expect employees to work from our Minneapolis office Tuesday, Wednesday and Thursday each week. You are welcome to work remotely Mondays and Fridays if you wish.

11000 Optum Cir Eden Prairie, MN 55344

What You'll Do
Help grow and lead a 7+ person Data Science function
Develop and execute a strategic roadmap for integrating AI and machine learning into our existing healthcare solutions, while actively contributing to the direction and execution of net new products powered by AI.
Stay at the forefront of AI research and technology trends, integrating cutting-edge methodologies into our initiatives.
Gain, or bring, deep healthcare domain expertise, and form executive-level relationships. Leverage your domain expertise, strong relationships, and technical skillset to put forward your own vision for what our priorities as a business should be and what capabilities we will be investing in.
Tell us what we can do, don't wait to be told what to do.
Deeply understand our existing data assets and data infrastructure.
Create multi-quarter strategic roadmaps partnering across data, engineering, product, marketing, and other functions, and back up each initiative proposed with a business case and rigorous articulation as to why this initiative should be prioritized.
What We're Looking For
You have a deep analytical background – extensive prior hands-on experience executing complex analyses leveraging SQL, Python, and a statistical programming
You have experience working with and some knowledge of multiple data functions – machine learning, data engineering – though your expertise is in analytics: driving stakeholder behavior change through understanding what data tells us we should do next.
You operate effectively at many levels: you are at home debating strategic decisions with business executives, and you can dive into the details of data science initiatives to provide tangible, concrete direction.
You view yourself as the CEO of your function – you treat your team like a P&L and enthusiastically measure the value your team adds and hold yourself and others to a high talent bar.
Preferred Qualifications
Proven experience in leading data science teams and AI initiatives, preferably in the healthcare industry.
Strong knowledge of machine learning, deep learning, natural language processing, and other AI technologies.
Proficiency in programming languages such as Python, and familiarity with data science libraries and frameworks.
Excellent communication and leadership skills to collaborate with cross-functional teams.
Understanding of healthcare data and regulations, such as HIPAA, is a plus.

Pursuant to various state Fair Pay Acts, below is a summary of compensation elements for this role at the company. The following benefits are provided by RVO Health, subject to eligibility requirements.

Starting Salary: $188,300 - $240,000

Note actual salary is based on geographic location, qualifications and experience
Access to a Free Udemy for Business subscription—thousands of hours of learning content on hundreds of different subjects at your fingertips
Health Insurance Coverage (medical, dental, and vision)
Life Insurance
Short and Long-Term Disability Insurance
Flexible Spending Accounts
Paid Time Off
Holiday Pay
401(k) with match
Employee Assistance Program
Paid Parental Bonding Benefit Program

This position may occasionally require travel for training and other work-related duties.

Who We Are:

Founded in 2022, RVO Health is a new healthcare platform of digital media brands, services and technologies focused on building relationships with people throughout their health & wellness journey. We meet people where they are in their personal health journeys and connect them with both the information and the care they need. RVO Health was created by joining teams from both Red Ventures and UnitedHealth Group's Optum Health. Together we're focused on delivering on our vision of a stronger and healthier world.

RVO Health is comprised of Healthline Media (Healthline, Medical News Today, Psych Central, Greatist and Bezzy), Healthgrades, FindCare and PlateJoy; Optum Perks, Optum Store and the virtual coaching platforms Real Appeal, Wellness Coaching, and QuitForLife.

We offer competitive salaries and a comprehensive benefits program for full-time employees, including medical, dental and vision coverage, paid time off, life insurance, disability coverage, employee assistance program, 401(k) plan and a paid parental leave program.

RVO Health is an equal opportunity employer that does not discriminate against any employee or applicant because of race, creed, color, religion, gender, sexual orientation, gender identity/expression, national origin, disability, age, genetic information, veteran status, marital status, pregnancy or any other basis protected by law. Employment at RVO Health is based solely on a person's merit and qualifications.

We are committed to providing equal employment opportunities to qualified individuals with disabilities. This includes providing reasonable accommodation where appropriate. Should you require a reasonable accommodation to apply or participate in the job application or interview process, please contact accommodations@rvohealth.com.

#LI-Hybrid

RVO Health Privacy Policy: https://rvohealth.com/legal/privacy",2022,Hospitals & Health Clinics,Unknown / Non-Applicable,Healthcare,1001 to 5000 Employees,Company - Private,False
Senior Risk & Compliance Data Analyst,"U.S. Bank National Association
","Minneapolis, MN",$87K - $113K (Employer est.),3.7,"At U.S. Bank, we’re on a journey to do our best. Helping the customers and businesses we serve to make better and smarter financial decisions and enabling the communities we support to grow and succeed. We believe it takes all of us to bring our shared ambition to life, and each person is unique in their potential. A career with U.S. Bank gives you a wide, ever-growing range of opportunities to discover what makes you thrive at every stage of your career. Try new things, learn new skills and discover what you excel at—all from Day One.

Job Description
Partners with their assigned Line of Business, other Risk/Compliance/Audit (RCA) professionals, and RCA Managers to, depending on their function, create, implement, maintain, review or oversee an effective risk management framework. Participates in projects and/or activities that ensure compliance with applicable federal, state, and local laws and regulations. Identifies gaps and inform solutions that minimize losses resulting from inadequate internal processes, systems or human errors. Identifies, responds and/or escalates risks as appropriate. Serves as a functional liaison between the Line of Business and the Lines of Defense.

Basic Qualifications

Bachelor's degree, or equivalent work experience
Typically more than five years of applicable experience

Preferred Skills/Experience

Advanced knowledge of applicable laws, regulations, financial services, and regulatory trends that impact their assigned line of business
Advanced understanding of the business line’s operations, products/services, systems, and associated risks/controls
Thorough knowledge of Risk/Compliance/Audit competencies
Strong analytical, process facilitation and project management skills
Effective presentation, interpersonal, written and verbal communication skills
Proficient computer navigation skills using a variety of software packages, including Microsoft Office applications and word processing, spreadsheets, databases, and presentations
Applicable professional certifications

Essential Duties:

Data Aggregation / Preparation

Ability to gather and aggregate data from a variety of disparate U.S. Bank-related data resources.
Ability to develop appropriate processes designed to transform native data into an easily consumable product.
Ability to perform complex data analysis in order to identify trends, outliers, & process improvement opportunities.
Ability to develop comprehensive documentation designed to appropriately document a process, ensure business continuity, and allow for continued governance.

Application / Reporting

Ability to develop insightful and compelling applications and/or dashboards that are designed to (1) create awareness of potential issues and (2) highlight process improvement opportunities.
Ability to collaborate with a high volume of internal customers, such as business lines, internal auditors, and regulatory examiners, identify their needs, and develop workable ad-hoc data-related solutions.
Partner with a number of business lines to improve data collection and integration, as well as continue driving overall Bank-wide data handling methods and systems into a more uniform, less segmented system and/or series of systems;

If there’s anything we can do to accommodate a disability during any portion of the application or hiring process, please refer to our disability accommodations for applicants.


Benefits:

Our approach to benefits and total rewards considers our team members’ whole selves and what may be needed to thrive in and outside work. That's why our benefits are designed to help you and your family boost your health, protect your financial security and give you peace of mind. Our benefits include the following (some may vary based on role, location or hours):

Healthcare (medical, dental, vision)

Basic term and optional term life insurance

Short-term and long-term disability

Pregnancy disability and parental leave

401(k) and employer-funded retirement plan

Paid vacation (from two to five weeks depending on salary grade and tenure)

Up to 11 paid holiday opportunities

Adoption assistance

Sick and Safe Leave accruals of one hour for every 30 worked, up to 80 hours per calendar year unless otherwise provided by law

EEO is the Law

U.S. Bank is an equal opportunity employer committed to creating a diverse workforce. We consider all qualified applicants without regard to race, religion, color, sex, national origin, age, sexual orientation, gender identity, disability or veteran status, among other factors.

E-Verify

U.S. Bank participates in the U.S. Department of Homeland Security E-Verify program in all facilities located in the United States and certain U.S. territories. The E-Verify program is an Internet-based employment eligibility verification system operated by the U.S. Citizenship and Immigration Services.

The salary range reflects figures based on the primary location, which is listed first. The actual range for the role may differ based on the location of the role. In addition to salary, US Bank offers a comprehensive benefits package, including incentive and recognition programs, equity stock purchase 401k contribution and pension (all benefits are subject to eligibility requirements). Pay Range: $87,465.00 - $102,900.00 - $113,190.00",1863,Banking & Lending,$10+ billion (USD),Financial Services,10000+ Employees,Company - Public,False
