Job Title,Company Name,Location,Salary Estimate,Rating,Job Description,Founded,Industry,Revenue,Sector,Size,Type,Easy Apply
"Founding Backend Engineer, AI Startup","Recruiting From Scratch
","Providence, RI",$160K (Employer est.),4.0,"Who is Recruiting from Scratch :
Recruiting from Scratch is a premier talent firm that focuses on placing the best product managers, software, and hardware talent at innovative companies. Our team is 100% remote and we work with teams across the United States to help them hire. We work with companies funded by the best investors including Sequoia Capital, Lightspeed Ventures, Tiger Global Management, A16Z, Accel, DFJ, and more.
https://www.recruitingfromscratch.com/
Our Client

We are a venture-backed startup building the infrastructure layer for Property & Casualty (P&C) insurance. Integrating technology in the insurance industry today is much like consumer finance pre-Plaid (we could succinctly be described as ""Plaid for Insurance""), or payments pre-Stripe, and our vision is to unlock a similar wave of innovation for the $2T global P&C industry.

Today, walking into an insurance agency is like stepping into a time machine. Filing cabinets, fax machines, piles of incoming and outgoing mail. What you don't see is that even for the parts that have been ""digitized"", needless manual work abounds. Few systems communicate directly, leading to endless copy-pasting from emails to various proprietary web portals/desktop apps and back again.

Carrier by carrier, endpoint by endpoint, we will bring each of those manual and error-prone workflows into our simple, modern API layer.

The implementation details are subject to change, but this is our north star, and the future we envision isn't possible without it.

What we're looking for

We are seeking a highly autonomous engineer (employee #2!) excited about owning the design and implementation of a robust, API-driven product and playing a foundational role in the formation of the company.

Responsibilities
You'll work closely with the team and early customers to build a world-class, API-driven product.
You'll solve hard technical problems from scratch, owning the solution through the entire development lifecycle.
You'll help define the tech stack/architecture for a fledgling product — we're technology agnostic and focus using the right tool for the job.
You'll contribute to the creation of the team culture, as well as internal tooling and processes.
Role requirements
4+ years professional backend/full-stack engineering experience. Working on large-scale open-source projects works too. You've played significant roles in either API design, building processing pipelines, or systemic integration of external systems.
Early-stage startup experience (or other similar unstructured, fast-paced environment)
Live in or willing to relocate to the Bay Area to work full-time in our SF office
Nice to haves
Experience with web scraping, email scraping, RPA — in general just getting data creatively out of hard-to-reach places
1+ years TypeScript/JavaScript experience in a professional or large-scale OSS setting. If you have a comprehensive side project you think is equivalent, send it our way! Clear, concise, and extensible code is important to us and collaborating with others is often a forcing function to that end.
Experience integrating with low tech industries, or other time spent integrating with poorly documented, antiquated APIs (and sometimes even a lack thereof)
Why you should join us
Opportunity to be a foundational team member to a well-funded, post-product and -revenue startup in a massive and largely untapped industry.
Hard backend engineering problems on day 1. Backend is all we do, and the projects you'll work on will be challenging and interesting.
Generous equity comp (90th+ percentile) and competitive cash comp (50th percentile). As we're a startup, we're happy to play with the balance for exceptional candidates.
The Founding Team

Our CEO is a strong engineer in his own right (Waterloo grad, senior eng at multiple Bay Area startups) but will be focusing on the business/product side. He’s gone super deep on insurance, including getting a Broker License and a stint as an Insurtech EIR at a top VC firm.

We’ve raised funding from great investors including top seed funds, ex-Plaid folks, and insurance industry insiders.

Salary Range: $160,000-$180,000 base.
https://www.recruitingfromscratch.com/",2019,Staffing & Subcontracting,$1 to $5 million (USD),Human Resources & Staffing,1 to 50 Employees,Company - Private,True
"Vice President, Data Science- Systems Engineering (HYBRID)","Inclusively
","Smithfield, RI",$77K - $127K (Glassdoor est.),5.0,"Inclusively is partnering with a multinational financial services company to hire a Vice President, Data Science- Systems Engineering (HYBRID).

ABOUT INCLUSIVELY:

Inclusively is a digital tech platform that connects candidates with disabilities, who may benefit from workplace accommodations, to inclusive employers. This includes all disabilities under the ADA, including mental health conditions (e.g. anxiety, depression, PTSD), chronic illnesses (e.g. diabetes, Long COVID), and neurodivergence (e.g. autism, ADHD). Applicants with one or more of these conditions are encouraged to apply; Inclusively does not require applicants to disclose their specific disability.

The Role

The main area of work for the Systems team is training and inference for deep learning models (e.g., LLMs). We are currently heavily exploiting GPT-4, soon expect to be doing the same for Google’s LLM offering. These are powerful systems capable of delivering good language processing functionality across a wide range of tasks. However, they are slow and not necessarily as good on narrow tasks as small systems that have been specifically trained for the task. We need the capability to train (pre-train, fine tune) our own (small, fast) models, and deploy them for efficient inference. This includes (“distillation”) models that are trained on data generated from the more powerful LLMs.

You are a skilled, experienced Deep Learning Engineer to lead for this team. You must have significant hands-on experience on all aspects of developing, training, optimizing, and deploying deep learning models in production. You should have a sound grounding in machine learning fundamentals, and deep knowledge of the entire training and evaluation lifecycle – including acquiring and building out the large data sets needed for training. You should have a thorough background in existing deep learning stacks (Python, PyTorch, TensorFlow, …). You should have hands-on knowledge of important developments in this fast-moving field – LORA, PEFT, quantization, optimization techniques used to get efficient inference performance. You should have a demonstrated track record of working with such models (eg in the context of open source LLMs such as Llama, MPT, Falcon, Mistral) and deploying them for production use. You should be an expert in the tools of the trade – Python, git, MLFlow tools such as WandB – know how to organize, run, evaluate a series of experiments for establishing basic theses for new LLM training. You should have demonstrated experience leading deep learning engineering teams and proven track record of mentoring young engineers in this space.

The Expertise and Skills You Bring

Master's in Machine Learning / Statistics or associated discipline + at least five years of industrial or research experience. PhD preferred.

Extremely strong systems skills necessary.

The Team

At the Asset Management Artificial Intelligence Center of Excellence (AM AI-COE), we are bringing in groundbreaking AI technologies to the Company’s Asset Management. Our team consists of a diverse group of hard-working Data Scientists and Machine Learning Engineers who collaborate with business collaborators to develop AI/ML solutions to complex challenges in Asset Management. We are passionate about Large Language Models (LLMs) and are building the platform and capability to enable their applications in Asset Management.

Certifications:

Company Overview

The Company is a privately held company with a mission to strengthen the financial well-being of our clients. We help people invest and plan for their future. We assist companies and non-profit organizations in delivering benefits to their employees. And we provide institutions and independent advisors with investment and technology solutions to help invest their own clients’ money.

Join Us

At the Company you’ll find endless opportunities to build a meaningful career that positively impacts peoples’ lives, including yours. You can take advantage of flexible benefits that support you through every stage of your career, empowering you to thrive at work and at home. Honored with a Glassdoor Employees’ Choice Award, we have been recognized by our employees as a Best Place to Work in 2023. And you don’t need a finance background to succeed at the Company—we offer a range of opportunities for learning so you can build the career you’ve always imagined.

At the Company, our goal is for most people to work flexibly in a way that balances both personal and business needs with time onsite and offsite through what we’re calling “Dynamic Working”. Most associates will have a hybrid schedule with a requirement to work onsite at a Company work location for at least one week, 5 consecutive days, every four weeks. These requirements are subject to change.

The Company is an equal opportunity employer. We believe that the most effective way to attract, develop and retain a diverse workforce is to build an enduring culture of inclusion and belonging.

The Company will reasonably accommodate applicants with disabilities who need adjustments to participate in the application or interview process. To initiate a request for an accommodation, contact the HR Accommodation Team.

At the Company, we value honesty, integrity, and the safety of our associates and customers within a heavily regulated industry. Certain roles may require candidates to go through a preliminary credit check during the screening process. Candidates who are presented with a Company offer will need to go through a background investigation and may be asked to provide additional documentation as requested. This investigation includes but is not limited to a criminal, civil litigations and regulatory review, employment, education, and credit review (role dependent). These investigations will account for 7 years or more of history, depending on the role. Where permitted by federal or state law, the Company will also conduct a pre-employment drug screen, which will review for the following substances: Amphetamines, THC (marijuana), cocaine, opiates, phencyclidine.

Job Type: Full-time

Experience level:

5 years

Schedule:

Monday to Friday

Work Location: Remote",-1,-1,Unknown / Non-Applicable,-1,1 to 50 Employees,Company - Private,False
"First Developer Relations, AI / ML Startup","Recruiting From Scratch
","Providence, RI",$100K - $150K (Employer est.),4.0,"Who is Recruiting from Scratch:
Recruiting from Scratch is a premier talent firm that focuses on placing the best product managers, software, and hardware talent at innovative companies. Our team is 100% remote and we work with teams across the United States to help them hire. We work with companies funded by the best investors including Sequoia Capital, Lightspeed Ventures, Tiger Global Management, A16Z, Accel, DFJ, and more.
https://www.recruitingfromscratch.com/
About Our Client

About Us

Our client aims to provide the state-of-the-art AI infrastructure to help teams around the world compete and succeed with AI. They are behind several popular open-source projects with thousands of developers worldwide. As the first DevRel of the team, you would have the opportunity to work with a team of talented engineers, influence the direction of a popular open source project, and have your work visible to a global audience.

What you’ll do

Serve as the primary advocate of the company in the global developer community
Build meaningful relationships with our users through regular check-ins, community events, and answering questions across Slack, Github, and social media
Build awareness of our client through code samples, prototypes, blog posts, tutorials videos, outreach, and more.
Represent the company at conferences and meetups online and in-person with the global developer communities
Develop and implement strategies to grow and engage our open source community, including onboarding, community events, and outreach programs.
Track and analyze community engagement metrics to measure growth, identify trends, and inform future strategies.
Provide support and guidance to community members, assisting with technical and non-technical questions and issues.
Improve the developer experience by providing user feedback to Engineering and influence product decisions
Collaborate with engineering to structure roadmap and support community contributions

What We're Looking For

Strong technical background, including 3+ years experience working as a developer advocate, software engineer, solutions engineer, or equivalent role.
Demonstrated success in growing and improving developer communities against business goals
Strong communication skills with the ability to convey complex ideas and information clearly and effectively to both technical and business audiences.
Strong interpersonal skills, with the ability to build rapport and trust with a diverse community of developers
Strong presence in technical communities spanning GitHub, Medium, DZone, Stack Overflow, Reddit, LinkedIn, etc.
Experience with open-source technologies, big data, machine learning, or artificial intelligence
Understanding of best practices within developer communities, platforms, groups, and initiatives
Experience giving technical presentations, talks, and fireside chats at events and conferences

What Gives You An Edge

Active contributor to open source projects, standardization working groups, or tech communities
Hands-on experience with machine learning workflows; training and deploying models at scale.

Location

This role is based in the Bay Area, CA.

Salary: $100,000 - $150,000

https://www.recruitingfromscratch.com/",2019,Staffing & Subcontracting,$1 to $5 million (USD),Human Resources & Staffing,1 to 50 Employees,Company - Private,True
"Lead Data Engineer, AI","Recruiting From Scratch
","Providence, RI",$160K - $280K (Employer est.),4.0,"This is for a client of Recruiting from Scratch.
Who is Recruiting from Scratch:
Recruiting from Scratch is a premier talent firm that focuses on placing the best product managers, software, and hardware talent at innovative companies. Our team is 100% remote and we work with teams across the United States to help them hire. We work with companies funded by the best investors including Sequoia Capital, Lightspeed Ventures, Tiger Global Management, A16Z, Accel, DFJ, and more.
Our Client:

This is a hybrid role based in our Palo Alto or San Francisco offices and will require you to be in office Tuesdays and Thursdays.

What’s the job?

Our client is looking for an exceptional data engineer who is passionate about data for AI. This candidate loves working with data ops at scale; and who is committed to the hard work necessary to continuously improve our ML data pipelines.

In this position, you will be responsible for establishing and executing the strategy for our organization’s ML Data Engine, with an initial focus on agile ML Data OPs. This includes identification of infrastructure components and data stack to be used, design and implementation of pipelines between data systems and teams, automation workflows, data enrichment and monitoring tools all for AI models. As a tech lead specialized in data engineering, you are expected to code and contribute to the stack.

Responsibilities:

Dive into our dataset and design, implement and scale data pre/post processing pipelines of ML models
Work on applied ML solutions in the areas of data mining, cleaning, normalizing and modeling
Be self-motivated in seeking solutions when the correct path isn’t always known
Collaborate with engineers in conceptualizing, planning and implementing data engineering initiatives working with different stakeholders
Design and build data platforms & frameworks for processing high volumes of data, in real time as well as batch, that will be used across engineering teams
Build data processing streams for cleaning and modeling text data for LLMs
Research and evaluate new technologies in the big data space to guide our continuous improvement
Collaborate with multi-functional teams to help tune the performance of large data applications
Work with Privacy and Security team on data governance, risk and compliance initiatives
Work on initiatives to ensure stability, performance and reliability of our data infrastructure

What we’ll love about you

Bachelors in Computer Science, Mathematics, Physics, or a related fields
5+ years of experience as a data engineer building production-level pre/post-processing data pipelines for ML/DL models, including 2+ years of technical leadership experience
Experience in statistical analysis & visualization on datasets using Pandas or R
Experience designing and building highly available, distributed systems of data extraction, ingestion, normalization and processing of large data sets in real time as well as batch, that will be used across engineering teams using orchestration frameworks like Airflow, KubeFlow or other pipeline tools
Demonstrated prior experience in creating data pipelines for text data sets NLP/ large language models
Ability to produce well-engineered software, including appropriate automated test suites, technical documentation, and operational strategy
Excellent coding skills in Python, Java, bash, SQL, and expertise with Git version control
Experience using big data technologies (Snowflake, Airflow, Kubernetes, Docker, Helm, Spark, pySpark)
Experience with any public cloud environment - AWS, GCP or Azure
Significant experience with relational databases and query authoring (SQL) as well as NoSQL databases like DynamoDB etc
Experience building and maintaining ETL (managing high-quality reliable ETL pipelines)

We’ll really swoon if you have

2+ years of experience of technical leadership in building data engineering pipelines for AI
Previous experience in building data pipeline for conversational AI APIs and recommender systems
Experience with distributed systems and microservices
Experience with Kubernetes and building Docker images
Experience with building stream-processing systems, using solutions such as Kafka, Storm or Spark-Streaming
Strong understanding of applied machine learning topics
Be familiar with legal compliance (with data management tools) data classification, and retention
Consistent track record of managing and implementing complex data projects

Location : We are looking to hire someone in the San Francisco, Palo Alto, or Chicago Area.

Salary Range: $160,000-$280,000 USD base. Equity. Medical, Dental, Vision.
https://www.recruitingfromscratch.com/",2019,Staffing & Subcontracting,$1 to $5 million (USD),Human Resources & Staffing,1 to 50 Employees,Company - Private,True
"Founding Fullstack Engineer, AI Startup","Recruiting From Scratch
","Providence, RI",$100K - $200K (Employer est.),4.0,"This is for a client of Recruiting from Scratch.
Who is Recruiting from Scratch:
Recruiting from Scratch is a premier talent firm that focuses on placing the best product managers, software, and hardware talent at innovative companies. Our team is 100% remote and we work with teams across the United States to help them hire. We work with companies funded by the best investors including Sequoia Capital, Lightspeed Ventures, Tiger Global Management, A16Z, Accel, DFJ, and more.
https://www.recruitingfromscratch.com/
About our Client

Our Client is an AI platform solving a unique finance use case.

Location : NYC, Flatiron office. In-person team.

Your role
Build
Engineer software systems around sophisticated ML models
Take ownership
Report directly to co-founders
Oversee significant parts of our tech and product
Set culture and practice
Shape our early engineering culture and processes
Evolve our approach on frontend infrastructure, web server design, abstractions, etc.
Wear multiple hats
Help hire and build out the rest of the early engineering team - there will be no shortage of responsibility
Balance long-term thinking and smart abstractions with shipping fast and iteratively
What you have:
Experience: 5-10 years of experience in the field; open to exceptional candidates with fewer years but strong experience
Autonomy: Exercise a high-degree of autonomy and technical authority
Flexibility: Willing and interested to jump across multiple disciplines
Team-first mentality: you are interested in building for the long-term alongside founding team members, and committed to mentoring others and being mentored
Passion for vision : Genuinely excited about our tech and its impact on accounting, finance, and economy
Curious about latest AI: Experimented with ChatGPT, etc.
Experience with financial workflows : Worked with corporate financial data/products geared to finance professionals
NYC-based: Seeking in-person environment; working from office most days of week
All-in: This is not a 9-5, we have a massive opportunity ahead of us and are looking to multiply our engineering speed. We are optimizing for the best folks and happy to compensate generously
A little something extra You know it when you see it
Bonus points
Hiring : A knack for spotting and recruiting engineering talent
Data science : Hands-on experience with data science projects
Machine learning: Experience training models or building ML-ops systems
Fintech APIs: Experience with foundational fintech APIs e.g., Quickbooks, Plaid, etc.
Product ownership : Experience owning a product end-to-end
Salary Range: $100,000-$200,000 base. Equity. Medical, Dental, Vision.
https://www.recruitingfromscratch.com/",2019,Staffing & Subcontracting,$1 to $5 million (USD),Human Resources & Staffing,1 to 50 Employees,Company - Private,True
"Senior Site Reliability Engineer, Series B AI Startup","Recruiting From Scratch
","Providence, RI",$130K - $170K (Employer est.),4.0,"Who is Recruiting from Scratch :
Recruiting from Scratch is a premier talent firm that focuses on placing the best product managers, software, and hardware talent at innovative companies. Our team is 100% remote and we work with teams across the United States to help them hire. We work with companies funded by the best investors including Sequoia Capital, Lightspeed Ventures, Tiger Global Management, A16Z, Accel, DFJ, and more.
https://www.recruitingfromscratch.com/
Our Client
They are in the AI Voice Transcribing Space
Senior Site Reliability Engineer
Mountain View, CA
The Opportunity

We are seeking a talented Engineer with extensive system knowledge who wants to be part of a team to build and operate large-scale systems that enables reliable and rapid deployment with effective monitoring and resilient operations.

Your Impact
Automation! Capability! Performance! Scale!
Have a strong influence in defining our engineering best practices and deployment process
Help automate the continuous integration and testing processes to enable and scale
Manage and maintain infrastructure
Own, design and implement monitoring systems such as Prometheus and Grafana
Optimize Linux systems for performance, reliability, and security
Own configuration management process(es) and build product features as appropriate
Investigate and dig into data to find the root of a problem and strategize with our engineers on solutions
Participate in on-call rotation
We're looking for someone who
You have 5+ years experience in SRE, Production Engineering and/or DevOps
Expert level experience architecting, developing, and troubleshooting large scale systems
Advanced level proficiency with one or more programming languages (i.e. Python, Golang)
Deep experience with data structures and Linux systems internals (e.g., filesystems, system calls) and administration
Extensive experience with CI/CD pipelines and infrastructure as code (i.e. Terraform, Ansible)
You have a strong familiarity with AWS services (i.e. ECS, S3, ALB, VPC)
You have knowledge in containers and orchestration using Kubernetes
Experience building production quality cloud infrastructure that enables reliable and rapid deployment of large-scale systems with effective monitoring and resilient operations
You thrive working in a fast paced, startup environment
You have a proven track record taking on projects from inception to launch
Bachelor's in Computer Science or Electrical Engineering (MS preferred)

Salary range

Salary Range: $185,000 to $210,000 USD per year

https://www.recruitingfromscratch.com/",2019,Staffing & Subcontracting,$1 to $5 million (USD),Human Resources & Staffing,1 to 50 Employees,Company - Private,True
