Job Title,Company Name,Location,Salary Estimate,Rating,Job Description,Founded,Industry,Revenue,Sector,Size,Type,Easy Apply
Actuarial Team Member,"SFM Mutual Insurance Company
","Bloomington, MN",$95K (Employer est.),4.7,"Actuarial Team Member

SFM – The Work Comp Experts

Work somewhere you love

SFM is unique in that we are small enough that your voice is heard, but has all the benefits and perks of a larger employer. We value your opinion, help you reach your goals, and make it easy for you to maintain work-life balance. SFM is committed to creating the best work environment and believes that our exceptional and motivated employees are our greatest strength. SFM emphasizes work life balance, and our benefit package is designed to assist you navigate your work-life journey.

Our benefits include:

Affordable Medical, Dental, Vision Insurance, HSA, FSA
Traditional and Roth 401(k) plans with company match
Company contributions to help pay off student loans
Monthly home internet allowance
Free life insurance, STD & LTD
Opportunities for annual gainshare bonus
Pet insurance
Generous PTO
9 paid holidays
Paid parental leave
Annual company-wide volunteer day
Discounts on gym memberships, fitness apps and weight loss programs
Free on-site fitness center
Adoption financial assistance

Visit our careers page to learn more about working at SFM.

The Role

SFM’s Actuarial team members have opportunities to use state-of-the-art tools, are encouraged to innovate and learn to master actuarial methodologies. If this sounds like a place you could thrive, then we want to know more about you!

As an Actuarial team member, you’ll support SFM’s business needs and strategic goals by analyzing, evaluating, and modeling business processes and outcomes. In this role, you will drive the execution of the core actuarial duties of reserving, reinsurance, ratemaking, financial projections, and claim calculations focusing on Workers’ Compensation Insurance. In addition, we’ll count on you to provide expertise, including consultation and recommendations, on actuarial models and issues. SFM believes that our exceptional and motivated employees are our greatest strength. This position will provide you many opportunities to grow and stretch yourself while affording you balance in your life. This role can be filled at the Senior Actuarial Analyst or Actuary level, depending on work experience. We will tailor your project work and training based on your experience level, while providing you the opportunity to grow and develop. SFM offers a flexible hybrid work environment, so some office time is required. The Corporate Headquarters are in Minnesota.

Actuarial Focus

Reserving: Conducts in-house financial loss and expense reserve calculations while collaborating with consulting actuaries in related analyses and presentations. Performs financial projections, including but not limited to accounting and budgeting for frequency, severity, audit, expense and annual statement. Provides individual claim projections for case reserve, settlement and interest purposes.
Ratemaking: Conducts reviews of rating components for insurance rates, procedures and plans. Assists in preparation and coordination of all rate filings necessary for Departments of Insurance.
Pricing: Monitors pricing including loss sensitive and dividend plans, making recommendations for changes when appropriate. Develops pricing methodologies, tools and assumptions.
Reinsurance: Analyzes reinsurance contracts and retention selections. Interfaces with reinsurance broker to understand and implement alternative structures/offerings where appropriate.
Analytics: Participate in corporate predictive modeling initiatives as part of department cross-training and development. May participate in Enterprise Risk Management and Business Intelligence initiatives.
Innovation: Stays apprised, explores and implements evolving actuarial, statistical and coding methodologies, with discernment for implementation of internal models versus vendor solutions as appropriate.

Business Service Focus

Business Partnership: Provides ad hoc data analyses as requested. Participates in company initiatives and projects, including but not limited to those with underwriting, claims, finance and Information Services. Works extensively with business leaders and technical experts to develop innovative business solutions and insights. Acts as a champion to leverage internal and external data to improve efficiencies, decision-making and allocation of resources. Mentors business on value proposition of use of analytics to overhaul existing processes. Use analytics to analyze and make recommendations on new opportunities.
Tool Development: Maintains, enhances, and develops tools and methodologies to improve efficiencies and outcomes. Creates buy-in throughout the development process. Provides leadership, training and product expertise during implementation of new tools.
Teamwork: Participates in team-oriented development environment. Collaborates with Business Intelligence team members to create implementation processes, automated reporting and data visualization solutions. Keeps team members updated on project status and works with other team members to produce timely high-quality solutions. Maintains appropriate interactions with persons both within the organization and externally.
Communication: Communicates effectively with leaders and management on project status and work assignments. Presents research findings to interested parties including internal stakeholders, vendors, clients and industry conferences. Provides clear and concise documentation.

What We'll Love About You

Bachelor’s degree in Mathematics, Actuarial Science, Statistics or related quantitative field.
3 or more years of actuarial experience in an insurance or consulting setting.
Passed four or more actuarial exams; Associate of the Casualty Actuarial Society (ACAS) or Associate of Society of Actuaries (ASA) designation preferred.
Fellow of the Casualty Actuarial Society (FCAS) is a plus.
Some experience with statistical modeling and/or programming preferred, including working knowledge of Python, SAS, R or Visual Basic for Applications (VBA).
Strong analytical and problem-solving skills, with sound judgment and decision making capabilities.
Excellent attention to detail
Resourceful with good organizational and project management skills
Strong oral and written communication skills, including presentation abilities.
Strong customer service skills.

Physical Requirements

Regular attendance is required. Work takes place in a semi paperless environment within an office setting, either on business premises or remote location, using standard office equipment such as computers, phones, and photocopiers, which requires being stationary for extended periods of time. While performing the duties of this job, the employee is regularly required to talk or hear, and maintain concentration and focus. The employee frequently is required to stand; walk; use hands and fingers, handle or feel; and reach with hands and arms and work with close vision. This position requires the ability to occasionally lift office products and supplies, up to 20 pounds. Work is performed indoors with little to no exposure to extreme outdoor weather conditions.

The physical demands described here are representative of those that must be met by an employee to successfully perform the essential functions of this job. Reasonable accommodations may be made to enable individuals with disabilities to perform the essential functions.

About SFM

Since 1983, our mission has been to be the workers’ compensation partner of choice for agents, employers and their workers. In that time, we’ve expanded to well over 25,000 customers in the Midwest and grown our offerings to include vocational rehabilitation, safe patient handling, loss prevention, medical services and more. Though much has changed through the years, our focus continues to be unrivaled customer service, safety, and providing better outcomes for employers and injured workers.

Salary Range: $95,000.00 up to $140,000.00- pay will be based on experience and number of exams/credentials.

Join us!! Click Apply Now

Why work for us? Watch Videos to learn more about SFM’s careers and culture.

___________________________________________________________________

SFM Mutual Insurance Company and each of its parent companies, subsidiaries and/or affiliated companies are Equal Opportunity/Affirmative Action Employers. SFM provides equal employment opportunities to all employees and applicants for employment and prohibits discrimination and harassment of any type without regard to race, color, religion, age, sex, national origin, disability status, genetics, protected veteran status, status with regard to public assistance, sexual orientation, gender identity or expression, or any other characteristic protected by federal, state or local laws.

SFM Companies, EEO/AA Employers. SFM is a participant of E-Verify. Applicants have rights under Federal Employment Laws.",1983,Insurance Carriers,$100 to $500 million (USD),Insurance,201 to 500 Employees,Company - Private,True
Data Scientist II,"Boston Scientific Corporation
","Arden Hills, MN",$89K - $115K (Glassdoor est.),4.1,"Data Scientist II
Work mode: Hybrid
Onsite Location(s): Arden Hills, MN, US, 55112

Additional Location(s): N/A

Diversity - Innovation - Caring - Global Collaboration - Winning Spirit - High Performance

At Boston Scientific, we’ll give you the opportunity to harness all that’s within you by working in teams of diverse and high-performing employees, tackling some of the most important health industry challenges. With access to the latest tools, information and training, we’ll help you in advancing your skills and career. Here, you’ll be supported in progressing – whatever your ambitions.




Our Global Customer Experience (Technology & Solutions) team is looking for a Data Scientist II to join their team. This is a hybrid position in Arden Hills, MN. This is an exciting opportunity to drive strategic initiatives and make an impact to our growing Capital Equipment business.




Your responsibilities will include:

Interacts with the functional leads to understand all data requirements and translates them into data structures and data model requirements, where needed in collaboration with IT.
Defines criteria for monitoring integrity of data modelling during projects.
Drives data modelling and testing during projects.
Carries out quality assurance of analytics tools & methods used in projects.
Applies strong expertise in machine-learning, data mining, and information retrieval to design, prototype, and build the next-generation analytics.
Apply best practices for analytics (models, standards, tools).
Tracks impact of analytics on business.
Works with senior leaders and business leaders providing technical guidance related to data architecture, data models and meta data management.



Required Qualifications:

Bachelor’s degree in Computer Science, Data Analytics/Science, or a related area
3+ years of experience with key analytics tools: Tableau, PowerBI, ETL (Informatica, Alteryx)
Experience with Customer Experience tools such as: SAP, SF.com, NiceIncontact
Proven ability to work creatively and innovational
Ability to solve complex problems
Experience working successfully in cross functional teams
Project Management skills
Limited travel will be required



Preferred Qualifications:

Medical Device industry experience
Experience in the capital equipment space
Good financial acumen
Solution driven mindset
Ability to communicate effectively at all levels of the organization



Requisition ID: 573307





As a leader in medical science for more than 40 years, we are committed to solving the challenges that matter most – united by a deep caring for human life. Our mission to advance science for life is about transforming lives through innovative medical solutions that improve patient lives, create value for our customers, and support our employees and the communities in which we operate. Now more than ever, we have a responsibility to apply those values to everything we do – as a global business and as a global corporate citizen.




So, choosing a career with Boston Scientific (NYSE: BSX) isn’t just business, it’s personal. And if you’re a natural problem-solver with the imagination, determination, and spirit to make a meaningful difference to people worldwide, we encourage you to apply and look forward to connecting with you!




At Boston Scientific, we recognize that nurturing a diverse and inclusive workplace helps us be more innovative and it is important in our work of advancing science for life and improving patient health. That is why we stand for inclusion, equality, and opportunity for all. By embracing the richness of our unique backgrounds and perspectives, we create a better, more rewarding place for our employees to work and reflect the patients, customers, and communities we serve. Boston Scientific is proud to be an equal opportunity and affirmative action employer.




Boston Scientific maintains a prohibited substance free workplace. Pursuant to Va. Code § 2.2-4312 (2000), Boston Scientific is providing notification that the unlawful manufacture, sale, distribution, dispensation, possession, or use of a controlled substance or marijuana is prohibited in the workplace and that violations will result in disciplinary action up to and including termination.




Please be advised that certain US based positions, including without limitation field sales and service positions that call on hospitals and/or health care centers, require acceptable proof of COVID-19 vaccination status. Candidates will be notified during the interview and selection process if the role(s) for which they have applied require proof of vaccination as a condition of employment. Boston Scientific continues to evaluate its policies and protocols regarding the COVID-19 vaccine and will comply with all applicable state and federal law and healthcare credentialing requirements. As employees of the Company, you will be expected to meet the ongoing requirements for your roles, including any new requirements, should the Company’s policies or protocols change with regard to COVID-19 vaccination.





Nearest Major Market: Minneapolis
Job Segment: Machinist, Computer Science, QA, Quality Assurance, Data Architect, Manufacturing, Technology, Quality, Data",1979,Health Care Products Manufacturing,$10+ billion (USD),Manufacturing,10000+ Employees,Company - Public,False
Data Scientist - Remote,"Optum
","Plymouth, MN",$68K - $133K (Employer est.),3.7,"Optum is a global organization that delivers care, aided by technology to help millions of people live healthier lives. The work you do with our team will directly improve health outcomes by connecting people with the care, pharmacy benefits, data and resources they need to feel their best. Here, you will find a culture guided by diversity and inclusion, talented peers, comprehensive benefits and career development opportunities. Come make an impact on the communities we serve as you help us advance health equity on a global scale. Join us to start Caring. Connecting. Growing together.




We are seeking an experienced business analyst to provide expert-level insight and analysis on our processes and applications. You will advise on process improvement by identifying new opportunities and applying the best practices within the health care business. Additionally, you will provide support to the development and business teams by application testing and evaluations of technical procedures.




You’ll enjoy the flexibility to work remotely * from anywhere within the U.S. as you take on some tough challenges.




Primary Responsibilities:

Create requirements and specifications for business processes
Conduct business analysis and research to identify key metrics and opportunities for improvement
Develop processes and procedures to ensure business solutions meet strategic goals
Ensure business processes are running in accordance with Agile methodologies
Consult with key stakeholders to determine business objectives and success factors & risk mitigation
Collaborate with team members to collect, analyze, and evaluate information from multiple sources including:
Present findings and recommendations to stakeholders
Write and document business requirements, functional requirements, and design specifications
Work with information technology professionals to develop a solution that meets business requirements
Continuously improve existing business processes and strive to develop new ones to improve efficiency



You’ll be rewarded and recognized for your performance in an environment that will challenge you and give you clear direction on what it takes to succeed in your role as well as provide development for other roles you may be interested in.

One year of post-high school education can be substituted/is equivalent to one year of experience.




Required Qualifications:

3+ years of Microsoft Excel experience
2+ years of technical writing experience
2+ years of Working knowledge of SQL, relational databases, and basic computer science
Python Programing Language
Bachelor's degree in business administration, finance, computer science or related field



Preferred Qualifications:

2+ years of Data visualization and data analysis experience
2+ years of Experience in project management
Experience with project management tools such as Jira, Trello, Confluence or Rally
Flask Framework & API Development
C# Programming Language
Solid problem-solving and management skills
Excellent communication and analytical skills



All employees working remotely will be required to adhere to UnitedHealth Group’s Telecommuter Policy



California, Colorado, Connecticut, Nevada, New Jersey, New York, Rhode Island, or Washington Residents Only: The salary range for California/Colorado/Connecticut/Nevada/New Jersey/New York/Rhode Island/Washington residents is $67,800 to $133,100 annually. Pay is based on several factors including but not limited to education, work experience, certifications, etc. In addition to your salary, UnitedHealth Group offers benefits such as, a comprehensive benefits package, incentive and recognition programs, equity stock purchase and 401k contribution (all benefits are subject to eligibility requirements). No matter where or when you begin a career with UnitedHealth Group, you’ll find a far-reaching choice of benefits and incentives.




At UnitedHealth Group, our mission is to help people live healthier lives and make the health system work better for everyone. We believe everyone–of every race, gender, sexuality, age, location and income–deserves the opportunity to live their healthiest life. Today, however, there are still far too many barriers to good health which are disproportionately experienced by people of color, historically marginalized groups and those with lower incomes. We are committed to mitigating our impact on the environment and enabling and delivering equitable care that addresses health disparities and improves health outcomes — an enterprise priority reflected in our mission.




Diversity creates a healthier atmosphere: UnitedHealth Group is an Equal Employment Opportunity/Affirmative Action employer and all qualified applicants will receive consideration for employment without regard to race, color, religion, sex, age, national origin, protected veteran status, disability status, sexual orientation, gender identity or expression, marital status, genetic information, or any other characteristic protected by law.




UnitedHealth Group is a drug - free workplace. Candidates are required to pass a drug test before beginning employment.",-1,Health Care Services & Hospitals,$10+ billion (USD),Healthcare,10000+ Employees,Company - Public,False
