Job Title,Company Name,Location,Salary Estimate,Rating,Job Description,Founded,Industry,Revenue,Sector,Size,Type,Easy Apply
Sr Data Analyst,"Citizens
",United States,-1,3.6,"Description

Are you eager to join a team using data to transform the way risk professionals monitor and manage risk in their business? Do you have a passion for analytics and a track record creating data-driven solutions that influence management decision-making? Our Non-Financial Risk Management Analytics team deploys the latest analytical tools to monitor and analyze risk across the entire Bank, putting intelligent and timely information in the hands of risk managers allowing them to act quickly to manage their changing operational risk environment.

The Senior Data Analyst will be responsible for the ongoing development and administration of Citizens’ enhanced use of data and analytics designed to identify potential operational and compliance risk. This successful candidate will lead and manage the development life cycle associated with new data analytics, reporting, and process automation projects. The candidate will liaison between business line stakeholders, risk partners, data providers and the Enterprise Data Office development team to support existing and new capabilities within the broader Compliance organization.

Primary responsibilities include:

Using stakeholder knowledge and other available resources to research, to facilitate discovery, and to analyze and evaluate options for data solution.
Managing all deliverables, process or project materials, communications, and acting as a liaison between internal technology resources and the key stakeholders while ensuring appropriate visibility, escalation and resolution of project risks and issues
Working with business to review data sources, data inconsistencies, and business logic for initiating data discovery.
Parsing and manipulating raw, complex data streams to prepare for loading into an analytical tool; delving into complex data from systems to discover hidden relationships and useful information.
Write and maintain business requirements documentation including overall solution, data definitions, process flows and test script(s)
Through consultation and engagement with the development team, design metric-based visualizations to facilitate risk oversight and senior leadership decision-making.
Train key stakeholders on the analysis of trends, notable changes and their potential risk impact
Develop concise executive status updates and program-level reporting.

Qualifications/Required Skills:

5+ years Financial Services experience (preferably in banking) with previous experience in regulatory compliance risk management or similar role
3+ years of project management related to process analysis and business intelligence within consumer financial services preferred.
Strong analytical skills and an innovative approach to solving both practical and theoretical problems.
Proficient in coding Python and other data analytics tools/languages (such as SQL, Alteryx, R)
Using stakeholder knowledge and other available resources to research, to facilitate discovery, and to analyze and evaluate options for data solution.
Exceptional organizational skills and cross-functional business and senior stakeholder engagement
Ability to present to both a technical and non-technical audience, presenting data with confidence to business leadership in both informal and formal presentation settings.
Work independently with minimal guidance.
Some experience in visualization tools (e.g. Tableau).

Preferred Skills:

Knowledge of the design and coding of data extract, transform, and load (ETL), data analytics, and process automation utilizing various automated analytical tools.
Creating analytical datasets from large data sources through the development of highly efficient reusable code structures
Working knowledge of AWS data profiling tools and other AWS data tools
Experience with Agile and Scrum practices

Education:

Bachelor's degree in computer science, Finance or equivalent required
Master’s degree preferred.

Hours and Work Schedule:( 3 days in the office)

Hours per Week: 40
Work Schedule: Monday-Friday



Some job boards have started using jobseeker-reported data to estimate salary ranges for roles. If you apply and qualify for this role, a recruiter will discuss accurate pay guidance.

Equal Employment Opportunity

At Citizens we value diversity, equity and inclusion, and treat everyone with respect and professionalism. Employment decisions are based solely on experience, performance, and ability. Citizens, its parent, subsidiaries, and related companies (Citizens) provide equal employment and advancement opportunities to all colleagues and applicants for employment without regard to age, ancestry, color, citizenship, physical or mental disability, perceived disability or history or record of a disability, ethnicity, gender, gender identity or expression (including transgender individuals who are transitioning, have transitioned, or are perceived to be transitioning to the gender with which they identify), genetic information, genetic characteristic, marital or domestic partner status, victim of domestic violence, family status/parenthood, medical condition, military or veteran status, national origin, pregnancy/childbirth/lactation, colleague’s or a dependent’s reproductive health decision making, race, religion, sex, sexual orientation, or any other category protected by federal, state and/or local laws.

Equal Employment and Opportunity Employer

Citizens is a brand name of Citizens Bank, N.A. and each of its respective affiliates.

Why Work for Us

At Citizens, you'll find a customer-centric culture built around helping our customers and giving back to our local communities. When you join our team, you are part of a supportive and collaborative workforce, with access to training and tools to accelerate your potential and maximize your career growth",1828,Banking & Lending,$5 to $10 billion (USD),Financial Services,10000+ Employees,Company - Public,False
Principal Statistical Programmer - CRO - Remote,"Compass Life Sciences
",United States,$145K (Employer est.),4.8,"Compass Life Sciences are working with a growth stage CRO that is rapidly building teams across the globe to support FSP and non-FSP projects that have been awarded by some of the largest Pharma and Biotech in the world. Due to their growing reputation for quality delivery, they are securing work ahead of the more established CROs and as such have an exciting future ahead.

I am looking for experienced Statistical Programmers that have a passion for quality and are able to understand the larger picture of what the data they work on means. This home based position can be based anywhere in the US or Canada.

This is a broad role that will provide the opportunity to use your SAS programming skills in the production of data analyses from all phases of clinical drug development, depending on the project / FSP relationship you work on.

This is offered on a fully remote basis.

Responsibilities

Depending on level of Seniority within the group you will be expected to provide leadership and guidance as the lead statistical programmer on one or more projects. You will be required to plan and manage programming activities across multiple studies or projects to deliver datasets and statistical outputs to agreed timelines and quality.

Key responsibilities will include:
Plan and manage programming activities to deliver all required outputs to agreed timelines and quality, (e.g., analysis datasets, pooled datasets, tables, figures and listings for regulatory or reimbursement submissions and publications).
Management and oversight of statistical programming tasks outsourced to the company by the sponsor, ensuring that performance meets the agreed timelines, quality and budget requirements established for the project or study.
Participate in the design and/or review of statistical programming deliverables including developing programming specifications for datasets and data outputs.
Participate in the review of other biometrics deliverables (e.g. case report forms, study database structure, data management and data quality plans, statistical analysis plans).
Act as key statistical programming contact for internal project team and external project partners.
Mentoring and development of less senior programming staff.
Other activities as may be assigned.

Job Requirements

Demonstrable leadership, project management, and interpersonal skills
Experience working as a SAS programmer, preferably in a drug development environment
Experience in managing and working with CROs and consultants in outsourcing statistical programming work
Good knowledge of and experience in applying CDISC standards
Self-starter with the ability to work on a cross-functional team

Education & Skills

BSc or higher in mathematics, statistics, computer science or related discipline
Experience working as a SAS programmer, preferably in a drug development environment
Proficiency with SAS programming and SAS macro code development required along with a good understanding of SAS GRAPH and SAS ODS.
Demonstrated knowledge of and experience in the application of CDISC standards (SDTM and ADaM)
Knowledge of non-SAS programming packages an advantage (e.g. Spotfire, S-Plus, R)
Excellent written and verbal communication skills
Proven leadership skills

If you would like to be considered for this position, contact David Jolley on his cell (919) 429 7658, or you can reach the US office on (984) 444 9984 for a conversation in confidence. Alternatively email an updated CV .

Recommendations

Compass Life Sciences Inc. are working as a Staffing Agency in connection for this permanent vacancy; we offer up to $500 of Amazon.com vouchers for each successful recommendation.",2009,Staffing & Subcontracting,$5 to $25 million (USD),Human Resources & Staffing,51 to 200 Employees,Company - Private,False
"Sr. Data Scientist, Patient Engagement and Personalization","CVS Health
","Woonsocket, RI",$95K - $196K (Employer est.),3.1,"Bring your heart to CVS Health. Every one of us at CVS Health shares a single, clear purpose: Bringing our heart to every moment of your health. This purpose guides our commitment to deliver enhanced human-centric health care for a rapidly changing world. Anchored in our brand — with heart at its center — our purpose sends a personal message that how we deliver our services is just as important as what we deliver.

Our Heart At Work Behaviors™ support this purpose. We want everyone who works at CVS Health to feel empowered by the role they play in transforming our culture and accelerating our ability to innovate and deliver solutions to make health care more personal, convenient and affordable.

Position Summary
The Sr. Data Scientist (Manager) of Patient Engagement and Experimentation is directly responsible for designing and developing patient engagement use cases (including experiments, mini-tests, campaigns and patient engagement tactics) to enhance patient experiences and business outcomes. The Manager leads the deployment of patient engagement use cases and analytical models (including descriptive/inferential statistics, machine learning, etc.) by effectively managing and guiding data scientists and data engineers through end-to-end product development. The Manager also performs hands-on analyses in product diagnostics, opportunity assessment, pre-deploayment validation and post-deployment evaluation by querying, mining and analyzing big data in CVS’ cloud computing environment using programming tools including Python (Pyspark) and SQL.

Required Qualifications

Academic background or prior experiences in data science, statistics, computer science, product analytics, marketing analytics, or business analytics
Proficiency in programming languages including SQL, Python and PySpark
Experience with cloud computing and programming in a cloud platform (e.g. Azure, GCP, AWS)
Strong understanding of descriptive and inferential statistics (e.g. sample size calculation, statistical significance determination)
Solid understanding of the design of both experimental studies (e.g. A/B testing) and observational studies
Working knowledge of supervised and unsupervised machine learning and data engineering
Ability to structure problems and influence stakeholders in a data-driven way
Experienced in leading complex projects with multiple stakeholders in a cross-matrixed environment
Effective communication and presentation skills


Preferred Qualifications

Hands-on experiences with building machine learning models including deep-learning models
Hands-on experiences with data engineering pipeline, analysis of algorithm, optimization of complex codes and code automation
Experiences with data visualization and business intelligence


Education

Academic background or prior experiences in data science, statistics, computer science, product analytics, marketing analytics, or business analytics

Pay Range

The typical pay range for this role is:

$94,500.00 - $196,000.00

This pay range represents the base hourly rate or base annual full-time salary for all positions in the job grade within which this position falls. The actual base salary offer will depend on a variety of factors including experience, education, geography and other relevant factors. This position is eligible for a CVS Health bonus, commission or short-term incentive program in addition to the base pay range listed above.

In addition to your compensation, enjoy the rewards of an organization that puts our heart into caring for our colleagues and our communities. The Company offers a full range of medical, dental, and vision benefits. Eligible employees may enroll in the Company’s 401(k) retirement savings plan, and an Employee Stock Purchase Plan is also available for eligible employees. The Company provides a fully-paid term life insurance plan to eligible employees, and short-term and long term disability benefits. CVS Health also offers numerous well-being programs, education assistance, free development courses, a CVS store discount, and discount programs with participating partners. As for time off, Company employees enjoy Paid Time Off (“PTO”) or vacation pay, as well as paid holidays throughout the calendar year. Number of paid holidays, sick time and other time off are provided consistent with relevant state law and Company policies.

For more detailed information on available benefits, please visit jobs.CVSHealth.com/benefits

CVS Health requires certain colleagues to be fully vaccinated against COVID-19 (including any booster shots if required), where allowable under the law, unless they are approved for a reasonable accommodation based on disability, medical condition, religious belief, or other legally recognized reasons that prevents them from being vaccinated.

You are required to have received at least one COVID-19 shot prior to your first day of employment and to provide proof of your vaccination status or apply for a reasonable accommodation within the first 10 days of your employment. Please note that in some states and roles, you may be required to provide proof of full vaccination or an approved reasonable accommodation before you can begin to actively work.

CVS Health is committed to recruiting, hiring, developing, advancing, and retaining individuals with disabilities. As such, we strive to provide equal access to the benefits and privileges of employment, including the provision of a reasonable accommodation to perform essential job functions. CVS Health can provide a request for a reasonable accommodation, including a qualified interpreter, written information in other formats, translation or other services through ColleagueRelations@CVSHealth.com If you have a speech or hearing disability, please call 7-1-1 to utilize Telecommunications Relay Services (TRS). We will make every effort to respond to your request within 48 business hours and do everything we can to work towards a solution.",1963,Health Care Services & Hospitals,$10+ billion (USD),Healthcare,10000+ Employees,Company - Public,False
Specialist IS Bus Sys Analyst - AI/Digital Based Initiatives,"Amgen
","West Greenwich, RI",$107K - $129K (Employer est.),4.1,"HOW MIGHT YOU DEFY IMAGINATION?
You’ve worked hard to become the professional you are today and are now ready to take the next step in your career. How will you put your skills, experience and passion to work toward your goals? At Amgen, our shared mission—to serve patients—drives all that we do. It is key to our becoming one of the world’s leading biotechnology companies, reaching over 10 million patients worldwide. Come do your best work alongside other innovative, driven professionals in this meaningful role.
Specialist IS Business Systems Analyst-AI/Digital Based Initiatives (West Greenwich, RI)
Live
What you will do
Let’s do this. Let’s change the world. In this vital role you will be responsible for design, development, and support of the technology that our colleagues in manufacturing use to get products to every patient, every time. Are you looking for a role in which you use emerging Artificial Intelligence (AI) and Digital Capabilities to drive transformational change at a manufacturing site; enabling volume-driven growth? Advancing Strategic Priorities? Do you see yourself collaborating with business partners and vendors to prioritize, launch and implement cutting-edge technologies and system enhancements? Then this might be the perfect opportunity for you!
Collaborate with Site and Network leaders to advance AI and Digital technologies that improve user experience, reduce cycle time, deliver improved productivity for the organization, and upskill our workforce into a digital future.
Work hand-in-hand with key business partners to understand areas of opportunities where AI/Digital driven solutions can be leveraged to solve business problems.
Lead requirements and user story definition sessions with key business users and stakeholders.
Perform analysis of both the business process and innovative technologies to help find the right fit to enable business/site outcomes.
Drive the execution of a varied portfolio of AI/Digital Technology projects/initiatives with appropriate portfolio planning, resource, risk management and financial management for the portfolio.
Collaborate with a team of engineers, developers, and data scientists as well as suppliers to drive outcomes.
Effectively managing relationships with service owners, site business partners, enterprise service partners, and vendors
Drive continuous reliability focused improvements through AI/Digital based initiatives.
Be a champion for Agile SCRUM adoption and development methodologies in building and testing applications.
Own area metrics for Site function and ensure they are aligned to business/Site goals.
Drive year-on-year productivity improvements for budgetary items within your control.
Active member of the Operations Digital, Technology and Innovation (DTI) site leadership team, contributing to and supporting the overall site strategy and functional deliverables
Be part of a learning and development program which will include goal setting, annual performance reviews and individual development plans.
Win
What we expect of you
We are all different, yet we all use our unique contributions to serve patients. The professional we seek will have these qualifications.
Required experience and skills:
Self-Motivating with the ability to think critically and creatively.
Experience working both independently and, in a team-oriented collaborative environment.
Strong experience in business analysis and process mapping
Ability to navigate Ambiguity in an ever-changing work environment.
Continuous improvement approach (i.e. LEAN, Kaizen, etc.)
Ability to quickly assimilate knowledge of new platforms, languages, tools, and technologies.
Ability to explain complex technical concepts to non-technical clients.
Sharp learning agility, problem solving and analytical thinking.
Good communicatory and analytical skills
Solid leadership, technical writing, and communication/presentation skills
Fluency in written and spoken English.
Ability to travel to Rhode Island Site at an agreed upon cadence.
Basic Qualifications:
Doctorate degree
OR
Master’s degree and 3 years of systems analysis experience
Or
Bachelor’s degree and 5 years of systems analysis
Or
Associate’s degree and 10 years of systems analyst experience
Or
High school diploma / GED and 12 years of systems analyst experience
Preferred Qualifications:
Experience in developing strategies for new innovative technology deployment
Ability to translate strategic opportunities and emerging technology solutions into tangible pragmatic executable plans.
Experience and knowledge of AI, Machine Learning, and digital capabilities and techniques that allow you to be able to help identify the right solutions for business problems.
The ability to influence the development of business area strategy and Information Systems strategy where appropriate.
Intellectual curiosity and the ability to question thought partners across functional areas.
Experience working with Agile development methodologies (such as Sprint and Scrum) and DevOps.
Experience in biotechnology or other healthcare/regulated environment
Thrive
What you can expect of us
As we work to develop treatments that take care of others, we also work to care for our teammates’ professional and personal growth and well-being.
Amgen offers a Total Rewards Plan comprising health and welfare plans for staff and eligible dependents, financial plans with opportunities to save towards retirement or other goals, work/life balance, and career development opportunities including:
Comprehensive employee benefits package, including a Retirement and Savings Plan with generous company contributions, group medical, dental and vision coverage, life and disability insurance, and flexible spending accounts.
A discretionary annual bonus program, or for field sales representatives, a sales-based incentive plan
Stock-based long-term incentives
Award-winning time-off plans and bi-annual company-wide shutdowns
Flexible work models, including remote work arrangements, where possible
Apply now
for a career that defies imagination
Objects in your future are closer than they appear. Join us.
careers.amgen.com
Amgen is an Equal Opportunity employer and will consider you without regard to your race, color, religion, sex, sexual orientation, gender identity, national origin, protected veteran status, or disability status.
We will ensure that individuals with disabilities are provided reasonable accommodation to participate in the job application or interview process, to perform essential job functions, and to receive other benefits and privileges of employment. Please contact us to request accommodation.",1980,Biotech & Pharmaceuticals,$10+ billion (USD),Pharmaceutical & Biotechnology,10000+ Employees,Company - Public,False
