Job Title,Company Name,Location,Salary Estimate,Rating,Job Description,Founded,Industry,Revenue,Sector,Size,Type,Easy Apply
Senior Developer AI,TMPI,"Minneapolis, MN",$94K - $124K (Glassdoor est.),-1.0,"Job Title: Senior Developer (Artificial Intelligence, AI)
Category: Technical/Engineering
Department: Engineering
Location: Minneapolis, MN
Job Type: Full-time


About Us:

With a rich history of Technology & Security service spanning over 30 years, TLC Millimeter Wave Products and Technology has become a trusted name in the community and around the world. We have built a powerful reputation based on our unwavering commitment to exceptional care, professional expertise, and a genuine passion for improving lives. Our team of experienced professionals works collaboratively to create a supportive and nurturing environment for our clients.

We are currently experiencing rapid growth and are in search of a highly skilled and motivated Senior Developer, AI (Artificial Intelligence) to join our Engineering group at TLC Millimeter Wave Products and Technology. In this role, you will have the opportunity to work on exciting projects and contribute to the development of new products. We are seeking an ideal candidate who possesses exceptional technical expertise, effective communication skills, a passion for their work, a keen interest in exploring and applying innovative technologies, and a strong sense of ownership and ambition.


Role Duties and Responsibilities:


AI Solution Development: Collaborate with cross-functional teams to design and develop AI solutions that address complex business challenges. Apply advanced AI algorithms and models to create innovative solutions that meet project requirements. Implement scalable and efficient AI systems capable of handling large volumes of data. Utilize machine learning, deep learning, and natural language processing techniques to enhance AI models.
Research and Innovation: Stay updated on the latest advancements in AI technologies, actively researching and incorporating new techniques into our solutions. Experiment with emerging AI algorithms, tools, and frameworks to improve the performance and capabilities of our systems. Conduct experiments and perform statistical analysis to validate and optimize AI models.
Technical Leadership: Provide technical guidance and mentorship to junior developers, sharing your expertise in AI technologies and best practices. Collaborate with stakeholders to understand their requirements and deliver AI solutions that align with their needs. Evaluate and select suitable AI tools, platforms, and frameworks to support project objectives.
Communication and Collaboration: Work closely with cross-functional teams, including data scientists, software engineers, and business analysts, to develop cohesive AI solutions. Participate in project meetings, providing valuable insights and recommendations on AI-related aspects. Effectively communicate complex AI concepts and findings to non-technical stakeholders in a clear and concise manner.
Continuous Learning and Growth: Stay abreast of the latest AI trends and advancements, actively participating in conferences, workshops, and learning opportunities. Enhance your skills and knowledge in AI through self-study and professional development initiatives. Share your learnings and insights with the team, contributing to the overall AI knowledge base within the organization.
Minimum Role Qualifications:


Bachelor's or Master's degree in Computer Science, Data Science, or a related field.
Proven experience as a Senior Developer, AI, or a similar role, with a strong focus on AI solution development.
Excellent programming skills in languages such as Python, Java, or C++.
In-depth knowledge of machine learning algorithms, deep learning frameworks (i.e., TensorFlow, PyTorch), and natural language processing techniques.
Experience with AI model development, training, and deployment in cloud environments.
Proficiency in data preprocessing, feature engineering, and model evaluation.
Strong understanding of statistics, probability, and mathematical concepts relevant to AI.
Exceptional problem-solving and analytical thinking abilities.
Effective communication and collaboration skills, with a demonstrated ability to work well within a team.
Experience working on large-scale AI projects and delivering successful outcomes.
Familiarity with Agile development methodologies.
Travel Requirement: Yes
This is an onsite role located in Minneapolis, MN
Preferred Qualifications:


PhD in Artificial Intelligence, Machine Learning, or a related field.
Experience developing AI applications in specific domains, such as healthcare, finance, or cybersecurity.
Knowledge of big data technologies and distributed computing frameworks (i.e., Hadoop, Spark).
Contributions to the AI research community, such as publications or active participation in conferences.
Project Management Experience/Certification, preferred.
If you thrive in a fast-paced environment and are excited to contribute to cutting-edge projects and new product development, we invite you to join our team as a Senior Developer, AI. This is an opportunity to work alongside talented professionals, engage with innovative technologies, and make a significant impact in the field of Artificial Intelligence. Apply now to unleash your potential and be a part of our journey in advancing Artificial Intelligence capabilities with TLC Millimeter Wave Technologies!

EEOC Statement: TLC Millimeter Wave Technologies is an equal opportunity employer. We value diversity and are committed to creating an inclusive and equitable workplace for all employees. We prohibit discrimination and harassment based on race, color, religion, sex, national origin, age, disability, genetic information, veteran status, sexual orientation, gender identity or expression, or any other characteristic protected by applicable law.


Why Choose TLC?


Innovative and Dynamic Environment: Our company fosters a culture of innovation and creativity, where innovative ideas are encouraged, and collaboration is valued. You will have the opportunity to work with a talented team and contribute to groundbreaking projects.
Growth and Development Opportunities: We are committed to the professional growth and development of our employees. We offer training programs, mentorship opportunities, and resources to enhance your skills and advance your career within the company.
Meaningful Work: Our company is dedicated to making a positive impact in the industry and the community. By joining our team, you will have the chance to work on meaningful projects that have real-world implications and contribute to improving people's lives.
Competitive Compensation: We offer a competitive salary package that includes benefits and incentives. At TLC, hard work and dedication is recognized and rewarded.
Work-Life Balance: We believe in the importance of maintaining a healthy work-life balance. We offer flexible working hours, remote work options, and other initiatives to help you achieve a harmonious integration of work and personal life.
Supportive and Inclusive Culture: We value diversity and inclusivity. Our company strives to create a supportive and inclusive work environment where everyone feels respected, valued, and empowered to bring their authentic selves to work.
Comprehensive Benefits: We provide a comprehensive benefits package that includes health insurance, retirement plans, paid time off, and other wellness programs. We care about the well-being of our employees and offer benefits to support their overall health and happiness.
Company Perks: We offer additional rewards and incentives to enhance your work experience, such as employee discounts, professional memberships, team-building activities, and more.

At TLC Millimeter Wave Products and Technology, we believe in investing in our employees' success and providing a fulfilling and rewarding work experience. We are dedicated to creating an environment where you can thrive both personally and professionally. Join our team of talented engineers and contribute to the development of state-of-the-art hardware solutions using FPGA and DSP technologies and be part of a dynamic and innovative work environment where your skills and expertise will make a significant impact. Apply now and help shape the future of our cutting-edge products, securities, and technologies!",-1,General Repair & Maintenance,Unknown / Non-Applicable,"Construction, Repair & Maintenance Services",Unknown,Company - Private,True
Senior Marketing Data Analyst,"First International Bank & Trust
","Edina, MN",$68K - $96K (Glassdoor est.),3.7,"We are seeking a highly analytical and detail-oriented Senior Marketing Data Analyst to join our marketing team. In this role, you will champion Salesforce Marketing Cloud, serve as a SME (Subject Matter Expert) on our customer databases, lead generation strategies, measure ROI on campaigns, research, and supervise our current Marketing Data Analyst. The ideal candidate will have a strong background in data analysis and marketing analytics with an emphasis on Salesforce Marketing Cloud and Google Analytics.

This position is In-Person and will have the employee primarily located in one of our Branches.

Key Responsibilities:

Champion Salesforce Marketing Cloud including but not limited to:
Recommend and implement marketing automation to streamline/align sales efforts and increase effectiveness.
Collaborate with SMEs to architect prospect engagement activities.
Share outcomes of efforts through reporting and suggest enhancements for better results.
Serve as SME of FIBT’s customer database and share insights with business line leaders and operations teams to help identify opportunities and drive effective strategies for engagement and growth.
Lead effective strategies for customer engagement and cross-selling; includes targeted digital marketing campaigns and SEO/SEM practices; includes collaboration with third parties.
Measure ROI of online and offline advertising campaigns including, but not limited to, reporting of KPIs such as leads, conversion rates, website traffic and social media engagement.
Conduct competitive research and analyze benchmarking data, including consumer behavioral insights.
Supervise marketing data team member(s)

Qualifications:

Bachelor degree in Marketing or Business Administration; a minimum of 7 years of marketing analyst experience, or equivalent combination of education and experience is required.
Salesforce Marketing Cloud experience highly preferred.
Google Analytics experience is highly preferred.
In-depth understanding of SEM campaign strategies and SEO practices and experience with PPC campaigns.

First International Bank and Trust is a family-owned full-service Community Bank with locations in ND, MN, SD, and AZ. We show our employees we care by providing competitive benefits and training and growth opportunities. Here are the things we offer within our full-time benefits package:

Health, Dental & Vision
401K Retirement Plan with Employer Match
Paid Parental Leave
Life and Disability Insurance
Generous PTO and Holiday pay

If you are interested in learning more, you can apply or if you have questions before applying you can reach out directly at TalentAcquisition@FIBT.com.

Equal Opportunity Employer",1910,Banking & Lending,$25 to $100 million (USD),Financial Services,501 to 1000 Employees,Company - Private,False
Data Science Director,"CliftonLarsonAllen
","Minneapolis, MN",$107K - $151K (Glassdoor est.),3.9,"CLA is a top 10 national professional services firm where our purpose is to create opportunities every day, for our clients, our people, and our communities through industry-focused wealth advisory, digital, audit, tax, consulting, and outsourcing services. Even with more than 8,500 people, 130 U.S. locations, and a global reach, we promise to know you and help you.
CLA is dedicated to building a
culture
that invites different beliefs and perspectives to the table, so we can truly know and help our clients, communities, and each other.
CLA is looking to hire a Data Science Director to join our growing Internal IT team.
About the role:
As a Data Science Director, you will:
This role constructs complex solutions that integrate data wrangling, visualization, and advanced modeling techniques into a seamless workflow using software development best practices in R, Python, or other scripting languages. They are comfortable working with APIs, web scraping, and SQL/no-SQL databases. They automate business workflows while integrating stochastic/numeric algorithms in the process. This role will develop more autonomy to develop solutions and will lead others, take on administrative tasks, perform support roles, and get involved in new business development.
Essential Job Functions
Software Development: Build applications based on designs that fit within our growing ecosystem of tools.
System Design: Design system architecture as well as the software that will support it.
Team Participation: Participate in the SCRUM process and maintain logs.
What you will need:
3+ years of experience in professional software development.
Bachelor’s degree or combination of experience, education and training may be accepted in lieu of degree.
Technical Competencies:
JavaScript
React
API Building
Solution Architecture
Python
Cloud Infrastructure/Architecture (Azure preferred)
Our Perks:
Flexible PTO (designed to offer flexible time away for you!)
Up to 12 weeks paid parental leave
Paid Volunteer Time Off
Mental health coverage
Quarterly Wellness stipend
Fertility benefits
Complete list of benefits
here
#LI-DJ1
Equal Opportunity Employer /AA Employer/Minorities/Women/Protected Veterans/Individuals with Disabilities.

Wellness at CLA
To support our CLA family members, we focus on their physical, financial, social, and emotional well-being and offer comprehensive benefit options that include health, dental, vision, 401k and much more.
To view a complete list of benefits click
here
.",1953,Accounting & Tax,$500 million to $1 billion (USD),Financial Services,5001 to 10000 Employees,Company - Private,False
Sr Pricing Data Analyst,"Datasite
","Minneapolis, MN",$68K - $98K (Glassdoor est.),4.5,"Datasite is where deals are made. We provide the data rooms and SaaS technology used in M&A and other high-value transactions, to deliver projects in more than 170 countries. Carrying that success into the future is all about you. Your useful skills, your unusual experience, your unique ideas. Everyone here brings something unexpected. What’s yours? Invest your talents in us, and we’ll return the compliment.
Job Description:
The Sr Pricing Data Analyst is responsible for data analysis and modeling to derive insights that support data driven decision making related to pricing, packaging, and commercial strategy. This role focuses on transforming raw data into actionable insights and leveraging data-driven storytelling to influence commercial outcomes. An essential responsibility includes the development, monitoring, maintenance, and updating of various pricing metrics, reports, and dashboards to support ongoing monetization and price improvement efforts.
The role requires an analytics background with equal parts technical, business and communication skills. This role will report directly to the Senior Director, Pricing and Packaging Strategy and will work closely with other cross-functional teams across Datasite.

Applicants must be authorized to work in the U.S. We are unable to sponsor or take over sponsorship of an employment Visa at this time. This is a hybrid role; preferred location is MN or NY.
Responsibilities:
Aggregate, cleanse, and organize business data (e.g., product usage, pricing, billing, etc.) from disparate sources with varying degrees of data integrity.
Conduct thorough analyses to identify data driven insights from trends and anomalies to inform pricing, packaging, and commercial decisions.
Perform analyses and modeling to support various price improvement initiatives.
Develop, update, and maintain pricing metrics (e.g., Price-per-unit, ARPU, ASP) to measure pricing effectiveness.
Build, maintain and update dashboards, KPI tracking, and visualization/reporting on a regular basis.
Support weekly, monthly, quarterly reporting of pricing metrics, analysis, and guidance to stakeholders across the organization.
Support various analyses for pricing strategy related projects, including new product and feature rollouts.
Analyze customer spending trends and usage to assist in new product pricing and deal structuring for new contracts.
Collaborate with cross-functional teams, including Finance, Data Science, Operations, SF practice, Engineering.
Participate in presentation of pricing analytics and reporting to various internal stakeholders.
Education, Experience Requirements & Essential Skills:
Bachelor’s degree in an analytical field (Statistics, Mathematics, Computer Science, or related).
4+ years of prior B2B (preferably SaaS) experience in an analytical business role, preferably in Pricing, Data Science, Finance or Sales Ops.
High proficiency in Excel skills (e.g., nested formulas, VLOOKUP/XLOOKUP, INDEX/MATCH, SUMIFS), pivots and charting.
Proficiency in data manipulation, analysis, and visualization/BI tools (e.g., Excel, SQL, SF, CRM analytics, Power BI, Python, R).
Proficient in the remainder of Microsoft Suite (PowerPoint, Word, etc.)
Strong analytical thinking and problem-solving skills, with the ability to translate data into actionable recommendations.
Detail-oriented mindset with a commitment to data accuracy and integrity.
Effective communication skills and ability to explain complex models in simple terms.
Ability to build relationships and collaborate regularly in a dynamic, cross-functional environment.
Self-motivated with the ability to work independently, maintain accountability, and prioritize multiple projects.
Adaptability to operate within an unstructured environment with minimal or unclear business requirements as the company continues to evolve.
As a global organization, Datasite knows that diverse perspectives are essential to our success. We’re committed to maintaining a diverse workforce to serve our customers around the world. Datasite is an equal opportunity employer (EEO) and furthers the principles of EEO through Affirmative Action.",1968,Enterprise Software & Network Solutions,$100 to $500 million (USD),Information Technology,1001 to 5000 Employees,Company - Private,False
Sr. Business Data Analyst,"Thomson Reuters
","Saint Paul, MN",$51.00 - $61.00 Per Hour (Employer est.),4.2,"Description:

Senior Business Data Analyst to support the implementation of the Master Data Management (MDM) system for Finance Master Data (FMD), including but not limited to testing, data conversion, validation, coordination, documenting processes, and supporting end users.
Interprets results using a variety of techniques, ranging from simple data aggregation to complex data mining independently.
The Senior Data Analyst will work closely with the FMD team to ensure that the business requirements are supported appropriately.
This position will also provide FMD support as required for Oracle Financial Consolidation and Close Cloud Service (FCCS) and SAP S/4 HANA. Given the global reach of this business the individual should be an effective communicator both oral and written.
Bachelor's degree in accounting, finance, business or a related degree is required.
7+ years of direct, progressive financial experience including interaction with corporate and business unit executives in a dynamic, high volume business environment.
Relies on extensive experience and judgment to plan and accomplish goals. Performs a variety of tasks.
A wide degree of creativity and latitude is expected.
Demonstrated proficiency in Microsoft Excel and Access.
Oracle Financial Consolidation and Close Cloud Service (FCCS), MDM and SAP S/4 HANA experience a plus.
Reports to the Director of finance master data.

Job Type: Contract

Salary: $51.00 - $61.00 per hour

Experience level:

8 years

Schedule:

8 hour shift

Ability to commute/relocate:

Saint Paul, MN 55123: Reliably commute or planning to relocate before starting work (Required)

Education:

Bachelor's (Required)

Experience:

Master data management: 7 years (Required)
Finance Master Data: 7 years (Required)
SAP S/4HANA: 5 years (Preferred)
Data analysis skills: 7 years (Required)
Oracle: 4 years (Required)
Business analysis: 3 years (Preferred)
Accounting: 4 years (Preferred)

Work Location: Hybrid remote in Saint Paul, MN 55123",2008,Enterprise Software & Network Solutions,$10+ billion (USD),Information Technology,10000+ Employees,Company - Public,True
"First Developer Relations, AI / ML Startup","Recruiting From Scratch
","Minneapolis, MN",$100K - $150K (Employer est.),4.0,"Who is Recruiting from Scratch:
Recruiting from Scratch is a premier talent firm that focuses on placing the best product managers, software, and hardware talent at innovative companies. Our team is 100% remote and we work with teams across the United States to help them hire. We work with companies funded by the best investors including Sequoia Capital, Lightspeed Ventures, Tiger Global Management, A16Z, Accel, DFJ, and more.
https://www.recruitingfromscratch.com/
About Our Client

About Us

Our client aims to provide the state-of-the-art AI infrastructure to help teams around the world compete and succeed with AI. They are behind several popular open-source projects with thousands of developers worldwide. As the first DevRel of the team, you would have the opportunity to work with a team of talented engineers, influence the direction of a popular open source project, and have your work visible to a global audience.

What you’ll do

Serve as the primary advocate of the company in the global developer community
Build meaningful relationships with our users through regular check-ins, community events, and answering questions across Slack, Github, and social media
Build awareness of our client through code samples, prototypes, blog posts, tutorials videos, outreach, and more.
Represent the company at conferences and meetups online and in-person with the global developer communities
Develop and implement strategies to grow and engage our open source community, including onboarding, community events, and outreach programs.
Track and analyze community engagement metrics to measure growth, identify trends, and inform future strategies.
Provide support and guidance to community members, assisting with technical and non-technical questions and issues.
Improve the developer experience by providing user feedback to Engineering and influence product decisions
Collaborate with engineering to structure roadmap and support community contributions

What We're Looking For

Strong technical background, including 3+ years experience working as a developer advocate, software engineer, solutions engineer, or equivalent role.
Demonstrated success in growing and improving developer communities against business goals
Strong communication skills with the ability to convey complex ideas and information clearly and effectively to both technical and business audiences.
Strong interpersonal skills, with the ability to build rapport and trust with a diverse community of developers
Strong presence in technical communities spanning GitHub, Medium, DZone, Stack Overflow, Reddit, LinkedIn, etc.
Experience with open-source technologies, big data, machine learning, or artificial intelligence
Understanding of best practices within developer communities, platforms, groups, and initiatives
Experience giving technical presentations, talks, and fireside chats at events and conferences

What Gives You An Edge

Active contributor to open source projects, standardization working groups, or tech communities
Hands-on experience with machine learning workflows; training and deploying models at scale.

Location

This role is based in the Bay Area, CA.

Salary: $100,000 - $150,000

https://www.recruitingfromscratch.com/",2019,Staffing & Subcontracting,$1 to $5 million (USD),Human Resources & Staffing,1 to 50 Employees,Company - Private,True
