Job Title,Company Name,Location,Salary Estimate,Rating,Job Description,Founded,Industry,Revenue,Sector,Size,Type,Easy Apply
Data Scientist ML/AI/LM/LMM (remote),"Pearson
","Providence, RI",$130K - $140K (Employer est.),3.7,"Position Summary

Machine learning and LLMs’ impact on Higher Education continues to expand each day. Pearson is looking for a data scientist to help harness this growing field to benefit university students and instructors. This individual will participate in the planning, design, development, and implementation of solutions to provide the optimal learning experience for our customers. Our data scientists work on solutions which improve the efficiency of instructors and increase student engagement, comprehension, and personalized learning experiences.

Responsibilities:

Collaborate with cross-functional teams to build new solutions for students and instructors in Higher Education using your expertise in deep learning and other machine learning models and algorithms
Continuously learn, explore, and provide insights into the latest tools and practices in artificial intelligence so we can innovate new ways of teaching and assessing university level material.
Evaluate and fine tune the performance, cost and efficacy of different models and solutions to achieve the highest quality standards for our customers.
Make a lasting, positive impact on the educational outcomes of our customers.
Be a trustworthy steward of our customers’ data

Requirements

3+ years of experience of deep-learning and Language Model Middleware (LMM) technologies, know how to evaluate similarity search and LMM outputs, and conduct prompt engineering, token optimization and evaluate system efficacy.
In-depth understanding of LLM technologies and their applications in natural language processing.
Experience with data preprocessing, data augmentation, and data quality assessment.
Proficiency in using and fine-tuning state-of-the-art deep learning models, such as transformer-based architectures (e.g., BERT, GPT, T5).
Strong programming skills in Python and proficiency with relevant libraries and frameworks (e.g., TensorFlow, Pandas, PyTorch, SciPy, scikit-learn, JAX)
Knowledge of ethical AI principles, red-teaming, and responsible AI practices.
Master's or Ph.D. in Computer Science, Machine Learning, Data Science, or a related field.
Prior experience with prompt engineering and chatbot development is highly desirable.

Compensation at Pearson is influenced by a wide array of factors including but not limited to skill set, level of experience, and specific location. As required by the Colorado, California, Washington State, New York State and New York City laws, the pay range for this position is as follows:

The minimum full-time salary range is between $130,000 - $140,000

This position is eligible to participate in an annual incentive program, and information on benefits offered is here.

\#LI-POST

\#LI-REMOTE

What to expect from Pearson

Did you know Pearson is one of the 10 most innovative education companies of 2022?

At Pearson, we add life to a lifetime of learning so everyone can realize the life they imagine. We do this by creating vibrant and enriching learning experiences designed for real-life impact. We are on a journey to be 100 percent digital to meet the changing needs of the global population by developing a new strategy with ambitious targets. To deliver on our strategic vision, we have five business divisions that are the foundation for the long-term growth of the company: Assessment & Qualifications, Virtual Learning, English Language Learning, Workforce Skills and Higher Education. Alongside these, we have our corporate divisions: Digital & Technology, Finance, Global Corporate Marketing & Communications, Human Resources, Legal, Strategy and Direct to Consumer. Learn more at We are Pearson.

We value the power of an inclusive culture and also a strong sense of belonging. We promote a culture where differences are embraced, opportunities are accessible, consideration and respect are the norm and all individuals are supported in reaching their full potential. Through our talent, we believe that diversity, equity and inclusion make us a more innovative and vibrant place to work. People are at the center, and we are committed to building a workplace where talent can learn, grow and thrive.

Pearson is an Affirmative Action and Equal Opportunity Employer and a member of E-Verify. We want a team that represents a variety of backgrounds, perspectives and skills. The more inclusive we are, the better our work will be. All employment decisions are based on qualifications, merit and business need. All qualified applicants will receive consideration for employment without regard to race, ethnicity, color, religion, sex, sexual orientation, gender identity, gender expression, age, national origin, protected veteran status, disability status or any other group protected by law. We strive for a workforce that reflects the diversity of our communities.

To learn more about Pearson’s commitment to a diverse and inclusive workforce, navigate to: Diversity, Equity & Inclusion at Pearson.

If you are an individual with a disability and are unable or limited in your ability to use or access our career site as a result of your disability, you may request reasonable accommodations by emailing ppsmhr@pearson.com.

Note that the information you provide will stay confidential and will be stored securely. It will not be seen by those involved in making decisions as part of the recruitment process.

Job: RESEARCH AND DEVELOPMENT

Organization: Higher Education

Schedule: FULL\_TIME

Req ID: 13349

\#location",1844,Publishing,$5 to $10 billion (USD),Media & Communication,10000+ Employees,Company - Public,False
Research Statistician (Research),"Care New England
","Providence, RI",$67K - $93K (Glassdoor est.),3.3,"Job Summary: The Research Statistician collects, organizes and analyzes statistical data for research projects. The incumbent works closely with the members of the research team to identify data needs, develop procedures for collecting data, and perform statistical analyses and interpretation. Prepares statistical reports and analysis as well as assists with grant preparation and abstract/paper presentations.

Specifications: Master’s Degree in statistics/biostatistics or epidemiology/public health with strong quantitative background and three to five years experience with analysis of data in health care research. Must have working knowledge of Statistical Analysis Software (SAS) and/or STATA. Grant writing experience helpful; strong communication skills required.

Care New England Health System (CNE) and its member institutions, Butler Hospital, Women & Infants Hospital, Kent Hospital, VNA of Care New England, Integra, The Providence Center, and Care New England Medical Group, and our Wellness Center are trusted organizations fueling the latest advances in medical research, attracting top specialty-trained doctors, and honing renowned services and innovative programs to engage in the important discussions people need to have about their health.

Americans with Disability Act Statement: External and internal applicants, as well as position incumbents who become disabled must be able to perform the essential job-specific functions either unaided or with the assistance of a reasonable accommodation, to be determined by the organization on a case-by-case basis.

EEOC Statement: Care New England is an equal opportunity employer. All applicants will be considered for employment without attention to race, color, religion, sex, sexual orientation, gender identity, national origin, veteran or disability status

Ethics Statement: Employee conducts himself/herself consistent with the ethical standards of the organization including, but not limited to hospital policy, mission, vision, and values.

WIH Internal Posting Period: 6/28 - 7/4/2023",1996,Health Care Services & Hospitals,$1 to $5 billion (USD),Healthcare,5001 to 10000 Employees,Company - Private,True
Senior Data Analyst Marketing and Sales,"Cox Communications
","West Warwick, RI",$77K - $116K (Employer est.),4.0,"The Senior Data Analyst will be responsible for CCI's efforts to develop and expand an analytically driven business performance evaluation framework. You will support the testing, analysis, and reporting function in projects across multiple functional areas of the business, including Marketing, Pricing, Sales, Operations and others. This role requires a creative individual who possesses skills in data handling, model development, analytics, and storytelling. Innovation is encouraged and a desire to collaborate well with our team, boundary partners, and leaders across the organization is a must.

Cox Communications is seeking a Senior Data Analyst who is experienced in:

Data mining, modeling, analysis, and visualization.
Analytical capabilities building and continuous improvement.
Using data analysis to assess the performance and identify insights of strategies and tests.




In this role you are part of a team responsible for CCI's efforts to develop and expand an analytically driven business performance evaluation framework. You will support the testing, analysis, and reporting function in projects across multiple functional areas of the business, including Marketing, Pricing, Sales, Operations and others. This role is a unique opportunity to help deliver on the vision to grow analytical capabilities, as well as support the development of key strategies critical to the business.

What You'll Do:


Serve as a subject matter expert supporting effectiveness analysis, including:

A/B testing and multivariate experiments.
Sales, Marketing, Pricing performance, including evaluation of strategy objectives.
Performance of offers, customer migration, churn, etc.
Designs and develops big data-based models and reporting tools using tools like SQL and Python in the Snowflake environment.
Identifies and mine new data resources to enable reporting and advanced analytics.
Translates data and trends into actionable insights via regular and ad-hoc reports that tell our competitive story.
Understands organizational objectives and helps improve reporting, analytics, and development projects to meet these goals.
Provides support to ad-hoc requests from senior leaders and boundary partners.
Ensure data accuracy, integrity, and consistency by implementing data validation and quality assurance procedures .
Provides Data Analysis services across multiple products, business or organizational areas.
Interacts with business leaders to understand key objectives and concerns.
Develops database logic to extract required information for reporting.
Supports efforts to distill massive amounts of complicated data into meaningful and actionable insights.
Designs, develops and implements dashboards and reports to facilitate data review and analysis.
Manage and prioritize multiple projects, ensuring that they are delivered on time and within budget.
Drives successful projects by providing action-oriented analyses, optimization and a data-driven approach.




What's In It For You:

At Cox, we reward your hard work with meaningful benefits.

First, we offer a highly competitive compensation package, 401(k) with a generous company match, comprehensive healthcare, life, and disability benefits, plus numerous other benefits, including adoption assistance, pet insurance, and discounts on travel and cars!

We value people more than technology. That means you'll work within a culture and with a team that values your leadership, your experience, your contributions, and you - yes, you - as a person. We believe recognition is important, and Cox strives to celebrate those who help make us successful every day. We also encourage diversity and support inclusion; we want you to do you and feel comfortable doing so.

We also offer boundless opportunities for growth; you can sharpen your skills, learn a new talent, join a mentoring program, even earn an advanced degree. You'll find the potential for lateral or upward career growth within the Cox family businesses, including the innovative startups in transportation mobility, clean tech and more.

Who You Are:

Minimum



Bachelor's degree in a related discipline and 4 years of experience in a related field (Marketing, Data Analytics or related field). The right candidate could also have a different combination, such as a master's degree and 2 years of experience, a Ph.D. and 1 year of experience or 8 years of experience in a related field with no degree.
Analytical/financial analysis background.
Strong multitasking, analytical and creative skills.
Self-starter with strong organizational, detail and follow-up skills.
Excellent interpersonal, leadership, presentation, and collaborative skills to work effectively with teams throughout the organization.
Demonstrated business acumen, problem solving and critical thinking skills.
Develop framework to analyze effectiveness of offer recommendations, strategy rules and processes; provide insights to strategy teams for improvements.
Ability to translate and communicate complex analyses clearly and concisely.
Conducts business/strategy impact analyses, validations, and measurement through all stages from concept formulation, definition of metrics, determination of appropriate statistical methodology, research evaluation, and final presentation
Ability to work independently with minimal supervision.
Deadline driven, ability to work with a sense of urgency.
Proficiency with quantitative tools including Excel and presentation tools such as PowerPoint and willingness to learn new tools that may be valuable to the team.
Continuous learner mindset.
Comfort setting direction and drawing insight from multiple (and often unclear) data sources.
Hands on experience with SQL.
Hands on experience with BI and dashboarding tools (MicroStrategy, Tableau, Power BI, or similar reporting tools.)




Preferred



Bachelor's degree in marketing, data analytics, engineering, computer science, economics, finance or similar analytical or technical field.
Telecommunications, cable industry, high tech, or consulting experience.
Familiarity with financial and data modeling techniques.
Interest in learning (or prior experience with) statistical analysis methods.
Strong knowledge of programming languages SQL, Python, R.
Experience working with Snowflake, AWS (Amazon Web Services) and/or ThoughtSpot.
Process management tools such as Airtable.




Join the Cox family of businesses and make your mark today!

USD 77,000.00 - 115,600.00 per year

About Cox Communications

Cox Communications is the largest private telecom company in America, serving six million homes and businesses. That's a lot, but we also proudly serve our employees. Our benefits and our award-winning culture are just two of the things that make Cox a coveted place to work. If you're interested in bringing people closer through broadband, smart home tech and more, join Cox Communications today!

About Cox

Cox empowers employees to build a better future and has been doing so for over 120 years. With exciting investments and innovations across transportation, communications, cleantech and healthcare, our family of businesses - which includes Cox Automotive and Cox Communications - is forging a better future for us all. Ready to make your mark? Join us today!

Benefits of working at Cox may include health care insurance (medical, dental, vision), retirement planning (401(k)), and paid days off (sick leave, parental leave, flexible vacation/wellness days, and/or PTO). For more details on what benefits you may be offered, visit our benefits page .

Cox is an Equal Employment Opportunity employer - All qualified applicants/employees will receive consideration for employment without regard to that individual's age, race, color, religion or creed, national origin or ancestry, sex (including pregnancy), sexual orientation, gender, gender identity, physical or mental disability, veteran status, genetic information, ethnicity, citizenship, or any other characteristic protected by law.

Statement to ALL Third-Party Agencies and Similar Organizations: Cox accepts resumes only from agencies with which we formally engage their services. Please do not forward resumes to our applicant tracking system, Cox employees, Cox hiring manager, or send to any Cox facility. Cox is not responsible for any fees or charges associated with unsolicited resumes.",1962,"Cable, Internet & Telephone Providers",$10+ billion (USD),Telecommunications,10000+ Employees,Company - Private,False
Lead Cognitive/Machine Learning Professional – MLP,"Humana
",Rhode Island,-1,3.9,"Humana is seeking a Lead Cognitive/Machine Learning Professional to join our Fortune #40, Best Places to Work company and help us make a different as a help our members achieve their best health!

You will have the opportunity to work on challenging Machine Learning and AI projects with the goal to improve the everyday life of our members.

Responsibilities

As a Lead Cognitive/Machine Learning Professional, you may direct a small team of engineers. You will collaborate with data scientists, analysts, business and IT teams to design, implement, and deploy Machine Learning and AI services using Python, PySpark, Azure services, Databricks, Terraform, and other open-source software. You will be expected to lead by example, to develop plans, designs, code, and documentation, and to perform code reviews, testing, and debugging. You will embrace and enforce best practices in our data science community with automated, repeatable data pipelines.

Some examples of how we add capabilities to Humana’s Machine Learning Platform include:

Creating templates for data scientists, embracing leading-edge modeling techniques

Establishing a Feature Store with tens of thousands of features available to use in predictive models

Defining monitoring, auditing, data lineage, and dependency tracking for data pipelines to improve quality

Integrating ethical AI bias monitoring and drift analysis into modelling processing

Standardizing the definitions of clinical, financial, and actuarial features for use across the business

Engineering Philosophy:

Build and deploy ML models on Azure, using best practices in security, and Azure services

Understand best practices for effective predictive models, including cluster management and algorithms, and evangelize with Humana Data Scientists

Thrive in a fast-paced agile environment, closely interacting with business analysts, software engineers, machine learning scientists, data engineers, and data scientists

Mentor junior team members, to help grow and mature the overall skillset of the team

Required Qualifications

BS in Computer Science or related field or equivalent experience

3+ years of experience working on cloud platforms

5+ years of experience with Machine Learning and AI

5+ years of software development experience, with significant Python experience

Solid knowledge of data structures and algorithms

Ability to learn new technologies and comprehend unfamiliar data domains and business processes quickly

Preferred Qualifications

Open-source contributions and portfolio of shipped code at GitHub

Familiar with healthcare applications, terminologies, and data

Passion projects with ML/AI/NLP, for example Kaggle competitions and Hackathons

Experience with Generative AI, GCP, and/or Vertex AI

Additional Information

Location/Work Style: Remote US

Why Humana?

At Humana, we know your well-being is important to you, and it’s important to us too. That’s why we’re committed to making resources available to you that will enable you to become happier, healthier, and more productive in all areas of your life. Just to name a few:

Work-Life Balance

Generous PTO package

Health benefits effective day 1

Annual Incentive Plan

401K - Excellent company match

Well-being program

Paid Volunteer Time Off

Student Loan Refinancing

If you share our passion for helping people, we likely have the right place for you at Humana.

Work at Home Guidance

To ensure Home or Hybrid Home/Office associates’ ability to work effectively, the self-provided internet service of Home or Hybrid Home/Office associates must meet the following criteria:

At minimum, a download speed of 25 Mbps and an upload speed of 10 Mbps is recommended; wireless, wired cable or DSL connection is suggested

Satellite, cellular and microwave connection can be used only if approved by leadership

Associates who live and work from Home in the state of California, Illinois, Montana, or South Dakota will be provided a bi-weekly payment for their internet expense.

Humana will provide Home or Hybrid Home/Office associates with telephone equipment appropriate to meet the business requirements for their position/job.

Work from a dedicated space lacking ongoing interruptions to protect member PHI / HIPAA information

#LI-Remote

Scheduled Weekly Hours

40

Pay Range

The compensation range below reflects a good faith estimate of starting base pay for full time (40 hours per week) employment at the time of posting. The pay range may be higher or lower based on geographic location and individual pay decisions will vary based on demonstrated job related skills, knowledge, experience, education, certifications, etc.


$126,800 - $174,500 per year


This job is eligible for a bonus incentive plan. This incentive opportunity is based upon company and/or individual performance.

Description of Benefits

Humana, Inc. and its affiliated subsidiaries (collectively, “Humana”) offers competitive benefits that support whole-person well-being. Associate benefits are designed to encourage personal wellness and smart healthcare decisions for you and your family while also knowing your life extends outside of work. Among our benefits, Humana provides medical, dental and vision benefits, 401(k) retirement savings plan, time off (including paid time off, company and personal holidays, volunteer time off, paid parental and caregiver leave), short-term and long-term disability, life insurance and many other opportunities.

Not Specified
0",1961,Health Care Services & Hospitals,$10+ billion (USD),Healthcare,10000+ Employees,Company - Public,False
