Job Title,Company Name,Location,Salary Estimate,Rating,Job Description,Founded,Industry,Revenue,Sector,Size,Type,Easy Apply
Lead Data Scientist - Optimization/Operations Research,"General Mills
","Minneapolis, MN",$88K - $121K (Glassdoor est.),4.1,"Job Description:

LEAD DATA SCIENTIST

Optimization/Operations Research


OVERVIEW

Do you see patterns or opportunities that others don’t see? Do you enjoying asking questions and analyzing data to deepen your knowledge? Do you like to challenge historical assumptions and recommend new ways to drive action based on data driven insights? Do you like to find the best way to tackle a problem and share the approach with others?

To make the food people love, we need to make sure we feed our decision makers the right data and solutions at the right time, every time. As a Lead Data Scientist-Optimization/Operations Research at General Mills, you will apply your strong expertise in machine learning, data mining and information retrieval to design, prototype and build next generation advanced analytics engine and services. You will collaborate with product owners, business partners and other Data Scientists in the consumer marketing and media space to define technical problem statement and hypothesis to test. In addition, you will develop efficient and accurate analytical models that mimic business decisions.


KEY ACCOUNTABILITIES

Lead, design, and execute exploratory and applied analyses in the areas of simulation, modeling and optimization, and operations research of key business objectives
Work closely with data science leadership, engineering, and business partners to develop optimization and machine learning models using best in class tools and technology.
Provide technical leadership through strong partnership and providing solution alternatives.
Accountable for the analytic solution design across data science, ML engineering and reporting.
Create production ready, scalable models that provide real time insights that align with General Mills technology standards.
Serve as a senior leader as part of the data science leadership team- contribute to technical strategy, best practices, and team development.
Coach junior data scientist on key technical and domain topics through solution reviews and mentoring.
Act as a thought leader in data science techniques and represent the Digital and Technology organization.
Partner with functional analytic teams to align and integrate solutions.


MINIMUM QUALIFICATIONS

PhD in Operations research, Statistics, Industrial engineering, or Computer Science or commensurate experience in Operations Research with a Masters Degree
5+ years of experience in the field of data science
2+ years applied experience in operations research, optimization, or similar field
High proficiency with Python programming in developing optimization models using different types of solvers suite
Hands on experience building Integer/Mixed Integer Linear programming, Network/route/price optimization models with sound knowledge of supporting algorithms
Comfortable working with large and dynamic Data Frames & writing complex SQL queries
Highly adaptable, curious, and willing to work independently on complex and challenging problems
Bias for action with ability to deliver outstanding results through task prioritization and time management
Expertise with leading the development of large-scale AI and machine learning based models

PREFERRED QUALIFICATIONS

Experience with cloud bases AI platforms
Applied experience in supply chain, logistics, pricing, or other commercial area

ADDITIONAL CONSIDERATIONS

This position is remote eligible
Relocation or international remote working arrangements (outside of the US) will not be considered.
Company Overview:
We exist to make food the world loves. But we do more than that. Our company is a place that prioritizes being a force for good, a place to expand learning, explore new perspectives and reimagine new possibilities, every day. We look for people who want to bring their best — bold thinkers with big hearts who challenge one other and grow together. Because becoming the undisputed leader in food means surrounding ourselves with people who are hungry for what’s next.",1866,Food & Beverage Manufacturing,$10+ billion (USD),Manufacturing,10000+ Employees,Company - Public,False
AI Engineer/Data Scientist,TMPI,"Minneapolis, MN",$130K - $160K (Employer est.),-1.0,"Benefits/Perks

Competitive Compensation
Flexible Scheduling
Career Growth Opportunities
Job Summary
We are seeking a detail-oriented Data Scientist to join our team. As a Data Scientist, you will analyze large amounts of raw data to discover patterns and insights that will help to improve our company. We will rely on you to collect and analyze data, build models, and present your findings in an easy-to-understand manner. The ideal candidate has an analytical mind and a passion for data.

Responsibilities

Analyze large amounts of raw data to discover trends and patterns
Discover valuable business insights and propose new approaches to challenges
Automate the data collection process
Identify valuable data sources
Build machine learning algorithms and predictive models
Present information in an easily digestible format
Collaborate with other teams within the organization
Work between multiple projects and flexibility to shift between projects
Code development and integration
integrate with database and knowledge on SQL
Code versioning and maintaining
Qualifications

A bachelor’s degree in Computer Science or a related field is preferred
Strong understanding of data collection and analysis
Strong troubleshooting and analytical skills
Ability to work well as part of a team
Strong written and verbal communication skills
Experience with data visualization tools such as Tableau and PowerBI
Minimum of 3 years working experience in AI field
Minimum of 3 years experience in programming languages
Understand Agile Scrum and Waterfall project management methodologies
Knowledge of R, SQL, Python, Java, Unix and Linux, C++",-1,General Repair & Maintenance,Unknown / Non-Applicable,"Construction, Repair & Maintenance Services",Unknown,Company - Private,True
Data Scientist - Davis Center,"Minneapolis Public Schools
","Minneapolis, MN",$90K - $113K (Employer est.),2.9,"Below is specific information for you to consider about this position.

Job Title: Data Scientist - Davis Center and Requisition ID number: 99256

Close Date: No established closing date; open until filled

Organizational Unit: Research, Evaluation & Assessment (10001130)

Site: Davis Center (0001)

FTE: 1.0 FTE - 40 hours/week (52 weeks); this is based on full-time equivalency with 1.0 being full time

Union: AMP(42)

Functional Area: Administrative

Resume and Cover Letter are mandatory to apply for any position.

****************************************************************************************


SUMMARY

Under general supervision, performs complex coordination and partnership with technical and data use and predictive statistics that can advance academic outcomes for Minneapolis Public School students; position will be key in the identification of the most relevant data parameters to effect tangible results for students.


ESSENTIAL FUNCTIONS - Essential functions, as defined under the Americans with Disabilities Act, may include any of the following representative duties, knowledge, and skills. This list is ILLUSTRATIVE ONLY, and is not a comprehensive listing of all functions and duties performed by incumbents of this class. Employees are required to be in attendance and prepared to begin work at their assigned work location on the specified days and hours. Factors such as regular attendance at the job are not routinely listed in job descriptions, but are an essential function. Essential duties and responsibilities may include, but are not limited to, the following:




Applies skills to the development of analytics, data mining, statistical analysis, and designed experiments to answer some of the most important and compelling questions in preK-12 education regarding administrative efficiency, teacher quality, and student achievement for all groups.
Engages with MPS departments to influence data literacy and data use.
Creates data visualization dashboards and interactive reports.
Develops and applies SQL data pulls to acquire and compile the necessary source data; develops and populates new data structures to support project as required.
Develops robust statistical models and learning algorithms to extract valid inferences about students learning from unstructured data.
Applies statistical analysis on resulting data sets: applying and interpreting statistical inference methodologies, regression models, cluster analysis, correlations, predictive variables, and other traditional statistical tests and data mining techniques to large datasets to identify meaningful trends, and patterns across relevant district data systems.
Supports interpretation and presentation of the “story” that emerges from the insight gained.
Supports program evaluations as requested.
Demonstrates courteous and cooperative behavior when interacting with students, clients, visitors, and MPS staff; acts in a manner that promotes a harmonious and effective workplace environment
Enthusiastically promotes the Superintendent’s goals and priorities in compliance with all policies and procedures.
Maintains absolute confidentiality of work-related issues, records and MPS information.
Other duties or tasks may be assigned on an as-needed basis


MINIMUM QUALIFICATIONS

Education, Training and Experience Guidelines

Master’s Degree in a quantitative field; AND three (3) years of professional program evaluation experience; OR an equivalent combination of education, training and experience as determined by Human Resources.


Knowledge of:
SQL and relational databases.
Data analysis and statistical modeling in SPSS, R, Stata, or SAS.
Cultural, racial, and linguistic diversity of program stakeholders and considerable ability to work effectively in the cultural context of programmatic offerings and with MPS staff representing diverse cultural and ethnic backgrounds.
Statistics, research methods, and quantitative and qualitative research standards.
Statistical software packages, databases, spreadsheets, and other computer programs to manage large data files and translate quantitative data into information useful for planning, evaluation, and other decision-making purposes.
Advanced mathematical principles as applied to quantitative research and evaluation projects.
Specialized MPS and state agency software applications and procedures.
Principles of record keeping, records management, and management of confidential records.


Skill in:

Defining data requirements for projects that allow for the creation of data sets necessary to meet project objectives.
Using data visualization techniques in software such as D3, Tableau, etc.
Empirical research and for answering hard questions with data
Using a flexible analytical approach that allows for results to be at varying degrees of precision
Ability to communicate complex quantitative analysis in a clear, precise, and actionable manner
Problem solving skills and quickly learning new concepts and methodologies as needed.
Demonstrated ability to work on high impact problems in a collaborative environment.
Providing effective customer service, and dealing tactfully and courteously with the public.
Establishing and maintaining effective working relationships with co-workers, clients, advocates and representatives from community groups and government agencies.
Operating a personal computer utilizing specialized presentation and graphics software.
Communicating effectively verbally and in writing.


Bargaining Unit: AMP l Grade: 70 l Salary Range*: From $90,134 - $112,565 per year l FLSA Status: Exempt

The salary range is provided by the collective bargaining agreement associated with this position. Actual pay will be based on selected candidates’ experience.


MPS Offers a Desirable Benefits Package!

Pension (Employee Contribution) with District Match

MN Deferred Compensation

Eleven (11) Paid Holidays in addition to Paid Time Off

EAP (Employee Assistance Program) access to free, confidential consultation with counselors in the areas of personal and work concerns

LegalSheild/IDShield access to legal advice

Wellness and Fitness Programs

Medical, Dental and Vision Plans

Flexible Spending Account Options

and More!


LICENSE AND CERTIFICATION REQUIREMENTS

A valid Minnesota State Driver’s License may be required.




PHYSICAL DEMANDS AND WORKING ENVIRONMENT

Work is performed in a standard office environment which requires occasionally lifting such articles as file boxes or heavier materials with help from others and/or lifting and carrying light objects frequently. A job in this category may require walking or standing to a significant degree or may involve sitting most of the time with long periods of computer work and heavy phone usage.


****************************************************************************************


Final candidates may be invited to interview with a committee. Final appointment to this position will be contingent upon passing a criminal background check.

COMMITMENT TO DIVERSITY:

Diversity is one of Minneapolis Public Schools core values and is essential to our goal of putting children first and making them college-ready. Diversity of our workforce provides us with a competitive advantage and allows us to better understand, communicate with and educate our diverse student body. Minneapolis Public Schools will not deny anyone the opportunity for training or employment because of race, color, creed, religion, national origin, gender or gender identity, marital status, status with regard to public assistance, disability, sexual orientation, age, family care leave status, or veteran status.


Minneapolis Public Schools strongly encourages diverse candidates to apply.

Posting Notes: | [No Established Closing Date] | Research, Evaluation & Assessment (10001130) | Davis Center (0001) | Administrative",1908,Primary & Secondary Schools,Unknown / Non-Applicable,Education,5001 to 10000 Employees,School / School District,False
Environmental Data Manager / Data Scientist,"Northeast Technical Services, Inc.",United States,$60K (Employer est.),-1.0,"Who we are:

NTS Environmental Science and Engineering offers a broad spectrum of environmental services, including consulting, engineering, engineering support, and data management to a wide range of clients around the Iron Range in northern Minnesota. NTS is proud to provide an employee-driven culture that fosters professional development and growth. Integrity, safety, client-focus, and excellence underline all we do. We offer a competitive pay and benefits package, flexibility, and opportunity for advancement.

Position Description:

NTS is seeking an Environmental Data Manager / Data Scientist. Primary accountabilities include, but are not limited to:

Review field and analytical reports for completeness and accuracy and document identified quality issues;
Ensure all samples and measurements comply with local, state, and federal requirements;
Integrate data from laboratory, field, and historical sources with NTS database;
Perform regular quality checks on data;
Complete and submit reports to the MPCA;
Produce graphs, reports, and other deliverables for clients;
Provide customized querying and reporting support through the Client Portal;
Assist with maintenance of the NTS quality assurance program through continued development of and adherence to new and existing policies and procedures;
Build and maintain strong, collaborative relationships with clients and NTS staff;
Support the NTS safety program through safe work practices, policy adherence and hazard reporting, and wearing appropriate PPE; and
Other duties as assigned or necessary.

Qualifications:

Bachelor’s degree in environmental science, geology, chemistry, or other relevant field
QA/QC and lab experience
Knowledge of federal and state regulatory guidelines
Must be extremely detail-oriented and possess a strong desire for continued learning and professional growth
GIS, Database programming, SQL, or other programming experience helpful

Northeast Technical Services, Inc. (NTS) is an Equal Opportunity, Affirmative Action Employer. All qualified applicants will be considered for employment without regard to race, color, religion, sex, sexual orientation, gender identity, national origin, age, disability, or status as a protected veteran.

Job Type: Full-time

Pay: From $60,000.00 per year

Benefits:

401(k)
401(k) matching
Dental insurance
Flexible schedule
Flexible spending account
Health insurance
Health savings account
Life insurance
Paid time off
Professional development assistance
Relocation assistance

Schedule:

Monday to Friday

Ability to commute/relocate:

Virginia, MN 55792: Reliably commute or planning to relocate before starting work (Required)

Experience:

Environmental Lab: 1 year (Preferred)

Work Location: In person",-1,-1,-1,-1,-1,-1,True
Machine Learning Engineer,"Solution Design Group
","Minneapolis, MN",$80K - $115K (Glassdoor est.),4.5,"SDG is a high-performance software community. We are a team of collaborative and creative consultants who build and deliver custom software for some of the most recognizable local and national brands. In this role, you will be asked to leverage your current skills while also learning new ones. Working in over 500 different technologies and continually learning together, you can expect a one-of-a-kind and award-winning work experience. Our team at SDG has exceptional integrity and the desire to create the best possible customer solutions. We are proud to partner with our customers to consistently provide a successful working relationship as a high-performance team.

We are adding a Machine Learning Engineer to our team! This person will play a key role in designing, implementing, and deploying machine learning models to solve complex problems and enhance our customer’s products and services. You will be a part of a tight-knit technical community, giving you the opportunity to constantly grow your development amongst top technical talent. You will work closely with a cross-functional team of data scientists, software engineers, and domain experts to drive the development and deployment of machine learning solutions. SDG is looking for a hard worker with a team-oriented mindset, that has at least 2 years of experience and an in-depth understanding of machine learning and cloud data tools. A successful Machine Learning Engineer at SDG is a lifelong learner who is motivated to continually improve their craft and thrives amongst their fellow employee-owners.
SDG’s Machine Learning Engineer’s have proven experience with the following responsibilities. If you do too, we want to hear from you:
Design, implement, and optimize machine learning algorithms and models to address specific business challenges.
Collaborate with data engineers to preprocess and transform raw data into a format suitable for machine learning models. Conduct feature engineering to extract relevant information for model training.
Train, validate, and fine-tune machine learning models using state-of-the-art techniques. Evaluate model performance and iterate on models to improve accuracy and efficiency.
Deploy machine learning models into production environments and integrate them into existing systems. Collaborate with software engineers to ensure seamless integration with our products.
Stay abreast of the latest developments in machine learning and related fields. Proactively identify opportunities to enhance existing models and propose new approaches to solve business problems.
Requirements:
2+ years of hands-on machine learning development experience
Experience delivering solutions in large scale enterprise environments
Experience with Public Cloud Providers such as AWS and Microsoft Azure
Experience with AWS and/or Azure data tools and services
Strong understanding of data processing, data engineering, and data visualization.
Experience with SQL and NoSQL databases
Proficient in programming languages such as Python and R
Familiarity with big data technologies such as Apache Spark
Experience with Machine Learning frameworks such as TensorFlow or PyTorch
Ability to work effectively in a collaborative, cross-functional team environment. Excellent communication skills and the ability to explain complex concepts to both technical and non-technical stakeholders.
Strong analytical and problem-solving skills. Proven ability to tackle complex problems and deliver robust machine learning solutions.
Prior consulting or professional services experience is a bonus
Education degree or certification in Computer Science, or the equivalent related work experience

What's in it for you?
Full-time salaried consultant position
A true stake in success. SDG is an ESOP - 100% employee owned
Star Tribune Top Workplace winner the last 6 consecutive years
National Top Workplace in 2022
Engaged teammates who care about quality solutions
Challenging and rewarding work with great customers
Various opportunities to give back to the community
Be amongst some of the best technologists in the industry
Dedicated to our core values of superior customer service, exceptional employee experience, and responsible corporate citizenship
Opportunities to connect with other SDGer’s via internal communities, committees, and events – virtually and in person
Applicants must be authorized to work for ANY employer in the United States. We are unable to sponsor or take over sponsorship of an employment Visa at this time.

#LI-AS1
#LI-Hybrid",1989,Information Technology Support Services,$25 to $100 million (USD),Information Technology,201 to 500 Employees,Company - Private,True
