Job Title,Company Name,Location,Salary Estimate,Rating,Job Description,Founded,Industry,Revenue,Sector,Size,Type,Easy Apply
System Analyst / Sr. System Analyst,"Cook Inlet Tribal Council Inc
","Anchorage, AK",$69K - $97K (Employer est.),3.6,"CITC ENTERPRISES, INC.

JOB DESCRIPTION

Job Title: System Analyst / Sr. System Analyst

Department: Information Technology (IT)

Reports To: Manager / Sr. Manager, Enterprise Applications

Supervises: None

FLSA Status: Exempt

Pay Grade: E5 (System Analyst) / E6 (Sr. System Analyst)

Job Type: Full-Time, Regular

AKBCU: No ICPA: No


General Functions:

The System Analyst supports, manages, and maintains a single application or a suite of applications, which includes maintaining services and conducting user and security administration.

Additionally, system analysts provide end-user support for their applications including fixing technical problems, maintaining hardware/software, and coordinating with operations staff to solve problems. This position also conducts and assists in business analysis and project management tasks.

Duties and Responsibilities:

System Analyst:

Communicating and Collaborating with Non-Technical Staff

Understand what communication is required with internal and external stakeholders.
Translate technical concepts into non-technical language.
Collect business needs and requirements, as it relates to application updates or enhancements.
Coordinate and assist business stakeholders and developers on the deployment of application updates or enhancements.

Technical Understanding



Maintain knowledge necessary to perform the job at a working or expert level.
Engage in trainings to maintain relevant professional competencies.

Asset Management and Configuration

Manage the documentation and tracking of job-related assets.
Assist in the management of technology assets throughout their life cycle.

Design and Implementation

Possess ownership of Small Projects including documentation and reporting.
Assist in Medium-Large Projects.
Support and guide users’ research to focus on a balance between needs and desires.

Testing

Review requirements, specifications and define and execute test conditions and scenarios.
Identify issues and risks associated with work while being able to analyze and report test activities and results.

Change Management

Identify process or technologies that can be implemented to add value to application use.
Adhere to department policies on systems changes.

Incident and Problem Resolution

Provide guidance and troubleshooting for escalations from the Service Desk.
Provide on-call support which may include working after hours or early mornings.

Team Support

Support fellow development team members during absences.
Train and mentor junior staff.

Other duties as needed and/or assigned.


Sr. System Analyst:

All duties and responsibilities of a System Analyst with a higher level of proficiency.

Technical understanding

Coordinate with developers to identify and improve system integrations.
Assist developers in code creation and deployment.
Provide guidance and support to System Analysts and other junior staff to continuously develop professional competencies.

Design and Implementation

Possess ownership of Medium-Large Projects including documentation and reporting.

Team Support

May serve as acting supervisor/manager during supervisor/manager’s absence.
Assist supervisor/manager with strategic planning for the service desk.
Provide guidance and mentor System Analysts and other junior staff.

Other duties as needed and/or assigned.

Job Responsibilities Related to Participant Privacy

Employee is expected to actively participate in CITC privacy training and to protect the privacy of participant information in accordance with CITC's privacy policies, procedures and practices, as required by federal and state law. Failure to comply with CITC's policies and procedures on participant privacy may result in disciplinary action up to and including termination of employment.
Employee may access protected health information and other participant information only to the extent necessary to complete job duties. Employee may only share such information on a need to know basis with others who have job responsibilities related to treatment, payment, or other CITC operations.
Employee is encouraged and expected to report, without the threat of retaliation, any concerns regarding CITC's policies and procedures on participant privacy and any observed practices in violation of the policy to the designated Privacy Officer.

Job Specifications:

System Analyst:

Excellent verbal and written communication skills.
Excellent customer service skills.
Working knowledge of IT service management practices.
Awareness of business analysis and project management processes and tools.
Awareness of how system automation works and aware of which tools and software are available to be utilized and are currently in practice.
Awareness of coding and familiarity with enterprise applications.
Awareness of system integration tools and best practices.
Working knowledge of incident and problem management practices.
Awareness of information security and the security controls that can be used to mitigate security threats within solutions and services.

Sr. System Analyst:

All knowledge, skills and abilities (KSAs) of a System Analyst with a higher level of proficiency.
Working knowledge of business analysis and project management processes and tools.
Working knowledge of how system automation works and awareness of which tools and software are available to be utilized and are currently in practice.
Working knowledge of coding and familiarity with enterprise applications.
Working knowledge of system integration tools and best practices.

Minimum Core Competencies: CITC Values, Respectful Leadership, Professionalism, Emotional Intelligence, Problem Solving/Critical Thinking, Communication Skills.

Minimum Qualifications:

System Analyst:

Bachelor's degree in Information Technology or related field. Relevant experience may substitute for the educational requirement on a year-for-year basis.
Three (3) years of work experience with enterprise SAAS (Software as a Service) applications, reporting tools, and/or middleware tools.
Two (2) years of experience using customer and issue-tracking software to manage tasks and work.
Two (2) years of experience in a query/scripting language (i.e. Python, PowerShell, SQL, etc…)
Experience in Microsoft Office plus real-time communication and collaboration tools (i.e. O365, Teams, Zoom, etc…)

Sr. System Analyst:

All qualifications of a systems analyst, plus the following:
Five (5) years of work experience with enterprise SAAS (Software as a Service) applications, reporting tools, and/or middleware tools.

Preferred Qualifications for All Levels:

Experience in social services or non-profit organizations.
Experience with system automation and optimization.
Experience with business analysis and/or project management.

Minimum Qualifications for All Levels:

Valid Alaska driver’s license and insurable under CITC’s automotive insurance, which requires a driver to be at least 21 years of age and has had a driver’s license for at least three years.
Continued employment is contingent upon completion of a satisfactory state and federal fingerprint criminal background check.

Physical Requirements:

Primarily works in an office setting, with extended periods of time at a desk and on a computer.

Disclaimer

The information provided in this description has been designed to indicate the general nature and level of work performed by incumbents within this job. It is not designed to be interpreted as a comprehensive inventory of all duties, responsibilities, qualifications, and working conditions required of employees assigned to this job. Management has sole discretion to add or modify the duties of the job and to designate other functions as essential at any time. This job description is not an employment agreement or contract.


11/13/23 AM",1983,Civic & Social Services,Unknown / Non-Applicable,Nonprofit & NGO,201 to 500 Employees,Nonprofit Organization,True
