Job Title,Company Name,Location,Salary Estimate,Rating,Job Description,Founded,Industry,Revenue,Sector,Size,Type,Easy Apply
"Operations/Technical Support Analyst, Journeyman & Helpdesk Specialist - Hawaii","OBXtek Inc.
",United States,-1,4.0,"Responsibilities:
OBXtek is currently staffing for a Operations/Technical Support Analyst, Journeyman & Help Desk Specialist position supporting the Army’s Global Enterprise Network Modernization – OCONUS (GENM-O) organization.


Operations/Technical Support Analyst Duties:
Theater Operation Support:
Provide centralized suspense control over periodic reports and briefings for accuracy, relevance and completeness (i.e. weekly Top 5 project report, Staff Call, weekly contracting status reports, Council of Colonels for Pacific, Europe, SWA and Network Infrastructure, weekly Deputy CIO/G6 Brief, monthly project reviews, ArmyGlobal Enterprise Network Modernization - OCONUS Performance Work Statement (PWS) 29 Quarterly Performance Reviews and Periodic Status Reviews).
Coordinate and support organizational events approved by Director as required, drafting and complete final Commander's Critical Information Requirements (CCIR) reports. Prepare CCIR reports, received from the directorates within GENM-O, in accordance with GENM-O policy and procedures to inform leadership chain of potential adverse personnel or critical changes that impact or delay PdM GENM-O operations.
Perform emergency notification procedures for GENM-O using telephonic means; assist with emergency evacuation procedures and personnel accountability.
Assist with coordination and execution of Government sponsored events such as All- Hands meetings, honorary ceremonies, and ribbon-cuttings as required
Coordinate all in processing and out-processing procedures for all personnel
Organization Taskers and Reporting:
Maintain current organizational charts and perform monthly reviews and updates
Coordinate and support recurrent meetings with the teams overseas and other stakeholder engagements by developing meeting minutes, agendas, meeting notifications, and tracking tasks and suspenses.
Consolidate reports from each of the regions provide updates to the PMO leadership on project life cycle activities.
Monitor, assess, coordinate, analyze, and integrate component activities, and provide support to develop briefings/presentations and agendas.
Support the Quarterly PMOS Contract Performance Review (QPR) to include coordination with Directorates for input, scheduling and conducting GENM-O QPR briefings with PdM GENM-O staff.
Assist with the Management Internal Control Program (MICP) checklists review and internal GENM-O staffing annually and the Command Inspection Program (CIP) twice per year to measure compliance with prescribed PEO EIS policy and directives
Support the POM and PPBE processes
Maintain and update organizational records and current organizational charts as required.
Coordinate, track and respond to Staff Actions Control Officer (SACO) and data calls for information as required.
Training and Travel Support:
Provide a single point of contact, to assist GENM-O personnel with official overseas travel prerequisites, per Foreign Clearance Guide and http://www.fcg.pentagon.mil/fcg.cfm, theater clearance-related issues and base housing requirements; assist travelers when issues arise during travel or while deployed through the Government travel database; provide ongoing accurate and timely deployment and travel information status on personnel on departure, layover and arrival to and from TDY locations.
Track and prepare status of all TDY and overseas deployed Government and contractor personnel and report it daily to higher HQs
Maintain and process all requests for Government sponsored training, track all mandatory training and certification status for personnel (DAU, COR, Supervisory, etc.); and ensure training status is updated or maintained in the appropriate system.
Track readiness to travel on 72-hr notice of all personnel including having a valid passport, CRC certification, medical clearance, etc.
Coordinate and lead teleconferences with IPT leads, KOs, and leadership as needed.
Programmatic Documents:
Monitor, assess, coordinate, analyze, and integrate component activities, and provide support to develop briefings/presentations and agendas.
Facilitate information sharing and collaboration and maintain organizational policies and Standard Operational Procedures (SOPs)
Develops, writes, and edits material for reports, manuals, briefs, proposals, instruction books, catalogs, and brochures in support of program or project objectives.
Facilitate receiving writing and editing assignments from management staff and/or other authorized staff
Organize written material and complete writing assignments according to set standards
Facilitate reviews, written materials and recommended revisions and/or changes in scope, format, content, and methods of reproduction and binding.
Ensures documents meet editorial and government specifications and adhere to standards for quality, graphics, coverage, format and style.
Helpdesk Specialist Duties:


Contractor shall maintain the SharePoint Portal server location for storing, versioning, and collaborating on documents and MS Project Server collection sites daily.
Contractor shall maintain software needs for Government-provided desktop computers as required on a recurring basis with assignment of new Government or contractor personnel to GENM-O in support ofthe KM function, the contractor shall:
Coordinate within GENM-O Directorates and maintain the GENM-O Share Point portal.
Validate project is funded, named appropriately and assigned a unique ID, updated in the Master Project List (MPL), assigned to the proper directorate, and governance structure and electronic repository are established, as required.
Analyze project in coordination with GENM-O Directorates all portal Performance Work Statement (PWS) 38 documentation (i.e. plans, schedules, matrices, registers, charters, concurrence memorandums, support agreements, and strategies) to ensure accuracy, completeness and compliance with organizational standards, as required.
Modify site views, arrange for integrated version history tracking, accomplish collaborative live editing, and establish user friendly search capabilities based on validated user requirements as required schedule.
Recommend and assist Government enforcement of portal access and governance policy daily.
Establish and update authoritative repository for all project data as required with new projects and as old projects transition-out.
Provide users initial and refresher SharePoint orientation training with assignment of new personnel or when portal views are changed.
Prepare and maintain comprehensive user’s guide for the portal.
Establish process for gathering and tracking new requirements and updates.
Establish and maintain electronic trouble ticket process and respond to inquiries.
Coordinate trouble tickets with the help desk as required.

Travel can be expected up to 10% of the time.
Travel will consist of trips both CONUS and OCONUS.
Must be readily deployable (medically and administratively) to travel within 72 hours in any environment including contingency operations.
Qualifications:
Secret Clearance
3-7 years of relevant experience
Education/Certifications:
Bachelor’s Degree, preferably a MA/MS degree
Security Clearance: Secret Company Information:
COVID Policy: Prospective and/or new employees will be required to adhere with OBXtek’s COVID-19 policy. Employees working onsite at a customer location must comply with customer COVID-19 policy which may include any or all the following: social distancing, masks, vaccination, mandatory statements regarding one's vaccination status and mandatory testing.

Headquartered in McLean, Virginia and founded in 2009, OBXtek is a fast-growing leader in the government contracting field. Our mission is Our People…Our Reputation. Our people are trained professionals who enhance our customers’ knowledge and innovation using technology, collaboration, and education.

We offer a robust suite of benefits including comprehensive medical, dental and vision plans, Flexible Spending Accounts, matching 401K, paid time off, tuition reimbursement plans and much more.

As a prime contractor for 93% of our current work, OBXtek pairs lessons learned across disciplines with industry standard quality practices such as CMMI-Dev Level III, ITIL, 6Sigma, PMI, and ISO. Our rapid growth has been recognized by INC500, the Washington Business Journal, and Washington Technology magazine.

OBXtek is an Equal Opportunity Employer and does not discriminate based on race, color, religion, sex, age, national origin, gender identity, disability, veteran status, sexual orientation or any other classification protected by federal, state or local law.",2009,Information Technology Support Services,$25 to $100 million (USD),Information Technology,501 to 1000 Employees,Company - Private,False
Business Application Manager,"First Hawaiian Bank
","Honolulu, HI",$59K - $103K (Employer est.),3.7,"First Hawaiian Bank is currently seeking an analytical and collaborative Business Application Manager to join our Omni Channel Center. In this role, you’ll be responsible for supporting the implementation and maintenance of new or enhanced business applications and processes, including the Bank’s Online Appointment setting application and marketing technology solutions. Create test plans and conduct testing for application software or database changes and/or new releases. This also includes business requirements gathering, data analysis, project management, and other key responsibilities to support the business process and technology advancement of branch transformation, customer relationship management, and sales/marketing initiatives.

The successful candidate will be hired for the level of the position that aligns with their experience.

Work Schedule

Monday-Friday 8:00am-5:00pm (hours may vary)

The ideal candidate will have:

Bachelor’s degree in Management Information Systems or related field; or equivalent work experience required.
5-7 years of progressively responsible professional experience in applications support required.
5-7 years’ Business Analyst experience supporting institutional mainframe or client server applications preferred.
Analytical, problem solving, and decision-making skills
Knowledge of mainframe or client server applications
Knowledge of the system development life cycle (SDLC)
Excellent communication and presentation skills
Ability to demonstrate interpersonal and team building skills and manage conflict
Skill in understanding and focusing on the business unit needs, establishing credibility and building relationships with business units.
Ability to plan, organize and budget.
Possesses attention to detail with excellent follow-through.
Ability to work under pressure with multiple deadlines.

About First Hawaiian Bank

Are you interested in working alongside a group of dynamic thinkers, innovators, and leaders who thrive together as a team? Looking for a fun, collaborative, and challenging environment where you are empowered to make decisions? Would you like the opportunity to grow professionally and personally within a forward-thinking company? If so, you've come to the right place. At First Hawaiian Bank, we invest in you. We offer an award-winning training and development program to set you up for success. We pride ourselves on our company culture and core values: Caring, Character, and Collaboration. We also offer a comprehensive benefits program, including medical, 401(k), life insurance, tuition reimbursement, paid vacation, retiree benefits, and more!

Job Type: Full-time

Pay: $58,802.00 - $103,085.00 per year

Benefits:

401(k)
Dental insurance
Health insurance

Schedule:

8 hour shift
Monday to Friday

Ability to commute/relocate:

Honolulu, HI 96813: Reliably commute or planning to relocate before starting work (Required)

Experience:

Business analysis: 5 years (Required)
application support: 5 years (Required)

Work Location: In person",1858,Banking & Lending,$500 million to $1 billion (USD),Financial Services,1001 to 5000 Employees,Company - Public,True
Senior Program Manager,"Hawaiian Electric Company
","Honolulu, HI",$109K - $169K (Glassdoor est.),4.0,"We recognize our competitive advantage - our people. We believe in our people, who share our vision of meeting the needs of our employees, customers, and communities and who carry out the continued success of the company.




Our employees are committed to the company's foundational values: integrity, excellence, teamwork, environmental stewardship, and community commitment. In turn, we invest in our employees, providing opportunities for challenge and advancement and offering a competitive compensation package.




BRIEF POSTING DESCRIPTION:

The P CV CS INITIATIVES & IMPROV Department of the P CUSTOMER SERVICE SUPPORT & IMPROVEMENT Division at Hawaiian Electric Company has 1 Management vacancy available. (Role: Professional)




JOB FUNCTION:

Leads business analysis, project management, testing and training for major Customer Service projects for the company requiring complex regulatory approvals, cross-functional/multi-level (internal) management from conceptualization/inception through budgeting, design, approval, procurement, implementation, placement in operation, training and project closing. Serves as a focal point for all project matters and is responsible for meeting all project-related objectives.




ESSENTIAL FUNCTIONS:

Provides project leadership and work direction and secures commitment from stakeholders and team members in meeting project milestones. Develops and maintains project schedules and work plans, testing plans and leads user training. Prepares and presents project progress and cost reports internally and externally as required. Ensures team members have all resources, information, and direction necessary to successfully perform their jobs. Evaluates progress and performance of project team members and implements personnel actions necessary to accomplish project objectives including recognition, redirection, recruitment, and replacement of team members. Develops necessary strategies required to meet project goals. Makes early identification of potential problem areas. Solves problems to ensure attainment of project goals. Directs design, purchasing, approvals or implementation to prevent or minimize constraints or actions which may delay schedules or add costs to projects. Conducts inspections of the implementation as necessary.
Plans, organizes, and manages all tasks associated with business analysis, business case development, budgeting, design, approval, procurement, project implementation, operationalization, closing of projects and benefits realization. Lead requirements gathering/management, developing solutions and testing, including the design and review of test cases.
Serves as the focal point for all project-related matters. Works with and through external community groups, government agencies, the media, other utilities and private companies, the City Council, the State Legislature, and the Public Utilities Commission (“PUC”) to disseminate information, address concerns, obtain approvals, and resolve project-related problems. Prepares and provides testimonies and presentations at internal strategic meetings, public meetings and regulatory hearings as necessary.
Works with various divisions to obtain necessary authorizations for expenditures. Reviews and approves procurement for project approvals, design, material, and implementation.
Participates in Company emergency response activities as assigned, including any activities required to prepare for such emergency response.
Other duties as assigned.



BASIC QUALIFICATIONS:

Knowledge Requirements

A bachelor’s degree in a relevant discipline from an accredited college or university (business administration, information systems, e-business, telecommunications, or project management) or equivalent.Project Management Professional (PMP) Certification is required.
Excellent working knowledge of business analysis, requirements management, business cases, and project management processes.
Excellent working knowledge of facilitation techniques, idea generation/brainstorming, group decision making methods, process documentation and tools.
Thorough knowledge of project management standards and methodologies, including Waterfall, Agile and/or ASAP, developing work breakdown structures, tracking progress and status, managing scope, schedule, costs, resources, mitigating risk, etc.
Thorough knowledge of IT-related testing methodologies; planning, developing, leading testing teams, evaluating and tracking defects related to Unit, Functional, Integration, Batch, User Acceptance, and Security testing, etc.
Working knowledge of continuous improvement methodologies and techniques such as Six Sigma and Lean.
Thorough knowledge of the principles of change management, normally acquired through related training, and/or several years’ experience in in a cross-matrixed organization.
Working knowledge and experience with developing, coordinating, and managing end-user training and documentation.
Working knowledge of Information Technology principles including infrastructure and communications, operations, application development, production support, and service desk technologies; normally acquired through college level courses or equivalent experience.
Working knowledge of personal computers and related software applications such as MS Teams, MS Project, Word, Excel, Visio, SharePoint, SAP, HP ALM etc.
Demonstrated working knowledge of customer service principles and functions, highly desired.
Working knowledge of regulatory requirements (i.e. SOX, PUC, etc), highly desired.



Skills Requirements

Excellent written, oral and presentation skills.
Strong interpersonal skills to direct, influence motivate and persuade various groups or individuals.
Demonstrated in-depth analytical and administrative skills for such tasks as preparing and monitoring project requirements.
Effective oral, written, listening and platform skills to communicate with all levels inside and outside the organization.
Demonstrated interpersonal skills to handle confrontational, difficult and/or sensitive issues. Ability to handle such issues with professionalism while using tact, courtesy and discretion.
Ability to remain flexible in a demanding work environment and to adapt to rapidly changing priorities.
Clear ability to research, plan, organize, execute and report on work with little supervision.
In-depth analytical, computational, organizational and time-management skills.
Ability to work collaboratively as a member of a team and manage people at all levels within the company.
Ability to develop/maintain strong positive relationships with leaders and members of the community and government.
Demonstrated advance skill in using Microsoft Project, highly desired.
Ability to conceptualize new ideas quickly.



Experience Requirements

Extensive (8+ years) experience as a business analyst, project manager, implementation manager, designer or engineer with large complex projects, preferably within the electric utility industry.
Several (3-5) years of project management experience for small to large software implementation projects.
Experience with regulatory, social, or public affairs entities is desired (neighborhood boards, community groups, government agencies, political leaders, media, etc.).
Several (3-5) years of supervisory experience are desirable.



Role: Professional

Number of Vacancies: 1

Location: Honolulu – Oahu

Hiring Range: The hiring range for the Senior Program Manager [Req ID 8768] position is $103,500.00 to $134,400.00. The person selected will be placed according to his/her skills and qualifications.




About Hawaiian Electric Companies
Hawaiian Electric Companies provide electricity and services to 95 percent of the state's 1.4 million residents. The company is also one of the state's leading employers and a major contributor and supporter of community and educational programs.

The demand for power that has fueled the growth of the Hawaiian Islands has been met by Hawaiian Electric Companies for well over a century. And as the next millennium unfolds, the company is committed to providing quality service and seeking clean local energy sources to power generations of Hawaii families and businesses to come. Visit us at http://hawaiianelectric.com.

Interested individuals should apply online. The application must clearly indicate the demonstrated experience/knowledge/skills/abilities the candidate possesses which specifically qualifies him/her for the position.




Applicant Certification
By submitting an application for the position, candidates:
1. Authorize the Hawaiian Electric Companies to confirm all statements contained in the application and/or any materials submitted and made a part of the application as they relate to the position and to the extent permitted by law;
2. Authorize and consent to, without reservation, the Hawaiian Electric Companies sharing any and all information regarding previous or present employment, educational training or personal information from their records and from any other source with the hiring department or subsidiary company;
3. Release, discharge, and hold harmless, Hawaiian Electric Companies, from any and all liability for any damage which may be claimed as a result of furnishing such information to the hiring department or subsidiary company;
4. Authorizes release and transfer of all personnel records to be maintained by the hiring company in the event of an inter-company transfer; and
5. Authorize, direct, and consent to Hawaiian Electric Companies and/or its authorized agents to conduct investigations into candidates' background. These investigations may include, but are not limited to searches for information about applicants; record of criminal convictions to the extent permitted by law, education records, professional certifications, personal character references, and employment history.




EEO Statement
Hawaiian Electric Companies is an equal employment opportunity/affirmative action employer. We actively seek diversity among our employees. We do not discriminate on the basis of age, race, color, religion, sex/gender (including gender identity/expression), ancestry/national origin, disability, marital status, arrest and court record, sexual orientation, pregnancy, veteran status, genetic information, domestic or sexual violence victim status, or other protected categories in accordance with state and federal laws. We further encourage individuals with disabilities, minorities, veterans and women to apply.




Hawaiian Electric Companies complies with Title I of the Americans with Disabilities Act. Any request for reasonable accommodation needed during the application process should be communicated by the candidate to the HR Service Center at (808) 543-4848.




Affiliate Disclaimer
Hawaiian Electric Company, Inc., Maui Electric Company, and Hawaii Electric Light (“Company”) are Hawaii Public Utilities Commission (“PUC”) regulated companies. The disclosure relating to Affiliate Transaction Requirements that follows is made pursuant to the PUC’s Decision and Order No. 35962, issued on December 19, 2018, and subsequently modified by Order No. 36112, issued on January 24, 2019 in Docket No. 2018-0065.

By submitting your application, you understand and acknowledge that, if you are hired by the Company and subsequently transferred, assigned or otherwise employed by an Affiliate, said Affiliate will be required to make a one-time payment to the Company in an amount up to twenty-five percent (25%) of your base annual compensation.

In addition, if you are hired by the Company and subsequently transferred, assigned or otherwise employed by an Affiliate or an Affiliate-Related Entity, for a period of one year, you cannot appear in negotiations or otherwise interact directly with the Company or work on the same matter that you worked on while with the Company.

Affiliate is defined as “any person or entity that possesses an ‘affiliate interest’ in a utility as defined by section 269-19.5, Hawaii Revised Statutes (“HRS”), including a utility’s parent holding company, except as otherwise provided by HRS section 269-19.5(h).”

Affiliate-Related Entity is defined as “a third party that provides electricity-related services in a regulated utility’s service territory that has a material financial, operational, or ownership interest with an unregulated affiliate of the utility and of whom the utility has reasonable knowledge.”

For a current list of all Affiliates and Affiliate-Related Entities, please see:
https://www.hawaiianelectric.com/about-us/key-performance-metrics/financial/affiliate-transactions

This list may be amended, updated or revised from time to time without notice.",1891,Energy & Utilities,$1 to $5 billion (USD),"Energy, Mining & Utilities",1001 to 5000 Employees,Company - Public,False
