Job Title,Company Name,Location,Salary Estimate,Rating,Job Description,Founded,Industry,Revenue,Sector,Size,Type,Easy Apply
IMI CIB - Business Analyst Financial Sponsors Group - New York Branch,"Intesa Sanpaolo
",United States,-1,3.5,"Intesa Sanpaolo is the banking group leader in Italy. Assisting more than 14,6 milion of retail customers through a network of 5360 branches, it significantly supports the development of Companies and gives an important sustain to the country's growth. The Group has a selected retail banking presence in Central and Eastern Europe, the Middle East and North Africa, with approximately 1,000 branches and 7.2 million customers in 12 countries. Intesa Sanpaolo is also present in 25 countries in support of its corporate customers’ cross-border business. It is looking for new qualified profiles who want to face demanding and challenging career path with the following requirements:

Scope and Purpose

In support of the Global Relationship Manager (GRM) Financial Sponsors International, the Business Analyst will:

Support the GRM in all tasks related to developing new and expanding existing relationships with Private Equity clients
Perform due diligence on PE clients, fund structures, acquisition targets, industries, and other relevant information as required
Prepare PE and company profiles and pitches
Support in the identification of business opportunities and cross-selling of Intesa Sanpaolo’s financial products and services
Accompany and support the GRM in meeting with clients, in negotiating and structuring transactions
Manage multiple transactions/projects and communicate effectively with deal team members on status and prioritization
Coordinate between and establish strong working partnerships and routines with key internal partners including Leveraged Finance, Fund Finance, Syndication, Debt Capital Markets, Credit, Risk, Industry Verticals, KYC and Legal
Support the preparation of credit applications for LBO and fund finance deals, portfolio summaries and reviews
Perform specific administrative and operative activities related to customer onboarding and management
Demonstrate knowledge of relevant credit policies and procedures and accurately identify policy exceptions
Ensure the Branch’s KYC (Know Your Customers) and CDD (Customers Due Diligence) procedures and directives are adhered to.

The salary range for this job offer would be $ 85,000 - $ 110,000

Required Experience

Ideally 2- 3 years of work experience in a Leveraged Finance, Sponsor Coverage or Capital Markets role
Proficiency in MS Office (Excel, Word and PowerPoint)
Experience with Bloomberg, SEC filings, rating agency reports, and equity research reports is a plus.

Competencies Required

Good understanding of Leveraged Buyout (“LBO”) transactions and Private Equity (“PE”) fund structures
Knowledge of the Syndicated Loan Market
Strong quantitative and analytical skills, with the ability to understand and analyze syndicated deal structures and loan documentation
Familiarity with commercial, corporate and investment banking products
Resourceful self-starter, with willingness to learn, superior attention to detail, professional demeanour, and ability to work effectively on multiple projects
Teamwork attitude, with ability to interact and build healthy working relations in a culturally diverse environment
Excellent communication skills
Fluency in English

Required Qualifications, Skills and Knowledge

Bachelor’s degree in Finance, Accounting or Business Administration, with an emphasis on Corporate Finance, Financial Accounting or Economics

Everyone is an asset for our Group and that person could be you! Check out our job opportunities, apply and join our team!

Location: New York, US

Job Type: Full-time

Work Location: On the road",-1,Banking & Lending,$5 to $10 billion (USD),Financial Services,10000+ Employees,Company - Public,False
Business Analyst - Marshall Health,"Marshall Health
","Huntington, WV",$59K - $95K (Glassdoor est.),3.9,"Job Responsibilities:

Gathers, organizes, and evaluates relevant information, such as financial statements, vendor contracts, and EHR system specifications.
Communicates with internal and external stakeholders and conducts interviews as necessary to understand current practices and determine possible areas for improvement.
Analyzes department revenue, profits and losses.
Designs alternative plans and solutions for possible implementation to improve aspect of the departments.
Assists with project management at multiple stages, including the research, business plan preparation and presentation.
Performs administrative tasks such as creating or updating manuals for departmental policies and procedures as they relate to revenue cycle, operations and human resources (non-clinical).
Conducts in-depth data analysis, using spreadsheets or more specialized tools such as project management software and traceability solutions.
Utilizes departmental score cards to track and assess needs based on statistical information.
Performs quarterly reviews of departmental performance based on score cards to implement needed changes or adjustments in coordination with Department Administrator.
Assists, as needed, with physician enrollment during onboarding process to ensure accuracy and timely payer enrollment.
Assists Department Administrator with regular faculty interaction at all locations to ensure communication is consistent and beneficial.
Demonstrates willingness to seek and complete needed training for EHR systems, data analytics and data collection/organization.
Assists Department Administrator and appropriate staff with recruitment efforts to include scheduling, provider needs assessment and related business plans.
Performs other duties as assigned or requested.
Education: Bachelor’s degree in business, healthcare administration or related field. Master’s degree in healthcare administration preferred.
Experience: Prefer 1 year work experience, preferably in an academic ambulatory practice setting.

Internal applicants must call HR at ext. 11653 to determine eligibility before applying.",-1,Health Care Services & Hospitals,Unknown / Non-Applicable,Healthcare,Unknown,College / University,False
Business Applications Specialist -- Business Intelligence & Data Analytics -- Northgate-400 Associat,"CAMC Health System
","Charleston, WV",,3.5,"The Business Applications Specialist is responsible for combining business knowledge, clinical workflow, and data analysis within a continuous financial and process improvement framework. The Business Applications Specialist performs a variety of simple and complex activities to provide CAMC business entities with insights to maintain, improve or transform the business and technology framework. Responsible for application support and implementation within the Information Services Department. Demonstrates elevated computer operational skills. Should be able to perform difficult application diagnostics and troubleshooting. Must be able to mentor more junior level staff on departmental procedure and application support and/or implementation procedures. Understand and promote all IT services available to the organization. Demonstrates and the ability to follow I/S Departmental and CAMC Organizational governance commitments including (but not limited to) ticket management, training, testing, implementing, and validating service requests and/or requested modifications through the departments change control process. Promote the departments’ services within the organization as well as develop Informatics practices to ensure departmental quality and process measurements are included. Demonstrates a basic understanding and adheres to departmental processes for change control. Maintains a level of cybersecurity knowledge sufficient to securely accomplish their job duties.


Responsibilities

1. Coordinates and Assists users and IT personnel with training and development of user documentation. 2. Develops system design, including functional specifications, and implements strategies based upon the analysis of specific operational needs. 3. Evaluates, designs, builds, tests, and implements custom or vendor supplied software and develops system-wide reports to support information management needs. 4. Maintains production systems to ensure reliable performance. 5. Prepares complete unit, system, and integrated test plans and test methodologies. 6. Provides day-to-day operations support to customers as required. 7. Coordinates efforts between stakeholders from multiple areas in order to gather requirements, develop technical specifications, and test enhancements and other changes to these systems. 8. Identifies data integrity issues and analyzes data and process flows for process improvement opportunities. 9. Develops & Performs data analysis in order to extract requirements, identify data inaccuracies, and ensure accurate processing and reporting. 10. Identifies policies and requirements that drive a specific solution. 11. Works effectively on project teams and meets deadlines in accordance to project manager's expectations. 12. Works with stakeholders to build, test and maintain integration points with multiple vendor solutions 13. Utilizes detailed instructions to perform routine support and implementation work. 14. Utilizes appropriate and timely communication skills within assigned team. 15. Must have appropriate and timely communications skills to communicate with senior level management. 16. Completed certification/accreditation for specific vendor and/or governing body related to specific applications/tools for which responsibility is held for support. 17. Participates in contract review process, which will include initial vendor contact and contract review prior to delivering to management for further review, negotiation, and execution. 18. On call as required. 19. Flexible hours when needed. 20. All other duties as assigned.


Knowledge, Skills & Abilities

Patient Group Knowledge (Only applies to positions with direct patient contact) The employee must possess/obtain (by the end of the orientation period) and demonstrate the knowledge and skills necessary to provide developmentally appropriate assessment, treatment or care as defined by the department’s identified patient ages. Specifically the employee must be able to demonstrate competency in: 1) ability to obtain and interpret information in terms of patient needs; 2) knowledge of growth and development; and 3) understanding of the range of treatment needed by the patients. Competency Statement Must demonstrate competency through an initial orientation and ongoing competency validation to independently perform tasks and additional duties as specified in the job description and the unit/department specific competency checklist. Common Duties and Responsibilities (Essential duties common to all positions) 1. Maintain and document all applicable required education. 2. Demonstrate positive customer service and co-worker relations. 3. Comply with the company's attendance policy. 4. Participate in the continuous, quality improvement activities of the department and institution. 5. Perform work in a cost effective manner. 6. Perform work in accordance with all departmental pay practices and scheduling policies, including but not limited to, overtime, various shift work, and on-call situations. 7. Perform work in alignment with the overall mission and strategic plan of the organization. 8. Follow organizational and departmental policies and procedures, as applicable. 9. Perform related duties as assigned.


Education

• Bachelor's Degree (Required) Education: Bachelor’s Degree and Advanced Certifications or equivalent experience in Business Administration, Health Administration, Information Systems, Information Technology or related field Master’s Degree and Advanced Certifications preferred Experience: 10 years of related information technology, financial systems support, and/or related business/healthcare experience


Credentials

• No Certification, Competency or License Required


Work Schedule: Days

Status: Full Time Regular

Location: Northgate-400 Association Dr.

Location of Job: US:WV:Charleston

Talent Acquisition Specialist: Lisa J. Craft lisa.craft@vandaliahealth.org",1984,Health Care Services & Hospitals,Less than $1 million (USD),Healthcare,5001 to 10000 Employees,Nonprofit Organization,False
Operations Analyst -- Ambulatory Administration -- General-MSOB,"CAMC Health System
","Charleston, WV",$44K - $64K (Glassdoor est.),3.5,"Researches, identifies, and rectifies any circumstances affecting delayed submission of insurance accounts or payment of accounts.


Responsibilities

• Provides feedback / education to staff to prevent reoccurrence of insurance account issues. • Ability to analyze trends and determine root cause of billing problems. • Maintains knowledge of all Federal and state billing regulations and guidelines. • Prepares and reviews reports/ documents with appropriate staff as required. • Identifies opportunities for improvement within MMS CBO/Practice work flow processes. • Demonstrates ability to identify issues outside work flow process and escalates them when necessary. • Identifies and monitors incorrect reimbursement and coding issues. • Identifies and applies appropriate adjustments per contracts or state requirements. • Follows-up on all previously sent reconsiderations for proper payment. • Communicates with payors regarding issues and resolutions. • Performs other duties as assigned


Knowledge, Skills & Abilities

Patient Group Knowledge (Only applies to positions with direct patient contact) The employee must possess/obtain (by the end of the orientation period) and demonstrate the knowledge and skills necessary to provide developmentally appropriate assessment, treatment or care as defined by the department’s identified patient ages. Specifically the employee must be able to demonstrate competency in: 1) ability to obtain and interpret information in terms of patient needs; 2) knowledge of growth and development; and 3) understanding of the range of treatment needed by the patients. Competency Statement Must demonstrate competency through an initial orientation and ongoing competency validation to independently perform tasks and additional duties as specified in the job description and the unit/department specific competency checklist. Common Duties and Responsibilities (Essential duties common to all positions) 1. Maintain and document all applicable required education. 2. Demonstrate positive customer service and co-worker relations. 3. Comply with the company's attendance policy. 4. Participate in the continuous, quality improvement activities of the department and institution. 5. Perform work in a cost effective manner. 6. Perform work in accordance with all departmental pay practices and scheduling policies, including but not limited to, overtime, various shift work, and on-call situations. 7. Perform work in alignment with the overall mission and strategic plan of the organization. 8. Follow organizational and departmental policies and procedures, as applicable. 9. Perform related duties as assigned.


Education

• Bachelor's Degree (Required) Experience: 3 years related experience Substitution: May substitute Associate Degree in related field with 5 years experience for the Bachelor's degree and 3 years of experience


Credentials

• No Certification, Competency or License Required


Work Schedule: Days

Status: Full Time Regular

Location: General-MSOB

Location of Job: US:WV:Charleston

Talent Acquisition Specialist: Anita J. Ferguson anita.ferguson@camc.org",1984,Health Care Services & Hospitals,Less than $1 million (USD),Healthcare,5001 to 10000 Employees,Nonprofit Organization,False
Business Analyst Academic Affairs,"WVUH West Virginia University Hospitals
","Morgantown, WV",$63K - $99K (Glassdoor est.),3.6,"Welcome! We’re excited you’re considering an opportunity with us! To apply to this position and be considered, click the Apply button located above this message and complete the application in full. Below, you’ll find other important information about this position.

This positon will focus on the day-to-day business operations of a signature service line within WVU Medicine. This position contributes to meeting departmental goals through identifying revenue enhancement, expense management, and project development opportunities. This position will take a lead in several business functions which include, but aren’t limited to; oversight and coordination of service contracts with non-WVU Medicine entities, project management and deployment of new tools and software systems, and monitoring, analysis, and report coordination of operational metrics key to the success of the department.

Position will provide administrative oversight of the P&T process for WVU School of Medicine faculty.

Position will work collaboratively with leadership at all levels to ensure that the process is handled in a timely and efficient manner from start to finish. This includes oversight of communications among all parties involved, dissemination of information, scheduling meetings and ensuring that all WVU Provost’s Office deadlines are met.

Serves as a resource and contact for SOM faculty leaders and departmental administrators relative to the WVU SOM P&T function.

Position will act as the SOM Dean’s Office web developer and will be the unit’s authority on established WVU website protocols and guidelines. In collaboration with the HSC/SOM office of communications, the position is responsible for all website material to be current and within established WVU guidelines.

Position will assist the WVU SOM Associate Dean – Faculty and Practice Plan Affairs with the timely preparation, review and dissemination of SOM faculty offer letters, inclusive the processing advance rank/tenure requests.

This positon will focus on the day-to-day business operations of a signature service line within WVU Medicine. This position contributes to meeting departmental goals through identifying revenue enhancement, expense management, and project development opportunities. This position will take a lead in several business functions which include, but aren’t limited to; oversight and coordination of service contracts with non-WVU Medicine entities, project management and deployment of new tools and software systems, and monitoring, analysis, and report coordination of operational metrics key to the success of the department.

MINIMUM QUALIFICATIONS :

EDUCATION, CERTIFICATION, AND/OR LICENSURE:

1. Bachelor’s Degree in Business Administration, Finance, Accounting, Economics, or related field.

PREFERRED QUALIFICATIONS :

EDUCATION, CERTIFICATION, AND/OR LICENSURE:

1. Two (2) years of related work experience preferred.

CORE DUTIES AND RESPONSIBILITIES: The statements described here are intended to describe the general nature of work being performed by people assigned to this position. They are not intended to be constructed as an all-inclusive list of all responsibilities and duties. Other duties may be assigned.

1. Conducts analysis in order to support leadership in investigating and improving budget. Reports conclusions and recommends strategies to resolve any variances.

2. Manages and coordinates projects with external vendors to bring on new services and software in facilitating departmental goals. Ensures Projects are meeting established timelines, performing within projected pro-forma’s and budgets, and remaining within scope.

3. Conducts and participates in business meetings with Divisional and Regional leadership. Includes creating and improving reporting packages with operational, qualitative, and fiscal performance.

4. Manages expectations and engages management to review/resolve any potential changes to project scope, expected deliverables, etc.

5. Performs analysis of reporting revenue and investigates areas for improvement. Develops reporting to track, trend, and monitor success of revenue initiatives.

6. Reviews and summarizes large amounts of expense data with an ability to highlight areas for expense reduction to improve bottom line.

7. Uses analytical methods to ensure reported data is meaningful and accurate.

8. Develops technical ability in data analytics using various systems and tools.

9. Provides support in problem identification, resolution, and solution design for a variety of business needs.

10. Serves as first point of contact for department. Interfaces with hospital leadership and staff of various levels, with an ability to translate and communicate business concepts into actionable and meaningful terms.

11. Reviews, identifies and documents any issues, barriers, or risks and brings them to management’s attention.

12. Participates in post implementation review of projects.

PHYSICAL REQUIREMENTS: The physical demands described here are representative of those that must be met by an employee to successfully perform the essential functions of this job. Reasonable accommodations may be made to enable individuals with disabilities to perform the essential functions.

WORKING ENVIRONMENT: The work environment characteristics described here are representative of those an employee encounters while performing the essential functions of this job. Reasonable accommodations may be made to enable individuals with disabilities to perform the essential functions.

SKILLS AND ABILITIES:

1. Excellent oral and written communication skills and strong computer & organizational skills.

2. Proficient in Microsoft Office Suite; Word, Excel, and PowerPoint particularly.

3. Ability to problem solve and make appropriate decisions and recommendations to leadership.

4. Ability to learn or familiarity with healthcare software systems.

5. Ability to manage multiple task simultaneously to support leadership.

MINIMUM QUALIFICATIONS :

EDUCATION, CERTIFICATION, AND/OR LICENSURE:

1. Bachelor’s Degree in Business Administration, Finance, Accounting, Economics, or related field.

PREFERRED QUALIFICATIONS :

EDUCATION, CERTIFICATION, AND/OR LICENSURE:

1. Two (2) years of related work experience preferred.

CORE DUTIES AND RESPONSIBILITIES: The statements described here are intended to describe the general nature of work being performed by people assigned to this position. They are not intended to be constructed as an all-inclusive list of all responsibilities and duties. Other duties may be assigned.

1. Conducts analysis in order to support leadership in investigating and improving budget. Reports conclusions and recommends strategies to resolve any variances.

2. Manages and coordinates projects with external vendors to bring on new services and software in facilitating departmental goals. Ensures Projects are meeting established timelines, performing within projected pro-forma’s and budgets, and remaining within scope.

3. Conducts and participates in business meetings with Divisional and Regional leadership. Includes creating and improving reporting packages with operational, qualitative, and fiscal performance.

4. Manages expectations and engages management to review/resolve any potential changes to project scope, expected deliverables, etc.

5. Performs analysis of reporting revenue and investigates areas for improvement. Develops reporting to track, trend, and monitor success of revenue initiatives.

6. Reviews and summarizes large amounts of expense data with an ability to highlight areas for expense reduction to improve bottom line.

7. Uses analytical methods to ensure reported data is meaningful and accurate.

8. Develops technical ability in data analytics using various systems and tools.

9. Provides support in problem identification, resolution, and solution design for a variety of business needs.

10. Serves as first point of contact for department. Interfaces with hospital leadership and staff of various levels, with an ability to translate and communicate business concepts into actionable and meaningful terms.

11. Reviews, identifies and documents any issues, barriers, or risks and brings them to management’s attention.

12. Participates in post implementation review of projects.

PHYSICAL REQUIREMENTS: The physical demands described here are representative of those that must be met by an employee to successfully perform the essential functions of this job. Reasonable accommodations may be made to enable individuals with disabilities to perform the essential functions.

WORKING ENVIRONMENT: The work environment characteristics described here are representative of those an employee encounters while performing the essential functions of this job. Reasonable accommodations may be made to enable individuals with disabilities to perform the essential functions.

SKILLS AND ABILITIES:

1. Excellent oral and written communication skills and strong computer & organizational skills.

2. Proficient in Microsoft Office Suite; Word, Excel, and PowerPoint particularly.

3. Ability to problem solve and make appropriate decisions and recommendations to leadership.

4. Ability to learn or familiarity with healthcare software systems.

5. Ability to manage multiple task simultaneously to support leadership.

Opportunity for hybrid

Scheduled Weekly Hours:

40

Shift:

Exempt/Non-Exempt:

United States of America (Exempt)

Company:

WVUH West Virginia University Hospitals

Cost Center:

8340 UHA Deans Office

Address:

1 Medical Center Drive

Morgantown

West Virginia",-1,Health Care Services & Hospitals,$1 to $5 billion (USD),Healthcare,10000+ Employees,Hospital,False
