Job Title,Company Name,Location,Salary Estimate,Rating,Job Description,Founded,Industry,Revenue,Sector,Size,Type,Easy Apply
Business Analysis Manager - Remote (WFH),"Cognitive Medical Systems
","Anchorage, AK",$75K - $112K (Glassdoor est.),3.8,"Job Title: Business Analysis Manager


Job Summary:

The Business Analysis Manager is responsible for leading a team of IT business analysts to support the planning, development, and implementation of technology solutions within the government sector. This position plays a critical role in understanding business needs, assessing existing systems, and collaborating with stakeholders to ensure that IT projects align with government objectives and regulatory requirements.


Key Responsibilities:

Team Leadership:
Manage and lead a team of IT business analysts, providing guidance, mentorship, and performance management.
Foster a collaborative and innovative team culture that encourages professional development and knowledge sharing.
Business Analysis:
Identify, document, and analyze business processes, requirements, and objectives.
Develop and maintain a clear understanding of government policies, regulations, and procedures related to technology projects.
Collaborate with business units to define project scope and objectives.
Requirements Elicitation:
Engage with stakeholders to gather, validate, and prioritize requirements for IT projects.
Create detailed requirements documentation, including functional and technical specifications user stories and functional workflows
Solution Design and Planning:
Translate business requirements into technology solutions and systems.
Work with architects and technical teams to design efficient and cost-effective solutions.
Develop project plans, timelines, and resource allocation to ensure successful project implementation.
Quality Assurance:
Conduct thorough testing and validation of IT solutions to ensure they meet established requirements and government standards.
Implement quality control measures to identify and rectify defects in the systems.
Stakeholder Collaboration:
Facilitate communication and collaboration between IT teams, government departments, and other stakeholders to ensure alignment with government goals and objectives.
Compliance and Security:
Ensure that all IT solutions meet government security and compliance requirements.
Stay current with evolving regulations and implement necessary changes to maintain compliance.
Documentation and Reporting:
Maintain comprehensive records of project documentation, status reports, and project outcomes.
Prepare and present reports to senior management and government officials as required.

Qualifications:

Bachelor's degree in Information Technology, Business Administration, or a related field (Master's degree preferred).
At least 5 years of experience in IT business analysis, with 2 years in a managerial role.
Strong understanding of government operations, policies, and regulations.
Proven experience in leading and managing IT project teams.
Excellent communication, presentation, and interpersonal skills.
Proficiency in business analysis tools and methodologies.
Knowledge of project management principles and methodologies (e.g., PMI, Agile, Scrum).
Familiarity with government-specific software and systems is a plus.
Professional certifications, such as CBAP (Certified Business Analysis Professional), PMP (Project Management Professional), or similar, are advantageous.",2010,Computer Hardware Development,$5 to $25 million (USD),Information Technology,51 to 200 Employees,Company - Private,True
"Analyst II, Quality Assurance","GCI
","Anchorage, AK",$67K - $105K (Glassdoor est.),3.9,"GCI's Analyst II, Quality Assurance will provide professional services support in IT quality assurance efforts at GCI. This position contributes to success by testing, evaluating, assessing, investigating, and troubleshooting IT systems and integrations. This position writes, revises, and verifies quality standards and test procedures for program design and product evaluation to attain quality of applications economically and efficiently resolving bugs, defects and other potential issues.

Quality Assurance:

Perform quality assurance and testing activities.
Develop, document, and execute test plans and test cases in accordance with functional requirements and technical specifications.
Create and execute regression test plans.
Validate system application functionality across various hosted and on prem solutions, integrations, integrated systems, operational processes, and custom development ensuring their alignment with design specifications, and database updates.
Write clear, concise defects and/or bugs and effectively communicate with developers and project team members to isolate problems.
Work closely with technical resources and testers on review and resolution of issues.
Review test plans and cases written by others for coverage and completeness.
Review requirements and design documentation and participate in design reviews.
Assist Project Manager and/or Scrum master's in planning and estimating efforts - providing input/clarity on testing requirements and level of effort estimates.
Conduct QA on support processes to ensure that the application and support solution meets quality standards and business needs.
Work collaboratively with developers, business system analysts, project managers, and scrum masters to ensure quality product development and successful project deliveries.
Assist in developing and maintaining quality assurance procedures and standard.

Knowledge, Skills and Abilities :

Required:

Must be technically astute, highly organized and have a reputation for meeting deadlines and budget commitments.
Strong oral and written communication skills, particularly in the ability to communicate with, and understand the needs of, non-technical internal clients are essential. Instinctively senses issues and opportunities.
Understanding of SDLC (Software Development Life Cycle) leveraging traditional Waterfall, Agile, LEAN-Agile, SAFe, and/or blended frameworks.
Testing experience in internal software application and/or hosted development and systems integration.
Demonstrated ability to meet deadlines and multi-task in a dynamic, complex and rapidly changing environment.
Must be able to reconcile divergent demands and prioritize individual workload.
Must have the ability to successfully interact and collaborate with colleagues, customers, operating and technical staff and other GCI departments.
Must be able to function autonomously on assigned projects with minimal direction.
Strong analytical skills, problem-solving skills and troubleshooting abilities.
Ability to create and execute test plans and test scripts.
JIRA, Zephyr or other test system software experience including planning, creating and executing test cases.
Active participation in sessions with the business stakeholders

Desirable:

User Acceptance Test Planning and Implementation experience for hosted and/or on-premises applications and integrations
Telecommunications Industry Experience
Test Automation or Monitoring Experience
Netcracker platform experience or other order to billing/CRM/Financial software package
Experience testing: Website development, User Experience (UX) Design, Mobile Apps, Telecom software and systems, financial systems, engineering systems and switching, mobile device design, Cloud based solutions, Next gen connected devices, E-commerce, CRM, e-payment, and/or order to cash product process development lifecycles
SQL scripting skills in Oracle and MS SQL
Testing experience in a production environment with regular and frequent code releases
Business analysis and/or Project Management skills
Ability to use and create or configure automated testing tools for testing such as scripts or other available testing tools
Experience with development of electronic presentation materials, MS Teams, Zoom, Skype and the ability to handle ad-hoc question-and-answer sessions is also desirable.
Functional testing experience
Familiarity with JIRA, Confluence, Kanban
Functional understanding of Intranet and Internet technologies including, HTTP, FTP servers, application servers, and internet protocols
Experience with web analytics/reporting tools

Certifications: Industry specific certifications are highly valued and contribute toward education.

Software Test Certifications desirable
Project Management Institute Certification as a Project Management Professional (PMP and/or PMP-ACP) is highly desirable
Agile Certified Professional (ACP), IC Agile, LEAN Six Sigma is highly desirable
Certified Scrum Master (SAFE Certification is beneficial) is desirable
Applications, Programming, and Software certifications desirable.
ITIL Certification (V3 or 4), Foundation, Practitioner, Intermediate, Expert, Managing Professional, Strategic Leader, Master is desirable

Level Definition:

Position Title: Analyst II, Quality Assurance

Grade: E04

Additional Job Requirements: This is an intermediate level position requiring moderate supervision as well as collaboration with more senior analysts. This position will support the team in implementing moderate to more complex projects.

Essential Duties for this position:

Manage Kanban Test Boards in Jira or Confluence as an application administrator.
Communicate with other Jira Administrators and Atlassian on functionality and configuration updates
Verify and present statistical test data for client review through Dashboards and Status
Technical support for application jobs required for testing, including but not limited Data Requests, Inventory, Invoicing, Usage loads.
Evaluate incoming client requests for prioritization against backlog - providing input/clarity and on testing requirements and document level of effort estimates per request.

Minimum Qualifications:

Minimum of four (4) years quality assurance/ product/project management or monitoring experience.
Project experience a plus, Telecommunication experience is preferred, IT project experience preferred.
High School diploma or equivalent is required.
Bachelor’s degree is required preferably in Business, Technology, or Computer Science or relevant field required.
Or a combination of relevant education and/or work experience sufficient to perform the duties may substitute for the degree on a year for year basis.
Job Requirements At All Levels

Because GCI is a federal contractor subject to Executive Order 14042, GCI employees may be required in the future to be fully vaccinated* against COVID-19 as a condition of employment. If this occurs , GCI will consider requests for accommodation if an individual’s medical condition, disability, or sincerely held religious belief prohibits receipt of the COVID-19 vaccine.

Physical Requirements: Physical effort may include stooping, kneeling, touching, feeling, reaching, standing, walking, pushing, pulling, lifting, grasping, talking, hearing, and repetitive motions. Clarity of vision to see near, mid-range, and color. Ability to lift and carry up to 25 lbs.

Working Conditions: The work area must be quiet and free of distractions. Lighting must be adequate and without glare. Distracting noises should be kept to a minimum. The employee’s desk must be adequate, designed to safely accommodate the equipment the employee must use, e.g., computer, printer, keyboard, monitor etc. The employee must have reliable connectivity to the internet to access GCI via VPN. Employee workstation must comply with GCI’s ergonomics standards. Occasional business travel required.

The company and its subsidiaries operate in a 24/7 environment providing critical services to Alaskans and may need to respond to public health and safety matters or other business emergencies. Due to business needs employees may be contacted outside of the core business hours to respond to the immediate emergency. As such, you will be requested to provide emergency after hours contact numbers, to include your home and cell phone numbers if you have those services.

Driving Requirements (if applicable): Must possess and maintain a valid driver’s license, proof of insurance and a satisfactory driving record.

EEO: We are an equal opportunity employer, and all qualified applicants will receive consideration for employment without regard to race, color, religion, sex, sexual orientation, gender identity, national origin, disability status, protected veteran status, or another characteristic protected by law.

Disclaimer: The above information on this description has been designed to indicate the general nature and level of work performed by employees within this classification. It is not designed to contain or be interpreted as a comprehensive inventory of all duties, and responsibilities required of employees assigned to this job.",1979,"Cable, Internet & Telephone Providers",$500 million to $1 billion (USD),Telecommunications,1001 to 5000 Employees,Company - Public,False
"Senior Business Data Analyst, Revenue Cycle","Providence
",Alaska,-1,3.6,"Description

Providence St. Joseph Health is calling a Senior Business Data Analyst, Revenue Cycle to work remotely within our footprint states: AK, CA, MT, OR, TX and/or WA.

This position will be a contributor to the RCS Analytics Operations team which supports efforts of the Data & Insights team. The role (and team) supports the RCS Analytics team, leadership, and its stakeholders/customers. This position is seen as an accountable Business Analyst Sr for analytics-related activities. This role also supports various administrative and customer facing activities including, but not limited to intake/triage management, artifact management, policies & procedures, effort/time estimation, product training, Data Governance & Evangelism, inventory review with customers/leadership, resource onboarding, analytics ecosystem management, etc. The role may also serve in cross functional capacity on projects and initiatives.

Providence caregivers are not simply valued – they’re invaluable. Join our team at Revenue Cycle Business Services and thrive in our culture of patient-focused, whole-person care built on understanding, commitment, and mutual respect. Your voice matters here, because we know that to inspire and retain the best people, we must empower them.

Required qualifications:

Bachelor's Degree Computer science, mathematics, statistics, information technology, health informatics, public health, or related subject. -Or-
Bachelor's Degree Data Science, Analytics, Finance, Engineering, Mathematics, Computer Science, Business Administration, Health Administration, Public Health, Public Administration, or related discipline
2 – 3 years Revenue Cycle Experience
5 years Strong SQL programming skills. Some combination of experience with: Snowflake, SQL Server, Oracle SQL or similar platforms.
5 years Progressive experience in practicing analytics as a data analyst, report analyst, business analyst, BI developer, etc.
2 year's Experience with two or more provider-based Revenue Cycle vert
3 years Proven experience creating, managing, and validating large data sets.
Demonstrated PC skills, i.e., proficient with MS Office products including Word, Excel, Teams, SharePoint, Power Point and Outlook

Preferred qualifications:

Master's Degree Computer science, mathematics, statistics, information technology, health informatics, public health, or related subject.
Experience with EPIC: reporting data out of Epic, reviewing Revenue Cycle related account detail.
Report writing skills in Tableau or Power BI

Salary Range by location:

NorCal (Napa, Sonoma)

Min: $42.53 Max: $68.67

Southern California, NorCal (Humboldt) Alaska (Kodiak, Seward, Valdez)

Min: $37.91, Max: $61.20

WA Puget Sound Oregon (Portland) Alaska (Anchorage)

Min: $36.37, Max: $58.72

Oregon (Hood River, Medford, Seaside)

Min: $32.90, Max: $54.74

Eastern Washington (Richland, Spokane, Walla Walla)

Min: $32.36, Max: $52.25

Montana

Min:$29.28, Max: $47.27

Texas

Min:$27.74, Max: $44.78

Why Join Providence?

Our best-in-class benefits are uniquely designed to support you and your family in staying well, growing professionally, and achieving financial security. We take care of you, so you can focus on delivering our Mission of caring for everyone, especially the most vulnerable in our communities.

About Providence

At Providence, our strength lies in Our Promise of “Know me, care for me, ease my way.” Working at our family of organizations means that regardless of your role, we’ll walk alongside you in your career, supporting you so you can support others. We provide best-in-class benefits and we foster an inclusive workplace where diversity is valued, and everyone is essential, heard and respected. Together, our 120,000 caregivers (all employees) serve in over 50 hospitals, over 1,000 clinics and a full range of health and social services across Alaska, California, Montana, New Mexico, Oregon, Texas and Washington. As a comprehensive health care organization, we are serving more people, advancing best practices and continuing our more than 100-year tradition of serving the poor and vulnerable.

The amounts listed are the base pay range; additional compensation may be available for this role, such as shift differentials, standby/on-call, overtime, premiums, extra shift incentives, or bonus opportunities.

Check out our benefits page for more information about our Benefits and Rewards.

About the Team

Providence Shared Services is a service line within Providence that provides a variety of functional and system support services for our family of organizations across Alaska, California, Montana, New Mexico, Oregon, Texas and Washington. We are focused on supporting our Mission by delivering a robust foundation of services and sharing of specialized expertise.

We are committed to the principle that every workforce member has the right to work in surroundings that are free from all forms of unlawful discrimination and harassment.

We are committed to cultural diversity and equal employment for all individuals. It is our policy to recruit, hire, promote, compensate, transfer, train, retain, terminate, and make all other employment-related decisions without regard to race, color, religious creed (including religious dress and grooming practices), national origin (including certain language use restrictions), ancestry, disability (mental and physical including HIV and AIDS), medical condition (including cancer and genetic characteristics), genetic information, marital status, age, sex (which includes pregnancy, childbirth, breastfeeding and related medical conditions), gender, gender identity, gender expression, sexual orientation, genetic information, and military and veteran status or any other applicable legally protected status. We will also provide reasonable accommodation to known physical or mental limitations of an otherwise qualified caregiver or applicant for employment, unless the accommodation would impose undue hardship on the operation of our business.

We are a community where all people, regardless of differences, are welcome, secure, and valued. We value respect, appreciation, collaboration, diversity, and a shared commitment to serving our communities. We expect that all workforce members in our community will act in ways which reflect a commitment to and accountability for, racial and social justice and equality in the workplace. As such, we will maintain a workplace free of discrimination and harassment based on any applicable legally protected status. We also expect that all workforce members will maintain a positive workplace free from any unacceptable conduct which creates an intimidating, hostile, or offensive work environment.

Requsition ID: 224357

Company: Providence Jobs

Job Category: Strategy & Planning

Job Function: Administration

Job Schedule: Full time

Job Shift:

Career Track:

Department: 4001 SS RC RPTNG ANALYTICS

Address: WA Liberty Lake 24001 E Mission Ave

Work Location: Liberty Lake-Liberty Lake

Pay Range: $See posting - $See posting

The amounts listed are the base pay range; additional compensation may be available for this role, such as shift differentials, standby/on-call, overtime, premiums, extra shift incentives, or bonus opportunities.

Check out our benefits page for more information about our Benefits and Rewards.

Providence is proud to be an Equal Opportunity Employer. Providence does not discriminate on the basis of race, color, gender, disability, veteran, military status, religion, age, creed, national origin, sexual identity or expression, sexual orientation, marital status, genetic information, or any other basis prohibited by local, state, or federal law.",1855,Health Care Services & Hospitals,$100 to $500 million (USD),Healthcare,10000+ Employees,Nonprofit Organization,False
