Job Title,Company Name,Location,Salary Estimate,Rating,Job Description,Founded,Industry,Revenue,Sector,Size,Type,Easy Apply
Senior Business Analyst - Commercial Office and Product,"Hawaii Medical Service Association
","Honolulu, HI",$80K - $119K (Glassdoor est.),2.8,"Job Summary

**Hybrid Work Environment - Must reside in Hawaii **

Position performs business analysis tasks, project management activities and other related responsibilities for the department. Performs business analysis, cost/benefit justifications, must be able to analyze and comprehend complex processes and projects across the organization and is continually looking at ways to improve quality across existing and new workflows.

Duties and Responsibilities

Demonstrates proficiency in bringing a cross functional perspective to complex business analysis activities and projects to support the implementation of corporate projects involving new systems and functions, enhancements to existing systems and functions. Implementation responsibilities for projects of medium to large size and scope include:
Collaborate with business users to understand the business needs.
Define and document requirements and develop the business case.
Produce and manage a project plan.
Work with the technical staff to complete the analysis and design.
Manage cross functional teams, representing and advocating functionality for stakeholders.
Document the test plan, work with the business users to complete the test cases.
Coordinate the testing to ensure technical and business resources are available and appropriate.
Collaborate with the business users on workflows and procedures.
Ability to understand inputs, outputs, and impacts to the end-to-end workflows across multiple project teams and/or departments.
Work with the business users on staff training.
Provide post implementation support.
Collaborate with management and users to influence changes to improve and automate business processes.
Plan and coordinates projects to support departmental and cross departmental related activities. Work with business analysts, project leads, management and other departments as required. Learn new business concepts and workflow management methods applicable to assigned projects and applications as needed.
Performs all other miscellaneous responsibilities and duties as assigned or directed.
#LI-Hybrid

Exempt or Non-Exempt

Exempt

Minimum Qualifications

Bachelor's degree (B.A.) and 4 years of related experience; or equivalent combination of education and related experience.
Effective verbal and written communication skills.
Report writing or other business/technical writing skills.
Excellent critical thinking skills.
Knowledge of business processes and analytical functions.
Demonstrated organizational skills.
Proven success with project implementation and analytical work.
Basic knowledge of Microsoft Office applications. Including but not limited to Word, Excel, Outlook, and Power Point.",1938,Insurance Carriers,$500 million to $1 billion (USD),Insurance,1001 to 5000 Employees,Company - Private,False
Deposit Operations Analyst,"American Savings Bank
","Honolulu, HI",$47K - $67K (Glassdoor est.),3.4,"Primary Purpose Of Job

Ensures data integrity on system applications/modules are in compliance with applicable regulations and internal controls, through report reviews, account maintenance, research and data entry. Analyzes reports and ensures file maintenance has been correctly conducted by the branches or other departments.


Major Job Accountabilities

Performs and maintains compliance processes for government reporting, applicable regulatory requirements, and internal controls.
Promotes data integrity on system applications/modules supported by the Department through reporting, conducting transactions, and performing account maintenance.
Reviews and analyzes reports to identify data discrepancies and correct where possible and/or escalate for action.
Conducts research on issues, conducting changes or questions during report review or file maintenance requests.
Analyzes and reviews processes and make recommendations for changes and opportunities for process improvement.
Prepares correspondence and legal documents to accomplish what is required per the instruction of the Legal Process Documents (Levies, garnishee summons, subpoenas, seizure warrants and temporary restraining orders). Prepares and forwards notification letters to customers, branches, departments, attorneys, federal and state agencies, Item Processing Operations – Research, Accounting and various Loan departments.
Prepares, maintains, and monitors accurate filing and retention of documents. Processes necessary transactions including the collection and processing of legal or other fees due to the bank as part of complying with the Legal Process Documents.
Answers inquiries via phone and email from branches, departments, and customers within established timelines.
May occasionally work over 40 hours per week.
Performs work at the assigned work location.


Required Skills Or Training

Customer Service: Ability to provide excellent customer service to meet customer and teammates needs. Must be able to keep sensitive customer and Bank data confidential and secure.
Communication: Excellent verbal, written and interpersonal skills.
Organization: Excellent organization skills and attention to detail.
Computer: Proficient use of Microsoft Office applications (Word, Excel, Outlook). Demonstrated ability to learn technical and business knowledge of banking systems/applications.
Analytical: Ability to gather and interpret data and analyze results to solve problems.
Personal: Able to work effectively to meet critical deadlines amid shifting priorities and multiple demands.


EOE, including disability/veterans

At American Savings Bank, we welcome and support all individuals and celebrate the diversity of our team members, customers and community. We are committed to ensuring that our online application process is accessible and provides an equal employment opportunity to all job seekers. If you need assistance searching for a job or submitting an application, please contact us by calling 808-538-2000 and a member of our Recruitment team will follow up with you. Mahalo for your interest in American Savings Bank!",1925,Banking & Lending,$1 to $5 billion (USD),Financial Services,1001 to 5000 Employees,Company - Public,True
Security Operations Analyst,"American Savings Bank
","Honolulu, HI",$47K - $71K (Glassdoor est.),3.4,"Primary Purpose of Job

The Security Operations Analyst is responsible for the design and execution of a strategic roadmap that maintains and evolves the company's security posture. Maintains subject matter expert-level knowledge of security tools and techniques, incident response, containment, and recovery.


Major Job Accountabilities

Responds to immediate security incidents, assess the impact of threats as well as coordinate strategies for containing, mitigating, and eradicating them.
Responsible for escalation support, security tickets, and security incident response.
Serves as project manager for key security initiatives.
Monitors and assesses the Bank’s systems/applications on a continual basis. Prioritizes urgent security patches and remediation as needed.
Supports and maintains security controls on different platforms to ensure enforcement of internal security policies to maintain the integrity of the enterprise networks, systems and applications utilized throughout the organization.
Stays up-to-date on cybersecurity best practices, trends and technologies.
Serves as an information security expert to promote awareness as well as to promote healthy, open & honest communication with other teams/departments.
Develops and implements threat mitigation strategies. Performs event reporting and trending analysis.
Ensures work performed is compliant with all banking laws and regulations relevant to data security.
Works On Call rotations or as needed to respond to critical incidents. May also be required to work evening/night hours.


Experience Required

Three (3) years of work experience in Information Security and/or Security Operations experience. Prior experience within a financial services organization is a plus.
Three (3) years of working knowledge of security technologies including but not limited to vulnerability management, cloud security, web proxies, endpoint and email protection, Firewalls, IDS/IPS, privileged account management, etc.).


Required Skills or Training

Hands-on experience with security architecture, technologies, and solutions.
Experience detecting, analyzing, and responding security events.
Experience in system and/or application vulnerability management.
Able to apply security principles and oversight based on best practices and industry standards.
Understanding of a broad range of security technologies and how they work.
Excellent verbal, written and interpersonal communication skills. Able to work collaboratively across the organization.
Excellent organizational skills and attention to detail.
Possesses solid understanding of Federal and state laws/regulations relating to information safeguards and controls, including laws such as National Institute of Standards & Technology (NIST). Knowledge of the Federal Financial Institutions Examination Council (FFIEC) and section 501(b) of the Gramm-Leach-Bliley Act is a plus.
Demonstrates in-depth analytical skills, including the ability to consolidate broad data sets from multiple sources, both internal and external, to identify patterns and/or risk factors.
Must be self-motivated with willingness to learn in a hands-on learning environment. Critical thinker with the ability to research, develop and communicate solutions to detect security incidents in a timely manner.


EOE, including disability/veterans

At American Savings Bank, we welcome and support all individuals and celebrate the diversity of our team members, customers and community. We are committed to ensuring that our online application process is accessible and provides an equal employment opportunity to all job seekers. If you need assistance searching for a job or submitting an application, please contact us by calling 808-538-2000 and a member of our Recruitment team will follow up with you. Mahalo for your interest in American Savings Bank!",1925,Banking & Lending,$1 to $5 billion (USD),Financial Services,1001 to 5000 Employees,Company - Public,True
EPIDEMIOLOGY AND LABORATORY CAPACITY (ELC) BUSINESS ANALYST,"State of Hawaii
","Honolulu, HI",$5K - $7K (Employer est.),3.3,"Recruitment Information

This posting is for the State of Hawaii, Department of Health, Disease Outbreak Control Division, Health Information Systems Office.

The position is located in Downtown on the Island of Oahu.

Up to $5,400 - $6,900 per month, salary commensurate w/ training and experience

If you have any questions regarding this non-civil service exempt position, please contact the HR Specialist, at doh.docd.ao@doh.hawaii.gov.

The State Recruiting Office will refer all inquiries regarding this exempt position to the Department of Health.

Duties Summary

Exempt, Non-Civil Service, Full-Time, Temporary Appointment. The primary purpose of this position is to act as the key interface between the users and the project manager by gathering information, document processes, and confirm the final documents with users. The position will facilitate the collection of data and transform it into a more usable format for analysis and decision-making and for detecting, understanding, controlling, and preventing infectious diseases in the population, and using data analytics to assess processes, determine technical and functional requirements, and deliver data-driven solutions to the stakeholders. In addition, the position is responsible for facilitating enhancement of disease outbreak investigations by using data driven techniques to ensure data management systems and technology provide the critical data for efficient and timely response to and reporting of disease alerts; developing and enhancing surveillance data through any necessary complex coding or HL/7 message mapping; facilitating, coordinating, and exchanging of surveillance data through electronic interfaces with partners. The position will implement sentinel, syndromic, or hospital-based, including emergency department, surveillance to enhance early detection, identify outbreaks, and support all-hazards situation awareness.

Minimum Qualification Requirements

EDUCATION: Possession of a bachelor’s degree or higher in business analysis, business administration, finance or related field with coursework in data science and analytics.

EXPERIENCE: Two (2) years of Business Analyst experience and one and a half (1 ½) years of progressively responsible professional work experience that required and aptitude for planning, development, implementation and review of large-scale electronic data application systems. Proven management and organizational skills.

In addition, broad IT domain experience in three or more of the following areas: Applications Development, Enterprise Architecture, Project Management, Vendor Management, Quality Assurance, Infrastructure and Maintenance and Support.

LICENSE: Valid State of Hawaii driver’s license is preferred.

Who May Apply

LEGAL AUTHORIZATION TO WORK REQUIREMENT: The State of Hawaii requires that all persons seeking employment with the government of the State shall be citizens, nationals, or permanent resident aliens of the United States, or eligible under federal law for unrestricted employment in the United States.

Other Information

This position is exempt from civil service. Therefore, if you are appointed to the position, your employment will be considered to be “at will.”

How to Apply:
Mail completed State of Hawaii Application for Non-Civil Service Appointment with original signature, cover letter, detailed resume, three (3) references, and salary requirements to:
Department of Health
Disease Outbreak Control Division
PO BOX 3378
Honolulu, Hawaii 96801-3378
Attn: Administrative Officer/HR Specialist

Visit the Department of Health website at: http://health.hawaii.gov/employment/job-opportunities/.

Recruitment is continuous until needs are met for position #123503.

Direct all inquiries regarding this position to:
HR Specialist, at doh.docd.ao@doh.hawaii.gov

This position is exempt from civil service. Employment in such positions are considered to be “at will.”

This position is located on Oahu. Remote work is currently not available.

The mission of the Department of Health is to protect and improve the health and environment for all people in Hawaii. Hawaii Department of Health (HDOH) supports a diverse-multicultural workforce that reflects the community, promotes equal opportunity at all levels, and creates an inclusive work environment, free from discrimination.

NOTE: The State Recruiting Office will refer you to the Department of Health regarding this exempt position.


As a condition of employment with the State of Hawai‘i, each qualified candidate who has been given a conditional offer of employment must show proof of full COVID-19 vaccination and shall be fully vaccinated by his/her/their employment start date. A reasonable accommodation will be provided if requested by a candidate and it is determined through an interactive process that pregnancy, a qualifying disability, or a sincerely held religious belief prevents the candidate from receiving a COVID-19 vaccination.

Please note that the COVID-19 vaccination policy above will apply to both new hires not currently employed by the State of Hawaii Executive branch, as well as current State of Hawaii Executive Branch Employees who are being considered for placement into another State of Hawaii Executive Branch position.




EXEMPT BENEFITS

This is a non-civil service position. Benefit information will be provided at time of offer by the Department Personnel Officer or Director of the hiring department.

Listed below is a summary of the benefits the State offers to exempt employees, which is based on full-time employment.

Paid Holidays


Eligible for 13 paid holidays each year; 14 holidays during an election year.


Paid Vacation


Eligible for 21 days per year.


Paid Sick Leave


Eligible for 21 days per year.


Other Leaves


Reasonable time off with pay may be provided for jury or witness duty, a death in the family, some military duty, and donation to the Blood Bank. Leave sharing donations may be granted to eligible employees who have serious personal illnesses or injuries or need to care for a seriously ill or injured family member. Various leaves without pay may also be granted with full re-employment rights.


Health Insurance


The State pays a part of the premiums for each employee's enrollment in a State sponsored Medical, Drug, Vision, and Dental Plan. For more information, visit the Employer Union Trust Fund website www.eutf.hawaii.gov for coverage and options.


Group Life Insurance


The State provides a free life insurance policy for eligible exempt employees.


Retirement Plan


The State contributes to a retirement plan for eligible employees. Generally, employees under the Hybrid Plan with 10 years of credited service and who have reached 65 years of age or have 30 years of credited service and have reached 60 years of age may retire and receive benefits. To find out more about the options you have, go to http://ers.ehawaii.gov.


Premium Conversion Plan


Participating exempt employees may increase their take-home pay by having the State deduct the cost of health care premiums before payroll taxes are withheld.


Flexible Spending Accounts


Eligible exempt employees can reduce their federal and state income taxes and social security taxes by setting aside money from their paychecks to pay for eligible out-of-pocket health care expenses and eligible dependent care expenses on a BEFORE-TAX basis.


Transportation Benefits


Participating employees may increase their take-home pay by having the State deduct qualified transportation expenses (i.e. eligible parking fees, monthly bus passes for TheBus, fare coupons for The Handi-Van, Vanpool Hawaii participation fee, etc.) through pre-tax payroll deductions.


Deferred Compensation


The State offers exempt employees a tax-deferred retirement savings program. This program allows employees to build a retirement nest egg through voluntary, pre-tax payroll deductions. A broad range of investment options are available to select from.


Temporary Disability Insurance


Qualified exempt employees may be eligible to receive partial wage replacement, at no cost to the employee, for a disability caused by a non-work related injury or illness under this program.


Social Security


As an employer, the State also contributes to an exempt employee's social security account.


Training & Continuing Education


The State supports developmental activities related to an exempt employee's work. In many departments there are numerous in-service training opportunities available. Sabbatical leaves with pay are available for qualified employees.


Travel Expenses


The State may pay for certain business related travel expenses including mileage reimbursement for use of a personal car during work, airfare, meals and lodging expenses for trips to neighbor islands or out of state.


Union & Collective Bargaining


Exempt employees may have the right to join the union for collective bargaining with the State and employee representation depending on the status of the exempt position.


The above information is solely intended as a summary of the benefits available to State of Hawaii employees and is subject to change. Whether or not you are entitled to a particular benefit will depend on your specific appointment and employment status (included, excluded, exempt, non-exempt). Please refer to the appropriate collective bargaining agreement or executive order and all applicable laws, rules, policies, or plan documents for further details. Nothing herein shall be deemed as creating an employment contract, promise of employment, promise of continued employment, or obligation of any kind on the part of the State of Hawaii.




The State of Hawaii is an Equal Opportunity Employer


Revised 01/13",1960,State & Regional Agencies,Unknown / Non-Applicable,Government & Public Administration,201 to 500 Employees,Government,False
Medicare Stars Senior Business Data Analyst,"Hawaii Medical Service Association
","Honolulu, HI",$65K - $97K (Glassdoor est.),2.8,"Job Summary

**Hybrid Work Environment - Must reside in Hawaii **

Serves as a lead business data analyst to inform initiatives and strategy within the Medicare Stars team. Works independently to monitor Medicare Star Ratings program performance at the plan and measure level and manages all aspects of Stars performance data: identification, synthesis of disparate sources, analysis, management, reporting and visualization. Supports efforts with internal and external partners by providing relevant and actionable data.

Duties and Responsibilities

Research and Analysis:
Proactively develops, implements and/or enhances methods to extract complex data sets from available sources (e.g., HMSA data repositories, HEDIS software, external party extracts, etc.).
Integrates data and uses advanced analytical methods/tools to identify business-critical trends, issues, root causes and focused population segments.Translates data into actionable visualizations using tables, graphs, charts, written reports and presentations.
Works closely with management to develop short and long-term departmental objectives.
Synthesizes data insights and stakeholder input to provide recommendations to internal and external partners to support Stars performance improvement initiatives.
Applies expert understanding of standard quality measures (e.g., HEDIS, CAHPS, HOS) to identify additional strategic improvement levers (e.g., supplemental data, benefit alignment) that may impact Stars performance.
Ensures Stars measure data is complete and accurate by implementing effective controls and validation activities.
Cross-Functional Collaboration
Participates in and contributes to various projects and cross-departmental teams that support the Stars program. Prioritizes Stars performance data needs across efforts.
Serves as the lead Stars performance data subject matter expert in various workgroups and efforts (e.g., data strategies, HEDIS performance, provider performance platforms such as Coreo, etc.). Writes business requirements and test scripts, performs unit and system testing.
Coordinates Stars performance data activities with related quality team activities (e.g., HEDIS data team, Payment Transformation quality team, FQHC/RHC quality team). Coordinates Stars improvement activities with the HCC risk adjustment team to ensure integration and alignment of quality goals with HCC risk adjustment objectives.
Represents HMSA in Blues plan and/or other industry work groups to compare best practices for improving Stars performance data.
Stars Performance Monitoring
Maintains a high-level understanding of the Medicare Part C & D Star Ratings Technical Notes. Monitor proposed changes, proactively identify potential risks to Stars performance, as well as associated mitigation strategies.
Gathers data to create and publish the Stars dashboard and related metrics on a monthly basis. Proactively identifies and supports acquisition of new data sources.
Distributes actionable data to facilitate Stars performance monitoring against current targets and year-end projections.
Works with internal and external teams to proactively identify and implement Stars dashboard enhancements.
Validates CMS Stars plan performance reports (e.g., First Plan Preview, Westat MCAHPS reports) against internal data.
Other Duties/Functions
Performs all other miscellaneous responsibilities and duties as assigned or directed.
#LI-Hybrid

Exempt or Non-Exempt

Exempt

Minimum Qualifications

Bachelor's degree and five years of related work experience; or equivalent combination of education and related work experience.
Demonstrated knowledge in identifying issues, collecting data, and analyzing and interpreting data.
Intermediate working knowledge of Microsoft Office applications including Word, PowerPoint and Outlook.
Advanced working knowledge of Microsoft Excel.
Advanced working knowledge of MicroStrategy, SQL, SAS, Access, R or other business intelligence language/tools.
Intermediate working knowledge of Tableau or other data visualization tools.",1938,Insurance Carriers,$500 million to $1 billion (USD),Insurance,1001 to 5000 Employees,Company - Private,False
