Job Title,Company Name,Location,Salary Estimate,Rating,Job Description,Founded,Industry,Revenue,Sector,Size,Type,Easy Apply
IT D365 Business Analyst,"Morgan Advanced Materials
",United States,-1,3.2,"Overview:

Morgan Advanced Materials is a business rich in history and innovation. Founded in the UK in 1856, we have grown into a global organisation with 70 sites in 18 countries. Our model to serve our customers where they need us has led to a diversified product range using our unparalleled expertise in ceramic and carbon materials, which we exploit to solve difficult problems for our customers across a diverse range of markets.


We are a purpose driven organisation. Our purpose is to use advanced materials to make the world more sustainable and to improve the quality of life. We deliver on that purpose through the products that we make, and the way that we make them.


We help our customers push the limits of their processes and products to meet the demanding requirements they face, from higher process temperatures to higher product performance to increasing miniaturisation.

Key Figures: Revenue £1,112m (2022), ~8,500 employees, manufacturing in 30+ countries, and a global customer portfolio. A UK PLC with head office located in Windsor, Berkshire UK. Listed on London Stock Exchange; Member of the FTSE 250 Index.


Responsibilities:

OVERVIEW & SCOPE OF ROLE:

Morgan IT is on a mission to enable and drive the Morgan goals by being a valuable business partner to all Global Business Units and Functions by:

Running Effective and Efficient IT
Delivering Solid Business Foundations
Extracting Maximum Business Value from IT
Driving disruptive innovation

To do so, the OneIT team is currently executing on a strategic roadmap to make significant step changes in IT performance and business value from IT.


ESSENTIAL DUTIES & REPONSIBILITIES:
The D365 IT Business Analyst will ensure the line of business applications, primarily Dynamics 365 (D365), can sustain current and future business needs for our businesses. This role is responsible for providing D365 technical and functional expertise, ensuring business requirements are gathered and subsequent technical/functional resolutions are implemented appropriately. In addition, the role will ensure efficient and effective business as usual operation of D365, including remediation of issues.

The D365 IT Business Analyst understands both technology as well as business and is responsible to capture all business requirements in order to ensure proper IT solutions are delivered. The key focus is mapping functional requirements of the Finance & Supply Chain modules in D365, data and processes.
Key Accountabilities
Serves as liaison to business and IT teams to understand business requirements and create and implement solutions as well as understanding root causes of current issues.
Assembling business requirements with requisite analysis and translation into D365 solutions; along with alternative options and recommendations.
Supports designing business solutions that ensure alignment with the architecture principles and standards.
Documents and provides training for newly implemented systems and/or processes using Click Learn
Resolving incidents/issues, with root cause analysis and fix where appropriate, for D365 applications.
Applying functional and technical understanding of D365 to develop new functionality and integrations/interfaces with other systems as required, to support business growth.
Ensuring all aspects of the D365 development lifecycle are completed successfully, incorporating ISV solutions.
Assuring quality of releases (fixes/upgrades/enhancements etc) into production, through thorough testing and first-class environment management.
Ensuring vendor relationships remain transparent and with clearly understood outcomes
Supports Business Information Managers, Project Managers and Solution Architects in writing program / project proposals
Work with business end users to ensure the project meets business needs
Assumes ownership of the process, system, and expands skill base.
Interacts frequently with business process owners.
Conduct unit testing for project deliverables and facilitate user acceptance testing
Engage in efforts to establish scope and business case for new programs and initiatives.
Collaborate with team members to collect and analyse data
Qualifications:

OVERVIEW & SCOPE OF ROLE:

Morgan IT is on a mission to enable and drive the Morgan goals by being a valuable business partner to all Global Business Units and Functions by:

Running Effective and Efficient IT
Delivering Solid Business Foundations
Extracting Maximum Business Value from IT
Driving disruptive innovation

To do so, the OneIT team is currently executing on a strategic roadmap to make significant step changes in IT performance and business value from IT.


ESSENTIAL DUTIES & REPONSIBILITIES:
The D365 IT Business Analyst will ensure the line of business applications, primarily Dynamics 365 (D365), can sustain current and future business needs for our businesses. This role is responsible for providing D365 technical and functional expertise, ensuring business requirements are gathered and subsequent technical/functional resolutions are implemented appropriately. In addition, the role will ensure efficient and effective business as usual operation of D365, including remediation of issues.

The D365 IT Business Analyst understands both technology as well as business and is responsible to capture all business requirements in order to ensure proper IT solutions are delivered. The key focus is mapping functional requirements of the Finance & Supply Chain modules in D365, data and processes.
Key Accountabilities
Serves as liaison to business and IT teams to understand business requirements and create and implement solutions as well as understanding root causes of current issues.
Assembling business requirements with requisite analysis and translation into D365 solutions; along with alternative options and recommendations.
Supports designing business solutions that ensure alignment with the architecture principles and standards.
Documents and provides training for newly implemented systems and/or processes using Click Learn
Resolving incidents/issues, with root cause analysis and fix where appropriate, for D365 applications.
Applying functional and technical understanding of D365 to develop new functionality and integrations/interfaces with other systems as required, to support business growth.
Ensuring all aspects of the D365 development lifecycle are completed successfully, incorporating ISV solutions.
Assuring quality of releases (fixes/upgrades/enhancements etc) into production, through thorough testing and first-class environment management.
Ensuring vendor relationships remain transparent and with clearly understood outcomes
Supports Business Information Managers, Project Managers and Solution Architects in writing program / project proposals
Work with business end users to ensure the project meets business needs
Assumes ownership of the process, system, and expands skill base.
Interacts frequently with business process owners.
Conduct unit testing for project deliverables and facilitate user acceptance testing
Engage in efforts to establish scope and business case for new programs and initiatives.
Collaborate with team members to collect and analyse data


Morgan Advanced Materials is an EEO/AA/M/W/D/V Employer Ind-1",1856,Metal & Mineral Manufacturing,$1 to $5 billion (USD),Manufacturing,5001 to 10000 Employees,Company - Public,False
Technology Business Analyst- Contractor,"EY
",United States,$55.00 - $85.00 Per Hour (Employer est.),3.9,"We currently have a contract opportunity for a Technology Business Analyst- Contractor.

Lead the effort to plan, scope, gather, understand and analyze business requirements, and translates business requirements into functional and non-functional requirements
Apply business analysis knowledge areas and creativity to drive requirements work effort ranging from planning, elaboration, analysis, validation to communication through the different stages of the requirements lifecycle
Lead the effort to engage with business and technology partners to clarify application functions, processes and data flow to align business and technology capabilities or constraints
Integrate the solution into the business workstreams, which may include the provision of enablement materials and training agenda to facilitate adoption and integration of the product and processes into the business cycle
Verify, through different testing practices (ex. UAT), that the solutions meet the functional specifications and resolve specified business problems
Have awareness of technology components and their relevancy to the functional modules, especially their advantages in advancing business position and improving user journey
Skills

devops

agile

Qualifications
Bachelor's degree in Business Administration, Business Management, Computer Science, Engineering or related field preferred
At least 5 years of experience with significant role interacting with business and technology leaders to define business operations, workflows and technology solutions
Experienced and accountability in the functional architecture of products, product portfolios or solution accelerator with at least $3m of investment, $1m if using leading cutting edge innovative technologies
Have experience in Agile framework participating directly in Agile practices and producing common artifacts
Understand product development and delivery framework especially Agile framework, DevOps practices and micro services

The expected pay rate range for this contract assignment is $55 to $85 per hour. Exact pay rate will vary based on skills, experience, and location.

GigNowOpportunities

#GigNowTechOpportunities

Equal Employment Opportunity Information
EY provides equal opportunities to applicants, employees, contractors, vendors, and stakeholders without regard to race, color, religion, age, sex, sexual orientation, gender identity/expression, pregnancy, genetic information, national origin, protected veteran status, disability status, or any other legally protected basis, including arrest and conviction records, in accordance with applicable law. If you are an individual with a disability and either need assistance applying online or need to request an accommodation during any part of the application process, please email gignow.recruiting@ey.com.",-1,-1,Unknown / Non-Applicable,-1,Unknown,Unknown,False
IMI CIB - Business Analyst Financial Sponsors Group - New York Branch,"Intesa Sanpaolo
",United States,-1,3.5,"Intesa Sanpaolo is the banking group leader in Italy. Assisting more than 14,6 milion of retail customers through a network of 5360 branches, it significantly supports the development of Companies and gives an important sustain to the country's growth. The Group has a selected retail banking presence in Central and Eastern Europe, the Middle East and North Africa, with approximately 1,000 branches and 7.2 million customers in 12 countries. Intesa Sanpaolo is also present in 25 countries in support of its corporate customers’ cross-border business. It is looking for new qualified profiles who want to face demanding and challenging career path with the following requirements:

Scope and Purpose

In support of the Global Relationship Manager (GRM) Financial Sponsors International, the Business Analyst will:

Support the GRM in all tasks related to developing new and expanding existing relationships with Private Equity clients
Perform due diligence on PE clients, fund structures, acquisition targets, industries, and other relevant information as required
Prepare PE and company profiles and pitches
Support in the identification of business opportunities and cross-selling of Intesa Sanpaolo’s financial products and services
Accompany and support the GRM in meeting with clients, in negotiating and structuring transactions
Manage multiple transactions/projects and communicate effectively with deal team members on status and prioritization
Coordinate between and establish strong working partnerships and routines with key internal partners including Leveraged Finance, Fund Finance, Syndication, Debt Capital Markets, Credit, Risk, Industry Verticals, KYC and Legal
Support the preparation of credit applications for LBO and fund finance deals, portfolio summaries and reviews
Perform specific administrative and operative activities related to customer onboarding and management
Demonstrate knowledge of relevant credit policies and procedures and accurately identify policy exceptions
Ensure the Branch’s KYC (Know Your Customers) and CDD (Customers Due Diligence) procedures and directives are adhered to.

The salary range for this job offer would be $ 85,000 - $ 110,000

Required Experience

Ideally 2- 3 years of work experience in a Leveraged Finance, Sponsor Coverage or Capital Markets role
Proficiency in MS Office (Excel, Word and PowerPoint)
Experience with Bloomberg, SEC filings, rating agency reports, and equity research reports is a plus.

Competencies Required

Good understanding of Leveraged Buyout (“LBO”) transactions and Private Equity (“PE”) fund structures
Knowledge of the Syndicated Loan Market
Strong quantitative and analytical skills, with the ability to understand and analyze syndicated deal structures and loan documentation
Familiarity with commercial, corporate and investment banking products
Resourceful self-starter, with willingness to learn, superior attention to detail, professional demeanour, and ability to work effectively on multiple projects
Teamwork attitude, with ability to interact and build healthy working relations in a culturally diverse environment
Excellent communication skills
Fluency in English

Required Qualifications, Skills and Knowledge

Bachelor’s degree in Finance, Accounting or Business Administration, with an emphasis on Corporate Finance, Financial Accounting or Economics

Everyone is an asset for our Group and that person could be you! Check out our job opportunities, apply and join our team!

Location: New York, US

Job Type: Full-time

Work Location: On the road",-1,Banking & Lending,$5 to $10 billion (USD),Financial Services,10000+ Employees,Company - Public,False
Learning Advancement Business Systems Analyst (Contract),"Vertex Pharmaceuticals
",United States,$80.00 - $90.00 Per Hour (Employer est.),4.3,"Job Description:
The Business Systems Analyst position is part of the Data, Technology and Engineering (DTE) team, supporting Quality Systems and Vertex Innovation and External Research (VIER). This position is responsible for supporting and enhancing Vertex’s Learning Management SAAS solution provided by Cornerstone on Demand.

As Vertex works to build and enhance our existing system, we are seeking an individual who will help us research, configure, test, and document solutions to issues identified by our business stakeholders. This individual will partner with other Subject Matter Experts, both internally and via third parties. They will help us ensure that we provide a system that meets the compliance needs demanded in a validated environment while continuing to enhance Vertex’s learning ecosystem via the Learning Advancement Program.

Qualified candidates will have:
Cornerstone (or similar LMS technical experience)
GxP validation experience
System Administration, integration, and configuration experience

*** this role will not include the creating or assigning of training content ***

Key Responsibilities:
Participate in day-to-day project and support work, including analysis, documentation, configuration, testing, integration, and reporting activities.
Conduct systems analysis and configuration changes in accordance with industry Systems Lifecycle (SLC) and Vertex Change Management guidelines for a validated environment
Implement product enhancements; understand and document business processes and requirements
Manage customer support cases via case management tool
Participate in reviewing, planning, testing and implementing regularly scheduled system upgrades
Develop collaborative relationships with IT peers, Talent Management, Quality Systems, external partners, and various operational teams to help design, develop, and deliver learning solutions that satisfy business requirements
Translate technically complex analysis into easily comprehensible terms
Ensure data integrity including quality, accuracy, security, and usability of employee data and related interfaces by adhering to established processes and controls

Minimum Qualifications/EXPERIENCE
Bachelor’s degree in Computer Science, Mathematics, or other technical discipline
Minimum 3 years of relevant experience
Demonstrate the ability to quickly learn new tools based on conceptual understanding of technology
Exceptional analytical and problem-solving skills with attention to detail
Flexibility to adapt to a continually changing and fast paced business environment
Effective communications and presentation skills
Demonstrate an understanding of good project management practices as well as the fundamentals of the System Lifecyle (SLC) and Information Technology operational practices
Familiar with Microsoft Office products (e.g. Outlook, Excel, PowerPoint, OneNote)
Experience administering Cornerstone on Demand preferred
Experience with Learning Management Systems preferred
Pharmaceutical industry experience including GxP requirements preferred
Proficiency leveraging analytical languages and tools preferred (e.g. SQL, PowerBI)
Pay Range:
$80-$90/hr
Requisition Disclaimer:

This job posting is for a temporary role with a third-party agency partner on assignment at Vertex Pharmaceuticals (“Vertex”). The individual selected for this role will be offered the role as an employee of a third- party agency partner; compensation, medical benefits, fringe benefits and other terms and conditions of employment shall be presented by the third-party agency partner upon offer. The pay rate range provided is a reasonable estimate of the anticipated compensation range for this job at the time of posting. The actual pay rate will be based on a number of factors, including skills, competencies, experience, location and/or being pursued and other job-related factors permitted by law. In addition, this role will be eligible for overtime pay, in accordance with federal and state requirements


By applying for this position, you agree to the Atrium Terms and Conditions and you direct Atrium to share your application materials, which may include your CV/Resume, email address or phone number, with Vertex. For more information on how Vertex handles your personal data related to your job application, please see Vertex’s Careers Privacy Notice. Agreeing to the Atrium Terms and Conditions, includes permission to use the email address and mobile phone number you provide during the application process or throughout the duration of your prospective or actual employment to notify you of job openings, profiles, articles, news, and other employment-related information, as well as to notify you of special promotions or additional products and services offered by us or our affiliates and partners
(collectively, “Atrium Alerts”). Atrium Alerts may be sent by email, phone, or text message. Your personal information will be safely stored within the Atrium & Vertex databases. Atrium does not sell your personal information to third parties. Text message and data rates may apply. To OPT OUT of text messaging or to modify your communication preferences for Atrium Alerts at any time, please contact Atrium at privacyadministrator@atriumstaff.com.


If you do not agree with the Atrium Terms and Conditions, you can still complete your application for this position by emailing your resume to our team at tempstaffing@vrtx.com. Please include the job title in the subject of your email.


No C2C or Third-Party Vendors",1989,Biotech & Pharmaceuticals,$1 to $5 billion (USD),Pharmaceutical & Biotechnology,1001 to 5000 Employees,Company - Public,False
Sales Analyst I,"Flowers Bakeries, LLC
",United States,-1,3.5,"The primary goal of the Sales Analyst I is to support Kroger sales team, competitive and/or market intelligence reporting of the company by efficiently building and maintaining reports in Business Objects (Sales Data Warehouse), IRI, AC Nielsen or other systems as directed. The Associate Sales Analyst provides database, report, master data and application validation for the reporting applications that they are assigned and support. They utilize test plans that have been developed by senior members of the team. They provide analysis for the management team as requested. Objective analysis, solid spreadsheet technical knowledge, word processing, written presentation preparation, and clear communication skills are required. Requires constant interaction with work group and other departments at the primary work location. Position requires demonstration of competency for all on-the-job activities that may have a direct or indirect effect on product safety, legality and/or quality.

Job Responsibilities
Responsibilities include, but are not limited to:

Provide support to the sales, marketing and management team by providing analysis and reports from the available tools such as AC Nielsen, IRI, Consumer Panel Data, Sales Data Warehouse, Retailer’s systems.
Support the team by completing spreadsheets and forms that support established business processes.
Continually measure, monitor and modify tactics to show progress against the team’s strategic goals.
Practices and complies with all Company policies and procedures (EEO, Harassment, Safety, Sarbanes Oxley, etc.). Performs other duties which are deemed by management to be an integral part of the job, including but not limited to fulfillment of work schedules, adherence to attendance policies, and other applicable operating rules, policies and procedures.

Desired Experience
1+ years of sales analytic or related experience (preferred)
Desired Education
Bachelor’s degree in related field.

We offer a competitive salary and an excellent total rewards package. Please reply by 12/07/2023. Resumes are active for 30 days. Interested job seekers who successfully complete the series of pre-screening questions and who appear to possess the basic qualifications for this position may be contacted for a telephone interview.


Equal Opportunity Employer/Veterans/Disability


If you need assistance with submitting your resume due to a medical condition or disability, please send an e-mail to Malinda Gwen Black at Malinda.Black@flocorp.com or 334 707-1986 .",1919,Food & Beverage Manufacturing,$1 to $5 billion (USD),Manufacturing,5001 to 10000 Employees,Company - Public,False
Business Analyst,Bloom MT,"Helena, MT",$60K - $70K (Employer est.),-1.0,"***THIS IS NOT A REMOTE POSITION***

Summary:

Provide reporting, analytics and insights across the business with initial focus on Merch/Product, Supply Chain.

Essential Duties and Responsibilities:

Manage daily, weekly operational reporting.
Work closely with the Supply Chain, Merch/Product, Real Estate teams to track and report on strategic initiatives and synergies.
Manage synergy realization across functions via cross functional meetings and periodic distro of reports and dashboards.
Proactively work with the business units to identify and track synergies based on agreed upon timelines and KPIs.
Design predictive data models using statistical solutions.
Manage the “Data Warehouse”. Create ad-hoc reports and dashboards using SQL and PowerBI.
Develop and manage regular key performance metrics reporting and tracking.
Provide insights and root cause analysis to inform executive decision making and assist with daily operations.
Build visualizations that help various stakeholders understand complex topics.
Automate or streamline existing reporting and processes using powerful analytics tools.
Anticipate new reporting / analytical needs as business needs evolve.
Work closely with BI to create business applications and tools, drive adoption, and help create “one source of the truth” from a data standpoint.
Other ad-hoc requests and projects as assigned.

Critical Skills

Technical Skills: Comfortable with data and has experience using Excel, BI Tools and querying databases. Programming experience preferred, especially SQL, R or Python. Experience with PowerBI or Tableau is a plus.
Problem Solving: Able to synthesize complex information into critical insights and eager to tackle tough problems.
Curiosity: Willing to learn new skills and tools. Displays a natural curiosity and understands how to connect data and process.
Communication: Able to communicate effectively with all levels of management.
Teamwork: Balances team and individual responsibilities; Gives and welcomes feedback; Puts success of team above own interests.

Physical Demands

None

Qualifications

Bachelor’s Degree in STEM or a relevant field (Industrial Engineering, Business Management, Data Science)
Minimum 2 years of work experience in an analytical setting
Strong communication skills
Ability to work independently and under pressure
Proficient in Excel, SQL and all Microsoft applications
Familiarity with some programming language, preferably Python or R
Six Sigma training or Project Management experience is a plus
Must pass a background check
Must be able to commute to Helena, MT daily

Travel

Minimal, as required

Job Types: Full-time, Permanent

Pay: $60,000.00 - $70,000.00 per year

Benefits:

401(k)
401(k) matching
Dental insurance
Health insurance
Vision insurance

Experience level:

2 years

Schedule:

Monday to Friday

Work Location: In person",-1,-1,-1,-1,-1,-1,True
