Job Title,Company Name,Location,Salary Estimate,Rating,Job Description,Founded,Industry,Revenue,Sector,Size,Type,Easy Apply
BUSINESS ANALYST,"State of Hawaii
","Honolulu, HI",$68K - $100K (Glassdoor est.),3.3,"Recruitment Information

This posting is for the State of Hawaii, Department of the Attorney General, Child Support Enforcement Agency (CSEA).

The position is located on the Island of Oahu.

Salary: pending applicant's qualifications

The State Recruiting Office will refer all inquiries regarding this exempt position to the Department of the Attorney General.



Duties Summary

Hawaii Child Support Enforcement Agency (CSEA) is a division within the Department of the Attorney General. CSEA’s primary goal is to ensure that children have the ongoing financial support of both parents by providing a system for collection and disbursement of child support. CSEA provides services in all matters pertaining to child support including establishing paternity, locating non-custodial parents, establishing support orders, and collecting and distributing child support payments. It is CSEA’s mission to promote the well-being of children and the self-sufficiency of families through the enforcement of child support orders. CSEA uses an automated caseload management system named KEIKI to carry out its legal mandates to provide child support services to citizens, whether they receive public assistance or apply for child support services.

CSEA will be launching a project to replatform and refactor the state’s Child Support Enforcement System, KEIKI from its current mainframe environment. The project management team will consist of two positions, a Project Manager (PM) and a Business Analyst (BA).

The purpose of this position is to serve as the Business Analyst for the design, development, implementation of the KEIKI Replatform/Refactor project. This position is critical in supporting the Project Manager with required communications, knowledge transfer, adoption and acceptance of the new KEIKI system and future enhancements and enterprise modules. When implemented, this project will provide a comprehensive, integrated information and data processing system that efficiently and expeditiously fulfills the needs of the current KEIKI system, within required federal and state regulations.

The position of Business Analyst will span the course of this multi-year project.

Minimum Qualification Requirements

RECOMMENDED QUALIFICATIONS
Knowledge: The incumbent in the position must have a satisfactory knowledge of:



Principles, practices and goals of public programs
Planning, monitoring, and providing project management of comprehensive, integrated information and data processing system(s)
Skills/Abilities: The incumbent in the position must have the ability to:

Make logical and objective decisions
Exercise judgment and make responsible decisions
Resolve conflicts fairly and consistently
Analyze and evaluate facts on a large scale
Gain the confidence and cooperation of others
Recommend making sound administrative decisions
Communicate effectively both orally and in writing
Work with people and resources efficiently and effectively
Coordinate and conduct meetings as necessary efficiently and effectively
Have good organizational skills
Education: College graduate with a bachelor’s degree.

Experience:
Four (4) years of professional work experience demonstrating business analyst experience. Experience includes working with staff, consultants, vendors: establishing project work plans, establishing target completion dates and identifying resource requirements, monitoring progress, identifying and resolving issues and providing status reports.

Two (2) years of professional work experience in the information technology field, preferable working with large, complex systems.

Two (2) years of professional work experience with demonstrated knowledge of the principles, practices, philosophies and goals of public welfare programs is desirable. Experience which included involvement with the development and maintenance of various public assistance programs such as Child Support Enforcement would be extremely useful. Experience which involved responsibility for identifying program goals and objectives and evaluating their attainment; identifying resource needs; planning, organizing and coordinating program activities and actively participating in policy determination are extremely desirable. Supervisor experience managing staff (e.g. assigning work, evaluating work performance, assessing unit output) is also required.



Other Information

To apply: Send cover letter, resumé, salary requirements, and completed Application to:


Department of the Attorney General
Child Support Enforcement Agency
601 Kamokila Boulevard, Suite 251
Kakuhihewa Building
Kapolei, Hawaii 96707
or send by email to: Sheri.Wang@Hawaii.gov
(No phone calls please)
An Equal Opportunity Employer




EXEMPT BENEFITS

This is a non-civil service position. Benefit information will be provided at time of offer by the Department Personnel Officer or Director of the hiring department.

Listed below is a summary of the benefits the State offers to exempt employees, which is based on full-time employment.

Paid Holidays


Eligible for 13 paid holidays each year; 14 holidays during an election year.


Paid Vacation


Eligible for 21 days per year.


Paid Sick Leave


Eligible for 21 days per year.


Other Leaves


Reasonable time off with pay may be provided for jury or witness duty, a death in the family, some military duty, and donation to the Blood Bank. Leave sharing donations may be granted to eligible employees who have serious personal illnesses or injuries or need to care for a seriously ill or injured family member. Various leaves without pay may also be granted with full re-employment rights.


Health Insurance


The State pays a part of the premiums for each employee's enrollment in a State sponsored Medical, Drug, Vision, and Dental Plan. For more information, visit the Employer Union Trust Fund website www.eutf.hawaii.gov for coverage and options.


Group Life Insurance


The State provides a free life insurance policy for eligible exempt employees.


Retirement Plan


The State contributes to a retirement plan for eligible employees. Generally, employees under the Hybrid Plan with 10 years of credited service and who have reached 65 years of age or have 30 years of credited service and have reached 60 years of age may retire and receive benefits. To find out more about the options you have, go to http://ers.ehawaii.gov.


Premium Conversion Plan


Participating exempt employees may increase their take-home pay by having the State deduct the cost of health care premiums before payroll taxes are withheld.


Flexible Spending Accounts


Eligible exempt employees can reduce their federal and state income taxes and social security taxes by setting aside money from their paychecks to pay for eligible out-of-pocket health care expenses and eligible dependent care expenses on a BEFORE-TAX basis.


Transportation Benefits


Participating employees may increase their take-home pay by having the State deduct qualified transportation expenses (i.e. eligible parking fees, monthly bus passes for TheBus, fare coupons for The Handi-Van, Vanpool Hawaii participation fee, etc.) through pre-tax payroll deductions.


Deferred Compensation


The State offers exempt employees a tax-deferred retirement savings program. This program allows employees to build a retirement nest egg through voluntary, pre-tax payroll deductions. A broad range of investment options are available to select from.


Temporary Disability Insurance


Qualified exempt employees may be eligible to receive partial wage replacement, at no cost to the employee, for a disability caused by a non-work related injury or illness under this program.


Social Security


As an employer, the State also contributes to an exempt employee's social security account.


Training & Continuing Education


The State supports developmental activities related to an exempt employee's work. In many departments there are numerous in-service training opportunities available. Sabbatical leaves with pay are available for qualified employees.


Travel Expenses


The State may pay for certain business related travel expenses including mileage reimbursement for use of a personal car during work, airfare, meals and lodging expenses for trips to neighbor islands or out of state.


Union & Collective Bargaining


Exempt employees may have the right to join the union for collective bargaining with the State and employee representation depending on the status of the exempt position.


The above information is solely intended as a summary of the benefits available to State of Hawaii employees and is subject to change. Whether or not you are entitled to a particular benefit will depend on your specific appointment and employment status (included, excluded, exempt, non-exempt). Please refer to the appropriate collective bargaining agreement or executive order and all applicable laws, rules, policies, or plan documents for further details. Nothing herein shall be deemed as creating an employment contract, promise of employment, promise of continued employment, or obligation of any kind on the part of the State of Hawaii.




The State of Hawaii is an Equal Opportunity Employer


Revised 01/13",1960,State & Regional Agencies,Unknown / Non-Applicable,Government & Public Administration,201 to 500 Employees,Government,False
Experienced Intelligence Support to Information Operations Analyst - Camp Smith HI - TS/SCI,"Peraton
",United States,$112K - $179K (Employer est.),3.6,"Peraton Overview
Peraton drives missions of consequence spanning the globe and extending to the farthest reaches of the galaxy. As the world's leading mission capability integrator and transformative enterprise IT provider, we deliver trusted and highly differentiated national security solutions and technologies that keep people safe and secure. Peraton serves as a valued partner to essential government agencies across the intelligence, space, cyber, defense, civilian, health, and state and local markets. Every day, our employees do the can't be done, solving the most daunting challenges facing our customers.
Responsibilities

Peraton is seeking an experienced Intelligence Analyst to support Information Operations functions and activities into all facets of Combatant Command (CCMD) level planning, and to ensure the command group and staff consider Operations in the Information Environment (IE) factors. This position will be located at Camp Smith, Honolulu, Hawaii.

You will have the opporuntity to:

Successfully identify, gather and assess all-source information in order to determine the disposition, location, and all-encompassing information supporting operations in the IE.
Integrate analytical tools and methodologies that enhance Intel Analysis that directly support contingency plans and operations plans, and ensure that information related capabilities are considered in the deliberate and crisis action planning processes and that deep insights in the IE are uncovered.
Provide expert mission analysis, analytic problem solving, and assessment skills.

Additionally, be creative in using information systems and information related capabilities (IRC); integrate with interagency and intelligence community (IC); develop innovative concepts to counter adversarial use of information in the IE and consider significant or key cultural aspects that affect operational and tactical planning, security, and risk assessments.

Roles and responsibilities for this position include:

You should demonstrate the ability to review, analyze, and operationalize tactical, operational, and strategic level Information Operations related directives, as well as a working knowledge of the joint planning process. Create and write high level professional analytical products for a Joint Staff.

You must be effective at applying technical skills and the use of analytical capabilities and tools for identifying insights, tracking indicators and measures of performance through attainment of measures of effectiveness, and providing advice concerning the application of information related capabilities during the development of planning concepts.

Write/create analytical products for a Joint Staff
Participate in working groups and brief senior leaders
Planning, synchronization, coordination and assessment of IO related topics in support of assigned operations
Integrate with the relevant intelligence staff and develop inputs to collection processes that support activities in the information environment

Qualifications

Basic Qualifications

Bachelor's degree with 8-10 years of relevant experience OR a Master's degree with 6 years of relevant experience OR a PhD with 5+ years of experience; An additional 5 years of experience maybe considered in lieu of a degree requirement education requirements:
Army/Joint Targeting, IPB, and COG analysis process as well as a general understanding of joint training doctrine and procedures.
Knowledge in JOPP, MDMP, and MCPP planning and targeting processes and expertise in developing and accessing tactical and operational level IO plans and orders.
Army/Joint Targeting, IPB, Intelligence cycle, and COG analysis
Have a minimum of 5 years of experience with Intelligence Analysis at the service or joint level, working that support operations with Combatant Commands or Joint Task Forces.
Experience with supporting the integrating, coordinating, and synchronizing adjacent and supporting operations, as well as the support for related capabilities and their activities. Be familiar with, certified in, or have applicable operational/field time experience in:
Military Information Support Operations (MISO) / (Psychological Operations (PSYOP))
Military Deception (MILDEC)
Operations Security (OPSEC)
Tactical Electronic Warfare (EW)
Cyberspace Operations
SIGINT related activities
Ability to engage senior JIIM leaders and staff, and conduct operational and informational briefings to a large audience
Ability to work effectively within a task organized working group and expertise with planning, integrating, and coordinating with inter-agency and intelligence community entities. Coordinating with inter-agency and intelligence community and to work effectively within a task organized ""working group"".
Must be a U.S. Citizen
Must possess or be able to obtain a U.S. Passport.
Clearance: This position requires an Active Top Secret/SCI security clearance, based on current background investigation (SBI).

Preferred Qualifications:

Recent Joint or Service Level Intelligence Analysis experience in the INDOPACOM Area of Operations
DIA Analytical writing tradecraft
Cyberspace Operations Integration Course (COIC)
Army Information Operations Planner Course (AIOPC)
Military Information Support Operations Integration Course (MISOIC)
Electronic Warfare Integration Course (EWIC)
Psychological Operations Qualification Course (POQC)
Information Operations Capabilities, Application, and Planning Course

Target Salary Range

$112,000 - $179,000. This represents the typical salary range for this position based on experience and other factors.

SCA / Union / Intern Rate or Range

EEO
An Equal Opportunity Employer including Disability/Veteran.

Our Values

Benefits
At Peraton, our benefits are designed to help keep you at your best beyond the work you do with us daily. We're fully committed to the growth of our employees. From fully comprehensive medical plans to tuition reimbursement, tuition assistance, and fertility treatment, we are there to support you all the way.

Paid Time-Off and Holidays
Retirement
Life & Disability Insurance
Career Development
Tuition Assistance and Student Loan Financing
Paid Parental Leave
Additional Benefits
Medical, Dental, & Vision Care",2017,Information Technology Support Services,$5 to $10 billion (USD),Information Technology,10000+ Employees,Company - Private,False
Commercial Business Analyst,"ISLAND ENERGY SERVICES, LLC
","Kapolei, HI",$78K - $101K (Employer est.),3.0,"At Island Energy Services (IES), we are constantly looking for people who are driven to find cleaner, smarter ways to fuel our community. It is our goal to provide our customers with efficient, reliable, and high quality services. No matter where you are on your career path, Island Energy offers continued education and training to help you cultivate your skills and expand your opportunities.

SUMMARY:
Under the general supervision of the VP of Sales & Marketing, the Commercial Business Analyst prepares, coordinates and communicates commercial information as directed. Desired competencies include: excellent communication, critical thinking and solution focused skills with a sense of urgency in responding to internal/external customer requests. Ideal candidate must be trustworthy in maintaining company and client confidentiality, have a proven track record of setting priorities under tight deadlines, is a motivated self-starter who is comfortable working in a fast-paced environment, has sound knowledge of data analytics, product scheduling and familiarity with basic contract structure in addition to professional writing skills. Must have advanced Excel and Microsoft Office skills. Prior relevant experience in the energy industry/logistics environment is strongly preferred.

ESSENTIAL FUNCTIONS:
1. Market Analysis: Produce and maintain market analyses and trends for relevant industry prices including marker prices, refining crack spreads, RVO RIN’s prices, etc. Maintain centralized point of information reflecting product type, dates, volumes, and prices for all commercial supply and sales contracts. Track supply/demand balance for the State of Hawaii. Become subject matter expert with industry patterns to ultimately drive strategic business plan development.

2. Commercial Team Support: Assist Commercial Team with analyses and bid submissions for jet, gasoline, ULSD and utility fuels. Conduct ad hoc evaluations and analyses of business opportunities for growth or efficiency improvements. Act as lead for federal and state fuel contracts and bids. Candidate would take the lead on developing relationships with potential marine (MGO) and truck rack ULSD buyers. Responsible for updating transfer pricing model, delivered cost model and basis for proposal generation.

3. Demand Tracking: Receive and track supply nominations from commercial airlines and utility customers; communicate volumes to Supply Chain Scheduler/Planner. Support relationships with customers. Report material discrepancies to customers and Supply Chain Scheduler/Planner in a timely manner and collaborate with all parties on necessary resolutions. Publish demand summaries weekly. Candidate would facilitate significant prompt demand changes with schedulers at airports along with fuel haulers.

4. Demand Forecasting: Analyze and trend sales volumes. Build forecasted volumes from combination of nominations and prior year results accounting for seasonality.

5. Contract Development and Support: Draft sales agreements and work with Legal department on refinements. Communicate changes from customers with Legal until final draft is complete.

6. Supply Chain Scheduler/Planner Backup: Learn basic duties of scheduling/planning for a limited backup role for the Supply Chain Scheduler/Planner.

7. Teamwork: Works effectively with coworkers and others by sharing ideas in a constructive, positive manner; listening to and objectively considering ideas and suggestions from others; keeping commitments; keeping others informed of work progress and issues; addressing problems and issues constructively to find mutually acceptable and practical solutions; and respecting the diversity of the IES workforce in actions, words, and deeds.

8. Safety: Maintains commitment to a high standard of safety, comply with all safety laws and IES safety policies/rules, and reports actual and potential safety violations to appropriate supervisory or management personnel to further IES core value of safety.

OTHER DUTIES:
1. Perform other duties consistent with the scope of the position.

Minimum Qualifications:
Education and Experience
1. Three (3) years of experience in business development, data analytics or commensurate work experience.
2. Bachelor’s Degree in Business Administration or comparable field of study.

Skills
1. Interpersonal Skills – Ability to interact professionally (internal\external) while working in close alignment with others.
2. Problem Solver – Ability to identify issues and/or concerns and proactively respond while keeping others informed and engaged.
3. Critical Thinking - Inquisitive and not satisfied with status quo, continually seeks to understand details of the business to find and grow opportunity. Ability to evaluate information and exercise good judgment in making decisions.
4. Ability to uphold to strict ethical standards: integrity, objectivity, and confidentiality.
5. Ability to manage complex record keeping systems.
6. Strong sense of team spirit and ability to transfer it to others.
7. Ability to work independently.
8. Ability to maintain high level of confidentiality.
9. Oral communication—the individual speaks clearly and persuasively in positive or negative situations and demonstrates group presentation skills.
10. Ability to provide excellent customer service and customer relations.
11. Written Communication—the individual edits work for spelling and grammar, presents numerical data effectively and can read and interpret written information.
12. Planning/organizing—the individual prioritizes and plans work activities, uses time efficiently and develops realistic action plans.
13. Quality control—the individual demonstrates accuracy and thoroughness and monitors own work to ensure quality.
14. Adaptability—the individual adapts to changes in the work environment, manages competing demands and can deal with frequent change, delays or unexpected events.
15. Dependability—the individual is consistently at work and on time, follows instructions, responds to management direction and solicits feedback to improve performance.
16. Safety and security—the individual actively promotes and personally observes safety and security procedures and uses equipment and materials properly.

Other Requirements
1. Willingness to commit to the Island Way (IES core values of): Kīnāʻole, Aloha, Lōkahi and Hoʻohana.
2. Pass background check including periodic job-related physical abilities testing as required.
3. This is a safety sensitive position and random drug testing is required.
4. Valid driver’s license with clean abstract.
5. Must be able to obtain a Transportation Worker Identification Card (TWIC) within sixty days of hire.
6. Willingness to devote the time as needed to meet project and task deadlines.
7. Willingness to maintain or increase skills.

PAY AND BENEFITS:
Island Energy Services offers a competitive salary that commensurate with qualifications and experience. The hiring salary range for this position is $78,000 to $101,000. IES also offers a generous benefits package to include comprehensive health and welfare benefits, vacation, sick leave, 401k plus employer matching, supplemental voluntary insurance options, etc

PHYSICAL DEMANDS:
The physical demands described here are representative of those that must be met by an employee to successfully perform the essential functions of this job. Reasonable accommodations may be made to enable individuals with disabilities to perform the essential functions. While performing the duties of this job, the employee is regularly required to sit. The employee frequently is required to use hands, hands to finger, handle, or feel objects, tools or controls to talk or hear. The employee is occasionally required to stand; walk; reach with hands and arms; and stoop, kneel, crouch or crawl. The employee must frequently lift and/or move up to 20 pounds and occasionally lift and /or move up to 30 pounds. Specific vision abilities required by this job include close vision, color vision, depth perception and the ability to adjust focus.

SPECIAL REQUIREMENTS:
Employment is contingent upon successfully passing an employee reference check, drug test, criminal background check and a five-year motor vehicle history check. This is an exempt position under FLSA regulations.

Island Energy Services, licensee of the Texaco brand, is an equal opportunity, at-will employer. All qualified applicants will receive consideration for employment without regard to race, color, religion, sex, sexual orientation, gender identity, national origin, disability, or status as a protected veteran.

Position open to US residents and resident aliens with a valid green card only.",-1,Energy & Utilities,$100 to $500 million (USD),"Energy, Mining & Utilities",201 to 500 Employees,Company - Private,True
