Job Title,Company Name,Location,Salary Estimate,Rating,Job Description,Founded,Industry,Revenue,Sector,Size,Type,Easy Apply
"Senior Business Data Analyst, Revenue Cycle","Providence
",Montana,-1,3.6,"Description

Providence St. Joseph Health is calling a Senior Business Data Analyst, Revenue Cycle to work remotely within our footprint states: AK, CA, MT, OR, TX and/or WA.

This position will be a contributor to the RCS Analytics Operations team which supports efforts of the Data & Insights team. The role (and team) supports the RCS Analytics team, leadership, and its stakeholders/customers. This position is seen as an accountable Business Analyst Sr for analytics-related activities. This role also supports various administrative and customer facing activities including, but not limited to intake/triage management, artifact management, policies & procedures, effort/time estimation, product training, Data Governance & Evangelism, inventory review with customers/leadership, resource onboarding, analytics ecosystem management, etc. The role may also serve in cross functional capacity on projects and initiatives.

Providence caregivers are not simply valued – they’re invaluable. Join our team at Revenue Cycle Business Services and thrive in our culture of patient-focused, whole-person care built on understanding, commitment, and mutual respect. Your voice matters here, because we know that to inspire and retain the best people, we must empower them.

Required qualifications:

Bachelor's Degree Computer science, mathematics, statistics, information technology, health informatics, public health, or related subject. -Or-
Bachelor's Degree Data Science, Analytics, Finance, Engineering, Mathematics, Computer Science, Business Administration, Health Administration, Public Health, Public Administration, or related discipline
2 – 3 years Revenue Cycle Experience
5 years Strong SQL programming skills. Some combination of experience with: Snowflake, SQL Server, Oracle SQL or similar platforms.
5 years Progressive experience in practicing analytics as a data analyst, report analyst, business analyst, BI developer, etc.
2 year's Experience with two or more provider-based Revenue Cycle vert
3 years Proven experience creating, managing, and validating large data sets.
Demonstrated PC skills, i.e., proficient with MS Office products including Word, Excel, Teams, SharePoint, Power Point and Outlook

Preferred qualifications:

Master's Degree Computer science, mathematics, statistics, information technology, health informatics, public health, or related subject.
Experience with EPIC: reporting data out of Epic, reviewing Revenue Cycle related account detail.
Report writing skills in Tableau or Power BI

Salary Range by location:

NorCal (Napa, Sonoma)

Min: $42.53 Max: $68.67

Southern California, NorCal (Humboldt) Alaska (Kodiak, Seward, Valdez)

Min: $37.91, Max: $61.20

WA Puget Sound Oregon (Portland) Alaska (Anchorage)

Min: $36.37, Max: $58.72

Oregon (Hood River, Medford, Seaside)

Min: $32.90, Max: $54.74

Eastern Washington (Richland, Spokane, Walla Walla)

Min: $32.36, Max: $52.25

Montana

Min:$29.28, Max: $47.27

Texas

Min:$27.74, Max: $44.78

Why Join Providence?

Our best-in-class benefits are uniquely designed to support you and your family in staying well, growing professionally, and achieving financial security. We take care of you, so you can focus on delivering our Mission of caring for everyone, especially the most vulnerable in our communities.

About Providence

At Providence, our strength lies in Our Promise of “Know me, care for me, ease my way.” Working at our family of organizations means that regardless of your role, we’ll walk alongside you in your career, supporting you so you can support others. We provide best-in-class benefits and we foster an inclusive workplace where diversity is valued, and everyone is essential, heard and respected. Together, our 120,000 caregivers (all employees) serve in over 50 hospitals, over 1,000 clinics and a full range of health and social services across Alaska, California, Montana, New Mexico, Oregon, Texas and Washington. As a comprehensive health care organization, we are serving more people, advancing best practices and continuing our more than 100-year tradition of serving the poor and vulnerable.

The amounts listed are the base pay range; additional compensation may be available for this role, such as shift differentials, standby/on-call, overtime, premiums, extra shift incentives, or bonus opportunities.

Check out our benefits page for more information about our Benefits and Rewards.

About the Team

Providence Shared Services is a service line within Providence that provides a variety of functional and system support services for our family of organizations across Alaska, California, Montana, New Mexico, Oregon, Texas and Washington. We are focused on supporting our Mission by delivering a robust foundation of services and sharing of specialized expertise.

We are committed to the principle that every workforce member has the right to work in surroundings that are free from all forms of unlawful discrimination and harassment.

We are committed to cultural diversity and equal employment for all individuals. It is our policy to recruit, hire, promote, compensate, transfer, train, retain, terminate, and make all other employment-related decisions without regard to race, color, religious creed (including religious dress and grooming practices), national origin (including certain language use restrictions), ancestry, disability (mental and physical including HIV and AIDS), medical condition (including cancer and genetic characteristics), genetic information, marital status, age, sex (which includes pregnancy, childbirth, breastfeeding and related medical conditions), gender, gender identity, gender expression, sexual orientation, genetic information, and military and veteran status or any other applicable legally protected status. We will also provide reasonable accommodation to known physical or mental limitations of an otherwise qualified caregiver or applicant for employment, unless the accommodation would impose undue hardship on the operation of our business.

We are a community where all people, regardless of differences, are welcome, secure, and valued. We value respect, appreciation, collaboration, diversity, and a shared commitment to serving our communities. We expect that all workforce members in our community will act in ways which reflect a commitment to and accountability for, racial and social justice and equality in the workplace. As such, we will maintain a workplace free of discrimination and harassment based on any applicable legally protected status. We also expect that all workforce members will maintain a positive workplace free from any unacceptable conduct which creates an intimidating, hostile, or offensive work environment.

Requsition ID: 224357

Company: Providence Jobs

Job Category: Strategy & Planning

Job Function: Administration

Job Schedule: Full time

Job Shift:

Career Track:

Department: 4001 SS RC RPTNG ANALYTICS

Address: WA Liberty Lake 24001 E Mission Ave

Work Location: Liberty Lake-Liberty Lake

Pay Range: $See posting - $See posting

The amounts listed are the base pay range; additional compensation may be available for this role, such as shift differentials, standby/on-call, overtime, premiums, extra shift incentives, or bonus opportunities.

Check out our benefits page for more information about our Benefits and Rewards.

Providence is proud to be an Equal Opportunity Employer. Providence does not discriminate on the basis of race, color, gender, disability, veteran, military status, religion, age, creed, national origin, sexual identity or expression, sexual orientation, marital status, genetic information, or any other basis prohibited by local, state, or federal law.",1855,Health Care Services & Hospitals,$100 to $500 million (USD),Healthcare,10000+ Employees,Nonprofit Organization,False
"Analyst, Field Training, BK, Company Operations","Restaurant Brands International
","Billings, MT",$44K - $72K (Glassdoor est.),3.5,"About Restaurant Brands International:

Restaurant Brands International Inc. is one of the world's largest quick service restaurant companies with more than $35 billion in annual system-wide sales and ~30,000 restaurants in more than 100 countries. RBI owns four of the world's most prominent and iconic quick service restaurant brands – BURGER KING®, TIM HORTONS®, POPEYES® and FIREHOUSE SUBS®. These independently operated brands have been serving their respective guests, franchisees, and communities for decades. Through its Restaurant Brands for Good framework, RBI is improving sustainable outcomes related to its food, the planet, and people and communities.

Analyst, Field Training, BK, Company Operation

Position Overview:

This position works to maintain training certified restaurants and ensures that employees receive proper tools to aid in their development. Conducts onsite visits in the field and provides coaching and personal instruction to improve areas of opportunity in the restaurants. Conducts classroom-based training. Works to understand how to analyze multiple business metrics and put it into action plans to improve the restaurants. Responsible for improving overall guest satisfaction, speed of service, cleanliness, friendliness, in addition to other operations related performance metrics. Allocates work as a team leader; may check on completion/quality.

Responsibilities:

Responsible for maintaining a certain number of certified training stores.
Responsible for creating a training curriculum for restaurant managers as defined by a series of core competencies.
Responsible for delivering consistent reports that track GURU completion and OSAT metrics.
Responsible for updating and rolling out training seminars and presentations to field employees.
Responsible for giving coaching and feedback to restaurant management.

Essential Duties:

Visits restaurant managers to review restaurant performance.
Develops and trains restaurant managers.
Assesses and evaluates the manager's level to fulfill manager responsibilities.
Coaches employees to improve restaurant performance, impact, overall profitability and operations scores.
Implements tools and systems in the restaurants to help improve the business' operations.



Qualifications & Skills:

Bachelor's degree in business or related field
Proficiency in Microsoft Office (Word, Excel, PowerPoint, and Outlook)
Knowledge of company restaurant systems
Skilled in managing multiple priorities and projects; skilled in interacting effectively under difficult circumstances and tight deadlines.
Ability to present and express ideas and information clearly and concisely in a manner appropriate to the audience, whether orally or in writing
2 to 4 years previous experience preferred.

Burger King Company LLC is an equal opportunity employer and gives consideration for employment to qualified applicants without regard to race, color, religion, sex, national origin, disability, or protected veteran status. For successful placement at Burger King Corporation, the final candidate must be willing to work a flexible full-time schedule, including weekends and holidays, and successfully complete the pre-employment background screening.




Restaurant Brands International and all of its affiliated companies (collectively, RBI) are equal opportunity and affirmative action employers that do not discriminate on the basis of race, national origin, religion, age, color, sex, sexual orientation, gender identity, disability, or veteran status, or any other characteristic protected by local, state, provincial or federal laws, rules, or regulations. RBI's policy applies to all terms and conditions of employment. Accommodation is available for applicants with disabilities upon request.",2014,Restaurants & Cafes,$5 to $10 billion (USD),Restaurants & Food Service,1001 to 5000 Employees,Company - Public,True
"Analyst, HR Systems and Operations","D.A. Davidson Companies
","Great Falls, MT",$74K - $115K (Glassdoor est.),3.7,"Job Description:


Summary/Function:
The HR Systems and Operations Analyst is responsible for helping to drive and maintain process improvement, data integrity, analytics, reporting, and special projects in support of departmental initiatives and programs. This role will report to the Senior Analyst and work in close collaboration with IT, FP&A Data Analytics, Payroll, relevant external vendors, and other members of the Human Capital team on the development, testing, and implementation of various departmental systems and processes to implement deliverables.
Experience and Skills:

Qualifications:

Bachelor’s degree strongly preferred, or equivalent experience.
High-level of proficiency with Microsoft Word, Outlook, PowerPoint, and Excel including pivot tables, VLOOKUP, macros and advanced charting.
Experience with IT systems and programs, reporting tools, and user interfaces; prior experience with an HRIS system or Workday is a strong plus.
Technical proficiency and ability to understand data flows, mapping and source tables.
Advanced problem solving and critical thinking skills, with strong detail orientation.
Experience in gathering, understanding, and documenting business requirements.
Excellent verbal and written communication skills.
Ability to maintain a high level of confidentiality. Prior experience working with sensitive or confidential information; prior experience within Human Resources is helpful but not required.
Customer service orientated, with the ability to proactively work with both internal and external clients.
Strong organizational skills with the ability to work under stress to meet agreed upon deliverables.
Self-motivated individual who enjoys working both independently as well within a team environment.
Ability to maintain regular, predictable attendance.
Duties:

Ensure system-related department processes and procedures are appropriately documented, updated, and maintained on all relevant systems including, Workday, learning management system, applicant tracking system and online application, YourCause volunteer portal, and other vendor interfaces as needed.
Develop and support Workday governance practices, including reviews, processes, controls, and project intake.
Find opportunities for process improvement and efficiencies; proactively explore and recommend additional avenues to use the Workday platform and better apply system capabilities based on HC team and other key partner needs.
Build and manage reports; ensure best practices are identified and implemented to support data integrity & hygiene as well as efficient and accurate reporting practices.
Participate in HR system improvements, implementations, integrations, and user acceptance testing.
Serve as primary day-to-day relationship contact from Human Capital with HR system vendors.
Engage in ongoing systems-related or other relevant training to deepen knowledge base as necessary and to stay up-to-date with software changes.
Assist in developing HR system training materials for employees and managers as needed.
Works closely with HC staff members to support the needs of the department and the firm.
Performs any other duties and special projects as necessary.
What we offer:
Competitive salary plus excellent benefits and perks including, but not limited to:

Medical, dental and vision
Company 401(k)and ESOP contribution
Generous sick, vacation, and maternity/parental leave
Paid holidays
Professional development opportunities
Tuition reimbursement ($15,000 lifetime cap)
Discounted personal insurance including home, auto and recreational vehicles
Davidson Day of Giving - Our tradition of positively impacting communities in which we live and work!

We are an equal opportunity employer and value diversity at our company. We do not discriminate on the basis of race, religion, color, national origin, gender, sexual orientation, age, marital status, veteran status, or disability status. We will ensure that individuals with disabilities are provided reasonable accommodation to participate in the job application or interview process, to perform essential job functions, and to receive other benefits and privileges of employment. Please contact us to request accommodation.
From: D.A. Davidson Companies",1935,Investment & Asset Management,$100 to $500 million (USD),Financial Services,1001 to 5000 Employees,Company - Private,False
Business Intelligence Developer,"RiverStone Health
","Billings, MT",$48K - $64K (Employer est.),4.2,"Working title: Business Intelligence Developer

Classification title: IT Database Analyst

Division: Administration

Program: Information Technology

Reports to: Data and Analytics Manager

FLSA status: Exempt; Full-time

Schedule: Monday-Friday

Wage Range: $48,103 to $63,765 annually; depending on number of years of transferrable experience and internal equity

*This position is located onsite in Billings, MT. Relocation assistance not available.*

Organizational Overview:

Serving the Yellowstone County community and south-central Montana for nearly 50 years, RiverStone Health is an essential provider of personal and public health services. Health, Education, Leadership and Protection – HELP is what we do. From medical, dental and behavioral healthcare; home care and hospice; public health services like immunizations, WIC, health promotion and restaurant inspections; and educating the next generation of health professionals, our expertise spans all ages and stages of life. Underlying principles of access, affordability, compassion, and quality in all interactions, RiverStone Health improves life, health and safety for all of the communities we serve. Foremost, we are committed to the values of Justice, Equity, Diversity, and Inclusion (JEDI) by cultivating an environment that protects and acknowledges the unique identities within our diverse community.

Job Summary:

The Business Intelligence Developer serves a critical role in the modeling and analysis of organizational data. The Business Intelligence Developer works closely with the Data and Analytics Team to convert data into actionable visualizations and reports for RiverStone Health. This includes building dashboards, writing reports, validating data for accuracy and other functions. The Business Intelligence Developer is expected to build and maintain a reputation of integrity within RiverStone Health.

Essential Functions/Major Duties and Responsibilities:

A. Data & Analytics Delivery 95%

Provide a critical role in the Data & Analytics team as a Business Intelligence Developer

Develop and maintain a working knowledge of the data warehouses and other reporting databases managed by RiverStone Health

Combine multiple data sources into reports and data visualizations for use by RiverStone Health leadership and operational teams across the organization.

Provide training and support for end users of RiverStone Health’s dashboards & reports.

Collaborate with the Data & Analytics team on the planning, design and deployment of models into RiverStone Health’s data warehouses.

Develop an understanding of the application databases used by RiverStone Health service lines.

Provide assistance in gathering usable and meaningful data for RiverStone Health and its data partners.

Support organizational strategies through development of actionable KPI-driven visualizations and detail reports.

Advise the business analyst on project requirements and coordinate the prioritization of BI projects with the Data & Analytics team.

Adhere to data security and HIPAA organizational policies

Non-Essential Functions/Other duties as assigned 5%

Perform other duties as assigned in support of RiverStone Health’s mission and goals.

Education and Experience:

Minimum Qualifications:

Associate degree in an IT, statistics, or other closely related field, or relevant experience in data analysis and business intelligence development

2+ years of professional experience with business intelligence tools

Preferred Qualifications:

Bachelors degree in IT, statistics, or other closely related field

Medical terminology training or experience

Experience with Tableau or Power BI

Experience with T-SQL and/or MySQL queries

Required Certificates, Licenses, Registrations:

Emergency preparedness on-the-job training at a minimum of ICS 100, 200, and 700.

Knowledge, Skills, and Abilities:

Working knowledge of basic programming principles (ex. functions, variables)

Strong data visualization skills

Solid understanding of data security principles

Experience with the Microsoft Office suite of applications, especially Excel

Experience navigating and relating databases and other data sources.

Strong attention to detail, problem solving skills, and quantitative and analytical abilities.

Excellent communication and collaboration skills

Willingness to learn complex products, processes, and concepts.

Customer Service Excellence:

Doing things right the first time

Making people feel welcome.

Showing respect for each customer

Anticipating customer needs and concerns.

Keeping customers informed

Helping and going the extra mile

Responding quickly

Protecting privacy and confidentiality

Demonstrating proper telephone etiquette

Taking responsibility for handling complaints

Being professional

Taking ownership of your attitude toward Service Excellence

Physical Demands and Working Conditions:

Work is mainly performed on a computer for at least eight hours per day.

Work under pressure to meet aggressive timeframes associated with grants, regulatory filing, and more.

Freedom to Act & Decision Making:

The work is performed under the supervision and direction of the Data and Analytics Manager with a moderate degree of autonomy. Work is carried out in conjunction with other Data and Analytics team members, including other business intelligence developers and data warehouse engineers.

Communications & Networking:

Daily written and verbal communication with RiverStone Health staff.

Work directly with other team members to provide quality data and statistics.

Participate in planning the data and analytics strategic roadmap.

Budget & Resource Management:

May assist in delegation of reporting and analysis software licensing.

Education
Preferred
Associates or better in Information Technology or related field
Behaviors
Preferred
Functional Expert: Considered a thought leader on a subject
Detail Oriented: Capable of carrying out a given task with all details necessary to get the task done well
Dedicated: Devoted to a task or purpose with loyalty or integrity",1974,Health Care Services & Hospitals,Unknown / Non-Applicable,Healthcare,201 to 500 Employees,Government,False
Senior IT Revenue Cycle/Business Systems Analyst (Full Time),"Benefis Health System
","Great Falls, MT",$66K - $92K (Glassdoor est.),3.3,"Benefis is one of Montana’s largest and premier health systems, and we are committed to providing excellent care for all, healing body, mind, and spirit. At Benefis, we work hard to support our employees in every aspect of their careers by offering outstanding benefits and compensation, state-of-the-art facilities, and multiple growth opportunities. The only thing missing is you!

Assesses, plans, configures, installs, maintains and documents electronic medical records (EMR) and business applications. Manages efforts to improve and adapt workflows and processes that adhere to the EMR model system and align with current best practice standards. Coordinates and collaborates among healthcare business service lines and Information Technology Services to resolve EMR and business application issues.. Assess customer education needs, organizes and provides training and support in effective use of business systems applications. Demonstrates advanced knowledge of EMR and business applications capabilities, functions, configuration, end user equipment, workflows, and business processes. Provides a secure, effective, integrated patient care delivery system that continually improves outcomes, reduces cost, increases efficiency, and optimizes the users’ experience.
Demonstrates the ability to deal with pressure to meet deadlines, to be accurate, and to handle constantly changing situations. Demonstrates the ability to deal with a variety of people, deal with stressful situations, and handle conflict.
Will perform all job duties or job tasks as assigned. Will follow and adhere to all requirements, regulations and procedures of any licensing board or agency. Must comply with all Benefis Health System’s organization policies and procedures.

Education/License/Experience Requirements:
Bachelor’s degree required or suitable work experience
5 years working experience in a health care setting
5 years experience as analyst supporting healthcare with demonstrated understanding of business practices
At least 1 year of EMR Project and/or EMR Team Lead experience preferred
Must complete all required application course work and obtain applicable EMR certification within three months of assignment
Previous experience with the primary healthcare EMR system vendor is preferred
Revenue cycle, patient access, or HIM experience preferred",1996,Health Care Services & Hospitals,Unknown / Non-Applicable,Healthcare,1001 to 5000 Employees,Nonprofit Organization,False
