Job Title,Company Name,Location,Salary Estimate,Rating,Job Description,Founded,Industry,Revenue,Sector,Size,Type,Easy Apply
Business Development Analyst,Todd Judy Ford East,"Charleston, WV",$35K (Employer est.),-1.0,"Responsibilities:

Generate appointments and quotes by means of proactive outbound prospecting and lead activity management in an effort to qualify and market to potential customers.
Set appointments •

Listen and be attentive to customer needs and priorities in order to provide appropriate suggestions and guidance on our vehicle offerings

Provide superior customer service and achieve highest degree of customer satisfaction •

Work in close partnership with sales consultants to provide qualified leads and detailed information on customer requirements •

Meet specified monthly targets and goals •

Direct customers to product information resources, including those available on the internet •

Check email frequently and respond to inquiries immediately •

Deliver inquiries/messages intended for other sales personnel and departments promptly •

Contribute to the overall success of the dealership by working with all customers, teams and departments collaboratively and professionally with a positive, roll-up your sleeves attitude.

Job Type: Full-time

Pay: From $35,000.00 per year

Benefits:

401(k)
Dental insurance
Health insurance
Paid time off
Vision insurance

Schedule:

8 hour shift
Monday to Friday

Supplemental pay types:

Bonus opportunities

Ability to commute/relocate:

Charleston, WV 25315: Reliably commute or planning to relocate before starting work (Required)

Experience:

Sales: 1 year (Preferred)
Customer service: 1 year (Preferred)

Willingness to travel:

25% (Preferred)

Work Location: In person",-1,-1,Unknown / Non-Applicable,-1,Unknown,Company - Public,True
"HHR Specialist, Sr. - PATH Child Welfare Business Systems Analyst","West Virginia Department of Health and Human Resources
","Charleston, WV",$36K - $67K (Employer est.),3.3,"Please note, by clicking Apply, you are requesting that a DHHR Recruitment Team Member reach out to you regarding further application steps.

Nature of Work

As a PATH Child Welfare Business Systems Analyst, this position serves as a statewide expert of defined focus areas within the CW application and requires expertise in both the program content and the technical skills needed to support the software serving the program. This position collaborates with stakeholders to promote, protect, manage, and provide appropriate health and human services for our residents to improve their health, well-being, and quality of life. This position provides expert business analysis in the development, enhancement, and maintenance of all DHHR computer systems to provide customers and staff systems that is efficient, well maintained, and compliant with Federal and State Requirements. The position fills the gap between state technical staff, IT contractors (mainly OPTUM) and state policy staff to assure that what is programmed in the application (FACTS, OSCAR, RAPIDS, or PATH) is implemented appropriately and correctly to follow the system rules while also following the policies/administrative rules that govern the programs.

Minimum Qualifications

Training: Bachelor's Degree from a regionally accredited four-year college or university.

Substitution: Additional experience as described below may be substituted for the required training on a year-for-year basis.

Experience: Four years full-time, equivalent part-time paid or volunteer experience in a technical or program area that is related to the area of employment.

Substitution: Post-graduate education in a field related to the technical or program area may be substituted for the required experience on the basis of fifteen semester hours for one year of experience.

Job Type: Full-time

Pay: $35,994.00 - $66,589.00 per year

Benefits:

401(k)
401(k) matching
Dental insurance
Employee assistance program
Health insurance
Life insurance
Paid time off
Retirement plan
Tuition reimbursement
Vision insurance

Schedule:

8 hour shift

Work Location: In person",1989,State & Regional Agencies,Unknown / Non-Applicable,Government & Public Administration,5001 to 10000 Employees,Government,True
WV-SAP Business Analyst II - PP/QM,"Niterra North America
","Sissonville, WV",$58K - $84K (Glassdoor est.),2.7,"Responsibilities:
Essential Duties:
This is an on-site role, located in Charleston, WV.
Under general supervision, responsible for directly supporting various business units in their utilization of SAP module.
Leads sub-projects of the SAP applications, and operates as an internal consultant and thought leader with the business users.
Works with business units to ensure project objectives are well defined, tracked and completed on schedule.
Has a role in ensuring the smooth integration and rollout of systems by coordinating closely with the affected functional area.
Responsible for quickly resolving and documenting day to day issues as they arise.
Provide and transfer functional and process knowledge of the latest SAP releases and practices by keeping current on various published materials and training outlets.
Assist key business users in creating the functional requirements needed to alter SAP in line with changes in business practices.
Responsible for translating the user’s functional specifications into a technical specification on which the new SAP configuration will be based.
Provide ongoing training and knowledge transfer to users to enable them to become self-sufficient in the operation and training of the system.
Provide support to key users in end user training and “go-live” support.
Adhere to all company policies and procedures and, if applicable, all company policies relating to IATF16949 and ISO14000.
Knowledge of SAP modules: PP/QM as well as WM & MM.
Qualifications:
Academic Skills/Knowledge/Experience:
Bachelor’s degree preferred.
Minimum of 5 years of industry experience and/or SAP process knowledge required.
Minimum of 3 years hands on experience as subject matter expert or user with proven capabilities in systems analysis, application design and configuration.
Experience in unit testing, developing/testing application interfaces and integration testing
Experience in a multicultural environment preferred
Strong written and oral communication skills
Excellent organization, planning and administration
Experience in SAP SD required
Candidate must be located or willing to relocate a resonable distance from Charleston, WV after a hiring offer is made.",1936,Transportation Equipment Manufacturing,$1 to $5 billion (USD),Manufacturing,10000+ Employees,Company - Public,False
Senior Business Intelligence Analyst,"Pearson
","Charleston, WV",$77K - $108K (Glassdoor est.),3.7,"Senior Business Intelligence Analyst

Context

The shift within Higher Education more from one-time purchases of print textbooks to recurring subscriptions of digital products has generated a wealth of data about our products, customers, opportunities, and sales.

We’re looking for a leader who can take this information and leverage the latest data analytics tools, especially Tableau, to provide insight into the performance of business.

Reporting to the Director of Business Intelligence and sitting within the Strategic Sales Operations wing of US Higher Ed Sales Operations, the Sr Business Intelligence Analyst leads the analyses of the sales pipeline, net sales, subscriptions, and market data across multiple formats, models, and channels.

Responsibilities

Forecasting Mastery: Take the helm in owning all aspects of forecasting seasonal revenue, turning data into a strategic asset for our team.
Collaborative Insight: Work closely with cross-functional teams, including sales, marketing, finance, and product, to deliver accessible and consumable insights into the success of our higher education products.
Dashboard Stewardship: Support the lifecycle of our Tableau dashboards, ensuring they remain up to date with the latest features and capabilities while streamlining and retiring those that are no longer necessary.
Analytical Evolution : Drive the evolution of our analytics capabilities from self-service to predictive and early alert insights into product, sales, and market trends.
Data Integrity Guardian : Manage functional areas of data management, forecasting, contacts, leads, opportunities, dashboards, and reports, ensuring data integrity across our systems.
Strategic Partner: Assist in turning sales data into actionable insights that inform our go=to-market strategy, emphasizing focus areas, maximizing revenue, and preventing revenue leakage.

Essential Skills:

Holistic Business Understanding: Detailed comprehension of the sales business process and the ability to translate business needs into technical specifications.
Communication Prowess: Excellent interpersonal and communication skills, with the ability to articulate complex topics and present them thoughtfully to senior leaders.
Tech Savvy: Comfort with navigating the complexity of data across legacy and third-party platforms, ensuring forward momentum while simplifying and standardizing.
Organizational Agility : Strong time-management and organizational skills to balance multiple competing priorities.
Data Expertise: Background with ETL logic, data modeling concepts, and 5+ years of experience in a technical data role.

Requirements

Bachelor’s degree in business, finance, or computer-related program
5+ years of experience in a technical data role, such as analyst, engineer, architect, or scientist 5
5+ years of experience with multiple versions of SQL
5+ years of experience building and maintaining Tableau dashboards

Preferred Skills

Proficiency with Salesforce Sales Cloud (Marketing & Services Clouds a plus)
Proficiency with cloud databases such as Google BigQuery or Snowflake
Experience with machine learning concepts such as predictive modeling, categorization, and clustering
Background with programming in a language such as R or Python
Experience working in or supporting Sales or Revenue Operations a plus

\#LI-RS1

What to expect from Pearson

Did you know Pearson is one of the 10 most innovative education companies of 2022?

At Pearson, we add life to a lifetime of learning so everyone can realize the life they imagine. We do this by creating vibrant and enriching learning experiences designed for real-life impact. We are on a journey to be 100 percent digital to meet the changing needs of the global population by developing a new strategy with ambitious targets. To deliver on our strategic vision, we have five business divisions that are the foundation for the long-term growth of the company: Assessment & Qualifications, Virtual Learning, English Language Learning, Workforce Skills and Higher Education. Alongside these, we have our corporate divisions: Digital & Technology, Finance, Global Corporate Marketing & Communications, Human Resources, Legal, Strategy and Direct to Consumer. Learn more at We are Pearson.

We value the power of an inclusive culture and also a strong sense of belonging. We promote a culture where differences are embraced, opportunities are accessible, consideration and respect are the norm and all individuals are supported in reaching their full potential. Through our talent, we believe that diversity, equity and inclusion make us a more innovative and vibrant place to work. People are at the center, and we are committed to building a workplace where talent can learn, grow and thrive.

Pearson is an Affirmative Action and Equal Opportunity Employer and a member of E-Verify. We want a team that represents a variety of backgrounds, perspectives and skills. The more inclusive we are, the better our work will be. All employment decisions are based on qualifications, merit and business need. All qualified applicants will receive consideration for employment without regard to race, ethnicity, color, religion, sex, sexual orientation, gender identity, gender expression, age, national origin, protected veteran status, disability status or any other group protected by law. We strive for a workforce that reflects the diversity of our communities.

To learn more about Pearson’s commitment to a diverse and inclusive workforce, navigate to: Diversity, Equity & Inclusion at Pearson.

If you are an individual with a disability and are unable or limited in your ability to use or access our career site as a result of your disability, you may request reasonable accommodations by emailing ppsmhr@pearson.com.

Note that the information you provide will stay confidential and will be stored securely. It will not be seen by those involved in making decisions as part of the recruitment process.

Job: GENERAL BUSINESS OPERATIONS

Organization: Higher Education

Schedule: FULL\_TIME

Req ID: 13765

\#location",1844,Publishing,$5 to $10 billion (USD),Media & Communication,10000+ Employees,Company - Public,False
Senior PLM Business Analyst,"AtriCure
","Morgantown, WV",$106K - $137K (Employer est.),4.4,"AtriCure, Inc. provides innovative technologies for the treatment of Afib and related conditions. Afib affects more than 33 million people worldwide. Electrophysiologists and cardiothoracic surgeons around the globe use AtriCure technologies for the treatment of Afib and reduction of Afib related complications. AtriCure’s Isolator® Synergy™ Ablation System is the first medical device to receive FDA approval for the treatment of persistent Afib. AtriCure’s AtriClip® Left Atrial Appendage Exclusion System products are the most widely sold LAA management devices worldwide. AtriCure’s Hybrid AF™ Therapy is a minimally invasive procedure that provides a lasting solution for long-standing persistent Afib patients. AtriCure’s cryoICE cryoSPHERE® probe is cleared for temporary ablation of peripheral nerves to block pain, providing pain relief in cardiac and thoracic procedures. For more information, visit AtriCure.com or follow us on Twitter @AtriCure.

We foster a culture of inclusion by embracing diverse experiences and individuals where everyone’s authentic self is welcome. We offer supporting programs and resources that provide enriching and equitable opportunities for each person to contribute professionally and personally.

POSITION SUMMARY:
The Senior PLM Business Analyst (BA) will assist the PLM Business Solution Architect to consult and collaborate with business teams to capture and analyze current PLM business practices and systems, assist in architecting future state PLM solutions based on industry best practices enabled by computer-aided design (CAD), PLM and related technologies, and ensure technical alignment with AtriCure’s 3DExperience PLM platform. This role will partner with business stakeholders, Product Owners, SME’s, solution architects, data analysts, solution providers, and support personnel following the Agile framework and delivery. The PLM BA plays a critical role in capturing business, functional, system level requirements and serves as the liaison between the business and the IT development team to ensure the end solution adequately meets all requirements.

ESSENTIAL FUNCTIONS OF THE POSITION:

Assist the team in the design of future state PLM solutions (process models enabled by CAD, PLM and related technologies) based on industry best practices and aligned with Dassault ENOVIA 3DExperience PLM platform for the following areas: document management, quality management, advanced product configuration management, change control, managed CAD in PLM, systems engineering and requirements management, risk management (FMEAs), materials management and compliance, and integrations with CRM, ERP, MES, Reporting & Analytics platforms
Collaborate with business’ legacy system owners and IT to define the scope and requirements for migrating legacy PLM and CAD data to the configured 3DExperience application
Assist the team in archiving and retiring legacy systems and associated data
Perform basic mockups, configurations on the Dassault ENOVIA 3DExperience PLM platform to facilitate future state solutioning workshops and align with out-of-the-box capabilities to minimize configuration and customization effort
Work closely with the business Product Owner and PLM Solution Architect to author and refine Agile features and associated user stories with clear and accurate acceptance criteria definition.
Quality Assurance and Incident Resolution: Assist the team through authoring and executing test scripts for verification, validation and capture results. Communicate and help rectify gaps, bugs, missed requirements for the developed solution that are exposed during testing to ensure delivered solution meets all requirements
Assist Project Lead / Scrum Master to keep projects on schedule and hold team accountable to the AtriCure delivery process
Assist with the development of training materials, socializing, and training business users on the future state PLM solution and mitigating solution gaps
Assist in the continuous improvement of AtriCure’s project delivery methodology including implementing improved revision and change control practices for living artifacts (e.g., requirements, source code, technical specifications, test plans & scripts, release packages, etc.)
ADDITIONAL ESSENTIAL FUNCTIONS OF THE POSITION:

Experience with Continuous Delivery frameworks, Microsoft Azure and DevOps specifically
Familiarity with cloud-based Enterprise Application platforms used to support cross-functional business areas
Proven experience in conducting current state analysis and modeling future state solutions and related tools
Thorough understanding and proven experience with core, out-of-the-box 3DExperience functionality for change control, document management, product configuration management, and managed CAD.
BASIC QUALIFICATIONS:

Bachelor’s degree or higher in science, computing technology, or engineering discipline is required.
5+ years of experience working as a BA or comparable role with ENOVIA 3DExperience PLM platform (preferably 2021x or higher) with proven ability to demonstrate 3DExperience capabilities and facilitate requirements gathering workshops
8+ years of experience working with project teams to successfully implement ENOVIA 3DExperience solutions (preferrable) and/or other enterprise PLM package solutions for discrete manufacturers
Ability to interpret, understand and analyze complex legacy business processes, systems, and associated data, model and map to the future state solution
Proven experience in authoring requirements specifications for PLM solutions (features & user stories)
Working experience in an onsite-offshore model and collaborating with developers to meet the project schedule
Proven experience in providing input to quality assurance strategies, authoring, and executing test scripts and playing a significant role in the incident resolution process
Ability to partner across all levels in the organization to initiate, develop and maintain effective working relationships
Understanding of the various application development lifecycles (e.g., Agile, RUP, and Waterfall)
Exceptional communication skills (written and verbal)
Ability to travel 10%
PREFERRED QUALIFICATIONS:

Excellent understanding of business complexity and project interdependencies
Minimum of two years experience working in the medical devices or health sciences industry supporting and/or providing business-process-enabling technologies
Two years experience using or supporting CAD data management systems – preferably Solidworks
3 years of combined experience working in Agile environment with multiple teams and dependencies in an enterprise organization
Trained or certified Agile Product Owner
Experience w/ using automated testing tools is desirable
OTHER REQUIREMENTS:

Ability to regularly walk, sit, or stand as required
Ability to occasionally bend and push/pull
Ability to occasionally lift up to 10 pounds
Ability to pass pre-employment drug screen and background check
Salary range of $105,500 to $136,500. The pay for the successful candidate will depend on various factors (e.g., qualifications, education, prior experience). You may also be entitled to receive bonus, benefits, and more.

#LI-RD1

AtriCure has a variety of benefits available for US based employees and their families. Examples include Medical & Dental beginning day 1 of employment, 401K plus match, 20 days of paid Parental Leave, in addition to maternity leave, for new moms and dads, Volunteer Time off, Pet Insurance, and more. Corporate-based employees also have full access to our on-site fitness center and cafeteria. To see a complete list of our benefits, please visit our careers website: https://www.atricure.com/benefits AtriCure participates in the federal E-Verify program to confirm the identity of and employment authorization of all newly hired employees. For further information about the E-Verify program, please click here https://www.e-verify.gov/ AtriCure is an Equal Employment Opportunity/Affirmative Action employer and provides Drug Free Workplaces. All qualified applicants will receive consideration for employment without regard to race, color, religion, sex, national or ethnic origin, age, protected veteran status, status as an individual with disability, sexual orientation, gender identity or any other characteristic protected by federal, state, or local law(s).",2000,Health Care Products Manufacturing,$100 to $500 million (USD),Manufacturing,1001 to 5000 Employees,Company - Public,False
