Job Title,Company Name,Location,Salary Estimate,Rating,Job Description,Founded,Industry,Revenue,Sector,Size,Type,Easy Apply
Management Consultant (IT Business Analyst) - US,"Public Knowledge, LLC
",Montana,-1,4.3,"Applicant must be willing to travel as needed

Company Summary
Public Knowledge® is a national management consulting firm that helps government agencies solve tough problems and thrive in complex environments. We do this by providing planning, procurement, and implementation services. Most of our work is in Health and Human Services. You can learn more about us at www.pubknow.com. The GLI® Group has acquired Public Knowledge®, which provides Public Knowledge® with the financial backing and infrastructure of a larger company.

Inclusion is a core value of Public Knowledge®. We value and seek to create a more diverse workforce. We encourage women, minorities, veterans, people with disabilities, people with different sexual orientations, people with lived expertise, and other diverse people to apply. We believe every member on our team enriches our diversity by exposing us to a broad range of ways to understand and engage with the world, identify challenges, and to discover, design, and deliver solutions. We are committed to creating a safe and inclusive workplace that highlights the diversity in all of us and our experiences.

Position Summary
This management consultant would spearhead research efforts to gather information for large projects and programs and propose creative solutions. This person would collaborate with project managers and team members to support project administration, time management, and budgeting.

Duties & Responsibilities include, but not limited to:
Research

Gather information for a project by conducting interviews, surveys, facilitating groups, analyzing client documentation, conducting research of best practice and academic literature, and the application of other information gathering tools.
Project Support

Learn and apply the tools and techniques we have for projects.
Work with project managers to support the administration of projects (ensure staff adhere to standards, organizing the time of other team members, supporting project meetings, and assisting with project financial management).
Help your team meet project objectives, timelines, and deliverables within budget.
Analysis, Communication, and Consultation

Using your experience and research results, analyze and organize information identifying root causes of issues, opportunities for improvement, and generate ideas to improve the client situation.
Based on your analysis, research, and experience participate with your team in the development of recommendations for actions that will improve the client situation.
Communicate the results of our work (information, analysis, and recommendations) through the participation in the development and delivery of written reports, formal presentations, and oral discussions with your team, and as requested clients and stakeholders.
Firm Knowledge Sharing and Growth

Freely share your knowledge, skills, and abilities with your peers in the firm.
Perform firm administrative activities (maintain your resume, record your time accurately).
Grow your skills and experience by participating in projects and actively pursuing continuing professional education.
Develop an effective working relationship with clients and colleagues.
Required Education and Other Credentials:

Bachelor’s Degree required
Valid Driver’s License
Required Experience and Skills:

Must have ability to lead the application of analytic techniques and assist in defining the project objectives, methodologies, and principles.
Must have experience performing a wide variety of analytical tasks with the continuous improvement of processes, personnel, organization, system, or training.
Must have strong interpersonal skills and extremely resourceful
Experience with JIRA, Rational, Kanban, preferred
Must have experience in bringing focus and organization to ambiguous situations
Must demonstrate creative and strong analytical and problem-solving skills
Demonstrates excellent interpersonal skills Must have flexibility and ability to adapt quickly to new situations
Must have ability to establish and cultivate strong work relationships
Must have clear, concise written and verbal communication
Must have demonstrated life-long learning skills
Desire to work in a collaborative, fast-paced, entrepreneurial environment
Ability and willingness to travel (reasonable travel will be required)
Proficient knowledge of Microsoft Word, Excel, and Outlook
Must have excellent oral and written communication skills, including the ability to communicate with officials at all levels in government and industry
Must have the ability to handle and organize multiple projects and deadlines
Must demonstrate a high degree of attention to quality, details, and correctness
Ability to work with colleagues in a virtual environment (via conference calls, web meetings, and using digital collaboration tools such as Zoom and cloud document repository)
Physical Requirements and Working Conditions:

Must have the ability to travel to client sites
Ability to work from a home-based office
Must have the ability to work at a computer for extensive periods of time
Must have the ability to speak on the telephone for extended periods of time
Must have the ability to read (paper or computer screen) for extended periods of time
Must have sufficient hand, arm, and finger dexterity to operate a computer keyboard and other Company equipment
Must have the ability to be self-driven, work independently and as part of a team
We offer excellent paid benefits that include:

Comprehensive Health & Dental Insurance
100% Paid Life Insurance
20 Days Paid Time Off (Per Year)
Paid Holidays
401K Savings Plan with 100% match up to 3% of your salary
Anniversary Reward Bonus
If you are a Colorado resident, you may be eligible to receive additional information about the compensation and benefits for this role, which we will provide upon request. You may contact 732-942-3999 ext. 1436 for assistance
In accordance with PK's duty to provide and maintain a safe workplace during the pandemic, we require all new employees to be fully vaccinated with a Coronavirus vaccine. You will be asked to show proof of vaccination prior to your start date.

Applying
Think you've got what it takes? Apply online on our website and include an introduction to yourself and your qualifications.

This job post should not be interpreted as all-inclusive; it is intended to identify major responsibilities and requirements of the job. The incumbent may be requested to perform other job-related task and responsibilities than those stated above.

Public Knowledge is an Equal Opportunity Employer",1988,Business Consulting,$5 to $25 million (USD),Management & Consulting,51 to 200 Employees,Company - Private,True
Business Intelligence Specialist - Fully Remote,"Mi-C3 International
","Malta, MT",-1,4.3,"Mi-C3 is seeking a skilled, highly analytical Business Intelligence Specialist/ Report writer, to work remotely with our global teams The successful Business Intelligence Specialist/ Report writer will be responsible for creating reports for data created in the Affectli system, our Flagship software.


This role provides deep technical and business support for all aspects of data acquisition, data analysis, data interpretation, and interactive data visualizations. The role enables us to assist our clients to extract greater value from raw datasets that are varied in their composition, that are growing constantly, and tend to get more complex over time. At its core, we help our clients visualize their data in new and more informative ways than ever before.

The candidate will have an advanced understanding of SQL, ETL tools, data ingestion, data discovery & analysis, data cleansing, data transformation, data modelling, and data visualization.




JOB REQUIREMENTS

Understand ETL concepts of data flow, data enrichment, data consolidation and transformation
Understand database concepts of referential integrity, indexes and keys and table metadata
Ability to design and develop Data Warehouse ETL processes and associated reporting
Architect, design (including data model), develop, implement, and maintain code for ETL Transformation
Architect and design queries to enable complex report construction - understanding that these are informed by business and other analytical demands..
Expertise in one or more of these areas: data security, data storage, data ingestion, data streaming, data processing, data analysis & exploration, data quality, data visualization (using reporting & business intelligence), business process management/business rules processing, data exchange, or data modeling.
Ability to collaborate with Business Analysts/ BPE’s and architects to analyze business requirements, develop data model strategies and develop technical design specifications

TECHNICAL REQUIREMENTS




Database - Intermediate to advanced skills for doing SQL database queries and associated functions
Database - Exposure to Time Series Database technologies such as Druid would be advantageous
Familiarity with alternative data storage and transfer format such as JSON advantageous
Familiarity with GraphQL advantageous
Transformation tool - Experience with a transformation tool such as Pentaho Data Integration (kettle, database AND spoon) would be advantageous, but is not a necessity
Report writer tools - Experience with Reporting tools such as SuperSet, Pentaho, Tableau, or similar.
Source control: Experience using Git version control software would be advantageous",2014,Enterprise Software & Network Solutions,$5 to $25 million (USD),Information Technology,51 to 200 Employees,Company - Private,True
Business Intelligence Analyst,"Altenar
","Malta, MT",$69K - $100K (Glassdoor est.),4.8,"Altenar is interested in recruiting the services of a Business Intelligence Analyst to work closely with various Product and Business stakeholders as well as with Technology teams to focus on using various analytical techniques to answer interesting business questions. The role requires outstanding communication skills, proven ability to contextualize complex problems, identify data requirements, and develop solutions backed by strong documentation. The candidate will be expected to demonstrate familiarity with concepts such as ETL/ELT and statistics.

The successful applicant should illustrate comfort working in a startup environment, possessing high intellectual curiosity with ability to quickly learn new concepts/frameworks, algorithms and technology that powers Alternar business objectives. We seek someone with a high degree of ownership that can consistently deliver superior quality results on-time. The successful candidate is expected to contribute to Altenar’s data strategy by diving deep into data-warehouse architecture, exploring opportunities for gaining insight and extracting value from our data, and finally contributing actively to the dashboarding and reporting needs within the company.

About the Altenar Intelligence Platform (AIP):

Founded in 2011, Altenar is a leading igaming software provider inspired by the vision of our customers. As our platform has scaled we have begun to generate high volumes of transactional data which can be potentially mined to generate additional insights. AIP is the long term vision for unlocking this potential.


The activities of a Business Intelligence Analyst include but are not limited to:

Continuously updating core knowledge and skills in SQL and Python or R as applied to mathematical analysis
Working with the Solution Architect and Business Analysts, and directly with key Product and Business owners on topics for exploration and their description
Gaining an in-depth understanding of Altenar data-warehousing and helping to unlock the value of the data,
Working with Data Engineers, Infrastructure Engineers and Data Services Engineers on data collection, movement and storage strategies
Building analytical applications in a structured manner that can be tested and deployed
Performing various types of analytics including descriptive, diagnostic, predictive or prescriptive analytics.
Delivering views, dashboards and report configurations using BI tools as required by internal stakeholders
Participation in the research, test, design of new data services tools for online or warehoused data
Work in a fast-paced, dynamic, multinational, multicultural environment
Creating and maintaining documentation for the solutions provided



Qualifications

Experience working with python and pandas (knowledge of statistical and ML libs would be a plus)
Strong SQL querying skills
Knowledge of noSQL and ETL/ELT operations considered a plus
Strong analytical and forecasting skills using offline methods such as spreadsheets (knowledge of Power Pivot would be a plus)
Strong math and statistics background (relevant Degree education required)
Proven experience with one or more BI tools (Metabase, Apache Superset, Redash, PowerBI, Tableau, Qlikview)
Ability to quickly write ad-hoc SQL scripts to analyze small to medium datasets.
Strong research and validation skills
Motivated and self-driven to work in an environment with minimal supervision
Strong presentation skills
Proficient in spoken and written English
Graduate-level education in Computer Science, Engineering, Math, Statistics,
Economics, or other relevant field

Nice to have:

Experience with Spark core functionality such as Spark SQL, Spark Structured Streaming is very desirable
Some experience in using Git version control in the context of documentation/source code management
Experience with Jupyter notebooks or any equivalent IDE



Some of the benefits of working at Altenar:

Stable and flexible working environment
Training and professional development events
Health insurance

Good compensation and a fantastic office environment
Corporate parking near our office
Multinational team with experts around the world",2011,Software Development,Unknown / Non-Applicable,Information Technology,201 to 500 Employees,Company - Private,True
Business Analyst -Hybrid,"State of Montana
","Helena, MT",$68K - $75K (Employer est.),2.8,"Business Analyst -Hybrid (66933) - (23143412)




Why live in Helena, Montana?

Helena is surrounded by rolling hills and lofty mountains and is tucked below the Continental Divide.
It is a relatively quiet place to call home where small-town living collides with outdoor adventure.
Helena has a rich history and was originally founded as a gold camp during the Montana gold rush.
Learn more about moving to and/or living in Helena, Montana here.

This position affords the opportunity to telework from a remote location within the state of Montana. Specific conditions will be outlined as part of the job offer and must adhere to state policy.



Why should you keep reading and consider working here?
We know you have other work options, but we ask you to consider working with us at the State of Montana Department of Administration in the State Information Technology Services Division (SITSD). Our mission to provide shared IT services to support the needs of the state and citizens of Montana. We offer an innovative and collaborative work environment where employees are valued and supported. In addition, our employees have the opportunity to be involved in some of the most exciting and innovative IT projects and initiatives in development within Montana state government.



What is this career opportunity?
We are looking for a highly motivated and dynamic business analyst to join our team and help deliver innovative solutions on the ServiceNow platform to meet State agencies’ business needs. In the business analyst role, you will work with a wide variety of business partners at agencies to understand their current business processes, conduct discovery workshops to elicit business requirements, and define the desired future state. The business analyst works closely with the technical team to represent the needs of the business partner to ensure value is delivered quickly through an iterative process. In addition, the business analyst helps conduct testing and validation of the solution to ensure it meets business requirements. If you are analytical, curious, collaborative, resourceful, committed to growth, and agile, we’d love to have you apply to join our team!


What are we looking for?

Education and Experience:

A Bachelor’s degree and three years of applicable experience.
Alternate combinations of education and experience will be considered on a case-by-case basis.



Competencies:

Knowledge of:

Business analysis concepts, skills, and techniques;
Basic understanding of agile methodology;
Basic understanding of software development lifecycle.

Preferred:

ServiceNow platform;
Scaled Agile Framework (SAFe).

Ability to:

Review and analyze existing business processes to understand a business partner’s current state;
Elicit, define, and document business requirements; refine business requirements based on iterative feedback;
Develop and maintain relevant business documentation such as business process workflows and user stories;
Communicate effectively with a diverse, and often non-technical, audience with the goal of translating their business needs into IT solutions utilizing the ServiceNow platform;
Articulate and represent the needs of business partners to the technical team throughout the software development lifecycle; facilitate dialogue to ensure the development team understands the requirements;
Conduct testing and validation of the solution to maintain quality and satisfy the customer’s needs;
Establish collaborative working relationships with all involved parties;
Be agile and able to adapt to continuous change.



Does this sound like you?
Please tell us how and why by submitting your resume and cover letter. (Please Note: You do not need to complete the “work experience” or the “education & certifications” portion of the application process in our recruiting system. You only need to upload the requested documentation.)



What can you expect from us in return for your hard work?

Ø Look here to see the additional benefits! They include:

o Work/life Balance
o Health Coverage
o Retirement plans
o Paid Vacation and Sick Leave and Holidays
o And more…

Ø Public Service Loan Forgiveness (PSLF) – Employment with the State of Montana may qualify you to receive student loan forgiveness under the PSLF. Look here to learn more and see if you may qualify!




Other important information to be aware of.

This position requires the successful completion of a criminal background check.
Only online applications are accepted. By applying online, you are able to receive updates and monitor the status of your application.


Applicant Pool Statement: If another department vacancy occurs in this job title within six months, the same applicant pool may be used for the selection.
Training Assignment: This agency may use a training assignment. Employees in training assignments may be paid below the base pay established by the agency pay rules. Conditions of the training assignment will be stated in writing at the time of hire.


Salary: $ 68,000.00 - 75,000.00 Yearly
Telework Eligibility: Telework Eligible (Full-time telework is not available. Telework schedule must be supervisor approved.)
Benefits Package Eligibility: Health Insurance, Paid Leave & Holidays, Retirement Plan


Number of Openings: 1
Employee Status: Regular
Schedule: Full-Time
Shift: Day Job
Travel: Yes, 5 % of the Time


Primary Location: Helena


Agency: Department of Administration
Union: 000 - None


Posting Date: Nov 17, 2023, 12:43:33 PM
Closing Date (based on your computer's timezone): Dec 4, 2023, 12:59:00 AM
Required Application Materials: Cover Letter, Resume


Contact Name: Shannon Voss | Contact Email: Shannon.voss2@mt.gov | Contact Phone: 406-444-5583",-1,Health Care Services & Hospitals,Unknown / Non-Applicable,Healthcare,51 to 200 Employees,Hospital,False
