Job Title,Company Name,Location,Salary Estimate,Rating,Job Description,Founded,Industry,Revenue,Sector,Size,Type,Easy Apply
Business Analyst,"TekSynap
","Clarksburg, WV",$58K - $84K (Glassdoor est.),4.4,"Responsibilities & Qualifications:
RESPONSIBILITIES
Supports agencies by analyzing propositions and assessing decision-making factors, such as strategic alignment, cost/benefit, and risk.
Works closely with the Product Manager to define a product approach to meet the specified user need.
Defines skill requirements and maps internal, agency, and external (partners/specialist contractors) resources.
Works with the owning agency to ensure they have the budget to cover the proposed approach and resource requirements during delivery and analyzes what provision they have for on-going running costs.
Analyzes and maps the risks of a product approach and proposes mitigation solutions.
Defines how the predicted user and financial benefit can be realized, and how channel shift will be measured.
Makes a recommendation for action against the analysis done.
REQUIRED QUALIFICATIONS

3 years of relevant Business Analyst experience
Bachelor’s degree in an IT discipline preferred
Active DoD Secret Security Clearance required
Understanding of data mapping, data integrity, data relationships, and dashboard customization
Proven ability to apply industry standard modeling techniques with broad understanding of analysis and IT industry, e.g., emerging technologies, industry standards, support services, architectures, systems design, and systems integration and solid knowledge of analysis and accepted IT processes and methodologies
Experience in client interaction and understanding business application, business data flow, data sharing, data validation, and data mapping.
Working knowledge of supporting applications Atlassian suite (Jira, Confluence, Bamboo).
Must have experience working in an Agile development team.
Ability to work independently, prioritize effectively, multitask, and manage time appropriately.
Results oriented, independently driven, self-motivated with advanced analytical and problem-solving abilities.
Record of accomplishment of delivering results, setting strategy, and leading a large volume and high-profile customer; including influencing stakeholders and working in cross-functional projects.
Excellent organizational skills including prioritizing, scheduling, time management, and meeting deadlines.
Strong communicator, ability to concisely communicate complex information.
Ability to create original documentation, including Architectural and Process Flow Diagrams.
Previous experience with supporting Federal Government customers preferred.
Overview:
We are seeking a Business Analyst to join our team supporting the FBI’s Criminal Justice Information Services Division.

TekSynap is a fast growing high-tech company that understands both the pace of technology today and the need to have a comprehensive well planned information management environment. “Technology moving at the speed of thought” embodies these principles – the need to nimbly utilize the best that information technology offers to meet the business needs of our Federal Government customers.

We offer our full-time employees a competitive benefits package to include health, dental, vision, 401K, life insurance, short-term and long-term disability plans, vacation time and holidays.

Visit us at www.TekSynap.com.

Apply now to explore jobs with us!

The safety and health of our employees is of the utmost importance. Employees are required to comply with any contractually mandated Federal COVID-19 requirements. More information can be found here.

By applying to a role at TekSynap you are providing consent to receive text messages regarding your interview and employment status. If at any time you would like to opt out of text messaging, respond ""STOP"".

Additional Job Information:
COMPETENCIES
Establish Focus
Change Management
Develop Others
Oral Communication
Written Communication
Interpersonal Awareness
Build Relationships
Analytical Thinking
Conceptual Thinking
Strategic Thinking
Technical Expertise
Initiative
Foster Innovation
Results Oriented
Teamwork
Customer Service
WORK ENVIRONMENT AND PHYSICAL DEMANDS
The work environment characteristics described here are representative of those an employee encounters while performing the essential functions of the job. Reasonable accommodation may be made to enable individuals with disabilities to perform the essential functions.
Location: Clarksburg, WV
Type of environment: Office & Remote
Noise level: Medium
Work schedule: Schedule is day shift Monday – Friday. May be requested to work evenings and weekends to meet program and contract needs.
Amount of Travel: 10%
PHYSICAL DEMANDS
The physical demands described here are representative of those that must be met by an employee to successfully perform the essential functions of this job. Reasonable accommodations may be made to enable individuals with disabilities to perform the essential functions.
While performing the duties of this job, the employee is regularly required to use hands to handle, feel, touch; reach with hands and arms; talk and hear. The employee is regularly required to stand; walk; sit; climb or balance; and stoop, kneel, crouch, or crawl. The employee is regularly required to lift up to 10 pounds. The employee is frequently required to lift up to 25 pounds; and up to 50 pounds. The vision requirements include close vision, distance vision, peripheral vision, depth perception, and ability to adjust focus.

WORK AUTHORIZATION/SECURITY CLEARANCE
U.S. Citizen
Secret Security clearance required

OTHER DUTIES
Please note this job description is not designed to cover or contain a comprehensive listing of activities, duties or responsibilities that are required of the employee for this job. Duties, responsibilities and activities may change at any time with or without notice.

EQUAL EMPLOYMENT OPPORTUNITY
In order to provide equal employment and advancement opportunities to all individuals, employment decisions will be based on merit, qualifications, and abilities. TekSynap does not discriminate against any person because of race, color, creed, religion, sex, sexual orientation, gender identity, protected veteran status, national origin, disability, age, genetic information or any other characteristic protected by law (referred to as “protected status”). This nondiscrimination policy extends to all terms, conditions, and privileges of employment as well as the use of all company facilities, participation in all company-sponsored activities, and all employment actions such as promotions, compensation, benefits, and termination of employment.

TekSynap is committed to ensuring that our online application process provides an equal employment opportunity to all job seekers, including individuals with disabilities. If you believe you need a reasonable accommodation in order to search for a job opening or to submit an application, please contact hr@teksynap.com for assistance.",2008,National Agencies,$100 to $500 million (USD),Government & Public Administration,501 to 1000 Employees,Company - Private,False
Associate Logistics Manager - Projects,"Ecolab
","Martinsburg, WV",$53K - $83K (Glassdoor est.),3.7,"The Associate Logistics Manager - Projects is responsible for leading continuous improvement projects, applying lean and Total Productive Maintenance (TPM) methodologies, and driving efficiencies by streamlining process flow and distribution center layout. In addition, this position will ensure metrics are being reported as well as lead root cause analysis to identify potential issues. Will also work to bring solutions to enable the site to achieve peak productivity as soon as possible after go-lives.

Examples of projects across the network include:

Supporting the smooth roll-out of the Warehouse Management System (WMS) for our new/existing distribution centers in North America.

Establishing, validating and implementing Labor Management System (LMS) processes and assisting the North American distribution centers to reach goals as defined by these engineered standards.

This high visibility role will require extended travel during the site openings and roll-outs. There is a formal PMO deployment team and a “Project High-Score” team nationally that will work collaboratively to drive success as a cohesive team.

Extended travel will be expected the first year


What You Will Do:

Deploy to NA sites as they go live on our new WMS and LMS systems; boots on the ground to support the sites

Collaborate with functional leaders on key performance metrics that are tracking the recovery efforts of each go live

Drive engagement with the local teams and the support functions; using metrics to drive decisions

Monitor site and shift performance metrics and provide necessary actions to improve productivity

Align expectations for go lives; establish realistic timelines for each site to be achieve daily KPIs

Provide root cause analysis of daily service escalations and provide corrective action feedback to leadership teams

Assist the overall site operations leader in developing and implementing site process improvements, operational changes, and collaborate on project initiatives.

Serve as a liaison and mentor to shift supervisors and hourly leads to insure daily operational activities and goals are met.

Drive logistics plans through clear communication and close co-operation with Customer Service, Materials Planning, Manufacturing and major suppliers/vendors.

Partner with Quality, Planning, Manufacturing, Carriers & Customers to proactively avoid & resolve quality and service issues relating to logistics.

Manage projects to improve performance and meet customer needs, generating and implementing innovations for improved performance and a logistical competitive advantage.

Monitor fixed assets and coordinate implementation of approved CARs, and support budgeting for site logistics with focus on continuously improving year over year performance against metrics.

Manage inventory control, warehousing, transportation, logistics planning, order processing & customer service driving performance to metrics through the communication standard logistics metrics to direct reports and effectively resolving quality, service & cost issues.

Additional duties as assigned.


Minimum Qualifications:

Bachelor’s degree

6+ years of supply chain, logistics or related experience

Proven experience with project management and/or business analysis

Strong problem-solving, analytic, conceptual, and critical thinking skills

Excellent communications skills both verbal and written, including executive level presentations

No immigration sponsorship available for this role

Ability to travel up to 90% of the time


Preferred Qualifications:

Bachelor’s degree in Logistics / Supply Chain, Operations, Engineering or Mathematics

SAP operations and reporting capability

Self-starter with detail orientation; persistence and ability to work independently to drive execution.

Solid understanding of supply chain drivers and key sensitivities, with business performance reporting experience

Ability to synthesize/analyze complex and diverse information and to develop and recommend strategies and communicate them clearly

Ability to perform ad-hoc analysis, glean and form business insights under aggressive timelines

Demonstrated ability to manage complexity/ambiguity and multiple initiatives

#li-ussc

Benefits

Ecolab strives to provide comprehensive and market-competitive benefits to meet the needs of our associates and their families. Click here to see our benefits.

If you are viewing this posting on a site other than our Ecolab Career website, view our benefits at jobs.ecolab.com/working-here.

Covid-19 Vaccine Notice

Due to local mandates and customer requirements, applicants for certain customer-facing positions must be fully vaccinated (which in some situations requires a booster if eligible), unless a religious or medical accommodation is requested by the applicant and approved by Ecolab.


Americans with Disabilities Act (ADA)

Ecolab will provide reasonable accommodation (such as a qualified sign language interpreter or other personal assistance) with our application process upon request as required to comply with applicable laws. If you have a disability and require accommodation assistance in this application process, please call Ecolab Recruiting Support at (866) 841-6682 for assistance.

Our Commitment to Diversity and Inclusion

At Ecolab, we believe the best teams are diverse and inclusive, and we are on a journey to create a workplace where every associate can grow and achieve their best. We are committed to fair and equal treatment of associates and applicants. We recruit, hire, promote, transfer and provide opportunities for advancement on the basis of individual qualifications and job performance. In all matters affecting employment, compensation, benefits, working conditions, and opportunities for advancement, we will not discriminate against any associate or applicant for employment because of race, religion, color, creed, national origin, citizenship status, sex, sexual orientation, gender identity and expressions, genetic information, marital status, age, disability, or status as a covered veteran.

In addition, we are committed to furthering the principles of Equal Employment Opportunity (EEO) through Affirmative Action (AA). Our goal is to fully utilize minority, female, disabled and covered veteran individuals at all levels of the workforce. Ecolab is a place where you can grow your career, own your future and impact what matters.

We will consider for employment all qualified applicants, including those with criminal histories, in a manner consistent with the requirements of applicable state and local laws, including the City of Los Angeles’ Fair Chance Initiative for Hiring Ordinance and the San Francisco Fair Chance Ordinance.",1923,Chemical Manufacturing,$10+ billion (USD),Manufacturing,10000+ Employees,Company - Public,False
"Health and Human Resources Specialist, Senior - DHHR/SEC - Kanawha Co.","State of West Virginia
",United States,$36K - $67K (Employer est.),3.6,"Nature of Work

As a PATH Child Welfare Business Systems Analyst, this position serves as a statewide expert of defined focus areas within the CW application and requires expertise in both the program content and the technical skills needed to support the software serving the program. This position collaborates with stakeholders to promote, protect, manage, and provide appropriate health and human services for our residents to improve their health, well-being, and quality of life. This position provides expert business analysis in the development, enhancement, and maintenance of all DHHR computer systems to provide customers and staff systems that is efficient, well maintained, and compliant with Federal and State Requirements. The position fills the gap between state technical staff, IT contractors (mainly OPTUM) and state policy staff to assure that what is programmed in the application (FACTS, OSCAR, RAPIDS, or PATH) is implemented appropriately and correctly to follow the system rules while also following the policies/administrative rules that govern the programs.


IMPORTANT: Your eligible score will be based on information provided in your application; therefore, make sure your application is detailed and complete. You MUST complete ALL parts of the application, including the Work Experience section.

ATTENTION: Applicant must verify post high school education by submitting an official transcript or diploma, training or licensure earned pertaining to this position by the closing date of the posting, if not previously verified. If you are claiming Veterans preference, please submit ""MEMBER 4"" form and/or your VA Letter.

Please attach documents to the online application before submitting it. Or, you may email it to: applicantservices@wv.gov or by mail to: WV Division of Personnel, 1900 Kanawha Blvd. E., Building 3, Suite 500, Charleston, WV 25305.

This announcement is for one or more specific vacancies and only applies to the location(s) indicated. Your application will remain active for this job for 180 days or until the job is filled. Application for this job does not automatically qualify you for other positions. Be sure to submit your application for each position of interest. To receive an email notice anytime jobs in this or other categories are posted, you may choose to complete a Job Interest Card from the slide-out menu located at the top left of our Job Opportunities page.



Minimum Qualifications

Training: Bachelor's Degree from a regionally accredited four-year college or university.

Substitution: Additional experience as described below may be substituted for the required training on a year-for-year basis.

Experience: Four years full-time, equivalent part-time paid or volunteer experience in a technical or program area that is related to the area of employment.
Substitution: Post-graduate education in a field related to the technical or program area may be substituted for the required experience on the basis of fifteen semester hours for one year of experience.

***DETAILS OF RELATED EXPERIENCE MUST BE SHOWN IN THE WORK EXPERIENCE SECTION OF YOUR ONLINE APPLICATION***",-1,State & Regional Agencies,Unknown / Non-Applicable,Government & Public Administration,10000+ Employees,Government,False
