Job Title,Company Name,Location,Salary Estimate,Rating,Job Description,Founded,Industry,Revenue,Sector,Size,Type,Easy Apply
Revenue Cycle BI Analyst,"Vagus Technologies
","Great Falls, MT",$74K - $113K (Glassdoor est.),3.9,"Position Overview

This position will focus on the development and streamlining of business performance reports that aid End Users (Operations and Hospitals) to make objective decisions. This position will identify improvement opportunities and communicate analysis results directly with Product Line leaders to assist with business performance advancement. Will independently lead projects related to revenue cycle operations initiative reporting, pre-integration client reporting, emerging client integration reporting and projects requiring expertise across multiple business reporting areas. This individual leverages analytical skills and time management skills to ensure that all requirements are accomplished within established timeframes.

Education

4-year college degree in Business, Accounting, IS, Engineering or 7 or more years of related experience, preferred.

Experience

Healthcare experience, required.

Knowledge/Skills/Abilities

Expert data gathering, analytical and data visualization skills.
Independent, logical thinker with strategic view of reporting offerings and proven ability to perform detailed data analysis, make recommendations and develop analytical reports and models that provide solutions for client.
Expert troubleshooting and QA skills, with ability to research and problem solve complex technical issues independently within a timely fashion.
Must demonstrate excellent professional communication skills through clearly written, concise and comprehensive documentation.
Experienced and comfortable making presentations to product line leaders, Directors and Executive Leadership across multiple product lines.
Advanced ability to work well with team members across the Enterprise, respectful of all positions at all levels, as well as complete tasks independently and professionally.
Advanced organizational, communication, customer service, interpersonal, and time-management skills.
Ability to manage multiple projects simultaneously and voice concerns with the management when needed.
Expert knowledge/experience with reporting systems.
Expert level knowledge of relational database management systems such as MS SQL Server/MySQL, AS/400, Showcase, MS Access.
Expert level SQL language skills (creating/optimizing queries and stored procedures).
Expert level knowledge of desktop applications (Microsoft Excel, Word, Access and PowerPoint).
VBA.
Alteryx, MicroStrategy,Tableau, Power BI or similar a plus

Notice Of Pre-employment Screening Requirements

If you receive a job offer, please note all offers are contingent upon passing a pre-employment screening, which includes:

Criminal background check
Drug Screening

Health and Immunizations Screening

Job Type: Full-time

Salary: $60.00 - $70.00 per year

Benefits:

401(k)
Health insurance
Vision insurance

Schedule:

8 hour shift
Monday to Friday

Work setting:

Office

Application Question(s):

How many years of experience do you have as a BI Analyst?
How many years of experience do you have in data gathering, analytical and data visualization?
Do you have expereince in any one of the below skills?

MS SQL Server/MySQL, AS/400, Showcase, MS Access.

How many years of experience do you have in Healthcare?(MUST)
What is your Visa?
What is your expected salary?

Work Location: On the road",2006,Information Technology Support Services,Unknown / Non-Applicable,Information Technology,51 to 200 Employees,Company - Private,True
Systems Analyst – SABHRS Financials,"State of Montana
","Helena, MT",$68K - $75K (Employer est.),2.8,"Systems Analyst – SABHRS Financials - (23143327)



Why should you keep reading and consider working here?
We know you have other work options, but we ask you to consider working with us at the State of Montana Department of Administration (DOA). Our foundation of success is having effective working relationships, built on mutual trust and respect. We will challenge you to be the best you can be and will work hard to provide a work environment that allows you to succeed.
(You can learn more about the DOA here.)

What is this career opportunity?
Do you enjoy researching information technology to resolve business challenges related to accounting and budgeting? Would you appreciate working in a supportive environment that fosters a work/life balance? Our Computer Systems Analyst position may be for you!

The Financial Services Technology Bureau (SABHRS Financials) is looking for an analyst with experience in accounting, budgeting, business analysis, or systems analysis, and who is also customer-focused and enthusiastic about working in a constantly evolving technology landscape.

We are team-oriented professionals that collaborate with our stakeholders to evaluate current business processes and IT systems to provide technology solutions and enhancements in a PeopleSoft environment.

The Computer Systems Analyst is responsible for:

Overseeing the installation, configuration, and testing for new, existing, or modified PeopleSoft modules.
Focusing on meeting the business needs of our stakeholders.
Testing components to determine system performance.
Trouble-shooting system issues.
Providing solutions to the State’s business process issues.
Conducting research about existing and emerging technologies to recommend improvements and efficiencies.
Technical support and project management.


(Learn more about the State Financial Services Division’s Financial Services Technology Bureau here.)

In this position you will be afforded the opportunity to telework, however there will be required weekly in office day(s) in Helena. Specific conditions will be outlined as part of the job offer and must adhere to state policy.


What are we looking for?
Competencies:

Knowledge of financial, budget and accounting business processes and practices.
Knowledge of principles, practices and procedures associated with the design, development, and support of computer financial applications.
Use analyses and judgment to make decisions to solve complex problems.
Understand system data integrity and apply information security standards.
Identify and consider possible alternatives before making decisions.
Find effective solutions while considering short-term and long-term impact.
Work independently and as part of a team.
Follow policies, procedures, and industry standards.
Build constructive and effective relationships with internal and external customers.
Understand personal authority and when to escalate issues.
Generate ideas and fresh perspectives and engage in open-minded thinking.
Adapt to changing conditions and work responsibilities.
Display optimism about assigned work, share expertise, and respond positively to challenges.
Provides leadership and/or mentors in areas of knowledge that will help others.
Effectively communicate both verbally and in writing and to both technical and non-technical people.

Education and Experience:

A Bachelor’s degree in a business, computer science or related field and two years applicable experience. OR
An Associate’s degree in business, computer science or related field and four years applicable experience. AND
Familiarity with SABHRS Financials or IBARS would be a plus, or prior in-depth experience in an Enterprise Resource Planning or Accounting/Budgeting system. OR
Alternate combinations of education and experience will be considered on a case-by-case basis.

Does this sound like you?
Please tell us how and why by submitting your resume, cover letter, and three professional business references. In your cover letter please tell us why you want to be a part of our team. (Please Note: You do not need to complete the “work experience” or the “education & certifications” portion of the application process in our recruiting system. You only need to upload the requested documentation.)

What can you expect from us in return for your work with our agency?

Ø Look here to see the additional benefits! They include:

o Work/life Balance

o Health Coverage

o Retirement plans

o Paid Vacation and Sick Leave and Holidays

o And more…

Ø Public Service Loan Forgiveness (PSLF) – Employment with the State of Montana may qualify you to receive student loan forgiveness under the PSLF. Look here to learn more and see if you may qualify!

Other important information to be aware of.

This position requires the successful completion of a criminal background check.
Only online applications are accepted. By applying online, you are able to receive updates and monitor the status of your application.


Applicant Pool Statement: If another department vacancy occurs in this job title within six months, the same applicant pool may be used for the selection.
Training Assignment: This agency may use a training assignment. Employees in training assignments may be paid below the base pay established by the agency pay rules. Conditions of the training assignment will be stated in writing at the time of hire.


Salary: $ 68,000.00 - 75,000.00 Yearly
Telework Eligibility: Telework Eligible (Full-time telework is not available. Telework schedule must be supervisor approved.)
Benefits Package Eligibility: Health Insurance, Paid Leave & Holidays, Retirement Plan


Number of Openings: 1
Employee Status: Regular
Schedule: Full-Time
Shift: Day Job
Travel: No


Primary Location: Helena


Agency: Department of Administration
Union: 000 - None


Posting Date: Nov 7, 2023, 12:19:58 PM
Closing Date (based on your computer's timezone): Ongoing
Required Application Materials: Cover Letter, Resume


Contact Name: Natasha Cook | Contact Email: nacook@mt.gov | Contact Phone: 406-444-3103",-1,Health Care Services & Hospitals,Unknown / Non-Applicable,Healthcare,51 to 200 Employees,Hospital,False
Senior Business Intelligence Analyst,"Pearson
","Helena, MT",$72K - $104K (Glassdoor est.),3.7,"Senior Business Intelligence Analyst

Context

The shift within Higher Education more from one-time purchases of print textbooks to recurring subscriptions of digital products has generated a wealth of data about our products, customers, opportunities, and sales.

We’re looking for a leader who can take this information and leverage the latest data analytics tools, especially Tableau, to provide insight into the performance of business.

Reporting to the Director of Business Intelligence and sitting within the Strategic Sales Operations wing of US Higher Ed Sales Operations, the Sr Business Intelligence Analyst leads the analyses of the sales pipeline, net sales, subscriptions, and market data across multiple formats, models, and channels.

Responsibilities

Forecasting Mastery: Take the helm in owning all aspects of forecasting seasonal revenue, turning data into a strategic asset for our team.
Collaborative Insight: Work closely with cross-functional teams, including sales, marketing, finance, and product, to deliver accessible and consumable insights into the success of our higher education products.
Dashboard Stewardship: Support the lifecycle of our Tableau dashboards, ensuring they remain up to date with the latest features and capabilities while streamlining and retiring those that are no longer necessary.
Analytical Evolution : Drive the evolution of our analytics capabilities from self-service to predictive and early alert insights into product, sales, and market trends.
Data Integrity Guardian : Manage functional areas of data management, forecasting, contacts, leads, opportunities, dashboards, and reports, ensuring data integrity across our systems.
Strategic Partner: Assist in turning sales data into actionable insights that inform our go=to-market strategy, emphasizing focus areas, maximizing revenue, and preventing revenue leakage.

Essential Skills:

Holistic Business Understanding: Detailed comprehension of the sales business process and the ability to translate business needs into technical specifications.
Communication Prowess: Excellent interpersonal and communication skills, with the ability to articulate complex topics and present them thoughtfully to senior leaders.
Tech Savvy: Comfort with navigating the complexity of data across legacy and third-party platforms, ensuring forward momentum while simplifying and standardizing.
Organizational Agility : Strong time-management and organizational skills to balance multiple competing priorities.
Data Expertise: Background with ETL logic, data modeling concepts, and 5+ years of experience in a technical data role.

Requirements

Bachelor’s degree in business, finance, or computer-related program
5+ years of experience in a technical data role, such as analyst, engineer, architect, or scientist 5
5+ years of experience with multiple versions of SQL
5+ years of experience building and maintaining Tableau dashboards

Preferred Skills

Proficiency with Salesforce Sales Cloud (Marketing & Services Clouds a plus)
Proficiency with cloud databases such as Google BigQuery or Snowflake
Experience with machine learning concepts such as predictive modeling, categorization, and clustering
Background with programming in a language such as R or Python
Experience working in or supporting Sales or Revenue Operations a plus

\#LI-RS1

What to expect from Pearson

Did you know Pearson is one of the 10 most innovative education companies of 2022?

At Pearson, we add life to a lifetime of learning so everyone can realize the life they imagine. We do this by creating vibrant and enriching learning experiences designed for real-life impact. We are on a journey to be 100 percent digital to meet the changing needs of the global population by developing a new strategy with ambitious targets. To deliver on our strategic vision, we have five business divisions that are the foundation for the long-term growth of the company: Assessment & Qualifications, Virtual Learning, English Language Learning, Workforce Skills and Higher Education. Alongside these, we have our corporate divisions: Digital & Technology, Finance, Global Corporate Marketing & Communications, Human Resources, Legal, Strategy and Direct to Consumer. Learn more at We are Pearson.

We value the power of an inclusive culture and also a strong sense of belonging. We promote a culture where differences are embraced, opportunities are accessible, consideration and respect are the norm and all individuals are supported in reaching their full potential. Through our talent, we believe that diversity, equity and inclusion make us a more innovative and vibrant place to work. People are at the center, and we are committed to building a workplace where talent can learn, grow and thrive.

Pearson is an Affirmative Action and Equal Opportunity Employer and a member of E-Verify. We want a team that represents a variety of backgrounds, perspectives and skills. The more inclusive we are, the better our work will be. All employment decisions are based on qualifications, merit and business need. All qualified applicants will receive consideration for employment without regard to race, ethnicity, color, religion, sex, sexual orientation, gender identity, gender expression, age, national origin, protected veteran status, disability status or any other group protected by law. We strive for a workforce that reflects the diversity of our communities.

To learn more about Pearson’s commitment to a diverse and inclusive workforce, navigate to: Diversity, Equity & Inclusion at Pearson.

If you are an individual with a disability and are unable or limited in your ability to use or access our career site as a result of your disability, you may request reasonable accommodations by emailing ppsmhr@pearson.com.

Note that the information you provide will stay confidential and will be stored securely. It will not be seen by those involved in making decisions as part of the recruitment process.

Job: GENERAL BUSINESS OPERATIONS

Organization: Higher Education

Schedule: FULL\_TIME

Req ID: 13765

\#location",1844,Publishing,$5 to $10 billion (USD),Media & Communication,10000+ Employees,Company - Public,False
GPS Operations Transformation - Healthcare Quality Analyst,"Deloitte
","Helena, MT",$69K - $101K (Glassdoor est.),4.0,"Are you looking to make an immediate impact where you can help our clients solve their business challenges? Deloitte's Core Business Operations (CBO) portfolio operates at the center of our client's business. By joining our team, you could help C-suite and program leaders transform their organization and accelerate mission execution through emerging and disruptive technologies, innovative business models, retooled program operations and industry-driven solutions.

Work you'll do

Conduct reviews of medical exam documentation in accordance with established medical and legal requirements

Interact with healthcare professionals to provide report-specific feedback and assist in resolving discrepancies
Follow all processes and procedures related to program operations and safeguarding of personally identifiable information / personal health information
Consistently meet individual productivity and quality goals

The team

Deloitte's Government and Public Services (GPS) practice - our people, ideas, technology and outcomes-is designed for impact. Serving federal, state, & local government clients as well as public higher education institutions, our team of over 15,000+ professionals brings fresh perspective to help clients anticipate disruption, reimagine the possible, and fulfill their mission promise.

Our Operations Transformation offering transforms our clients' core business operations. We advise, design, implement, and deploy solutions that are focused on ""heart of the business"" issues across client organizations. Using deep sector knowledge and program management skills, we work alongside our clients to implement industry leading practices and manage their most important projects.

Qualifications

Required:

Bachelor's degree required
Must be legally authorized to work in the United States without the need for employer sponsorship, now or at any time in the future
Must be able to obtain and maintain the required clearance for this role
Ability to travel 25% or more based on the work you do and the clients and industries/sectors you serve

Preferred:

Health Care Quality Assurance
Experience conducting reviews of medical exam documentation in accordance with established medical and legal requirements
Medical Terminology
Medical Benefit experience",1850,Accounting & Tax,$10+ billion (USD),Financial Services,10000+ Employees,Company - Private,False
"Sr Business Analyst - Helena, MT",HCSC,"Helena, MT",$60K - $87K (Glassdoor est.),-1.0,"At HCSC, we consider our employees the cornerstone of our business and the foundation to our success. We enable employees to craft their career with curated development plans that set their learning path to a rewarding and fulfilling career.

Come join us and be part of a purpose driven company who is invested in your future!

Job Summary

This position is responsible for leading the development of functional and non-functional business requirements; working with the Business Solutions Lead to understand business strategy and translate into product requirement.

NOTE: This hybrid role is located in HELENA, MT ~ relocation will not be offered; sponsorship is not available .

Required Job Qualifications:

Bachelor’s degree and 4 years Information Technology, business analysis specific experience OR Technical Certification and/or College Courses and 6 year Information Technology, business analysis specific experience OR 8 years Information Technology, business analysis specific experience.
1 year experience leading project.
Knowledge of system architecture and application portfolio.
Knowledge of requirements management and/or prototyping (ALM, Jira, RallyDev, Balsamiq, iRise).
Ability to simplify & standardize complex concepts and/or processes.
Business acumen.
Project management skills.
Requirements definition and management.
SDLC, Iterative, Agile, OWF, and /or Scrum development.
Problem solving and/or analytical thinking.
Possess ability to manage workload, and manage multiple priorities, as applicable.
Written and verbal communications

Preferred Job Qualifications:

Bachelor’s degree in computer science, Business Administration, or Information Technology.
Business process management and modeling.
*BA Certification**Experience working in healthcare industry

Are you being referred to one of our roles? If so, ask your connection at HCSC about our Employee Referral process!

HCSC Employment Statement:

HCSC is committed to diversity in the workplace and to providing equal opportunity and affirmative action to employees and applicants. We are an Equal Opportunity Employment / Affirmative Action employer dedicated to workforce diversity and a drug-free and smoke-free workplace. Drug screening and background investigation are required, as allowed by law. All qualified applicants will receive consideration for employment without regard to race, color, religion, sex, sexual orientation, gender identity, national origin, disability, or protected veteran status.",-1,Shipping & Trucking,Unknown / Non-Applicable,Transportation & Logistics,Unknown,Company - Private,False
